id	qid1	qid2	question1	question2	is_duplicate
240699	70187	129948	I have forgotten my Facebook password and email password also?	I forget my Facebook account password and I also can't access to the email address provided, can I reset my password?	1
240700	352573	352574	Is there a recommended Solar Energy provider and Panel Installation company in Higley AZ?	Is there a recommended Solar Energy provider and Panel Installation company in Cornville AZ?	0
240701	89973	16730	What was the most embarrassing moment in front of your crush’s parents?	What was the most embarrassing moment in front of your parents?	0
240702	121509	44318	How can I effectvely loss 20 kgs of excess weight from my body?	How do I lose fats and excessive weight from body?	1
240703	352575	352576	Acronyms: What is the full form of ISIS?	What is the full form of ISI?	0
240704	352577	352578	What does no backlog mean in engineering?	What does Backlogs means as per JNTUH?	0
240705	94479	46839	What are similar sites like Quora?	Are there any websites that has similar functions as Quora?	1
240706	352579	312849	For whom do you live?	What do you live for?	0
240707	352580	352581	If a new technology around mobile app development such as augmented reality became available, where could I hear/read about it first?	What is it like to work at Cricbuzz?	0
240708	230485	352582	What would happen if I filed a stolen property report and the person moved out of state?	What would happen, legally speaking, if Mexico overthrew its government and requested to be a part of the United States?	0
240709	352583	138091	How tapinfluence make money?	Can money really buy happiness? If yes, then how and if not, then what can bring happiness?	0
240710	6029	37114	Is there a way to prevent hair Loss?	What can we do to minimize our hair loss?	1
240711	352584	352585	Which quote did motivate you most in your life?	What quotes most motivate you in life?	1
240712	352586	352587	What are the essential skills for a mechnical engineer?	What are the essential skills for a electronic engineer?	0
240713	352588	352589	I plan to do research on the Baha’i religion. What are some ideas and how should I go along with it?	How do I plan market research?	0
240714	352590	241499	[SPOILER] What did Gregor Clegane do to Septa Unella in the episode Winds of Winter (S06E10)?	"What are your predictions for season 6, episode 8 of Game of Thrones [""No One""]?"	0
240715	352591	352592	What happens to the dollar bills if you accidentally leave them in your clothes as your clothes end up going into the washing machine?	What is that washing machine they use in The Big Bang Theory? They seem to just put the clothes & detergent in; press a button & then leave & recollect them later with clothes completely dry? Is it available in India?	0
240716	352593	352594	How many manufacturing companies are in Australia?	I have many ideas for phone manufacturing but I have no resources? How can I turn into a phone manufacturer or even contact companies to help me?	0
240717	352595	60690	What is the difference between wireless repeater and wireless bridge?	How do I configure a TP Link TL-WR740N V5 router to a wireless repeater?	0
240718	352596	239298	How do I increase viscosity of liquid resin?	How do I increase the viscosity of liquid resin?	1
240719	352597	352598	How can I score a 100% in mathematics?	How can I score 100 in mathematics and English?	0
240720	352599	352600	How do I manage to tidy up my dad's place and make it more livable when I am so depressed?	What are the differences between fluency, eloquence, and articulateness?	0
240721	352601	352602	What does it means by food commodities?	What is the meaning of commodity?	0
240722	115422	18324	How can I hack my Instagram?	How can I recover a hacked Instagram?	1
240723	352603	18639	If I request to follow a private Instagram what happens when they go off private?	I have a private account on Instagram. If I request to follow someone, do they see my profile?	0
240724	79487	51663	"Why is every single question I ask on Quora suddenly being tagged as ""needing improvement""?"	"What should I do if Quora marks my question as ""Needs Improvement""?"	1
240725	352604	352605	How can I overcome my bad dreams?	What should I do to avoid bad dreams?	1
240726	352606	352607	What is a legally binding contract?	What are the essential elements that form a legally binding contract?	0
240727	16167	57300	What is the best laptop to buy under 25000INR?	What will be best laptop Under 25000 INR ?	1
240728	352608	233214	Are cellphones cheaper in Bangkok compared to Mumbai?	I am travelling to Thailand from India. Which Currency should I carry with me. US Dollars or Thai Baht or Indian Rupee?	0
240729	61840	323078	What time do most direct deposits hit your bank account?	How do I block my bank account from any deposits?	0
240730	185129	352609	You can have one superpower – and only one. What is it, and why did you pick it?	If you had to pick one rule to live by, what would it be and why?	0
240731	14806	19891	Why MS Dhoni left captaincy though he was a successful captain?	Why MS Dhoni left captaincy of limited overs?	1
240732	87026	51443	What is cazpro.com?	What is RedGage.com?	0
240733	27772	352610	What are good gifts for a foreign visitor to bring when they're invited to someone's home in Iraq for the first time?	What are good gifts for a foreign visitor to bring when they're invited to someone's home in Bahrain for the first time?	0
240734	352611	352612	Which television campany received the most Emmy Awards?	Considering Peter pettigrew (wormtail) , Sirius black (padfoot), is James Potter an animagus (prongs)?	0
240735	352613	332225	How are international air tickets priced?	What is the best way to avoid tourist-traps while travelling?	0
240736	77064	352614	Which one should I buy, a GoPro or DSLR camera?	Which DSLR camera should I buy as a beginner, Canon 700D, 600D Or Nikon D3300?	0
240737	352615	352616	Which is best problem books, Which contain brainteasers for JEE advanced?	Is memory a shareable resource?	0
240738	31851	352617	How do you tweet embedded YouTube videos with autoplay on Twitter?	How can you use Twitter to promote a YouTube video when you have no Twitter followers?	0
240739	352618	17050	What is the best closing lines of TV/film?	What is the best closing line of a movie or TV series?	1
240740	236946	352619	How will Trump make America great again?	How would Bernie Sanders make America great again?	0
240741	104126	352620	What are some ideas for a business start-up?	What are some ideas to start a business?	1
240742	352621	352622	Is reservation good in competitive exams?	Is there is really a need for reservation in competitive examinations?	1
240743	352623	352624	Will there always be web hosting that will support php?	Will there always be web host providers that support php?	1
240744	352625	352626	Where can I learn to trade Forex and how much money can I realistically make?	How much money can I expect to make from stock trading if I invest $20000 /year and be in the 75th percentile range in knowledge about the field?	0
240745	352627	352628	What is a koala?	What do koalas look like?	0
240746	352629	352630	What frustrates you most about your job? Why?	What are some things that you love about your job?	0
240747	352631	352632	How difficult is Pomona College?	What did Laszlo Bock major in at Pomona College?	0
240748	249699	99009	What is your longest journey?	What is the longest journey which you took in your life?	1
240749	352633	352634	What are opcode and operands in microprocessor?	What are opcodes and operands in a microprocessor?	1
240750	352635	8827	Can women have oral sex?	Do all women like oral sex?	0
240751	352636	352637	What's it like to work at Spectranetics for your first job?	Why am I feeling underrated and at the same time, seeing people with bad works getting recognized, that I can do better?	0
240752	5160	352638	I told a girl that's in a relationship that I liked her and she says she never know what's going to happen to her relationship. What does that mean?	I said to a girl that has a boyfriend that I liked her and she says she never know what's going to happen to her relationship. What does that mean?	1
240753	281943	352639	How do I bring 1988 back by decorating a more grown up bedroom theme?	How would I bring 1988 back by decorating my room as a more grown up theme?	1
240754	352640	352641	Can drama queens change?	What are drama queens?	0
240755	352642	352643	What is the difference between a queen, double bed and full bed?	Which bed is better in a bunk bed?	0
240756	61700	244675	"How do I use ""would"", ""could"", ""should"", ""would have"", ""could have"", ""should have"", ""would have been"", ""could have been"", and ""should have been"" in a proper way?"	"When should I use ""has been"",""have been"" and ""had been""?"	0
240757	352644	352645	How do you deal with a depressed girlfriend?	How do I deal with a depressed girlfriend?	1
240758	352646	352647	Which college should I try for to get a job in discovery channel? And which course should be opt for?	Which college should I try for, to get a job in discovery channel? And which course should be opt for?	1
240759	113315	106578	What is the best way to start learn hacking?	What is a good site to learn hacking?	1
240760	130160	121844	Why do guys stare at girls that they don't know?	Why do guys like to stare at girls?	1
240761	121583	33155	How will the Indian economy benefit if GST is introduced?	Is GST going to benefit the end user?	1
240762	251345	113614	How would you explain game theory?	What are some ways to understand game theory?	1
240763	203672	352648	Do girls like nerdy-looking boys?	Do girls like nerds?	1
240764	352649	352650	What are the qualities to become an engineer?	What are the qualities of an engineer?	0
240765	352651	352652	What is a consecutive calendar day and how is it related with the Berber calendar?	What is a consecutive calendar day and how is it related with the Nanakshahi calendar?	0
240766	74482	71931	When will Spotify launch it's services in INDIA?	Spotify: When will Spotify be available in India? What are the reasons for this unavailability?	1
240767	58299	150083	How do I get into Stanford with a poor GPA? E	How can I get to Stanford with a poor GPA?	1
240768	352653	352654	My girlfriend lies to me all the time. What should I do?	Should I forgive my girlfriend if she lied to me?	0
240769	125084	352655	What happened to dirpy.com?	What happened to shoefitr.com?	0
240770	229100	275208	How can girls get rid of lice and nits?	How do I get rid of lice from head?	1
240771	2502	7681	What are the places to visit for a honeymoon in Kerala?	What are the best places to visit on a 3 day trip in and around kerala?	1
240772	352656	352657	How can I improve my resoning ability or rational thinking to make decisions in real life situations?	I recently realized that make my decisions based on my emotions at that moment. I also think based on my emotions. How can I overcome this tendency in order to think and decide more rationally?	0
240773	214867	33467	What are the best resources online to self-study German?	What's the best site to learn German?	1
240774	111181	62432	How one can lose weight without going to the gym?	What are the best ways to lose weight?	0
240775	72940	50440	Which is better as a career: physiotherapy or pharmacy?	Which field is better, veterinary or pharmacy?	0
240776	140830	31058	What are the symptoms of anxiety?	How can you tell if you have anxiety?	1
240777	352658	352659	How can you play Cards Against Humanity with two players?	Which is the most popular two player card game best played in person?	0
240778	14202	352660	What is algorithms?	What is iterative algorithm?	0
240779	352661	352662	What are some examples of nature?	"What are some examples of ""less is more""  in nature?"	0
240780	352663	352664	Why is no one writing Harambe and Shrek fan-fiction yet?	If you could write a fan fiction of Breaking Bad, what would you write?	0
240781	1062	1214	How imminent is world war III?	Can World War 3 ever take place?	1
240782	352665	216251	What is the sum of all 4 digit numbers that can be formed by the digits 2, 3, 4,5 with repeatation?	What is the sum of all 4 digit numbers that can be formed by the digits 0, 1, 2, 3, 4? No repetitions allowed.	0
240783	352666	352667	The following sequence is given below 1,3,3,3,5,5,5,5,5,7,7,7,7,7,7,7… whatis the 111^th term of this sequence?	Does Sun look slightly larger from ISS?	0
240784	352668	352669	Do employees at Mallinckrodt have a good work-life balance? Does this differ across positions and departments?	How can I selfstudy for KVpy SX?	0
240785	352670	352671	How does a programmer customize his laptop?	How frequently does the customer change his method of payment at a given store?	0
240786	184255	35475	Where are the offices of Uber and Ola Cab services in Mumbai?	How do I attach my car with Ola cabs and how much I can expect from it?	0
240787	352672	352673	I am confused between Radha and Rukmini. Who is the incarnation of the goddess Lakshmi?	Hinduism: What are all the incarnations of the goddess Devi?	0
240788	352674	352675	Can a F1 visa holder get a government job in US after graduation?	Can I get a US F1 visa if I am unemployed?	0
240789	13301	54721	Is green tea a fat burner? Does it help with weight loss? how much should I drink? which time to drink ?	What is the correct time to take green tea for weight loss?	1
240790	352676	352677	Is there any happiness except for family, love and career? If yes, how do I achieve that?	What should a single guy do for the healthy meals?	0
240791	352678	352679	Which kind of technology I can add in students coaching classes?	OS X : how can I re-enable the built-in trackpad using keyboard shortcuts only?	0
240792	287796	352680	How do I not give up on at all?	How do you give up on somebody?	0
240793	282010	261733	What are some of the best ways to study or prepare for the GMAT?	How I prepare for GMAT?	1
240794	352681	352682	Without any knowledge how can I make a website?	How can I make a website without any knowledge?	1
240795	352683	106486	How can I earn with my blog? How to increase traffic to my blog?	How do I increase traffic of my blog?	1
240796	352684	5448	What can be the possible hobbies for interviews?	What are various hobbies that can be mentioned in an SSB interview?	0
240797	352685	352686	How is the formula for copper II sulfate hydrate determined?	What is the formula for copper II sulfate?	0
240798	352687	352688	How can a string be checked for the presence of special characters like '.' and '@' in Java?	How can I write a program in Java to get the last character of string in a string array & check whether the new string formed is palindrome or not?	0
240799	28314	278716	Have you ever seen UFO?	Has anyone living in Kongka La Ladakh and using Quora seen a UFO?	1
240800	74599	224085	Are there any other websites like Quora?	Are there any alternative question and answer websites to Quora?	1
240801	352689	352690	"Who are the 7 warlords in ""One Piece"" and how were their characters designed for the anime series?"	"Why do Shanks and Whitebeard fight each other in the TV series ""One Piece""?"	0
240802	352691	352692	Do you know people who themselves successfully immigrated to the US or Canada but are sympathetic to anti-immigration sentiment?	People: What do you think of a Finnish immigrant of Japanese descent who wants to speak French in the US?	0
240803	352693	352694	How did you come up with your pet projects?	Programmers: How do you come up with side projects to work on?	1
240804	352695	157588	Is orgasm and cumming and/squirting the same thing?	How do I make a woman squirt?	0
240805	352696	352697	How write best essay in UPSC?	How can I write the best essay?	0
240806	38014	40575	Are there symptoms of sleep deprivation?	What are symptoms of sleep deprivation?	1
240807	352698	352699	How do I make a fuel cell without platinum?	Can I create a Hydrogen fuel cell without Platinum catalyst?	1
240808	642	13880	How will Indian GDP be affected from banning 500 and 1000 rupees notes?	What will be the impact of banning Rs. 500, Rs. 1000 notes on Indian economy and Businesses?	1
240809	82890	44566	I used a fake email and phone number for Snapchat and I forgot my password how can I get it back?	How can I get my Snapchat account back if I forgot my original email and password?	1
240810	11917	155718	How does it feel to fall out of love?	How do yo fall out of love with someone?	1
240811	352700	352701	I am currently in class 11th (commerce) and I want to work in Google so how a commerce student can get into Google and what post I can get in google?	Why does Zeus constantly cheat on Hera?	0
240812	163466	352702	How is a magnetic field generated when a current flows through a conductor?	Is a magnetic field present when a current is not flowing through a conductor?	1
240813	352703	352704	Why are some blood types rare?	What are the most and least rare blood types?	0
240814	352705	352706	How does HTTPS encrypt URL parameters?	Does HTTPS encrypt the URL itself?	0
240815	352707	352708	Why are my hands and feet itching me so bad?	Why do my hands itch so bad?	0
240816	291726	352709	Have you ever done a photo shoot?	Fastrack watches feature for copywriting?	0
240817	352710	352711	What is your favorite movie to watch on Halloween night?	What is the best Halloween movie ever?	1
240818	230207	184556	How is the word 'cordial' used in a sentence?	How is the word 'candor' used in a sentence?	0
240819	352712	352713	Why do you regret moving to the Bay Area?	How should I prepare for a move from the SF Bay Area to Raleigh, NC?	0
240820	352714	352715	How is the state of smartphone business in India?	What is the state of smartphone business in India?	1
240821	66659	26248	When will humans become immortal?	Will we ever become immortal?	1
240822	352716	352717	How do I handle trust issues?	How do I deal with trusting issues?	1
240823	247458	352718	What do you think of the Bharat Bandh on 28th November against demonetization? Will you join it?	What do you think about opposition for Bharat Bandh on 28th November, 2016 on Demonetization?	1
240824	352719	352720	Is the Syrian American Medical Society a good charity?	Which one of the numbers does not belong in the following series? 2 - 3 - 6 - 7 - 8 - 14 - 15 – 3	0
240825	352721	352722	Businesses well established outside but not in India?	Why did the Philippines end its alliance with the U.S.?	0
240826	352723	352724	Why is everyone so intolerant when driving?	What will become of auto racing when everyone has an electric, self-driving car?	0
240827	9026	65246	What are some CV worthy online Digital Marketing courses?	Which is the best free digital marketing course?	1
240828	352725	352726	What makes some people more popular than others?	What characteristics make someone likeable or popular?	0
240829	352727	352728	Why the ecnomical and military reasons lead the British to expand in Hong Kong?	Why didn't Taiwan claim Hong Kong and Macau from the British and Portuguese respectively?	0
240830	352729	352730	How is the Samsung Galaxy S7 edge?	Does Samsung Galaxy S7 edge need a protective case?	0
240831	82828	352731	In Ozone 7, if you use the EQ's Matching feature and capture a reference audio frequency spectrum, can you save it and others en masse for future use?	Did Ozone 7 remove the multi-band gate feature?	0
240832	352732	171722	What are the best ways to build an Instagram following?	What are the best ways to get more followers on Instagram?	1
240833	352733	352734	Am Asian super skinny living in England, anyone know pills to die without pain? Pls help I can't hear disgusting skinny anymore.	I am a 20 yr old girl living in a hostel. I am very skinny and get tired easily. How can I improve my health and endurance?	0
240834	352735	352736	What is the best way to remove gel nail polish?	How can I remove nail polish from gel nails?	1
240835	146737	352737	Why China is threat to India?	Why is China a threat to India?	0
240836	352738	352739	What is the best laptop for college students?	What is the best laptop for a college student?	1
240837	352740	352741	What are the other technology in demand other than mobile wallet companies in cashless economy?	How to someone download Third Wave Advant Edge 7.3 software?	0
240838	352742	68794	Can an ugly looking guy become a handsome one?	How can ugly guys be happy?	0
240839	352743	352744	I find it hard to concentrate on my career. I am not good at anything in particular. I am always chasing people. How do I change?	I have an issue with sending snaps on Snapchat, please help?	0
240840	352745	352746	Why do Scientologists believe what they believe?	What do Scientologists believe?	0
240841	215091	114627	Which thing comes once in a year and twice in a month?	I appear once in a second, twice in a month, and 3 times in a year.what am I? Who can answer this first?	0
240842	352747	11625	How does a person get over being absent minded?	How do I reduce being absent minded?	1
240843	211070	352748	How comfortable is life for those who make $100,000 or more a year?	I make $1,000,000 a year. Will it be ok for me to comfortably buy a supercar?	0
240844	352749	352750	Why is genetic diversity important in agriculture?	Why is genetic diversity important in a population?	0
240845	352751	352752	How should I prepare for clearing SAP labs online test?	How should I prepare for SAP labs written test?	0
240846	336649	352753	How can you determine the formula for ferrous carbonate?	How is the formula for carbon oxygen determined?	0
240847	352754	206595	Why didn't Dumbledore hide the Potter family when Snape had asked him to do so?	Why didn't Dumbledore reveal the secret of horcruxes to Snape?	0
240848	352755	352756	What is the best CMS platform based on .Net framework?	What is a good CMS that runs on Zend Framework?	0
240849	31868	26053	Why do people ask questions on Quora while They can get all the answers by Googling?	Why do so many people ask things on Quora that they could just as easily Google?	1
240850	7391	4100	How do I stop caring about what people think about me?	How can I stop worrying about what other people think?	1
240851	352757	352758	What is the clear difference between stressed and unstressed syllable and how are they used?	What is the clear difference between stressed and unstressed syllable?	1
240852	352759	352760	Why does my cat rub her face on my feet?	Why does my cat like to attack my feet?	0
240853	58742	132172	Is it true that India is faking a surgical strike?	Did India really carry out surgical strikes?	1
240854	352761	35187	What are some good project ideas related to engine (IC engine) that can be completed within two months working full time on it?	What is a good project on data mining?	0
240855	163189	42512	How can I upload any picture on Google images?	How can I upload my photo on Google images?	1
240856	352762	352763	How can the motabilization of methamphetamine be speeded up in the body?	If we could travel at the speed of light and in time? How can we make sure that none of our body atoms get left behind?	0
240857	319805	352764	Where can I find market size data for music on hold devices?	What is the UK data storage market size?	0
240858	181201	52542	How do I reduce my belly fat when I don't get enough time to workout?	How can I reduce my belly and hips fat without doing exercise?	1
240859	352765	250937	What is the melting point of crustal rocks?	What is the melting point of rocks?	0
240860	352766	352767	Can we take casual leave during notice period in public sector bank? Will it extend my notice period?	What is notice period in HPE?	0
240861	352768	352769	Are any FIITJEE AIITS papers available on the web?	Which would be better VMC online test series or the FiitJEE Offline AIITS?	0
240862	1357	17506	Why are so many questions posted to Quora that are so easily answered by using Google?	Why are so many Quora questions about factual information that the questioner could easily look up?	1
240863	352770	352771	When I get angry or sad I get suicidal thoughts what's wrong with me?	What characteristics do neurons (nerve cells) have?	0
240864	352772	206018	What are the best tools to generate engaged users for your app?	"Is there such a web service like ""what should I read next""?"	0
240865	352773	83812	Do ghosts really exist?	Do ghosts or gods really exist?	0
240866	352774	352775	How is the Lewis structure for IF4 determined?	What is the Lewis structure for ketene? How is it determined?	0
240867	330901	352776	Does the Australia FM deny the legitimacy of the tribunal on Australia and East Timor?	Why is The Tribunal in League of Legends so inefficient?	0
240868	352777	352778	How should I prepare for SSC CGL 2016 without coaching and also want to learn tricks?	I want to prepare for ssc cgl 2016. Should I buy study kit from sscportal?	0
240869	96423	20129	What will happen now that Trump's president?	What will happen to America now that Trump is president?	1
240870	352779	352780	Any public transport available form India to Bhutan?	Are Russia and the US sponsoring more terrorist groups than we imagined?	0
240871	352781	352782	What are good ways to mentally grasp foreign mathematical concepts?	"Why is the concept ""live one day at a time"" so hard to grasp?"	0
240872	352783	188205	Is Donald Trump just like Andrew Jackson?	Is Donald Trump the modern Andrew Jackson?	1
240873	352784	303114	What torrent sites provide the best RSS feeds for torrents of specific TV shows?	What is the best torrent site for TV series and episodes?	0
240874	352785	352786	How can I change sentence this from passive voice to active voice (Catcher in the Rye)?	How do I change my passive voice to an active voice?	0
240875	352787	352788	How do I approach W.A.T in SSB?	I couldn't clear SSB in my first attempt. Should I go for it again?	0
240876	318013	352789	What exactly is online dating?	What exactly online dating is?	1
