id	qid1	qid2	question1	question2	is_duplicate
305353	428749	428750	How can I know am ready to love someone?	How do you know when you are ready to love?	0
305354	215333	276760	What is the process of distillation?	How can the process of distillation be described?	1
305355	428751	146928	What are some important softwares for civil engineers?	What are the softwares that a civil engineer must know?	1
305356	6438	8037	How can I make money online for job?	How do you make money online?	1
305357	428752	428753	How do I reinstall Windows from a full Linux laptop? I have a bootable USB.	How do I install Windows on a Linux laptop? I have a bootable USB.	1
305358	94309	2559	How do I lose weight fast in less than 3weeks?	What are the best ways to lose weight?	0
305359	162476	382572	How do I prepare for the CAT starting from the beginning? What are the tricks and methods?	How do I start CAT preparation from scratch?	1
305360	118113	177047	How often can I put coconut oil on my hair?	Should I apply coconut oil to my hair daily?	1
305361	285222	428754	Is there any possibility to get selected in international BPO with average communication skills?	I am an average looking guy with excellent acting skills, I want to be an actor But I don't have any contacts in the industry, Is there a possibility?	0
305362	428755	428756	How can I use my UE Boom 2 to amplify my voice (not using speakerphone)?	Why I feel calm when I go to mountains and spend time there?	0
305363	428757	428758	I am curious. What ethnicity are you, really?	"What are some key reasons why ""Buckwild"" is scripted?"	0
305364	124055	428759	Which is the best country to study a master’s in data science?	My company provides Accidental Death and Dismemberment (ADD) insurance. Is there a good reason to also carry Personal Accident insurance (PAI)?	0
305365	428760	428761	What is the fill form 60/61 of SBI in ''opening of accounts and ''issue of debit card'' amount of transaction ''?	Amazon: While transacting with my debit card for shopping on the Amazon site, it asked to enter my ATM PIN for SBI and not OTP. Is it normal and safe?	0
305366	428762	428763	What is the scope after doin Masters in environmental management from Australia?	How's the scope of masters in environmental planning and management?	0
305367	428764	428765	Why are Wohler watches coveted among collectors?	Greenspan endocrinology vs william textbook of endocrinology?	0
305368	428766	389269	What comes to mind when you hear the word ‘weekends’?	What comes to your mind when you hear the word gentleman?	0
305369	428767	428768	I want to apply for UFT certification (HP0-M102). Which study material I can refer to clear the exam?	I have few queries related to compTIA and also I want to clear the certification exam. How should I proceed?	0
305370	331955	221616	How can the size of breasts be reduced?	How I decrease the size of breasts?	1
305371	114117	141225	How can I get funding from a venture capital firm?	How can I get venture capital or private equity for companies.?	1
305372	428769	197612	What are the best ways to invest 10k?	What are the best ways to invest money?	0
305373	428770	428771	Which is the best place in Mumbai to get cricket coaching?	Which are the best places in Mumbai to get cricket coaching?	1
305374	428772	243623	What do you think of rich people?	What do rich people think about?	0
305375	149463	428773	What are some good Ted talks on technology?	What are some good TED talks on sex?	0
305376	327417	313895	What is the small thing that made you smile today?	What makes you smile today?	1
305377	428774	226550	Why is there so much promiscuity in the world?	Is there anything wrong with promiscuity?	0
305378	428775	428776	How can we minimise sleep?	How can I minimize sleep?	1
305379	428777	428778	What are some famous and important examples of modern day heroes in Mexico?	What are some famous and important examples of modern day heroes in China?	0
305380	275045	428779	How can I connect an iPhone 6 to a Samsung LED TV? Also how to do screen mirroring of iPhone to samsung smart tv ?	"How can I buy the new Macbook 12"" M7 512GB model in India?"	0
305381	428780	428781	What percentage of the population has a IQ between 90 and 95?	About what percentage of the population has an IQ between 115 and 120?	0
305382	428782	428783	How long will this take to heal?	How long does it take to heal a boxers fracture?	0
305383	428784	428785	Is there a difference between digital, online and Internet marketing?	What is the difference between digital media and digital marketing?	0
305384	39369	285664	Do Indian women find Pakistani men attractive?	Do Pakistani women find Indian men attractive?	0
305385	428786	428787	Can astrologers actually read the future?	Can astrology and astrologers accurately predict the future?	1
305386	197975	14183	Is it healthy to eat fish every day?	Is it healthy to eat a tomato every day?	1
305387	428788	276898	Where is the best Lg washing machine repair center in Hyderabad?	Where is the best LG Repair center in Hyderabad?	0
305388	354126	428789	What has been your biggest career mistake?	What has been your biggest career success and how did you achieve it?	0
305389	428790	428791	Did anyone have a bad experience after getting engaged/ married to someone they found though a matrimonial website?	Is getting married at 20 a bad idea?	0
305390	428792	428793	Are  there any startups in Chennai providing internship for students?	Are there any startup in Chennai providing internship and training to students?	1
305391	197365	428794	What advice would you give to your 18-year-old self?	What is some advice you could give an 18-year-old?	1
305392	428795	428796	Why we approximate the population standard deviation to the sample standard deviation?	What is the difference between sample standard deviation and population standard deviation?	0
305393	7324	60739	What is the best way to reduce belly and arm fat?	What are the best cardio exercises for skinny people that have lower belly fat?	1
305394	428797	428798	Which airline is better, Etihad, Emirates or Qatar for Economy class travel to USA ?	How can one modify flight bookings made on a particular Airline Website (eg Etihad or Emirates or Qatar) using a general travel website? Is it allowed?	0
305395	428799	428800	Who will be the next Steve Jobs?	Who will be the next generation of business leaders after Steve Jobs, Bill Gates, Larry Ellison and others?	0
305396	428801	428802	How many countries have a national flag with an eagle?	Is it time for national flags to get abolished?	0
305397	371224	398872	What are some good books to learn about World War 2?	Which are the best books available to know about world war 1&2?	0
305398	428803	428804	Why do so many Democrats cling to the fiction that Russia and Vladimir Putin had ANYTHING to do with Hillary Clinton's loss?	How advanced are north korea's nuclear weapons?	0
305399	428805	428806	Is this a start of me getting bald?	Is this start of me of getting bald?	0
305400	286017	219649	Is Turkey a safe place to visit considering the recent events?	Is Turkey safe given the recent bombings and protests?	1
305401	308157	428807	What should I reply when I ask a girl for her phone number and she ask why?	Does it mean anything if you ask a girl for her number and she asks for your phone so she can put in the number herself?	0
305402	11281	428808	Is it okay to book a ticket with a different station as the departure point and board the train from a different one?	Can I board the train from Mumbai central if reservation is from Mumbai central but boarding point is borivali?	0
305403	163693	295202	Which is the best beach for a couple to stay for a week in Goa?	Which is the best beach resorts for romantic views in Goa?	1
305404	24272	18052	What would be the possible impact on Indian economy after cancellation of 500 and 1000 Rs notes?	How can the ban of 500 and 1000 rupee notes increase the Indian economy?	1
305405	428809	62064	What are the best blogging sites?	How do I start a blog and what are the best blogging platforms available?	0
305406	114739	98237	What career choice do I have after completing a B.Tech in mechanical engineering if I am interested in space research?	What opportunities exist after completing a B.Tech in mechanical engineering?	1
305407	150202	26803	What do you think of the the movie Fantastic Beasts and Where to Find Them? How did it appeal to you?	What do you think about Fantastic Beasts?	1
305408	96132	36191	What makes you decide to follow someone on Quora?	What factors decide who you follow on Quora?	1
305409	428810	428613	How is the potential energy of a battery measured?	How is potential energy measured?	0
305410	428811	428812	how to fix metal gear solid V the phantom pain Not starting up?	Should I buy metal gear solid v the Phantom pain or wait until the bugs are fixed?	0
305411	428813	428814	Which are some of the best smartphone action games under 50 MB?	What are some cool multiplayer pc games with size less than 50 MB?	0
305412	2816	9697	What are the best top 10 movies of Hollywood ever?	What are best Hollywood movies?	1
305413	428815	428816	Is Ubuntu Studio good for pro Audio? Does it have all the features of regular Ubuntu?	Is Ubuntu Studio viable for pro audio? Does it have all the features of regular Ubuntu?	1
305414	428817	100882	How do you implement dynamic objects in c++?	How memory is allocated to 1D and 2D array in C?	0
305415	428818	428819	What can you do with an MPA and an MPP?	Should I get an MPP or an MPA?	0
305416	428820	211833	What should I do to become a doctor?	How can I become a doctor?	1
305417	428821	428822	What is the purpose of doing a PhD?	Do most American PhD students get their PhD before 30?	0
305418	110148	293502	What are current Quora demographics (by country)?	What are the demographics of Quora users and the main personas?	1
305419	178711	428823	Why when I urinate does my urine sometimes come out in two directions simultaneously?	Is protein in urine bad?	0
305420	428824	428825	What are some nicknames for Australia? What is the history of those nicknames?	What are some nicknames for Madeline?	0
305421	10694	23231	Why is Saltwater Taffy candy imported in Portugal?	Why is saltwater Taffy candy imported in Canada?	1
305422	25789	316481	What are some cultural faux pas of asking cultural faux pas questions?	What are some cultural faux pas at LinkedIn?	0
305423	84839	135328	How do I convince my wife to take bath everyday?	How do I convince my wife to take a bath everyday no matter its winter or summer?	1
305424	428826	428827	Does dental implant surgery hurt?	Does getting a dental implant hurt?	1
305425	428828	428829	Do Golang have a future?	Is golang the future?	0
305426	164006	390952	What is a harmonic minor scale?	How many scales are there in music?	0
305427	151373	342917	How do I learn the art of asking questions?	How can I learn to ask good questions?	1
305428	428830	276830	What are the best birthday surprises?	What is the best birthday gift?	0
305429	209654	72545	Will the World end?	When will be the end of the world and why?	1
305430	428831	203696	What are the top 5 MBTI types that are most reserved and introverted in social situations?	What are traits in introverts that are negatively understood?	0
305431	428832	428833	I MARRIED AT THE AGE OF 14, WITH A UNEDUCATED LADY BY FAMILY, SINCE THEN I WAS OUT FOR STUDY, NOW I BACK AND EVERY ONE IRRITATE ME, WHAT SHOULD I DO?	How java can make me rich?	0
305432	288913	428834	If someone unfriends me on Snapchat, can I still see their snaps?	If someone unfriends me on Snapchat can they still see my story?	1
305433	3595	99661	How do i lose weight?	How do I reduce my weight?	1
305434	30684	273264	How do you overcome fear?	How can I overcome fears?	1
305435	236073	428835	Which is the best architecture college in nagpur?	Which is the best architecture college in pune?	0
305436	428836	428837	Why don't they let women drink water during labor and ask them to chew on ice chips instead?	Can I drink wine instead of water to stay alive?	0
305437	48012	307636	What are the differences between SEAL Team Six and Delta Force?	What are the differences between Marines and SEALs?	0
305438	297541	155744	How can I remove dark circles under eye?	How do I remove dark circles below eyes naturally?	1
305439	428838	428839	How much does it cost to design a logo in india?	How much does it cost to design a logo?	0
305440	428840	350569	What types of foods do Americans eat which the rest of the world finds disgusting?	What types of food do Americans eat that people from other parts of the world find disgusting?	1
305441	248395	119840	What is the point of living when were all going to die?	What is the point of living if we are going to die and not remember anything?	1
305442	428841	428842	After studying in iiser can we do mba?	I am 17 years old and I want to invest in stocks how do I start? I have around 18000 rupees?	0
305443	322177	428843	How do I improve my accent?	How can I reduce my accent?	0
305444	30083	188671	What is unusual or different about the food and cuisine in Canada?	What is unusual or different about the food and cuisine in Kazakhstan?	0
305445	428844	428845	What was greek fire?	How did Greek Fire work?	0
305446	428846	428847	Which sunglasses are suitable for driving (car), polarized or non polarized sunglasses?	You have a pair of unpolarized sunglasses, a pair of polarized 3D viewing glasses and a large supply of flat mirrors. Can you tell the two glasses apart?	0
305447	428848	78654	How can someone become a polymath?	How does one become a polymath?	1
305448	428849	428850	How do you get started as a beginner public speaker?	What should I do to be a public speaker?	1
305449	428851	428852	Is intelligence is a blessing or a curse?	What is cursed life? In reality	0
305450	428853	428854	My plant’s leaves are turning yellow. What should I do about it?	Will plants feel pain when leaves are cut?	0
305451	12501	80530	What are some things Indians should be proud of?	What are some things every Indian should know and feel proud about?	1
305452	116459	363789	What are the effective ways to increase the willpower?	What is the best way to increase your willpower?	1
305453	30274	4121	Why is Saltwater Taffy candy imported in Poland?	Why is Saltwater taffy candy imported in Japan?	1
305454	143875	24468	"Would Modi ""dare"" to abolish the reservation?"	Will Modi remove Quota Reservation?	1
305455	328976	428855	Has Ancient Israel been scientifically tested?	What is the Impact of robotics and cognitive intelligence on human resources and shared services?	0
305456	428856	428857	How did the Iranians lose to the Iraqis in their 80s war yet they look far superior today militarily?	Why are some people so gullible in believing what they are told?	0
305457	15217	428858	Internet Service Providers: Is Hathway good for broadband connection?	Is Hathaway's broadband connection good in Delhi?	0
305458	428859	428860	Why has there been a major uptick in absurd questions on Quora with extremely poor grammar and spelling?	Why do so many Quora questions have poor spelling and grammar?	1
305459	192739	428861	Does biking help build leg muscles?	Does long-distance running build leg muscle mass? How?	0
305460	181252	428862	If I want to change my name what should I do?	I want to change my name, how do I do it?	1
305461	428863	428864	How should I feed my turtle?	How can I filter my Quora feed properly?	0
305462	97235	11705	Which is the best coaching centre in Hyderabad for IAS coaching?	What are the best IAS coaching centres in Hyderabad?	1
305463	426398	428865	What is the difference between network television and cable television?	What is difference between 2x1c and 2c cable?	0
305464	428866	326478	Does science support the idea that gay people can't change their sexual orientation?	Can sexual orientation be changed?	0
305465	428867	428868	How do horses not freeze during the winter in sub-freezing climates?	How do I bring a stray cat into my home if he's too afraid of me? Now that it’s winter, I don’t want him to freeze	0
305466	428869	428870	How can I improve small talk as I am absolutely useless at it?	I'm really bad at small talk. How can I improve my small talk skills?	1
305467	428871	428872	If I want to live my life again what all should I do?	How do I want to live my life again?	0
305468	170180	428873	Do reliance Jio Mifi device support other sim cards like airtel, vodafone?	Does JioFi 2 device support only Jio SIM or any network can be used in it?	1
305469	428874	428875	Is Muslim-Hating conspiracy theorist Frank Gaffney advising Trump’s Transition Team?	How much money do doctors make in Portugal?	0
305470	53296	57405	How can I increase my height I am 5'2 and 13 years old?	How do I increase height at age of 16?	1
305471	428876	428877	Are the Income Tax Inspectors under Ssc Cgl transferred often and out of state?	Is boxing tougher then krav maga?	0
305472	428878	428879	What advancement will there be for black box in the near future?	Were r u from?	0
305473	428880	428881	Which is the best sector in Noida to buy residential property?	Where are the best residential apartments in noida when budget is not a constraint, please name a few of them?	0
305474	428882	428883	When do people use Quora?	Do people still use Quora?	0
305475	2703	73421	How does the HP OfficeJet 4620 Airprint compare to the HP LaserJet Enterprise M506x?	How does the HP OfficeJet 4620 Airprint compare to the HP DesignJet Z5200 44-in Photo Printer?	1
305476	409119	231272	What's the best way to get laid in Bangalore?	How do I hire a mini truck in Bangalore?	0
305477	14931	13779	How do you see the PM Modi’s move of banning old 500 and 1000 rupee currency notes?	What are the full implications of the Indian government's decision to withdraw all the old 500 and 1000 rupee notes from circulation?	1
305478	428884	108477	How do I make free mobile app?	How do free apps make money?	0
305479	133367	428885	What is secularism?	What is secularism? Are the Indian political parties secular?	1
305480	381653	428886	How is the life of Assistants in CSS selected through SSC CGL?	Does a person selected through SSC-CGL in CSS ever gets a blue/red beacon govt vehicle in his entire tenure? ITI in CBDT ever gets it?	0
305481	428887	428888	Is heating of any object by direct sunlight different from heating by hot air blower?	During winter heating, what is an inexpensive way to get all the hot air near my ceiling down to where my cold body is?	0
305482	229706	15671	Did Donald Trump win the election?	How and Why did Donald Trump win the election?	0
305483	428889	428890	Can we do a mobile recharge using the BHIM app?	How do I select state bank of Patiala in bhim app?	0
305484	428891	428892	What are Kepler's laws? Why are they important?	Why are Kepler's Laws so important?	1
305485	24960	11435	I am an international student in the US - do I have to leave if Trump wins?	What will happen to international students in the US if Donald Trump becomes president?	1
305486	428893	79479	Would ISPs block access to our Google Play or iTunes movies if we didn't have net neutrality?	What would ISPs block if we didnt have net neutrality?	0
305487	428894	428895	Why are so many successful recovering alcoholics in the closet about their recovery?	Would you date a recovering alcoholic? Why or why not?	0
305488	428896	428897	In today's date do u believe that job is better or own business?	Are the Chinese regulators not worried by how big Chinese banks have gotten in the U.S. treasury repo market?	0
305489	428898	428899	Which are the countries set laws to control MNCs?	Are there any laws against creating false accounts on the Internet and in which countries' legislations?	0
305490	428900	428901	Does Zumba dance lose muscles?	Is it normal to not want to gain visible muscle?	0
305491	428902	270677	Who invented the wheel?	How was the wheel invented?	0
305492	428903	428904	What are variable constants?	What are variables?	0
305493	428905	417571	What is the process of garments washing?	What is the process of bleach wash in garment?	0
305494	165336	162310	What are the things that make Indians happy? (Enough of what makes us sad)	What are the things that made India happy?	1
305495	428906	428907	How long do tortoises live in the wild?	How long do bats live? Why do they live that long?	0
305496	55640	106499	Can you get your penis bigger?	How do I get a bigger dick?	1
305497	258605	321553	Why is religion is to blame for the witch hunt in Salem? Give quotation from crucible and explain it.	Why is religion is to blame for the witch hunt in Salem?	1
305498	428908	19258	Why are radio waves transverse?	What are radio waves?	0
305499	33412	17812	Why do so many people ask questions on Quora that can be found in a Google search?	Why do so many people on Quora ask stupid questions they could find answers to if they spent less than 5 minutes on a search engines?	1
305500	428909	428910	Are there portable small FM receivers in the market that can stream FM output through Bluetooth and Aux to home theatre and portable speaker?	How do I switch ON FM radio in W330X F&D speakers?	0
305501	428911	284523	What is pen?	What is pen c?	0
305502	428912	268709	What can I do if I want to have sex with a girl?	I want to have sex with a girl, what can i do?	1
305503	15741	76566	What is the funniest joke you've ever heard or read?	What is the funniest joke you have ever read heard or listened?	1
305504	13322	46473	What is the point of answering questions on Quora?	How does it benefit you to answer questions on Quora?	1
305505	428913	428914	How is PGPME/PGDM course at Great Lakes Gurgaon?	Should I go for MHA course in INLEAD Gurgaon?	0
305506	428915	428916	How do I convert from farads to ampere hours?	What is ampere hour?	0
305507	19642	19590	What is a good solar panel installation provider in Novato, California CA?	What is a good solar panel installation provider in Lompoc, California CA?	0
305508	428917	258139	If an astronaut in space took his helmet off for a second, what would happen?	What would really happen to an astronaut who took off his helmet in space?	1
305509	428918	428919	Why do people choose to attend Raffles JC or Hwa Chong JC instead of NUS High School?	What are the pros and cons of joining NUS High School?	0
305510	5037	428920	How do I distinguish between stock and flow variables?	What is the correlation between Exxon stock and oil prices?	0
305511	290600	260965	How do you tell someone that thinks you like them, that you don't actually like them?	How do you tell someone you like them?	0
305512	428921	428922	How do I tell my friends, I don't want to play strip poker?	Do I tell my friend the real reason I don't want to move in with her or a lie? I'm seeing her ex	0
305513	428923	428924	What are the top 10 websites for models to find gigs (for those who do not work with an agency)?	What is it like to run a modelling agency?	0
305514	21678	131253	Which is the best laptop I can buy in india for Rs.25000-30000?	What are the best laptops to buy within Rs.30000 or $485 and why?	1
305515	642	24272	How will Indian GDP be affected from banning 500 and 1000 rupees notes?	What would be the possible impact on Indian economy after cancellation of 500 and 1000 Rs notes?	1
305516	52957	428925	What is, scientifically, the best form of energy to use?	What is the best tool to use for building a rational database, reports and forms?	0
305517	428926	195203	How do I save a .gif from Pinterest onto my Android phone?	Where do the downloaded songs get saved on the phone in the Gaana app for Android?	0
305518	428927	428928	Are Pembroke Welsh Corgis born without tails or are they docked?	How much should I pay for a 6 year old pembroke Corgi?	0
305519	428929	428930	How many QA people does Intuit employ?	How many customer support people work at Intuit?	0
305520	428931	428932	WHAT ARE DIFFERENT M.B.A BRANCHES OTHER THAN TRADITIONAL ONES WITH GOOD PACKAGE IN INDIA?	How can a student pursuing MBA from a non ABC IIM get job at a VC firm? How should he build his resume?	0
305521	428933	428934	How can I stop from getting junk in my mailbox (real one, not e-mail)?	How can I stop getting junk mail? Is there some trick I could use that would stop the junk mail?	1
305522	428935	428936	Can foreigners own land in California?	Can foreigners own land in the USA?	0
305523	428937	342336	What are the differences between Filipino and American English collocations?	"What is the difference between ""sang"" and ""sung""?"	0
305524	428938	139056	Which is the best site for downloading anime?	What is the best site to download anime torrents?	0
305525	428939	428940	Who are notable angel investors in Singapore?	Who are the notable angel investors in Singapore?	1
305526	428941	428942	How can you determine the melting point of coconut oil?	What is the melting point of coconut oil? How is this determined?	1
305527	94571	428943	I'm applying to psych PhD programs from a similar field (Masters in Family Therapy). Should I apply to a psych MA program because of my low GRE scores?	Can I select applied math departments' professors to be my thesis tutor if I am enrolled in a pure math phd program?	0
305528	428944	277686	How can we send a mass email for free?	What's the best way to send mass emails?	0
305529	428945	428946	What is use of laying undersea Internet cables?	Why do they lay underground internet cables in ocean?	0
305530	428947	428948	How do I calculate percentile?	What is percentile and how to calculate it?	1
305531	109999	502	How do you recover your gmail account password?	I do not remember my password to my Gmail account, how can I recover my account?	1
305532	428949	374428	What are all the best timing photographs?	Who is the best photographer of all time?	0
305533	428950	428951	How do you prove the area of an equilateral triangle?	How does one determine the area of an equilateral triangle?	0
305534	85305	23556	What is a good song for a text prank?	What is a good prank lyric text to text to a friend?	1
