id	qid1	qid2	question1	question2	is_duplicate
380701	512346	512347	Why do I have more energy for running when I do it right after waking up rather than after eating breakfast and dropping my kids off at camp?	What are the best games that are compatible on a Intel(R) core i5 - 4200u cup @ 1.6 GHz?	0
380702	512348	159711	What is wrong in prostitution in India?	Prostitution is not legal in India, then how can so many escorts/callgirls websites run freely in India?	0
380703	5576	9356	Will Donald Trump be a good President?	Why will Donald Trump be a good president?	1
380704	90666	40888	How will World War III begin?	Why Do You Think World War 3 Will Happen? I Personally think it won't.	1
380705	512349	512350	How do I find a perfect male hairstyle for me?	How can I find the right hairstyle for me?	0
380706	512351	162984	What is the worst crime someone could commit?	What is the worst crime ever committed?	0
380707	402210	512352	How is ArrayList implemented in Java?	How can an ArrayList be synchronized in Java?	0
380708	3774	21215	What is the best way to prepare for the theoretical part of the CA Final Exam?	What is the best way to prepare for CA final law and audit?	1
380709	247006	512353	What are the differences between unipolar, bipolar, and multipolar neurons?	What is a neuron and a neuroglia? How are they different?	0
380710	512354	512355	Can a person who is an over ambitious but still ambiguous about his goals can attain the zenith which he always dreamed of?	How can people set concrete and ambitious career goals if they are unsure about what they want to be doing?	0
380711	93789	512356	How is life in the Russian military?	Are worn out tires normal for the Russian Military?	0
380712	512357	512358	What are some study tips for b.tech student of computer science (first year)?	I am a B.Tech Computer Science student and am offered an internship with EY in Stat Audit Analysis. How should I prepare for this?	0
380713	146016	512359	Can you explain what is the difference between NEFT/RTGS/IMPS?	What is the major difference between a Immediate Payment Service (IMPS) and NEFT from a bank's point of view? Doesn't the launch of IMPS reduce the usage of NEFT services?	0
380714	512360	512361	What does Richard Muller think of human colonization on Mars?	What does Richard muller think about human colonization on Mars?	1
380715	512362	391306	How cool is Google?	What is the best way to be cool?	0
380716	512363	297438	What is the past tense of text?	What is the past tense of set?	0
380717	512364	512365	What is the diffrence between spider and crawler?	What is to love someone who is hated by my friends?	0
380718	202243	512366	How can smoking weed cause depression?	How can smoking weed cause headaches?	0
380719	512367	512368	Can Thanaka powder permanently remove hair from our body?	How effective is thanaka powder and Kusum oil for facial hair removal?	0
380720	141055	512369	Why do we need a starter to start an AC and DC m/c?	Why we use ac than dc?	0
380721	202157	68733	Why do we get Nightmares?	What are the main causes of nightmares?	1
380722	512370	512371	What's the difference between a business model and an industry model?	What is the difference between a business model and an industry model?	1
380723	512372	11858	 I'm openly gay and falling in love with my best friend I've known for 5 years he's a really great guy but I'm stuck. What should I do?	I'm in love with my best friend. I'm gay; he's straight. What should I do?	1
380724	512373	512374	How do I read maps for upsc?	What is the meaning of a high absolute neutrophil count?	0
380725	512375	512376	How much does a management consulting firm (MBB) charge per project? How much do the 2nd tier firms (Roland Berger, Strategy&, LEK, Oliver Wyman etc)?	How much do strategy consulting firms in Asia charge multinational and government clients?	0
380726	167541	512377	What is it like living in New Zealand?	What does it feel like to work and live in New Zealand as an immigrant?	0
380727	407735	512378	What are some mind-blowing facts about Narendra Modi's security?	What are some incredible facts about the Indian armed forces?	0
380728	235310	246220	Why does my girlfriend refuse to have sex with me?	How do I convince my girlfriend to have sex for pleasure?	0
380729	192805	512379	What does NASA think of Elon Musk's SpaceX?	Who will get to Mars first, Elon Musk's SpaceX or NASA?	0
380730	512380	512381	What are some famous music videos featuring Rajlakshmi khanvilkar?	Who was the actress featuring in Bally Sagoo's music video Lahng Gawacha?	0
380731	279784	176721	What are the top 5 best catches in the world for cricket?	What are some of the best catches in the history of Cricket?	1
380732	512382	456416	Who is the best EPL commentator?	Who are the best football commentators?	0
380733	90614	148578	How do I stop a Pointer/Boxer mix puppy from chewing my shoes?	How do I get my dachshund to stop chewing furniture?	1
380734	38980	64808	How can I prepare for CAT 2017?	What should be my approach and CAT percentile to get into IIMs?	0
380735	512383	100882	How do you allow the user to input the array size in C?	How memory is allocated to 1D and 2D array in C?	0
380736	95616	512384	How does it feel like to die?	How does it feel like to see someone die?	0
380737	512385	512386	"What is a summary of Francis Bacon's ""Of Studies""?"	How did Sir Francis Bacon display the qualities of a scientist?	0
380738	512387	512388	What are the best sarcastic one liners you've heard?	What is the best sarcastic one-liner you have heard?	1
380739	512389	512390	What if Google force users to use Google allo instead of WhatsApp?	What would have happened if Google had acquired WhatsApp instead of Facebook? Did they make any attempts to do so?	0
380740	16052	3857	Why won't Quora let me delete my question or edit the extra details?	How do you delete a question you asked on Quora	1
380741	205368	135056	How do you differentiate between a Boeing and an Airbus?	What is the difference between boeing and airbus?	1
380742	512391	512392	As a graphic design student what should I charge for freelancing if I want to charge per project rather than hourly?	Can I play a 5.1 movie though 2.1 speakers?	0
380743	512393	512394	Does the NYPD have a 99th Precinct? If so, is it in Brooklyn?	I need to create a badge number for a film for an NYPD detective in the first precinct - would a believable number be 3 or 4 digits?	0
380744	154965	330760	Does Quora use a specific algorithm to filter out or merge similar questions?	Can Quora be made capable of merging similar questions automatically?	0
380745	394732	129690	What are the worst words in the English language?	What are some interesting words in English?	0
380746	512395	512396	Mechanical Engineering: What is the purpose of piston ring and oil rings?	Why are the piston rings of a 2-stroke engine chamfered but not for a 4-stroke engine?	0
380747	86224	512397	How long does ibuprofen take to work?	Why is my Percocet taking so long to work?	0
380748	512398	512399	How do you repair cracked leather seats?	How can I repair leather seats?	1
380749	149993	512400	How does the Pomodoro Technique work?	What is the Pomodoro Technique?	0
380750	512401	512402	Is there any easy animation software for windows just like Muvizu?	Which animation software uses GPU to render?	0
380751	203177	53811	"While booking a ticket on IRCTC, should I check ""Consider for Auto Upgradation"" or not?"	Trains: Why are 1AC tickets NEVER available for booking in IRCTC?	0
380752	287230	58269	What app can I use to track my husband with his phone by using my phone?	Can I track or locate my husband without his phone by using my phone?	1
380753	512403	512404	Did Charles Darwin really eat every animal he discovered?	Was Al-Jahiz's book of animals really the first book on evolution before Charles Darwin's?	0
380754	512405	180399	What is the speciality of Japan in terms of products that people around the world would like to use?	Why did Japan enter World War I?	0
380755	512406	130971	What is civil?	What civilization do we live in?	0
380756	263823	20868	How can I clear my acne?	How can I get rid of my acne?	1
380757	96087	512407	Why do dogs like to sleep together with humans on their human beds?	How do dogs sense human emotions?	0
380758	512408	512409	What is it like to be a special education professor?	What's it like to be a teacher for special education students?	1
380759	512410	290145	If I don't have an Instagram account but I scroll through somebody's account, will they know?	Can people see if I've viewed their Instagram if I don't have an account?	0
380760	512411	512412	Why are reservations are given to children of SC/STs whose parents belong to creamy layer?	Valuelabs aptitude pattern?	0
380761	512413	512414	What is the best way to solve difficult problems?	How can I not get frustrated when solving a difficult problem?	0
380762	35498	19789	Do people post questions in Quora just so that they can skip searching in Google for a few minutes?	Why do people ask basic questions instead of searching them?	1
380763	333402	395975	What is light caused by?	How is light created?	1
380764	512415	24190	How does UV light dry gel nails?	What can you do to get gel nail polish dry without an UV light?	0
380765	512416	434498	What is your review of The Machine (2013 movie)?	What is your review of +1 (2013 movie)?	0
380766	512417	512418	How do I use the Spring AOP to intercept the method execution at some point for doing some intermittent process?	Can I run a 240v or even 480v 3 phase motor on a 125AMP 208Y/120V 3-PHASE 4-WIRE panel?	0
380767	36447	59575	What was the significance of the battle of Somme, and how did this battle compare and contrast to the Battle of Calabria?	What was the significance of the battle of Somme, and how did this battle compare and contrast to the Battle of Smilevo?	1
380768	48527	344669	How do I lose 20 kgs in a year?	How can one lose 20 kg in one year?	1
380769	19821	52637	How can I find my hidden talents?	What are the ways to find the hidden talent in me?	1
380770	13581	31163	On Quora how do I change the generic blue profile pic to a photo I want?	How can I change my profile pic on Quora?	1
380771	11212	10694	Why is Saltwater taffy candy imported in The Bahamas?	Why is Saltwater Taffy candy imported in Portugal?	1
380772	512419	512420	Why did Quora search show errors in the evening of May 10th?	Are Quora questions and answers searchable? That is, do they show up in a Google or Yahoo search?	0
380773	234257	97822	What is the best online resource to learn Python?	What is the best online resources to learn Python?	1
380774	512421	512422	What should be done to go from physically unattractive to attractive?	How do I transform myself from physically unappealing to physically attractive?	1
380775	512423	365756	What is the antonym of anonymous?	What is an antonym?	0
380776	512424	512425	How good is University of Florida Gainesville for MS in INDUSTRIAL Engineering? Is 317 in gre (Q-162,V-155) enough to apply there.	What are some good US universities for an MS in Industrial Engineering that I could apply with the following profile?	0
380777	16474	1101	What will happen if Donald trump wins, and its effect on Indian students who are studying in US?	How would Trump presidency affect Indian students in the US?	1
380778	512426	512427	Are all personality disorders permanent?	"What influences someone who is at peace with / accepting ""passing on,"" versus those who become despondent / denial of their impending death?"	0
380779	512428	512429	How is the placement of the MBA students at BIT Mesra?	What is the average package of placement in the civil branch of BIT Mesra?	0
380780	512430	127652	Why is Taj Mahal considered as a Shiva Temple?	Was the Taj Mahal a Shiva temple?	0
380781	512431	512432	What is the difference between speculation and hoarding?	What are the differences between speculation and extrapolation?	0
380782	512433	512434	Power spells and chants?	I have to make a quiz webpage.. Any brilliant idea for the same plz?	0
380783	512435	98446	What can be the best solution to the ever increasing beggars in Mumbai? Can they be relocated somewhere to live a dignified life?	Should we give money to beggars?	0
380784	512436	512437	Which was the first IT company started in Bangalore?	What are the first steps to starting an energy drink company?	0
380785	11116	68680	What is lucky number?	Is 7 a lucky number?	0
380786	512438	512439	"Do Australians use the word ""fuck"" like Americans do?"	"Do British use the word ""fuck"" like Americans do?"	0
380787	12804	512440	Who is the richest man?	Who is the richest man in ahmedabad?	0
380788	512441	512442	As a USA Green Card holder (permanent resident), which countries can I visit (for tourism) without needing a visa for that country?	Do F1 Visa holders need an AP to re enter US while green card application is being processed?	0
380789	443369	144450	How much does it cost to own a small plane?	Roughly how much will it cost to fix this small dent and scratch on my car?	0
380790	9004	54361	Daniel Ek: Why spotify is not available in India for free?	Is Spotify available in India?	1
380791	512443	512444	What are interview questions asked by Google for search quality evaluator?	How do you want to improve yourself in the next year?	0
380792	58499	512445	Taxes in India: Can I download a soft copy of my PAN card?	How can I get new duplicate copy of my pan card?	0
380793	300920	76957	Why should you jailbreak a iPhone 6?	Why should I jailbreak my iPhone?	0
380794	512446	512447	Why does he insults me and lie to me?	Why does everybody ignore and insult me?	0
380795	512448	512449	Is intellectual property really that important?	What is the importance of intellectual property rights?	0
380796	441849	512450	"Spanish (language): What is the English meaning of ""Cuidadito con traicionar a Will""?"	Why is English the official language of Belize if the majority of the population speaks Spanish?	0
380797	148468	512451	What one experience defined the person you are today?	What is the one experience that has defined you as a person and/or got you where you are today?	0
380798	512452	512453	Are humans reproducing like rabbits?	How do I approach a woman who goes on dates with multiple men at the same time?	0
380799	4207	512454	How much money do the Alaskan Bush People make on TV?	How much money do people in Dothan Alabama make?	0
380800	317214	512455	How do Under Armour shoes typically size?	What size shoe does Jay-Z wear?	0
380801	512456	148809	What is the relation between frequency and time period?	What is frequency?	0
380802	378199	160372	Which gas is mixed with LPG to detect smell?	Why does the outside of my car smell heavily of gas right after I fill the tank up?	0
380803	512457	512458	What causes dizziness after laughing?	What causes dizziness when laughing?	1
380804	512459	123208	Should I apply for Jamia, PESSAT and VITEEE college?	Which is a good inpatient drug and alcohol rehab center in Montgomery County KY?	0
380805	247746	444115	Who is the current Prime Minister of India?	Who is the  Prime Minister of India?	1
380806	512460	445100	Actor Robert Williams who makes the whole world laugh with his works has hanged himself. What kind of a man would do this?	Why did David Foster Wallace commit suicide?	0
380807	91065	512461	What are some examples of things that are morally wrong, but not illegal?	What is the example of something that is morally right but ethically wrong?	0
380808	229275	512462	Which is the best school in Bangalore?	Which are the best IB schools in Bangalore?	0
380809	155433	512463	How do people with high IQ think?	Do people with high IQ speak more quickly?	0
380810	512464	512465	Was Flappy Bird an addictive game?	Is Flappy Bird one of the most addictive games?	1
380811	512466	512467	What are the opportunities after doing MS from Taiwan?	Is it advisable to do MS in networking in Canada? What are job opportunities after MS?	0
380812	222356	110310	What is your biggest regret for not doing something?	What’s your biggest regret that you have in your life so far?	1
380813	179915	41885	Sexism: Why do some men hate women?	How can I hack someone's WhatsApp account if I just have his WhatsApp account number?	0
380814	512468	512469	Is it good if I sell ready-to-use website for $1000?	How can you make over $1000 monthly selling on eCommerce websites?	0
380815	512470	512471	What is Britney Spears' best song?	If you had the chance to meet Britney Spears, what would you tell her?	0
380816	512472	282010	How do I prepare for GMAT 2016?	What are some of the best ways to study or prepare for the GMAT?	0
380817	512473	512474	Why do the nose pads of my spectables turn green?	How do I keep the nose pads from falling off my glasses?	0
380818	512475	512476	What is the ultimate goal of everything?	What should be the goal in life of a human being?	0
380819	512477	512478	How many hours should I charge my new Vivo X7 phone for the first time?	How many hours should I charge my new Vivo X7 phone for the first time? Request	0
380820	10512	512479	What are the laws of getting a green card due to marriage in US, how do they compare to the green card laws in China?	What are the laws of getting a green card due to marriage in US, how do they compare to the green card laws in Russia?	0
380821	512480	512481	Are Americans interested in making Asian friends?	What are the managerial prospects for ecommerce?	0
380822	512482	512483	Where can I read Death Note online?	Is there any other series like Lost on Netflix?	0
380823	346808	314180	I eat very slowly. How to increase my eating speed?	What should I eat to increase my weight by 10 kg in 3 months?	0
380824	512484	512485	How do cats burp?	Do cats burp?	1
380825	512486	512487	I am an aerospace student who specializes in drones, and have internship offerings from startups like DJI, 3D Robotics, Amazon Prime Air, Kespry, and Matternet, as well as larger corporations such as Lockheed Martin and GE. What are the pros and cons of these?	I am a graduate student in aerospace engineering with concentration in Dynamics & Control, and would like to work in robotics/AI. What new skills would I have to develop, and which skills can I translate directly?	0
380826	512488	512489	Should I take an online course?	What is the best way to take an online course?	0
380827	512490	512491	Is geedunk pronounced with a hard or soft g?	What would happen to the British economy if Jeremy Corbyn would actually become PM?	0
380828	143794	1863	Can Donald Trump still win the 2016 U.S. Presidential Election?	Did Trump win the election?	1
380829	22508	2508	What are you views, pros, cons on ban of 500 and 1000 notes by goverment?	What are your views on the ban of Rs 500 and Rs 1000 notes by the Indian Government? Pros cons?	1
380830	512492	512493	What is the future of solid propellants/solid propulsion? Is it worth doing research in combustion/decomposition of solid propellants?	Is oxygen a solid, liquid or gas?	0
380831	484276	512494	What were the consequences of the Persian Wars?	How was first the Persian Gulf War a watershed event for CNN?	0
380832	232910	512495	Why are some eggs brown?	Why are some eggs yellow and some are white?	0
380833	512496	512497	Algorithms: Why is viola-jones still considered as state-of-art in object detection algorithm?	Computer Vision: Easiest way to implement viola jones face detection in java.? I have studied the algorithm i know the working still dont know how to start it with java. I want some code with documentation for reference or some idea how to do training and all that stuff. Provide me some useful links if possible. I have already googled a lot but it seems little bit confusing that's y i m askin here.. thanks in advance.	0
380834	512498	512499	I am expecting 140 marks in the Mains and a 93% in the boards. Which NIT's and what rank should I expect?	I am expecting 140 marks in my JEE Mains paper 2 and 85% percent in the 12 RBSE board exam. What nit college can I get?	0
380835	512500	512501	Why do restaurants in the US not swipe the credit card post-tip?	In Indian restaurants I have seen some folks write the tip amount on the slip that you have to sign on after you swipe your card. Does that really work?	0
380836	100212	20183	How do you become the top writer on Quora?	How can I become a Top Writer on Quora?	1
380837	512502	512503	What is software development life cycle?	What is software development lifecycle?	1
380838	512504	512505	I am in college and I have no money how do I invest and how can I make money?	I confessed my feelings to a guy who has Asperger, how long will it take for him to respond?	0
380839	103478	160901	"How would you use the word ""brusque"" in a sentence?"	How would you use the word “pillage” in a sentence?	0
380840	202539	512506	A genie gives you 3 wishes. But he is a genius manipulator and informs you he will try his best to twist your wishes. What do you wish for and why?	"If Aladdin's wish is ""not to get his wish fulfilled"" what will genie do?"	0
380841	512507	512508	Which countries use Fahrenheit as a measurement of temperature?	Why in India, in summers the temperature is reported in Celcius and in winter it is reported in Fahrenheit?	0
380842	136085	512509	What's the best gaming laptop under $700?	What is the best gaming laptop under 1000$?	0
380843	311290	96809	How can I learn Deep Learning quickly?	How do beginners learn deep learning?	1
380844	512510	512511	What are white blood cells in urine during pregnancy?	Mechanica engineering jobs in software companies?	0
380845	512512	512513	Which is the costliest alcohol in the world?	Which is the costliest liquor in world?	1
380846	512514	214997	Which is the best application for learning English?	Which is the best app for learning English vocabulary?	0
380847	512515	512516	Why is everyone annoying?	Why do I find everyone annoying?	1
380848	226254	19527	How can I ignore someone?	What is the best way to ignore someone?	1
380849	282923	512517	What do I need to know before learning algorithms?	What do you need to know to learn algorithms?	1
380850	512518	512519	What does it mean if someone rolls their eyes in front of me?	A girl makes eye contact with me in class what does this mean?	0
380851	512520	512521	How does a hair dryer help to style hair?	Can hair dryer be used to shape hair daily for boys? Is it harmful?	0
380852	203915	512522	What is Travis Kalanick's net worth in terms of cash in the bank?	Does Travis Kalanick take Uber to office?	0
380853	512523	512524	Water testing Lab at Cuddalore?	Relative centripetal acceleration (due to the earth's rotation) with respect to the body would be zero why?	0
380854	512525	243589	Is it normal in the Indian culture for the man to walk in front of the woman, instead of walking beside her?	What do Quorans think about Salman Khan's sentence and about getting acquitted by the high court as of Dec 10, 2015?	0
380855	102178	269284	What happens if I drink bleach?	What will happen if I drink a glass of bleach?	1
380856	512526	512527	Kevin Murphy: Why did you leave UBC?	What are some of the great qualities of UBC?	0
380857	512528	512529	Is make up sex good?	Is make up sex hotter than average sex? Why?	1
380858	122532	512530	"I was rejected in a software developer interview and one feedback was ""No agile experience"". What does that mean?"	"What is a ""whole-team approach"" in agile software development?"	0
380859	145891	408275	What causes depression in humans?	What are the main causes of depression?	1
380860	12717	10234	What are the various ways through which one can earn money online?	How do we make money online?	1
380861	512531	512532	I'm a girl who fell in love with my girl best friend. I already confessed to her and she didn't say anything. She became closer to me. What does that mean?	I love a girl who's my best friend. I proposed to her and she stopped talking to me. After a few months she again started talking to me as a friend. I have tried to express my feelings for her many times. Now she's lost interest in me and started to avoid me. What can I do to get her?	0
380862	166025	512533	How do I convert mp3 file to midi file?	What is the best way to convert mp3 to midi?	1
380863	512534	512535	Is it true a girl does not forget her first kiss?	Girls: Do girls prefer when a guy asks to kiss them first or just goes for the kiss?	0
380864	512536	512537	What is biological magnification and how is it done?	What is Biological magnification?	1
380865	512538	211525	What does a script look like?	What's a script?	0
380866	215717	147852	Is it right decision to replace Raghuram Rajan by Urjit Patel?	How much urjit Patel Suits to RBI as a governor: compare with Raghuram Rajan sir?	1
380867	512539	512540	Am I required to update my passport when my present residential address changes?	What's the ratio between learning something and practicing it?	0
380868	512541	512542	What are the good names for online food business?	What is a unique online food business?	0
380869	512543	512544	Which is the best newspaper in the world that provides unbiased information on world affairs?	What are currently the best newspaper websites in the world? Why?	0
380870	512545	512546	Why couldn't Jews deny their identity during Holocaust?	Would the Jews have left Europe if they hadn't been persecuted, victims of pogroms and almost erased in the Holocaust during WWII?	0
380871	3314	331467	How is the story behind your country's national flag?	What does your country's National Flag imply?	1
380872	69519	99225	What are some things new employees should know going into their first day at Gibraltar Industries?	What are some things new employees should know going into their first day at CSS Industries?	0
380873	34686	388946	Will I get logged out of Instagram if I use another device?	If I change the password from a different device will it log out of the orginal device on instagram?	0
380874	9373	512547	What is the fastest land mammal?	Is the cheetah the fastest land animal to ever live?	0
