id	qid1	qid2	question1	question2	is_duplicate
240000	207550	351729	What is the truth of life?	What's the evil truth of life?	0
240001	33183	351730	Which is the best smartphone under 20K in India?	Which is the best smartphone with in 20k in India?	1
240002	351731	351732	Steps taken by Canadian government to improve literacy rate?	Can I send homemade herbal hair oil from India to US via postal or private courier services?	0
240003	37799	94186	What is a good way to lose 30 pounds in 2 months?	What can I do to lose 30 pounds in 2 months?	1
240004	351733	351734	Which of the following most accurately describes the translation of the graph y = (x+3)^2 -2 to the graph of y = (x -2)^2 +2?	How do you graph x + 2y = -2?	0
240005	351735	91369	What is the purpose of yawning?	Why do mammals yawn and stretch?	0
240006	351736	339786	Can anyone help me solve this math riddle?	Mathematics and Physics: Can anyone help me solve this?	0
240007	351737	351738	What SAT/ACT scores are average for the University of Michigan?	What is considered a low SAT/ACT score to get into Stanford?	0
240008	351739	351740	What is the business can I do now that Modi is trying to change India to a cashless economy?	What is the business I can do now that Modi is trying to change India to a cashless economy?	1
240009	351741	199625	Do Christians really still believe in Noah's Ark, Santa Claus, and Jonah living inside the whale?	Why do rational people believe in Noah's Ark?	0
240010	351742	351743	What can I do when I feel sleepy and dizzy at work?	What can I do when feel sleepy at work?	0
240011	351744	351745	Why does the Catholic Bible have 73 books?	Why are there more books in the Catholic bible than the Protestant bible?	1
240012	351746	351747	What's the safest way to transport a desktop computer while flying?	What's the cheapest way to ship heavy packages (e.g. furniture/desktop computer) from New York to Nairobi, Kenya?	0
240013	228421	42179	Which is a good solar panel installation provider near Petaluma, California CA?	Which is a good solar panel installation provider near Agoura, California?	0
240014	351748	351749	Does UnitedHealth Group (Bangalore) provide any higher education assistance to its employees?	Does IBM allow its fresher employees any higher education?	0
240015	63971	85997	How do I hack my husband phone?	How can I hack my husband WhatsApp?	1
240016	351750	119559	What is it like to work at Capgemini India?	What is it like to work at Capgemini in India?	1
240017	351751	46005	What hotel in Nashik would be safe for unmarried couples, without the harassment of police, hotel staff, and moral police?	What hotel in Gurgaon would be safe for unmarried couples, without the harassment of police, hotel staff, and moral police?	0
240018	351752	351753	What are some reviews of Hifonics amps?	What are reviews for the Hifonics 5-Channel Amp?	0
240019	351754	351755	World of Warcraft (2004 video game): What is it like to play as Dwarf DPS in World of Warcraft?	World of Warcraft (2004 video game): What is it like to play as Blood Elf DPS in World of Warcraft?	0
240020	246311	24850	What is the worst thing you ever smelled?	What's the worst thing you've ever done?	0
240021	351756	351757	I had created database Better than excel using SQL, how can I sell that to schools and colleges?	How is machine learning in asu?	0
240022	282090	351758	Who is Jesus?	Who is Jesus deelena?	0
240023	351759	148178	What is the best way to find a lead VC?	How do I raise venture capital? Do I just email my business plan?	0
240024	351760	351761	Can a project's IRR be positive even if the NPV is negative?	Can NPV be positive when IRR is 0?	0
240025	351762	108841	I want to name my dog after a Game of Thrones character. What would be the best name?	Who is the most beautiful woman on Game of Thrones?	0
240026	351763	12053	What is it like to major in Philosophy at Brown?	What is it like to major in philosophy?	0
240027	69455	351764	What are the most interesting products and innovations that Host Hotels & Resorts is coming out with in 2016?	What are the most interesting products and innovations that Strategic Hotel & Resorts is coming out with in 2016?	0
240028	351765	131673	How do I remotely access smart phone from laptop?	Is there a way to remotely access a mobile from another mobile phone?	0
240029	51681	2682	What are the best places to visit in Kerala? What is the best way of transportation there?	What are some good beaches to visit in Kerala?	1
240030	16814	14142	Can we time travel anyhow?	Is time travel already possible on Earth?	1
240031	351766	351767	What decides the amount of money that a central bank prints?	Why do banks lend or borrow money from each other instead of borrowing it from the central bank?	0
240032	351768	351769	Which is the easiest way to quit smoking?	What is the easiest way to quit smoking?	1
240033	351770	351771	Which are some factors affecting soil fertility?	Which type of algae can increase soil fertility?	0
240034	351772	351773	If the Father is Elohim and Jesus is Jehovah (as the Mormons teach), how does a Mormon explain Deuteronomy 6:4?	Why do Mormons believe in more than one God? How do they worship them?	0
240035	180011	351774	Why do ideas come to me so easily when I am taking a shower?	Why do people have really good ideas in the shower?	1
240036	351775	351776	What do you mean by MOSS in SharePoint?	What do you mean by MOSS in SharePoint Development?	1
240037	5489	351777	Why does $500 trillion rich Rothschilds are not on Forbes richest people list?	Who are the richest people in trinidad?	0
240038	351778	351779	What causes black spots on skin?	What causes orange spots on my skin?	0
240039	307893	204920	What is the dumbest question or answer you have seen on Quora?	What is the most stupid question and answer(s) on Quora?	1
240040	351780	351781	Would you break the law to save a loved one?	Would you break the law for your loved one?	1
240041	351782	351783	What are the facilities provided by Cognizant Technology Solutions to the freshers?	Which is better: Cognizant Technology Solutions in Pune, Bangalore, Gurgaon or Hyderabad?	0
240042	351784	96786	What are the best open source automated web functional test tools available as of September 2014?	What is best tool to start with Automation testing?	0
240043	351785	351786	What apps are similar to WhatsDog?	What app is similar to Snapchat?	0
240044	55876	54919	What is the best book on digital marketing?	What is the best book about digital marketing?	1
240045	351787	351788	How UX designers communicate decisions effectively? I have a formal training in law & my writing style is dry. How can I change that?	I want to write a book on politics, but I have no formal education in that area. How can I prevent my book from being rubbished based on my lack of credentials?	0
240046	241579	27766	Can an 11 year old boy have sex?	Can a 14 year old guy date a 12 year old girl?	0
240047	71364	180801	Does Hillary Clinton have any serious health issues?	Why does Hillary Clinton's health matter?	1
240048	351789	351790	Is there any app which is very useful for a final year civil engineering student, for technical knowledge?	H? How can download Mahabharat episode	0
240049	351791	351792	What do you think of the extrajudicial killing in the Philippines, is it OK for you or not? Why?	How can I defend extrajudicial killings in a debate?	0
240050	351793	351794	What do you do if you board a flight and the overweight person you are seated next to spills into your seat?	How do I optimize my airplane seat selection for probability of being next to a hot chick?	0
240051	351795	351796	What kind of lawyer handles complicated identity issues?	How do the lawyers handle losing their cases?  Is it difficult? Is it humiliating?	0
240052	351797	351798	How can I get my HFA son to understand what he said was wrong?	My girl friend wants to contact her ex. I don't like it, I fear it will ruin my relationship with her. what I have to do?	0
240053	61034	351799	How do you know when a woman likes you?	How do I know when a woman is interested in me?	1
240054	115030	351800	Can the president run for two non-consecutive terms?	If President Obama could have run for a third term, would you have voted for him?	0
240055	351801	351802	Why do boys musterbate?	Why does guys musterbate?	1
240056	351803	351804	What happens in our brain while we are sleeping?	What happens to our brains when we are sleeping?	1
240057	351805	351806	I need a good ultra thin laptop suitable for mechanical engineering applications, which one is the best?	What would an actual 30,000 foot view look like?	0
240058	103102	351807	What piano chords go together?	Which is harder to play in a song on piano: arpeggio or chord?	0
240059	351808	53933	How can I change the education system of a country?	If you could change anything about today's system of education, what would you change and why?	0
240060	351809	351810	What is the correlation between IQ and smoking?	What is the correlation between IQ and income?	0
240061	18599	209089	What is the world's view on the design of India's new ₹500 and ₹2000 notes?	What do you think about the new design of 500 and 2000 rupee notes?	1
240062	351811	351812	How do I get internships in mumbai?	How do I get an internship in Mumbai in an electronics firm?	0
240063	137209	60186	Why do people drive so slowly on the left lane in Hawaii?	Why do people stay in the left lane when they are driving slow?	1
240064	351813	351814	What are all the different types of government?	What are the types of government?	1
240065	351815	351816	How do top writers manage their notifications?	How do Quora Top Writers manage their notifications?	1
240066	351817	333717	After Trump gets elected, how long would how would it affect his supporters?	What does it feel like to be a Trump supporter after his win?	0
240067	351818	351819	Which bank was the Goldman Sachs of the 1970's?	How does GS Bank diversify Goldman Sachs's revenue?	0
240068	351820	338652	Hillary Clinton: Why did you set up a private email server while working at the State Department?	Why did Hillary Clinton use a private server in the first place?	1
240069	351821	191879	What is the shortest answer with the highest number of upvotes on Quora?	What are some of the shortest answers with the maximum upvotes on Quora?	1
240070	351822	351823	After the war has drive most of the people out of large parts of Syria will it become part of greater Israel?	Did the USA cause the Syrian war so that Israel can have more territory and oil?	0
240071	351824	351825	Where bearings are used?	Why and where are bearings used?	1
240072	130196	31410	What will Hillary Clinton do after the election?	What are Hillary Clinton's chances of winning in the 2016 US Presidential Election?	0
240073	351826	351827	What is the deep beam?	What is deep beams?	1
240074	1903	63451	Realistically speaking, what would happen to the USA if Donald Trump wins Presidency in the 2016 elections?	What will happen to the superpower status of the USA, if Donald Trump wins the 2016 Presidential elections?	1
240075	351828	351829	How much in-hand salary will I get at Accenture with 3.35 CTC?	How much in-hand salary as a fresher I'll get at Accenture with 3.15 CTC?	0
240076	351830	351831	My only friend is busy with work. He has time at night which he devotes to his girlfriend. I have not talked to him in more than a month. I am not understanding what I should do. What's your take on this?	My friend's business partner just put a restraining order against him. His business partner is a snake and he didn't see it coming what can he do?	0
240077	351832	351833	My dog is not able to stand on his hind legs. What can I do to help?	Why does my dog open his legs when he sees me?	0
240078	351834	351835	"What's wrong with this sentence: ""Don't go nowhere, we'll be right back""?"	"How should I tackle this type of ""OCD""? Is this OCD?!!! What If I think of this forever, and then if I don't break my glasses forever I'll go crazy ?!"	0
240079	333461	351836	What does etc. mean?	What does it mean to be informed by an experience or event, etc.?	0
240080	351837	351838	Why do we use money instead of trading?	How does the oil subsidy policy in India work?	0
240081	114035	25	Is there a way to make learning physics easier?	What can make Physics easy to learn?	1
240082	351839	351840	Why do you want to join indian army as an officer and why did not you went to rally?	Why should you want to join Indian army?	0
240083	93313	351841	What are some of Füssen's best kept secrets?	What are some of Spain's best kept secrets?	0
240084	264705	351842	How do I get backlinks to app?	How can I get backlinks?	0
240085	74742	33576	Is there a possibility to love 2 person at once?	Is it possible for people to love 2 person at the same time?	1
240086	183622	56733	What was your most embarrassing moment during high school?	What's the most embarrassing thing that's happened to you in front of your crush?	0
240087	90748	297588	What is the easiest way to sell a car?	What's the best way to sell your car?	1
240088	351843	351844	What is the most f'kd up question that you have been asked in an interview?	What are some questions you have been asked in an interview?	0
240089	351845	100026	Which Aloe Vera plants are edible and how do they benefit your health?	What are the best place to visit in India with friends in December?	0
240090	56998	343818	Which are the major highways in California and how are they compared to the major highways in Maine?	Which are the major highways in California and how are they compared to the major highways in Pennsylvania?	0
240091	39395	19732	Which is the funniest joke you've ever heard?	Tell a joke that the funniest you have heard?	1
240092	179689	351846	Will Kiteboarding  become as popular as snowboarding? What will it take?	What is the founding story of Best Kiteboarding?	0
240093	351847	351848	How can you become a male escort in delhi?	How can I become male escort in delhi?	1
240094	222157	23424	What things in life are worth dying for?	What will happen after we die? What about our thoughts?	0
240095	85189	243348	Why are cats afraid of cucumbers?	Is it true that cats are afraid of cucumbers?	1
240096	351849	351850	What is iTunes?	What is iTunes architecture?	0
240097	199139	123355	What mobile game is best?	Which is the best mobile game?	1
240098	351851	159249	What are some interesting guitar tunings?	What are the coolest guitar tunings?	1
240099	10355	351852	How do I find my Citibank account number?	How do you determine a Citibank routing, account and check number?	0
240100	351853	254870	Have you ever felt the ”Impostor syndrome”? How did you get over it?	What are some effective techniques for overcoming Impostor Syndrome?	0
240101	351854	318227	What is the most significant fact about Sargon?	What’s the most important thing for a project manager to do?	0
240102	351855	351856	Http://www.fitclown.com/medi-wei... #medi #weight #loss #clinics #medicines #SEO.?	What is this dummyaccount?	0
240103	325476	149394	What is the difference between Ibuprofen, Advil and Motrin?	Can I take a pill after its expiration date?	0
240104	33475	22652	Why is Saltwater Taffy candy imported in Spain?	Why is Saltwater taffy candy imported in the Philippines?	1
240105	21712	42108	Why do people often ask questions in Quora while they can Google it themselves?	Why do people use Quora when they could easily find the answer in a quick Google search?	1
240106	78472	351857	What do b/f c/f b/d c/d mean in financial accounting?	What does financial statement tieouts mean (10Q/K)?	0
240107	351858	351859	How many deep discharge cycles can the Tesla Model S handle?	When will the Tesla Model S be redesigned?	0
240108	133798	351860	How can we say that we are happy?	"How do you say ""happy"" in French?"	0
240109	351861	351862	What did Ted Cruz score on the LSAT?	Did blueprint test prep help you score better on the LSAT? How so?	0
240110	30008	351863	What is the difference between art and music?	What is the difference between art and artistry?	0
240111	19789	69550	Why do people ask basic questions instead of searching them?	Why do so many people ask soppy questions on Quora, which can easily be Googled?	1
240112	351864	351865	What is the most overrated thing?	What is the most Overrated thing of all time?	1
240113	341128	87384	What will the next generation of American parenting be like?	What kind of parenting will the coming generation have?	1
240114	351866	351867	How can I prove 1/2 > 0?	How can you prove e^πi+1=0?	0
240115	351868	351869	What happens if an engineering college refuses to follow government order in India?	What will happen if a high court gives an order, and police and government doesn't follow it?	0
240116	351870	351871	What are the best strategies to promote a service business?	What is the best strategy to increase engagement on a software as a service business model?	0
240117	351872	351873	A logic teacher said You don't have a brother and he likes cheese.how is this rational?	I have crush on my teacher. I'm 21 and he is 24. He knows about my feelings but he doesn't respond. What should I do? Should I talk to him face to face? How can I know if he likes me or not?	0
240118	351874	351875	Which phone you prefer windows or Android and why?	Do you prefer Android or Windows Phone?	1
240119	57694	202430	When did the conflict between Israel and Palestine start?	What is the conflict between Israel and Palestine?	1
240120	330787	351876	I recently got my HDFC credit card, but I didn't receive a PIN with it. Is my credit card PIN the same as my debit card's?	Should credit cards use PINs for security?	0
240121	189421	12035	Why do scrum masters get paid so much? Is the job stressful?	What is the salary of an IIT professor?	0
240122	351877	351878	What is the best drug in India?	What is the best drug to take?	0
240123	351879	351880	Is floor price good or bad?	Can a person have a good relationship with someone with narcissistic traits?	0
240124	278919	351881	What is the difference between an extrovert and an introvert?	What is the difference between being shy and being an introvert?	0
240125	19200	2559	How can I slowly lose weight?	What are the best ways to lose weight?	1
240126	351882	351883	How safe is it to store files on Google drive?	How do we tell the world to shoot phone videos in landscape mode?	0
240127	351884	351885	Which is the best logo designing company?	What are some low budget graphic design sites and how do they compare?	0
240128	17980	100854	What is the best joke you've ever hear?	What's the best joke you have ever heard?	1
240129	55055	351886	Which is the world's oldest religion? What is the evidence of it?	How did Islam spread into South-East Asia?	0
240130	26804	156430	What did you think of the Fantastic Beasts and Where to Find Them movie?	What is the review of Fantastic Beasts and Where to Find Them movie?	1
240131	351887	172776	What are the strategies to earn from stock trading daily?	What are the tools you use for doing intra-day trading in Indian stock market?	0
240132	351888	351889	Was Yoda a Sith Lord?	Would psychopaths make good Sith Lords?	0
240133	9005	7003	Daniel Ek: When will you launch Spotify in India?	Why doesn't Spotify work in India?	1
240134	351890	351891	What is good about loneliness?	Is loneliness good?	0
240135	227307	351892	How does Wikipedia ensure content quality / authenticity is maintained?	How does Wikipedia keep content quality high?	1
240136	351893	207176	How has it come to be that the moon rotates at exactly the same speed as earth, thus only ever revealing one side of the moon to us?	Why do we always see the same side of the Moon from Earth?	0
240137	351894	351895	Is an MS in VLSI from Portland State University good? I have heard Intel has a research center on its campus, is that true?	Which universities should I apply for an MS in VLSI?	0
240138	351896	351897	How did Roman Abramovich become so financially successful?	Did Roman Abramovich own Sibneft until 2005 when Gazprom bought it?	0
240139	160306	233693	What should I do when there is nothing to do?	What should I do when I have nothing to do?	1
240140	62476	133773	When on instagram if you have a private account can the people you follow see your pictures?	If a person with a private Instagram account posts a photo and tags a person he is following but who is not following him, will they see that photo?	0
240141	14900	113320	Why do people commit suicide?	What are the reasons some people commit suicide?	1
240142	351898	351899	I'm an architecture student. My lecturer taught me Sketchup. Now I want to take an extra course about 3d modelling. Should I have to study 3d max too?	Henry Ford established Ford. I want to establish my own car brand. I am an ECE student. Which course(s) I should take in future?	0
240143	351900	351901	Did Francisco Franco live like a king?	Stereotypes on original inhabitants of India?	0
240144	254405	351902	What are some good 20 minute shows on Netflix?	How do I remove other users on my Netflix account?	0
240145	6892	82166	Which is the best way to control anger?	What should I do for controlling anger?	1
240146	351903	351904	After destroying the ring, why does Frodo leave Middle Earth?	The Lord of the Rings (creative franchise): Were Frodo and Sam gay?	0
240147	351905	351906	Interracial Dating and Relationships: Why do some white guys like Korean girls?	Interracial Dating and Relationships: Why do some white guys like Asian girls?	0
240148	351907	15559	What is the difference between mass and weight? How do you measure each?	What I s the difference between mass and weight?	1
240149	351908	351909	Who has the larger fan following: Salman Khan or Shahrukh Khan?	Why do Salman Khan fans and Shahrukh Khan fans always fight?	0
240150	190013	351910	Are women on average really smarter than men?	Are there any examples of the chord progression in Pachelbel's Canon in D before Pachelbel?	0
240151	351911	351912	What were your most important tattoo apprentice lessons?	Is it benficial to make carrer in big hadoop?	0
240152	73252	351913	What is the process for a Leave Request from the US Army?	Could a 26-year-old man migrate to the USA, become a citizen, and join the US Army as a soldier? If yes, what would be the processes he should take?	0
240153	351914	351915	Can family members living with a convicted felon own and keep guns in their home?	Why does the average gun owner in the United States own 8 guns?	0
240154	351916	27998	"My iPhone is filled up by pictures but they get automatically imported in my ""Photos"" on my Mac. Will they stay there if I delete them on my phone?"	How can I delete photos from my iPhone but keep them in iCloud?	0
240155	351917	49954	How do anyone learn something?	How can I learn something?	1
240156	127122	351918	What do you think of India's win in the Kabaddi world cup?	How do you feel about India winning kabaddi world cup?	1
240157	43898	6802	What is the best way of improving spoken English?	What is the best way or resources to learn english like a native speakers?	1
240158	46022	21896	Have Ancient Akkadians been scientifically tested?	Have the Ancient Chaldeans been scientifically tested?	1
240159	115237	90871	Can anime exist in a parallel universe and can we visit them far in the future or in the afterlife?	I been seeing some questions on Quora and Yahoo that anime might exist in another parallel universe so is it true?	1
240160	206437	351919	What is it like flying from Bangkok to Manila and how are these touristic cities compared to Hyderabad?	What is it like flying from Bangkok to Manila and how are these touristic cities compared to Chengdu?	0
240161	351920	351921	Why are the yeezy boosts so popular?	How do I get a pair of Yeezy 350 boosts?	0
240162	351922	266402	What is that one thing that you regret in your life?	What's the one thing you regret most in life? 	1
240163	351923	351924	My car is running low on coolant, would just adding the right coolant without flushing it hurt my car?	My car's coolant runs out every day. What could the problem be?	0
240164	277144	351925	If birds had Quora, what kind of questions would they ask?	If lions had Quora, what kind of questions would they ask?	0
240165	25994	85443	How can I gain weight on my body?	How do I gain weight fast but still be healthy?	1
240166	351926	351927	What are some of the best time pass movies?	What are some Hollywood movies that you love to watch again and again?	0
240167	310604	351928	Can CRISPR/CAS9 be used instead of restriction enzymes to cut DNA sequences?	Why is mRNA fed into the CRISPR Cas9 system and not DNA?	0
240168	94053	46957	How do I find Best SEO Company in Delhi?	Which is the Best SEO Company in Delhi for Digital Marketing Services?	1
240169	351929	351930	What is it like to own and/or manage a movie theater?	Why would you want to own an independent movie theater?	1
240170	351931	351932	What does it feel like to want to have kids but not be able to?	What is it like not to want kids but have one anyway?	0
240171	151773	351933	What is the easiest way to email bomb someone?	Can someone who works for the government hack my iPhone and gain full access to all my personal data just by knowing my email address?	0
240172	351934	351935	How do I conduct a usability test?	How do I perform a usability test?	0
240173	351936	266809	Is there any relation between the gravity and viscosity?	Why does the viscosity of liquids decrease with increasing temperature, while that of gases increases with increasing temperature?	0
240174	351937	316097	Where can I download the mp3 of Sia's Cheap Thrills for free?	What is the best way to download a YouTube video over 20 minutes into MP3 format (not copyrighted)?	0
240175	351938	351939	If I save money in form of gold for the long term, what are its effects?	How can I take advantage of meeting new people every day while I am driving for Uber?	0
