id	qid1	qid2	question1	question2	is_duplicate
159000	248281	248282	What are some live conversation websites?	How many times can I apply for an Indian scholarship for an MBBS course?	0
159001	248283	248284	How can I be a great public speaker?	How can I learn to be a great public speaker?	1
159002	225619	248285	I am red-green colourblind. I have applied for the post of Aircraft Maintenance engineer in Air India. Will I be rejected during medical checkup?	How yo write a code for image priveiew before upload in php?	0
159003	223589	30673	What should I do if I forgot my password for Instagram and used a fake email to make my account?	How can I hack my instagram account if I don't remember the email that I used to sign up for the account with?	1
159004	248286	248287	Why doesn't a guy want to talk to me just because I refused to give away my number?	Why do I feel like a failure because my wife doesn't want to have sex?	0
159005	622	248288	What are some unwritten rules in USA?	What are the unwritten rules?	0
159006	248289	248290	What is the best way to forget a girl I had a crush?	How do I forget this girl I had a crush on for 4 years?	1
159007	248291	248292	Does an Apple Airport Extreme need to be connected to an ethernet cord if a wireless network already exists in a home?	In order to print wirelessly using Apple's airport express, do I need a wifi-ready printer?	0
159008	2723	248293	I am a Portuguese national and I want to move to Norway. Is it possible?	I want to become a surgeon, but I do not think that I am smart. I moved to the US five years ago and my English stinks. Will it still be possible?	0
159009	248294	248295	Is Donald Trump really going to be the president of United States?	Do you think Donald Trump could conceivably be the next President of the United States?	1
159010	248296	248297	How does the endocrine system interact with the environment to regulate behavior?	How does the endocrine system interact with the environment to regulate behaviour?	1
159011	248298	147373	What are some of the best jojoba oil brands that can be used to reduce hair fall?	Has anyone had any success using onion juice to regrow their hair?	0
159012	248299	248300	Is there any case when the disease was cured with the use of only medicines?	Cloud computing disadvantages in business?	0
159013	248301	248302	How does a plasma screen work?	How plasma monitor work?	1
159014	143278	127799	What are some mind-blowing facts about Area 51?	What's really in area 51? What are they hiding?	1
159015	174463	206821	What does full-stack developer mean?	What is the meaning of full stack development?	0
159016	10590	29960	Should India go for another war with Pakistan?	Should India go through war with Pakistan?	1
159017	248303	64539	What could be wrong if my ears randomly get hot and red (for longer than an hour) if I'm not embarrassed or otherwise emotionally triggered?	Why do my brother's ears get hot and red sometimes suddenly?	0
159018	248304	248305	Can a 17 year old and a 16 year old get married?	Can a 17 year old marry a 21 year old?	0
159019	248306	248307	What would happen if an astronaut or cosmonaut were to suffer from appendicitis aboard the ISS?	What happens if an astronaut were to be in a life threatening medical emergency on ISS?	1
159020	248308	110043	What can an individual or a family or a business in the Cocos Islands do today to prepare and adapt for the coming impacts of climate change?	What can an individual or a family or a business in Egypt do today to prepare and adapt for the coming impacts of climate change?	0
159021	248309	248310	Which android phone is better?	Why is an iPhone better than an Android phone?	0
159022	248311	248312	Was the movie Drishyam inspired by a real life event?	Was the movie Buried based off or inspired by any real events?	0
159023	248313	23124	Why are there two sexes?	What is importance of sex in life?	0
159024	248314	248315	How is funneling effect accounted in a simplified method of calculating wind load pressure on ENS?	Who's most hot perfomers of Hollywood pop singers?	0
159025	127014	248316	What are First World, Second World and Third World countries?	Is Cambodia considered a third world country?	0
159026	248317	248318	In Star Wars, how many planets did the Galactic empire control at its greatest extent?	Why do people in the West today suddenly think they know better than literally everyone else who has lived before on the existence of God?	0
159027	248319	248320	Which country is the least intolerant towards criticism?	Can this be the most viewed question on Quora?	0
159028	248321	248322	"How did the term ""Blue Blood"" come about?"	If a person has blue blood what happens?	0
159029	248323	248324	How can you prevent sebaceous cysts on your labia?	What are some causes of sebaceous cysts on a labia?	0
159030	248325	248326	How do I stop focusing on what I don't have?	How do I stop focusing on the ‘wrong things’?	0
159031	248327	234191	How should I prepare for JEE Mains 2017 for the time left?	How do I prepare for jee mains in 2017?	1
159032	524	248328	Where do I publish my paper?	If I have a research paper how and where can I publish it?	1
159033	248329	248330	What is intellectual infiltration?	Gratien Bonheur: How is it similar to a Ducon Lajoie?	0
159034	237942	55702	How can I develop my profile to apply to top 20 global B-schools?	How should I build my profile for top business schools?	1
159035	248331	248332	What organs are located in the peritoneal cavity? What function do they serve?	How would an alternative universe need to be built so that crashing into a wall at 400 m/s wouldn't pulverize a human being?	0
159036	248333	248334	What is the best marketing tip in the world?	What is your best marketing tip?	0
159037	248335	248336	How do you spend your time at office if you don't have anything to work on?	How can you use your free time while you are at work?	0
159038	248337	248338	Why is Windows 10 lagging?	What is Windows 10?	0
159039	248339	43520	What did Nostradamus predict about China?	What are the predictions made by Nostradamus about India?	0
159040	248340	248341	How can I outshine my competitors in studies in school?	I'm looking for a good accredited research University, that I can attend Online for a masters in Marketing any ideas?	0
159041	248342	248343	Can all cheetahs run as fast as 60 - 70mph?	What is the way to use tallow balm to get better result?	0
159042	181491	69985	Will Donald Trump be the next US President?	What are the chances that Donald Trump will be the next US president?	1
159043	248344	248345	How ot use bootstrap framework in Java?	What time of year is it best to visit Kazakhstan?	0
159044	39158	248346	How do I leave an abusive relationship?	How does one get out of an abusive relationship?	1
159045	207852	248347	Could Sweden become next target for terrorism?	Basic task of data acquisition in ei?	0
159046	24260	64335	How we start preparation for IAS?	How should I start the preparations for IAS?	1
159047	248348	248349	What are fields for specialization after MBBS? Some of the best fields which has higher salary?	What are fields for specialization after mbbs? Some best fields which has higher salary?	1
159048	30047	42586	I have an untreatable and life-long disabling neurological disease. What is the easiest and most painless way I can commit suicide?	What is the most painless and quick way to die?	1
159049	29095	248350	Why do some people still use Windows laptops when they can afford a MacBook?	What are the main reasons why people don't switch from Windows PCs to Mac?	0
159050	105219	248351	Where's the cheapest place to buy land in the U.S., and how much is it per acre?	Why is so much chicken consumed in the U.S.?	0
159051	198385	248352	Why is hcl soluble in water?	Is iodine soluble in water?	0
159052	248353	248354	Would I qualify as NRI if 75 days I was in US on Business Visa (salary from India) and 120 days after getting work permit (salary from US) in same FY?	I am getting a H1B1 visa and will be in the US for more than 30 days before I start work. Am I allowed to enter the US on a H1B1 visa if I leave the country soon after but without starting work yet?	0
159053	19144	6894	How do I reset a Gmail password?	How do I reset a Gmail password by email?	0
159054	248355	248356	"What is the best ""Thug Life"" incident of your life?"	What are the best thug life moments of your life?	1
159055	248357	248358	Is Donald Trump a danger to the human race?	Is Donald Trump dangerous?	1
159056	248359	248360	What are you tired of?	What are you sick and tired of?	1
159057	29487	248361	What Quora users have the highest ratio of answers to followers?	Which Quora user (who has at least one answer) has the highest followers to answers ratio?	1
159058	248362	208937	What is the best thing you have ever eaten?	What is the most delicious meal you've ever eaten?	1
159059	122055	32257	What principle makes the EM drive work?	Do EM Drives actually work?	1
159060	6606	248363	What are strange souvenirs for in Pokemon Sun and Moon games?	Do you think there will ever be paid DLC for Pokémon Sun and Moon?	0
159061	248364	248365	Has anyone used sendmoney24.com to transfer money before?	Has anyone used sendmoney24.com to transfer money?	1
159062	248366	248367	How does Levaquin treat strep throat?	Does Levaquin treat strep throat?	1
159063	3260	66930	How can I build traffic for my website?	How do I build traffic to my website?	1
159064	248368	248369	What is a suggested diet chart for an Indian to lose weight at 3 kgs per month?	"I am a 30 year old woman and weigh 109 kgs at 5'3"" height. I am Indian and follow a vegetarian diet. I suffer from several symptoms of PCOS and am pre-diabetic but cannot afford a doctor because I am unemployed. What are some easy to follow detailed meal plans for me to lose 5 kgs per month?"	0
159065	248370	248371	What amazes you about Rahul Dravid?	What are some mind-blowing facts about Rahul Dravid?	1
159066	248372	248373	What is the best specialization in petroleum engineering after B.Tech.?	I am currently pursuing B.Tech 2nd year in electrical engineering from Sastra university.What are the best options for me after my B.tech?	0
159067	113931	248374	Is it possible to cross breed humans with any of the mammal?	Can humans cross breed wit other mammals?	1
159068	248375	248376	Events (leisure): What's the difference between a conference, a trade show, and a convention?	Events (leisure): What are the major engineering trade shows in the US?	0
159069	248377	248378	Which post is better in stenographer and office assistant?	Which post is better in stenographer and office assistant in uppcl?	0
159070	248379	248380	What is your most memorable cultural shock?	What is your biggest cultural shock and realization from visiting China?	0
159071	248381	248382	Which one is better: ME computer or Bcom?	What you learn from doing b.com?	0
159072	248383	248384	Do people hate Hitler? Why?	Why does people hate hitler?	1
159073	248385	248386	Why does water will not come when e drill the hole in capillary tube?	How do I get job while working?	0
159074	248387	248388	How good is the Narsee Monjee integrated course of engineering in Mbabane?	How good is engineering in Narsee Monjee?	0
159075	248389	248390	"How is ""academic politics"" different at MIT compared with other universities?"	"How is ""academic politics"" different at Princeton compared with other universities?"	0
159076	248391	248392	What is the topic wise weightage given to each section of HAS?	What is the topic wise weightage given in each section of CAT2015?	0
159077	248393	248394	What is a good online job for a 15 year old?	What are the best online jobs for a 15 year old?	1
159078	119839	248395	What's the point of living, when eventually we are going to die?	What is the point of living when were all going to die?	1
159079	248396	178840	How can I poke someone on Facebook?	What does a poke mean on Facebook?	0
159080	248397	139514	What are some good tips on getting along well with kids?	What are some good automotive hacks and tips?	0
159081	146210	248398	What is the most regretful thing done by you in your life?	What is the one thing you will never regret in your life?	0
159082	248399	248400	Is there any app which can store internet in our device from WiFi and we can use it later when we are offline?	Is it possible to store Internet data in our device during WiFi, to use it later?	1
159083	248401	248402	Who is the leading General in coup against Turkey Government?	If the Turkey military coup fails, will all military leaders responsible be executed?	0
159084	145929	198308	Is iwantmyname.com reliable?	Is iamtexan.com reliable?	0
159085	248403	248404	Is Kapil Sharma on Quora?	Is Kapil Sharma married?	0
159086	4017	2920	How is replacing 1000 rs notes with 2000 rs notes going to make black money hoarding a lot harder?	How does banning 500 & 1000 rupee notes solve black money problem?	1
159087	248405	248406	I'm a student who knows general concept of JAVA, I want to be junior Java developer or Android developer, my question is which one has more job opportunity in California and can shortcut to get good job?	I am an automation engineer, but want to be a Java developer. Which job is more stressful and which one is more fruitful?	0
159088	248407	248408	How can I record a song that sounds like a professional?	What are the best sound recording studios in India?	0
159089	172163	182153	What are some things I can do to become more self-aware?	How can I become more self aware?	1
159090	248409	248410	How can I develop my intuition?	How does one develop intuition?	1
159091	248411	248412	How can I sell my software to Iran online?	Who are the key decision makers in a bank or a credit union for IT software platform (account process, etc.)? Is it the CEO or the CIO?	0
159092	248413	158724	Why is the color of the sea blue?	Why is the sea blue?	1
159093	248414	248415	Your or yours? Which one is correct?	Which is correct marm or ma’am?	0
159094	248416	248417	How do I choose a mobile data option between 2g and 3g in Apple iOS 8.1.2?	What is 2g/3g voice call?	0
159095	248418	248419	What is the best Spanish-speaking country to live in?	Which Nordic country is best to live in?	0
159096	248420	248421	Is there a spa in Bangalore where guys do body massages to women?	Where can I get ayurvedic body massages by females in Bangalore?	0
159097	248422	248423	Why do people feel sorry for other people?	Why do people feel sorry for themselves?	0
159098	248424	184227	Were there 7 Horcruxes -- not 6 as Dumbledore intimated to Harry? If so, does this mean that Voldemort had an 8-part soul?	When Harry was a baby, Voldemort tried to murder him which resulted in what would have killed him if he didn't have Horcruxes. Wouldn't this mean that he would have had to use one of his Horcruxes to stay alive?	0
159099	90615	13714	How do I stop my Chihuahua from biting my shoes?	How do you stop your Beagle/Pointer mix puppy from biting your shoes?	1
159100	248425	155476	Where can I find English-dubbed episodes of the series Aria?	Where can I download Agents of S.H.I.E.L.D. season 2 complete 1080p (From Torrent in between 12-15 GB)?	0
159101	248426	248427	Is Telegram more popular than WhatsApp?	Is Telegram messenger secure? Is it more secure than WhatsApp?	0
159102	248428	248429	If my father is Russian am I part Asian?	Are Russians considered Asian?	0
159103	41063	59487	What is the natural way to increase height at age of 20?	What is the effective way to get taller at age of 20?	1
159104	248430	246058	What is actually happening when (biased) news reported Obama is giving away the internet?	Should Obama give away the Internet?	1
159105	23230	23109	Why is Saltwater taffy candy imported in Switzerland?	Why is Saltwater taffy candy imported in Germany?	1
159106	48137	44968	Who are some most followed/popular writer in Quora?	Who are the people with the most followers on Quora?	1
159107	248431	248432	I have an audition tomorrow for a commercial. How can I sound confident and normal, without being fake. Do you think I should learn the script?	Once I took the credits I need in a Junior College for transferring to a university associated to the JC, Do I have more chances to be accepted?	0
159108	15004	16666	How do I get addmision in MIT?	What do I need to do to get into MIT?	1
159109	248433	248434	Why does plastic surgery go wrong so often and look so strange?	What does the average woman look like without photoshop and plastic surgery?	0
159110	248435	20952	What is the difference between first copy and original watches?	What is the difference between first copy and duplicate watches?	0
159111	248436	248437	How do objective and subjective claims differ?	What is an objective claim, and how does it differ from a subjective claim?	1
159112	83628	11797	"Why do I see questions with basic grammatical mistakes on Quora but some of my questions are marked as ""needing improvement""?"	Can Quora quote the improvements needed in the questions when it is marked as 'Needing Improvement'?	1
159113	248438	248439	No product market fit: change product or market first?	What is product market fit?	0
159114	105247	107981	How much money do female fashion bloggers in India make?	How much money does an Olacab or Uber driver make in India?	0
159115	228362	248440	How do I get a scholarship to study abroad?	Which exams can I take to get a scholarship for studying abroad?	0
159116	248441	248442	Should I stay friends with my ex even though I have been hurt repeatedly?	Should I be friends with my ex-girlfriend?	0
159117	248443	248444	On news channels like CNN or cable networks like CNBC, Bloomberg, etc., do the guests/experts who are invited to talk or respond to questions get paid? If so, typically how much?	Do guests on Fox News get paid for their appearances?	0
159118	248445	248446	Which is the best website to meet Indian women for sexting?	Do you like sex with condom or without condom?	0
159119	14840	248447	What is the best passive investment strategy?	What are the best strategies for stock market investing?	0
159120	83003	214655	What are some ideas of a new business with low investment to start in India?	Entrepreneurship in India: Any new Business ideas with lesser investment?	1
159121	248448	38776	How do you restore a deleted Gmail account?	How can I recover my Gmail password without a recovery phone number or email?	0
159122	248449	248450	How is the toluene's specific gravity determined?	How is toluene specific gravity determined?	0
159123	248451	248452	Is it true that B positive blood people should not eat groundnuts?	People always say it's useless to eat breakfast after 9 am. Is it true?	0
159124	130898	248453	Where do I catch Exeggcute in Pokémon Go?	Where do I catch a Staryu in Pokémon GO?	0
159125	33521	44306	What are the differences between Chinese culture and western culture?	#What are the major differences between Chinese and western cultures?	1
159126	4628	5298	What's the best method to control anger?	How do I control my emotions and anger?	1
159127	20332	12965	What will be the impacts of gst on our economy?	How can the GST bill, passed by the Rajyasabha yesterday, boost the Indian economy?	1
159128	248454	248455	How does the HP OfficeJet 4620 Airprint compare to the HP Color LaserJet Enterprise M553dn?	How does the HP OfficeJet 4620 Airprint compare to the HP Color LaserJet Enterprise M750dn?	1
159129	248456	248457	Who is the best vascular surgeon?	Who is the best vascular surgeon in the bangalore?	0
159130	248458	248459	Where can I get Yojana Magazine in a bookstore around Chennai?	What is Yojana magazine?	0
159131	248460	212676	Why is champagne synonymous with celebrations?	Why is champagne used for celebration?	1
159132	248461	248462	What is the best way to fulfill my dreams?	What should I do to fulfill my dream?	1
159133	248463	248464	What is mean of nifty tells about Balaji Vishwanathan?	What's it like to work at Kratos Defense & Security for your first job?	0
159134	248465	248466	What would happen if America got in another civil war?	What event would have to happen for the United States to have another Civil War or Revolution?	1
159135	248467	248468	How many Special Forces soldiers does Russia have?	How many Special Forces soldiers does China have?	0
159136	248469	248470	Who became a billionaire in the shortest amount of time?	Which people became the fastest billionaires in the shortest amount of time?	1
159137	248471	248472	What is this bug?	What's this bug called?	0
159138	20826	47507	How do I start preparing for civil services?	How do I start preparing for UPSC exam?	1
159139	248473	248474	Which hair wax is better - Ustraa or Beardo?	Do people usually mortgage houses in the US?	0
159140	248475	248476	How can I find the filings data of a Singapore based company?	Is liking someone a waste of time?	0
159141	189329	248477	Are people answering on Quora lonely and/ or unemployed?	Is Quora full of lonely and unemployed people?	1
159142	248478	248479	Which is better LTPS LCD or IPS LCD?	Is an IPS LCD costlier than AMOLED?	0
159143	248480	248481	When was the first video game created?	I complete by bachelor in mass communicatio degree.cani join UPSC exam.is my degree syllabus similar to UPSC optional subject?	0
159144	248482	248483	What is the best way to get rid of pimples for teenagers?	What are the best ways to get rid of acne, especially for teenagers?	1
159145	248484	248485	How do you update your phone number on Uber?	What third party api OLA and UBER is using for disguised phone number technology in India?	0
159146	248486	248487	How data block size, page size are related to file system? Please read the details	How does meditation help to raise consciousness?	0
159147	248488	248489	Which website provides best premium resume models/layout with free download?	Which is the best free website builder with some good themes for Resumes and CVs?	0
159148	100680	248490	Islam: Islam forbids Muslim women from marrying non-muslims, but Muslim men may marry any woman who follows a unitarian or monotheistic religion.  Why?	Non Muslims: Do any of you feel Islam is the only true religion?	0
159149	248491	248492	How do I read faster and more books?	How do I read faster while still enjoying a book?	1
159150	248493	248494	Is it okay to be able to feel my cervix?	After having a baby, will I be able to feel my cervix?	0
159151	248495	248496	How does an employer know the uan number?	Can an employer know about my UAN number?	1
159152	248497	248498	Is Ian McKellen in any of the Harry Potter films?	Did Ian McKellen audition for any of the Harry Potter films?	0
159153	248499	248500	Are there Gay, Lesbian or transgender superheroes?	Why are there no gay superheroes?	1
159154	55877	248501	What are some good reads on digital marketing?	Which are best books on digital marketing?	1
159155	52331	1931	What is the trick to maintaining long distance relationships?	How does a long distance relationship work?	1
159156	248502	248503	If I am bleeding from hemorrhoids, would it cause bacterial infection if my partner soothes me by licking the site of bleeding?	Can I get rabies if a dog bites me but there is no bleeding and the skin doesn't break?	0
159157	248504	248505	How can I tell the difference between button-up shirts that are meant to be worn tucked in, untucked, or either way?	What's the best way to hide an untucked shirt when required to keep it tucked in, such as at a boarding school?	0
159158	248506	248507	What is the toughest part of learning Android app development for a beginner?	What are the downsides of republishing older content on Medium?	0
159159	248508	248509	How are living things and non living things interdependent?	What are living things and non-living things?	0
159160	248510	248511	What were the origins of the Balkan Wars?	What triggered the Balkan Wars?	1
159161	248512	248513	How do I become a successful real estate agent?	What are the characteristics of a successful real estate agent?	0
159162	235999	248514	How do you invest $1000?	How do I invest 1000$?	1
159163	29460	85270	How would you teach your 2 year old to swim?	Who need to teach children swim?	1
159164	52282	248515	How do I change my SBI register mobile number?	How do I add my UK mobile number to SBI NRE/NRO account?	0
159165	248516	248517	I have designed an e-reader and it can be manufactured within Rs 3000. Do Indians buy e-readers? If so, what are the numbers?	Do you need a dictionary tool in your e-reader?	0
159166	248518	248519	What is the gap for a Champion Spark Plug RJ19LM?	Where can I get deals on Bosch Iridium spark plugs?	0
159167	248520	248521	How much are participants on Survivor compensated?	"The winner of the TV show ""Survivor"" wins $1 million dollars. Are the other contestants compensated in any way for enduring 39 days of agony?"	0
159168	248522	248523	How are Pakistan people responding towards the non state actors who are bringing shame to their country?	Are there militias in Pakistan to take out the extremists like in Colombia, given how many people who lost family due to terrorism in the country?	0
159169	248524	248525	"What's your opinion about the filming of popular tamil song "" ஆத்தாடி பாவாடை காத்தாட""? Isn't that a violence against women?"	What is the opinion of Muslim women wearing a hijab/burqa about other Muslim women who don't?	0
159170	248526	248527	What are the best exercises to improve the sculpt your butt?	What are the best exercises to improve your balance sculpt and your butt?	1
159171	248528	248529	What CMS does Hillaryclinton.com use?	What CMS does Made.com use?	0
159172	248530	5340	What would happen if I masturbate daily?	What are the side effects (positive and negative), if any, of masturbation?	0
159173	198100	197966	What is the difference between Chinese and American education?	What is the difference between Chinese education and American education?	1
