id	qid1	qid2	question1	question2	is_duplicate
372175	502870	502871	Which is a better: the Symbiosis Institute of Technology or the Bharati Vidyapeeth College of Engineering?	Is Symbiosis Institute Of Technology a good institute for engineering (CS/IT) ? How is the placements there?	0
372176	163934	33933	What is the penalty for driving without a license in Alabama, how do they compare to the penalties in Maryland?	What is the penalty for driving without a license in Alabama, how do they compare to the penalties in Washington?	0
372177	502872	502873	What is the best online dictionary that shows where the stressed syllable is in a word?	Why do so many people ask what words rhyme with X when all they have to do is consult an online rhyming dictionary?	0
372178	502874	40405	What books or resources can I read to learn tape reading?	Where can I get online PDF or EPUB versions of books?	0
372179	107752	56068	How do I overcome my anger problem?	How can I manage my anger issues?	1
372180	502875	502876	What do coffee cherries taste like?	Does coffee hurt your palate for wine tasting?	0
372181	161213	64312	"Why was Odysseus considered a good leader in ""The Odyssey""?"	"In the book ""The Odyssey"", is Odysseus considered a good leader?"	0
372182	121469	8134	What is the most embarrassing thing you have done in front of your crush?	What is the most embarrassing moment your crush had in front of you?	1
372183	502877	502878	Do I need to get NOC from Kolkata if I need to bring my West Bengal registered car to Bangalore for 6-8 months? I will be back after that time?	Do I need to get NOC from Kolkata if I need to bring my West Bengal registered car to Bangalore for 6-8 months? I will be back after that time	1
372184	502879	202711	Does the IP address belong to the SIM card or to the mobile IMEI number?	Can I known mobile imei through mobile number?	0
372185	502880	502881	Where can one purchase Michele Watch bands?	Where can I purchase a 100% tungsten (not tungsten carbide) wedding band?	0
372186	66955	67546	Should people over 89 not be allowed to vote?	Should people over 87 not be allowed to vote?	1
372187	502882	233685	What are the main competitors of Quora?	Who are Quora's top 3 competitors?	0
372188	502883	502884	What is it like to be the parent of a psychopath?	What is it like to have psychopathic parents?	0
372189	189720	502885	What is it like to live in Istanbul, Turkey?	What is it like living in Istanbul, Turkey? Is it expensive?	1
372190	502886	502887	Can I use VR headset for Moto M?	Is my paragraph too disjointed?	0
372191	502888	502889	What are the institutes in India to learn mountaineering?	Where can I find the best Mountaineering and trekking institutes in India?	0
372192	131688	237969	Which books are essential for GMAT exam preparation?	Which book should I prefer for GMAT preparation?	1
372193	3374	3575	How do I delete a question from Quora?	How do I delete my question from Quora?	1
372194	502890	502891	Will the black money be brought back?	How is black money brought back?	0
372195	239868	102325	What are the best additional courses for working mechanical engineers?	What is the best programs for mechanical engineerings?	1
372196	502892	502893	What are those French hats called?	What are those French artist hats called?	0
372197	163630	502894	Is it legal for a campaign to work together covertly with DNC to ensure their cadidate has every possible advantage during nominations process?	Holidays for startup teams. Is it possible for startup teams to do working holidays together?	0
372198	121174	263106	What can be done to overcome the fear of flying?	How can I overcome the fear of flying things?	1
372199	301317	423748	Where is the best place to take a vacation in the winter?	What is the best place I should visit in the winter?	1
372200	502895	502896	What is the moral of the Rostam and Sohrab story?	"What is the moral behind ""The Hare And The Tortoise"" story?"	0
372201	4753	36797	How did Donald trump win the elections?	How did trump win the presidential election?	1
372202	502897	502898	Why did the Greeks call themselves Romans?	Why did the Greeks call themselves Romans in the Middle Ages and until recently and their language as well?	1
372203	148245	270370	Do jellyfish change color?	How do jellyfish change color?	0
372204	84613	502899	How does the energy of electromagnetic waves change as the wavelength of the waves decrease?	How does the amplitude of a wave change if the energy of the wave is increased?	0
372205	502900	242162	Why does my cat sit on the laptop keyboard while I am using it?	What would happen if I would lick a cat?	0
372206	277902	502901	Which is the best biology book?	Which book is best biology book for 11?	0
372207	162384	502902	How often do you lose your car keys?	What are the steps you take after you lose your car keys?	0
372208	502903	502904	What do you do to keep yourself motivated and interested in your work, at times when you lose hopes?	Learn exchange trade?	0
372209	502905	502906	What is SEO audit report?	What is a SEO audit report?	1
372210	146104	106623	I am a 17-year-old. Can I apply for a PAN card?	What are the essentials to apply for PAN Card?	0
372211	502907	502908	What is the equation for sodium bicarbonate and acetic acid?	How can you determine formation of acetic acid in a equation?	0
372212	502909	502910	What's the better app for beginner mindfulness and meditation, Simple Habit or Calm?	How do I begin learning to meditate if my mind never seems to calm down?	0
372213	502911	491041	Do you lie ok?	Is it ok to lie?	0
372214	502912	502913	Why isn't King Salman listed as the richest man alive? His oil company, Saudi Aramco, is worth at least 1.4 trillion in assets.	Who is the richest Telugu man?	0
372215	502914	502915	Why wasn't there any new powerful nation born out from Mediterranean region again? Could one day Greece  become the most powerful nation in the Eu?	Which nations in the EU don't approve of Turkey joining the EU?	0
372216	502916	502917	What kind of pepper is this?	What kind of peppers are there?	0
372217	294722	421524	What are the major human caused threats to biodiversity? How can we solve this threats?	How can human activities have an effect on biodiversity?	1
372218	36461	18379	Who viewed my profile on Instagram?	Who views Instagram?	1
372219	502918	206666	What makes an Indian girl beautiful?	What makes an Indian girl more beautiful?	1
372220	502919	502920	How do you know when you're in the wrong relationship?	How do you know you are in a wrong relationship?	1
372221	471646	491941	I've lost my mobile phone with Airtel postpaid SIM card. I haven't deactivated the SIM card, and the person who stole my phone is still using my SIM card. Is there any way to trace the SIM card and get my phone back?	I have lost my phone, so I deactivated the SIM-card. How can I delete my WhatsApp account?	0
372222	502921	30782	Facebook like button that sends to another page?	How can you look at someone's private Instagram account without following them?	0
372223	356388	406056	Can we reverse time?	Is it possible to reverse time?	1
372224	502922	502923	I have a crush on my best friend. What should I do?	What do I do if I have a crush on one of my best friends?	1
372225	502924	502925	Phillips trimmer with high battery backup?	It's been 9 months since I got my apendix removed (laproroscopic) why does it hurt when I do sit ups?	0
372226	502926	123210	What do consulting companies really do?	What do consultants do?	0
372227	502927	502928	What happens if your PayPal account goes into negative balance for any reason?	What is a Level 2 security breach on my PayPal account	0
372228	502929	502930	What can you mix with Pinnacle Whipped Vodka?	What mixes well with Pinnacle Whipped Vodka?	1
372229	502931	502932	Why would a civilian living peacefully need a semi-automatic gun?	Can I bring a semi automatic rifle while hunting?	0
372230	502933	502934	What is the best way to wash satin sheets?	What are the best ways to wash satin sheets?	1
372231	502935	502936	How much did an ounce of weed cost in 2000?	To go through a half ounce of weed, how much time would an average pot smoker need?	0
372232	82868	102902	When is the world going to the end?	Is the world really going to end? If so, then how will it end?	1
372233	502937	502938	What's your favorite swear word?	How do I get rid of my habit of using swear words?	0
372234	502939	502940	How can you manipulate your girlfriend's mind?	What is mind set when your girlfriend married and also you are jobless?	0
372235	24296	1886	How do I earn money online?	How can I earn money on internet?	1
372236	502941	502942	Can I get 10points in class 10 even if I got 10 and 9 poits in fa-1and2and got 9.4 in sa-1?	Which other sites can be used instead of torrents?	0
372237	267900	502943	What are the best software tools for structural engineers?	What are some of the best companies for structural engineers?	0
372238	142229	207365	What are the scopes of biotechnology?	What is scope in biotechnology?	1
372239	108225	502944	What are some things new employees should know going into their first day at Worldwide Resources?	What are some things new employees should know going into their first day at NCR?	0
372240	502945	502946	What are some really good movies I should check out?	What are some really good films?	1
372241	502947	502948	If you had access to all the data in the world since the dawn of mankind, what would you do, which hypotheses would you test?	Who in history of mankind, has come the closest to conquering the world, and why did he fail?	0
372242	502949	502950	What are the most important subjects for preparing for the GATE? I am from an ECE branch.	What are the most important subjects for preparing GATE? Im from ECE branch	1
372243	100172	54440	Is it practically possible for two or more countries to merge into a single entity?	If two countries want to merge (both are willing), is it possible?	1
372244	399958	75354	Which is the best website where we can buy instagram followers and likes?	Who can view my likes on Instagram? Followers only or the Instagram public?	0
372245	502951	482524	Is it okay to wear fake shoes?	Why do people wear sport shoes with a formal dress?	0
372246	502952	502953	What are your funniest stories you've had in the Military?	What is your funniest story in the military?	1
372247	502954	502955	What is hashcode in Java?	What is a hashcode in Java?	1
372248	87649	221670	Who would win in a war, Quora or Yahoo answers?	If Yahoo Answers and Quora fought a war, who would win?	1
372249	502956	502957	What foods can I find in South Korea?	What foods are banned in South Korea?	0
372250	502958	502959	How effective is cocoa butter lotion for the face?	How is cocoa butter beneficial for the face?	1
372251	502960	502961	"What is meant by the term ""baseline activity of neuron”?"	Nominal GDP per capita growth to real GDP per capita growth?	0
372252	502962	502963	What are the technical skills required by a B.Tech graduate from EEE branch to get a good placement?	: What are the technical skills required by a B.Tech graduate from EEE branch to get a good placement?	1
372253	20765	502964	Can my husband trust me after I cheated?	Why do husbands cheat on their wives?	0
372254	502965	11858	My straight friend who knows I'm gay told another friend that he is not gay but has confusing feelings towards me. I like him too - what should I do?	I'm in love with my best friend. I'm gay; he's straight. What should I do?	0
372255	502966	502967	How popular is general Qasem Soleimani in Syria and Iraq?	Does the fact that Hilary Clinton being a woman cost her the Presidency?	0
372256	178180	502968	What is the most inspirational CAT Entrance Success story you ever heard?	What is the best inspiring story of a cricketer? And who is the most inspiring cricketer?	0
372257	29603	4394	Who will become the next CM of Gujarat?	Who will be next CM of Gujarat?	1
372258	227435	311516	How do I sell car to government?	What is the best way to sell a car?	0
372259	502969	502970	What could be a good name (Sanskrit or English) for a women clothing boutique?	What names seem to be popular for Indian clothes boutique?	0
372260	502971	502972	How should I write my interview assignment?	How can I improve my writing skills given that I don't get much time on a daily basis after working on my college assignments and side projects?	0
372261	502973	502974	How can I get rid of a cracking shoulder pain?	How do you get rid of shoulder pain?	0
372262	502975	138993	What is the business model of Pinterest?	How does Pinterest generate revenue? What is the company's business model?	0
372263	502976	5675	Gmail: How do I hack a Gmail account based on email I'd and get the chats information?	How do I hack a Gmail account of an unknown person?	1
372264	114818	36456	How do I overcome my depression and stress?	How should I overcome my depression?	1
372265	4950	21713	How come people on Quora ask questions here, when they can get them on Google and why is Quora just a question/answer site, will it expand?	Why do so many people ask questions on Quora instead of searching the answers on Wikipedia?	1
372266	80224	2675	What are the pros and <bold>cons</bold> of demonetizing Rs.500 and Rs.1000 notes?	What do you think of the decision by the Indian Government to demonetize 500 and 1000 rupee notes?	0
372267	52164	436457	What is the strangest thing that ever happened to you?	Whats the strangest experience you have ever had?	1
372268	502977	502978	What are some good books to learn calligraphy?	What are some good books to learn calligraphy from?	1
372269	224432	389621	How does a recruiting office make money?	How do recruiters make money?	1
372270	502979	502980	Are INTPs more complex or harder to understand than other MBTI types? If so, how?	Is it harder for INTP to show appreciation?	0
372271	11667	502981	How do we make friends?	How do I make friends on Youtube?	0
372272	120908	389514	What is best i5 6th or i5 7th gen?	What is best i5 6th or 7th gen?	1
372273	502982	502983	Who is better Flipkart, Amazon or Snapdeal in India for buying books?	Who is the CEO of Flipkart, Snapdeal and Amazon?	0
372274	502984	495825	What is best laptop cooling pads with sensors?	What is the best laptop cooling pad?	0
372275	406160	405641	What problems do you have when travelling abroad?	What kind of problems will you face when travelling abroad?	1
372276	502985	502986	"What does the phrase ""Suffering Succotash"" mean and what are its origins?"	"What is the origin of the phrase ""bust a nut""? What does it mean?"	0
372277	502987	502988	What is 1/infinity, 0 or infinitesimal?	What is 0/infinity?	0
372278	447152	502989	What happened to the Tirpitz after it was sunk and capsized in WWII?	How can I defeat the US Navy?	0
372279	502990	502991	What is best ipad app for real estate market in Estonia / Tallinn for real estate investor?	Where can young real estate developers find private equity investors in the competitive NYC market? What is the best way to pass the funding hurdle?	0
372280	502992	502993	What are those technical and non technical terms used in share market trading?	Where does the inorganic phosphate come from in the Electron Transport Chain? Are the Phosphorus and Oxygen consumed and synthesize in the body?	0
372281	74599	1248	Are there any other websites like Quora?	Is there any other website similar to Quora?	1
372282	35829	201980	What is a catalytic converter?	How do you clean a clogged catalytic converter?	0
372283	472978	502994	What are the functions of mitosis?	What are the functions and the purpose of mitosis?	0
372284	502995	502996	How many times a normal girl can have sex in a day?	What is wrong with me? Sometimes I wake up with extreme positivity and ambition and some other days I'm the most pessimistic depressed person.	0
372285	502997	502998	How can I add money to PayPal account?	How can I add money to PayPal?	1
372286	210337	177095	Where is the best place to learn how to make apps for iOS?	What are the best ways to learn an IOS?	1
372287	21552	27734	Can we pursue biotechnology after B.tech in mechanical engineering?	What is the best field for earning money after completing a B.Tech in mechanical engineering?	1
372288	502999	319690	Does the Stalkbook app work?	How does a summary app work?	0
372289	503000	503001	Do United Airline flights have power outlets at the seats?	How could SeatGuru collect hundreds of airlines' flight numbers and seat information?	0
372290	8428	60274	How will demonetization of ‎₹1000 and ‎₹500 notes will help curb the rampant black currency in India?	Would banning notes of denominations 500 and 1000 help to curb the black money in system?	1
372291	120025	503002	What is GST? How is it different from CST and VAT?	Do I have to register for vat or GST?	0
372292	503003	503004	Which software is better for interior design design - 3ds max or 3ds max design? Why?	What softwares do professional interior designers use?	0
372293	503005	503006	What happens if you don't drink enough water in a day?	What will happen if I don't eat for 3 days, just water?	0
372294	287446	464145	Why was Sundar Pichai chosen as the CEO of Google?	What do you think about Sundar Pichai becoming CEO of Google Inc?	1
372295	56643	503007	I am a blogger. I want to get huge traffic on my blog. What should I do?	I'm a blogger. Should I guest post on other blogs to get more traffic to my blog?	1
372296	503008	115235	Why do I always feel cold in the morning right after I wake up? What can I do to avoid this?	Why do a lot of people sneeze a lot after waking up in the morning?	0
372297	147618	503009	What is the difference between electrical devices and electronic devices?	What are some types of electronic devices? How do they differ among them?	0
372298	503010	503011	What happened when gate angle is greater than 90 in phase controlled rectifier?	Is there a servo dc motor that work with more angles between 0 and 90?	0
372299	503012	314663	What is it like to work in a start-up?	Is it good to work in a start up?	1
372300	503013	503014	How would you rate Obama’s presidency?	Cloud computing in business organizations?	0
372301	6171	59242	How can we earn money online without investment?	How does one earn money online without an investment from home?	1
372302	503015	503016	Why is it that these days, nearly all of the worlds powerhouses is in the northern hemisphere and not the Southern Hemisphere?	When it is spring in the northern hemisphere, what season is it in the southern hemisphere?	0
372303	503017	503018	How can I install an update in android 6?	How do I install updates in Android via PC?	0
372304	503019	503020	What do birds feel during earthquakes?	Why do birds fly from the tree during earthquake?	0
372305	239449	8358	Does Donald Trump still have a chance to become President of the United States?	Can Donald Trump win this Tuesday?	1
372306	503021	503022	"What are the use cases of ""sigaltstack"" system call in Linux?"	What are the use cases of mremap() system call on Linux Systems?	0
372307	289680	163070	Which is a good solar panel installation provider in Inglewood, California?	What is a good solar panel installation provider near Hollister, California CA?	0
372308	503023	503024	My concepts are clear I work hard but when I give mock test at aakash (medical 12thclass) I end up getting 340 ! Its very demotivating what to do?	Second number of mobile number does not start with?	0
372309	503025	503026	What was the most recent question asked on Quora?	What is the most-asked question (merged) on Quora?	0
372310	503027	503028	What is the scope of an ECE B.tech in India?	I am an ECE undergrad. All my CSE friends tease me that there is no scope for an ECE and I won't be able to earn half as much as them. Is it true? What scope is there for an ECE in India? Should I opt for higher studies abroad?	0
372311	503029	329868	Where can I find the trust name of my PF account?	How do I get my PF account number? If company refuse to give my PF number?	0
372312	160141	82018	What books should entrepreneurs read on entrepreneurship?	What are some of the best books about entrepreneurship?	1
372313	503030	503031	Why was my IP address blacklisted?	How do IP addresses get blacklisted?	0
372314	503032	503033	Can a metallurgical engineer appear for IES?	How big is Facebook ad platform?	0
372315	503034	503035	What are the softwares used to design logo?	What are the softwares you used to design logos as a freelancer?	0
372316	503036	503037	How can I be enthusiastic in work?	What I should do to be enthusiastic?	0
372317	503038	503039	What is it like for an Indian to live and settle in Denmark?	What is it like for an Indian to live in Denmark?	1
372318	232545	228366	Is there a way to make a down arrow on the keyboard?	How can I use old keyboards to make it useful?	0
372319	503040	503041	Can a restaurant sue ZOMATO for uploading photos and menu?	Why does zomato prefer menu in the form of images than listing on their website and app?	0
372320	356921	503042	What does it mean to you to live life to the fullest and enjoy? What do you do to accomplish this?	Why do we not live life to its fullest?	0
372321	503043	503044	What are the latest tools used in Digital Marketing?	Where can I find the latest digital marketing stats of 2016?	0
372322	503045	240654	Why would a high school senior choose MIT over Caltech?	Why would a high school senior choose Caltech over MIT?	0
372323	503046	503047	What would happen if the whole Earth got flooded?	What would happen if the whole earth was flooded?	1
372324	1977	35003	What would be a cool way to commit suicide?	What is the cheapest, painless, easiest way to commit suicide?	1
372325	503048	140996	Why are a majority of Jews secular in nature?	What do secular Jews believe in?	0
372326	503049	503050	What is the difference between 200-120 and 200-125 CCNA papers?	What's the logic behind the CCNA exam numbers? The current CCNAv3 exam number is 200-125, what do these numbers signify?	0
372327	16995	503051	How does Special K make you lose weight?	Does Kellogg's Special K cornflakes really help people lose weight in 2 weeks?	1
372328	72586	189255	How do you start to build an email list?	What is the best way to build an email list?	1
372329	503052	503053	"Why did Teodora wore a veil in ""La Leyenda de la Nahuala"" movie?"	"Why did Teodora wore a veil in ""La Leyenda de la Nahuala""?"	1
372330	287090	503054	What is the best way to get gold fish in Neko Atsume?	How come in Neko Atsume the auto set feature just messes up all my stuff?	0
372331	503055	503056	How does Warren Buffet research stocks?	Does Warren Buffet own penny stocks?	0
372332	231922	483307	What were the causes and effects of the Boxer Rebellion? How did it affect the Qing Dynasty?	What was the purpose of the Chinese Boxer Rebellion and what were its causes and effects?	1
372333	546	66484	What is the best way to get traffic on your website?	What is the best way to drive traffic to a website?	1
372334	503057	260092	What are the best business to start with 20 to 30 Lacs of investments?	What are the best businesses to start with 20 to 30 lacs of investment? In technology?	0
372335	503058	314292	Is 18 too late to learn programming?	Is 16 too late to get better at programming/CS?	0
372336	503059	503060	What are the typical deliverables or artifacts that are expected of an OD (organizational development) consultant?	My consulting firm is forcing me to over-bill a client. For example, we are billing Client A for time spent working on deliverables for Client B. I have reported this to my manager without success. What are my options?	0
372337	503061	503062	Has anyone done the Blended Masters SCM program with MIT? If so, what was your experience?	I got a B in a college course I took. How will the MIT undergraduate admissions see this?	0
372338	503063	334382	How do I determine train types in particular route?	How are train numbers allotted to Indian trains?	0
372339	503064	503065	What are some strangest stories of successful persons suffering from ADHD?	What advice would Awdhesh Singh like to give a 26 year old introvert suffering from ADHD with no aim or passion?	0
372340	489753	182830	What are some examples of suffixes used in sentences?	What are some examples of adjectives used in a sentence?	0
372341	280961	384882	What are some examples of covalent and ionic bonds?	What are some examples of ionic and covalent compounds?	1
372342	503066	120181	Is it safe to use honey in or near your eyes?	Is it true that honey is capable of changing your eye colour naturally?	0
372343	503067	503068	What is the difference between seabed and ocean crust?	What is the lithological difference between oceanic and continental crust?	0
372344	270405	286288	What can I do to become an investment banker?	How do I become an investment banker? What do they actually do?	0
372345	415501	512	Is there still hope in Narendra Modi's becoming the Prime Minister in the 2019 elections?	Can Narendra Modi become Prime Minister of India in 2019?	1
372346	388977	503069	Why do some Taiwanese hate Koreans (south)?	Is South Korean culture becoming less conservative?	0
372347	503070	503071	Is Ted Cruz a demagogue?	Is Ted Cruz a Dominionist?	0
372348	503072	503073	Which is easier to learn, programming for iOS vs. Android?	Which is easier to learn: programming for Android or programming for iOS?	1
372349	503074	503075	What are the best blogs about tools for web and graphic designers?	What are the best blogs about graphic design?	0
372350	503076	503077	What is it like to be a babysitter?	If you needed a babysitter what would you do?	0
372351	503078	503079	If the nucleus of a hydrogen atom is of the size of a spherical particle of radius 1 cm, how big the size of the atom will be?	Which has the largest atomic size: Br, Br- or Br+?	0
372352	165296	480999	Who would win a fight between a gorilla and a grizzly bear and why?	In a fight between a grizzly bear and a silverback gorilla, who would win?	1
