id	qid1	qid2	question1	question2	is_duplicate
305000	428336	96947	Is there any harm if I drink 180 ml of whisky at once in a week?	How do I get my husband to stop drinking?	0
305001	428337	428338	What factors to consider before purchasing playground equipments.?	What factors to consider before purchasing playground equipments?	1
305002	428339	428340	How does Ola arranges wifi in Premium taxis?	Who has the most power, President of the USA or the Queen of UK?	0
305003	373471	428341	What do these margin headings mean?	What does marginalized mean?	0
305004	428342	428343	What are some examples of forced convection?	What is forced convection? What are examples of this?	1
305005	428344	106370	What is the meaning of Hindi word 'Riti Rivaaz'?	"What does the Hindi word ""Baregama"" mean?"	0
305006	373486	30172	Is it possible to get over depression without medicine or therapy?	How do I overcome depression without psychiatric help?	1
305007	128858	370622	Why is time defined as a dimension?	How can time be a dimension?	1
305008	95355	97156	I have forgotten my password in Gmail account. What should I do? I need this account.	Computer Security: How is a Gmail password recovered?	1
305009	6978	93650	What are the best ways to improve my writing skills in English?	What are the best ways to improve my writing skills in English.?	1
305010	428345	51342	How do I approach a girl in confident way?	How do I get the confidence to talk to girls?	0
305011	29628	316379	Which bicycle should I buy under 10k?	Which is the best bike in in dia to buy in INR 10k?	1
305012	428346	2559	How can I lose weight as a teenager?	What are the best ways to lose weight?	0
305013	54361	28797	Is Spotify available in India?	Daniel Ek: When is Spotify coming to India?	1
305014	342913	428347	Why do you want to leave your current job?	Why do you want to quit your current job and how?	1
305015	253241	43798	Does creative visualization really work in helping people to achieve goals?	Law of Attraction: Does the concept of creative visualization really work?	1
305016	428348	428349	"What is the correct English translation of the Spanish phrase ""que cosa""?"	"What is the correct English translation for the Spanish phrase ""que haces""?"	0
305017	428350	428351	How do I get the PPF CIF number?	What are the pros and cons of having a PPF account in SBI Bank?	0
305018	34834	428352	If I had 3 million dollars cash to put in an investment portfolio how feasible would it be to count on a 5% annual return I could withdraw ($150,000) for an annual personal income?	Would a bank loan you millions of dollars if you can supply a personal guarantee that you can return it back by investing it in financial market?	0
305019	72752	428353	What hotel in Ananthagiri Hills Hill-station would be safe for unmarried couples, without the harassment of police, hotel staff, and moral police?	What hotel in Nagari Hills Hill-station would be safe for unmarried couples, without the harassment of police, hotel staff, and moral police?	0
305020	428354	428355	Is the KTM RC 200 worth buying?	Is it safe to buy a second hand KTM Duke 200.	0
305021	19290	8513	Which is the best joke you have ever heard?	What are some of the best jokes?	1
305022	428356	428357	How is the genre of a song defined?	How does one classify a song into a genre?	0
305023	416480	52787	"What can I say to respond ""Thank you so much""?"	"How do you say ""thank you"" in Korean?"	0
305024	209087	249232	How can I become a better liar?	Lies and Lying: How can I become a better liar?	1
305025	428358	428359	If Trump decides he doesn’t want to run for President before the election, will his name be removed from ballots?	Is 401(k) a pension plan and how much does employer contribute to the 401(k)?	0
305026	285889	414540	What do Russians think of China?	What does Russia think about China?	1
305027	428360	428361	"What does ""the sea of electrons"" mean?"	What does o sea mean?	0
305028	320467	239428	What are examples of invertebrates?	What are some examples of invertebrates?	1
305029	192034	428362	What would happen if all the countries in the world have open borders?	What would happen to the world economy if all countries opens their border?	1
305030	428363	428364	Is sneezing beneficial or not?	How does sneezing can cause miscarriage?	0
305031	5408	428365	How do I prepare IBPS PO exam in one month?	Can one go for preparation for IBPS PO exam along with CSE exam preparation?	0
305032	428366	428367	What do dogs think about cars ?	What do dogs think cars are?	1
305033	428368	38506	"How do you say ""education"" in Latin?"	"How do you say ""it"" in Latin?"	0
305034	428369	428370	For those using the ShipStation platform, which carrier/marketplace/shopping cart integrations do you leverage?	Do citizens of countries that drive on the left side of the road use shopping carts on the left side of aisles in supermarkets?	0
305035	428371	131648	Where can I get a red coat, like Joaquin Phoenix used to wear in the movie Her, in India?	How did Joaquin Phoenix get the scar on his lip?	0
305036	198631	173156	How can you motivate me to study hard?	How can I motivate myself to study even if I'm not interested in education?	1
305037	87331	428372	Are men on average smarter than women? Why or why not?	Do women expel urine faster than men?	0
305038	118057	293478	Does project manager and project engineer for lokacart under Professor Ganesh Ramakrishnan are involved in corruption?	Why should you never apply for internship under Ganesh Ramakrishnan?	0
305039	256917	428373	What is the best multi-user, online project management tool?	Which is the best multi-user, online project management tool?	1
305040	428374	428375	Looking for a device which can get me free Internet anywhere in the world.?	How frog produce in a dry lands like our gardens? Because I m in confusion that it produce due to ignorance about cleaning?	0
305041	428376	246244	"Why is there a picture of potato and a sentence saying, ""sorry for the long post, here's a potato"" in 9gag? What does it mean?"	"What does ""Sorry for the long post, here's a potato"" mean in 9GAG?"	1
305042	177331	171231	How do you log out of Quora?	How do I log out from Qoura?	1
305043	428377	428378	What is metal oxidation reaction?	What is a metal oxide?	0
305044	428379	428380	In video RTB, what are VAST video tags and how do they work?	What are the best video resources for HTML5?	0
305045	428381	428382	What is the difference between RFID tags and HID Proximity cards?	What strikes first time visitors as special or unusual when they arrive in Takaoka, Japan?	0
305046	428383	428384	How should I prepare for an internship at Microsoft Research?	How should I prepare for an internship at Microsoft?	0
305047	1033	35360	What is the difference between Chinese and western culture?	What are the biggest differences between Chinese culture and western culture?	1
305048	261757	67362	How are conciliation, mediation, and arbitration used?	How do conciliation, mediation, and arbitration differ?	0
305049	243240	329219	When and Where did cotton farming originate?	What is the difference between Egyptian and Pima cotton?	0
305050	428385	428386	Can I travel to Sweden on Schengen visa issued by Italy? I have multiple-entry Schengen visa and I had made one trip on that visa to Italy.	If I have a universal Schengen visa from France, and haven't been there yet - is it okay if my first travel into Schengen zone is to Italy?	0
305051	428387	246340	What's the origin of the eating motion that you see many college football players doing after making a good play? Like, who was the first to do this?	How many players are needed to play a football game, and who are they?	0
305052	428388	428389	Which book is the best one for the MAT 2015?	Which book is best for a GS in the UPSC exam of 2015?	0
305053	49721	134005	What if aliens really exist and the world governments know? Why should the governments hide it from the people?	Why are governments going to such length to hide aliens and UFOs?	1
305054	189245	428390	How do I find a phone number’s location?	How do I find a phone owner's information using their IMEI number?	0
305055	26244	308049	How is the presidency of Donald Trump going to affect India's IT industry?	How will Trump's presidency affect the Indian IT industry?	1
305056	11000	120780	What are the most annoying questions that you feel ridiculous in Quora?	What are some of the most annoying questions on Quora that you wanted to answer?	1
305057	428391	29370	Is ebiz.com really safe?	My friends are asking me to join ebiz. Is it safe to do the business with ebiz?	0
305058	428392	428393	Is there a list of websites?	Should I list my website as my experience?	0
305059	428394	428395	What beneficial or relaxing things can you do when you are tired during work or study?	What do you do if you're tired but you have to study?	1
305060	135455	97874	What is the meaning of Hindi word 'Chashmadid Gawah'?	What is the meaning of a hindi word बेदबी?	0
305061	336281	428396	Does Proverbs 21:1 mean believers should trust in GOD to “”select”” national leaders for us?	"Bill Cooke quotes Charles Bradlaugh, ""I know not what you mean by God...""* as an alternative to ""God doesn't exist"" or ""I lack belief god(s) exist"". Would this be a more productive** approach for atheists to take in discussions with Christians (or believers in general) about God?"	0
305062	363441	39294	What are the most famous/popular local products and businesses in Dallas?	What are the most famous/popular local products and businesses in Seattle?	0
305063	428397	44095	I'm in love with Shahrukh Khan. I want to meet him. What do I do?	Why do some people hate Shahrukh Khan so much?	0
305064	134291	422682	What is the average price per square foot for commercial real estate in jamaica?	What is the average price per square foot for commercial real estate in NYC?	0
305065	428398	22185	How do you get rich in sales?	How could I get rich?	0
305066	428399	428400	What are the parts of Java I actually need to know in depth before starting Android development?	Can I learn Android app development right from scratch without knowledge of Java?	0
305067	428401	428402	As a psychologist, have you ever encountered any terrifying experiences with your patients?	Can a psychologist ever make more than a psychiatrist?	0
305068	65052	47477	What is the scope of mechanical engineering worldwide?	What is the scope of Mechanical Engineering?	1
305069	428403	428404	How can you prevent razor bumps in your bikini area?	How do I get rid of razor bumps in the bikini area?	0
305070	428405	428406	How are fuel (petrol/diesel) prices decided in India?	How do I get daily updates on petrol/diesel prices in every city of India?	0
305071	428407	428408	How can an insurance bill be passed in Lok Sabha when it is already pending in Rajya Sabha?	If PM is a member of Rajya Sabha, then who is elected as leader of house in Lok Sabha?	0
305072	59766	428409	What happens to your stock options if you decide to leave a company?	What happens to your stock options when you leave a startup?	1
305073	354054	179012	What are some quick and painless ways to kill myself?	What would be a sure shot, painless way to kill myself?	1
305074	428410	255824	What makes a good leader?	What makes a great leader?	1
305075	118539	428411	What's the best sales intelligence tool for B2B lead generation?	Which is the best B2B prospect generation software?	0
305076	428412	256605	How do I install WordPress on Ubuntu?	How do I install WordPress?	0
305077	428413	428414	I got 126.5 marks in SSC CGL 2016 and belings to SC category how much target should I set for Mains?	Can an RTK rigid raider be coded mark 3?	0
305078	428415	428416	Radio app development in Android?	What are the reasons why the decrease of porosity increased the strength of ceramics?	0
305079	32397	123796	What is the meaning of Hindi/Urdu words 'Mitr' and 'Dost'?	What is the meaning of Hindi/Urdu word 'Swarg' and 'Jannat'?	0
305080	12805	168486	Can I restore my deleted emails from a Gmail account?	How do I get deleted emails back from gmail?	1
305081	428417	67928	What are three things that highly proactive people do on a daily basis?	What are three habits that highly productive people have on a daily basis?	1
305082	428418	428419	Why do Jawans live with the officers of Indian Army and why are they treated as servants?	Can Indian army officer afford a DC Avanti?	0
305083	244302	428420	What is the best order to read the Discworld novels by Terry Pratchett for maximum enjoyment?	In what order should I read Pratchett's Discworld novels?	1
305084	384011	19678	Is Pokemon Go the first of its kind and why is it so popular?	What makes Pokémon GO so popular?	1
305085	428421	167511	Do Americans watch and play cricket?	Why don't Americans play cricket?	0
305086	428422	428423	What is the difference between Kali Linux and Ubuntu?	What is the difference between Kali on PC and Kali on Android OS?	0
305087	428424	390025	Why do Indians hate Pakistanis and/or Pakistanis hate Indians?	Why don't Indians hate the British as much as Pakistanis?	0
305088	187353	114139	I want to learn drawing. Where should I start?	What is the best way to learn how to draw?	0
305089	428425	97611	How do I check my Aadhar Number to bank accounts & properties list?	How do you cash a personal check without a bank account?	0
305090	428426	428427	Which tech companies give out the best bonuses?	Which tech companies give out the best bonuses or equity?	1
305091	218101	74164	Why is India unique? What does India have that other countries don't?	What are the things that separate India from other countries making it unique in that special way?	1
305092	428428	428429	What are the most useless apps?	What is the most useless job?	0
305093	428430	428431	Does henna mehndi make your hair dry?	Is hair mousse applied to wet hair or dry hair?	0
305094	428432	428433	Is this website legit?	Is Movieflix.to a legit website?	0
305095	428434	428435	What is 6 B in an O?	What is o.b.c.?	0
305096	428436	428437	What is the pH of a neutral solution? Why is that the neutral point?	Is hydrogen peroxide acidic, basic or neutral? What will be the color of pH paper in its solution?	0
305097	239753	428438	Why is it that forms in the US that ask for your race/ethnicity also ask in a separate question if you consider yourself Latino/Hispanic?	Am I considered Hispanic or Latino in the US? 	0
305098	428439	428440	How do I finance for coding bootcamp in India?	What is the best way to finance a coding bootcamp in UK?	0
305099	63416	134298	What is the best c# book for a beginner?	What's the best C# OOP book for beginners?	1
305100	30340	27003	What is the quickest and less painful way to commit suicide?	What is an easy way to commit suicide?	1
305101	428441	428442	When did the Simpsons change the aspect ratio of the TV in the intro to widescreen?	What will change if I take my TV out my bedroom?	0
305102	428443	189669	What is a recipe for Greek fire?	What could possibly have been the composition of Greek fire?	1
305103	23427	21754	Which is the most important thing in life?	Are money, time, and friends the most important things in life?	1
305104	12523	69522	Has life been found on any other planet?	What are some signs of life on other planets?	1
305105	428444	405970	How do you make more money?	What are good ways to make more money?	1
305106	428445	374656	What makes an argument successful?	What does it mean if an argument is sound?	1
305107	137653	407930	What are compound mixtures? What are examples of this?	What are some examples of mixtures?	0
305108	428446	428447	Is there any proof that Jesus actually existed?	Is there any proof that Jesus really existed?	1
305109	336515	428448	How do I take care of a baby?	How do you take care of a baby mole?	0
305110	428449	93519	What companies can help me improve my questions on Quora?	What is the best way to improve my questions on Quora?	0
305111	428450	428451	What kind of job / service does RR Donnelley offer?	What kind of jobs do PSUs offer? I am a final year student in IT engineering. Do they offer development jobs?	0
305112	428452	428453	What is 4x4?	What 4X4 should I get?	0
305113	84189	428454	What is average height of 18 year old boy?	What is the average height for a 14 1/2 year old boy?	0
305114	428455	428456	What does heartbreak feel like?	What does a heartbreak feels like?	1
305115	428457	359362	How did The Wall (2017 movie) get greenlit? What's the backstory of how the movie got made?	How did Jumanji (2017 movie) get greenlit? What's the backstory of how the movie got made?	0
305116	428458	428459	How true is the famous Roswell Incident video which shows the autopsy of a proclaimed Alien?	Did the U.S government find any space craft or aliens in the Roswell incident?	0
305117	428460	230812	How do I be a good roommate?	How do I find a good roommate?	0
305118	180751	167444	Where is the peace in the world?	How do we achieve world peace?	0
305119	428461	428462	Do Muslims in India dislike Narendra Modi?	Why Muslims hate P.M Narendra Modi?	1
305120	32184	428463	How can you use voice call on iPhone 5s in Jio sim?	Will Jio bring its voice calling app in iPhone 5s and below?	0
305121	236306	428464	What is the difference between industrial psychology and human resource manager?	What are the differences between work of industrial psychologist and human resources manager?	1
305122	428465	428466	The Dark Knight Rises (2012 movie): What evidence was there that Talia did or did not have romantic feelings for [character]?	What are some amazing facts about The Dark Knight Rises?	0
305123	236060	216302	Who are some lesser known important historical figures of São Tomé and Príncipe and what should people know about them?	Who are some lesser known important historical figures of Guam and what should people know about them?	0
305124	428467	428468	If the Washington Redskins team name is offensive, can't the same be said for many other sports teams?	Why is there so much scrutiny and push to change the Washington Redskins name when there are so many other professional sports barring the same type of name (i.e. Chicago Blackhawks, Atlanta Braves, Cleveland Indians)?	1
305125	428469	428470	How can I confirm that Ii have successfully selected an examination slot in BARC online exam?	How do I crack the BARC exam?	0
305126	201651	416680	Is it possible to choose your dreams?	How can I manipulate my dreams?	1
305127	423467	428471	What is the speed of electron?	What is speed of electron?	1
305128	227335	428472	How do Native American tribes commemorate death? What ceremonies do the Sioux Tribe practice?	How do Native American tribes commemorate death? What ceremonies do the Cherokee Tribe practice?	0
305129	428473	428474	Why is it called a vacuum cleaner if all it does is clean dust? Where is the vacuum?	How does a vacuum cleaner work?	0
305130	428475	428476	Which are the best coaching classes in Mumbai for mht CET (PCM) crash course?	How would the world be if U.S. annexed the Canadian province of British Columbia? How would the two countries be affected?	0
305131	374287	428477	What's the legal way to watch the Premier League live in the USA?	Is there a Legal way to watch the Premier League Online?	0
305132	7529	92977	How exactly does banning Rs 500 and Rs 1000 notes curb the problem of black money?	How does the latest decision of abolishing 500 and 1000 rupee notes help the Government curb corruption?	1
305133	428478	170740	If the universe begin from a huge explosion (Big bang), then how the universe will end?	Does universe has a begining and an ending?	0
305134	428479	428480	Which book is best to know indian custom?	Which book is best to know indian customs?	0
305135	134953	78321	What are some mind-blowing mobile tools that exist that most people don't know about?	What are some mind-blowing smartphone gadgets that exist that most people don't know about?	1
305136	428481	428482	How can reset phone back to it's two original state with out loosing all information?	How do you view deleted Wechat accounts?	0
305137	428483	27889	How do I share content from Quora by WeChat?	How do I share content from Quora?	0
305138	11796	231298	Why the hell does Quora mark all my questions as needed improvement?	Why does Quora always mark my questions as needing improvement, when I'm saying all I know and I really need some help?	1
305139	12638	32032	Why do folks ask questions on Quora that a Google search could answer faster and more accurately?	Why do people ask questions here in Quora instead of just googling?	1
305140	217971	428484	How can I loose weight as a 21 year old Bi-Gender-Queer 16 Seater Apache Helicopter, without resorting to a new carbon fibre body?	I am a 21-year-old with a fat body. How can I motivate myself to exercise and live a better and healthy life?	0
305141	428485	428486	What harm does alcohol do to your body?	What does alcohol actually do to the body?	0
305142	428487	428488	Uruguay: Is Jose Mujica, the Uruguayan president, really 'poor'?	What is your review of Uruguay?	0
305143	211126	23214	Should I buy the new MacBook pro 2016 or the MacBook pro 2015?	Should I get the 2015 MacBook Pro or the 2016 MacBook Pro?	1
305144	428489	428490	Is there a survey app which pays at least 5 dollars for easy questions?	What are the best activities to do with children when visiting Kostroma, Russia?	0
305145	428491	428492	What are best private physiotherapy collges in West Bengal?	Say you are suddenly gifted/cursed with the ability to read minds and you can't turn it off. How would you use/cope with your new power?	0
305146	43606	428493	Are pyramid schemes illegal?	What is a pyramid scheme and why are they illegal?	0
305147	428494	428495	How can I password protect my Belkin G Router (wireless)?	On Windows XP, how can I view the password needed to wirelessly access my modem/router?	0
305148	428496	428497	How do I drop from 180lbs to 170lbs in a month?	Should I go on a diet to lose weight for cross country?	0
305149	428498	428499	What does it mean to agree to enter into a relationship with someone?	Are there any websites on which I can find tests from different subjects to examine myself?	0
305150	428500	428501	Who is a mistress to a married man?	Do married men re-connect with their mistress? Why?	0
305151	225633	111738	Where can I get custom lanyard design in Melbourne?	Where can I get awesome designs for custom lanyards in Melbourne?	0
305152	428502	428503	Did ESPN2 cancel NBA Tonight?	When will NBA lockout end?	0
305153	121599	428504	How do I see old snapchat conversations?	Can I recover old Snapchats?	0
305154	31479	144756	What are some good songs to listen to when you're angry?	What are some good songs to listen to when you're bored?	0
305155	428505	428506	What's the best memory?	What are the best memories of your dog?	0
305156	225546	205706	What are the bitter truths of going yo the US for an MS as an Indian? By Nikhil Patel	What are the bitter truths of going to US for masters as an Indian?	1
305157	285701	428507	What is the maximum amount by cheque that we can deposit or withdraw from an SBI (State Bank of India) savings account?	I have an account in the ICICI bank. Can I withdraw the money from different bank across India?	0
305158	428508	6954	Why do I feel anxious easily?	Why do I feel anxious?	1
305159	411723	226411	What is a legit work from home job?	What legit online jobs can I work from home?	1
305160	428509	428510	What does it feel like to study psychometrics?	How do I study psychometrics?	1
305161	428511	428512	Does the ovulation phase change after a child birth even though the lady has a 28 to 30 day cycle?	How do I know if my cycle is every 28 days?	0
305162	428513	428514	What are next upcoming opportunities (competition) for me?	Temperature of exit flow in nozzle?	0
305163	428515	428516	Out of AAKASH and ALLEN, which coaching for Pre-medical is good particularly in Bangalore centres?	Which coaching is best for the medical entrance exam: ALLEN or AAKASH?	0
305164	60998	428517	What is the difference between wine, vodka, breezer, beer, alcohol, and rum?	I don't like to drink beer, scotch, and whiskey (all malt based), but I like vodka and rum. Why is this? Does it make me weird?	0
305165	428518	424319	What's the best advise you've been told by your mother?	What is the nicest, most unexpected thing that's ever happened to you?	0
305166	428519	428520	Why do men always go behind girls who ignore them?	Why men always go behind girls who ditch or ignore them?	1
305167	428521	275940	"What does ""bypass proxy for"" means?"	What are the best free proxy servers?	0
305168	380835	428522	Will dark energy ever be convertible to usable energy?	"Is it possible for dark matter or dark energy to somehow convert into ""normal"" matter or energy? If yes, how? Has it ever been documented?"	0
305169	237627	428523	What are the best project topics in civil engineering for final year?	What are the best and innovative projects related to concrete technology for final year civil engineering students?	0
305170	4703	175657	What is the best answer to why should I not hire you?	"What is the best answer to the question ""why are you not hired yet""?"	0
305171	428524	428525	What are good blogging websites?	What are some good blogging websites?	1
305172	415134	428526	How can you tell is a bowl is oven safe?	How can I stop my Pyrex bowls from burning in the in oven if those are the only ones I have? What is the chemistry behind it?	0
305173	94286	207248	How can I travel without money to work voluntarily?	What is the easiest way to travel without much money?	1
305174	428527	428528	Does House ever provide the explanation as to why Kutner died/killed himslef?	What would have happened to House after Wilson died?	0
305175	174920	32165	How can I improve my vocabulary?	How can I increase English vocabulary?	1
305176	428529	418251	What are the signs to show a woman really loves you?	What are some signs that your boyfriend really loves you?	0
