id	qid1	qid2	question1	question2	is_duplicate
372716	503453	503454	How was SavReader viewer developed and what are its main characteristics?	What is the best pest Control is Sharjah?	0
372717	503455	503456	How do I know if I am ready to monetize my blog?	How would I know if I am ready to monetize my blog?	0
372718	503457	503458	What is the difference between tangible and intangible?	What are the differences of tangible and intangible?	1
372719	503459	503460	Do programmers have girlfriends? If yes, how do they approach them?	Do programmers have girlfriends? If yes, how do you propose to them?	1
372720	503461	503462	Why do MBB hire only from IIMs? What talent do they get there compared to other colleges?	Do NGOs hire from TISS or IIM?	0
372721	475092	503463	What are best laptop brands?	What are some good laptop brands?	1
372722	503464	503465	What are some tips for installing a half door (Dutch door)?	What are some ways to install a lock on a bedroom door?	0
372723	300368	503466	How do you make oatmeal paste?	What can I do/add to make oatmeal less bland tasting?	0
372724	38214	503467	How do we stop social media addiction?	Addiction: How do I curb an addiction to social media?	0
372725	503468	503469	"What are ""dispatch notes"" in business?"	Who should I contact to activate my Reliance Jio SIM?	0
372726	503470	503471	Is it feasible to prepare humanity for true democracy? To work together effectively ?To move beyond our political/social/economic systems into something a lot better? What do we need to be able to move into something like that?	Could a human move without a nervous system?	0
372727	3855	66927	What is the typical career path for someone who becomes a professor in accounting?	What is the typical career path for someone who becomes a professor in communications?	0
372728	498859	238142	Why do we have/find antimatter?	Why does special relativity require antimatter to mirror matter?	0
372729	467740	277155	How do I get on the Board of Directors of a non-profit or a for-profit organisation?	What is the best way to get on a board of directors?	1
372730	503472	337600	"What is the difference between ""elder"" and ""older""?"	What is the difference between 'different' and 'difference'?	0
372731	111364	503473	Is www.socialtrade.biz a scam?	Where do I register complaint against scams like Socialtrade.biz?	0
372732	63729	103456	How so I ask questions on Quora?	How we can post in Quora?	1
372733	503474	503475	How is anaerobic and aerobic respiration similar?	How do aerobic and anaerobic respiration compare?	1
372734	94562	503476	How many atheists are there on Quora?	What is it about Quora that attracts atheists, agnostics, and anti theists?	0
372735	163489	503477	How much do the Rothschild family really have?	How much money do the Rothschilds have?	1
372736	250879	503478	What is the difference between NIMZ and SEZ in the manufacturing policy of India?	What is the difference between SEZ and FTZ?	0
372737	503479	503480	Is there an inverse to antibiotic resistance?	Can stopping antibiotics early cause antibiotic resistance?	0
372738	503481	503482	How do different countries write the number 1?	Is 1.5 an even number?	0
372739	503483	503484	My dog rolled over a magnet that stayed stuck to his collar. Would his chip still be readable?	Why do some dog collars have spikes?	0
372740	17587	503485	What are cultural faux pas?	What are some cultural faux pas in Nepal?	0
372741	158170	223860	Ultimately, what is ISIS hoping to accomplish?	What does the ISIS want?	1
372742	503486	170357	"What is the meaning of ""corporate disclosure"" ?"	What is the best book for corporate finance?	0
372743	64080	9283	Don’t you think it is not a good decision by the honorable Supreme Court to play the national anthem at cinema halls?	What are your views on Supreme Court decision of must National Anthem before movies?	1
372744	385063	27521	I am currently a computer science undergrad going to my fourth year, what do I need to do to become a data scientist?	How can I become a data scientist?	1
372745	1841	18366	Can an infinite amount of dark or vacuum or gravitational energy be created with expansion?	Is at least the potential energy of vacuum energy and dark energy infinite?	1
372746	231464	503487	What are the most unrealistic parts of It (2017 movie)?	What are the most unrealistic parts of Split (2016)?	0
372747	503488	503489	How do I convince my parents to let me have an inter-state marriage?	Help me how to convince orthodox parents for other state love marriage?	1
372748	503490	503491	Can anyone suggest a career counsellor in Delhi/NCR region?	How can I find a Django job in Delhi or the NCR region?	0
372749	253827	188502	What are the best history books on Afghanistan?	What are the best history books?	0
372750	503492	483249	What are some super inspirational quotes?	How many Bollywood Actresses are showing camel-toe in real life?	0
372751	485640	503493	How many calories are burned during swimming?	How much calories get burned by swimming?	1
372752	503494	503495	What mobile phone does Elon Musk use?	Which phone does Elon Musk have?	1
372753	264840	503496	What are some cool facts about you?	What are the top 7 coolest things about you?	1
372754	503497	70664	How do I learn chemistry fast?	What is the best way to easily understand chemistry?	0
372755	503498	503499	What are some of the special properties of minerals?	Is water ice a mineral or not?	0
372756	159514	503500	What does it mean when two people share the same dream?	What does it mean when two people have the same dream about them kissing?	0
372757	503501	503502	What is the scientific explanation on why hair dye works better on dirty hair?	How do I make henna hair dye?	0
372758	128760	74780	Why specific heat capacity is important and why is it different for different substances?	Why do different materials have different specific heat capacities?	1
372759	503503	138058	What is the chemical formula for manganese (IV) sulfate?	What is the formula for hydrated sodium sulfate? How is it determined?	0
372760	130262	302349	How do I share internet from a PC via a USB cable to an Android phone?	How can I connect my android phone to the internet through my laptop?	0
372761	503504	503505	Is it mandatory for a woman to change surname after marriage?	Is it possible for an Indian woman not to change her surname after marriage?	0
372762	503506	503507	What are the pros and cons of studying in Canada vs studying in the US?	What are the pros and cons of studying in Canada vs studying in US?	1
372763	503508	503509	What is Iran nuclear deal?	Why is the Iran nuclear deal so important?	1
372764	503510	503511	What are Reese's peanut butter cups?	Are there Reese's cups without peanut butter?	0
372765	387905	311236	Which is more important: competition or cooperation?	Is competition superior to cooperation?	1
372766	75229	94560	Is it true that you can see who’s viewed your Instagram?	Is there a way to see who viewed my Instagram page?	1
372767	503512	503513	What made Michelle Obama's speech at the 2016 Democratic National Convention so effective?	What are your views on Michelle Obama's speech at the 2016 Democratic National Convention?	0
372768	503514	503515	Education or development which is the solution to the today's world problem?	Which are the best organizations out there raising money to educate the developing world?	0
372769	503516	503517	How much weight can Elmer's glue support?	What does it mean to sniff glue?	0
372770	503518	503519	What is it like to work in Exinda?	Why do Austrians have animosity towards Germans?	0
372771	47210	155246	How can I develop a positive attitude?	How can I get positive attitude?	1
372772	503520	503521	What are the advantages and disadvantages of recombinant DNA?	How exactly do DNA recombination and mutation work in evolution?	0
372773	10900	81877	What is the best way to be motivated?	How can one be self motivated?	1
372774	238682	503522	How long does it take to become a pilot in India after 12th?	Can I become a pilot in India if I have passed the 12th with biology?	0
372775	19611	43136	What's the worst thing that has happened to you?	What's the worst thing that ever happened to you?	1
372776	41347	42179	Which is a good solar panel installation provider near Nipomo, California CA?	Which is a good solar panel installation provider near Agoura, California?	0
372777	503523	503524	What is meant by bitcoin?	What is meant by Bitcoins?	1
372778	64563	217304	How do I learn ethical hacking in online?	How do I learn ethical hacking, for free of course?	0
372779	503525	503526	Which is the oldest language Sanskrit or Greek. Are both related, from same origin or entirely different altogether?	Why do most of the Hindus think that Sanskrit is the oldest language?	0
372780	15788	53984	Where can I get expert house painting service in Brisbane?	Where can I get expert interior house painters in Brisbane?	1
372781	503527	309823	How do I output webcam capture to broadcasting program? How do I output FFmpeg to Wirecast?	What is the output of the following program?	0
372782	191913	37513	What is the best thing that was ever done for your parents?	What is the best thing you have done for your parents?	0
372783	341384	487159	Is who singular or plural?	Is 'Binoculars' singular or plural?	0
372784	503528	227359	Why do I get annoyed when people who answer ask for upvotes at the end of it?	What makes people to be upset when the offer of things they asked for came much later than they expected?	0
372785	336538	503529	Can we repeat childhood?	How was Jesus' childhood?	0
372786	503530	503531	Which are the Mechanical Companies hiring through E-Litmus, AMCAT or any similar examinations?	Is there any standard test for hiring mechanical engineers (like eLitmus and the AMCAT for CS and IT)?	0
372787	503532	503533	Who are the top 5 email providers in China?	Which is the best email service provider in India and why?	0
372788	503534	503535	Is a license of SWRK worth it?	Why do Republicans seem so unconcerned about evidence of Trump's ties with Russia?	0
372789	503536	503537	What is the link between linguistics and psychology?	What is the link between linguistics and anthropology?	0
372790	188789	14247	What is the meaning of Marathi word 'Aamdaar' and 'Khaasdaar'?	What is the meaning of Marathi word 'Sohla'?	0
372791	503538	503539	What are some characteristics of leopards?	What are some characteristics of the black leopard?	0
372792	62668	1596	What are the safety precautions on handling shotguns proposed by the NRA in the entire U.S. including it’s territories and possessions? 2	What are the safety precautions on handling shotguns proposed by the NRA in Arizona?	1
372793	16655	174662	What are economic activities? What are some examples?	What are some examples of economic activity?	1
372794	503540	503541	Why did you leave Apple?	Design: Has Apple ever made a product with bad design?	0
372795	503542	503543	My interview in IOCL lasted for 30 minutes but the interview was below average.What are my chances of getting selected?	My rank in gate is 43 in instrumentation but my personal interview in iocl was below average.What are my chances of selection?	0
372796	184318	19707	What do Jon Davis and Balaji Viswanathan think of each other?	What does Balaji Viswanathan think of himself?	0
372797	503544	503545	What are the career opportunities after qualifying in the NET/SET/CSIR exams?	Will I get more salary after qualifying NET/SET?	0
372798	408409	105975	Did Quora get hacked?	Did Quora get hacked recently?	0
372799	145667	38270	What are some mind-blowing inventions and technology that most people don't know about?	What are some mind-blowing mobile inventions that exist that most people don't know about?	0
372800	107285	26284	How can I improve my German grammar?	How do I improve my german grammar?	1
372801	503546	495352	What's the easiest way to install Google Play Services on a Blackberry Q10 running OS 10.32?	How do I download and install Play Store on a Blackberry Z10?	0
372802	503547	503548	What were all of Nero’s accomplishments?	What were Nero's greatest accomplishments?	1
372803	161569	99944	What do you do that makes you happy?	What do you need to be happy?	0
372804	163482	55357	Which are the best books to learn HTML, CSS and JavaScript?	What are some of the best books on HTML, CSS, and JavaScript?	1
372805	503549	503550	What do you think , can Google+ beat Facebook?	Will Google+ beat Facebook?	1
372806	66465	100703	How do I grow taller in a hurry?	How do I grow taller (1-2 inches) when I'm already 23? Is it possible?	1
372807	503551	503552	What will be the size of the protective packaging market in the United States by 2019?	What is the average size of a United States prison jail cell?	0
372808	205501	87963	What would happen if all the oxygen in the earth disappeared for five seconds?	What would happen if the Earth lost it's oxygen for 5 seconds?	1
372809	503553	503554	I have completed my mechanical engineering with below 60%. What should I do to get a job in good company	I have completed my mechanical engineering with below 60%. What should I do to get a job in good company?	1
372810	503555	503556	Is housing a human right?	Is basic housing a human right?	1
372811	208495	147477	Is Vicks VapoRub safe for children?	After how long does Vick's Vapor Rub expire?	0
372812	503557	503558	How does protein catabolism occur?	How and where does protein catabolism occur?	1
372813	503559	503560	What kind of job are there in India for a creative person and an artist?	Why are creative jobs not considered as real jobs in India by the society?	0
372814	503561	503562	Can you use shaving cream as hair conditioner?	Can you use hair conditioner as shaving cream?	0
372815	467839	503563	"What is the first thing that comes to your mind when you hear the word ""aspiration'?"	"What is the first thing that comes to your mind when you hear the word ""scientist""?"	0
372816	503564	498994	Why are Google Pixel phones so expensive in India?	In what countries will Google Pixel be launching?	0
372817	503565	503566	What are the best tasting vodkas? How are they made?	What are the best vodkas?	1
372818	303126	204502	What's the difference between clementines, satsumas, tangerines and mandarins?	Is there a nutritional difference between red and green apples?	0
372819	503567	503568	Who was a better offensive tackle - Jim Parker or Anthony Munoz?	What skills does a QB need for pro-style offense vs typical college offense? Why is it different from college play? How hard is it for a QB to adapt? 	0
372820	503569	503570	Why do liberals need days off of school and safe spaces with coloring books and puppies when they lose elections while conservatives manage without them?	Why can't liberals accept their defeat in 2016 presidential elections?	0
372821	503571	503572	Could placebos be used to ease depression safely?	Can the placebos in birth control packs be used as regular placebo pills?	0
372822	24027	171991	Can my father's name be changed on an Aadhaar card?	How can I get an Aadhaar card in Tamilnadu?	0
372823	503573	503574	What causes a single hiccup?	What causes hiccups?	0
372824	503575	382685	Will Hillary Clinton be a good president (No bias)?	Would Hillary Clinton make a good president?	1
372825	503576	503577	What are some of the most amazing historical photos?	What are some amazing historical photos?	0
372826	503578	503579	How are the new Facebook API's affecting your social counts on sites like sharetally? What other sites do you use to track thos shares?	University acceptance rate for MS is based on what criteria?	0
372827	2567	25231	Is there some painless way to suicide?	What is the most painless way to do a suicide?	1
372828	503580	503581	If I fly over the Equator from West to East faster than the speed Earth rotates at, will I be going back in time?	Currents don't rotate the earth at the speed of the earths rotation, so where does the extra water that causes high tide go during low tide?	0
372829	385246	207921	What are the strongest majors in terms of job prospects and what are the weakest majors at Troy University?	What are the strongest majors in terms of job prospects and what are the weakest majors at Miami University?	0
372830	409067	441557	Who is Vaporizergiant CEO?	Who is Vaporizergiant of CEO?	1
372831	503582	503583	What do you think of Quora?	What do you think of how Quora is now?	0
372832	503584	503585	I Want To Becoming A Ads Copywriter? May I Know What Are All The Area I Have To Focus For That	Which books are good for aao post in CGL?	0
372833	503586	395176	How do you stop existing?	How do I stop existing?	1
372834	503587	503588	Who is a good ENT in the SF Bay Area?	Are there any good ear-nose-throat doctors available on weekends in the Bay Area, ideally closer to SF (rather than say SJ)?	0
372835	319126	266199	What are some best classified websites?	What would be the best classified website in your opinion?	1
372836	503589	503590	Do the lethal injection chemicals have mysterious unknown effects?	Biochemistry: Do (slightly) higher temperatures have a stronger effect on catalyzed chemical reactions (like enzyme-based ones) than on non-catalyzed chemical reactions (like the Maillard reaction)?	0
372837	117870	503591	What is the noun form of “complex”?	"What is the noun form of the word ""various""?"	0
372838	503592	503593	How do I enter into cashew nut export business?	Is exporting a difficult business to enter?	0
372839	503594	503595	What should I follow in astrology: the Moon sign or the Sun sign?	What should we follow? Sun sign or moon sign? What is the difference in both?	1
372840	503596	14304	Why are the rich getting richer under President Obama?	Why do super-rich people want to get richer?	0
372841	503597	503598	How can I improve my running for 1.6km in 5 minutes and 30 seconds?	How can I make an up and running simple server side in 5 minutes?	0
372842	63633	299244	How can I reactivate my permanently deleted Instagram account?	"I disabled my instagram account today and hours later logged in to reactivate it. I am missing half of my photos, are they gone permanently? Instagram states it will only hide my pictures during ""disabling account."""	0
372843	503599	503600	How do you go vegan?	Should I go vegan?	0
372844	503601	503602	What happened to El Diablo in Suicide Squad?	Is El Diablo from Suicide Squad Really dead or will he come back in future DC films?	0
372845	61287	32125	How long does meth say in your urine?	How long does crystal meth stay in your system and how can I dilute it?	1
372846	197210	503603	Dose it hurt when they take out stitches from wisdom teeth?	What happens if you don't take out your wisdom teeth?	0
372847	1858	8974	How can long distance relationships be successful?	Does long distance relationship works?	1
372848	503604	503605	Assuming Hillary Clinton wins the election, how likely is it that a Republican Congress would attempt to impeach her over the email scandal?	If Hillary Clinton wins will the republicans try to impeach her for lying under oath about her emails?	1
372849	361851	503606	How would God encapsulate star matter in a planetoid like earth?	How would life be on Earth if only one side of the planet faced the Sun throughout, like Remus did in Star Trek: Nemesis?	0
372850	95845	35905	How can a students start learning c programming?	How should I start to learn c language?	1
372851	503607	503608	White pine, red cypress, and poplar are usually considered the best lumbers to use in exposed positions. Why?	What does pine tar look like? How is pine tar formed and what is it useful for?	0
372852	226236	436295	What are most dangerous places in the world?	Where are some dangerous places to stay in the world, and why are those places so dangerous?	1
372853	503609	503610	Did the loss of the Witch-king of Angmar have an emotional impact on Sauron, at a personal level?	Why did Sauron put an inscription on the One Ring?	0
372854	289604	503611	Is there any way to study organic chemistry?	What is the best way to study organic chemistry?	1
372855	66736	503612	What is the best budget hotels in Cochin for accommodation of me and my friends in this coming New Year eve?	What is the best budget hotels in Mussoorie for accommodation of me and my friends in this coming New Year eve?	0
372856	292088	503613	What are the future prospect in cinematography?	How is the future job prospect in Service Now?	0
372857	24254	58835	Which is the best mutual funds to invest in India?	I've decided to invest monthly 5k in mutual fund. Which is the best mutual fund available right now?	1
372858	503614	194142	Which IIT /NIT/IIIT have you got in JOSAA JEE councilling 2016?	My JoSSA 2016 Merit Rank is 14196. Will I Get Admission in IITRAM (Mechanical) upto reshuffling round?	0
372859	503615	503616	What is the best hatchback in India for travelling 130 km daily?	Stories of famous Bollywood celebrities who got strange later, like parveeb babi, raj kiran etc?	0
372860	10591	30527	Will India declare war against Pakistan?	Should India declare war against Pakistan as they are spreading terrorism in India?	1
372861	503617	48953	What is unusual or different about the food and cuisine in Libya?	What is unusual or different about the food and cuisine in Russia?	0
372862	76908	598	What is the meaning of living life?	What the meaning of this all life?	1
372863	503618	37333	Who is the most educated and Secular President in the world?	Who is the most educated president in the world ?	0
372864	267988	369508	Were people in Hiroshima actually vaporized? Did they turn to dust?	Were the bombings of Nagasaki and Hiroshima moral?	0
372865	503619	503620	Are automatic OTF knives actually used in tactical environments?	Do soldiers use combat knives?	0
372866	255821	121775	What is the first programming language you learn?	What are some programming languages that I should learn?	0
372867	89486	46473	Why we spend time in answering questions on Quora?	How does it benefit you to answer questions on Quora?	1
372868	156468	277198	What is difference between CV And Resumé?	What is the difference between a CV nd a resume?	1
372869	136197	156665	What are some of your best experiences in life?	What are your best experiences of life and why?	1
372870	503621	503622	What does et al mean in APA?	"What is the meaning of ""et al""?"	0
372871	503623	503624	How much can a FOREX sales RM earn in Dubai as incentive/s?	How much does a FOREX sales RM earn in Dubai as incentive/s?	1
372872	503625	503626	What is the most delicious pizza you have ever eaten?	What's the most delicious pizza you've ever eaten?	1
372873	106790	14977	Why does it seem like early polls were so inaccurate in terms of actual 2016 presidential election results?	Why were the polls so inaccurate in the 2016 election?	1
372874	133980	503627	In what order should I watch the Marvel Cinematic Universe?	Why isn't Spider-Man/X-Men part of the Marvel Cinematic Universe?	0
372875	12214	2439	How can I improve my pronunciation of English words?	How can I improve my English pronunciation?	1
372876	14376	398949	Can you see who views your Instagram?	Can someone still see that I viewed their story if I disabled Instagram?	0
372877	503628	503629	Is there any use in learning ethical hacking for better learning?	What's it like to have a suicidal client?	0
372878	74056	9163	Which is the best institute in Delhi for GMAT Coaching?	What are some of the best coaching institutes for GMAT in Delhi/NCR?	1
372879	503630	503631	What are the various parameters for doing SWOT analysis for a rural unplanned site?	What are the best examples of 'The Secret' in your life?	0
372880	300275	503632	Why should your girlfriend be your best friend?	How do I make my girlfriend my (best) friend?	0
372881	503633	503634	What is the full form of e_g and t_2g in crystal field theory?	How can you determine the full form of IUPAC in chemistry?	0
372882	503635	82114	"In Korean, how do you say ""big""?"	How do you say I hate you in Korean?	0
372883	346896	503636	What is soft material that can conduct electricity?	Is there a material that only conducts electricity at a certain temperature?	0
372884	503637	503638	Where can I find some pre-trained word vectors for natural language processing/understanding?	Natural Language Processing: I have a feature vector (not a word) in word2vec feature space. How can we find out the word which is closest to this vector?	0
372885	503639	6734	What are some things new employees should know going into their first day at Advaxis?	What are some things new employees should know going into their first day at Express?	0
372886	503640	503641	What are the laws in India that every indian must be aware of so he/she can use them whenever it is required?	What are the basic laws and rights every Indian should be aware of?	1
372887	256803	503642	What are some popular food items from Kerala?	What are some of the popular Syrian Christian delicacies from Kerala?	0
372888	308652	99456	What or how is an IQ measured?	How do I get my IQ tested?	1
372889	503643	503644	Why isn't Bolivia taking Refugees from Syria?	Why don't Syrian refugees want to claim asylum in Russia?	0
372890	371703	503645	What pseudoscience runs/upholds Christian terrorism?	What pseudoscience runs/upholds Christianity?	0
372891	7110	84086	Should India ban all Chinese goods or anything which is made in China?	Why India can't ban cheap, substandard, harmful Chinese goods?	1
372892	352314	74167	What is a good tool for automated testing for mobile apps?	What is the best demanding automation testing tool in market?	1
372893	503646	503647	How should a coworking space be secured?	Are there any coworking spaces in Poznań?	0
372894	503648	503649	How does Richard Spencer's speech at a recent alt-right conference make you feel?	Will Trump ever disavow Richard B. Spencer and his National Policy Institute?	0
