id	qid1	qid2	question1	question2	is_duplicate
357187	486591	290388	"How do I apply for a birth certificate in Andhra Pradesh for those born in 90s? What is ""the process in particular""? Or if possible, are there any online applications?"	I am born before 1989 and I don't have a birth certificate. How can I apply for an Indian passport?	0
357188	124349	46684	What are the best anti-feminism critiques of Feminism?	What are the best refutations of & arguments against Feminism?	1
357189	66163	166110	What is the best way to go about learning JavaScript?	What are the online resources for learning javascript?	1
357190	358982	486592	What does a Brazilian Portuguese English accent sound like?	When did Brazilian people lose their Portuguese accent?	0
357191	33882	27062	What is something that you know that I don't?	What is something that you do not know?	0
357192	486593	486594	What should be a guy's next move after his first eye-contact with a girl to get along with her?	What's in girl's mind/heart when she is having eye contact with a guy frequently?	0
357193	486595	486596	How do I install Kodi in a chromecast device?	Is it safe to power Chromecast v2 from TV USB? My internet usage is so high after installing Chromecast. I think it is using data in background.	0
357194	486597	486598	Why do we sometimes get suddenly depressed for no reason?	Why do I often suddenly get depressed for no reason?	1
357195	486599	23232	How safe is Japan from terrorist attacks?	Why are there so many more terrorist attacks in France than anywhere else in Europe?	0
357196	486600	486601	What do visual effects artists produce?	What is it like to be a visual effect artist?	0
357197	2365	52070	How can you tell if a guy likes you or not?	How can you tell a if guy likes you?	1
357198	486602	486603	What is it like to take an algorithms course with Miguel A. Revilla from UVa (University of Valladolid)?	As a computer science 2nd year student, I want to take a course in SAP. Am I eligible? If yes, which course should I do and from where?	0
357199	486604	486605	Which is the best restaurant in the Mumbai?	Which is the best restaurant in Mumbai?	1
357200	28699	324233	What is the difference between a discrete and digital signal?	What's the main difference between digital and analog?	0
357201	5449	46047	What is the effect of demonetization of 500 and 1000 rupees note?	Is Modi's decision on demonetization of 500 and 1000 notes welcomed by public?	1
357202	101193	99454	What's the best compliment you've got?	What is the best compliment you've ever got?	1
357203	486606	486607	What are the reviews for the Nike Employee Store in Portland?	How is Nike Fuel calculated?	0
357204	486608	486609	If someone gave you $1 Million, what would you do with it?	If someone puts a gun on your head and says: You have 24 hours to make 1 Million dollars, what would you do?	0
357205	486610	486611	Is it possible to get acceptance into an Ivy League college with a GPA lower than 3.0?	Will my deep understanding of programming help me to get accepted into Ivy League colleges?	0
357206	201588	486612	If Black people want segregation, then WHY should they expect white people to care about their problems?	Why does it feel like a burden to keep everything a secret from people, despite the fact that they misunderstand you? Why should I care about their understanding if I do the right thing?	0
357207	486613	486614	What is a billing zip code?	What is the zip code (or zip codes) for East Austin?	0
357208	486615	486616	Is Java is a open source?	How is Java open source?	0
357209	486617	486618	How can I check the creditworthiness of a company providing work in home for extra income?	How do people in Nagpur manage the heat?	0
357210	312839	486619	What are some Chinese websites where I can read free e-books/stories?	What are some Japanese websites where I can read free e-books/stories?	0
357211	486620	486621	"Why did 4Chan create a totally false story about Donald Trump and ""Golden Showers""?"	What is the rumor about Trump and golden showers?	0
357212	486622	24235	What are some good Android game ideas (no apps)?	What are some good Android app ideas (no games)?	0
357213	10859	16490	How can I specifically improve my English?	How do I learn spoken English?	1
357214	48119	486623	Why do Christians sometimes put coins over the eyes of dead people?	Why don't people want to be Christian?	0
357215	486624	28764	Which is the best digital marketing course in london?	Which is the best digital marketing course?	0
357216	486625	486626	What is the purpose of epitranscriptomic RNA editing in tRNAs?	Can I get a buddy to learn French online?	0
357217	486627	486628	Who did the song at the end of the BBC's 'Gamechangers' film about GTA and Rockstar? Or was it composed especially for that film?	"What is the film ""Fair & Lovely"" about?"	0
357218	366856	486629	How do I have my first sex with my wife?	How can I please my wife while having sex?	0
357219	379589	153432	Why do some of the Indians have black skin like Africans, although they are Asians?	"When people say ""Asian"", does it include Indians?"	0
357220	200934	486630	If I'm getting abused by a friend and my boyfriend came and saved me and got in a fist fight with him could he go to jail also?	I had a fight with my boyfriend. He said he needs time and asked me not to message or call him during this period. What should I do?	0
357221	486631	486632	Why Singapore prohibited chewing gum?	Why did Singapore ban chewing gum?	1
357222	70545	486633	My wife lied about domestic violence and had me arrested. I don't think I can ever trust her again. Should I get a divorce?	My wife's male coworker emailed her telling her she's beautiful and would do anything for her. Then I discovered they went for dinner when she told me she had been with another friend. My wife says to trust her. She lied because I'd react badly.  Should I email his wife or him and establish boundaries?	0
357223	486634	486635	How are animals affected by global warming?	How is wildlife affected by global warming?	1
357224	486636	486637	Is there an camping accommodation unit?	Is there an camping unit?	0
357225	486638	486639	What is the use of nuclear reactors in generating electricity?	How do nuclear reactor makes electricity?	1
357226	96352	31791	Are the sets of numbers that broadcast from private radio stations numbers only for the dark web sites?	Are the sets of numbers that broadcast from private radio stations numbers only are they dark web sites?	1
357227	486640	339315	What is a parsebank in natural language processing?	What are the advantages of Natural Language Processing?	0
357228	403898	76964	How can you be a good leader?	How do I become a leader?	0
357229	76924	92064	Why do I keep getting logged out of my Instagram accounts?	Why did my Instagram log me out?	0
357230	67069	8639	Why did Tata Sons removed/sacked Cyrus Mistry as the chairman?	Why Cyrus Mistry has been removed from Tata Group?	1
357231	486641	486642	On a clear day, how far can you see from the Empire State Building?	How many states can you see from the Empire State Building on clear days?	0
357232	40877	67426	How do I get famous on Musical.ly?	How do people become famous?	0
357233	486643	486644	How do you prove that [a+b b+c c+a] = 2 [a b c]?	How can I prove A×(B×C) +B×(C×A) +C×(A×B) =0?	0
357234	486645	486646	What can I do rather than taking medicine when my headache makes my neck and shoulders ache too?	As a COC player, what would you say if playing the game is not a harmful thing or just a huge loss to your precious time?	0
357235	486647	486648	How do I burn a music cd for my car cd-player?	How can I listen to audio books in my car? The new ones do not have CD players and I do not have a smart phone.	0
357236	221761	1193	"Is it possible to get captions on YouTube videos if there is no ""cc"" button?"	How is it possible for a YouTube video to have more likes/dislikes than views?	0
357237	486649	486650	I have not got through campus placements, so if interviewer wants to know the reason behind this, how do I answer?	I got a year down in engineering. How should I answer to an interviewer if he/she asks me about the reason behind it?	1
357238	321035	327190	How do I build a profile to get an MBA admission in top US MBA schools?	What all should I do to build a strong profile for MBA admissions to top B-schools in USA?	1
357239	486651	616	Which is the best book to start studying calculus?	Which are the best books to understand calculus?	1
357240	486652	486653	What are the best apps for blocking unwanted calls?	What is the best app to block unwanted voice messages and calls?	1
357241	201285	486654	Why do men abuse women?	Why do men hit and abuse woman?	1
357242	486655	291277	How can the refractive index of plastic be determined?	What is the refractive index of plastic?	0
357243	152646	155152	How can you determine the Lewis structure for boron?	How can you determine the Lewis structure for hydrogen carbonate?	0
357244	486656	486657	I have small disability, will I get married?	Are football agents' brokerage fees included in the player transfer fee or are they paid seperately?	0
357245	32295	115593	Donald Trump has won the presidency election. How does it affect US relations with India?	How will Trump becoming President affect India?	1
357246	465382	486658	Who is a good father?	How difficult is to become a good father?	0
357247	486659	35448	Why did war between India and Pakistan happened in 1947?	What will happen if there is a war between India and Pakistan?	0
357248	486660	486661	What are some good home remedies for treating a headache and leg pain?	How do I treat knee and leg pain?	0
357249	350445	441789	What is GRE? How can I prepare for it?	What is the GRE? How do I prepare for it?	1
357250	12985	486662	Is there an app that can send automated WhatsApp messages?	Is there a way to set up an automated WhatsApp sending messages?	0
357251	257850	173622	What is the best book to learn c#?	What are the best book to learn C#?	1
357252	124792	33652	Why doesn't India have a US-like Prime Ministerial one-to-one debate?	What do you think about having a prime ministerial debate in India like they have Presidential debate in the US?	1
357253	486663	486664	What's mutual fund and what are the pros and cons?	How does one invest in mutual funds? What are the pros and cons of investing in a mutual fund?	0
357254	131902	486665	Which are the best brain twisting psychological thriller movies ever made?	What is the best twist ever we cannot even imagine in a movie?	0
357255	384414	255750	What is the best way to change your life?	How you can change your life?	1
357256	486666	29874	What would the world be like after world war 3?	Are we heading towards World War III?	0
357257	29379	214765	What happens if we die?	What happens when you die? (No religion)	1
357258	486667	486668	Will a mini display cable work with a thunderbolt port?	Does a Thunderbolt equipped Mac work with a mini display port to VGA converter?	1
357259	70503	44873	Is it possible to use a PS4 controller for a PS3?	How do I fix my PS3 controller?	0
357260	448366	193928	Does dark matter ripple when galaxy clusters collide and wave in a double slit experiment? Does dark matter displaced by matter relate GR and QM?	Is a sea of massive gravitons what ripples when galaxy clusters collide and is it what waves in a double slit experiment?	0
357261	42844	426337	Who named our planet earth, and why earth?	Who named our planet 'The Earth'?	1
357262	33651	201907	Why don't we have Presidential debate in India like America for PM candidates?	Why can't India also have a Presidential debate like in the US?	1
357263	486669	486670	I go to an all-boys school. How can I ask a girl out to a dance if there is no way to do it in person? (See Details)	I am a 19 year old boy and I'm very skinny the moment when someone ask me why your so skinny? I feel very bad and how will I become strong, I'm vegan	0
357264	486671	486672	How can I find duplicate content on my website?	How do I check for duplicate content on my website?	1
357265	157517	486673	Does the USPS have any standard regarding the time of day that residential mail is delivered?	What time does usps stop delivering?	0
357266	486674	278895	I lost my 10th marksheet is this will affect my certificate verification of TCS?	Was using an anti-tank gun on an infantry in WW2 a war crime?	0
357267	486675	486676	Which 32-GB micro SD will suit a moto g 2015?	Which one do you prefer: the OnePlus Two or Moto G 2015?	0
357268	180504	49877	How can I improve my writing? I have started writing articles and I want to write with more authenticity. What can I do?	How do I improve my writing?	1
357269	486677	486678	What is a fun group game for college age students?	What are some good board/card games available in India for the 18+ age group?	0
357270	486679	486680	What are some common mistakes non-native Marathi speakers make while conversing in Marathi and how can one avoid them?	What is the right age for kids to get serious about life?	0
357271	486681	486682	What is the best kindle version of Macbeth?	How do I make best use of Kindle?	0
357272	486683	486684	Why can we taste things in our brain?	What are some examples of the best Mcguffins, and the best films without a Mcguffin?	0
357273	99131	68798	Why is Manaphy childish in Pokémon Ranger and the Temple of the Sea?	Why does Manaphy have an annoying cry in PokeMon ranger and the temple of the sea?	1
357274	428445	58540	What makes an argument successful?	"What makes an argument ""sound""?"	1
357275	117372	486685	What are the most awaited Bollywood movies of 2016?	What are the awaited Bollywood movies for 2015?	0
357276	85481	486686	Which areas in Lucknow have least power cuts?	Is there any good coaching of gate exam for ECE in south area or Lucknow?	0
357277	304279	466857	In Islam, does black magic exist? And if yes to what extent?	How do I overcome black magic?	0
357278	183538	339953	What is a nursing care plan for cirrhosis?	What is the nursing care plan for hepatic encephalopathy?	0
357279	486687	486688	How does a Star Wars lightsaber work?	How did lightsabers work?	1
357280	354916	253680	How do I clear cat?	What does it take to clear CAT?	1
357281	209792	25595	What is the difference between an agnostic theist and an atheist?	What's the difference between an atheist and an agnostic atheist?	0
357282	486689	486690	What are some bizarre Indian cultural traditions / rituals?	What are some of the funny rituals in Indian marriages across different cultures?	0
357283	337538	486691	How do I connect a Bluetooth headphone to PS3?	How do I connect a PS3 controller to a PC on Bluetooth?	0
357284	16456	34183	What are some best books to prepare for IBPS PO?	Suggest me best book for puzzle in resoning for IBPS PO?	1
357285	232201	30859	Can you still get pregnant one day before menstruation?	Can i get pregnant the day after my period ends?	1
357286	40308	63000	How can one make a girl squirt?	How can you make a women squirt?	1
357287	486692	486693	What is the better option than searching in the internet, in order to find business opportunity?	I have cleared for both that is NDA and TES SSB this year, which one I should for training?	0
357288	486360	486694	How can one join Delta Force?	How can you qualify to be part of the army's Delta Force?	1
357289	120085	39940	How do I get into my Facebook if I can't remember passwords and I can't access email account?	How can I get my password back from Facebook if my email address doesn't exist anymore?	1
357290	371996	486695	Is it okay to charge your phone through a power bank while the power bank itself is being charged?	Is using a power bank advisable for mobile charging?	0
357291	32781	33552	How can I make money from YouTube?	How can I make money through YouTube?	1
357292	486696	486697	I have a shop and I have to give it for bank ATM machine?	How is it known that psychopaths make 1% of the population?	0
357293	43721	13748	How is black money gonna go off with no longer the use of same 500 and 1000 notes?	How will the scrapping of Rs 500 and Rs 1000 notes help in reducing black money and corruption?	1
357294	371883	395135	What's the best morning routine for me?	What is the best morning routine?	1
357295	486698	486699	How good is Jadavpur University for an M.Tech in nuclear engineering? How renowned and qualified are the faculty members? What is the quality of research?	Is an M.Tech in earthquake engineering a good option?	0
357296	486700	486701	What are some tips on answering a job application question that asks about working with diverse people?	Why is nobody stopping the Social Justice Warriors?	0
357297	312086	280387	How can I earn money easily for part time job?	Which is the best way to earn money by part time job?	1
357298	58418	381954	What problems will somebody face to organise an event like a fest, school day, sports day, etc, in a school or college other than raising funds?	I'm was not popular at my school/college days. I sometimes feel sad about it. What should I do ?	0
357299	486702	486703	Who is the best private tour guide in Erongarícuaro?	Who is the best private tour guide in Shanghai?	0
357300	144526	486704	As a tourist what is the best area to stay in when visiting Seoul?	Which areas are good to stay in Paris when visiting the city as a tourist?	0
357301	312852	186496	Why does Sonakshi Sinha still get to work in movies?	How does Sonakshi Sinha get movies?	1
357302	486705	486706	What is the best charging regime to extend electric vehicle battery life?	What's the best charging regime to extend laptop battery life?	0
357303	486707	486708	What are the most common life mistakes old people make?	What are the most common mistakes first time entrepreneurs make?	0
357304	5868	180851	Which is the best phone to buy under 15000 INR?	Which is the best smartphone to buy for 15000 INR?	1
357305	97384	304570	My Instagram is set up with an email I no longer have access to. How do I change my password for Instagram without my email password?	I have an Instagram account, and I just forgot the password and recovery email. It was not linked with Facebook also. How can I access my account?	0
357306	221747	184466	What are some major social faux pas to avoid when visiting the Gambia?	What are some major social faux pas to avoid when visiting Syria?	0
357307	259299	111239	How can I earn money from the internet for free?	How do free online games earn money?	0
357308	486709	486710	What are the characteristics of a really good listener?	Can you recommend me some good music to listen to?	0
357309	7086	300443	Is Donald Trump mentally ill?	Have there every been any mental stability issues in Donald Trump life?	1
357310	486711	486712	Where can I download Batman comics for free?	How can I download all of injustice comics of DC comics for free?	0
357311	486713	255478	What is the best sworld?	What is the best type of sword in the world?	0
357312	486714	486715	What are the job duties of a FBI Supervisory Special Agent (SSA)?	What are my chances of getting a Special Agent job in the FBI?	0
357313	413715	269917	Why do men wear jockstraps?	Are men superior to women? If so, in what ways?	0
357314	486716	486717	Suppose a 4 wheel car has a force & torque sensor (along X, Y, Z axis) on top of it, is it possible to estimate the center of gravity from the sensor data?	If a force acts along the x axis, then will its moment be clockwise or counterclockwise?	0
357315	486718	486719	What should I do if I lost my high school diploma?	How can I recover my lost high school diploma?	1
357316	113044	95017	What would have happened to election if Bernie Sanders was Democratic nominee?	Would Bernie Sanders have defeated Donald Trump?	1
357317	486720	457552	Why is solar energy conversion so inefficient?	Why are solar panels so inefficient?	0
357318	486721	486722	What is the ideal weight for 5'5 girl?	"What is the ideal weight for 5""7?"	0
357319	476563	486723	How do I get a job in Quora business and community team?	I would love to get into community management at Quora. How can I get a job?	1
357320	203921	486724	How people on Quora have so many followers and I don't have any followers?	Why don't I have any followers on Quora even though I have asked 50 questions?	0
357321	486725	486726	"In Italian, what is the meaning of ""nella cuccina""?"	"What does ""ma familia"" mean in Italian?"	0
357322	100048	486727	What are some tips on making it through the job interview process at Stamps.com?	What are some tips on making it through the job interview process at GoDaddy?	0
357323	317701	486728	What are the best books to study automobile engineering?	What are the best books for the course of automobile engineering?	1
357324	182751	298264	What is the proper firing order of a 4 cylinder engine?	What is the firing order of an engine?	0
357325	441955	288345	If I want to learn hacking, what should I do?	I want to learn hacking from where should I start?	1
357326	486729	486730	Has a U.S. presidential nominee from one of the major parties ever dropped out of the race before the election?	Has a major party candidate ever dropped out of the general election?	1
357327	486731	258632	Which is the best cricket match you have watched?	Which is the best cricket match?	0
357328	486732	486733	Can I use polyvore images on my website?	Can I share other's polyvore sets on my company social networking pages or do I need to provide the link for the image?	0
357329	486734	486735	Why do Real Madrid and FC Barcelona have the best players in La Liga and why not other teams? Why is it totally one sided?	I got 570 marks in neet 2016 with air827. Category obc can I get LHMC, delhi?	0
357330	486736	486737	As a high schooler that is interested in the outdoors, aerospace, and agriculture, what should my career path be?	How long does it take to become a Cisco certified network router & switcher from scratch?	0
357331	30835	136042	How do I start preparation for IAS?	How prepared IAS?	1
357332	91511	49615	How can I hack someone else's WhatsApp account from a different place?	How can I hack my spouse whatsapp account?	0
357333	36338	10949	How can I find all my Gmail IDs?	Where is my other gmail accounts?	1
357334	18818	42036	What should I do to avoid sleeping in class?	How do I avoid sleeping during the lectures?(a serious jee aspirant)	1
357335	486738	486739	To those with experience: how do you suggest those having difficulty with schizophrenia learn to cope more easily?	How many people out there cope with schizophrenia without medications?	0
357336	128190	486740	Why do I always thinking negative things and what should I do?	What are the causes of negative thinking?	0
357337	76821	208506	Where do I get cheap accommodation in goa?	What are cheap but good hotels to live in goa?	1
357338	486741	486742	Is Eminem's time over?	Is eminem's fame decreasing?	1
357339	486743	486744	If you knew you were going to die, would you choose hospice care?	If you knew you were going to die, would you choose hospice care, and why?	1
357340	486745	486746	Which college will I get with 3000 rank in wbjee?	Which college will I get with 3000 rank in WBJEE medical?	0
357341	425650	486747	How would you describe Orange County Californians?	How would you describe Orange County Californian parenting?	0
357342	81766	1885	What are some online ways of earning money?	What are the easy ways to earn money online?	0
357343	115958	486748	What did Alexander Hamilton do for a living?	What was Alexander Hamilton's IQ?	0
357344	486749	486750	What is the role of a movie director?	What are the duties of a movie director?	1
357345	486751	486752	Why did the Russians lose the Winter War?	Why did the Soviet Union lose the Winter War of 1939?	1
357346	486753	486754	How do you continue this conversation?	How could I help to continue a conversation?	0
357347	486755	486756	Does interviewbit offer referrals of jobs only for domestic offices of their listed companies?	Do IT companies offer jobs for deaf and mute people?	0
357348	193015	279226	What would happen if India completely bans all imports from China?	Will China be hurt if India bans imports from it?	1
357349	83830	486757	Which is the best institute for graphics designing in Pune?	Which institute is better for graphic design in Pune, Anibrain or MAAC?	0
357350	486758	486759	In the unlikely event that the Electoral College throws the vote, how soon will we know?	Will we know the electoral college vote count by December 19, or are the votes sealed and the results not known until January?	0
357351	486760	346623	Fighting: Other than in legend and myth, has a human ever killed a lion or tiger with nothing more than a knife or sword?	Can I fight a tiger and win?	0
357352	48556	98238	What are the best option after completing my B.Tech in mechanical engineering?	How will a gap of two years after earning a mechanical B.Tech affect my career?	1
357353	24936	51785	How is the word 'debris' used in a sentence?	How is the word 'temerity' used in a sentence?	0
357354	154926	38508	AVG antivirus technical support phone number to install AVG antivirus software setup?	Fix@~ 1.8009315079 AVG Antivirus technical support phone number?	1
357355	486761	195064	What is difference between library and packages in Java?	What is the difference between a package and a module in Java?	0
357356	486762	172592	"You still with ""Pluto is not a planet""?"	Is Pluto a planet? 	0
357357	486763	486764	Will Mia Khalifa ever do an anal scene?	What is Sabrina Deep's opinion on Mia Khalifa?	0
357358	14147	486765	"How many temples were actually there by the time when ""Shore temple"" in tamilnadu was built, and how many sank under the bay of Bengal?"	How many Indians are in favour of building a temple at the Babri Masjid site?	0
357359	486766	486767	Why aren't we able to improve the condition of farmers in India?	When the condition of farmers in india will improve?	0
