id	qid1	qid2	question1	question2	is_duplicate
353000	481993	481994	What are some good ways to repurpose wine bottles?	How can you repurpose wine bottles?	1
353001	481995	481996	How much do you think would be the gross of Avengers: Infinity War?	Who are the 67 characters that are rumored to appear in Infinity Wars?	0
353002	45590	205928	How does the HP OfficeJet 4620 Airprint compare to the HP LaserJet Enterprise 700 Printer M712dn?	How does the HP OfficeJet 4620 Airprint compare to the HP LaserJet Enterprise M605n?	0
353003	8353	23639	What's your new year resolution for 2017?	What is your new year resolution, short term and long term goal for 2017?	1
353004	346306	481997	Is Pkbazaar.com a reliable site for online shopping in Pakistan?	Which website is reliable for online shopping in Pakistan?	0
353005	481998	481999	How was the Roman world similar to the feudal world?	"Do you create documentation (""how to use"") for a customer WordPress or Joomla website?"	0
353006	170621	482000	What are some funny computer programming pickup lines that you have created or seen?	What's it like to hear or be the recipient of a really bad pickup line?	0
353007	246979	22736	Right now I am working in a software company. But I am interested in starting up my own business. How do I get ideas from the market?	How do I find a corporate firm in India which could be interested in discussing my business ideas?	0
353008	33122	120912	What made you want to join Quora?	Why did you join Quora?	1
353009	84902	7740	What are my options to making money online?	What is the best way to earn money online?	1
353010	482001	482002	Did Jack Sparrow once love Elizabeth Swann in the Pirates of the Caribbean films?	"Pirates of the Caribbean: The Curse of the Black Pearl (2003 movie): What does Jack Sparrow mean by saying: ""The world is still a big place, there's just less in it""?"	0
353011	482003	482004	How do I say the workings of the world is best described with math and why?	Why is mathematics used to describe the universe?	0
353012	126259	19179	Donald Trump or Hillary Clinton?	Donald Trump or Hillary Clinton? Why?	1
353013	72478	482005	How can I find my Wells Fargo account number on wellsfargo.com without a statement?	How can I open a Wells Fargo account?	0
353014	482006	482007	How do we read Kundli?	How do I read kundli?	1
353015	49882	482008	How can stress cause you to lose weight?	Can stress make me lose weight?	0
353016	482009	482010	How much cost for Samsung galaxy Note 7 in India?	How much it will cost for Samsung galaxy Note 7 in India?	1
353017	482011	482012	In the film Batman v Superman, was Batman right when he pointed out Superman was not brave?	Which font is used in the opening credits of Black Mirror’s Nosedive?	0
353018	482013	482014	Why do people buy overpriced stocks?	Why do people buy overpriced products?	1
353019	482015	482016	Find the circumcentre of the triangle with the vertices A (-3,4) , B (3,4) and C (-4,-3). What is the circumradius and area of the circle?	How can one find the area of a triangle ABC whose vertices are A(4,4), B(0,0), and C(6,2)?	0
353020	482017	482018	How do I get into an undergraduate (business) program of a top tier university in the USA (e.g., Harvard, UPenn, Berkeley) as an Indian?	How do I get into an undergraduate (business) program of a top tier university in the USA (e.g., Harvard, UPenn, Berkeley) as a German (European)?	0
353021	285753	482019	How did Maria Sharapova get into Harvard Business School?	What is it like to attend classes with Maria Sharapova at Harvard Business School?	0
353022	369173	281703	How can I create a mobile application?	How do I become a mobile application developer?	0
353023	339658	482020	How can I make foreign friends on Facebook?	How can l make some foreign friends?	0
353024	441493	482021	Who did John Wick kill in order for Viggo to let him leave the business?	Why didn't they just kill John Wick in the beginning, instead of just killing his dog and stealing his car?	0
353025	339017	93501	What should I do one day before an exam?	How do I study one day before an exam?	1
353026	482022	28944	What's the worst Tom Clancy novel?	What is the best Tom Clancy novel?	0
353027	62774	328064	What was the most awkward moment with your sister?	What is the most awkward moment in college?	0
353028	482023	482024	How can we spread humanity?	How does myxomatosis spread to humans?	0
353029	482025	482026	Does Alon Amit fully understand the Wiles - Taylor proof of Fermat's Last Theorem?	Does Alon Amit (somewhat) understand Wiles' proof of Fermat's Last Theorem?	1
353030	16500	482027	"How do I answer the question ""who am I""?"	What are the best ways to explore yourself in different fields?	0
353031	117619	180698	What is the difference between Love and liking?	"What is the difference between ""love"" and ""like""?"	1
353032	301334	23086	Do you believe in the afterlife? If so, what do you think it will be like?	Do you believe in an afterlife? If so, why?	1
353033	482028	482029	What things should I learn if I've learned python?	How long can a Warship operate without having to stop for supplies?	0
353034	482030	482031	Help! The waxing lady ruined my eyebrows! Are there any natural, tried and true ways of boosting the growth of eyebrows? Like using oils…?	How do I do valuation of a restaurant?	0
353035	482032	482033	What is the average cost of PRP treatment in Delhi, India?	What is the average cost of treatment for lymphoma in India?	0
353036	482034	482035	What is coding standards?	What is coding standard?	1
353037	482036	237074	What are some examples in which statistical data were misleading?	What are examples of deliberately presenting statistical data in misleading ways?	1
353038	78321	43271	What are some mind-blowing smartphone gadgets that exist that most people don't know about?	What are some mind-blowing Mobile gadgets that exist that most people don't know about?	1
353039	482037	482038	What is the easiest way to ship a washing machine across India?	How can I watch Dragon ball z in Android smart phone?	0
353040	25851	28646	What the purpose of life on earth?	What do you feel is your purpose in life?	1
353041	233992	264878	Which MBA stream is better to pursue a mechanical engineer as fresher?	Which stream is better in an MBA for a mechanical engineer?	1
353042	13889	13650	Is backward time travel possible?	Is time travel possible in next 5 years?	1
353043	482039	482040	Why do humans love their family members just because they're family?	Who do you love most among your family members and why?	1
353044	218552	482041	I’m upset that Trump won. What is the positive side that could help me get over it?	After Trump won is the USA really democratic?	0
353045	482042	482043	Is there a mobile or web app for work time tracking that keeps track of the previous day's left over or overworked time as well?	Highest paid captcha site?	0
353046	320118	9183	If someone is standing at a close distance and he shoots me in the face with a 50AE Desert Eagle, do I have any chance to survive?	Has the 50AE Desert eagle a almost 99% kill chance with a headshot at close range?	1
353047	84251	245423	Does the medical profession know the cure to cancer?	Can we cure cancer?	1
353048	405013	438098	Why does my bike's engine stop when it is slowed down?	How does the 1 down, 4 up gear on motorcyles work?	0
353049	254982	39327	What universities does Lincoln National recruit new grads from? What majors are they looking for?	What universities does Access National recruit new grads from? What majors are they looking for?	0
353050	79914	289268	How does it feel like to be in prison?	How does it feel to be in prison?	1
353051	176264	166270	What should I do to get a government job?	What should I do get a government job?	1
353052	482044	482045	Does the glove mode (more sensitive screen) drain the smartphone battery faster? By how much?	Which one kills a smartphone's battery faster, higher resolution or bigger screen size?	0
353053	77691	35566	What are your views about Islam?	What you think about Islam?	1
353054	4534	236092	How do you distinguish fake, plastic rice imported from China from the real rice that doesn't have plastic in it?	"Is there really ""fake rice made from plastic"" being exported by China?"	0
353055	64530	26378	How can I improve my writing skills for blogs?	How do I improve my English writing and speaking skills?	1
353056	182023	185246	How can I attain a photographic memory?	How do you develop photographic memory?	1
353057	271536	482046	Why does my vagina get so wet during sex?	Why does my vagina hurt so bad after sex?	0
353058	43988	482047	Does the freelancing website addanyproject provide fake leads?	Can you provide me the list of freelancing websites?	1
353059	482048	482049	How do I handle this situation with my boyfriend?	How do I handle this situation with my friend?	0
353060	482050	482051	Biological species concept definition?	What is the biggest limitation of the biological species concept and why?	0
353061	482052	482053	You get to marry one fictional character – who is it?	How do you get back the one you love but who decides to marry another?	0
353062	482054	482055	What are some international B2B website with free leads mainly for large quantities food?	What would Antarctica be like if it wasn't located in the south pole, climate, and geographical-wise?	0
353063	80253	70361	What is the best site to download books?	What are the best sites to download e-books for free?	1
353064	32441	482056	Who is the fastest footballer in the world?	Who is the most overrated/underrated footballer of all time?	0
353065	482057	482058	How does the ceiling fan create air flow?	What are the options for fan on a low ceiling?	0
353066	471426	109342	What are the weirdest movies you have watched?	What were the best movies of 2016? Why?	0
353067	482059	482060	What is Kantianism? What are some examples?	What are some examples of Kantianism?	1
353068	482061	482062	What are the pros and cons of doing M.Tech/M.E in Computer Science after doing B.Tech/B.E in Electrical and Electronics in India?	Can I do M.Tech in computer science after doing B.Tech in information technology?	0
353069	482063	482064	What are the differences in use between Sino-Japanese numbers or Native-Japanese numbers?	What could be the reasons for a middle class family childrens to clear JEE?Need some motivation! !	0
353070	863	3133	How do I prepare for Net JRF in English literature?	What are the name of the books for UGC net English literature?	1
353071	43721	83010	How is black money gonna go off with no longer the use of same 500 and 1000 notes?	Will demonetization of Rs. 500 & 1000 currency notes curb/eliminate corruption, black money and terrorism in India?	1
353072	482065	389154	I broke up with my girlfriend a week before. I need her back, what should I do?	I broke up with my girlfriend and I want her back. What should I do?	1
353073	44235	107408	How can I keep living when I I feel like a total loser?	What will you do if you feel like a loser?	1
353074	482066	482067	What is the SIP in a mutual fund? How do I invest in it?	Is it safe to invest in a mutual fund, especially in SIP?	0
353075	482068	482069	Are there organizations around the world that are dedicated to helping people in any way who accept volunteers/workers with no special skills?	Are there any reported people who has extra body parts that give special benefits to the person?	0
353076	21837	67129	How do I prepare for MBBS first year?	How will l be topper for MBBS first year?	1
353077	482070	482071	How does red dwarf work?	How does a red dwarf die?	0
353078	170253	173272	What is the work of a business analyst?	What is the basic role of a business analyst?	1
353079	169754	198891	What is some historical evidence that Jesus existed?	What is the evidence for and against historical Jesus?	1
353080	482072	482073	Do most atheists think most Christians are stupid?	Why do some atheists think many religious people are stupid?	0
353081	482074	136864	What could/should the future of the internet in Canada be like?	What's the future of the internet?	0
353082	64943	130771	Does penis size matters for girls?	Does penis size matter during sex?	1
353083	482075	482076	What are the main advantages and disadvantages of the separation of powers?	What purpose did the separation of powers within the US constitution have?	0
353084	482077	482078	Can I write a check to myself? Why or why not?	Are there any fashion/beauty brands that despise the Kardashians and/or Gigi Hadid?	0
353085	482079	482080	Who is the worlds richest pet?	Who is the world's richest animal?	1
353086	21693	20542	How could I improve my English?	How can I improve fluency in English?	1
353087	146040	482081	Who likes PewDiePie here?	Do you like PewDiePie?	0
353088	113744	179549	What is source of income of Facebook?	What are the sources of income for Facebook?	1
353089	284957	482082	What is leaky gut syndrome?	What is leaky gut syndrom?	1
353090	27476	383907	How can you become a travel agent?	How do I become a successful travel agent?	1
353091	133066	59990	Why do we have stage fright? How do we overcome it?	What is the best way to overcome stage fear?	1
353092	482083	482084	What are some of the functions of water when cooking food in it?	What type of food we should cook?	0
353093	482085	482086	Where can I find HONEST reviews on hair extensions and wig companies?	How do I choose a hair extension length?	0
353094	482087	482088	How do I learn the Spring Framework in-depth?	Where do wealthy individuals shop online?	0
353095	333627	482089	What can I do to lose weight?	How can I lose weight without having to do much?	0
353096	482090	461898	Why is Uranium's half-life so long?	A scientist finds [math[ 0.494\%[/math] of Carbon 14 in bones of a dead person. How long ago the person die? The half life of carbon is 5,730 years.	0
353097	482091	482092	What was your college student graduation speech?	Is the USA successful because of Americans (more broad and inclusive) or because of a handful of Americans (basically the prosperous)?	0
353098	482093	189555	As a supporter of Bernie Sanders, why should I vote for Gary Johnson?	Will Bernie Sanders supporters vote for the Libertarian candidate Gary Johnson?	0
353099	52741	8026	What is the Best photo editing apps for Android?	Which are the best photo editing apps for Android?	1
353100	482094	482095	What is adjustable blade in reaction turbine?	What is fixed blade in reaction turbine?	0
353101	130893	17616	What is a good first programming language?	What is a good first programming language to learn?	1
353102	181492	424721	How can I get admission in coep after diploma?	Can I get admission into IIT or NIT after completing a diploma in engineering?	0
353103	79354	89458	What are the best books for JEE Mains practice?	What is the best book for JEE Mains?	1
353104	482096	482097	What is it like to attend the Dr. Bessie F. Lawrence International Summer Science Institute (ISSI)?	What is the salary of a computer science PhD student for one summer as a research intern?	0
353105	482098	482099	If you demolish a house will your property taxes go down?	Is giving a tax exemption for property taxes to houses of worship a violation of the establishment clause?	0
353106	389554	281125	Who Invented the internet and how was it first used?	Who invented the internet?	1
353107	87828	229515	Why am I blocked from asking questions under anonymous basis on Quora?	Why was I blocked from adding questions on quora anonymously and how can I change it?	1
353108	482100	482101	What is the difference between Seiko and Seiko 5?	What is the difference between Seiko 5 Sport with the regular Seiko 5 ?	0
353109	96423	116988	What will happen now that Trump's president?	What will happen now that President-elect Donald Trump has won the election?	1
353110	482102	482103	I hurt my finger while playing football. It been around 1 month and still my finger has not healed completely. What might have happened?	Years back in an accident my left hand's ulnar nerve was cut off. I can't feel my pinky finger and ring finger. Since then, I've wanted to learn playing the guitar and keyboard. Is it ok to play with 3 fingers in my left hand?	0
353111	247257	423968	How can I get 1 million users to sign up to my app?	How can I get a million users on my social app?	1
353112	482104	482105	How can one merge 2 cells in Excel, A1 and A2, and then B1 and B2, C1 and C2, A3 and A4, B3 and B4, etc. without individually merging each set of cells or Copying and Pasting? *No content in the cells yet.	How do I copy data into merged cells in Microsoft Excel?	0
353113	482106	482107	Can somebody identify this top she is wearing in this photo? Is it a cardigan or a sweater?	When I turn on my mobile data or make calls my phone hangs and after sometime it reboots I am using cm11 on s3 mini?	0
353114	482108	482109	How can I learn screenwriting?	What are good ways to learn how to become a screenwriter?	0
353115	482110	482111	How can I spend my time without the Internet?	What are the best ways to spend time on the internet?	0
353116	482112	482113	I have bought a laptop on paytm ang I got a cash back of Rs.7000. Can I transfer this amount to my bank account?	I have bought a laptop on paytm and I got a cash back of Rs.7000. Can I transfer this amount to my bank account?	1
353117	482114	482115	What is the anime you have learned the most from? Why?	What anime did you learn the most from?	1
353118	263441	153778	Why am I not able to crack an interview?	How do I crack interview?	1
353119	22197	178	Which is the best laptop under Rs 60000 for gaming in India?	Which is the best gaming laptop under Rs 60000?	1
353120	482116	482117	What is salary of a B pharm MBA?	Why does Russia have a positive and legal reputation in Syria in the world, although the U.S. tries hard to badmouth Russia?	0
353121	165895	104907	What are the entrepreneurial opportunities that arise for EU countries because of the Brexit?	What new business opportunities will arise as a result of Brexit?	1
353122	482118	482119	There is Chinese people? Make a frend, ok?	What would happen to people if a roller coaster reached the stratosphere?	0
353123	482120	482121	Is it a bigger deal for athletes to succeed in the Olympics compared to the World Championships?	Is it better to win 5 world championships or an Olympic gold?	0
353124	150819	4638	Which the best water purifier?	What is the best water purifier available in India?	0
353125	482122	482123	Do pandas attack humans like other bears do?	How many human years do Giant Pandas live?	0
353126	482124	482125	Was the population exchange between Greece and Turkey beneficial for both countries?	How are you actually able to profit off of amazon FBA?	0
353127	482126	297202	How can I make my English writings better?	How can I make my English strong?	0
353128	35222	297643	How do I prevent my dog from chewing on my shoes?	How do I make a dog stop chewing shoes?	1
353129	482127	482128	Is it normal if the guy you are marrying (arranged marriage) does not talk much with you?	I am 25. A guy is deeply in love with me. If you ask me, yes, I love him too, but he does not know it. I belong to an Orthodox family. Our horoscope does not match at all. There would be fatal consequences, they say. Should I do a horoscope matched arranged marriage to make my family happy?	0
353130	482129	482130	Can someone help with a project topic/idea I can do in two weeks on a topic in group theory or any in abstract algebra?	Is Narendra Modi taking any steps to establish left equivalent right leaning media?	0
353131	482131	482132	What is the historical significance of the old Highbury Stadium?	What is the Highbury Stadium used for now?	0
353132	482133	482134	What does the ending of Requiem for a Dream mean?	An old fantasy movie which contains two brothers, they fight at the end, and the ending was everything was a dream. What's the title of the movie?	0
353133	482135	482136	What route was taken by Ken Block in the San Francisco Gymkhana?	What is the most dangerous block in San Francisco?	0
353134	482137	482138	Who is responsible for regulating the government?	Who this is then responsible for the regulating the government?	1
353135	482139	482140	If I got a Buddhist tattoo would I be disrespecting people who are actually Buddhist?	"Do many Buddhists actually ""throw away the raft""?"	0
353136	87004	482141	What are the best WhatsApp statuses in Kannada?	What is the best status u have seen in whatsapp?	0
353137	482142	482143	Which is harder GMAT or cat?	Which is better-GMAT or CAT?	1
353138	264917	482144	How much did each actor get paid to star in The Avengers?	How much salary do Hollywood actors get paid for a movie?	0
353139	335704	128058	Is it safe to have chicken and milk together, or one after the another?	Can you consume fish and milk together?	0
353140	55039	50588	What should I do to beat boredom?	How can I escape boredom?	1
353141	168072	482145	Where can I get Instagram followers for free?	What do you all do to get more instagram followers?	0
353142	482146	482147	Is “Why” the greatest question ever asked?	What is the greatest question that was never asked?	0
353143	153599	206643	What do you do when you feel sad?	What do you do when you are sad?	1
353144	482148	482149	Should the Fed raise interest rates in 2017?	Why should the Fed raise interest rates twice in 2016?	0
353145	482150	482151	How do I write an email to a company requesting for certificate?	Is it possible to repair safety valve of a pressure cooker?	0
353146	482152	10686	What was it like to study with Elon Musk?	How does Elon Musk thrive on little sleep?	0
353147	171376	104089	What were the most happiest moments in your life?	What is the most happiest moment in life?	0
353148	227805	482153	Which is best among ICICI, HDFC, KOTAK MAHINDRA, YES BANK, HSBC?	Among Axis, Citi, HDFC and ICICI, which is the best bank to open a new salary account?	0
353149	482154	482155	You studied electrical engineering,but working for TCS. Why?	I'm a master's student at the faculty of electrical engineering but I love maths and am thinking of enrolling in a PhD. Do you think it is possible to study math by yourself to prepare for a PhD?	0
353150	482156	482157	What is our favorite Drake song and why?	What is your Favorite Drake song?	1
353151	482158	482159	How do you transfer contacts from your computer to your iPhone?	How can I transfer iPhone contacts to a Mac?	0
353152	43591	80146	Can you get pregnant the day before your period starts?	Can I get pregnant a couple hours before I got my period?	1
353153	482160	482161	Can anyone identify this kind of turtle?	I scraped my car on a pole. Is this a comprehensive claim?	0
353154	19148	142246	What is the difference between transexual and transgender?	What is the difference (if any) between transgender and transexual?	1
353155	482162	482163	Which is the best photo editor in Android with all features?	Which is the best Photo editor?	0
353156	164161	33623	How do I develop analytical problem solving skills?	How can you develop your problem solving skills?	1
353157	57836	482164	Which is better, Snapdragon 625 or Snapdragon 650?	What is Snapdragon?	0
353158	116910	482165	Windows 10 issues: wifi is shown as disabled and does not enable . How do I fix this?	Why is my WiFi not showing up in Windows 10 even if it is enabled?	0
353159	482166	482167	What's the difference between a Camel Turkish, silver, gold, and royal?	Is gold/silver a good investment right now?	0
353160	482168	45527	How does guys lose their virginity?	How does a guy lose his virginity?	1
353161	234307	482169	What’s a good website that has a large library of downloadable, inexpensive sheet music for 2 violins (either older, pop or acoustic)?	Do I really have to choose either violin or cello as a musical instrument for my kindergarden child to pursue and can't do both concurrently as the technique conflicts?	0
353162	482170	482171	How do you sing Karaoke in sleeping dogs?	Why do you have to sing karaoke in Sleeping Dogs?	0
353163	118027	447696	What is the current post study work visa options for undergraduates in the united kingdom?	Will UK Open the Post Study visa for International Students?	1
353164	482172	482173	Is it worthwhile to take break for a year and solely prepare for CAT?	Is it a good decision to take a one year education gap & prepare for CAT?	1
353165	482174	301020	"How do you say ""We love you""  in Polish?"	"In Hindi, how do you say ""my love""?"	0
353166	165824	286472	"What will Google name their Android versions after they finish with the alphabet ""Z""?"	What will Google name the next Android version after Android Z?	1
353167	124435	482175	Is Donald Trump a good person?	Do you think that Donald trump is a actually a good person?	1
353168	102820	8536	Will starving yourself make you lose weight?	How safe is for you to starve to lose weight?	1
353169	482176	482177	"Who is the Adam the lyrics to Blink-182's ""Adam's Song"" are written about?"	"Which Blink-182 band member wrote the lyrics to ""Adam's Song""?"	0
353170	195976	193092	How can I improve my IELTS writing skills?	How can I improve my academic writing for IELTS?	1
353171	29935	311166	How can I make money as a 13 year old?	How can a 13 year old make money?	0
353172	305106	189843	What are the best Places in India to visit with friends?	What are some of the best places to visit in India with friends?	1
353173	482178	482179	Who is the world 's greatest fearless batsman and why?	What is the bravest thing ever done by a cricketer?	0
353174	32779	482180	How can I improve the growth of my beard?	How can I improve my beard?	0
353175	163347	482181	What is the difference between visual design and user interface design?	What is the difference between user experience and user interface design?	0
353176	482182	482183	What are the mechanical properties of copper?	What are mechanical properties of iron metal?	0
