id	qid1	qid2	question1	question2	is_duplicate
380176	511781	511782	What is consistency level generally people using Cassandra follow (say you have 10 node cluster)?	How do I avoid OutOfMemory error in Cassandra cluster when multiple application instances are accessing the Cassandra cluster (with replication factor as 3) on 3 nodes?	0
380177	511783	511784	Why are my feelings saying that she is cheating on me when she gets back from hanging out?	Why has my ex cut me out of her life when I told her that I wanted her back, even after we continued being friends after officially 'breaking up' for some months? Is she dishonest when she says that she still cares for me?	0
380178	321682	294250	How do I get 1TB of free data space?	How can I store 1TB of data in the cloud for free?	1
380179	511785	511786	How can we find the shortest m-connected path if the pixel values are given in matrix form?	How can I calculate the shortest path, if the path lengths are not summed but multiplied?	0
380180	511787	511788	Why is windows phone unpopular?	Why are Windows phone more popular compared to other mobile phones?	1
380181	511789	511790	When is the SBI IT officer exam?	When will be the next SBI IT officer exam?	1
380182	511791	511792	Do I look Greek, Turkish, Italian, Arabic, latino, Egyptian or Spanish?	Do I look Greek, Turkish, Italian, Arabic, Spanish, north-African, southern-European or Egyptian?	1
380183	267646	290170	Ancient Greece: What happened after the Trojan war?	What happened to the Trojans after the Trojan War?	1
380184	511793	511794	Why was 9/11?	Why was 9/11 so successful?	0
380185	38450	98866	What’s your top 10 list of horror movies?	What are the 10 greatest horror movies of all time?	1
380186	481814	128938	Who was the first Game of Thrones character you liked?	Who is your favourite character in Game of Thrones? And, why?	0
380187	511795	511796	Why are there different opinions among the astrologers?	Why do different astrologers give different opinions about the same horoscope?	1
380188	511797	511798	What are the advantages of breadth-first search?	What is a breadth first search?	0
380189	511799	193472	Can REST API and REST concepts be applicable to FTP also?	What are RESTful APIs and how do they work?	0
380190	511800	511801	Why women in India are not allowed to take sports as their career?	Why can’t India be as open as the USA in the matter of wearing a flag made of graphic cloth?	0
380191	33385	39583	Are conspiracy theories ever true?	Which are some of the conspiracy theories that later on proved to be true?	1
380192	511802	511803	How can I download samsung music player on j7 marshmallow?	Which Lennon songs did McCartney dislike?	0
380193	65141	27075	How do I make cake?	How does one make a cake?	1
380194	511804	511805	What is the best thing about your religion?	What's the most interesting thing about your religion?	0
380195	29371	16340	What is the Sahara, and how do the average temperatures there compare to the ones in the Syrian Desert?	What is the Sahara, and how do the average temperatures there compare to the ones in the Great Sandy Desert?	1
380196	354300	511806	What business can I start with 30000 RS in Hyderabad?	I have Rs 30000, what is a good small business that I can start with it?	1
380197	51466	511807	How do the tourist attractions on the Scandinavian Highlands compare to attractions in Iceland?	How do the tourist attractions on the Scandinavian Highlands compare to attractions in Andorra?	0
380198	98352	511808	How are the SRM rooms?	How is SRM?	0
380199	162675	225038	What is Universalhunt.com?	What is 19pencils.com?	0
380200	398338	511809	Was it appropriate for Meryl Streep to use her Golden Globes speech to attack Donald Trump?	Should Meryl Streep be using her position to attack the president?	1
380201	511810	511811	How effective is Sun-In hair Lightener on dark brown hair?	How do I lighten dark brown hair in the sun?	0
380202	511812	511813	What is RAW.?	What does RAW mean?	0
380203	86755	3822	How can I recover saved snapchat messages that disappeared?	How do I delete messages on snapchat that the other person has saved?	0
380204	296480	235946	What is the single most important thing in your life right now?	What is the single most important thing in your life today?	1
380205	511814	511815	Is Newton's 3rd law always correct?	Is newtons 3rd law always true?	1
380206	511816	29419	Why did you hire Debbie Wasserman-Schultz and sabotage the campaign of Bernie Sanders?	Why has Elizabeth Warren not endorsed Bernie Sanders?	0
380207	511817	284123	What strikes first time visitors as special or unusual when they arrive in Hyesan, North Korea?	What strikes first time visitors as special or unusual when they arrive in Sinuiji, North Korea?	0
380208	67739	511818	How do I find out on which day I created my Instagram account?	How do I find out more about the new business accounts for Instagram?	0
380209	511819	511820	Where is a good place to meet intelligent and selfless people?	Where is a good place to meet selfless people?	0
380210	28248	209908	What is a good website for free books?	Which are the website for Free download pdf books?	1
380211	153227	26081	If somebody is smoking weed around me, is it possible to get high off of second hand smoke?	Can you get high off of second hand marijuana (weed) smoke?	1
380212	511821	511822	How should an individual study films?	How can I study film in Canada?	0
380213	35454	272116	I would like to prepare for KVPY SX.How can I do it?	How should I prepare for KVPY Class 12?	1
380214	170020	114856	How do I start export business in India?	How do I start an export business of saris from india?	0
380215	47105	511823	What is your favorite historical event?	What is your favorite photo of a historical event in history?	0
380216	375989	244570	Is SRCC GBO worth joining or is it a course with only a name and not any structure?	How is GBO course of SRCC in terms of placement and faculty?	1
380217	129580	54413	How can I increase my IQ?	How can one increase and improve his IQ?	1
380218	5358	17135	What's the best plan to lose weight?	How do I actually lose weight?	1
380219	511824	268840	Has anyone signed out of iPhone iCloud and then discovering difficulty signing back into iCloud?	How do I sign out of iCloud on my iPhone?	0
380220	511825	511826	"What is the meaning of ""How do you do? "" and why should the reply to this be the same?"	What does it mean when a CEO does not reply to your question?	0
380221	511827	511828	I like my coworker and I think he likes me too but not sure. how can I reciprocate since I am scared to share as he is my senior too?	How do you think America's race relationship will be like if Trump wins?	0
380222	511829	511830	What are some great places to live near London Bridge?	What are the best places to live with children relatively near London bridge?	1
380223	362790	182843	How do I settle in canada?	What is the easiest way to settle in Canada?	0
380224	511831	511832	What is the best sci-fi/fantasy book of all time? Why?	What are the best sci-fi books for teens?	0
380225	64447	311299	What is the worst thing you have done in your life?	What is the worst thing that you did in your life?	1
380226	47770	78198	What hotel in Nepal would be safe for unmarried couples, without the harassment of police, hotel staff, and moral police?	What hotel in Varanasi would be safe for unmarried couples, without the harassment of police, hotel staff, and moral police?	0
380227	511833	437283	What kinds of anti-gravity performance tests do astronauts need to go through?	What kind if training do astronauts in NASA go through?	0
380228	511834	511835	If a libertarian owned an oasis in the middle of a desert could he justify refusing access to water to someone in danger from severe dehydration?	Is it really a good thing to dream high? Is it like looking and running towards an oasis in a desert, which turns out to be a mirage, and later realizing that you had a small water bottle in your backpack (I am talking about small things like friends, family, nature etc.)?	0
380229	39658	55785	Which phone should I buy under INR 15K?	Which mobile phone is the best under 15k?	1
380230	3477	67070	What made Tata group chairman Cyrus Mistry to quit?	Why has the Tata sons board voted to remove Cyrus Mistry as chairperson?	1
380231	48411	3704	Is there a question limit on Quora?	How many questions have been asked on Quora?	0
380232	511836	511837	Without net neutrality, would we have password managers?	Would password managers be blocked without net neutrality?	1
380233	475481	511838	What do teenage boys think about girls?	What do teenage boys think when a girl stares at them?	0
380234	44643	249139	Why does water evaporate at room temperature, even though it has a boiling point of 100 degrees Celsius?	Phase Transitions: How does water evaporate below its boiling point?	1
380235	135335	72097	How can I stop comparing myself with others?	What can I do to stop hurting myself by comparing myself to others? I want to be at peace and be happy. What can I do?	1
380236	511839	511840	Why do some countries appear out of alphabetical order in the Olympics?	Is the exponential model for BJTs used in practice?	0
380237	511841	511842	How do I stop wasting time and get motivated to do useful things? I am 30 year old mom of 2 with single income,i still watch TV in spare time	How do I prove to my parents that I can be independent and responsible for my life? I am 21 and still living with them and still studying though. Will be working in 2 years time if all goes smoothly.	0
380238	511843	511844	Did the Obama administration or Secretary Clinton frame Marc Turi?	Icons of my Android phone have suddenly become larger than they were before plzz help me.what shud I do to revert the size?	0
380239	511845	511846	Are scorpios funny?	How do Scorpio men show love?	0
380240	511847	140040	What is the cheapest air ticket booking website available in India?	What are some tricks to book cheap air tickets in India?	0
380241	5741	31700	Can a girl get pregnant after her last day of periods?	How do I get pregnant just after my periods?	1
380242	511848	286526	If Pakistan wants Jammu and Kashmir then why did they give parts of Pakistan Occupied Kashmir (Shaksgam Valley) to China?	Why did Pakistan cede parts of Kashmir to China?	1
380243	511849	511850	Marmara University: Im looking for flatmates to my house in kadikoy which is so close to goztepe campus?	Is it okay for my roommate's guest to invite people over to our house? Is it okay for my roommate to host a guest while she is out of town?	0
380244	238350	10182	What did you learn from your life experiences?	What are some of the best life tips?	0
380245	511851	433611	Is sleep paralysis unhealthy?	Is sleep paralysis dangerous?	0
380246	511852	511853	How do I run the official Ghost image on Docker using a custom config.js?	Can we convert a virtual machine to a docker image?	0
380247	506347	511854	I have a glass screen protector on my iPhone 6 and I cracked my screen protector does that mean the real iPhone is cracked too?	How do I put a screen protector on an iPhone 6?	0
380248	113228	511855	"Why is the line ""but I was going to Tosche Station to pick up power converters"" so iconic for people?"	Are Grey Jedi more powerful than Jedi?	0
380249	511856	511857	What are the best ways to write effective answers, essays and precise for UPSC Civil Services and UPSC CAPF? Any suggested books or blogs?	What is the best way to crack the english paper of capf assistant commandant?	0
380250	191262	4424	What does everyone think of last night’s New York debate between Donald Trump and Hillary Clinton?	What do you think about the first presidential debate between Hillary and Trump?	1
380251	511858	511859	Would you go on a dating reality show for a year if they paid you a million dollar?	I'm doing my 2nd year engineering rite now! Nothing can stop me from loving biology! I badly wanna study medicine! What is it I can do about it?	0
380252	511860	511861	How do I study history efficiently for the IAS?	How do I study history for IAS?	1
380253	493712	402261	What does a 2 months pregnant belly feel like?	What does a 2months belly look like?	1
380254	319400	14409	What is the hardest thing(s) about raising children in Bhutan?	What is the hardest thing(s) about raising children in Australia?	0
380255	196113	511862	What are the best ways to prioritize a list of product features?	What is the best way to prioritize bugs among many products?	0
380256	8438	139891	What companies would you recommend to buy a used rental car from?	Is it ok to buy a used rental car?	1
380257	470895	430816	How many calories does walking for an hour/per hour burn?	How many calories would you lose by walking for an hour?	1
380258	511863	511864	Why do people in India generally marry in lavish clothes?	Why do people like lavish weddings (especially in India)?	0
380259	511865	511866	Is it safe to use liquid bandage on my dog?	Is it safe to use liquid bandages on my dog?	1
380260	511867	511868	What are the benefits of a small family?	What are the advantages of having a small family?	0
380261	193555	511869	What secrets do women not want men to know?	What are the secrets that women don't want to tell to men?	1
380262	511870	2559	What is the best diet to run fast?	What are the best ways to lose weight?	0
380263	511871	511872	When people are watching the indian serials?	When people are watching the indian TV serials?	1
380264	441321	477364	How is the economy of a country affected by an increase in population or birth rate?	How will lower birth rates affect the population?	0
380265	511873	511874	How do you reset your Motoblur?	How can you reset a Motoblur?	1
380266	511875	144429	Why is Borderline personality disorder so contradictory?	Is borderline personality disorder hereditary?	0
380267	138021	16832	How do you know what you want in life?	What do you want in life?	0
380268	33292	155548	Why did Indian government scrap Rs 1000 and 500 note and instead is introducing Rs 2000 note?	Why has government taken out rs 2000 note?	1
380269	362441	18703	What's your favorite James Bond movie?	What is your favorite James Bond movie and why?	1
380270	175556	167697	Can I buy two Jio sim for different phone with same Id proof?	How many Jio SIMs can we take on one ID?	0
380271	511876	511877	Is accounting a lucrative field to work in? Why?	What socially beneficial work can be lucrative?	0
380272	511270	240479	How do I create my own website from scratch?	How can I learn to create a website from scratch?	1
380273	82562	64795	What are the best new camping gadgets that most people don't know about?	What are some mind-blowing camping adventure gadgets that exist that most people don't know about?	1
380274	115362	511878	How do I stop the automatic sending of unwanted LinkedIn invitations?	How can I cancel send request on LinkedIn?	0
380275	511879	511880	What´s the best software to create mockups / drafts of websites?	What is the best mockup framework?	0
380276	160	12131	What's the purpose of life? What is life actually about?	What should the purpose of your life?	1
380277	188513	33319	What are some tips on making it through the job interview process at Express?	What are some tips on making it through the job interview process at Etsy?	0
380278	156746	452898	How did the universe begin?	Did the universe have a beginning?	0
380279	511881	177217	When can we expect humans to go to Mars?	When can human possibly go and land on Mars?	1
380280	511882	511883	How can Khan Academy be improved?	What can Khan Academy do to improve its platform?	1
380281	511884	46275	What are the causes of inflation in India?	What are the impacts of inflation on India?	0
380282	511885	481575	"What comes to your mind when you hear the word ""Filipino""?"	"What comes to your mind when you hear the word ""Australia""?"	0
380283	511886	511887	Boarding school for average school?	How can I get up early in the morning, when I have sleeping late habit. How shall I change it?	0
380284	41031	160028	What were the most romantic moments of the Rio Olympics in 2016?	What were the most touching moments of the Rio Olympics in 2016?	0
380285	429071	201701	Can Donald Trump build the wall?	How will Donald Trump build the wall?	0
380286	201125	511888	Who wants to bring back their lost love?	Do you know an angel-backed company who wants to improve their investor reporting?	0
380287	511889	511890	What should I do as I dropped non user removable battery phone in water?	How can you justify Quora to be better than reddit?	0
380288	33270	21002	What type of government does Turkey have? How does it compare to the one in Egypt?	What type of government does Turkey have? How does it compare to the one in Japan?	0
380289	511891	511892	What are some things new employees should know going into their first day at Williams-Sonoma?	What are some things new employees should know going into their first day at Williams?	0
380290	511893	511894	Why do I feel awkward talking to a girl when someone is around? How do I improve?	I feel hopeless. I need to talk to someone about it. Can someone talk to me?	0
380291	511895	511896	I'm a 3rd year B.Tech CE student. How will I prepare for the GATE examination?	I am an ECE 3rd year student. How can I prepare for the GATE without any coaching?	0
380292	96009	8795	What is a suitable inpatient drug and alcohol rehab center near Will County IL?	What is a suitable inpatient drug and alcohol rehab center near Champaign County IL?	0
380293	420327	395049	How can I apply to join Accenture?	What is the placement process of Accenture?	1
380294	511897	511898	I am considering buying processed cardamom directly from planters in the neighbouring state in reasonable quantities and selling it to restaurants, food suppliers and shops. What is the license type required for this business, transportation across states, etc., in Bangalore?	Why is there hunger in the U.S. when we have so many fast food restaurants that sell food (burgers, tacos, etc.) for $1?	0
380295	396269	511899	Bicycle Mechanics & Maintenance: Is it possible to clean the rust from a bike chain?	How do you get rust off a bike chain?	1
380296	24734	25911	How can I speaking fluently speaking English?	How will I improve my spoken English?	1
380297	511900	511901	I want to fuck as many women as I can in my life? How can I achive it?	Why does my ex-boyfriend want to tell me about the new women in his life?	0
380298	511902	103951	What hotel in Kudremukh Hill-station would be safe for unmarried couples, without the harassment of police, hotel staff, and moral police?	What hotel in Srinagar Hill-station would be safe for unmarried couples, without the harassment of police, hotel staff, and moral police?	0
380299	275703	19633	Who is by far the best politician of India?	Who is the best politician in India? Why?	1
380300	511903	511904	Where can I find criminal court bundle examples to use in the Court of Appeal?	In the court of law, is an appeal a constitutional right?	0
380301	511905	511906	How different are the Vietnamese and Khmer languages?	Is Vietnamese (language) 'sinicized' Khmer?	0
380302	198718	506482	Which book makes/changed your life?	What book is the most life-changing?	0
380303	511907	511908	What is the minimum percentile needed in CAT to get admission in Irma?	What is the average percentile needed in CAT to get admission in a decent college?	0
380304	511909	511910	Life of project engineer at Wipro after campus placement?	Is it necessary to behave properly with unimportant persons?	0
380305	511911	511912	What are some overrated things in life?	What are the most overrated things in life?	1
380306	511913	511914	What are the disadvantage of stream processing?	What are the advantage of stream processing?	0
380307	511915	511916	Which comes first, wisdom or discernment?	Does this count as wisdom?	0
380308	511917	11733	Is it justifiable for non-white people to hate white people/say they hate white people?	Why do some white people hate non-white people?	0
380309	511918	511919	For passport issue, if I have stayed less than a year at a current address, will I always get an adverse report? Will it automatically resolve when the previous address report is clean?	I have been residing at my current address for 6 months due to which I got adverse PV report, will I receive a passport?	0
380310	511920	40966	How can you introduce yourself with a rhyme or a poem (at least 10 lines)?	How can you introduce yourself in an amazingly unique way?	0
380311	110389	212755	What are some unexpected things first-time visitors to Pakistan notice?	What are some unexpected things first-time visitors to Brazil notice?	0
380312	414936	106316	How Do I become a product manager?	How do I become a good product manager?	1
380313	511921	511922	Prisons and Prison Life: What is it like to be a married inmate?	How are inmates connected to healthcare services in prison?	0
380314	511923	511924	Whose face was on the dime before FDR?	Was FDR considered to be a good president?	0
380315	511925	228666	Has anyone been arrested for downloading torrent in India?	Has anybody in India been arrested recently for accessing torrent sites?	1
380316	511926	511927	How bad is Daisy's Destruction?	How do I deal with a bad mouthed and bitchy mother?	0
380317	511928	265297	How could I lose weight without getting depressed?	How do I motivate myself to lose weight?	0
380318	34097	3408	Can you get high from eating weed? Why or why not?	What's the best way to get high from eating weed and why?	1
380319	250947	134531	Is there any facial hair removal cream?	Is there any way to remove facial hair?	0
380320	511929	511930	Would I not be able to graduate high school if I got a F in the first semester of my Senior year?	What would you do if you had a gap semester your senior year of high school?	0
380321	97038	200901	Which company makes the best DSLR?	What is the best basic DSLR camera and lens to buy for the beginners?	0
380322	511931	511932	How fast does a passenger train travel in the US?	How are passenger trains heated?	0
380323	511933	11729	What are the best PC gaming brands?	What is the best PC game?	0
380324	511934	511935	What are average purchase orders on apparel for small to medium sized retailers in the USA?	Should the US be run as a Business?	0
380325	511936	511937	What is the weirdest thing you have Googled?	What is the weirdest thing you searched on the Internet?	1
380326	342024	308243	What are disadvantages of using KMSPICO for activating Windows 8.1 instead of a real activation?	Where can I find the latest version.of kmspico to activate windows 10?	0
380327	511938	511939	How much your networth should be a billionaire in India?	What are the common elements of Callisto?	0
380328	511940	269933	How can I have a cover designed for my eBook?	What is the best way to create an ebook cover?	0
380329	99380	8475	How can some people still believe the world is flat?	Why do some people still think the Earth is flat?	1
380330	511941	298088	What is the true definition of merit?	"What is the true definition of a “Tensei""?"	0
380331	57950	63598	How can I lose 30 pounds in 30 days with a workout plan?	What is the fastest way to lose 30 pounds in 1 month?	1
380332	511942	511943	Will Quora be next big thing after Facebook?	Is Quora the next big thing after Facebook and Twitter?	0
380333	511944	511945	What can be a reason for a dog to be limping and shaking?	What are some reasons why my dog would be limping?	0
380334	156638	477665	How can I find a job I really like?	How do I fInd a job that I really want?	1
380335	511946	405603	How do you delete a Imagekind account?	How do I delete my Paytm account?	0
380336	331916	511947	What would you like to see in the next Elder Scrolls game?	How can the next Elder Scrolls game improve over Skyrim?	1
380337	511948	511949	What would the American education system look like for generation alpha?	What will the American education system look like in 2050?	0
380338	224839	511950	How do you think more creatively?	How does one become more creative?	0
380339	479454	511951	How do I overcome my emotions?	How can I overcome emotional eating?	0
380340	511952	89730	How do I write a high level (English) essay?	I have to write an essay about myself. How should I begin (and end) the essay?	0
380341	511953	511954	Why is sex stigmatized?	Why is/was sex so stigmatized?	1
380342	185089	412713	Is it possible that dinosaurs are still alive, but humans don't know?	Do dinosaurs still exist and is it possible to contact and communicate with them?	1
380343	511955	480553	Why is Breast Cancer Awareness Month in October?	When is Breast Cancer Awareness Month?	0
380344	511956	434105	How do molecular compounds and ionic compounds dissolve in water?	Is SO2 an ionic compound?	0
380345	82525	163570	Where can I get comprehensive written advice in Sydney for any property transaction?	Where can I get very smooth and uncomplicated assistance in Sydney for any property transaction?	1
380346	511957	511958	What is Uruguay like?	What does Uruguay mean?	0
380347	511959	511960	In what ways does a case arrive to the Supreme Court?	What is the stability order of Alkali metal chlorides?	0
380348	277974	15196	If you could ask anyone alive one question that they would answer with complete honesty who would it be and what question?	If you could get now instantly and completely guaranteed right and complete answer to ANY of your questions, which one question would you ask?	1
380349	511961	511962	Is maladaptive daydreaming just a symptom of ADD?	Can anyone see a link between binge eating and maladaptive daydreaming?	0
380350	162585	511963	What is matrix learning?	What is a matrix?	0
380351	511964	511965	How much package I can get through eLitmus?	Is it good for Tamilans to live in Bangalore?	0
380352	511966	420994	Why is Wikipedia better than Quora?	Is Quora better than Wikipedia?	0
380353	511967	75155	What is the best way to get into the Star Wars universe?	What is the best order to watch the Star Wars series?	0
