id	qid1	qid2	question1	question2	is_duplicate
357720	450495	487122	Can Instagram users see who and how much times someone viewed their story?	Can you see if a user with a private account has viewed your public story?	0
357721	487123	487124	Why tata motors for ece students?	What kind of projects are done at Tata Motors LTD for ECE students?	1
357722	487125	55091	What is the easiest way of success?	What is the best way to success?	0
357723	200359	35392	"What is the ""Mysterious Bermuda Triangle""?"	What is Bermuda triangle mystery?	1
357724	55083	6804	How can I stop masturbation?	How should I stop masturbating?	1
357725	304582	235059	Why do teachers study sociology of education?	What is the sociology of education? Why is its role in teacher education important?	1
357726	46876	177796	Wwe is real fight?	Is pro wrestling fake?	0
357727	487126	403228	How do I track, and run reports for views/clicks/etc. for businesses advertising on my own website?	I am a very busy person and I run my own company; how do I keep track of what my children do from my desk?	0
357728	487127	33215	Is it worth doing an MS in computer science from the USA from a 100+ ranked university?	Which are the best/good universities in USA for MS in computer science and is it worth doing it?	0
357729	15440	54022	Why don't we have cars that run on water?	Can you run your car on water?	1
357730	487128	188547	How do I lose weight in my face?	How do I gain weight on my face?	0
357731	218088	32080	What are some of the most important lessons you have learnt in 2016?	What important lessons you have learnt in 2016(year)?	1
357732	487129	487130	What are the problems faced by Indian cities?	What are the biggest problems youngsters living in major cities face?	0
357733	487131	487132	What is the most craziest thing you ever did in your life?	What is the most craziest thing ever did in your life?	1
357734	487133	487134	What universities does UCT Industrial Manufacturing recruit new grads from? What majors are they looking for?	What is business correspondence? What are some examples?	0
357735	487135	487136	What stuff is illegal to do on the internet in the USA?	Should lying on the Internet be illegal?	0
357736	487137	178846	What are some great side dish ideas that go with salmon?	What are some great side dish ideas for salmon?	1
357737	55388	437431	Why is Pokémon GO so popular?	Why is Pokémon GO more popular than other games?	1
357738	487138	487139	What is nifty?	What is Nifty Futures?	0
357739	61890	487140	Will the EU allow the UK to remain in the single market after Brexit, and if so, under what conditions?	Why would the UK not be able to remain as part of the European single market post-Brexit?	1
357740	27660	176546	Is there a scientific name for what existed before the Big Bang?	What existed before the creation of our universe?	1
357741	487141	105572	How do I deal with dandruff and hair fall in bangalore?	How do I deal with dandruff and hair fall?	0
357742	487142	487143	Is it possible to clear KVPY without coaching?	Is it necessary to clear KVPY for IIT?	0
357743	11091	20607	What is the fastest way to lose weight safely?	How can someone lose weight quickly?	1
357744	487144	53030	Is there any way to prove that sin (180-A) =sinA?	How can we prove life after death?	0
357745	487145	487146	What is the best camera for black and white photography?	What is the best black and white film for scanning?	0
357746	96888	365595	How do you say, “Stay strong” in Arabic, if you are a guy?	"What is the correct way to say ""thank God"" in Arabic?"	0
357747	487147	487148	Can I claim married in my pay stub if I'm single?	Can I claim married on my pay stubs if I'm single?	1
357748	487149	487150	Where can I find joggers for taller women?	I want to work outside India as an EC engineer, what are the academic requirements that I will need?	0
357749	487151	287905	Which institute is best for CAT preparation in Chandigarh?	Which is the best coaching institute for CAT in chandigarh?	0
357750	349589	487152	What is the difference between 'had been', 'has been' and 'have been'?	Grammar: How do I change the sentence from active voice to passive voice: 3. The milk had been knocked over by a cat.?	0
357751	295848	153842	What is an accurate way of finding my IQ Score?	What is the most accurate way to measure IQ?	1
357752	107831	6782	What is your favorite book, why?	What is your favorite book of all time and why?	1
357753	487153	487154	How much of people's LinkedIn is bull shit?	What is it like finding a mate being of a fist generation family in America?	0
357754	31558	130001	Which is the best digital marketing company in india?	Which companies are doing best in digital marketing?	0
357755	487155	487156	What does the suspension of Renan Calheiros, formerly president of the senate, reveal about the current political crisis in Brazil?	I feel isolated as a female business entrepreneur in the arts industry. How can I fix this when it's difficult to meet people like me in this field?	0
357756	487157	487158	Why can't people understand feelings?	Why can't I understand feelings?	0
357757	487159	174946	Is 'Binoculars' singular or plural?	Is “pizza” a singular or plural word?	0
357758	487160	487161	Which is faster the MacBook Air or MacBook Pro (2016)?	Which MacBook is better to get? A 2015 MacBook Air or the MacBook Pro?	0
357759	45954	30511	Is there Wi-Fi on airplanes?	How does the Wi-Fi on airplanes work?	1
357760	487162	487163	Which is better: capital punishment or life imprisonment?	Is the equation for gravity and gravitational force the same?	0
357761	487164	487165	What is J2EE used for ?	What is a j2ee?	0
357762	167354	487166	When you hide a Facebook post on your timeline, does your friend who posted it still see the post on your timeline? Or can they see that you hid the post?	I would like to limit the audience of a post someone made to my timeline, so that only a certain Facebook friend list can see it. How do I do this?	0
357763	487167	131178	How come when I call, It always goes to her voicemail?	What does it mean when a phone rings once and then goes straight to voicemail?	0
357764	487168	90426	Which is the best SUV around 12Lac?	What is the best SUV?	0
357765	308959	164141	What is the difference between red meat, white meat and dark meat?	What is the difference between red meat and white meat? Which one is healthier?	0
357766	160512	7883	Which laptop should I buy under 70k?	Which laptop should I buy under 60000?	0
357767	79226	87551	Can anyone tell me some real life karma experiences?	Are there real life karma police?	1
357768	295462	487169	What are different ways to generate a B2B sales lead in India?	What are the best ways to generate B2B leads on a low budget?	0
357769	36509	286260	What real verifiable evidence is there that Jesus was crucified?	Was Jesus a real person?	1
357770	526	20342	What is your creative New Year's resolution for 2017?	What is your resolution for 2017?	1
357771	422077	38171	What is this upvote and downvote in Quora?	What is an upvote on Quora?	1
357772	487170	487171	Is it legal to pretend to be a police officer as an ethical hacker?	Placement related work?	0
357773	253554	7189	How do you apply to google?	Can anyone apply to Google?	1
357774	33619	366749	How can I get better in math?	What are some ways to get better at maths?	1
357775	487172	487173	What would happen if you went back in time and killed your grandfather?	What would happen if you are able to travel to the past and kill your grandfather?	1
357776	487174	136271	How do you learn to enjoy studying?	How can I enjoy studying?	0
357777	487175	89469	Why do people hate banks?	Why do people hate?	0
357778	484728	487176	What are the most surreal places to visit?	What are the most surreal places in Chicago?	0
357779	487177	487178	What are the products of digestion that are absorbed by the small intestine?	What is the end product of fat digestion? What process does it go through?	0
357780	487179	487180	When do you feel the happiest?	When do you feel happiest?	1
357781	33112	8624	Who is better, Clinton or Trump?	Why is Hillary Clinton a better choice than Donald Trump?	1
357782	487181	487182	What are examples of things made of porcelain?	What are some examples of things made out of metal?	0
357783	487183	407604	How do I control my mind?	What should I do to control my mind?	1
357784	5725	36338	How can I get a list of my Gmail accounts?	How can I find all my Gmail IDs?	1
357785	487184	487185	How is information management system domain in Capgemini?	What is the nature of a management information system?	0
357786	96287	487186	What should BJP do to win upcoming Punjab and UP Elections?	What should BJP do to win upcoming UP Elections?	0
357787	487187	487188	How much should an event consultant charge?	How much does an event consultant charge?	1
357788	487189	487190	Why transformers are not characterized by power factor?	Why does power in transformer is represented without power factor?	1
357789	19491	109276	The moon goes around our planet earth. The earth goes around the sun. The sun goes around the supermassive black hole, black hole goes around what?	What does the Milky Way galaxy orbit?	0
357790	487191	487192	What times are banks usually open?	How do I open a current account in any bank?	0
357791	158312	432245	Which are some of Best YouTube videos to learn Japanese?	What are the good channels available in YouTube for learning Japanese?	1
357792	135550	487193	What are the pros and cons of living abroad?	What are the pros and cons of studying abroad?	0
357793	308613	487194	Which one is better, NVIDIA GTX 1050 TI 4GB or NVIDIA GTX 1060 3GB?	Should I ask for the GTX 1050, 1050 ti, or the 1060 for Christmas?	0
357794	487195	487196	What laundry detergent do you use?	What are the best laundry detergents?	0
357795	52069	30253	How can I know if a. guy likes me?	How do I know if a guy likes me in office?	1
357796	433007	487197	Does the President's Book of Secrets exist?	Who was the craziest U.S. President?	0
357797	473159	390801	Why do I need to philosophize with others?	Why do we need to philosophize with others?	1
357798	80219	42092	How do I learn basics of stock market?	How do you join and start investing into the stock market?	1
357799	487198	487199	How many wives did Akbar have?	How many wives did akbar have? And their names?	1
357800	419568	487200	What are the differences between Computer Engineering and IT Engineering?	What is difference between a computer science engineer and an IT engineer?	1
357801	99661	241356	How do I reduce my weight?	How do I reduce body weight?	1
357802	116769	31846	How safe is Papua New Guinea, and how does it's crime rate compare to Afghanistan's?	How safe is Papua New Guinea, and how does it's crime rate compare to Albania's?	0
357803	487201	487202	"Is it reasonable to theorize that a child who gets in trouble in a good school might do better in a worse school where he""s not ""the bad kid""?"	Team, I am planning to get certified in Prince2 Foundation Course. Please advise as how can I start?	0
357804	353530	456336	How much water should I drink everyday?	How much water should I drink during eating?	0
357805	487203	487204	If India for Balochistan so why not Pakistan for Khalistan?	Is India engaging in the destabilization of Pakistan through the R&AW? What role does it have in the activities of the Balochistan Liberation Army?	0
357806	487205	487206	Which is the best way to learn AngularJS?	What is the best way to learn AngularJS?	1
357807	487207	487208	What is aviation course?	What is aviation?	0
357808	12241	180415	What would be your New Year resolutions for 2017?	What are some of your New Year's resolutions for 2015?	0
357809	487209	487210	Is Morocco a safe travel destination?	Is Morocco safe to travel to right now?	1
357810	487211	138982	Florida State Football Live Stream | Watch Florida State Seminoles Football Game Today Live Streaming Online?	Indiana Football Live Stream | Watch Indiana Hoosiers Football Game Today Live Streaming Online?	0
357811	487212	487213	What is the main function of nuclear plants?	What is the purpose of using nuclear power plants?	1
357812	487214	487215	If Jains do not want to harm any one why do they harm plants and still consider it okay?	If cigarettes, alcohol, fire crackers etc are harmful to health, why are they still manufactured? Why doesn't the government stop its production?	0
357813	293238	166066	What are integer solutions?	What are integers?	0
357814	487216	436488	What is the most interesting conversation between a strange boy and girl?	What are the most interesting conversations between a boy and a girl?	0
357815	487217	487218	How do I give a girl an orgasm just with nipple stimulation?  Can only sucking a woman's breasts make her climax?	What's the most unusual place you made love?	0
357816	16077	487219	What do you think of the allegation that the DNC planned a sexually tinged fake Trump job posting on craigslist?	What are your views on the recent allegations of online sexual harassment against Professor Walter Lewin? Do you think MIT is justified in removing all his courses from the MIT OpenCourseWare and edX platforms?	0
357817	487220	487221	How do I make Vim open with predefined headers for a new C/C++ file?	How to open file in Firefox using vim editor	0
357818	487222	143706	What is the hardest thing(s) about raising children in Greece?	What is the hardest thing(s) about raising children in Brazil?	0
357819	487223	24461	How can I get girls to be interested in me?	How do you get a girl to like you?	0
357820	439399	81866	If you had to change one thing about Quora, what would it be and why?	What is If there was one thing you would like to change about Quora what would it be? That one thing where Quora need to improve?	1
357821	487224	487225	Does/Should the Be Nice Policy apply to individuals who are not on Quora?	Does the be nice be respectful policy apply to public figures or just to people on Quora?	1
357822	313328	487226	In December my family will go on a travel. I have to choose Hawaii or Australia. Which one should I choose?	My parents gave me $250 for travelling. I have a passion for cycling too. I have to choose just one option. Should I travel or buy a bicycle?	0
357823	487227	487228	What are your favorite quotes?	What are the greatest quotes about love?	0
357824	487229	487230	What are applications of orthogonal trajectories?	What are the orthogonal trajectories and what are some of its applications?	1
357825	168019	75155	If I want to watch Star Wars, where should I begin if I never watched any episode or movie of Star Wars?	What is the best order to watch the Star Wars series?	0
357826	487231	57689	Which is the easiest language to learn besides learning English?	Which is the easiest language to learn besides English?	1
357827	487232	487233	Why do squirrels eat so fast?	How do squirrels chew so fast?	0
357828	487234	487235	Why is Einstein's theory of special relativity wrong?	How would you explain Einstein's theory of special relativity to a child?	0
357829	487236	487237	Does technology create need for more technology?	Is technology creating need for more technology?	1
357830	487238	487239	When was the first time you got drunk? What happened?	What age did you truthfully start drinking alcohol?	0
357831	69067	487240	What is process engineering?	What is chemical processes engineering?	0
357832	487241	487242	What is the best way to get a real estate license in Texas?	How do I get real estate license in Texas?	1
357833	38362	146730	What are the best ways to lose weight fast?	How can I lose my weight quickly ?	1
357834	31221	273316	How do you become famous and receive a lot of views, upvotes, and followers on Quora?	How do I increase followers in Quora?	1
357835	126153	487243	What are some of the best audiobooks?	What are the best audiobooks?	1
357836	273248	487244	How do I stop loving a person who does not love me?	How should I stop loving someone who does not love me?	1
357837	487245	487246	How will smart cities help in social upliftment of Indian citizens in Tier II cities?	What is the safe site for downloading rogue trooper?	0
357838	487247	231983	Why do the fastest swimmers in the Olympics swim in the middle lanes?	In competitive swimming, why are the inner lanes (3, 4 and 5 usually) the fastest?	0
357839	487248	70112	How widely accepted are credit cards at small businesses and restaurants in Slovenia?	How widely accepted are credit cards at small businesses and restaurants in São Tomé and Príncipe?	0
357840	487249	487250	What does this mean 14601.2(A)?	What does n! =2 mean in C++?	0
357841	198217	210195	Where can I found best quality commercial and residential fire sprinkler systems in Sydney?	Where can I get top-quality fire sprinkler services in Sydney?	1
357842	445424	487251	What is a Support Vector Machine?	What is Support Vector Machine?	1
357843	487252	487253	How many employees are working at Wipro?	How many employees are working in Wipro Ltd?	1
357844	487254	487255	I have know about bluetooth module? What are other prerequisite thing should I know to start bluetooth module?	I have know about bluetooth module? What are other prerequisite thing should I know before starting bluetooth module?	1
357845	487256	487257	What is the difference between risk and uncertainty?	What is the difference between risk and uncertainty in economics?	0
357846	487258	320787	If you were handed five million dollars (USD$) how would you invest/spend it?	If you were making 2 million dollars a month how would you spend it?	0
357847	487259	487260	What are the pros and cons of having a relationship with a work colleague?	What are the pros and cons of marrying a work colleague?	0
357848	487261	209897	How safe are hot air balloons?	How safe is hot air ballooning?	1
357849	221369	237292	How do the tourist attractions on the Scandinavian Highlands compare to attractions in France?	How do the tourist attractions on the Scandinavian Highlands compare to attractions in Italy?	0
357850	220635	86037	What are some best ever Telugu movies?	Which is the one movie scene you watch again and again?	0
357851	487262	487263	Cricket: In t20 cricket history, how many matches have taken place where a single six was not hit?	Cricket: In t20 cricket history, how many matches have taken place where a single six was hit?	0
357852	487264	487265	Which are the best hotels or resorts in Mussoorie?	Which are the best hotels or resorts to stay in Mussoorie?	1
357853	207407	45930	How do i get myself a girlfriend?	How can l get a girlfriend?	1
357854	233501	215545	How can I tell if someone is lying on video chat?	How can you tell if someone is lying on the phone?	1
357855	30055	21549	What are the repercussions of 500 and 1000 rupee notes not being legal tender anymore?	What will be the effects of demonetisation of 500 and 1000 notes on the Indian economy?	1
357856	308643	9073	What are the best books one should read?	What are some good books that one must read?	1
357857	219229	115612	What is wrong with the American education system?	What is wrong with the current education system in the US?	1
357858	487266	64112	Why did France colonize Canada?	What countries did France colonize?	0
357859	487267	487268	Do we need to believe in astrologers?	Do we really need to believe in astrology?	1
357860	43943	64632	How do I download a whole playlist of 40 videos on YouTube in one go?	How can I download an entire Youtube playlist as separate MP4 files?	1
357861	487269	487270	Topics for writing research paper on economics?	Can I get a new car with down payment of Rs10,000 in Delhi? If yes, please tell also the other details. Thank you.	0
357862	5902	21996	What are the safety precautions on handling shotguns proposed by the NRA in Illinois?	What are the safety precautions on handling shotguns proposed by the NRA in Mississippi?	1
357863	487271	487272	What does Mark Zuckerburg do at Facebook (as CEO)?	What would the name of Facebook be if Mark Zuckerburg were from India, and why?	0
357864	184078	20534	Does it turn off a guy if I drink 2cans of 4lokos in his car before going into the club/bar?	Does it turn off a guy if I drink 2 cans of 4loko malt liquor beverage in his car before we even go into the bar?	1
357865	487273	487274	How do you monetize a social media follower?	How do I market without a social media following?	0
357866	487275	169040	What are Google Panda updates?	What is the Google Panda Update?	1
357867	413506	487276	Who is the regulator of regional rural banks?	Why nationalised banks does not serve rural region?	0
357868	341715	487277	What happens when you are on a coma?	What happens to the mind when it's in a coma?	0
357869	487278	487279	How true is it that the cab cos like Uber and Ola are owned by rich politicians to convert their black money into white conveniently?	My kid got a ketchup stain in the pizza parlor yesterday. It was a new shirt which I got him recently. How do I remove it now?	0
357870	487280	40481	Why do people lose interest in talking to me after my first conversation?	Has a person ever said something to you that made you rethink your life?	0
357871	487281	487282	Which programming language should I learn if I want go in space technology further or what should I do to have a touch of space with development?	How can a 27 year old unemployed male make friends?	0
357872	313951	137419	How can we end violence against women?	What are the 10 most important things that the Indian Government should do to stop violence against women?	1
357873	487283	487284	Why do past memories make me sad whether they are good memories or bad?	Why does the memory I do have is only sad or bad?	0
357874	349988	487285	Without net neutrality would ISPs block Google Now and Siri?	Would Amazon be blocked by ISPs?	0
357875	135824	86372	How does one become a witch?	How can I become a witch?	1
357876	487286	487287	Can professors write one letter of recommendation for several graduate schools that I apply? How does the process of submission look like?	I missed to provide investment proof to the employer, Can I submit it again before March to the employer or I can reclaim that only on tax returns?	0
357877	487288	42788	How can I self-learn Japanese?	What’s the best way to learn Japanese?	0
357878	487289	487290	What is the best English-to-German translation software?	What is the best English to German translation app?	1
357879	487291	37205	What is the difference between Mandarin and simplified Chinese?	What is the difference between Chinese and Mandarin?	0
357880	487292	487293	Whish are Most awited day in life?	Does wealth accumulation work for the Incarcerated American Industry?	0
357881	72070	487294	What is the difference between theoretical and empirical research?	What is the difference between theoretical research and qualitative research method?	0
357882	487295	487296	What is tension?	What is tension in physics?	0
357883	487297	487298	What is some credibility material?	What is credibility?	0
357884	323191	487299	How do I identify a font?	How is font size measured?	0
357885	31362	3133	How do I prepare for UGC NET English Literature thoroughly?	What are the name of the books for UGC net English literature?	1
357886	372335	487300	Is the Dell XPS 15 good for programming and productive work?	What is your review of Dell XPS 13?	0
357887	72072	37193	What is the best question asked on Quora? What was the best answer?	What is the most important question asked on Quora?	1
357888	487301	487302	Is every field a vector space over itself?	Every field is a vector space over itself, then is it elements of that field a vector?	1
357889	487303	487304	What is Clinkle?	What is Clinkle building?	0
357890	487305	487306	I want to go and work abroad, dont have much of a professional degree like engineering, I have done b.a. and gniit, is there a scope. my age is 25?	"What is a summary of Ray Bradbury's short story ""A Sound of Thunder""?"	0
357891	487307	62993	What is the best method to loose belly and lower back fat?	Is there any quick method to loose belly fat?	0
357892	487308	487309	What are the apps present for iOS like Mcent for anroid?	Are there any IOS apps which can assist me with making a presentation in any capacity?	0
357893	487310	487311	Suppose Host A sends two TCP segments back to back to Host B over a TCP connection. The first segment has sequence number 140, the second has sequence number 170.	Suppose Host A sends two TCP segments back to back to Host B over a TCP connection. The first segment has sequence number 140; the second has sequence number 170.	1
357894	99405	352986	Is Pokémon GO overrated?	Do you think Pokémon GO is overrated?	1
357895	208951	487312	What could cause a world war ?	What could cause a world war?	1
357896	381702	382839	What are the most important things to learn?	What are some interesting things to learn?	0
357897	487313	487314	How is metadata used?	What is metadata?	0
357898	487315	487316	How are neon colors made? What neon colors are most commonly used?	What stores in a mall would sell neon colored lipstick and neon colored nail polish?	0
357899	487317	258252	How do tornadoes form?	Why do tornadoes occur?	1
357900	487318	487319	Does Kanye West even have a remote chance in the 2020 election?	Do you think Kanye West could win the 2020 election?	1
357901	487320	163579	Which books should I start reading?	I want to start reading books. Where should I start?	0
357902	8428	40173	How will demonetization of ‎₹1000 and ‎₹500 notes will help curb the rampant black currency in India?	Will the decision to demonetize 500 and 1000 rupee notes help to curb black money?	1
357903	487321	487322	Is it illegal to send money with a letter via India Post?	Can I send food via India Post to Hong Kong?	0
357904	362457	487323	I am an average student preparing for the IIT-JEE. Which test series is the best for me for free?	I am an average student preparing for the IIT-JEE. Which test series is the best for me?	0
