id	qid1	qid2	question1	question2	is_duplicate
159694	249250	249251	What topics of statistics and probability should be known before starting machine learning?	Which topics of statistics and probability should be known before starting machine learning?	1
159695	19516	144706	How do you overcome Writer's Block?	What are some tips to get over writer's block?	1
159696	249252	54218	What is the hardest thing(s) about raising children in Philippines?	What is the hardest thing(s) about raising children in Japan?	0
159697	84905	249253	How can I increase my typing speed fast?	How do I improve my typing speed?	0
159698	249254	249255	How do I find my area of interest?	How one should find his interest?	1
159699	246980	82404	How can I come out of loneliness and depression?	How does one overcome depression and anxiety?	0
159700	249256	249257	Can other people see the top 3 person of my search bar on my instagram?	How can I see hidden searches on Instagram?	0
159701	158036	27131	Can someone make a brief comparison of KMC Manipal and Mangalore?	Which one has better hostels, KMC Manipal or KMC Mangalore?	1
159702	249258	249259	How many people are in the air flying at any given time?	How many people may be in the air on flights at one given time?	1
159703	138157	249260	What are your top 5 movies for 2016?	What were the best movies of 2013? Why?	0
159704	249261	249262	Which software does a T.V. journalist use to create a report or edit video footage that they shot related to the news story?	Which is the free video editing software that I can use to create this kind of videos? [see the link in detail]	0
159705	217542	249263	How did Tom Hardy build his body for the role of Bane in The Dark Knight Rises?	What if Bane (The Dark Knight Rises) was in Game of Thrones?	0
159706	249264	249265	What is a traditional server?	How do I set up my Windows Server 2008 R2 server to be a proxy server?	0
159707	249266	40389	Which are the top 10 strongest navies in the world?	Why did the United States lose the Vietnam War?	0
159708	249267	249268	How do I make a bluetooth device that set an alarm when our phone out of the bluetooth device range?	How come it takes so long to connect devices to nearby devices (Bluetooth pairing and WiFi routers), when connecting devices to the web servers worldwide seems relatively instant?	0
159709	233132	173495	Now that he is President Elect, will Trump ever release his tax returns?	When Trump has to publish his tax return?	1
159710	249269	249270	What course should I pursue?	What are the courses in pursuing philosophy?	0
159711	106306	14169	Can anyone hack clash of Clans?	How can I hack Clash of Clans for unlimited gems?	1
159712	249271	211579	What universities does Avid Tech recruit new grads from? What majors are they looking for?	What universities does Aspen Tech recruit new grads from? What majors are they looking for?	0
159713	249272	179157	What can I do if I feel slightly depressed?	What can I do when I feel depressed?	1
159714	249273	249274	Is spotting always the sign of a pregnancy? How far along is one usually when this first happens?	Does cramping occur in the first 2 weeks of pregnancy?	0
159715	249275	249276	"What is the meaning of the ending dialogue from the movie""Batman: The Dark Knight"" when Lt. James Gordon says, ""Because he's the hero Gotham deserves, but not the one it needs right now,"" about Batman?"	Why does Ben Affleck keep changing his word on The Batman film?	0
159716	52838	101652	Why did President Obama wait so long to show a birth certificate?	What will Obama do after he's done being President of the USA?	0
159717	19892	114676	Why MS Dhoni leave captaincy of ODI & T-20?	Why did MS Dhoni leave the captaincy of ODI and T20?	1
159718	249277	249278	What are challenges facing hotel managers?	What are the challenges faced by hotel and restaurant managers?	0
159719	249279	249280	What is a suitable inpatient drug and alcohol rehab center near Phillips County CO?	What are the implications of an outlier in a positively or negatively skewed distribution?	0
159720	249281	249282	How do I stop lying to my parents?	Why do I keep lying to my parents?	0
159721	249283	249284	How much protein intake per day should I take - 0.8g/kg or 2.2G/kg?	What are some smart ways to make a profit from a low interest environment?	0
159722	249285	249286	What is current CTC and expected CTC?	How is CTC calculated in India?	0
159723	249287	18951	What are the major product negatives/drawbacks (if any) of the Mini Cooper?	Is a Mini Cooper a good first car?	0
159724	125246	113143	Is it too late to start medical school at 32?	Is 33 too old to start medical school?	1
159725	117313	249288	What is it in soil that makes it smell so good after the first rain?	Where does the smell of rain come from and why does it happen?	0
159726	17855	125268	Why is the war happening in Syria? Who is involved and why?	What is happening in Syria?	0
159727	249289	161424	Is there a way to manually choose an appointment date for a passport?	What happens if I reschedule the appointment at the Passport Seva Kendra?	0
159728	35048	7402	Why do some people drive slowly (10+ MPH under the speed limit) in the passing lane?	Why do people on Bay Area highways drive so slowly in the left lane?	1
159729	249290	249291	"What is the legality behind the ""Trespassers Will Be Shot"" sign?"	Legal Question: If somebody is trespassing and gets hurt on your property, can they sue you and have a good case?	0
159730	249292	249293	How do I track my husband on kik messages without him knowing?	How can I find out my husbands kik username?	0
159731	249294	249295	"Which one is correct: ""Laughing at my words"" or ""Laughing on my words""?"	Which is one instance where you really rolled on the floor laughing?	0
159732	170905	66642	If you had to survive off of 3 foods for the rest of your life (Not counting combinations of food such as pizza or a smoothie) What would they be?	If you had to spend the rest of your life eating only 3 food items then what would they be?	1
159733	249296	249297	Can my ex and I still be friends?	Is it possible to stay friends with your ex within a week from break up when you are both in love?	0
159734	249298	249299	What is the smartest thing you've ever heard a child say?	What is the smartest thing you've ever heard a child say? Andy	1
159735	249300	249301	What do people think of the movie Requiem for a Dream?	What was the movie 'Requiem for a Dream' all about?	0
159736	21317	135230	How do I recover/reset my AOL email password?	What can I do if I forgot my AOL username and password?	1
159737	19257	156593	What are radio waves? What are some examples?	What are the properties of radio waves?	1
159738	249302	249303	How do I read BIND source code?	If you were to join the U.S. Tank corps today, would driving an Abrams be safe against any threat? If so what are your chances of getting killed?	0
159739	183973	249304	How do you handle success and what does it take to be always successful?	What are the best ways to handle success?	0
159740	150709	24395	How can I find my old password or can I log into Facebook from my Gmail account?	How can I log in to Facebook if I forgot my email?	1
159741	249305	2561	How can I make money making online quizzes?	What's the easiest way to make money online?	0
159742	8353	53415	What's your new year resolution for 2017?	What's are your resolutions for 2017?	1
159743	249306	249307	What are the biggest problems society is facing today?	What's the biggest problem with our modern teenage society? What are the top 10 things?	0
159744	249308	249309	What is the chemical formula of cement?	What is the chemical formula of gypsum?	0
159745	54574	249310	What causes people to feel tired in old age?	When do we really feel that we are in old age?	0
159746	249311	249312	What's the difference between blockchain and a database?	What is the difference between a file system and a database?	0
159747	5474	4927	What is the best Pokemon GO hack?	What are some of the best Pokemon Go hacks?	1
159748	249313	249314	Which is better for machine learning Arduino or Raspberry Pi?	I have 5+ yrs of experience in mainframes and looking out for job in Dubai. Which are the best IT recruiting consultancies to contact ?	0
159749	249315	249316	What are some of your favorite DJ mixes?	What is your favorite DJ mix?	1
159750	249317	106883	How will the demonetization affect the value of rupee against dollar?	How will the demonetization of 500 and 1000 rupee notes affect the value of INR against USD?	1
159751	249318	249319	What is the origin of black people?	Are black people the original Jews?	0
159752	249320	249321	What does this quote mean by Robert G. Ingersoll: “With their backs to the sunrise they worship the night”?	I made out with a friend last night. Does it mean we're gay?	0
159753	50258	5876	How can I increase height after the age of 25?	What are ways I can increase my height (I'm a ftm Asian)?	1
159754	249322	249323	What is life's purpose?	What is life's most satisfying purpose?	1
159755	249324	249325	Which book will u prefer to read for mechanics of material (Dr B.C.Punmia or Timoshenko,Gere) for GATE (mechanical)	I have a book named Mechanics of Materials by 'Gere and Timoshenko'. Do I need to purchase a copy of Strength of Material book also?	0
159756	249326	77035	How do I start learning image processing in C/C++?	Can I start learning Java without C and C++?	0
159757	129936	249327	Which is the best graphics card available in laptops?	What is the actual use of graphic cards in laptops?	0
159758	249328	57132	What is the charge of a carbon ion?	What is ion ion repulsion?	0
159759	249329	249330	How did NASA come into being?	How did words first come into existence?	0
159760	249331	249332	How do I learn Japanese by watching anime?	Can you learn Japanese purely from watching anime?	1
159761	145606	118260	Why is Quora so liberal leaning?	Why is Quora such a liberal hangout?	1
159762	140172	249333	What is the best one liner on life or philosophy that you have ever heard?	What's the worst one-liner you have ever heard about The Taj Mahal?	0
159763	249334	249335	If an object is traveling towards you at .99c, will the relativistic Doppler affect cause a red or blue shift due to the time dilation affects?	How does time dilation affect radioactive decay?	0
159764	466	131213	Where does the water from the Great Lakes come from, and how does these lakes wildlife compare to Lake Como?	Where does the water from the Great Lakes come from, and how does these lakes wildlife compare to Lake Sevan?	0
159765	249336	249337	In the play The Tempest, Caliban argues that the island is his birthright. Discuss the political decisions Caliban makes to retake this inheritance?	What plays did Shakespeare co-author?	0
159766	249338	249339	How do I deal with loneliness?	How do you deal with the loneliness after a breakup?	0
159767	249340	86902	What valid proof can confirm/deny the surgical strike India claims it did yesterday in POK/Azad Kashmir (29/09/16)?	Did India really conduct a surgical strike on Pakistan?	1
159768	249341	141000	How can I get rid of the fat on my stomach?	How do I get rid of fat in my midsection?	1
159769	249342	249343	What are good facts about the universe?	What are some interesting facts about Universe?	0
159770	249344	249345	What are the major muscles in the body?	What is the largest muscle in the human body?	0
159771	249346	91539	What kind of economy does the United States have compared to the one in Ecuador?	What kind of economy does the United States have compared to the economies of other countries?	0
159772	249347	249348	What are some examples of companies or startups that have a mostly distributed workforce?	What are some examples of distributed startups and companies?	0
159773	249349	249350	What determines how many elevators a building will have?	When is a new commercial building required to put in an elevator?	0
159774	249351	249352	How can we use cc3200 to connect multiple stations in Ap mode?	Toll free number for agriculture?	0
159775	34003	249353	Which is the best question you've read on Quora?	What is the best question on Quora ever?	1
159776	62183	249354	Is MS Dhoni overrated as a batsman?	Do you think MS Dhoni is a good batsman?	0
159777	249355	249356	When you are buying something, is color important to you?	When you are buying something, is the colour important to you?	1
159778	120201	249357	How do I recover my Gmail account password without a recovery email (forgot) or the security question when 2 step verification code is turned on?	How do I login my Google account without my phone number, recovery email or security question?	1
159779	249358	249359	I have LAMP (Linux, Apache, Mysql, PHP) servers for back end. What should I use to build front end User Interface?	I want to build a website much better than Facebook.Front end I will use html and css.What should I use server side?	0
159780	41844	15671	Why did American people elect Donald Trump as their president?	How and Why did Donald Trump win the election?	1
159781	211070	249360	How comfortable is life for those who make $100,000 or more a year?	What can I invest $100,000 in to make 40,000/year?	0
159782	188009	249361	Which video games make you smarter?	What makes up a video game?	0
159783	249362	249363	What are the best books about office politics?	What are some good books on the social dynamics of office politics?	0
159784	249364	249365	Straight out of flight school can a pilot get a job with a major airline? Are the regional airlines your only option?	What is the procedure to get a job in any airline as a pilot after doing cpl course(with 200hours)?	0
159785	211722	249366	What is the full title of Daenerys Targaryen?	Is Daenerys the only Targaryen alive? No spoilers please. Watched till S03E08.	0
159786	47724	4476	If a question doesn't need improvement, why does Quora mess with your questions?	Why do all of my questions on Quora need improvement?	1
159787	249367	249368	What is a good position in basketball?	What is the most important position in basketball?	0
159788	249369	249370	Where should someone new to Doctor Who start watching?	I would like to start watching Doctor Who. Where should I start?	1
159789	249371	61353	Is there a more destructive weapon than a nuclear bomb?	What is more destructive than a nuclear bomb?	1
159790	101338	65629	How should we manage time?	What should I do to manage my time?	1
159791	249372	249373	The ALS Ice Bucket Challenge Actually Worked?	What important lesson(s) do politicians learn when they begin their career?	0
159792	249374	249375	How do I prepare for a software engineering job at Google?	After I get an offer, how can I prepare for a software engineering job at Google?	0
159793	22359	100854	What is the best joke you have heard?	What's the best joke you have ever heard?	1
159794	249376	249377	My J1 is terminated due to a disciplinary action and I need to leave the US immediately. Will I be able to apply for a new J1 in the future?	Do I need a lawyer to apply for US citizenship?	0
159795	4044	146730	How can I lose weight quickly?	How can I lose my weight quickly ?	1
159796	249378	249379	What are the reasons why Catholic priests wear the white collar?	What are the reasons why Catholic priests wear the white collar? How is the collar called?	1
159797	249380	249381	What are some things new employees should know going into their first day at Immersion?	What are some things new employees should know going into their first day at Cisco?	0
159798	30997	1165	Are Trump supporters disappointed that he has already backed away from some of his campaign promises?	How will Trump supporters react once they realize he can't or won't keep his campaign promises?	1
159799	249382	249383	Do all countries have national heroes?	Who is the most self advertising PM India has ever had?	0
159800	249384	249385	Why is the EPA held in such low esteem by a large proportion of Libertarians and the Right?	Why is the EPA (Environmental Protection Agency) held in such low esteem by the American Conservatives?	1
159801	249386	249387	Which is better, MS in Industrial Engineering or MS in Engineering Management? Why?	Which is better an MS in industrial engineering or an MS in engineering management?	1
159802	249388	249389	What should I expect from a fraternity initiation?	What are the pros and cons of joining a Fraternity?	0
159803	249390	122917	Where is God?	God: Who/What is God?	0
159804	249391	249392	What are the US business schools with the lowest tuition fees?	US Business Schools: I am an Indian applicant who wants to pursue an MBA from US. Which schools I can get into and have higher chances?	0
159805	149261	155240	Which is best time for exercise?	When is the best time to workout?	1
159806	249393	168383	Why one sided love hurt that much?	Why does one-sided love hurts so much?	1
159807	249394	249395	Why did slavery happen?	How does slavery happen?	1
159808	110818	89225	When should you downvote a comment?	How do I use downvote correctly?	1
159809	154462	249396	My 17 year old daughter said something horrible to me, so should I punish her?	My 17 year old daughter didn't go to her speech therapy class and now her teacher called me and is immensely angry at her. Should she have gone?	0
159810	249397	249398	What universities does Team recruit new grads from? What majors are they looking for?	What universities does HD supply recruit new grads from? What majors are they looking for?	0
159811	249399	249400	What are attractive scenes in patanamtitta district in kerala?	Why do some Sanders' supporters not understand that a vote for Clinton increases Senator Sanders' power to put forth a progressive agenda?	0
159812	249401	249402	Are there some real websites that offer real money for part-time work like data-entry, ad-posting jobs? With minimum registration fees of course.	How can free real estate deal websites make money on ads? What are some company perspectives on the benefit of ads in the industry?	0
159813	249403	249404	Is Alia Bhatt Pooja Bhatt's step sister?	What is Alia Bhatt's house address?	0
159814	209010	249405	What are qualities which make a man an asshole or a jerk? Am I one?	Can a man possibly be a 'one woman man'?	0
159815	39911	32044	What is UNIX?	What is UNIX and UNIX-like?	0
159816	249406	249407	Which subjects are important to become a chartered accountant?	How can I become Chartered Accountant after 12th std?	1
159817	22829	249408	How do I can make extra money online?	What are some good ways to make a little extra money?	0
159818	249409	249410	What if I've had the same music teacher for five years and it feels like I am learning nothing? I REALLY want to go to Juilliard	One day I feel very confident and the next day I am very depressed. I'm only 24 and do not have a job yet. I have no idea what I did in the last 8 years. I am not passionate about anything. Most times I feel like my existence is worth nothing. I want to get out of this. What do I do?	0
159819	249411	249412	What make men feel to be more superior over women and vice-versa?	What is social networking for business development?	0
159820	249413	249414	Will Facebook open source TAO?	When will Facebook open source Centrifuge?	0
159821	249415	249416	what are some internet service providers that gives unlimite data plans in Chennai?	What are the best wireless service providers in noida who provide for unlimited plans?	0
159822	249417	249418	What are some quality brands of leggings?	What are some brands of clothing in which you pay for quality, not a logo?	0
159823	249419	233817	What is your review of House of Cards Season 1?	What is your review of House of Cards Season 2?	0
159824	249420	249421	What will happen if I by mistake fill up my petrol engine car with a diesel, or my diesel engine car with a petrol, and what to do to fix this?	Is it possible to replace the Diesel engine to petrol engine for cars?	0
159825	249422	249423	Can ips officer marry…?	How do I get married with an IPS officer?	0
159826	249424	249425	What is C6H12O6?	What is the empirical formula of C6H12O6?	0
159827	11895	249426	What does it feel like to receive a blowjob?	How does it feel for a guy during a blowjob? Does every guy wants a blowjob? How does a woman feel to take it inside?	0
159828	249427	101795	What will be Hillary Clinton's strategy for India if she becomes US President?	What will be the Hillary Clinton's India policy if she become the president of USA?	1
159829	249428	134104	Why does cooked meat last longer than uncooked meat?	Are human stomachs better able to digest cooked meat than raw meat? If yes, why did we evolve this way?	0
159830	48865	249429	Is Hillary Clinton crooked?	Why do republicans call Hillary Clinton 'crooked Hillary'? What is she alleged to have done?	1
159831	249430	249431	What's the typical day of a venture capitalist?	What is the day in the life like for a venture capitalist?	1
159832	249432	249433	How tall is Leonardo DiCaprio barefoot?	How tall is Leonardo DiCaprio?	1
159833	3767	35549	Can you suggest a best budget phone below 15k?	Which phone would be the best for ₹15,000?	1
159834	249434	249435	What are the disadvantages of the European Union? What are the advantages?	What are the advantages and disadvantages of the European Union?	1
159835	234833	168669	Who needs digital marketing services?	What is digital marketing and how to set career in digital marketing?	1
159836	249436	249437	What is the best stock to invest in India 2014?	What are the best stocks to invest in India for 2015?	0
159837	69984	249438	Can Donald Trump really become President of US?	What is the chance that Trump will become president?	1
159838	249439	249440	What are the differences between German Standard German and Swiss Standard German when it comes to punctuation?	What are the 4 missing terms in the sequence? _, -2, -5, 9, -4, _, 2, -3, 7, -7, _, 3, -1, 4, 6, _	0
159839	249441	249442	English videos for competitive exams?	Which book is good for descriptive English for competitive exam?	0
159840	249443	249444	How do I add a Kindle book?	How do I add illustrations to a Kindle book?	0
159841	249445	249446	Can you get stds from oral sex?	Can STDs be transmitted via oral sex?	1
159842	249447	233219	How would you weigh a jet plane without using scales?	How would you weigh a plane without scales?	1
159843	136588	18300	What is the “Clinton Body Count” theory, and why do people believe it is true?	Could Donald Trump be a Democratic plant? Is he trying to help Hillary Clinton?	0
159844	249448	249449	How would you describe the eukaryotic cell cycle?	How can you describe the eukaryotic cell cycle?	1
159845	249450	249451	In what order should I watch the whole Gundam franchise?	What order do I watch all of the Gundam animes?	1
159846	249452	9727	Where can I find investors for my start up idea?	How do I find investors for my startup?	0
159847	23710	249453	Why do people continue to deny clumate change?	What are some reasons people don't believe in climate change?	1
159848	249454	249455	Why cant we break anything and everything using resonance?	Is every institutional buyer is a qualified institutional buyer?	0
159849	249456	249457	Of the 3 major private universities in California (Stanford, Caltech, USC), how has USC fallen behind as the worst, academically, of the 3?	Do private schools (Stanford, USC, Caltech, etc.) in California accept the CHSPE in place of a high school diploma?	0
159850	249458	248299	Can you relate a case from personal experience when alternative medicine ruined the health of a person, where conventional medicine has a reliable cure?	Is there any case when the disease was cured with the use of only medicines?	0
159851	236466	249459	Why do some men want to have anal sex with women?	Why do men engage in anal sex?	1
159852	249460	245273	Is diet really more important than working out for fat loss?	What is the more important factor to weight loss, diet or exercise?	1
159853	10813	38185	What was the best day of your life, and what happened?	What was the best day of your life? Why?	1
159854	249461	21317	What is the Gmail password reset number?	How do I recover/reset my AOL email password?	0
159855	249462	249463	What are some of the best places to visit in New York City?	What are good places to visit in New York?	1
159856	249464	249465	Why do my eyes tire quickly when I wear contact lenses?	Can someone wear contact lenses for 9 hours?	0
159857	249466	249467	"What is the origin of ""beaver"" as a slang term?"	How common is the slang in Hindi, 'chutiya'? And should it still be termed a slang considering its increased usage?	0
159858	249468	249469	How can I start forming good habits, and what are some good habits to form?	How can I form good habits?	0
159859	249470	249471	"What is difference between ""I"" and ""me""?"	What is the difference between you and me?	0
159860	249472	249473	Which is best school in the world?	What is the best school in the whole world?	1
159861	17621	159282	How can we learn faster?	How can I learn at a higher speed?	1
159862	249474	10382	How do I recover my Facebook password easily?	I forgot my Facebook password and email password. How can I log into Facebook?	0
159863	14111	18759	How will the ban of old 500 and 1000 rs notes help in bringing out the black money?	How will replacing 1000 notes with 2000 notes going to stop corruption and black money?	1
159864	54603	20373	How do YouTubers make money with their daily vlogs?	What kind of videos make the most money on youtube?	0
159865	249475	249476	What is the Lewis structure of SiF4, and how does it compare to that of sodium?	What is the Lewis structure of SiF4, and how does it compare to that of silicon?	0
159866	28196	103004	How do I stop my Pomeranian/Shih Tzu mix from humping my furniture?	How do I stop my American Staffy/Kelpie mix from humping my furniture?	1
159867	249477	249478	Why can't India show a hard stance against terrorism like Israel did?	Why can't India accept policies like Israel to tackle with terrorism?	1
