id	qid1	qid2	question1	question2	is_duplicate
240354	306644	352155	Can you get pregnant a week before ovulation?	If fertilization can occur only around ovulation then why is it said that you can get pregnant anytime?	0
240355	352156	195963	How are oil prices decided in India?	Commodities Markets: How are the petrol prices decided in India?	1
240356	352157	352158	What is it like to be a male governess?	How does it feel like to work in the goverment?	0
240357	139261	273835	How do you change your whole personality?	How can one change or choose his personality?	1
240358	352159	146846	What are some interesting areas of agriculture that I could do undergraduate honors thesis in?	What are some interesting areas of English that I could do undergraduate honors thesis in?	0
240359	19251	3505	How do I delete an Instagram account if I don't know the email or password?	Instagram (product): How can I login to Instagram if I don't remember the password, and I dont know the email address that was used to set up the account?	0
240360	106529	352160	What are the requirements to join the Canadian Army?	How can you join the Canadian army?	1
240361	5903	27379	What are the safety precautions on handling shotguns proposed by the NRA in South Carolina?	What are the safety precautions on handling shotguns proposed by the NRA in Washington?	1
240362	12775	75263	What are the tips and best books for preparing NTSE?	How do I prepare my English for the NTSE?	0
240363	352161	352162	How can I use ffmpeg c++ for encoeding?	Do people/companies still use C#?	0
240364	144727	98990	Why India don't produce weapons rather than buying it from other countries?	Why is India importing missiles and weapons from America and Russia? Why can't India produce their own?	1
240365	148965	352163	How can you determine the oxidation number of carbon monoxide?	How do you determine the oxidation number of iodine?	0
240366	94891	201567	Are you lactose intolerant?	Is there any treatment for lactose intolerance?	0
240367	50535	10370	How is black money curbed with the ban of 1000 rupee notes and introducing new 500 and 2000 rupee notes?	How introducing 2000 Rs notes which is of higher denomination than the current highest denomination 1000 Rs notes will reduce the black money?	1
240368	352164	123917	How are you different from your partner?	How are you different from your spouse?	1
240369	54174	93957	How can I read someones mind?	How to read minds like mentalist?	1
240370	352165	178636	How can you prepare easily for NEET?	How can I prepare for NEET?	0
240371	212301	89754	Can parallel universe exist for real?	Does the parallel universe exist?	1
240372	352166	352167	Why is there no Apple Pay showing on the wallet app?	Who is the head of Apple Pay?	0
240373	352168	352169	What are the best courses to be done for job in software industry?	What are good courses related to software testing for a good job?	0
240374	8866	74355	What can I do to stop worrying what others think?	What are some psychological tricks to stop caring about what people think?	1
240375	352170	352171	What are the downside for the W-4 exempt status program?	How shall I make my site SEO friendly just like smashtechs.com?	0
240376	197350	352172	What happens when you get shot in the stomach?	What happens when someone get's shot in the stomach?	1
240377	352173	352174	What are the details for the 2013 SXSW Quora meetup?	When is the Quora meetup at SXSW?	0
240378	185245	184607	How do I determine my IQ?	What is the easiest way to know my IQ?	1
240379	352175	352176	Why weren't chemical or biological weapons widely used during the war? (excluding use against civilians e.g. during the Holocaust)	What if Germany had used its entire arsenal of Tabun and other chemical weapons during the Battle of Britain?	0
240380	352177	45997	What is the best way to cleanse and detox my body at home?	What is the best way to detox the body?	1
240381	167198	352178	What are the most productive ways to spend time on internet?	What are the most productive ways to spend time on my mobile phone?	0
240382	99259	174248	What are some of the best ways to clean mildew from a carpet?	How do you remove mildew from a carpet?	1
240383	352179	352180	"In French, how do you say ""was""?"	"In French, how do you say ""my family""?"	0
240384	352181	352182	Daniel Ek: When will Spotify start its application in India?	Daniel Ek: What is the next step for spotify? Which key areas of music industry is Spotify looking to make a mark in future?	0
240385	144533	104071	Why do women wear makeup?	Why do people wear makeup?	1
240386	37803	171288	If your period is 10 days late, are you pregnant?	I have had 2-3 periods since I last had sex 3 months ago with a condom and no cum, my period is 10 days late, could I be pregnant?	1
240387	322789	352183	What is coffee?	What is coffee aroma?	0
240388	352184	352185	What is the difference between soil and sand?	What is the different between soil and sand?	1
240389	4754	9597	How can Donald Trump win the elections when people hate him so much?	How did Donald Trump win the election?	1
240390	28722	9037	How can you lose weight really quick?	What is the easiest way to lose weight faster?	1
240391	352186	352187	Why doesn't Michael Shelby cut his hair in the Peaky Blinder's style?	Who is the priest in season 3 of Peaky Blinders? Why is he an enemy of the Shelby's?	0
240392	352188	352189	Why am I weak?	How can I be strong when I feel so weak?	0
240393	352190	352191	What is the size of prototyping tool market?	What is the size of prototyping tool marketplace?	1
240394	352192	352193	How is friction useful?	How is friction helpful?	0
240395	352194	352195	What can I do if my puppy seems depressed?	Why does my beagle puppy seems depressed?	0
240396	33043	19435	How do I catch my cheating husband?	How do I catch a cheating spouse?	1
240397	352196	283211	How long will take to activate net banking in central bank of India?	How do I activate net banking in union bank of India?	0
240398	352197	352198	When is convergence analysis required for an experimental sampling design irrespective of random generation?	When is convergence analysis required for an experimental sampling design, irrespective of any random generation?	1
240399	46199	18366	Since more and more dark energy appears does this mean that it is infinite or that the potential dark energy that can be created is infinite?	Is at least the potential energy of vacuum energy and dark energy infinite?	1
240400	15970	75238	How do I apply for PAN Card?	How do I apply online for a PAN card free of cost?	1
240401	352199	352200	What is the best way to learn which gender does word belong to in Norwegian?	"Why is it that marchers say ""left right left"" in english while when it come to hindi ""daine bae dae"" is used which means right left right?"	0
240402	320207	352201	How do supernovas create elements?	Which is the first element formed after supernova?	0
240403	352202	352203	Where can I found high level of craftsmanship for glassware items in Melbourne?	Where can I found high quality yet durable glassware items in Melbourne?	0
240404	352204	352205	How were these photos edited?	How do I edit my photos?	0
240405	16554	5285	Why does Quora have a character limit for question titles and details?	Why is there a sign limit on Quora for questions?	1
240406	352206	149559	Is it good to study MD after taking pharmacy?	How can I study faster and more efficiently?	0
240407	352207	352208	Why should homo sapiens (humans) be the only species on planet Earth to focus on civilization, when all other species just wanted to live their lives and die?	Why are humans the only animals on earth that have religions?	0
240408	489	9704	If dark energy is created with expansion can infinite of it be created?	How is dark/vacuum energy created with the universe conserved if it is not conserved? Can infinite of these be created?	1
240409	352209	352210	How can I forget my exboyfriend completely? Need advice	How can I deal with my exboyfriend?	0
240410	352211	352212	What are the advantages of 64-bit Python over 32-bit Python?	Can I install (on Windows 32-bits) 2 versions of Python 2.x and 3.x (to run different libraries)?	0
240411	126866	352213	Can a person be really in love with two persons?	How can you be sure that you are in love with a particular person?	0
240412	352214	157520	Is it possible to apply to an F-1 student visa in the US while holding an approved but not used H1-B petition?	Can one produce music while a student with an F-1 (student) visa?	0
240413	352215	352216	Why have the Jews chosen to be great?	If Muhammad's lineage goes back to Ishmael and Abraham, the first Jew, why are Muslims so hostile to Muhammad's lineal ancestors, God's chosen people?	0
240414	352217	53387	What are some good math topics for exploration/investigations?	What is the value of [math]2^{2014}-2^{2013}[/math]?	0
240415	352218	352219	How do i combine audio and video from different sources?	What are some ways to combine video and audio?	1
240416	352220	352221	Everytime I make out with my boyfriend, he cuts contact for days which leads to fights because I tend to feel pretty pathetic & lonely. What do I do?	I told my friend's secret to my boyfriend and he told someone else. I feel so guilty for what I have done. How can I make things right?	0
240417	352222	352223	How can I make my mattress more comfortable?	How can I make a crib mattress more comfortable?	1
240418	352224	211333	How static capacitor banks improve power factor?	Why capacitor improve power factor?	1
240419	228069	352225	Am I a coward for running away from 3 people that had already managed to hit me a few times?	How do I create a few separate income sources that have low overheads in terms of time and energy to enable me to move away from a 9 to 5 grind?	0
240420	352226	283218	What is the dielectric strenght of transformer oil?	What's chemical name of transformer oil?	0
240421	352227	352228	What are some of the best books for IITJEE?	What are the best books for IITJEE?	1
240422	352229	201014	Which side would win if the civil war was fought today?	If we had another civil war and it was North versus South, which side would win?	1
240423	269301	352230	Will Jon Snow's parentage be made public?	How will people come to know of Jon Snow's real parentage and Will they believe it?	1
240424	304129	352231	What does cellulose do?	What is Cellulose used for?	1
240425	352232	352233	Were you the coolest kid in your high school or were you far removed from that status?	How cool were you in high school?	0
240426	352234	352235	What was the best news you ever received?	What is the best news you ever received in your life?	1
240427	352236	352237	What does ‘Lakeer ka Fakeer’ mean?	What does a KA mean?	0
240428	341191	352238	What is the hardest jobs in the world?	What is the Hardest Job in the World?	1
240429	126404	352239	I tried to add money to my Paytm account twice but both times the transaction failed and the money was debited from my bank account (that is 2600 twice). After an hour, I received notifications that the money has been credited to my Paytm wallet, but I didn't receive the money in my Paytm wallet. What should I do?	What is the need of paytm wallet if I can pay using credit and debit card and putting money in the bank will earn me interest?	0
240430	352240	231994	How do I improve my sketching and painting?	What are some simple sketching exercises I can do to improve my sketching skills?	0
240431	275739	352241	How can someone with a mechanical engineering background start a web based startup?	How can engineering technology based on a startup by freshly graduated engineers generate seed money?	0
240432	352242	352243	What are the positive feedback loops of Uber?	What is a positive feedback loop?	0
240433	352244	352245	My gf's son (6yo) is not allowed to go on the internet unsupervised. How can this be enforced when his best friend (7y) has full internet in his room?	My sister was getting messaged by some dude in the internet and when she didnt reply, his messages got angrier and angrier. Now he's saying he knows where she lives and knows that shes alone half the week when the kid is at his dad's. Whats the best way of stopping this guy?	0
240434	27759	18158	How do I hack or spy on someone's WhatsApp conversation?	How can I hack someone's WhatsApp account?	1
240435	352246	352247	What is the syllabus for IAS?	What is the syllabus of IAS?	1
240436	352248	352249	World top online selling sites to sell Indian wooden handicrafts and Novelties/nauticals from India?	I want to understand the mathematics of Polynomial kernel (SVM) with the help some real numbers taken from two different classes e.g Fisheriris exp?	0
240437	352250	352251	Where can I find seasons 2-7 of 'The Mentalist'?	"Did the series ""The Black List"" end with season 2 episode 7?"	0
240438	352252	352253	What are the best albums available on Amazon Prime Music?	How do I set up Amazon Prime on an Xbox One?	0
240439	37883	55618	How do I post blog on Quora?	How can I create a blog on Quora?	1
240440	352254	352255	Can a gay man fall in love with a woman?	How can a woman tell if a man is starting to fall in love with her?	0
240441	288535	123022	How are mitosis and meiosis compared and contrasted?	What is the importance of mitosis and meiosis and what are their differences?	1
240442	352256	352257	What is Alumniothermite prosess?	Can weak kids consume weight gainer (powder)?	0
240443	35069	8922	Game of Thrones or Walking Dead?	Which is better The Walking Dead or Game of Thrones? What do you guys think?	1
240444	352258	85579	How do I get a job in TCS?	How do I get a placement in TCS?	1
240445	352259	352260	Why was the Battle of Verdun important in World War I?	What is the Battle of Verdun related to the World War 1?	1
240446	2374	18277	Why do so may people ask questions on Quora that can easily be found by a simple Google searh?	Why do some people use Quora when a dictionary or Google could be used instead?	1
240447	352261	352262	I came to London on dependent visa which is less than 6months.as per govt rules brp can't be issued..can I work without brp in London?	Will Captain America ever wield Thor's hammer?	0
240448	352263	231777	What is an RNA primer and what is its purpose?	What are three ways in which RNA differs from DNA?	0
240449	52281	135049	How do I change my registered mobile number for SBI Visa Debit Card?	How do I change my SBI register mobile number online?	1
240450	352264	25039	What is the greatest book ever written on King Arthur?	What are the best books of all time?	0
240451	352265	352266	Did Matt Damon really lose so much weight during The Martian movie?	Is it true that the movie The Martian was actually filmed on Mars?	0
240452	352267	352268	How do the arts in schools help children succeed?	How do I contact Pastor Chris online?	0
240453	352269	352270	What are the chances of rolling a die twice in a row with neither roll yielding a 1?	What if the rays of the sun turn into black?	0
240454	352271	352272	How do I monitor my competitors' website traffic?	How do I find out my competitors' website traffic details?	1
240455	352273	352274	What are the best movies that make you think?	What are the best movies when it comes to making you think?	1
240456	260890	316835	How would you explain the law of demand?	What is law of demand?	1
240457	125741	311025	What are the best places to visit in kurseong?	What are some of the best places to visit in your country?	0
240458	352275	352276	What are certain things a girl would never tell her boyfriend?	What are the things a girl doesn't tell her boyfriend?	1
240459	128404	4490	Why do people still believe in god in this day and age?	Why do people believe in God and how can they say he/she exists?	1
240460	352277	352278	How many people do we pass by on average every day? Is there any research on that?	Why should I come up with new ideas every day?	0
240461	81579	352279	What color jeans goes best with white shirt?	Which colour tie goes best with an off-white formal shirt?	0
240462	352280	352281	Which are the best quotes from How I Met Your Mother?	What are some of your favorite quotes from How I Met Your Mother?	1
240463	352282	352283	What can someone do with my social security number/drivers license number?	What can you do with someone's social security number?	1
240464	31122	352284	What does an air traffic controller do?	What will you do if you are an air traffic controller?	1
240465	352285	118638	What is your strength?	"How does one answer the interview question: ""What are your strengths/weaknesses""?"	0
240466	219875	42434	Is Hillary Clinton too sick to be POTUS?	Is Hillary clinton well enough to be president?	1
240467	85131	59036	How do I delete sent pictures on chat for Snapchat?	How do I retrieve old chats after deleting a WhatsApp account from a device?	0
240468	352286	352287	How chose software testing or development as career?	Why are pandas becoming extinct? How can this be prevented?	0
240469	352288	104771	How do you improve your mental toughness?	How do you improve/gain mental toughness?	1
240470	17954	108924	What does surgical strike mean?	What is surgical strike by India?	1
240471	352289	352290	How do I improve my physique?	How should I train for a better physique?	1
240472	214176	44437	What are the strongest majors in terms of job prospects and what are the weakest majors at USC?	What are the strongest majors in terms of job prospects and what are the weakest majors at UCLA?	0
240473	352291	352292	How can I overcome lack of motivation?	How does one overcome extreme laziness and lack of motivation?	1
240474	352293	158230	What is the best laptop under €600?	What is the best laptop	0
240475	352294	352295	Which are extremely decent PG for women near Google's office in Hyderabad?	What are the major aspects of the Victorian literature?	0
240476	352296	60705	What are the strongest majors in terms of job prospects and what are the weakest majors at Eckerd College?	What are the strongest majors in terms of job prospects and what are the weakest majors at Union College?	0
240477	352297	85964	If a fight broke out between a lion and a shark, who would win?	Who would win in a fight between a tiger and a tiger shark?	0
240478	352298	352299	Does sex really feel good?	Is sex enjoyable?	1
240479	352300	352301	Is the Pirate Bay Legal, If not why hasn't it been shut down yet?	Why hasn't anyone shut down The Pirate Bay permanently?	1
240480	352302	352303	What is your opinion on Fate?	I need a solution to send a email through forms using PHP email() function without any bug?	0
240481	96077	87051	What are some of the movies of Hollywood that you must watch?	What are the best Hollywood movies ever?	1
240482	352304	352305	How to fix a corroding metal sculpture ?	Why does Gold corrode slowly than Iron?	0
240483	181481	352306	What is the average height of a 14 year old?	What is the average 14 year old height?	1
240484	127415	53623	What are things that make Indians happy?	What are the things that makes Indians happy?	1
240485	352307	352308	Who should be elected the President of the United States?	How exactly is the President of the United States elected?	0
240486	352309	94708	What is muscle?	What is a muscle?	1
240487	352310	352311	Who are the voice actors behind the Doremon and Shinchan cartoons in Hindi?	Who is your favorite video game voice actor and why?	0
240488	352312	352313	Why does discrimination exist?	Why does discrimination happen?	1
240489	352314	352315	What is a good tool for automated testing for mobile apps?	Which automated testing tools is best?	1
240490	352316	352317	Why do designers prefer to use Mac than PC?	What is the marketshare data on graphic designers and/or video editors using Mac vs. PC?	0
240491	99492	352318	"Why does my ""@icloud.com"" email send but not receive mail?"	How do you fix Yahoo Mail that is not receiving email?	0
240492	352319	352320	Where is the bhel application forms are available? what is the official site of bhel	What type of jobs I can get in USA with pharmaceutical sale experience? I have done MBA and bachelors of science from India.?	0
240493	352321	352322	I've been a self-employed for years for a tour business in Bali-Indonesia for years. Does anyone have an idea how to grow it bigger and bigger?	How do I determine what part of my question on Quora needs improvement?	0
240494	352323	352324	I think my best friend likes my crush. What should I do?	I feel my best friend likes my crush. What should I do?	0
240495	352325	352326	Which fast food restaurant has the best milkshakes?	Which fast food restaurant has the best curly fries?	0
240496	53203	56615	Why does it seem like half of the questions on Quora are about your IQ?	Why are most Quora users so obsessed with questions about IQ?	1
240497	352327	352328	Why did you stop using Facebook?	What happens when you stop using Facebook?	0
240498	45182	123003	Why is Manaphy bipolar in Pokémon ranger and the Temple of the sea?	Why did Manaphy had a panic attack in Pokémon ranger and the temple of the sea?	1
240499	352329	352330	Why do people continue to commit petty crimes knowing they're on their second strike?	Do movies influence people to commit crimes?	0
240500	352331	352332	Do people with previous job experience find it difficult to get a job after Mtech in IITs or BITS?	How do I deal with bullying when u have no one on your side?	0
240501	257923	349393	What is the selection process in cricket to be a part of the Ranji team?	Can anybody play for any ranji team?	0
240502	352333	352334	How do I prepare/study for an auditing exam?	How do I study and prepare for exams?	0
240503	352335	352336	I have friends who don't treat me bad but don't treat me like the others in the group, and I feel left out. What do I need to do?	I feel like I'm surrounded by friends who, even if unintentionally, don't take me seriously and simply treat me like the happy-go-lucky clown of the group. Do I leave this group of friends or how do I deal with it?	0
240504	52361	352337	Why does society prefer to idolise movies stars and models over people who do great things, like scientists or humanitarians?	Why can't even the goodhearted people who are wise and intelligent and also think about the society prefer child adoption in order to contribute to our society?	0
240505	151718	352338	In what order are the episodes of Firefly intended to be watched?	Is it worth it to watch Firefly?	0
240506	352339	352340	What are the top 10 birthday songs?	What are the Top 10 Fun Things To Do On Your Birthday?	0
240507	352341	352342	"How accurately does the video game ""This War of Mine"" depict what the civilian's life was like during the Sieges?"	How accurately does the video game This War of Mine depict what life was like during the Siege of Sarajevo?	1
240508	44820	352343	What consequences would india go through if Donald trump wins?	What will happen to India if Donald Trump wins?	1
240509	33171	352344	Is it possible to develop an intelligence like that of Sherlock Holmes?	Is it possible for someone to develop deductive reasoning abilities like Sherlock Holmes in real life?	1
240510	314816	352345	After learning the basics of a programming language, what are the next steps?	What should I do to take the next step after learning the basic syntax and functions of a programming language?	0
240511	352346	352347	Which catfish are good to eat? Why do those ones taste better?	How can I take the skin off a salmon?	0
240512	352348	352349	I want to quit my railways job and want to start a business can I have some advice?	I want to quit my job and start a business, but I need some real advice. All I find online are success stories. Does anyone have a good failure story?	0
240513	140795	352350	What are some Beautiful lines to comment on beautiful pictures?	What is the most beautiful line in Shakesperean writings?	0
240514	100944	149452	Are Einstein's gravitational wave and de Broglie's wave-particle duality wave both waves in the strongly interacting dark matter?	Could 'empty' space be a sea of massive photons which behaves as the medium for Einstein's gravitational and de Broglie's wave-particle duality waves?	0
240515	352351	213812	What is the perfect way to write a Quora question?	What is the most effective way to write a Quora question?	1
240516	237022	216074	Where can I watch Boruto (Naruto the movie) with Japanese audio and not Korean or English dubs?	"Will Naruto die in ""Naruto: Boruto The Movie""?"	0
240517	180174	1885	What are the easy ways to earn money?	What are the easy ways to earn money online?	0
240518	53120	4367	What is Balaji Viswanathan's take on 500 & 1000 rupees currency notes ban in India?	What do you think about banning 500 and 1000 rupee notes in India?	1
240519	499	75768	How will the implementation of GST bill impact the lives of common people?	How will the GST bill affect common men and the country? What are its pros and cons?	1
240520	27696	22323	How does Quora determine how many views an answer gets?	How is views on answers in Quora calculated?	1
240521	3807	22443	What are the best Smartphones tech gadgets?	What are some of the best mobile gadgets?	1
240522	352352	185667	Which are the best poems about India?	What are some of the best poems in India?	0
240523	192019	352353	What is the easiest way to get JIO sim?	How do I get a Jio Sim in Bangalore?	0
240524	197473	352354	How do I establish a cordial relationship with SIL?	How often do people cheat on an established relationship with more than one partner?	0
240525	36426	19308	Why has the Modi Government banned the 500 and 1000 rupee notes?	Why is 500 and 1000 rupee notes discontinued?	1
240526	352355	352356	Taupe colour shoes and what to wear with them?	What colour tie should I wear with a black shirt?	0
240527	352357	352358	Who are some professors/scientists who know both machine learning and toxicology?	Who are some professors/scientists who know both machine learning and sociology?	0
240528	68963	7156	What are your views on the Brexit?	What is your opinion on brexit?	1
