id	qid1	qid2	question1	question2	is_duplicate
305712	14459	192408	Which is a suitable inpatient drug and alcohol rehab center near Sumter County GA?	Which is a suitable inpatient drug and alcohol rehab center near Cook County GA?	0
305713	377479	429153	How has social media changed the world?	How has Social Medial Changed the World?	1
305714	328497	289542	What are some of the best motivational clips?	What are some of the best motivational videos?	1
305715	429154	429155	Does information exist, or is it a social construct?	Does science exist, or is it a social construct?	0
305716	429156	429157	What is the most funny or weird scene you have encountered while travelling Mizoram (India)?	Have you ever used a home made face product for a long time that actually gave wonderful results?	0
305717	203068	26340	How should I prepare for Java fresher interview?	How do I prepare for a Java developer interview?	0
305718	429158	429159	Why is there no RNA in nucleus?	Why there is no RNA in the nucleus?	1
305719	304653	20807	How did Bleed for This (2016 movie) get greenlit? What's the backstory of how the movie got made?	How did Ghostbusters (2016 movie) get greenlit? What's the backstory of how the movie got made?	0
305720	429160	429161	How do I install the same app multiple times on my Android device?	How can I run a single Android app many times in a single device?	0
305721	5877	112586	Does swimming increase your height in twenties?	Does height increase after 18 years?	1
305722	429162	429163	How do I apply for internship in TCS?	How one should apply for internship in TCS?	1
305723	429164	429165	Why do we feel a air breeze coming in opp direction inside a metro?	Why can't we put a camera in a black hole to see what's inside?	0
305724	13817	63609	What are the safety precautions on handling shotguns proposed by the NRA in Massachisetts?	What are the safety precautions on handling shotguns proposed by the NRA in Montana?	1
305725	429166	429167	If I have Rs. 50000, can I start my own business in India?	If I have Rs. 50000 can I start my own business in Mumbai?	0
305726	429168	13043	What are the most important books in Computer Science?	What are some of the best books on computer science?	0
305727	429169	429170	What can Donald Trump realistically do if he becomes the new president?	What kind of changes can Donald Trump realistically expect to make, if he became president?	1
305728	135132	429171	How do I calculate steel quantity for slab, footing, column? (assume the size yourself)	How do I estimate the quantity of rebar in slab?	0
305729	429172	429173	What are the problems faced by people in the Indian Armed Forces?	How capable are Indian Armed Forces?	0
305730	142120	182547	What was the worst thing that a complete stranger has ever done to you?	What is the most satisfying gesture you've ever done for a stranger?	0
305731	429174	429175	How many cars drive with rear wheel drive?	How many cars drive with rear wheel?	1
305732	19239	101658	Psychology of Everyday Life: What are some of the greatest examples of absence of mind?	What are some of the great examples of absence of mind?	1
305733	69958	76359	Why is the media against Trump?	Why mainstream media hates Donald Trump?	1
305734	122279	429176	What scenarios would most likely cause an all-out global nuclear war?	If nuclear war broke out would America win?	0
305735	117049	60209	Is there a chance that Donald Trump turns out to be a very good president?	Is Donald Trump fit to be president?	1
305736	429177	429178	What are some of the most successful political lies by both Republicans and Democrats?	Who is most likely to acquire the nomination for both democrats and republicans?	0
305737	429179	429180	Between how many levels of pressure force can the 3D-Touch sensitive display of the iPhone 6s distinguish?	How many levels of pressure force can the 3D-Touch recognition of the iPhone 7 differentiate?	1
305738	429181	429182	What are some amazing facts about Indian cricket?	What are some lesser known amazing facts about cricket?	0
305739	429183	429184	What are you doing while on Quora?	What are you doing in Quora?	1
305740	52401	429185	Is drinking apple cider vinegar good for you and why?	Is apple cider good for you?	0
305741	429186	429187	If I went up into space, opened a jar for a few seconds, put the lid on tightly, and then came back down to my kitchen, what would be in the jar?	Is it valid to calculate the isentropic efficiency for a polytropic process?	0
305742	429188	429189	Where can you buy a Mini DisplayPort to RCA converter?	Where can I buy an RCA to HDMI converter cable?	0
305743	429190	429191	I have a offer from Persistent Systems Private Limited with 3.7 lpa CTC, and from L&T Infotech with 3.0 lpa CTC. Where should I join?	I have 3.8 years of experience in QA. I have got an offer from Adobe System. What post and package (Detailed CTC) should I expect from them?	0
305744	429192	429193	How do I create a program to solve differential equations in c++?	How do I create a program to solve a system of differential equations in C++?	1
305745	322485	14409	What is the hardest thing(s) about raising children in Colombia?	What is the hardest thing(s) about raising children in Australia?	0
305746	429194	429195	Are there any kpop idols who came out as openly gay?	What is the Proper payment rates for blog-writer? Based in India, writing on behalf of Indian author.	0
305747	89405	71439	What is the best site to download films?	Which is the best site to download movies from?	1
305748	43657	429196	What are some smart ways to deal with people who brag way too much about themselves?	Why do I laugh way too much? How do I stop it?	0
305749	429197	429198	"What causes ""queefing""?"	What causes a queefing?	1
305750	429199	429200	How does HSTalks pay the speakers?	Who is the speaker of Lok Sabha?	0
305751	163570	77758	Where can I get very smooth and uncomplicated assistance in Sydney for any property transaction?	Where can I get very friendly assistance in property for sale across the Sydney?	1
305752	152897	295883	Why are human beings so intelligent compared to all the other kinds of animals?	What technicality results in humans being more intelligent than other animals?	1
305753	429201	429202	Which is best institute in Bangalore for software testing?	What is the best software testing institute for software testing in Bangalore?	1
305754	141350	429203	How do i prepare for NEET and AIIMS 2017 in a year?	How can I prepare for NEET 2017, AIIMS and JIPMER in one year?	0
305755	25413	211264	What is the meaning of “shalini”?	What is the meaning of #?	0
305756	225863	429204	What is a muscle car?	Would you rent a muscle car?	0
305757	429205	355152	How do I prepare for GATE exam being a chemical engineering student?	How should I prepare for GATE for chemical engineering?	0
305758	194002	64784	Why do you like working at google?	What is it like to work at Google?	0
305759	429206	429207	What should every physicist know about complex analysis?	Which constants should a physicist know by heart?	0
305760	14790	45181	Why is Manaphy angsty throughout in Pokemon Ranger and the Temple of the Sea?	In Pokémon ranger and The Temple of The Sea, Why does Manaphy whine like a baby?	1
305761	429208	2605	How much is the law of equivalent exchange valid in real life?	What is the purpose of life?	0
305762	90	429209	What universities does B&G Foods recruit new grads from? What majors are they looking for?	What universities does ConAgra Foods recruit new grads from? What majors are they looking for?	0
305763	429210	429211	How can I get a whole eggshell?	Business Intelligence: Has anyone tried Slemma and what was your experience?	0
305764	118532	23515	How do I get instagram followers for free really fast?	How do I get free Instagram followers fast?	1
305765	429212	141296	How often should you ask for a raise?	How can one ask for a raise?	0
305766	214320	429213	Did LikeALittle work for anyone?	What is the gender distribution of online flirts on Likealittle.com?	0
305767	429214	429215	What is best interview answer (emerging startup) when asked 'What is your career objective?'	What is best interview answer (emerging startup) when asked 'What are your career goals?'	1
305768	429216	429217	What will be the effect on flute if the bamboo used is slightly curve?	How do dreams impact our life?	0
305769	429218	429219	How do you celebrate Easter?	What are some things associated with Easter and why?	0
305770	15781	125297	What is the most important thing to have in life?	What is the most important thing/person in your life?	1
305771	429220	174069	What is the best way to learn internet marketing, i.e. SEO, analytics, conversion, etc.?	What's the best way to get started in internet marketing?	1
305772	429221	272627	Will ceasing Indus water treaty with Pakistan create the desired result for India?	Why India is not breaking the Indus Waters Treaty to teach lesson to Pakistan?	0
305773	429222	429223	Where I create my free website?	How do I create a free website?	0
305774	31851	429224	How do you tweet embedded YouTube videos with autoplay on Twitter?	How can I upload a YouTube video so that it *autoplays* on Facebook?	0
305775	429225	429226	What languages are used to make mobile apps?	What languages are used to make apps on the phone?	1
305776	36120	39774	What are the easiest ways to make good money using the Internet?	What is the easiest way to earn money using internet?	1
305777	39387	203240	What do you think of that Bob Dylan wins the 2016 Nobel Prize for Literature?	What do you think about Bob Dylan winning the Nobel Literature Prize as a singer and a songwriter?	1
305778	429227	429228	What are the differences between a TI-89 and a TI-84?	What are the differences between TI 84 plus and TI 89? What are some examples?	0
305779	429229	429230	How do you find the mass of square shaped things?	How do you find the volume of square shaped things?	0
305780	429231	429232	What is the best way to buy and resell cars?	How do I buy and resell things?	0
305781	56742	59447	What are the results of doing push-ups daily?	How many push ups and sit ups should I do each day to look buff?	0
305782	429233	429234	What is Mokeskin in Harry Potter?	What's the Harry Potter prequel?	0
305783	429235	429236	What are some good examples of freestyle verses?	Why weren't the Death Star plans on the Death Star?	0
305784	429237	429238	How do I become good at math?	How did you become so good at maths?	1
305785	429239	429240	Which is the best squadron in NDA? Which is easy to survive at NDA?	What are the different squadrons in NDA?	0
305786	46393	429241	What is the best way to learn qtp?	What is the best way to learn everything about QTP?	1
305787	429242	429243	Was Ghiyasuddin Ghazi the real name of Motilal Nehru's father?	Can I write my father full name as my initials?	0
305788	371456	429244	Where can I find sex pictures?	Where's sex?	0
305789	146257	77023	How do I make quick money?	What is the best way to to make money?	0
305790	35709	429245	Which are best apps for photo edit?	Which is the best app for cartoonised photo editing?	0
305791	427828	429246	What are your weaknesses? Why do you think it is your weakness and not a strength?	What are Hillary Clinton's strengths and weaknesses?	0
305792	263488	9518	How do I get 5k followers on Instagram?	How do I get more followers on Instagram?	1
305793	21243	84535	What are the best foods and/or diet plan for weight gain?	What are the best foods for weight gain?	1
305794	429247	429248	Is there any online coachig classes conducted by IIA?	Are there any good online classes for asp.net?	0
305795	429249	429250	If the gold standard was not removed would we have significantly less global economic growth and slower social mobility?	Economic History: Was the US action to devalue the USD by going off the Gold Standard a strong factor in the global recession in the 1970s?	0
305796	124537	429251	May one take Nimulid, Metrogyl and cetirizine tablets in an emergency?	Can I take 19mg of iron tablets a day? (male)?	0
305797	429252	429253	How can you teach yourself to read?	How do I teach myself to read?	1
305798	417496	429254	How do other countries perceive LCA-tejas and ARJUN tank?	What is export potential of LCA-tejas?	0
305799	429255	429256	How much do Software engineering jobs pay in London?	How much does Zulily in Seattle pay new grad Software Engineer?	0
305800	255742	421306	What is the conflict between Israel and Palestine?	What is the cause of conflict between Israel and Palestine?	1
305801	429257	429258	What is the best video format for Adobe Premiere Pro?	I have inserted an image file over a moving video in Adobe Premiere Pro, but how do I move it from the center of the frame to a corner of the frame?	0
305802	208002	429259	What makes an adult male genital modification more ethical than an infant genital modification?	If I have a mustache and male genitals, but was born a female and had SRS as an adult, what public restroom should I use when in North Carolina?	0
305803	429260	429261	How do you deposit a check at an ATM at Bank of America?	Why is there a maximum Bank of America ATM withdrawal?	0
305804	429262	429263	What is the total number of students appearing in FTRE class 9th, 2015?	How many students appeared for FTRE class 11 2015?	0
305805	160592	3693	In one episode of Impractical Jokers, Murr married Sal's sister for Sal's punishment. Is it true and did it actually happen or was it a publicity gimmick?	What are the ethnicities of the cast of 'Impractical Jokers'?	0
305806	429264	429265	How did I get huge money by tuition?	How can I earn huge money by becoming a teacher?	0
305807	429266	189201	Which is the easiest way to forget someone?	What is a good solution to forget someone?	1
305808	429267	429268	Which are the highest paying software companies for datawarehousing?	Which are the highest paying software companies in India?	0
305809	58545	35944	What hotel in Khalilabad would be safe for unmarried couples, without the harassment of police, hotel staff, and moral police?	What hotel in Jaipur would be safe for unmarried couples, without the harassment of police, hotel staff, and moral police?	0
305810	204273	122871	Using the Quora iPhone app, how do I create a blog?	How do I create a blog on the iPhone Quora app?	1
305811	429269	429270	What does an obsession feel like?	What does obsession feel like?	1
305812	429271	429272	How much importance should be given to patents before you build your idea?	Ideally how much time should you dedicate to building up your first venture before you move on to creating your second?	0
305813	208766	429273	Why was Stalin nominated for the Nobel Peace Prize in 1948?	How and when was the Nobel Peace Prize invented?	0
305814	429274	347780	What are some cultural faux pas when interacting with someone with histrionic personality disorder?	What are some cultural faux pas in Seattle?	0
305815	429275	429276	Are there placements at MIT Pune for petrochemical engineering?	Are there placements at MIT Pune for petroleum engineering?	0
305816	9005	99089	Daniel Ek: When will you launch Spotify in India?	When will Spotify launch in India?	1
305817	113480	23279	Why do some people currently believe the earth is flat?	Why do some people think Earth is flat?	1
305818	219161	429277	Why did you become a computer hacker? what was your need to become one?	How can I become a computer hacker?	0
305819	51226	67737	Which are the best books to prepare for IAS exam?	What is the best book of preparations for IAS exam?	1
305820	8828	17980	What is the funniest joke you ever heard?	What is the best joke you've ever hear?	1
305821	136896	15140	"Why does Quora claim of all questions I write, that ""This question needs editing to be improved""?"	Is there a way on Quora to ask why a specific question was marked as needs improvement?	1
305822	429278	310683	What is a plant habitat?	What is a terrestrial habitat?	0
305823	281911	429279	What are the best and worst things about public transit in Düsseldorf, Germany? How could it be improved?	What are the best and worst things about public transit in Nürnberg, Germany? How could it be improved?	0
305824	194018	319428	How do Americans get such white teeth?	Why do all Americans have such white teeth? Is it related to their habits or because of the race?	1
305825	37919	429280	What should you do if your Amazon package shows up as delivered, but you never got it?	What is Amazon (India) Prime welcome package?	0
305826	127798	177615	What are the career opportunities in US after MS in Engineering Management for a Civil Engineer?	How are the job opportunities in US after completing MS in Engineering Management?	1
305827	429281	429282	What was the pattern of the PepsiCo India campus recruitment in 2014?	Which is the best law college in india other than NLU'S in terms of campus recruitment?	0
305828	429283	429284	How many customers shop target each day?	Which sleeping pattern is most efficient?	0
305829	133237	75205	Is there life after death?	Is there life after death? Can we revive our life once again as next avatar of ourselves?	1
305830	429285	429286	I put someone on my reject list on my Android, so will that mean I won't get any calls or texts from them?	I need to automate call making. Which android app can automatically dial a phone number (from a list) right after I finish making a phone call?	0
305831	148969	429287	How can social behaviour contribute in DNA modifications?	Who coded our DNA?	0
305832	429288	429289	Can I find a mobiles location with it's phone number?	How can you find the location of a phone using its number?	1
305833	8254	141154	How long will it take for meth to get out of my system if I'm 6'0, 155 lb and 17 years old?	How do I get meth out of my system faster?	1
305834	3784	22111	Quora: How to ask question on Quora so that it wont get marked as needing improvement?	Why are ALL my questions being marked as needing improvement?	1
305835	429290	429291	How do sea monkey reproduce?	Do sea monkeys reproduce? Why or why not?	0
305836	429292	331145	Can non-iPhone users see emoji?	How are you able to see emojis on an Android phone?	0
305837	429293	299176	What is airtel's marketing strategy?	What are good marketing strategies for a small business?	0
305838	81243	429294	What are the isomers of bromobenzene?	What are the isomers of C6H14?	0
305839	429295	429296	How do I do background check for someone in uk?	How to do a background check on someone?	0
305840	429297	429298	How does AC work? Does it mean the electrons shuffle back and forth along the wire at a frequency of the current flowing?	How does AC current travel if it alternates back and forth?	1
305841	429299	429300	Why is CGI so expensive and how can it be made cheaper?	Why is CGI so expensive?	1
305842	10820	158630	What will you do during the last 24 hours of your life?	If you had only 24 hours left to live, what would you do?	1
305843	112254	429301	Who is the present HRD minister of India?	Who was/is the best HRD minister of INDIA?	0
305844	224267	429302	Does active in Messenger mean only Messenger, or can it mean in Facebook, without being on Messenger?	What does it mean when you have no icons at all after a message you've sent via Facebook Messenger?	0
305845	429303	429304	How come humans can survive the Van Allen radiation belts?	NASA sent people to the moon in July 20th 1969, crossing Van Allen radiation belt. Why do they need a test mission now, after 45 years, for NASA’s Orion Spacecraft to study the belt's radiation for their manned mission in 2020?	0
305846	364848	166407	What are the differences between a borderline personality disorder and a narcissistic personality?	What are the differences between a Covert Narcissist and someone with Borderline personality disorder?	1
305847	2934	23594	How do I get into my Instagram if I forgot my email and my Facebook password?	How can I open my Facebook account I forgot my password and Gmail?	1
305848	429305	96347	What is the trick to use Jio 4G in Xperia T2 Ultra 3G supported pleasesuggest?	Can I use a Reliance Jio 4G sim in a 3G Microsoft lumia 535 phone?	0
305849	429306	429307	What wiring I need to do to install ignition live lighter socket on opel/vauxhall zafira B? Socket will be for DVR and phone charger.	Who has the best pussy in Bollywood?	0
305850	429308	429309	What is the evolutionary purpose of becoming nervous around your crush?	Why do I get nervous, in a scientific way, when my crush talks to me?	0
305851	429310	429311	What happened to William's wife in pillars of the earth?	What happened to Williams wife in pillars of the earth?	1
305852	429312	327773	How do I get started with a career in football in India?	How can I get an internship at a football club in India?	0
305853	429313	429314	Which country high demand for architects?	Which countries have high demand for architects?	1
305854	429315	429316	What will be the answer for the fifth question?	What is the answer for this questions?	0
305855	164536	429317	What shouldi know to buil a website?	What frameworks/languages should I use to build a front end website like Zillow quickly?	0
305856	37205	242194	What is the difference between Chinese and Mandarin?	What's the difference between Mandarin and Chinese?	1
305857	429318	429319	What was the real cause of the arab revolutions?	What are the real causes of the Arab revolution?	1
305858	429320	429321	Why are Europe and Asia separate continents when all of it was once considered Laurasia?	How can you cook a frozen pot roast in a crock pot?	0
305859	429322	429323	China attack on India?	Will china attack India?	1
305860	429324	429325	Where can I read the Encyclopedia Britannica?	Who writes Encyclopedia Britannica?	0
305861	429326	84339	To what song are you listening?	What music are you listening to now?	0
305862	49631	429327	Why did Lucas change the final battle of ROTJ from Kashyyyk to Endor?	6,000,000,000 Clone troopers and 7,000,000,000 Stormtroopers brutally battle it out on Hoth, who wins?	0
305863	176205	180478	Is there any case where the surface of the earth can be assumed to be a non-inertial frame?	Since speed is equal to distance divided by time, how can the speed of light be constant if time is not?	0
305864	33323	29207	Why does helium make your voice go squeaky?	Why does helium make your voice sound funny?	1
305865	429328	429329	What is IP Security?	What is IPS?	0
305866	134955	429330	What is the lowest body fat percentage a bodybuilder has ever achieved?	Why do most athletes have such a low body fat percentage?	0
305867	429331	277996	What are the most important elements that made Harry Potter so wildly successful?	Why are some people crazy about Harry Potter?	0
305868	429332	429333	How does it feel to be a Russian Jew? Do you feel more affinity towards Russia or Israel?	As an Israeli Jew, how do you feel while passing an Arab village in Israel?	0
305869	429334	429335	What are some of the best recipes for making ice cream with beer?	What are some good recipes for making Ice Cream Magic?	0
305870	110618	192144	What color shirt should I wear with dark brown pants?	What color shirt and tie should I wear with a gray suit to a wedding?	0
305871	429336	429337	How does inflation affect the economy?	How exactly inflation affects economy?	1
305872	429338	429339	Which is more loving salamano and his dog or meursault and his mother?	Kendrick Mars is surely a fake and trying to net some scams, should be banned?	0
305873	199646	50267	What are some mind-blowing technology gadgets that exist that most people don't know about?	What are some mind blowing gadgets that exist in 2016 that most people don't know about?	1
305874	8975	18244	How do I survive in a long distance relationship?	Does a long distance relationship really work?	1
305875	317842	153748	What do you think Heaven is like?	What do you think heaven will be like?	1
305876	429340	429341	What is the difference between keyboards, synthesizers, arrangers ?	What are the differences between a synthesizer and a keyboard?	0
305877	429342	93535	Can I learn the Swift programming language enough to program an iOS app without any other coding experience at all?	How long would it take to learn programming well enough to would be able to write apps like Snapchat?	0
305878	429343	113978	Which is more efficient petrol or diesel engine?	Why diesel engine is more efficient than petrol engine?	0
305879	61254	35921	Are we near World War 3?	How imminent is World War three?	1
305880	236381	195225	What are some leguminous crops?	What are some examples of leguminous plants?	1
305881	19546	10473	Can we time travel?	Is it possible to time travel to past?	1
305882	1286	6748	How can I improve my spoken English ability?	How can I improve my communication skill and English proficiency?	1
305883	5051	5729	What is the QuickBooks payroll tech support number in Washington?	Which is the best QuickBooks Tech Support Number in New York, USA?	1
305884	184262	224907	Is the Bible true?	Is the Bible true? What if it was just like some sort of a diary?	1
305885	429344	429345	How should I practice writing essays?	How many days of the week would anyone practice and improve his or her essay writing skills?	0
305886	429346	429347	Does salt conduct electricity?	Can salt conduct electricity?	1
305887	429348	17721	What does the Destiny Knot do for breeding in Pokémon?	Which Pokemon evolve with Shiny Stones?	0
305888	20201	4415	What are ways to make money online at home?	What should I do to make money online in India?	1
305889	123387	140327	What can I do to improve my public speaking skills?	How can I improve my public speaking ability?	1
305890	157189	49206	When is it too late to study medicine and become a doctor?	I am 24. Is it too late to get into medicine?	1
305891	56511	61951	Do you really think everything happens for a reason?	Do you believe everything happens for a reason? Why or why not?	1
305892	70806	39761	What was the craziest thing you have done?	What is the craziest thing you have ever done in your lifetime?	1
