id	qid1	qid2	question1	question2	is_duplicate
353694	482792	482793	At what age is it too late to get an MBA?	Is it too late to start CFA at the age of 27 ?	0
353695	85987	276496	How do I delete WhatsApp chats permanently?	If I delete my WhatsApp account, will my photos and messages be deleted permanently?	0
353696	144999	102885	How can I start learning Python's language?	How can I start learning the developing of websites using Python?	1
353697	482794	482795	Why do so many African-American people hate Al Sharpton?	Do African Americans think that Al Sharpton is a positive role model and leader despite his many controversies?	0
353698	67141	171288	I had sex 2 month ago and I had my period for 2 days last month and this month I'm 2 weeks late. Could I be pregnant?	I have had 2-3 periods since I last had sex 3 months ago with a condom and no cum, my period is 10 days late, could I be pregnant?	1
353699	482796	257943	Which is the best phone to buy in India under 13000 right now?	What is the best phone under ₹20,000 in India right now (2016)?	0
353700	482797	482798	Why do we have a Fahrenheit and Celsius scale?	What is the need of the unit Fahrenheit if you can measure temperature in Celsius?	0
353701	482799	482800	Can a police officer from another state or jurisdiction execute an arrest or carry out a warrant in another state?	If a person shoots a gun and it hits a person in another state, which state will arrest him?	0
353702	482801	482802	What do you think about this stack (supplements): Gold Standard whey + CGT-10 + Amino Energy?	Why did the world adopt the gold standard?	0
353703	65265	482803	How do you say this in English ?	How can I say 小香风 in English?	0
353704	482804	482805	What should I do now with my love life?	What should I do now in my love life?	1
353705	482806	374609	How do I keep my mind relaxed and active?	How do I keep calm?	0
353706	480049	296712	What are the best books on 'Learning How to Learn'?	What are the best books to learn how to learn?	1
353707	482807	482808	Which is the best water purifier in Bangalore?	Which is the best water purifier for Mumbai?	0
353708	482809	105097	"How is the name ""Babar"" pronounced?"	"How do you pronounce ""Quora""?"	0
353709	482810	482811	Can I mail Excedrin to Canada?	Should I mail my transcript to university of Waterloo before I get accepted? (I am outside of Canada)	0
353710	98356	151036	Is it worth buying the iPhone 7?	Is it worth to buy an iPhone 7?	1
353711	105000	84997	How do you get over social anxiety?	How can I get over social anxiety?	1
353712	482812	482813	How is the climate at Roopkund in May and June? Is there a chance to see snow?	Why is it easier to see at night when it's snowing?	0
353713	482814	482815	"What is a ""carbon based life form""?"	Could there be non carbon based life?	0
353714	207004	284885	How can one become a successful entrepreneur?	How can one be an entrepreneur?	1
353715	81896	336090	How do I get a puppy?	Should I get a puppy?	0
353716	482816	482817	Is Tom's toothpaste better or worse than brands like Colgate?	What are the best non-gel toothpaste brands?	0
353717	482818	223183	What is Srinatha Mahakavi known for?	Who is Srinatha Mahakavi?	0
353718	168717	55190	Where can I get good quality weed in Mumbai?	Where do I get good quality weed in Jaipur?	0
353719	482819	482820	How much amount of rainfall are there all over the world?	What's the average amount of rainfall throughout the world?	1
353720	61996	273912	How do I know if I'm pregnant?	How do you know I'd your pregnant?	1
353721	482821	482822	What is data abstraction?	Is maths abstract?	0
353722	482823	482824	What is your happiness?	What is happiness?	0
353723	358351	157301	Is there any other country in the world with as much culture and diversity as India?	Is India the most culturally diverse country?	0
353724	167120	268745	Why can't asylum seekers get MTA free pass in the USA?	How do I become asylum seeker in Belgium?	0
353725	482825	138225	How can I prepare my self to be a good doctor?	How do I become a great doctor?	0
353726	15272	32801	How cold can the Gobi Desert get, and how do its average temperatures compare to the ones in the Great Sandy Desert?	How cold can the Gobi Desert get, and how do its average temperatures compare to the ones in the Taklamakan Desert?	1
353727	468318	216074	Is Naruto really dead in Boruto Manga?	"Will Naruto die in ""Naruto: Boruto The Movie""?"	0
353728	44601	73719	Why do people think Trump is racist?	Why do some people say that Donald Trump is racist?	1
353729	482826	482827	If your CTC is 6.4lap, what is the take home salary?	If CTC is 458000 then what will be the monthly take home salary?	0
353730	153209	195023	What hotel in Jhansi would be safe for unmarried couples, without the harassment of police, hotel staff, and moral police?	What hotel in Meerut would be safe for unmarried couples, without the harassment of police, hotel staff, and moral police?	0
353731	482828	482829	What happens when dihydric alcohol treated with aquous sodium bisulphite (NaHSO3)?	What happens when mixing alcohol and water?	0
353732	107699	15441	What are some mind blowing bike tools that most people should have?	What are some mind blowing bike inventions technology that most people don't know about?	1
353733	30465	106353	Which is the best Smartphone under INR 15000 ?	Which is the best smartphone in India under Rs 15000?	1
353734	482830	482831	How do I improve search engine ranking?	What is the best way to improve search engine ranking?	1
353735	482832	482833	What is the role of the queen in the UK government?	What role does the Queen of England play in the UK government?	1
353736	240546	257062	How much score is required for PTE Academic for an Australian PR with an experience of 3 years?	What is the exact score required in PTE to obtain a PR invitation for Australia?	1
353737	77131	482834	What is the creepiest thing your parent has ever done?	What's the creepiest thing to have actually happened to you ON Halloween?	0
353738	482835	482836	How do I start acting normally?	How can I start acting?	0
353739	81870	482837	Why can flat maps never be as accurate as a globe?	Which shadow mapping technique is fast and accurate?	0
353740	482838	482839	How can we make a model of a rocket?	How do I make a model of a rocket?	1
353741	482840	178301	Is it true that Narendra Modi is working for bankers, billionaires and corporate companies?	Narendra Modi: Is Narendra Modi incorruptible?	0
353742	130413	482841	How do you treat sunburn wrinkles?	What is the best way to treat sunburns?	0
353743	482842	482843	Why are my eyes always dilated?	Why can't my eyes dilate?	0
353744	43845	66094	What would happen when I die?	What happens to us when we die?	1
353745	112223	114562	Where can I sell my idea?	Where can I sell entrepreneur ideas?	1
353746	482844	482845	What Wade Wilson [Deadpool] was doing in Jacksonville? Not as Deadpool but as special forces operative. What happend there?	Can Deadpool feel pain?	0
353747	204453	463117	What is the worst thing you saw your kids do that you wish you had never seen?	What is one thing you caught your son doing that you wish you had never seen?	1
353748	169116	351376	How do I improve English in a non-English-speaking environment?	How can I learn to speak English well in a non English environment?	1
353749	342274	482846	What is the reason behind headaches?	What is the actual reason of headaches?	1
353750	152145	482847	What happens if I do not tip my waiter in the U.S.?	How much should I tip an exceptional waiter?	0
353751	482848	406153	Is/was there any place on the earth/ (with) in the world where castes (sub) systems do/did not exist?	Is there any place/city where all Indians are not allowed to visit, anywhere in the world?	0
353752	91206	98452	Most of my questions are marked as needing improvement. Where can I seek professional help?	Do people see questions that are marked as needing improvement?	1
353753	330857	397540	How does a vector quantity differ from a scalar quantity?	Is current a scalar or a vector quantity?	0
353754	280916	482849	Are teeth whitening products (such as the brand Carbon Coco) safe products to use?	Does teeth whitening work and does it hurt?	0
353755	266255	482850	When did it become legal for blacks and whites to marry?	Is it illegal to steal someone's black money, pay tax on it/ convert to white legally and use it?	0
353756	482851	482852	"What are auditions for ""The Bachelor"" like? What do the producers look for?"	Who plans the dates on The Bachelor: the bachelor or the producers?	0
353757	3405	17010	Which is the best movie download site?	What are the best sites to download movies from?	1
353758	482853	482854	Which is best affordable camera to start photography?	What is the best camera for a photography starter at an affordable price?	1
353759	288414	482855	My school does not have JROTC, what can I do?	What do they do in JROTC?	0
353760	482856	482857	Which are best music albums?	What are some of the best music albums (or) songs?	1
353761	172697	103449	How is the Catholic Bible different from the Protestant Bible?	Is protestant Bible the same as the Catholic Bible?	1
353762	30137	160862	What can I do to increase my IQ?	What shall I do to improve my IQ?	1
353763	77564	155090	How do I increase my confidence while public speaking?	How can I gain confidence in public speaking?	1
353764	192362	482858	Why is phenol more acidic than ethanol?	Is phenol more acidic than water or less?	0
353765	66787	35010	Why is Spotify not available in India?	Daniel Ek: What are the hardships for Spotify to be launched in India?	1
353766	345430	482859	What is Photoshop CS6?	Why is Photoshop CS6 slow?	0
353767	482860	482861	What software allows you to easily create closed captions/subtitle file for video?	What software do I need to create subtitles for my video?	0
353768	4639	482862	Why can I not add my friend back on Snapchat?	Should I add a guy I like on snapchat?	0
353769	482863	14217	What is the best CPM ad network?	What are the best CPM ad networks?	1
353770	482864	323517	How did Batman come back to life in The Dark Knight Rises?	Did Batman die in The Dark Knight Rises?	0
353771	482865	482866	Earn rs 10000 from one lakh minance?	What is matte eyeshadow used for?	0
353772	482867	482868	What is the role of domestic government institutions to the competitiveness of the three firms?	How do the three branches of the US federal government work?	0
353773	194572	349555	In what order are answers displayed on Quora?	What determines the order of answers to a question on Quora as of July 1, 2014?	1
353774	482869	5282	Which is better: OLED or AMOLED?	Is IPS LCD display better than OLED display?	0
353775	27511	117554	Why can someone ask questions with extremely long details on Quora?	How do I add long details to my Quora question?	1
353776	318110	482870	How is the chemical formula of margarine determined?	How do you determine the chemical formula of corn starch?	0
353777	482871	392843	How will you explain the difference between getters and setters and constructors in Java to a beginner?	How do you explain getters and setters in Java to a beginner?	1
353778	482872	482873	How many times do men and women think of sex in a day?	How many times a day does a women think of sex?	0
353779	482874	482875	How do you get over a depression after a divorce?	How do I get over depression? It seems like a never ending story of my life.Heart broken, divorced & married(thinking of divorce again).Using SSRI’s	0
353780	452531	482876	What is non primitive data structure?	Is it safe say that primitive data structures are used to represent semantically independent values whilst complex data structures are not?	0
353781	55769	437463	How do I see my older Instagram Direct Messages (DM)?	If I direct message someone on Instagram and they hide it, can I still send messages?	0
353782	3807	11752	What are the best Smartphones tech gadgets?	What are some mind blowing smartphones gadgets?	1
353783	326876	7236	Which are the best Linux distros for an individual user?	What's the best Linux operating System distro for beginners?	1
353784	482877	482878	Who are the greatest people in the world?	Can you name some people who have really saved the world?	0
353785	61724	14212	What is a good investment?	What's the best investment?	1
353786	152696	121136	How does the demonetisation of 500 and 1000 INR notes impact the Dollar to INR rate?	Will the value of rupee increase after the 500 and 1000 rupees notes are banned?	1
353787	397533	324513	What are the best websites for learning C++?	What's the best way to learn C/C++?	0
353788	482879	356685	Can I build a pc for gaming for 350$?	How do you build a gaming PC for under $1000?	0
353789	482880	482881	Is there any core company in eLitmus?	Is there any test for core companies like eLitmus?	0
353790	9031	185920	How can I grow a beard faster?	How can I grow my beard faster and thicker?	1
353791	217086	106205	What's a good way to promote an Etsy shop?	What are some good ways to promote my Etsy shop?	1
353792	25723	3848	How can I make my penis big and long?	How can I have a big penis?	1
353793	164326	482882	Is math a science? Is the scientific method used in math or only logical axiomatic deduction?	Is there a lot of math in computer science?	0
353794	124585	482883	What would happen if I put a metal in the microwave?	What will happen if I put a metal wax container in the microwave?	0
353795	126618	482884	Do you believe in ghosts?	Do you believe ghosts exist?	1
353796	482885	482886	What is the average lifetime of a user at a language learning app like Babbel, Busuu, Duolingo, etc...?	Can I learn a language using apps such as Babbel or Duolingo?	0
353797	482887	482888	What is this on my shoulder blade?	Why are my shoulder blades so large?	0
353798	482889	482890	Where can I get my Xbox 360 controller repaired in Bangalore?	Where can I get my Xbox 360 controller repaired in Pune?	0
353799	482891	172709	Can we smell like alcohol without drinking?	Why do people like alcohol?	0
353800	482892	474876	How do I stop crying?	How can one stop crying?	0
353801	41131	4891	Who owns wikiasked.com?	Who owns FinViz.com?	0
353802	81362	482893	Who won the 2nd presidential debate?	Who won the October 16th presidential debate?	0
353803	291845	482894	Approximately how many bags of cement are required for a 1500 square foot house?	How much concrete is required to construct a 1,500 square foot home?	0
353804	482895	482896	What would you say to a person standing on a ledge, ready to jump and kill himself that could potentially save his life?	What does a person miss if he has never eaten a banana in his 25 years of life?	0
353805	7842	11588	How can I speak English like natives?	How I can improve my English communication?	1
353806	3898	482897	What is the national language of India?	Can all of India accept one language (if any) as its national language?	0
353807	482898	482899	What is the difference between Windows 7 Professional and Windows 7 Ultimate?	I am using a Windows 7 Ultimate genuine copy. How and when can I migrate to Windows 10?	0
353808	482900	482901	Which are Must watch Bollywood movie for students?	Which are must watch Bollywood movies for the students?	1
353809	482902	482903	How can I import sql file into oracle 10g database?	Oracle database connection is instructed to create using Oracle SQL Developer (graphical tool). Is it possible to create it using Application Express (Web application development tool)?	0
353810	184720	6306	Who is better Donald Trump or Hillary Clinton and why?	Who is the better candidate for being the President of the United States of America: Hillary Clinton or Donald Trump?	1
353811	482904	482905	Is it possible that when we use our brain to its fullest i.e. 100%, we can control time and heal wounds of our body…?	What is the best programming language for an offshore online casino?	0
353812	22117	164490	How would I go about creating a new religion?	What is the way to start/create a new religion?	1
353813	482906	482907	What VR Games and Apps should I feature in an upcoming Showcase Video?	Who is the most famous beatboxer in the world?	0
353814	98762	96209	How do I reduce face fat?	How can I lose my face fat?	1
353815	482908	482909	Travel policy renewal?	What would be the standard of the team if midfield of 2011 Barca and attack of 2015 Barca are united in one team? (in their primes)	0
353816	279975	13023	How does it feel to have sex with a stranger?	How is it like to have sex with a stranger?	1
353817	338637	482910	What is the best way to interact with people you don't like?	Why do we like to interact with other people?	0
353818	482911	482912	Is it necessary to have played the previous Metal Gear Solid games before playing The Phantom Pain?	Who is The Man on Fire in Metal Gear Solid 5: The Phantom Pain? Why was he important?	0
353819	171735	482913	What is the best porn site to buy a membership?	What are the best porn membership sites?	0
353820	21199	3478	Why was Cyrus Mistry removed from the chairmanship of Tata Sons?	What was the reason behind the removal of Cyrus P. Mistry from the position of Chairman of The Tata group?	1
353821	482914	64319	I masturbate in such position that when semen's about to come out, I press my dick hard inside the bed that the semen doesn't come out. I have been masturbating in this condition from 3 years. Will it affect me in some way?	What are the best ways to stop or reduce the frequency of masturbation?	0
353822	106482	482915	What is the big O notation and how do I calculate it?	How do you calculate big O notation for a function?	0
353823	33521	35359	What are the differences between Chinese culture and western culture?	What are the major differences between Chinese and western culture?	1
353824	10839	8678	If it's true that humans evolved from monkeys why is that all monkeys are not evolved yet?	If humans evolved from monkeys then why are monkeys still around?	1
353825	482916	220898	Where can we order custom lanyards (preferably in the Bay Area)?	How does Seattle compare to the Bay Area?	0
353826	482917	482918	What are the USPs of MRU? How is MRU different from other universities? Howwill MRU programmes compare with other Govt. and Pvt. Univ. programs.	What are the different analytics and big data companies out there and how do they compare with each other?	0
353827	482919	482920	What is a basilica?	What does a Basilica look like?	0
353828	482921	482922	Sites for solo travel?	Where Sass and less file compile and hwo it happend?	0
353829	482923	103463	What can India learn from other countries?	India: What are some great innovative ideas that Indians can adopt from other countries?	0
353830	58528	453701	Do Mermaids really exist? Has anybody seen them?	Reasons why mermaids don't exist?	1
353831	431185	482924	What is the difference between SUV, MPV, hatchback, Sedan, and luxury cars?	What is the difference between a sedan and a saloon?	0
353832	482925	482926	Which are the places in India to visit?	Which place in India must I visit before I die?	0
353833	482927	482928	How can a radio wave travel through space forever? Doesn't it eventually run out of energy?	I’m 16 years old and I just got into programming. What is the most efficient way of practice/study?	0
353834	179194	482929	Do you have a secret crush on your cousin/uncle?	Being a Muslim, why do you always have cousins targeted as your prospective spouses?	0
353835	49810	76619	What is your favorite animal? Why?	What are your favorite animals and why?	1
353836	182277	122685	How did Kannada actor sunil died?	According to the theory of evolution, why do we die?	0
353837	411627	145355	Do employees at Thor Industries have a good work-life balance? Does this differ across positions and departments?	Do employees at Oxford Industries have a good work-life balance? Does this differ across positions and departments?	0
353838	482930	100128	Why aren't humans drilling to the center of the earth?	Could we drill a hole to the earth's core, how long would it take, and would it be a bad idea to do it?	0
353839	378793	113151	How can I find out if my girlfriend is on dating sites?	How do I find out if my husband is dating anyone online?	1
353840	166816	364560	What is Mother Teresa's greatest accomplishment?	What were Mother Teresa's contribution to society?	1
353841	20707	29037	How does one become an actor?	How should I become an actor?	1
353842	482931	482932	How can I make free internet calls to any othet mobile that doesn't have internet connection for nokia lumia720?	Why is it so that Nokia Asha Series phones can not be connected to KGP wifi to access internet?	0
353843	482933	482934	What is the best restaurant at Whistler?	What are the best restaurants in sacramento?	0
353844	482935	482936	What is the sum of [math]\frac{1}{1-\sqrt{2}}\div\frac{1}{1-\sqrt{2}}\div\frac{1}{1-\sqrt{2}}\div\frac{1}{1-\sqrt{2}}\div\ldots[/math] up to 100 terms?	What is the value of [math]\frac{1}{1-\sqrt{2}}\div\frac{1}{1-\sqrt{2}}\div\frac{1}{1-\sqrt{2}}\div\frac{1}{1-\sqrt{2}}\div\ldots[/math] up to 100 terms?	1
353845	47413	89547	Will Clinton or Trump be the next president of the USA?	Who will be the president of usa?	1
353846	482937	482938	Where can I learn the art of deduction?	How can I learn the art of deduction?	0
353847	482939	482940	Why do eyes blink?	Why do our eyes blink?	1
353848	482941	482942	Why was the Cold War fought? Who was involved?	Where and why was the Cold War fought?	1
353849	39129	31052	What's the best way to lose stomach fat?	How do I lose stomach fat permanently and become lean?	0
353850	63598	50204	What is the fastest way to lose 30 pounds in 1 month?	What is the best way to lose 30 pounds in 1 month?	1
353851	349552	482943	What is the cheapest car insurance in Edmonton?	Where can I find cheap car insurance in Ontario?	0
353852	162675	148273	What is Universalhunt.com?	What is govtogether.com?	0
353853	427943	482944	Can you overdose on cough drops?	What is the best kind of cough drop?	0
353854	7592	482945	Does wikileaks even post their own content?	"Does Facebook charge content sites to display a ""Post to Facebook"" button on their pages?"	0
353855	482946	482947	Why has kerala Congress left UDF?	What are the must things to do in Malaysia?	0
353856	482948	482949	What are the things that make you cry?	What are some things that make you cry easily?	1
353857	482950	482951	"What should we learn from movie ""Dear Zindagi""?"	"What can we learn from the movie ""Dear Zindagi""?"	1
353858	482952	482953	Approximately how much equity did the 3000th employee at Google receive?	How much in equity would an engineer at Google likely to have if they were hired 10 years ago?	0
353859	23786	6275	What do you think of the move of banning 500 and 1000 rupee notes in India (Nov 2016)?	What do you think of the decision by the Indian government to demonetize 500 and 1000 rupee notes?	1
353860	113736	68288	Is it hard to learn how to play the piano?	How hard is it to learn how to play the ukulele?	0
353861	482954	482955	How can you teach others about investing?	What is the best shorthand writing method for students?	0
353862	482956	482957	Food Science: Why does adding carbonation to soda make it taste so good?	Can you make a baking soda and vinegar bomb?	0
353863	179189	8968	What are the best educational apps for a teenager?	What are the best educational apps?	0
353864	21553	50579	What are some of the top paying career options after doing a B.Tech in mechanical engineering?	Is CAT after b.tech in mechanical engineering useful?	1
353865	482958	185724	Has anyone had success using onion juice for hair growth?	How do I use onion juice for hair growth?	1
353866	482959	482960	How are the degrees leveled?	What are the level of degrees?	0
353867	482961	482962	Why is Paytm's customer care service so bad?	How does Paytm plan to improve customer service and product quality? Have had personal experience of poor quality products/sellers/service wtih them.	0
353868	249448	361746	How would you describe the eukaryotic cell cycle?	What is the eukaryotic cell cycle?	1
353869	59852	61072	Why is GST amendment a gamechanger for Indian Economy?	How is GST beneficial for the country? How would it help to improve the country's economy?	1
353870	482963	482964	Should we stop using the symbols [math]\div[/math] and [math]\times[/math] in elementary school education?	How will Indians celebrate Diwali in Qatar?	0
353871	78093	50767	What are the best movies ever irrespective of genre?	What are the 5 best movies of all time?	1
353872	8462	11477	How do I improve my pronunciation in English?	I want to improve my English?	1
353873	200944	482965	What are the pros and cons Ubuntu and Elementary OS?	Which operating system is better, elementary OS or Pinguy OS?	0
353874	457347	396452	How can you use tacky glue on fabric?	Can I use tacky glue on fabric?	1
353875	482966	482967	Is there a difference between mughals and Muslims?	What is the difference between Muslims and Mughals?	1
353876	255426	440574	How do price comparison sites get their data?	How do price comparison websites get their data from merchants?	1
353877	259236	393351	What is the best kept secret?	What was the best kept secret ever ?	1
353878	482968	270001	Need help with my femdom addicition?	My gre score is 321 and my awa score is 3.0 . Does awa will hamper my chances in top 30 universities for ms in cs?	0
353879	482969	482970	What is the meaning of the poems -a hymn to love?	How is my first Hindi Love Poem?	0
353880	482971	482972	How do satellites send back signals to earth?	How do satellites send pictures back to earth?	1
353881	482973	336991	How can postpartum and miscarriage depression be cured?	What are some symptoms of postpartum depression?	0
353882	482974	482975	What is select?	What is selective social?	0
353883	482976	1644	How can I get a cheap upgrade from Windows 7 Professional 32-bit to 64-bit?	I have Windows 7 32 bit. Can I upgrade to 64 bit Windows 10 (since it's a free upgrade)?	0
