id	qid1	qid2	question1	question2	is_duplicate
240176	351940	351941	If i sex with girlfriend, can she force me to marry her?	I have very strong feelings for my girlfriend and vice versa. She wants me to have sex with her. Should I do so?	0
240177	88834	106091	How would a Trump presidency affect schools accessibility for international students?	How will Donald Trump's presidency affect international students?	1
240178	351942	351943	What are the advantages and disadvantages (if any) of implementing a recent graduate program into a company?	What are the highest paying companies in India for a recent MS in CS graduate from one of the best schools in USA?	0
240179	351944	132051	Renting a car on Priceline is cheaper than rental companies. Any Ideas?	Is it a good idea to buy a used car from a car rental agency?	0
240180	351945	351946	What are good topics for thesis on pathology at BS level?	What are some good topics that should I work on in my BA thesis?	0
240181	351947	266536	Where do rich people keep their yachts?	Do rich people ever fly coach?	0
240182	214830	11639	Why songs and music is forbidden In Islam?	Is music prohibited in Islam? Why?	1
240183	351948	273325	What does this quote mean: “facts are needed to establish theories but theories are needed to make sense of facts.”?	Facts are needed to establish theories but theories are needed to make sense of facts. To what extent this statement is applicable to ethics?	0
240184	351949	351950	How do I turn an idea into a startup?	How do I convert my idea to a startup?	1
240185	351951	351952	I think I love my girl best friend who already has a boyfriend. Should I tell her how I feel?	I fell in love with my girl best friend. Should I tell her? How? When?	0
240186	351953	351954	Why are there so many phone scams hitting Singapore?	Why are there so many frauds happening in Singapore?	1
240187	85662	5671	How do I reduce belly and chest fat?	What is the best way to reduce abdominal fat?	1
240188	40046	1286	How should I improve my english communication skills?	How can I improve my spoken English ability?	1
240189	43745	42108	Why do people ask question on Quora that can be easily and definitively answered by Googling?	Why do people use Quora when they could easily find the answer in a quick Google search?	1
240190	35249	351955	"Got a FB notification saying ""Do you know Mr.X?"".Why am I getting such notifications?"	Does the notification number ever get to 0?	0
240191	2438	3938	How can I improve my pronunciation in English?	What should I do to improve my English ?	1
240192	14084	351956	What is the latest format of writing a leave application in school by self?	"How do you write a year in ""YYYY"" format?"	0
240193	2195	30154	What individuals and events in history are a source of pride for São Tomé and Príncipe?	What individuals and events in history are a source of pride for China?	0
240194	17278	10660	How can I stop worrying about what other people think of me?	When will I stop thinking about what other people think?	1
240195	351957	114391	What is the best course for learning data structures?	How can I learn data structures effectively?	0
240196	351958	189918	"What movies have used the song ""Hallelujah""?"	What is the best use of a song during a movie or tv show scene?	0
240197	46804	351959	How do I lose weight in next 2 months?	How can you do weight loss within 3 months?	0
240198	351960	351961	What is the function of the right centrum semiovale?	What are the functions of centrum semiovale?	1
240199	351962	351963	Should Wikileaks hack into the IRS, in order to release Donald Trump's tax returns?	What's the better political move? Donald Trump's running mate refusing to release his or her tax records, or releasing them?	0
240200	351964	351965	Is it possible to convert a Kindle book to PDF format?	How do I convert PSD files to PDF for print?	0
240201	141841	199277	How do I get my birth certificate?	How can I get my birth certificate?	1
240202	338626	26660	What is the health impact of drinking Red Bull?	Is it bad for my health to drink 2-3 Red Bulls a week?	1
240203	77013	75483	How do born-deaf people learn to pronounce words?	"Does someone who was born with a hearing loss ""hear"" an inner voice?"	0
240204	154258	351966	Where can I get very affordable packages for horse riding in Melbourne?	Where can I get very affordable horse riding lessons in Melbourne?	1
240205	182182	351967	What are some of the best stories about Virender Sehwag?	Why do Virender Sehwag fans hate M.S. Dhoni?	0
240206	351968	351969	How would a man-portable electromagnetic rail gun work and would it be possible in the future?	How can an electrical discharge be prevented?	0
240207	48846	22122	What are the best online courses available for digital business and marketing management?	What is the best digital marketing course online for a beginner?	1
240208	351970	351971	How many people does John Wick kill in the movie?	How many bullets fired by John Wick hit & killed his targets? And how many were miss?	0
240209	351972	117413	Why does mucus taste sweet?	"What are the best ""sweet"" wines?"	0
240210	96128	160967	How do you find an answered question on quora?	How do you answer questions on Quora?	0
240211	351973	351974	IAS: Has anyone joined or planning to join online pub ad classes (NeoStencil) by Pavan Sir?	Probable type of question for ECE in gate 2017?	0
240212	78694	351975	How does it feel to be in an incestuous relationship with first blood relatives or siblings? How does it begin?	How does it feel to have siblings with whom you have relatively few shared childhood experiences?	0
240213	351976	351977	Last night, I dreamt that Jimi Hendrix hugged me and told me he loved me? Can you please give me an indication of what this means? Are there any clairvoyants on here?	Last night I saw a dream that a snake attacked me as soon as it jumped on me I woke up with terror. What could it mean?	0
240214	351978	351979	Key similarities between democracy and republic?	How does the TSA deal with people of ambiguous gender requiring a pat down at the airport?	0
240215	351980	351981	Which is the best source for Buddhist Political Thought for PSIR optional in UPSC?	My D O B 17/05/1981 so am I eligible for UPSC 2017?	0
240216	351982	351983	I want to put daisy picthure back on my yahoo profile?	What is it like to work for Johns Hopkins Aramco?	0
240217	351984	351985	What are some criticisms of Pranav Mistry's Sixth Sense Technology?	How did Pranav Mistry develop Sixth Sense Technology?	0
240218	78679	5020	Does acrylic paint work on ceramic and does not wash off?	How do you use acrylic paint on glass?	0
240219	54063	172680	Why did the Indian government demonetize the current 500 and 1000 rupee notes and replace them with new notes?	Why did the Indian government develop a 1000 rupee note but developed 2000 rupee note?	1
240220	172183	243867	What is goods and service tax?	What is goods and services tax?	1
240221	64236	17317	Where can I get funding for my idea?	How should I go about getting funding for my idea?	1
240222	351986	351987	What is Jason Russell up to these days?	Did KONY 2012 have any effect on warlords in Africa? Any at all?	0
240223	111892	351988	Why do caucasians guys find Filipino ladies attractive?	Why do I feel that aesthetically caucasians are more attractive than many Africans and Asians?	0
240224	351989	351990	Which is the best hair transplant clinic in Bangalore? How much does it costs?	What is the cheapest and best clinic for a hair transplant in Bangalore?	1
240225	77454	293364	Can a narcissist love someone?	Is a narcissist love real? Or is it an obsession?	1
240226	51617	7800	How can I realistically make money online?	What is a way to make money online?	1
240227	351991	2559	Do aerobics really help when losing weight?	What are the best ways to lose weight?	0
240228	118649	215898	How do i know who visited my Facebook profile?	Is it possible to know who visited my Facebook profile?	1
240229	351992	351993	Does taking NSAIDs after a flu shot reduce the immunological response?	What are the disadvantages of getting flu and cold shots in winter?	0
240230	351994	351995	What are the best fps games for PC for example: Battlefield?	What is the best gaming PC?	0
240231	284418	185768	What are the most beautiful tourist spots in Chhattisgarh?	What are the most beautiful and untouched tourist destinations in Chhattisgarh?	1
240232	137352	151152	Riddle: What has roots that nobody sees and is taller than trees? Up, up, up it goes, and yet never grows.	There are N teams in a cricket match. How many matches have to be played to know the winner and the runner-up?	0
240233	351996	351997	Why is Colorado considered a swing state and how is it important to the elections?	Why is Iowa considered a swing state and how is it important to the elections?	0
240234	329754	57836	Which chip set is better, MediaTek, Intel Atom or Snapdragon?	Which is better, Snapdragon 625 or Snapdragon 650?	0
240235	351998	351999	Who would win in a war between the Impirium of Man (WH40k) and the Galactic Empire?	Who would win in a fight between the Imperium of Mankind and the Galactic Empire?	1
240236	204431	352000	How do I get coins on Live.ly?	How do I get rid of Snapchat discoveries and live stories?	0
240237	208753	352001	How much weight can I lose if I only drink diet Coke and water for 7 days?	How much weight can I lose if I only drink water for a week?	1
240238	352002	352003	I am m.b.b.s now I want to do m.d from astraliya?	As an entrepreneur, what is the biggest mistake you have made and how would you advise others not to make the same mistake?	0
240239	352004	352005	What are the health benefits of almond butter?	What are the health benefits of cheese and butter?	0
240240	335448	352006	What is the best forensic medicine books for medical students?	What is the best forensic medicine book?	1
240241	352007	352008	Which is the best Laravel CMS?	What is the Laravel framework? Is it a CMS for PHP?	0
240242	352009	352010	What are the basic arguments of evolutionists vs. creationists in a nutshell (without any derogatory slander)?	Do evolutionists have faith that people are still evolving?	0
240243	352011	352012	What did you learn from your mistake?	What have you learned from your mistakes?	1
240244	78824	27391	What are some mind wallets for safety that most people don't know about and should have?	What are some mind-blowing wallets gadgets that exist that most people don't know about?	1
240245	121762	352013	In which US states is it legal for citizens to purchase, own, and operate an AK-47 assault rifle? How can I attain one in those states?	How does the INSAS rifle compare with AK-47?	0
240246	215217	352014	When will Amex put a hold on a black card?	Do I have to follow both PIB and PRS sites for UPSC preparation? Can't I follow any one of these sites?	0
240247	352015	192815	What is a linear demand curve?	What is linear demand curve?	1
240248	178293	352016	Are there hidden apps on my phone?	Is possible to open a hidden app on an Android phone without showing it?	0
240249	352017	352018	How should I make make friends with benefits into a relationship?	What is the best way to make friends with benefits?	1
240250	28191	254636	How do we protect our ideas from being copied by others?	How do I protect a business idea from being stolen from VC? How do I protect the idea from being copied?	1
240251	352019	352020	What do you mean by bank reconciliation statement?	How do you reconcile a bank statement?	0
240252	14221	32317	How can one make money online?	How do I make money from home?	1
240253	212170	186808	How big is the average penis?	How big is the average sized penis?	1
240254	352021	352022	What is the most beautiful real love story?	How can the economy of Nepal be explained?	0
240255	352023	352024	How do you run android apps on ios devices ?	How do you install android apps on iOS devices?	0
240256	55508	164230	How can I use a Jio SIM on iPhone 5s?	Do jio sims works in iPhone 5s?	1
240257	352025	352026	I'm a newly graduated physician with no previous experience in programming. Can you recommend any good data analysis courses for beginners?	How are modern special forces not classified as infantry?	0
240258	25781	352027	How do I stop caring about someone?	Why does someone stop caring about themselves?	0
240259	271067	352028	How do you live a good life?	Is the wandering life a good life to live?	0
240260	42789	27512	Why are some people on Quora able to write really long descriptions for their question?	How do some questions on Quora have long details?	1
240261	352029	352030	Interviewing for a product manager?	How is a product manager interview?	1
240262	352031	352032	How would you rotate a matrix?	How do I shuffle two arrays into one array?	0
240263	2921	67855	Would demonetization of 500 and 1000 rupee notes actually help in curbing black money in India?	By scrapping the 500 and 1000 rupee notes, how is RBI planning to fight against black money?	1
240264	352033	352034	Is it possible to develop lactose intolerance as you get older?	Is jyestha nakshatra (1) boy is harmful for girl’s elder brother?	0
240265	190538	352035	What is your favorite character in The Big Bang Theory?	Who is your favorite character on The Big Bang theory?	1
240266	352036	76763	What type of government does Turkey have? How does it compare to the one in Jordan?	What type of government does Turkey have? How does it compare to those in other countries?	0
240267	265934	133746	Why is it important to protect endangered species?	Why do we need to protect endangered species when they have no economic values?	1
240268	352037	352038	How can I lose unwanted fat in just 3 weeks?	How can I lose fat in 2 weeks?	0
240269	352039	352040	How many keywords are there in Gosu programming language in the latest version?	How many keywords are there in the Magik programming language of the latest version?	0
240270	12196	352041	"How do I sync the ""Notes"" app between my iPhone and my Mac laptop?"	How do you sync iPhone notes with Mac?	0
240271	116298	215185	How do I be successful in life?	Kindly tell me what I do for my successful life?	1
240272	122528	352042	How does one prove that A intersecting B = A, iff A is a subset of B?	How do I prove that [math] a^n + b^n [/math] is divisible by [math] a + b [/math] when [math]n[/math] is odd, and is never divisible by [math] a - b [/math]?	0
240273	352043	352044	"Why am I getting ""you don't have enough disk space"" error in Whatsapp?"	How do I solve this error: disk full! Not enough swap space in turbo c++?	0
240274	352045	352046	What do you think of this article?	What do you'll think of this article?	0
240275	42047	58271	How should I control my emotion?	How one can control impulsive emotions?	1
240276	352047	352048	What is the significance of the Laplace transform?	What are the disadvantages of Laplace transform?	0
240277	289004	352049	What is the use of azee 500mg?	Is it safe to take L-Lysine 500mg once daily while pregnant?	0
240278	74956	352050	"What are some sentence examples using ""rambunctious""?"	"What are some sentence examples using ""mischief""?"	0
240279	349879	137719	How can I excel at math?	How can I become good at math?	1
240280	352051	352052	How much is VMware?	What is VMware?	0
240281	48867	169942	How do Native American tribes commemorate death? What ceremonies do the Seminole Tribe practice?	How do Native American tribes commemorate death? What ceremonies do the Lumbee Tribe practice?	0
240282	91473	352053	I normally see him 1-2 X week. Is he ghosting if he started taking hrs to answer texts, didn't ask me out in 5 days, and stopped texting past 2 days?	"My boyfriend will see me for a day or 2 and then not answer his phone for a week or longer. He always says he's been busy. I ask him ""busy doing what? You can't pick up the phone or even make a quick phone call""? Do I need to move on or accept this?"	0
240283	352054	352055	How can I search for friends who went to a particular college on Facebook now that graph search is gone?	How do I install Facebook Graph Search?	0
240284	352056	352057	Who provides DJs for a private function in Sydney?	Which is the most famous Private Function DJ in Sydney?	0
240285	352058	352059	How is home state decided for admissions in NITS?	Should I take job as technical support in DT global telemarketing?	0
240286	352060	352061	How do I know which person I am in love with?	How do I know whether I am in love with a person or not?	0
240287	352062	192186	Why do some people hate the Times of India?	Why do some people hate India?	0
240288	352063	56233	Riddles: In a new hotel containing 100 rooms, Tom was hired to paint the numbers from 1-100 on the doors. How many times will Tom have to paint the number 8?	How many 3 digit even numbers can be formed from 0, 1, 2, 3, 4, 5 and 6 with no repetition?	0
240289	86763	205197	Why did Modi introduce a 2000 rupee note?	Why is the RBI issuing 2000 rupee notes?	1
240290	352064	105375	Why do I need virus protection for Mac?	Do I need an anti-virus for my mac?	1
240291	352065	352066	How many years do you have to stay in Singapore for, before you can apply for your PR status?	Why do so many Malaysian PRs in Singapore stay as PRs for decades and not become citizens?	0
240292	259858	200248	How can I fix and iPod 5 that doesn't turn on?	Why won't my iPod's screen turn on? How do I fix it?	1
240293	352067	352068	How is the poverty line in India?	What is the poverty line in India?	0
240294	352069	177334	I'm unfamiliar with guns. .45, .38 and .22 refer to the caliber of the bullet, but are there higher calibers? How does one refer to higher calibers (as in Larry Correia books)?	What happens when a .50 caliber bullet hits a person?	0
240295	352070	352071	Is there any way/application to hide apps in Android phones?	What is the best hide app for Android phones?	0
240296	352072	352073	What are the best exercises to build best chest?	What is the best exercise to build triceps?	0
240297	18926	3624	How can I see who views my Instagram?	How can I see who viewed my video I just posted on Instagram?	1
240298	352074	352075	Do all doctors have bad handwriting?	Why are doctors' handwriting so bad?	0
240299	14630	352076	Is Politico biased? Republican or Democrat?	Are Democrats or Republicans more phony?	0
240300	352077	352078	Septoplasty at fortis?	If Canada were to nationalize its oil industry, would the United States declare war on Canada?	0
240301	352079	352080	Where can I do paragliding in Chennai?	Is a paraglider at the risk of strikes of lightning?	0
240302	352081	352082	What's the best store to buy caps and hats online?	Which is best online store to buy running gear and clothes?	0
240303	352083	352084	Are scorpions afraid of anything?	What's the most harmless scorpion as a pet?	0
240304	352085	352086	How do I outsource this information gathering?	Is outsourcing a good thing?	0
240305	25695	88874	Is there any chance of World War III?	Is World War III on its way right now?	1
240306	352087	352088	Why tulsi leaves should not be chewed?	Why should tulsi leaves be not chewed?	1
240307	352089	352090	What is the difference between a process oriented person and a goal oriented person?	How can I become a people-oriented person?	0
240308	352091	119997	What is the strongest weapon in undertale?	How do I get true pacifist on undertale?	0
240309	352092	352093	In the airline world, how is 23 kg equal to 50 pounds?	How many airline cabin crews in the world?	0
240310	352094	352095	Why do finance ministers carry a briefcase while presenting a budget?	While presenting the budget in the parliament, What do they bring in those big bags and briefcases?	0
240311	352096	352097	What is a good substitute for soy sauce in a recipe?	What are good substitutes for soy sauce?	1
240312	352098	352099	Who is Vishwas Nangare Patil?	Aren't the police and Ravindra Patil's family members to be blamed more for his sad fate?	0
240313	86201	58646	Balancing of chemical equation?	How do I balance these chemical equations?	0
240314	352100	352101	How is the faculty for mathematics Hons. of Hindu College, University of Delhi?	How are the faculty of Hindu College, University of Delhi?	0
240315	352102	352103	My Nexus 5 front camera is not working. What are some suggestions on how to fix it?	Which is the best app lock for my Nexus 5 operating on Android 5.0.1?	0
240316	352104	352105	What is the average industry metric for subscription box services?	How do subscriptions meals services ship for free? Who is their insulated box supplier?	0
240317	352106	38853	Is it true that space isn't expanding, and that that doesn't make any sense?	Is our universe expanding?	0
240318	22309	352107	What routes are United's 787 Dreamliners flying?	Boeing 787: What are the reasons for the dreamliners problems with it's  batteries?	0
240319	352108	352109	How does the ozone layer filter out the ultraviolet rays?	What is so special about ozone that it can filter out UV rays?	1
240320	352110	352111	What's the best picture of the stars you have taken?	What are the best pictures of stars?	0
240321	190049	20117	Did anyone increased their AWA score after AWA score review?	Does AWA score increases after reviewing it?	1
240322	237678	352112	"Which song is featured in the new movie trailer of ""xXx: Return of Xander Cage""?"	What is your review of xXx: The Return of Xander Cage (2017 movie)?	0
240323	352113	352114	On what kind of research questions (or purpose) can you best use the dependent and independent t-test?	If I use means of means for a paired t-test, how should I control validity of my original means?	0
240324	352115	352116	How do I cancel the Apple ID associated with my phone number?	How do I spy WhatsApp text using Apple id?	0
240325	40900	352117	What is the best way to get rid of face fat?	How does a person get rid of fat on the face? Are there any exercises or ways recommended?	0
240326	352118	352119	Why are English nouns not all capitalized?	What were the disadvantages of the Great Vowel Shift?	0
240327	352120	352121	What would it be like if someone had an IQ of 1000+?	What abilities would one have if he had an IQ of 1,000?	1
240328	352122	352123	What wars in the history of mankind were fought over women?	What were the ten most brutal battles fought in history?	0
240329	352124	312590	Why is India considered the subcontinent of Asia?	Is India considered a subcontinent?	1
240330	352125	352126	Where and how can I apply to be a nude art model in Delhi for painting and sculpture?	Is it ok to take up testing if one is not interested in development?	0
240331	352127	352128	Who won the 2011 UEFA Champions League?	Who do you think will win the UEFA Champions League 2013-14?	0
240332	352129	352130	How to evaluate [math]\int\limits_0^a{\frac{{x}^{\small{\frac{3}{2}}}}{\sqrt{a-x}}}dx[/math]?	How can one evaluate [math]\displaystyle\int \frac{\sqrt{x-2}}{x+1} \, dx[/math]?	0
240333	352131	352132	East Tennessee State Football Live Stream | Watch East Tennessee State Buccaneers Football Game Today Live Streaming Online?	Tennessee State Football Live Stream | Watch Tennessee State Tigers Football Game Today Live Streaming Online?	0
240334	85230	37505	Who will win IPL 2015?	Who is going to win IPL 2015, CSK or MI?	1
240335	352133	352134	How do I handle ecommerce re-authentication when a user signed up through Facebook?	How could Facebook re-engage its younger users?	0
240336	352135	352136	Do we need a constitutional convention?	Does this country need a constitutional convention as in article V?	1
240337	4265	15632	What are your views on India banning 500 and 1000 notes? In what way it will affect Indian economy?	How Indian economy got affected after ban of 500 1000 notes?	1
240338	352137	352138	How does Colorado University Boulder compare with other universities like USC, UCI, UCSB, and UCSD for a master's in computer science (especially machine learning)?	Which is better for an MS in CS, USC or University of Colorado Boulder?	0
240339	31744	10283	Why is Barack Obama not eligible to run in the 2016 Presidential election?	What are the chances that Barack Obama will again become the president of the United States of America in the election of 2016?	0
240340	15806	352139	What is the best torrent meta-search engine?	What's the best torrent search engine that also searches extratorrent?	0
240341	352140	128636	How do I tell a girl that she is my crush?	How do I know if this girl haves a crush on me?	0
240342	9392	352141	What is Type checking?	What is type checking on objects?	0
240343	231994	352142	What are some simple sketching exercises I can do to improve my sketching skills?	What are some basic tips for sketching?	0
240344	252952	136533	How can we walk?	How do we walk?	1
240345	352143	352144	What are the best restaurants near the University of Michigan's campus?	What are the best restaurants near the University of Illinois's campus?	0
240346	91870	301855	Where can I find a database of Australian family offices?	Where can I find a Swiss family office database?	0
240347	352145	352146	How can I backup my Whatsapp chat from windows phone to Android phone?	How do I backup WhatsApp chats and media from a Windows Phone to an Android?	1
240348	198156	48753	Can you find someone's name from his photo?	How can you find out someone's name from a picture?	1
240349	297103	352147	How do I turn off parental control on Netflix?	How do I use parental controls on Directv?	0
240350	352148	352149	What is the the difference between electric, electronic and electrical?	What is difference between electric and electronic?	0
240351	352150	352151	What is scientific significance of RATHA SAPTAMI?	What is the significance of Ratha Saptami? What does it symbolize?	1
240352	352152	352153	Who was or is the most influential philosopher of all time?	Who is the most influential living philosopher?	0
240353	295598	352154	How do I use my personal qualities to become a good teacher?	How does an experienced teacher utilize his personal qualities to make him a good teacher?	1
