id	qid1	qid2	question1	question2	is_duplicate
159174	76559	248531	How do I delete my Snapchat conversations in blue if the other person saved them?	What does it mean when a guy saves your snapchat conversation?	0
159175	248532	248533	How do I become a video game maker?	What steps should I take to become a successful indie game developer?	1
159176	248534	165496	Did the USA really make it to the moon?	Did nasa really go to the moon?	1
159177	41634	55581	What are the preventions to stop hair falls?	What should I do to stop hair fall?	1
159178	50828	248535	How many $1 bills would it take to weigh 1 ton?	I weigh over 250 pounds. I want to weigh 160 pounds lean muscle. I would like a six pack. How many months should I take to lose the weight?	0
159179	248536	248537	What is your favorite David Bowie album?	What is the best David Bowie album? Why?	0
159180	45489	177	Which is the best laptop for gaming under 60k INR?	Which is the best gaming laptop under 60k INR?	1
159181	248538	232745	A Song of Ice and Fire (book series): How likely is it that Jon Snow is dead?	A Song of Ice and Fire (book series): Why was Jon Snow betrayed?	0
159182	248539	248540	Is there a term to describe the over 50s?	How was it like to grow up in the 50s and 60s?	0
159183	142040	73477	What are the best places to visit in Wayanad, Kerala?	What are the best off-the-beaten-path places in Kerala for a tourist?	1
159184	134794	248541	How do France's economic activities compare and contrast to those of Mexico?	How do France's economic activities compare and contrast to those of Germany?	0
159185	114256	248542	What are the best strategies on Chadora (simulator)?	What is best test strategy?	0
159186	44787	26104	What are the best places to meet new people?	Where are the best places to meet new people?	1
159187	248543	248544	What is something you should never abuse?	What is abuse?	0
159188	248545	248546	How do I recover my microsoft email account?	How can I recover my Microsoft email account?	1
159189	248547	248548	For recent college graduates, what's the difference between a good cover letter and a bad cover letter?	Is this a good cover letter?	0
159190	248549	24555	Why does my anus always itch?	How do l see who viewed my videos on Instagram?	0
159191	248550	248551	What does it mean when someone says that they are bad for me?	"What does it mean when someone says, ""good for you""?"	0
159192	248552	248553	Do boys get groped?	Are saree clad women more vulnerable to getting groped in public places?	0
159193	248554	248555	How do I add hair on my bald area in a photo editor?	Can I still have a stylish hair (and beard) if I'm going bald?	0
159194	15632	14490	How Indian economy got affected after ban of 500 1000 notes?	What can be the possible effects of removing 500 and 1000 rupee currency notes?	1
159195	248556	248557	"Why is there a threshold for ""remaining in ketosis""?"	Ketosis: Is fasting after binging an effective mitigation?	0
159196	9418	87387	Which is the best budget laptop under 50,000 INR?	What are the best laptops under 50K in India presently?	1
159197	5663	2675	What is Balaji Viswanathan's opinion on the Indian Prime Minister Modi's new policy about illegalization of 500 and 1000 currency notes?	What do you think of the decision by the Indian Government to demonetize 500 and 1000 rupee notes?	1
159198	248558	248559	How can I prepare bank clerk exams without coaching?	What is the best way to study for bank clerk exam?	0
159199	248560	201497	How do you read aloud text in Chrome for Android using TTS?	How do you know if someones read your text message on Android?	0
159200	248561	248562	When and how did WWI start and end?	How and when did WWI start and end?	1
159201	244534	248563	Why should I learn to play chess?	How can one learn to play chess?	0
159202	248564	248565	Which are the best core multinational companies which recruit graduated mechanical engineers of India from NIT colleges?	Which is the best company in India where a (NIT) mechanical engineer can do an internship?	0
159203	40624	27380	What are the safety precautions on handling shotguns proposed by the NRA in New Jersey?	What are the safety precautions on handling shotguns proposed by the NRA in Idaho?	1
159204	248566	248567	Why do my bottom front teeth ache? How should I treat this?	Why do my bottom teeth ache?	0
159205	248568	248569	What are the rules for success?	What are the rules of success?	1
159206	131312	54015	If I smoked meth Monday afternoon will I be clean for a urine test Thursday morning?	Can I pass a urine drug screen test on Monday, if I smoked a bowl of meth on Friday?	1
159207	118573	248570	"Bodybuilding: Is it possible that Bradley Martyn is natural at 6'3"" 260lb lean looking like this? *see description*"	I work out daily but now I find my body getting bulkier like bodybuilders. I want a lean fit body. How can I achieve it?	0
159208	248571	248572	What are the main differences between Google Chrome and Internet Explorer?	What are some differences between Google Chrome and Internet Explorer?	1
159209	98960	248573	Why is Doug using a syringe to drink whisky in Chapter 28 of House of Cards?	Is House of Cards over?	0
159210	248574	248575	Which business school has the happiest MBA students?	How is life after earning a MBA from a top India business school?	0
159211	248576	248577	Issues of environment on IR?	How can I protect my eyesight since I constantly use my smart phone and computer?	0
159212	19199	74656	How can I lose weight loss?	What are best tips for weight loss?	1
159213	20201	57	What are ways to make money online at home?	What is best way to make money online?	1
159214	248578	248579	Is it possible to become a pilot after completing class 12 in commerce?	What does the school send marks or grade to CBSE?	0
159215	37893	1449	What is the meaning of my life?	What is the exact meaning of life?	1
159216	18187	24454	How can a person control anger?	How can I control my anger? 	1
159217	20582	12346	Which is the best anime to watch?	What are some good anime movies?	1
159218	248580	248581	What is the importance of probability in everyday life?	Why are stars important in our everyday life?	0
159219	128179	248582	Do the Sistemics group in Quantico really exist?	How did Priyanka Chopra land her role in Quantico?	0
159220	248583	248584	EdTech Companies (especially startups) - what are the biggest questions you are grappling with right now regarding your product or service?	Are the most EdTech startups web-based (not mobile)? Why?	0
159221	248585	248586	How do I deal with a person with suicidal thoughts because of a relationship?	What are the best ways to deal with suicidal thoughts?	0
159222	203161	248587	What are the best places to catch rare Pokémon in India?	What are some best places in USA or any other country to catch Pokémons?	0
159223	248588	199728	I cannot delete files on an SD card of my Android phone. Also I am unable to cut-paste files. A pop up message 'no permission to delete' occurs and I can not download anything like WhatsApp images, videos. What can I do?	I deleted a WhatsApp group by mistake. Is there a way to restore it? I use an Android Phone.	0
159224	13719	49800	Why do intelligent young people with bright futures give up everything just to join terrorist groups like ISIS?	Why do people join ISIS?	0
159225	96214	198740	What is the right age to marry?	What, according to you, is the right age to marry?	1
159226	139151	248589	If the superfluid dark matter is what ripples when Galaxy clusters collide why wouldn't it be what waves in a double slit experiment?	When you only use a single electron in the double slit experiment, why does the electron go through the slit at all? Why doesn't it bounce off the wall between the two slits?	0
159227	55969	248590	How can I get admission in the IITs?	How does one get into an IIT?	1
159228	90850	248591	What is the difference between machine learning and data analysis?	Which is the difference between machine learning and data analysis?	1
159229	248592	248593	What is the best description of the Populism?	Was there at any point skirmishes between Allied soldiers and Soviet soldiers, during the campaign in Germany? By mistake or otherwise?	0
159230	248594	248595	What can I do after age 60?	How much sleep do I need after being 60 years old?	0
159231	248596	248597	Can I work in Canada on business visa?	I have a valid Canada business visa (B1), and I am interested in applying for a work permit in Canada. What are the chances of me getting a work permit considering I already have a Canada business visa?	1
159232	16016	10567	What were the major effects of the cambodia earthquake, and how do these effects compare to the Tohoku earthquake in 2011?	What were the major effects of the cambodia earthquake, and how do these effects compare to the Arica earthquake in 1868?	1
159233	248598	248599	Can coding make you smarter?	Freelancing or captcha solving which one best?	0
159234	248600	212458	"A friend's Facebook Account was hacked and the ""hacker"" changed the email address on the account, preventing her from accessing her Facebook account. How can she regain access to her account?"	I have forgotten my Facebook password and the number and email that was used in this Facebook account are also inactive and can't be used for recovery. Is there any other effective option available?	0
159235	248601	248602	Does Purina make good dog food?	Is Purina good for dogs?	1
159236	248603	248604	Is it worth going to a university?	Is it worth going to university? What are universities for?	1
159237	248605	4034	How do I unpop my ears?	How do I unpop a clogged ear?	0
159238	109596	248606	What are some things new employees should know going into their first day at South Jersey?	What are some things new employees should know going into their first day at LinkedIn?	0
159239	248607	248608	What is the best language learning program?	What is the best program for learning a foreign language?	1
159240	248609	248610	How does disc brake works in a bike?	How does the disc brake in a motorcycle work?	1
159241	248611	248612	"Who manufactures the products of ""Amazon Basics""?"	How do I search Amazon product in Facebook?	0
159242	248613	248614	What is jury nullification? Does it work?	Is jury nullification legal?	0
159243	194719	14528	Which are the best torrent sites?	What is the best torrent site for porn?	0
159244	194033	248615	Were the Dark Ages really pretty dark?	What is your review of Dark Ages?	0
159245	248616	248617	If I want to become an astrophysicist and I want to start studying on my own, how do I start?	I want to learn astrophysics. Where should I start?	0
159246	28806	248618	What is the proof that an electromagnetic wave is transverse in nature?	In transverse waves like electromagnetic ones, what's the relationship between the intensity and the amplitude?	0
159247	248619	248620	What is the career path for an Android app developer?	How do I change my career path from being a Civil Engineer to becoming a Web/Android/Software Developer?	0
159248	47102	248621	What is one thing you plan or want to change in your life?	If you were to change one decision in your life, what would it be?	1
159249	221083	94368	How can I get back my instagram deleted dms?	How can I view deleted Instagram text messages?	1
159250	248622	248623	Can you find a moment or time whereas Donald Trump acted racist or said he was a racist?	"Was it racist when Donald Trump said bad ""hombres"" obviously referring to Hispanics?"	0
159251	248624	68077	Is digital image visualization the same as digital image processing?	What is digital image and digital image processing?	0
159252	248625	248626	Is it possible to marry my mother's sisters husband's brothers daughter?	I want to marry my mother's sister's husband's elder brother's daughter. Is it okay?	1
159253	248627	14146	Which team will win IPL 2015?	Who do you think would win the IPL Season 7?	0
159254	248628	248629	Is there an app for Android that let's you remotely access and control other Android devices, like TeamViewer for PC?	Is there an Android app that can be used to set the buttons of an Android set top box remote control to the functions of a second Android app?	0
159255	248630	248631	Why do July and August have 31 days each?	Why does July and August has 31 days?	1
159256	248632	248633	How can I learn Spring and Hibernate in 2 weeks?	What's the best way to come to speed with Spring and Hibernate?	0
159257	248634	36629	What are some things new employees should know going into their first day at Telenav?	What are some things new employees should know going into their first day at Stamps.com?	0
159258	248635	70342	Can one earn some money by posting answers on Quora?	Do we earn something when we write answers for Quora?	1
159259	248636	248637	Why do most people get Alzheimer's disease?	What are the latest and most promising hypotheses of the cause of Alzheimer's?	0
159260	134419	248638	How do I find out if a hot guy is gay?	I'm gay and I love a guy at school. But I don't know if he's gay. How do I find out if he's gay?	1
159261	248639	248640	"Why isn't Kylo Ren calling himself ""Darth Something"" like all the Sith lords before?"	Will Kylo Ren always have the scar on his face?	0
159262	248641	248642	What are the best jokes you have read/heard or just made up?	As a nerd, what are the best jokes you've ever heard/read/made up?	0
159263	248643	248644	How do you use order-by in CodeIgniter?	What should we use instead of CodeIgniter?	0
159264	248645	248646	What's the most popular baby name of 2011?	What are the most popular baby names?	0
159265	248647	248648	When and how were toucans discovered?	What do we mean by alpha wave music?	0
159266	87074	248649	What is the corporate culture like at Square 1 Financial? How is the culture different than other companies?	What is the corporate culture like at MB Financial? How is the culture different than other companies?	0
159267	88197	248650	What are some 19-year-old birthday ideas?	What are some good ideas for a birthday party for a 50-year-old man?	0
159268	248651	76711	Love is my religion! What is likely to happen if more people will follow?	What is the economic system of Malaysia, and how does it compare to the one in Cuba?	0
159269	248652	248653	How can I watch anime on my iPhone?	How do I watch anime on Quora?	0
159270	248654	146284	If a person doesn't have Facebook messenger can he still receive it?	My boyfriend says he deleted his Facebook Messenger app, but he is still available for video calling. Next to his chat name the mobile icon always says 1 min. What does that mean?	0
159271	159396	6638	How can I use Omegle on my iPod Touch and how is it compared to using Slutroulette?	How can I use Omegle on my iPod Touch and how is it compared to using aFreeChat.com?	0
159272	147105	102996	What are the strongest majors in terms of job prospects and what are the weakest majors at Winthrop University?	What are the strongest majors in terms of job prospects and what are the weakest majors at Clark University?	0
159273	248655	248656	Is it ok to beat a child?	In which case is it ok to beat your children?	1
159274	248657	248658	Considering graphene’s strength and thickness is it possible to use it as a blade to cut through hard materials?	At what thickness is a piece of material considered quasi-2D?	0
159275	248659	248660	My older sister always beats me using martial arts. How can I withstand her?	What martial arts does Spider-Man use?	0
159276	245144	59478	How do I know that someone loves me?	How do I know whether someone really loves me?	1
159277	248661	248662	What is the meaning of |x-y|?	What does +x+ mean?	0
159278	248663	248664	What is the exposure of someone selling third party products on Amazon FBA, e.g. in case the product is faulty?	Is 3.8gpa and a great GRE score enough to get you into University of Illinois Urbana Champaign, grad school for Engineering?	0
159279	248665	248666	If energy can neither be created nor destroyed, doesn't that law suggest God created it because He can operate outside the laws of our universe?	Energy can neither be created nor destroyed! Can this be proved wrong?	0
159280	248667	248668	What are some things a visitor to Japan absolutely should not do?	I'm in Japan for 12 weeks as an exchange student. What are some things I absolutely must do before I leave?	0
159281	145476	33664	Why there is no option of freezing the seat after sliding round ipu?	What is the eligibility of sliding round in ipu?	0
159282	248669	248670	How do I get motivated to do my holiday homework for year 12?	Any references or sites to learn about ancient khemetic words (mer, ka, BA, ra, ta, etc)?	0
159283	158877	14303	Is Java a pure object-oriented programming language?	Is Java 100% Object Oriented Programming Language?	1
159284	139129	130076	What are any real life instances where karma played it's role?	"What are some real life examples of “Karma""?"	1
159285	248671	248672	How and where can I find fuck buddies in Delhi?	What is a good substitute for liquid starch?	0
159286	248673	248674	What is Karl Marx's economy or Marxism in a simple way?	What exactly is Karl Marx's philosophy?	1
159287	115954	248675	Is there a cure for cancer and the government and companies are hiding it from the public?	Is cancer too profitable to ever be cured?	0
159288	1595	67387	What are the safety precautions on handling shotguns proposed by the NRA in Alaska?	What are the safety precautions on handling firearms proposed by the NRA in the entire U.S. including it’s territories and possessions?	1
159289	248676	248677	What are the characteristics of a good person?	What are some characteristics of a good personality?	0
159290	248678	248679	How should I reward my girlfriend for being loyal?	How can I be loyal to my girlfriend?	0
159291	248680	248681	What are the beliefs within Christianity and Islam?	What are the beliefs of Christianity?	0
159292	248682	33332	How can I stop the Fox News website from doing an auto refresh in Firefox?	How can you train a dog to not bark at other dogs?	0
159293	136004	248683	Who did Negan kill in The Walking Dead?	The Walking Dead: Who was Negan before the apocalypse?	0
159294	248684	248685	What are some of the best IAS coaching institutes in Patna?	Which is the best IAS coaching in Patna?	1
159295	248686	248687	Can I apply to MIT after completing my B.Sc in Computer Science and engineering? If I can, what is the Qualification and requirements need?	How many high to medium voltage (1-36kV) substations are there in Europe? Or at least in the UK, Germany, France, Spain?	0
159296	248688	248689	Can I have all three Ubuntu, kubuntu and xubuntu at once when I have dual booted Ubuntu 16.04 alongside windows 10?	How do I dual boot Ubuntu 16.04 alongside windows 10?	0
159297	248690	248691	I badly need an elder sister in my life who actually treats me like her real brother. What should I do?	How can I get the AP Physics 2015 multiple choices questions?	0
159298	248692	248693	Can anyone help me with the poem recited by Amitabh Bachchan sir at the end of the movie Pink?	Which poem is recited in the end credits of hindi movie Pink?	1
159299	248694	221831	What is the basic difference between cookies and biscuits?	What is the difference between corn flour and cornstarch? Which is best for baking?	0
159300	248695	248696	When did USA and Japan become allies, given that the Japanese bombed Pearl Harbour and the USA nuked Japan?	How long after USA nuked Hiroshima and Nagasaki did Japan and USA become allies?	1
159301	248697	248698	How long does it take for Disney to respond to their emails?	How long should I take to respond to an email?	0
159302	248699	248700	When will my questions be answered?	When will I get my question answered?	1
159303	248701	248702	How does a pressure gauge work?	How does a pressure gauge works?	1
159304	10048	248703	My boyfriend dumped me because I am not like other girls who wear makeup and fashionable clothes. What should I do?	Where do fashionable girls (ages 12-20) buy their clothes?	0
159305	248704	248705	How can I iron burlap tablecloths?	What are burlap tablecloths made of?	0
159306	232907	117448	How can I get more views and upvotes on Quora?	What's the best way to get numerous views and upvotes on Quora?	1
159307	248706	248707	Why do I have brown discharge a couple of days before and after my period?	Why am I having a brown discharge 2 days after my last period?	1
159308	248708	248709	How many programmers are writing OBJECT ORIENTED PHP Code statistically? Are people building things from scratch anymore, seeing a rise in frameworks?	Are there statistics on how many people return to at least a basic standard living from being homeless?	0
159309	248710	248711	What is joint venture accounts?	What is a joint venture?	1
159310	248712	8524	When does an answer become a question?	What is the question that doesn't have an answer?	0
159311	248713	248714	When you listen to podcasts when and where do you listen to them?	Do you listen to podcasts?	0
159312	189676	248715	What are great books to read?	Which is the best inspirational book to read?	0
159313	248716	213778	Who are the most irritating actors and actresses in Bollywood?	Who is the most irritating bollywood star?	1
159314	248717	248718	Can I sue my mobile company if my mobile's battery explodes during charging?	How can I use my bike's battery to make a mobile charging point?	0
159315	239142	248719	What are the reasons why Somalia is a poor country?	Which country is best for a poor person?	0
159316	248720	248721	What are some side dishes to serve with prime rib?	What are some side dishes to serve with prime rib roast?	1
159317	248722	248723	In Cursed Child, how can Snape be alive in the timeline where Cedric killed Neville, even though originally Neville killed Nagini after Snape’s death?	How is Wade Wilson a.k.a. Deadpool alive even after getting beheaded in X-Men Origins: Wolverine?	0
159318	248724	16981	How can I learn to play soccer in 2 months?	How do I learn to play soccer?	0
159319	148448	116229	What are the top travel hacks?	What is the best travel hacks? Please comment.	1
159320	38520	30765	How can I have a successful long distance relationship?	Do long distance relationships ever work out?	1
159321	248725	227001	"What is ""Smart people"" according to you?"	What is smart people?	0
159322	248726	247025	Which British personalities of colonial era had a positive impact on India?	Who are some of the notable British people who have contributed greatly to the development of India and the Indian Society?	0
159323	248727	248728	How can you tell when you wrote a question on Quora?	Is there any way to tell if you wrote a question on Quora if you don't remember if you wrote it?	1
159324	248729	248730	Is hemoglobin considered a red blood cell?	What does the hemoglobin in red blood cells do?	0
159325	248731	248732	Essential Oils: What natural scents will repel rodents?	As we know, good scents and fragrances are oils in nature and soap and detergents are made to remove the oils. How are they selfmade from oils? How does soap, detergent, and toothpaste get mixed with them without being denatured and how do they remain scented after washing?	0
159326	201731	248733	Louisiana–Monroe Football Live Stream | Watch Louisiana–Monroe Warhawks Football Game Today Live Streaming Online?	Central Connecticut Football Live Stream | Watch Central Connecticut Blue Football Game Today Live Streaming Online?	0
159327	6799	7800	What are ways I can make money online?	What is a way to make money online?	1
159328	58035	178	What is the best gaming laptop I can buy under 60000 in India?	Which is the best gaming laptop under Rs 60000?	1
159329	248734	248735	Is Oyo rooms safe for unmarried couples in kolkata?	Is Oyo Rooms safe for unmarried couple in Bhubaneshwar?	0
159330	248736	248737	How can I increase my running speed?	How do I maximize my running speed?	1
159331	248738	248739	Should I pursue an MBA in the IIMs after doing an MS in economics in IIT KGP?	Is IIM Indore better than IIT KGP, or Kanpur for an MBA in CSE?	0
159332	248740	248741	I heard there was a legal dispute between CFA US and CFA India and CFA India is guided to stop awarding CFA degrees for the new candidates. Is it true?	What are the some of best personal portfolio sites Designed using WordPress?	0
159333	248742	248743	What are the biggest ironies in India?	Same Indian people didn't know India's Nobel Peace Prize winner Kailash Satyarthi (including me). But they complain about Maria Sharapova for not knowing Sachin, is this the biggest irony of India?	0
159334	248744	248745	My boyfriend doesn't care about me?	What should I do when my boyfriend doesn't care about me?	0
159335	36267	26248	Do you think humans can be immortal?	Will we ever become immortal?	1
159336	40833	51661	How do people still think the Earth is flat even though it's proven wrong?	Why do some smart and wise people think Earth is flat?	1
159337	248746	248747	What is the best to do in C++?	What is the best to-do manager?	0
159338	119649	248748	What is a guy's biggest turn on?	What's a guy's biggest turn off?	0
159339	248749	133055	Is there are some apps that work like that features in Interviewbit of maintaining your streak daily that can help us in our day to day life?	What’s the diameter of the biggest known black hole?	0
159340	35033	10012	How can I grow taller fast?	What are the ways to grow tall?	1
159341	248750	248751	Sensitivity to heat and cold on tooth with root canal & permanent crown 5 months after procedure. What's the problem?	I'm having pain on a tooth months after root canal (and crown) was done. Is this normal?	0
159342	248752	70064	Should I eat before I workout?	What should I eat before and after a workout?	0
159343	248753	248754	What is cellular respiration? What are some examples?	How does cellular respiration occur?	0
159344	248755	248756	Is web clipping a fair use?	Are cloud-based apps such as Evernote, Installer, and Pocket liable if a user stores copyrighted material in it for personal use?	0
