id	qid1	qid2	question1	question2	is_duplicate
305177	65661	158399	What does Hillary Clinton plan to do with illegal immigrants?	Hillary Clinton: What will you do, if anything, about illegal immigration?	1
305178	118085	428530	Is Mamta Banerjee a Muslim?	What has Narendra Modi done for Indian Muslims?	0
305179	412895	428531	What Rolling Stone song has the lyrics “oh and you know me so well and your time ain’t so hard to sell”?	What should you do when the person (ex-girlfriend) you tried so hard to get over, tries hard to come back to your life and messes everything up?	0
305180	428532	4769	What did the Spanish Army look like in the 1500's and 1600's?	Why was Dragon Skin armor rejected by the U.S. Army?	0
305181	428533	428534	I take lexapro at night time before going to sleep, will it work or do I need to take it in the morning?	Should I take lexapro in the morning or before bed?	1
305182	428535	151496	What are the top 2 Some important android phone app?	What are the top 2 important Android phone apps?	1
305183	29152	60274	How would changing the 500 and 1000 currency notes help indian government in dealing with corruption?	Would banning notes of denominations 500 and 1000 help to curb the black money in system?	1
305184	7861	63753	Why doesn’t anybody answer my questions on Quora?	Why will no one answer my question on Quora?	1
305185	428536	428537	How do I get the latest IELTS study material?	Web Design: What should I put below this black navigation bar?	0
305186	66411	214385	What jobs can I do with a math major?	What are some good math jobs?	1
305187	353307	267428	Which is the most underrated Hollywood movies in the recent times?	What are the most underrated Hollywood movies and why do you think they're worth watching?	1
305188	86996	428538	Which is the best way to earn money without working hard give examples?	Is there any alternative way of living other than working hard and earning money?	1
305189	428539	428540	A boy saying he likes me, he whenever see me he feel to kiss me. He doesn't want get committed, because of his breakup with his ex.Should I trust him?	For getting mbbs in kalinga institute how much marks required in neet?	0
305190	428541	428542	What is a 5-3-1 commission structure?	What is the commission structure for AT&T?	0
305191	74852	428543	What is the best way to reduce thigh size?	How do I reduce my thigh size (man)?	1
305192	428544	428545	How do I identify a song with quality?	Which Is The best Reviewed Restaurant In Charlotte Nc?	0
305193	27126	428546	Which European countries offer (tuition) free education in English to international students?	What European countries  charge no tuition to international students?	1
305194	213896	163477	Do pets ever commit suicide?	What animals commit suicide?	1
305195	4833	44601	Is Donald Trump really a racist?	Why do people think Trump is racist?	1
305196	428547	428548	What's the best floor to live in a high-rise apartment building?	Where can I get best painting services at high rise buildings in Paddington?	0
305197	14778	6580	What's the importance of GST bill in India?	How do GST bill will benefit local people?	1
305198	82503	112020	What is 0 dimension?	What are the N-dimensions?	0
305199	105062	428549	Who is PETA & why are they so keen in stopping jallikattu?	What is a way to join PETA?	0
305200	60558	428550	What's a reasonable hourly labor rate for an auto mechanic?	Auto Repair: Any one can tell me Mobile Mechanics are trustworthy or not?	0
305201	5903	47297	What are the safety precautions on handling shotguns proposed by the NRA in South Carolina?	What are the safety precautions on handling shotguns proposed by the NRA in Kentucky?	1
305202	428551	428552	How can we decriminalize cannabis in India?	Should cannabis be decriminalized?	0
305203	428553	186601	Who paid salary to the prime minister of India?	Is PM Modi selling India to foreign hands?	0
305204	28965	143576	Who will win Super Bowl 51?	Who is going to win the Super Bowl 2017?	1
305205	428554	428555	I keep finding my boyfriend talking to 18- to 35-year-olds on dating sites. What should I do?	Is it socially acceptable in NYC to date an 18 year old if you are in your late 20s?	0
305206	428556	428557	Why do many Americans seem to blame/hate Muslims in the US?	How many American Muslims are there?	0
305207	428558	428559	Can I do photography for a job?	Where can I find photography jobs?	0
305208	390796	222392	What is the reaction between copper nitrate and sodium hydroxide?	What is the reaction between sodium phosphate and sodium hydroxide?	0
305209	428560	206775	Why are Hollywood movies much better than Bollywood movies? Explain in just one line.	Why are Hollywood movies far much better than Bollywood movies? Explain in just one line.	1
305210	428561	275988	What are some examples of a database?	What are some examples of a databases?	1
305211	428562	428563	How does applying pressure on a bleeding wound stop bleeding?	Wounds: What is it like to nearly bleed to death?	0
305212	61380	122025	What does Gary Johnson have to do to have a chance of winning in November?	Why doesn't the Libertarian candidate Gary Johnson have a shot at winning the 2016 presidency?	1
305213	428564	428565	How come each firework colorant provides a different color?	Why does lipstick come in different colors?	0
305214	80821	355680	Who is better from India's perspective, Donald Trump or Hillary Clinton and why?	Who would be better from indian perspective, Trump or Hillary?	1
305215	428566	428567	For those of you who know what pixelblock is and use it does it actually work? Is there something with the same purpose which is better (Read more)..	What are the differences between a pompadour, fade and undercut haircuts?	0
305216	163070	69402	What is a good solar panel installation provider near Hollister, California CA?	Which is a good solar panel installation provider near Kenwood, California?	0
305217	428568	428569	How can I find out about all my Gmail accounts?	How can I find out how many Gmail accounts I have?	1
305218	428570	428571	Prior to the attack on Pearl Harbor, what actions could the US have taken that would have dissuaded Japan from going to war against the US?	Could the attack on Pearl Harbor have been prevented? What actions could the US have taken ahead of time to deter/dissuade Japan from attacking?	1
305219	152636	219915	What are the best web design companies in London?	Which is the best web designing Agency in London?	1
305220	195025	48610	Why is my Australian Cattle Dog/Pointer mix puppy afraid of cats?	Why is my American Staffy/Kelpie mix afraid of cats?	1
305221	321857	160934	What does the Polish proverb 'not my circus, not my monkeys' mean?	Why should I learn Polish?	0
305222	428572	428573	Interview question emc for Java, JavaScript and selenium?	Comment on the motion tween uses the power off the system to calculate smoothest transition for moving and or rotating an object?	0
305223	428574	428575	Is Indian politics a family business?	Is politics in India a family business?	1
305224	10308	79354	What are the best books for the JEE (Mains)?	What are the best books for JEE Mains practice?	1
305225	26184	19789	Why do most Quorans ask questions here instead of googling answers?	Why do people ask basic questions instead of searching them?	1
305226	428576	428577	What types of things can a man do improve fertility?	What things can an ugly woman do to attract and keep a very attractive man?	0
305227	205088	428578	How would the size of parachute required on a space probe to allow it to land safely different on thick atmosphere and thin atmosphere?	What is the lowest possible altitude that you could deploy a parachute and still land safely?	0
305228	428579	428580	What is sachins birthday?	Are consultancy jobs suited for law graduates with corporate law experience?	0
305229	68501	70920	What are the PPF benefits?	How does PPF works?	1
305230	428581	428582	What are some of the Jain surnames?	Do all Jains have the surname Jain?	0
305231	428583	428584	What is a good book for learning Hindi through Tamil or English?	Which is the best book to learn English through Hindi?	0
305232	428585	116839	How do I get over depression and focus on one's passion?	Does one get over depression?	0
305233	428586	428587	Give me information about pay in LDC SSC?	"What are some sentence examples using ""penance""?"	0
305234	428588	428589	What are the problems faced by an Indian entrepreneur?	What are the problems faced by Indian entrepreneurs while exporting?	0
305235	21115	12791	Which are some of the best horror movies of all time?	Give names of some of the best horror movies?	1
305236	428590	428591	How do I find forces in the sections CD,CJ and KJ,using method of sections?	What is so bad about a Muslim registry?	0
305237	297368	292878	How useful is MBA?	How much useful is MBA?	1
305238	428592	428593	Do Indians condemn Lashkar-e-Jhangvi, for being the sole reason responsible for Quetta Attack?	Should India have condemned the Quetta attack?	0
305239	428594	428595	Did British rule hinder or help the Indian economy?	What was the impact of British occupation in Indian economy?	1
305240	25984	26639	How do I improve my English language?	How can I improve my fluency in English to face a more confortable job interview?	1
305241	428596	428597	What classes should I take in high school if I want to be a biomedical engineer?	What classes in high school should I take if I want to be an electrical engineer?	0
305242	428598	428599	Is it possible for one to change schools (CBSE) from 11th to 12th? If yes, then what is the procedure to do so?	I failed 11th from the CBSE. Can I do 12th without repeating a year?	0
305243	428600	71961	Do eating out on dates increase your weight?	How do I gain 5 kgs in one month?	0
305244	77024	83803	How can we know that the Illuminati is real?	Is Illuminati thing real?	1
305245	421623	201956	How did you start with machine learning?	How do I start machine learning?	0
305246	183275	354721	Are doctors important?	Why are doctors important?	1
305247	428601	428602	What should I do after SCRA?	What we will become after SCRa?	0
305248	156244	342346	I am currently pursuing my first year in master's of dental surgery (MDS). I took it up by choice. But right now I am not interested in it and would like to prepare for IAS. What would be the wisest thing to do?	I am studying B.E.(1st year).I want to become an IAS officer. So should I start my preparation right now?	0
305249	428603	267112	What's the worst game you ever played?	What is the best game you have ever played?	0
305250	428604	428605	What are some myths people believe about science that are taught by sci-fi movies but aren't true?	What are some things films have led us to believe, that are actually not true?	0
305251	428606	428607	What are some closing paragraph transitions?	I'm a fresher for using Dev C++. How can I access the MS Access file to the Dev C++?	0
305252	428608	206883	What happens if nail polish gets in your eyes?	What should you do if you get nail polish in your eye?	0
305253	244308	428609	Should I join the French Foreign Legion?	Did you regret joining The French Foreign Legion?	0
305254	428610	428611	What is the best high school/college farewell speech ever given?	What's the best Class Day speech ever given at Harvard?	0
305255	214345	428612	"Are there any music similar to ""Rain of brass petals"" (version without vocals, composed by Akira Yamaoka)?"	Is there a Japanese composer of western style classical music? Any links to listen online?	0
305256	4997	428613	Is potential energy theoretical?	How is potential energy measured?	0
305257	2870	428614	In terms of reputation, can McGill University compare with the Ivy league?	How did Brittany Stinson get accepted into five Ivy League colleges?	0
305258	428615	428616	How is the placement of Unitedworld Institute of Design (product design)?	How good is Unitedworld Institute of Design in Ahmedabad? Looking for genuine answer Pl.	0
305259	428617	428618	What is a good thread count for sheets?	Why is it that the higher the thread count the softer the sheets?	0
305260	125773	428619	Who is the best football player now, Cristiano Ronaldo or Lionel Messi?	Who is the best soccer player: Messi or Ronaldo? Why?	0
305261	428620	428621	Why is six less than seven?	I'm born on 29/01/2000, am I eligible to write NEET exam for 2017?	0
305262	428622	428623	How I get admission in Indian Institute of Engineering Science and Technology, Shibpur?	My general rank is 40000 may I get admission to Indian Institute of Engineering Science and Technology, Shibpur?	0
305263	428624	428625	Why is my girlfriend not jealous of me but of normal friends she has for a long time (without any sexual relation)?	Who is your Harry Potter NOtp (Canon or not) and why?	0
305264	346781	254116	Which book is the best for the SSC JE exam?	Which book should be the best for JE AE exam preparation for electrical engineering students?	0
305265	428626	428627	How difficult is rocket science?	How difficult is rocket science? Almost all difficulties are related to rocket science, so how difficult is it, really.	1
305266	428628	428629	How can I replace a low voltage power connector by soldered wiring?	What we call husbands father in law house in English?	0
305267	428630	428631	"How do you fix the error ""Netflix is currently unavailable"" on Apple TV?"	How do I fix Netflix connection issues on Apple TV?	0
305268	428632	428633	Are there any restaurants that offer andhra ugaadhi pickle in chennai?	Which is the best non-veg food restaurant in Chennai?	0
305269	428634	428635	Is Tom And Jerry too violent for kids?	"Did the cartoon “Tom and Jerry” have anything to do with WWI's ""Tommies"" and ""Jerries""?"	0
305270	428636	63377	How many cups of black coffee is safe?	How many cups of coffee a day can a person drink?	0
305271	428637	428638	What is Insurance Credit Wrap? What will be the expense for Insurance Credit Wrap for $1.5 million Investment in India? How to get the same in India?	Where do I get my laptop/mobile insured in India?	0
305272	428639	428640	What do I talk with a girl?	How can I talk with a girl?	1
305273	56745	271371	How can I get out of Quora?	How do you get out of Quora?	1
305274	250623	428641	How do I find the cheapest flight to anywhere outside of the USA?	How do I find the cheapest flights to Europe from the USA?	0
305275	16997	428642	Which one is the correct sentence, listening music or listening to music?	Listening to music also is my favorite or listening to music also my favorite? Which is right?	0
305276	428643	428644	Which kind of tea should we drink if we want to mix it with milk?	I don't like milk but I like drinking tea a lot which has milk. What is a good variety of milk that I can use in tea?	0
305277	428645	428646	I want to write comments on a national party in a developing country showing some proofs on corruption in some blogs. how can I make sure that the IP is not tracked back to me?	If I am in India and my IP address shows that I'm in US. Does that mean someone in US is tracking me?	0
305278	47009	207830	Is there any difference between cupcake and muffin?	What is the difference between a muffin and a cupcake?	1
305279	428647	108878	I want to immigrate to canada. I have done bachelor of technology in IT and also I have 1 year of job experience, what should I do?	What salary can I expect if I have experience of 5 years at cognizant and want to switch job?	0
305280	428648	73820	Do the Westerners get bored by Indians' obsession with India?	Why is it so important for Indians to know what other people think about them?	0
305281	428649	428650	Do you read long Quora answers?	Do you read long answers on Quora?	1
305282	101312	208801	What are the new torrent download sites?	What are torrent download sites?	1
305283	428651	428652	How do I solve [math]3x^2+x+3=0[/math]?	How do you solve [math]-3X^3+4X^2+X+6=0[/math]?	0
305284	428653	428654	What is meant by biasing a diode?	What is the purposes biasing of diodes?	1
305285	428655	428656	Is it necessary to get a degree to apply for a software development jobs?	Is it necessary to get a degree to land a software developer job?	1
305286	428657	428658	What is indirection?	What is indirect imaging?	0
305287	428659	88719	I lost my mobile. I should deactivate the WhatsApp account before someone uses it. How can I do that?	How can I use two WhatsApp accounts with the same number on different devices?	0
305288	122358	225023	How do I become a voice actress?	How do you start as a voice actor?	1
305289	186441	428660	Why do some people only wear black? What does it mean?	What tend to be the social implications of wearing only black, for a man?	0
305290	215545	18821	How can you tell if someone is lying on the phone?	How do we know whether someone is lying to you?	1
305291	428661	428662	Facebook has tag option, Facebook has control over whtsapp, then why no tag feature in whtsapp?	What are the interview questions asked for BIW fixture design?	0
305292	428663	428664	What is the best way to promote your art?	How can I better promote my own art?	1
305293	428665	428666	Why did M.R.Radha shoot MGR?	What does it feel like to shoot someone in the line of duty?	0
305294	428667	428668	What does it mean when your eyes sparkle?	"What does the term ""wall eyed"" mean in dogs?"	0
305295	29173	428669	How should you introduce yourself in an interview?	How do you introduce yourself in bank interviews?	0
305296	251048	131437	If Quora was a country, how it was as compared to present countries?	If Quora were a country, what would it look like?	1
305297	428670	428671	Why is Turn Based battle System So much popular, I find it boring and a let off feature, despite the RPGs having good story?	Is there any famous battle or war where someone was considered the victor but in reality, the opposite was true?	0
305298	428672	428673	How does child adoption work in Iran?	What is it like to adopt a child in India?	0
305299	428674	428675	How do I realistic on online auction sites?	How do I get started with online auction sites?	0
305300	428676	428677	What is the ideal e-commerce platform for a fashion indie shop?	Which E-commerce platform set up a multi-vendor marketplace?	0
305301	428678	428679	Why do laptops overheat on beds?	Why does my Toshiba laptop overheat? How can this be prevented and fixed?	0
305302	133222	404748	What is the fastest way to make $1 million dollars in a week?	What is the fastest way to make 1 million dollars?	0
305303	428680	428681	Why did Russia abandoned Alaska?	Why did Russia sell Alaska to the USA?	0
305304	428682	428683	Do females ejaculate?	Do women really ejaculate?	1
305305	55365	90429	How is business analyst job in an IT company?	What is the role of a business analyst in the CS/IT industry?	1
305306	428684	428685	What are some good Guinness World Records for kids to try and break?	Who is the only Bangladeshi athlete to hold a Guinness Book World Record? Who knows about it?	0
305307	428686	428687	Is Bernie Sanders a radical?	"Is Bernie Sanders really a socialist? Why does the media refer to him as a socialist? What does Sanders mean when he says he's a ""democratic socialist""?"	0
305308	300825	311939	What are some examples of scanners being input devices?	What are some examples of output and input devices?	0
305309	428688	428689	What are the causes and effects of early marriage to the couple?	What's causing the rise of marriages that end in divorce?	0
305310	132249	205272	How was speed of light calculated?	How is speed of light calculated?	1
305311	428690	428691	Jobs and Careers: What were the best things you learned on your first job?	How much Microsoft Excel did you learn in college? Were you prepared for your first job?	0
305312	428692	164155	Who do you think should become the next Prime Minister of India after Narendra Modi?	After Narendra Modi, who is the most capable person to become prime minister of India?	1
305313	428693	7682	"What is it meant by ""bus jacking"" in Kerala?"	What are the best places to visit in Kerala?	0
305314	10566	94552	What were the major effects of the cambodia earthquake, and how do these effects compare to the Andreanof Islands earthquake in 1957?	What were the major effects of the cambodia earthquake, and how do these effects compare to the Concepcion earthquake in 1751?	1
305315	10015	59914	How do I learn acoustic guitar at home?	How can I learn to play guitar without joining any class?	1
305316	428694	428695	What if you hear the voice of goddess Durga in your dreams?	What if you hear goddess durga's voice in your dreams?	1
305317	100377	428696	How do I integrate Bulk SMS API for website?	How do I integrate Bulk SMS API in Magento platform?	0
305318	428697	428698	Is Xiaomi Redmi Note 3 up gradable to Marshmallow?	Can I update Xiaomi Redmi note 3 to marshmallow / MIUI 8?	0
305319	428699	428700	So, I get my college refund check soon but and my dad would be the one to get it, I don't want him spending any of my money as I think he might?	How do I find a great business to buy?	0
305320	428701	67093	How would you describe Americans and American culture?	What defines the American culture?	1
305321	428702	428703	Is grammar important while you speak English?	Is Grammar important in spoken English?	1
305322	517	428704	Did Swami Vivekananda ever eat non-veg or egg during his journey around the world?	Can people eat non-veg after taking amrit?	0
305323	354480	428705	I want to do image processing on Raspberry Pi. Is it feasible to do it with Scilab or is OpenCV preferable?	How do I process several images parallel using OpenCV?	0
305324	428706	428707	"Who coined the slogan, "" Doodh Maangoge to Kheer Denge lekin Kashmir Maangoge to Cheer Denge '' ?"	What is Vans' slogan?	0
305325	428708	428709	How do I write a farewell email to my office colleagues	How do I write a farewell email to my office colleagues?	1
305326	84896	428710	How can Americans be saved from being deceived by the U.S.' freedom of speech to lie in media and the world?	How do Clinton/Kaine feel about to U.S. being considered the largest threat to world peace by most of the world?	0
305327	428711	428712	I am a Java developer having 7 years of IT experience. Which courses should I do to boost my career?	I am a Java developer having 5 years of IT experience. Which courses should I do to boost my career?	0
305328	428713	81311	Is there any credible evidence for the argument that what is called 'the Holocaust' did not happen?	What is the best evidence that proves beyond reasonable doubt that the Holocaust occurred?	0
305329	268539	428714	"What does ""I love you unconditionally"" mean?"	How can someone love you unconditionally but not be in love with you?	0
305330	428715	428716	What do the letters of L.G.B.T.Q.I. stand for?	What does LGBTQI stand for?	1
305331	428717	314727	How can I delete inbuilt applications in the Nokia Asha 206 mobile?	How can I hard reset a Nokia 206 if the security code is forgotten?	0
305332	428718	428719	What were the most factually incorrect statements made by Donald Trump during the 1st pres. debate?	What were the most factually incorrect statements made by Clinton during the 1st pres. debate?	0
305333	428720	428721	"What does ""Error 503 Backend fetch failed,"" mean and why would it appear?"	What is 503 error?	0
305334	428722	428723	I'd like to start a smartphone company. Where do I start and how much would it cost me?	How much does it cost to start a digital bank?	0
305335	428724	428725	How (if at all) does exclusivity benefit dating relationships? What are the pros and cons?	What is the difference between exclusive dating & a relationship?	0
305336	428726	423917	How should I start earning at 16?	How can I start earning at 17?	0
305337	428727	428728	What advice does Jon Skeet will give to a novice programmer to become a champ like him?	What advice can you give to a novice computer programmer?	1
305338	246723	428729	What do I do if a girl ignores me when she knows I like her?	What should I do when a girl ignored me and she knows I like her?	1
305339	428730	428731	Why are Americans afraid of Muslims?	Why are Muslims so afraid of ideas?	0
305340	234733	428732	How to make INR 10 lakhs in a year?	How do I get 10 Lakh INR cash in 60 Days seriously?	0
305341	79823	205059	What are the funniest memes from 2016?	What was the funniest meme of 2016?	1
305342	428733	428734	What is the difference among CPU, GPU, APU, FPGA, DSP, and Intel MIC?	What is the difference between FPGA and DSP boards?	0
305343	428735	237463	Do achievers think about the failures, or consequences of failures while they plan?	What would you suggest for a student to learn in his vacation that will be cool as well as helpful for him in his life ahead?	0
305344	228784	428736	When will India host Olympics?	Why doesn't India host Olympics?	0
305345	428737	428738	Is Emile Durkheim's theory relevant in contemporary times?	Are Durkheim's theories still relevant today?	1
305346	428739	428740	What are some good German universities for data and knowledge engineering and software engineering for a master's program in English?	How good is MS in finance?	0
305347	428741	428742	Have people actually made a lot of money through PTC websites like NeoBux and ClixSense?	How much money have people made from FanDuel?	0
305348	38466	192377	What ways will you suggest to curb air pollution in delhi? How will they be implemented also?	How can we help to reduce pollution in Delhi?	1
305349	428743	428744	Why is education compulsory?	What is the compulsory public education system?	1
305350	348220	339307	What are some useful apps (or web sites) that I can use to practise my English?	What apps can I use for English lessons?	1
305351	428745	428746	I forget my laptop password. How can I unlock my Windows 7 laptop without any CD or floppy disk?	I forgot my Windows 7 password, and the CD drive is not working either. Can I change it without cd or pendrive?	0
305352	428747	428748	What are some tips to increase GRE verbal score?	What should to improve my GRE verbal score?	1
