id	qid1	qid2	question1	question2	is_duplicate
353177	482184	482185	What would happen in a collision of two equal-mass black holes, travelling in opposite directions at 99.99% of the speed of light?	What would happen if you smash two of the most massive Black Holes known in the Observable Universe together, at 99.9999999999999% the speed of light?	1
353178	482186	482187	What a best job for graduate guy?	Where does god stay?	0
353179	482188	119193	How do I get over my fear of driving on highway?	How do I get over my fear of driving?	0
353180	482189	482190	What are some of awesome facts about Indian constitution?	What are some interesting facts about Indian Constitution?	1
353181	49919	80031	What is the best thing that has ever happened to you?	What's the best thing that ever happened to you?	1
353182	425303	482191	What is the best option after a workout: a cold water shower or a hot water shower?	Should I shower with warm water or cold water after workout at the gym?	1
353183	482192	482193	How will you define character of a person?	How is character of a person defined?	0
353184	482194	274525	What is the best way to create an interest in programming?	How can I develop an interest in coding?	0
353185	482195	322390	How do I get rid of the greasy feeling after fatty or oily food?	What is the best way to get rid of food waste?	0
353186	482196	482197	Is there any study regarding the long term effects of linkbacks mechanism like pingback or webmention?	Processes that follow after letter of offer?	0
353187	311137	48597	Can I send text messages to someone who blocked my number?	How do you get a text to someone who has blocked your number?	0
353188	482198	482199	What is the salary of the people working on the ISS?	How many people are aboard the ISS at a given time?	0
353189	482200	482201	What's the starting salary for a person with an ACCA degree in UAE?	Which is most worth it: doing an MBA after getting a CA degree or the ACCA?	0
353190	482202	482203	What should I do if I have a crush on my school teacher?	What is it like to have a crush on your school teacher?	0
353191	482204	482205	How can I introduce myself into route map algorithms on time-dependent network like “real-life” road networks?	Why do people hate algorithms on social networks?	0
353192	26845	255641	What is exactly wrong in Samsung Galaxy Note 7 battery causing it to explode?	Why does the Galaxy note 7 explode?	1
353193	482206	227436	Do you like your husband to spank you?	What is the best way to spank my husband?	0
353194	482207	482208	Why should one be married? Is that really necessary?	Is getting married really necessary?	1
353195	482209	482210	Am I considered an adult at 16?	I am 16 years old (guy) and am 6 ft 2 inches tall. In which country am I considered short? Am I considered tall in USA and UK?	0
353196	482211	482212	What is the difference between individualism and humanism?	What is the difference between a person and a human?	0
353197	50700	71931	Is Spotify not available in India?	Spotify: When will Spotify be available in India? What are the reasons for this unavailability?	1
353198	482213	482214	What are some simple Mediterranean snacks and dishes that are easy for a college student to make?	How do you brew tea using the skin of a kiwi?	0
353199	482215	482216	My mechanic friend had permission to work on a vehicle but the owner filed on him for unauthorized use of a motor vehicle. What should he do?	What paperwork do I need to do if I am buying a used motor vehicle from a friend?	0
353200	482217	482218	In alkane stereochemistry, what is a gauche conformation? What is the application of the study of these conformers?	In stereochemistry, when do we switch the naming?	0
353201	116396	245361	Are recently used emojis ordered vertically or horizontally?	Why doesn't Quora allow the use of emoticons?	0
353202	482219	482220	How do I get information about Google Analytics certification?	How can I get Google Analytics certification?	0
353203	482221	482222	Why do some people make fun of others?	Why do people make fun of others for their entertainment?	1
353204	28855	205012	I want to improve my English writing skills. Can someone suggest me some books?	What books do you suggest would help improve English writing skills?	1
353205	399	2606	What are the effects of demonitization of 500 and 1000 rupees notes on real estate sector?	How will real estate prices be affected in India after banning of 500 and 1000 rupees notes?	1
353206	482223	482224	I am a graduate in industrial engineering. I want to become a analytics professional. What should I have to do?	Is there a desirable form or format for Ancillary Relief (typically attached to a divorce summons in NY State)?	0
353207	482225	482226	How can you make elf ear prosthetics?	I have VERY big ears (I’m a guy). What can I do to make it smaller or better-looking ?	0
353208	482227	51571	What are the best news sources in Pakistan?	What is the best news source?	0
353209	482228	482229	What exactly is Bitcoin?	What is the Bitcoin?	1
353210	4038	34942	What are the best ways to earn money from home?	How can I earn money easily online?	1
353211	143995	482230	Where can I get audios or videos with California and New York accent? I mean, people saying the same thing, but pointing out the differences.	What area of NY is the most common to hear a New York Accent?	0
353212	116699	166882	What are the basic components of a computer model?	What are some components of a computer?	1
353213	482231	482232	Has anyone worked with MirrorPlacement for technical recruiting?	How do I talk to technical recruiters?	0
353214	45456	104738	Can energy be borrowed from vacuum(to be returned immediately)? If this happens how do we know vacuum energy is real if virtual particles don't exist?	Do virtual particles and energy in vacuum really exist? How do we know if they exist if we can't observe them? Where are they?	1
353215	482233	482234	Is high-frequency trading with a lot of computing power fair and moral? 	How can a computer scientist get into a (HFT) high frequency trading firm and what role does he play?	0
353216	482235	482236	"What does a ""fourth degree felony"" mean?"	What counts as a Class 3 Felony?	0
353217	482237	482238	How is the interview process at instamojo?	How is the Orbitz interview process?	0
353218	482239	482240	How do you buy things with PayPal when the electricity and internet are out or away due to an emergency?	When you watch videos or TV shows, do you ever want buy any of the things you see, such as clothes, furniture, or props in the video? Is it easy for you to find out those things you are interested in the video?	0
353219	14772	38	Why do people ask questions on Quora instead of Googling it?	Why do people ask Quora questions which can be answered easily by Google?	1
353220	5265	447129	Punctuation: Is it correct to add a question mark after a rhetorical question?	Should there be a question mark at the end of a rhetorical question?	1
353221	105265	482241	How do I follow up with someone in WhatsApp?	How can I follow someone on WhatsApp?	1
353222	482242	277880	Where can I find the best vegetarian burger in San Francisco?	Where can I find the best burger in San Francisco?	0
353223	482243	482244	How do I calculate the equivalent resistance in this diagram?	How can we calculate equivalent resistance for the below resistor arrangement?	0
353224	226528	482245	How do you determine the decomposition of magnesium hydroxide?	Why India doesn't print million of notes and develop the country?	0
353225	405176	275878	What do Muslim women think of oral triple talaq?	What is the view of Muslim women on triple talaq?	1
353226	478979	482246	"What publications and resources do professionals in the field of writing theory read to stay up to date on published and ""in the works"" research?"	"What publications and resources do professionals in the field of taxonomy read to stay up to date on published and ""in the works"" research?"	0
353227	482247	482248	How do the holy scriptures of Hinduism compare and contrast to those of Buddhism?	How do Hinduism and Buddhism compare and contrast?	0
353228	93771	22336	What are the most common traffic convictions in Arkansas, and how does the severity of the convictions differ in California?	What are the most common traffic convictions in Arkansas, and how does the severity of the convictions differ in Texas?	0
353229	482249	482250	How do you calculate risk by race of being shot by police in the US?	What is the most interesting article about the importance of marketing in biology and healthcare?	0
353230	482251	482252	Why are unattractive people considered the biggest losers that exist?	Has Eichmann and Mengele ever met each other?	0
353231	482253	482254	What will be the effect of banning of INR 500 and INR 1000 notes in India?	What are the effects of withdrawing INR 500 and 1000?	1
353232	166899	482255	What is Net Demand and Time Liabilities (NDTL) of a bank?	Is a bank loan a current liability? If so, why?	0
353233	482256	482257	Which is the best way to stream live video on a website?	What are the best and most cost effective ways to perform live video streaming?	0
353234	369515	482258	What was the The Catcher In The Rye all about?	What did you think about The Catcher in the Rye?	0
353235	482259	482260	What are the major differences between the TV serials Elementary and The Mentalist?	What is the difference between acting in a film and acting in a TV series?	0
353236	482261	123524	Is modafinilstar.com trusted?	Can we trust candere.com?	0
353237	23355	3938	How do I talk English fluently?	What should I do to improve my English ?	1
353238	482262	135280	"Why does the Little Caesars commercial always say ""pizza, pizza""?"	What are some of the differences between pizza sold in the US compared to pizza sold in Italy?	0
353239	95439	292907	Can someone tell if you've saved a chat on snapchat?	How can you tell if someone saved your pictures in a snapchat conversation?	0
353240	376057	226432	Is addiction really a disease?	Is alcoholism a disease?	0
353241	482263	482264	Is Cristiano Ronaldo a nice person?	What's Cristiano Ronaldo like in person?	0
353242	14840	482265	What is the best passive investment strategy?	What's the best way to achieve an 8% return on investment in 2013 through passive investing?	0
353243	482266	482267	Which living organism cannot dream?	How did biological life evolve from chemical elements?	0
353244	482268	482269	How many companies use an ATS (applicant tracking system)?	Can you suggest the best ATS for internal hiring?	0
353245	60512	283246	What is this bump on my arm?	What are the bumps on my arm?	0
353246	105709	482270	What should I do about the girl I like?	What should I do when a girl likes me, but I don't like her while the girl I do like doesn't like me that way?	0
353247	49723	482271	How can India reduce its oil imports?	How can India reduce its dependence on oil?	1
353248	13880	21549	What will be the impact of banning Rs. 500, Rs. 1000 notes on Indian economy and Businesses?	What will be the effects of demonetisation of 500 and 1000 notes on the Indian economy?	1
353249	482272	482273	What are the best questions we can ask our girlfriend?	What is a good question to ask your girlfriend?	1
353250	482274	186583	"What are the problems of ""ugly husband beautiful wife"" couples?"	What is it like to have an ugly wife/partner?	0
353251	482275	482276	Where or How can I buy past seasons stock from clothing stores like New Look, Primark, … (or any other brand)?	Do you think Hillary could effectively lead the United States after she called 30,000,000 Americans deplorable; another 30,000,000 Americans losers?	0
353252	447058	69681	Where can I view the answers I have upvoted on Quora?	Where can I find a list of all answers I have upvoted on Quora?	1
353253	482277	482278	Why is it so hard for a woman to be president?	Which is the most popular blogger website?	0
353254	482279	482280	How do I give an effective paper presentation?	Script for anchoring a bithday party?	0
353255	482281	482282	How can I live the life the way I want?	How can I live the life I want?	1
353256	482283	112964	What was the most daring thing you did at 15?	What was the craziest thing you ever did in high school?	0
353257	217560	482284	How did Hollywood movies lost innocence and family values? How Playboy started in 1953 influenced the Hollywood and American culture?	How is the total earnings of a single movie generally divided among movie makers and distributors in Hollywood?	0
353258	482285	482286	How do I prepare the resume?	How do I prepare my resume for TCS?	0
353259	482287	482288	Which are the similar websites like Postcrossing.com?	Which are similar website like appyet.com?	0
353260	58690	24396	What is the meaning of our life?	What is a meaning of life?	1
353261	50380	4656	Which laptop I should buy, Dell or Lenovo or HP ?	Whose laptops are better, HP or Dell?	0
353262	482289	482290	What are the costs for using the Facebook Graph API beyond the rate limit?	Does Facebook enforce a limit on the number of API calls a given user can originate over a period of time when using a Canvas app?	0
353263	482291	482292	What are the reasons for Spain to block Scotland future choice to join EU?	In the event of Scotland leaving the UK, will Spain veto Scotland from joining the EU?	0
353264	106503	482293	Human Physiology: What concentration of salt water will induce vomiting?	Human Physiology: Which finger out of the five is most important?	0
353265	482294	482295	What does IAS officers generally do after retirement?	Is it true that IAS/IPS officers slip into severe depression and beome psychopaths after retirement?	0
353266	482296	447188	Why is someone being able to comment and reply after he's been blocked and muted on Quora?	Why are people you've blocked on Quora still able to reply to your comment on their content? Wouldn't that partially defeat the purpose of blocking?	0
353267	31138	208686	How will demonetization affect India?	How will demonetization affect India & Indian economy?	1
353268	448960	227084	What is the best birthday gift given to father?	What are some good birthday gifts to mom?	0
353269	52873	28399	How can I loose weight naturally without doing exercise?	How can you lose weight without doing exercises?	1
353270	482297	482298	How do police officers feel about enforcing laws they don't agree with?	How do police officers deal with enforcing a law they think is unjust?	1
353271	482299	482300	Where can I purchase a high quality P.O.P?	Where can make a high quality copy of my collage?	0
353272	482301	482302	Will there always be poor people in the world?	How would the world be if there are no poor people?	0
353273	51980	53686	Is it possible to get pregnant before period or after period ends?	If I have a 6 day period can I get pregnant just after it ends?	1
353274	482303	482304	Will Angela Merkel resign after Munich and the Wurzburg train attack?	Will Angela Merkel survive in office after the Munich mall Shooting (July 22 2016)?	1
353275	482305	482306	What does a free lance web developer do to get clients?	Where should a freelance web developer start to get clients?	1
353276	38822	482307	Is there any way to determine what theme a Shopify store is using by viewing the source code?	Anyone can click on the View Source of my webpage and know that I use WordPress. Is there a way I can hide this?	0
353277	482308	482309	How do I write a good movie script?	Can good acting save a bad movie script/plot?	0
353278	172800	482310	How Does Paypal Work in China?	How does the PayPal balance work?	0
353279	424510	482311	Is there any Facebook-advertising agency that has CPA/ROI based pricing?	Are there examples of agile software development agencies that utilize value-based pricing?	0
353280	9739	7165	How do I get rid of scalp acne?	How can I get rid of pimples all over my face?	1
353281	482312	375736	What are the disadvantages of marrying a woman with kids?	Can a Muslim marry a Hindu?	0
353282	482313	482314	How can I find the pH of a solution of NaHCO3?	What is the pH of an NaHCO3 0.1 Molar solution?	0
353283	482315	482316	Strong In Europe?	Do governments warn for real estate bubbles to keep rental fees down artificially, even if there is no bubble?	0
353284	62862	482317	What is the fee structure of hostel ?	Is hostel compulsory in Shiv Nadar University?	0
353285	73570	59575	What was the significance of the battle of Somme, and how did this battle compare and contrast to the Battle of Matapan?	What was the significance of the battle of Somme, and how did this battle compare and contrast to the Battle of Smilevo?	1
353286	169535	482318	Does letting weed sit in a bottle of e-juice and then vaping the juice, get you high?	Is it possible to smoke weed from a vape pen?	0
353287	482319	482320	What do I need to pick up money from Western Union?	Where can I pick up money sent to me through Western Union?	0
353288	482321	219710	What is ghosting?	What do ghosts eat?	0
353289	54575	9519	If universe expands without limit and dark/vacuum/gravitational energy is created with it, is potential energy (the energy that can be created) infinite?	If infinite dark/vacuum/gravitational energy can be created as universe expands, does it mean that their potentiality or potential energy is infinite?	1
353290	482322	294375	How do I tell my ultra, fundamentalist and almost extremist Catholic parents I'm an atheist?	How can I tell my Catholic parents I'm an atheist?	1
353291	482323	319692	What is the meaning of budget?	What does the budget mean?	0
353292	482324	113249	Which hp laptop is best for a graphic design/gamer?	Which is best HP or Dell laptop?	0
353293	125882	482325	How does culture affect Asian and Western design and making it different from each other? (Design elements, colour, logos etc.)	How different Baloch people living in Pakistan, Iran and Afganistan are from each other culturally?	0
353294	30758	152510	What are the 23 flavors in Dr. Pepper?	Is Dr Pepper really cherry cola in disguise?	0
353295	382095	482326	What are cancer cells? Why are they so dangerous?	Why are cancer cells dangerous?	0
353296	249065	466036	What is the best advertising model of education informative website?	What is the best advertising model of education informative websites?	1
353297	423504	319080	What should one check before buying a violin?	What are the specifications one should check on buying a violin?	1
353298	13249	92545	What is the Sahara, and how do the average temperatures there compare to the ones in the Colorado Plateau?	What is the Sahara, and how do the average temperatures there compare to the ones in the Mojave Desert?	1
353299	61811	247178	What happened during New Year’s Eve celebrations in Bangalore?	What happened during New Year’s Eve in Bangalore?	1
353300	482327	482328	How do I encrypt the data on my Android phone?	What is the best way to encrypt data in android?	1
353301	3879	18133	How widely accepted are credit cards at small businesses and restaurants in Israel?	How widely accepted are credit cards at small businesses and restaurants in Mexico?	0
353302	48484	178548	How do you add a profile picture on Quora?	How do I add or change my Quora profile picture?	1
353303	482329	482330	I am a 21 year old guy. I am attracted to girls. For some time, I fantasize about myself being a girl making out with a guy. Am I homosexual or bisexual or is it just normal?	I am 21 & I am wasting my life and time.I am engineer preparing for CAT. Sometimes I want to be a DJ,or join IIM, or start a startup. I am just lost?	0
353304	11105	482331	Do you know about the greatest adornments designed by the fashion designers to beautify women's natural beauty?	What are the beautiful images of life and nature's beauty?	0
353305	482332	482333	Did using aftermarket ink in my Canon Pixma MX922 inkjet printer shorten its lifespan (two years vs. average of four years)?	How do I wish someone happy birthday that is on Diwali?	0
353306	482334	482335	Are there any free online physicians' forum?	Is BestNaija.com the best Nigerian Online Forum?	0
353307	482336	482337	Why do I feel sleepy all day even after a good night sleep?	Why do we feel sleepy when bored even though we had had a good nights sleep?	1
353308	142250	482338	Which best online home grocery web site?	Could you please list some online grocery stores?	1
353309	11392	2675	What do you think about the Modi's sudden decision to scrap 500 and 1000 rs denomination?	What do you think of the decision by the Indian Government to demonetize 500 and 1000 rupee notes?	1
353310	76776	482339	How do I cope with guilt of sleeping with my friend's mom?	How do I cope up with the guilt of killing someone accidentally?	0
353311	69279	482340	Do the Rothschild control the world?	Is it true that some behind-the-scenes families, like the Rothschild family, control the world's wealth?	1
353312	75976	2068	What hotel in Lachen Hill-station would be safe for unmarried couples, without the harassment of police, hotel staff, and moral police?	What hotel in Shimla Hill-station would be safe for unmarried couples, without the harassment of police, hotel staff, and moral police?	0
353313	482341	228597	Who was the kindest/friendliest celebrity you've ever met?	Who's the nicest celebrity you've ever met?	0
353314	482342	482343	How much marks in JEE-Main and Advance are required to get an admission in CET?	What are the issues faced while using GPS on phones with no magnetometer?	0
353315	482344	482345	"What is the song ""Kashmir"" by Led Zeppelin about?"	What is the song “Stairway to Heaven” by Led Zeppelin about?	0
353316	307006	482346	What are some tips for you to use a Visa gift card online?	How can you use a Visa gift card for online purchases?	1
353317	482347	482348	How can I turn a box of Kraft Macaroni and Cheese into an exciting meal?	What kind of cheese is in macaroni and cheese?	0
353318	51564	191907	How hard is it to be accepted into Cambridge astrophysics?	Why doesn’t NASA keep a couple in the space station and ask them to make a baby?	0
353319	16572	60445	What will be the pros and cons of the replacement of 500 and 1000 currency notes by the Indian govt.?	What are pros and cons of 500 and 1000 currency notes abolishing?	1
353320	482349	482350	I got 35 marks in the JEE and 75 in the boards. I'm in the Gujrati quota. Will I get a CS in KJ Somaiya?	I got 35 marks in the JEE and 75 in boards. I'm in Gujrati quota. Will I get CS in KJ Somaiya, Mumbai?	0
353321	282492	482351	Why does Sweden produce such good pop music and musicians?	Why does Sweden produce such great bands and music artists?	1
353322	400367	202968	What's the difference between mice and rats?	What is the difference between a mouse and rat?	1
353323	482352	482353	How can I publish Theses on biochemistry on International Library for thesis?	How can I publish Theses on biotechnology on International Library for thesis?	0
353324	482354	482355	Is it legal to buy a Galapagos Tortoise?	Which country has the lowest legal age to buy a gun?	0
353325	482356	350466	How do you pronounce Steve Jobs' last name?	How do you pronounce the Danish last name Damkjær?	0
353326	31174	85305	What's good song for a best friend lyric prank?	What is a good song for a text prank?	1
353327	482357	482358	Is it true that in Russia soldiers must have the situation under control with a bear in 1vs1?	Are there any physiological changes happen when a human being gets spiritually enlightened?	0
353328	482359	482360	Where can I get best label printing work in Australia?	Where can I get very affordable price for different kinds of label printing in Australia?	1
353329	22805	482361	Should I prepare for NEET 2017 again?	How can I prepare for NEET 2017 from now onwards?	0
353330	9931	25852	How can one overcome porn addiction?	How can I overcome porn addiction?	1
353331	482362	90444	What is the main difference between circuit breakers and relays?	What is the difference between relay and circuit breaker?	1
353332	482363	482364	Why are girls so obsessed with Beyoncé?	Why are girls so obsessed with clothes?	0
353333	482365	482366	Why do cats have static electricity?	A person that educated but acts low class?	0
353334	482367	482368	What made Bill Gates rich? Was it luck, hard work or talent?	What made Bill Gates rich?	0
353335	482369	482370	What exactly is digital art?	What are the digital arts?	1
353336	482371	482372	What is the best JS, CSS, HTML, and PHP minifier?	What is the best IDE in Linux? I have to work with Python, Java, JavaScript, PHP, Django, Node.js, Angular, HTML, CSS. What would be the best choice?	0
353337	482373	482374	What is it like to be an ORFE student in quantitative finance at Princeton?	What do Princeton students think of Princeton AOS students?	0
353338	482375	482376	What are some small, seemingly insignificant things, that changed the course of history forever?	What are some seemingly insignificant incidents that later changed the course of history?	1
353339	5558	163571	Where can I get quality assistance in Sydney for any property transaction?	Where can I get highest quality service at exceptional prices in Sydney for property conveyancing?	1
353340	482377	482378	After ten years of experience in Microsoft related technologies (C#, .NET, Powershell, MVC), in both test and development roles I am earning a salary of 10L per annum. How much should I be earning as per market standards?	I earn $250,000 per annum at Google. How much should I expect from Facebook?	0
353341	122829	168901	Is ice more or less dense than water?	Why density of ice is less than water?	1
353342	482379	482380	I have an IQ of 160. How can I make use of this?	Found out my iq is 160. What now?	1
353343	482381	482382	What does India need the most at this moment?	What is the Improve India movement? Who leads it?	0
353344	482383	482384	What is Technology stack used in bandbaajaa.com?	What is the technology stack used in Kaggle.com?	0
