id	qid1	qid2	question1	question2	is_duplicate
159345	248757	185651	What is a low profile graphics card? What purpose does it serve?	What is the best graphics card for PC Gaming?	0
159346	248758	248759	How can an engineering student start his career in tollywood industry?	Who is Balakrishna in Tollywood?	0
159347	248760	248761	What is your review of “Designated Survivor”?	What is your review of Design?	0
159348	248762	248763	What would Voldemort have done if he survived and escaped at the end of the 7th book instead of dying?	Cricket (sport): What if I can bowl at a speed of 150 kmph in India?	0
159349	248764	248765	Why do many people lack basic manners nowadays?	What are the basic manners that people lack nowadays?	1
159350	248766	248767	Why do so many Americans think the country is on the wrong track?	How did the rise of Arab power preserve and extend late antique Byzantine and Persian cultural traditions from Rome to India?	0
159351	248768	248769	Can illegal immigrants vote in presidential election?	How do illegal immigrants illegally vote during presidential elections?	1
159352	248770	248771	Do the emails/mail from colleges mean anything?	I am forwarding email from Yahoo Mail to Gmail and all of it is going into my Gmail spam filter. What do I do?	0
159353	248772	248773	What are good watches for men under $200?	What are some good men's watches under $250?	0
159354	6312	20190	What do you think of the move by the govt to scrap 500 & 1000 rupee notes?	What do you think about ban on Rs. 500 and Rs. 1000 currency notes?	1
159355	46478	248774	What does mAh mean?	How much time will it take to charge a 10,000 mAh power bank?	0
159356	248775	248776	How do you become a businessman through your employer?	How do I become a businessman?	0
159357	41801	248777	How can I make 500 rupees daily from the Indian stock market if have only 10000 rupees to invest?	How much an Indian trader can earn from stock Market on daily basis, with an investment of 1 lakh?	1
159358	248778	248779	What are the differences between a MP3 file and FLAC file? Can they be converted?	What kind of disadvantages does an MP3 file have over a FLAC file?	1
159359	248780	248781	What is the average salary for 25 yrs exp7in software in usa?	I am an operations coordinator with over seven years of experience, what other job opportunities do I have out in the market with a higher pay scale?	0
159360	248782	248783	Matlab or C code for finding shortest path between 2 vertices in an undirected graph?	What are good ways to find all the possible paths between two nodes in a directed graph?	0
159361	4703	102417	What is the best answer to why should I not hire you?	Why should we not hire you?	1
159362	248784	248785	How can I use my Jio 4G SIM ?	Can I activate Jio sim in one 4G phone and then use that sim on another 4G phone?	0
159363	212707	248786	What is the difference between a loan and a mortgage?	What is the difference between a loan and an investment?	0
159364	248787	248788	Why are unconventional mechanical machining processes not so effective on soft metals?	What is the effect of using metal catalysts in industries?	0
159365	248789	248790	What was invented in 2003?	What was life like in 2003?	0
159366	82022	28132	What are the best ways to lose weight? What is the best diet plan?	What are some ways to lose weight fast?	1
159367	65803	142956	What song plays over the end credits to the 2002 movie Chance?	What song plays over the end credits to the 2002 movie Alive?	0
159368	248791	248792	How was the Pacific ring of fire formed? Why is it so unstable?	Why is there only one Ring of Fire on Earth, and how did it form?	1
159369	248793	248794	What is the best way to approach angel investors in India?	How can we find angel investors for my first startup in India?	0
159370	172714	214781	Will masturbation affect my muscle growth?	Does masturbation affect muscle gain?	1
159371	248795	207271	How come homeless people have pets often? Where did they get them?	Why should we help homeless people?	0
159372	90614	13714	How do I stop a Pointer/Boxer mix puppy from chewing my shoes?	How do you stop your Beagle/Pointer mix puppy from biting your shoes?	1
159373	99421	145009	What is the best way to overcome porn and masturbation addiction?	How do I self rehab from masturbation and porn addiction?	1
159374	248796	248797	What would the world be like if everyone were the same?	How would the world be different if everyone had the same eyes?	0
159375	248798	248799	What would happen if a reality TV show was made out of Redditors?	What would happen if a reality TV show was made out of professors?	0
159376	150015	47950	How do you know when you start to fall in love with someone?	How do you know you are in love with someone?	1
159377	248800	248801	What's the point of fighting a war on drugs?	Is there a argument for the war on drugs?	1
159378	242974	48411	Can you ask any question on Quora?	Is there a question limit on Quora?	0
159379	190488	248802	How do I get motivated to do something?	How do I get motivated to do well in life?	1
159380	248803	97038	Which is the best DSLR model?	Which company makes the best DSLR?	0
159381	244010	224408	What are the best hotels of Rajasthan?	What are best hotels in Rajasthan for holidays?	1
159382	248804	248805	Why are there 60 second in a minute?	How is a high heat capacity measured?	0
159383	248806	248807	Is the KTM RC 390 an appropriate bike for students?	How much does the powerparts KTM Duke 390 cost?	0
159384	248808	248809	What does a mechanical graduate engineer trainee do?	What are the responsibilities at BHEL (Bharat Heavy Electricals Ltd) as Graduate Engineer Trainee Mechanical?	1
159385	248810	248811	Do TV actors/movie actors earn more than an IIM A graduate?	Who earns more, an architect or an actor?	0
159386	191411	248812	Why was Quora down a few minutes back?	Why was Quora down for a few minutes on April 5, 2015?	1
159387	248813	248814	Do you think Sheela foam will gain on listing day?	How do you feel when someone points a middle finger at you?	0
159388	248815	248816	Why do people spend so much money on expensive gaming laptop when they can easily build a similar or better rig for half the price?	Rent 4000,wages 2000,social security 4000,bond 1200,corp bond 1000,dividends 1400,expense 2000 calculate my gross income in US tax?	0
159389	248817	248818	What should RNC do now?	What is RNC?	0
159390	248819	248820	How do I apply for job in YouTube as a fresher?	I am a B.Tech electronics fresher. Where should I apply for a job as a business analyst post?	0
159391	248821	248822	How many times have democrats and republicans been elected president?	How many astronauts go up Republican and return Democrat?	0
159392	248823	248824	Which college is better among Hindu College and Hans Raj College of Delhi University for doing BA (Hons.) in economics?	Do companies which come for placement at Hindu college, Delhi University also hire articles for articleship among students pursuing CA?	0
159393	248825	248826	Looking back, what was the most important risk you ever took, which changed your destiny?	What is the most embarrassing music you've ever listened to? (Hint: look back at your earliest iTunes purchases)	0
159394	248827	95931	What is partial pressure?	What is the partial pressure of oxygen in atmosphere?	0
159395	248828	248829	How is the density of bread measured?	How can the density of gelatin be measured?	0
159396	248830	248831	"What is the specific meaning of "" 16 wt.-%""? Is that 16%(w/v), 16%(w/w), or something else?"	What does v/o mean in a discussion of a suspension?	0
159397	12035	248832	What is the salary of an IIT professor?	Who are the best professors at IIT Kanpur?	0
159398	184417	248833	How do I read reference books efficiently for the IAS exam?	What books I need to read for the preparation of IAS exam?	1
159399	248834	248835	I have completed my BDS in India. I am interested in forensic odontology in USA or Canada. What is the scope of it and how should I proceed with it?	I have taken up science (PCM) for +2 but I am not interesting in engineering. What other options do I have that have scope in India as well as in the USA?	0
159400	248836	248837	What factors affecting the height of water in a thin tube?	What factors affect the height of a liquid in a thin tube?	1
159401	248838	248839	What is the best part of being a mother?	What is the best part about being a mother?	1
159402	66056	248840	How can I earn 10 lakhs in two months?	How can I make 5 lakhs in a month?	0
159403	248841	248842	How do I become super persuasive?	What are some ways to become more persuasive?	1
159404	248843	248844	Can you buy a gift card with a credit card?	Can you buy gift cards with a credit card?	1
159405	248845	248846	What are the best engineering jobs?	What is the best engineering job?	1
159406	248847	248848	Why doesn't MAIT upgrade its website?	What should I choose, MAIT, MSIT or BVP?	0
159407	248849	234707	What are Moroccans like, and how does their culture compare to Nigeria's?	What are Moroccans like, and how does their culture compare to Kenya's?	0
159408	248850	248851	What does North Korea do right?	What is South Korea shouting at North Korea?	0
159409	248852	248853	My 9 year old son can jog about as well as I can. Meaning, he can run 2 to 3 miles at a time at a 9 min mile pace. Does he have talent in running or is this normal for his age?	How fast can the average 40-year-old male run a mile?	0
159410	248854	248855	What is the difference between a Drop through longboard and a top mount longboard?	Can you recommend a good longboard drop deck for a heavy rider?	0
159411	248856	248857	How do criminal lawyers choose between prosecutor and public defender for their career?	Can TCS force me to work 60 hours a week without paying extra?	0
159412	248858	248859	Can I take M100 after drinking alcohol?	What is the Scholorships available now in senegal or tunisie or Africa?	0
159413	241243	175695	What are the best game apps to download for the Android?	What are some of the best games for Android?	1
159414	35188	248860	Is there any site where new game makers can post their games and recieve tips ,advice etc on how to make it better?	Well I am a flash game addict and I have made a script which works with a game and does some jobs automatically. Now I want to run that script 24 X 7... How do I go about it? Is there any website where say I can upload my script with my logins and it should continue to run on its own?	0
159415	248861	248862	Is staying up all night in order to earn extra hours of studying a good idea?	Is my cat affected if I stay up all night?	0
159416	248863	248864	How much time it should take to increase my biceps size from 13.5 inches to 16 inches? I do gym regularly since last 5 months.	How do I loose 4 inches in 5 months?	0
159417	248865	248866	Does Islam allow accepting a blood donation from a non-Muslim?	Question with Assumptions:  Why are Muslim families so adamant to not allow their females marry a non-Muslim, but are not so strict when it comes to accepting a non-Muslim bride into the family?	0
159418	248867	248868	How are electrons and holes injected into the correct orbitals in an OLED?	If ISS orbiting around the Earth requires orbital lift/correction due to orbital decay then how will such an operation be carried out in MAVEN/MOM periodically?	0
159419	86483	248869	How do I understand if my best friend is falling for me?	How do I know if my best friend is in love with me?	1
159420	248870	248871	How large would the explosion be if a 747, transporting only barrels of oil, crashed into the ground?	Oil prices have gone down to 45$ a barrel. Are we expecting oil prices to drop 20-30$ a barrel? If that happens, won't it lead to a stock market crash in the US because ultimately if one sector slows, it is going to slow the economy and oil that makes about 10% of index?	0
159421	248872	248873	How many glasses of champagne are in a bottle?	How much would a top range (e.g. '88 Krug) bottle of champagne cost?	0
159422	248874	248875	What is the best place to visit in Bengaluru?	What are the best places to visit in Bengaluru and nearby?	1
159423	248876	248877	How can I write a college essay for my admission?	How do you write a better college essay?	1
159424	59997	5746	Will time travel ever become possable?	Will time travel be possible in future?	1
159425	61502	65248	What is the easiest way to improve your memory?	Which is the best way to improve memory?	1
159426	57662	42935	Has Ancient History been scientifically tested? Is it all real? Did it happen differently than we were told it did? Did it even happen at all?	Have ancient civilizations been scientifically tested?	1
159427	248878	248879	What is the best answer you have ever given to any question?	What is the best answer to a question you don't have an answer to?	0
159428	248880	248881	How should one choose or not choose to use Maven for a new Java project?	What should I choose between Java and C#?	0
159429	23891	55880	Do aliens exists?	Do aliens even exist?	1
159430	248882	44209	Why do tumblr video URL links go red?	Why did I not get the link to verify my email address from Tumblr?	0
159431	108331	97973	How should I start business?	What's the way to start a business?	1
159432	51079	248883	What are the best ways to advertise a YouTube channel?	How can I improve a slow growing Youtube channel?	1
159433	248884	248885	What are Johnny Carson's sons, Christopher (Kit) and Cory Carson, doing today?	Was Marilyn Monroe ever a guest on Johnny Carson's show, or any other late night TV program?	0
159434	109326	248886	What are intellectual needs?	What is intellectualism?	0
159435	6451	224480	What are the strongest majors in terms of job prospects and what are the weakest majors at Bradley University?	What are the strongest majors in terms of job prospects and what are the weakest majors at Seattle University?	0
159436	248887	248888	How do you find out how much one second is on the map?	Why is Hillary Clinton so good?	0
159437	248889	248890	How did you get WBW to take off so quickly?	What does it mean when a commitment phobic man asks you if you are in love with him and you have been seeing each other randomly off and on?	0
159438	231272	106660	How do I hire a mini truck in Bangalore?	How do I rent a mini truck in Bangalore?	1
159439	248891	248892	Why is Bollywood not able to make movies comparable with Kabali Tamil movie?	Has Bollywood ever made a Hindi movie comparable to Tamil movie Kabali?	1
159440	248893	248894	My laptop wifi does not function properly. Would an external wifi adapter help?	I am a 26 year old male who has never been into relationship. Am I fucked now? How do girls perceive this?	0
159441	204007	155093	What is the differences between being in love with someone or loving someone?	Is there really a difference between loving someone and being in love with them?	1
159442	248895	248896	What does LexisNexis do?	What is lexisnexis?	0
159443	248897	248898	What are some examples of adaptive radiation?	What is adaptive radiation? What are some examples?	1
159444	136469	11888	How do I find a basic purpose in my life?	How do you find your passion and purpose in life?	1
159445	248899	248900	What is an example of Oedipus complex in adults?	What are some examples of an Oedipus Complex?	0
159446	197012	248901	Is it bad to never change a Brita filter?	What are some tips for prolonging the life of a Brita filter?	0
159447	248902	187278	Who is your best hero?	Who is best hero of Bollywood?	0
159448	248903	248904	Which TV series deserves a comeback?	"Does the new TV series ""TVF Pitchers"" really deserve a rating of 9.6 on IMDb?"	0
159449	248905	248906	What is the impact of demonetization in rural world of India?	Which bike is best in India for rural area?	0
159450	248907	248908	How do I replace the battery for my Rolex Oyster Perpetual watch?	How do you tell if a Rolex Oyster Perpetual is real?	0
159451	248909	248910	Why should you stalk your stalker?	What is it like to stalk your stalker?	0
159452	35751	5259	How can I know if my wife is a cheater?	How can I know if my spouse is cheating?	1
159453	248911	248912	What is the best reply when people say ok?	Why do people always say talking about your problems is best?	0
159454	248913	248914	What is the business model of Shuttl App?	What is the business model of Shuttle in India?	0
159455	248915	248916	If water were a nonpolar molecule, how would the properties of water be different?	Why is water considered to be a nonpolar molecule?	0
159456	248917	248918	What is the best thing to do when you have nothing left in your life?	What are some of the best things and life lessons you have learned from an animal?	0
159457	150378	248919	Who is #9 on the Detroit Lions?	Why are the Detroit Lions so bad?	0
159458	248920	248921	Why do titans exist in Attack on Titan?	Is Attack on Titan more of a horror anime or a drama?	0
159459	248922	248923	How do I expose Spark Mllib as a REST service?	What is the cost of staying healthy in India?	0
159460	248924	248925	Who earns more money, a quality engineer, maintenance engineer, design engineer or production engineer in the long run?	I am confused about my career.How can I earn more money by using my Production engineering degree? What should I do for settle in European country?	0
159461	248926	248927	What are free alternatives to Shutterstock and 123rf?	What is a free alternative to scribblemaps.com?	0
159462	248928	248929	How much traffic can a mobile app on a Heroku free tier handle?	I am planning to deploy my app on meteorjs. There will be about 30,000 users who will be using my app. Meteorjs can handle this much traffic?	0
159463	26915	248930	If time travelling is possible, then why are people from the future not coming?	If time travel is possible, why don't we see people from the future?	1
159464	248931	248932	Will I go to valhalla?	What is Valhalla like?	0
159465	78985	27544	How do I increase the vocabulary?	How did you expand your vocabulary?	1
159466	248933	248934	What are the best pop songs?	What are the best pop songs in your opinion?	1
159467	248935	248936	What would happen if Osama Bin Laden suddenly undied?	Will I successfully lose at least 10lbs on a paleo diet in a week without exercise?	0
159468	248937	248938	When and how do you get runner's high?	When do you get runner's high?	1
159469	248939	100647	What's the difference between a goal and a task?	What is the difference between dream and goal?	0
159470	172269	161645	I never signed up for this Quora account. How do I delete this account?	How can I delete this account? Please answer	1
159471	248940	248941	Are people of this generation better parents than their parents and grandparents?	Are modern classic children book series (Beverly Cleary, Judy Blume) becoming less and less relevant for children today, despite being beloved by their parents' and grandparents' generation?	0
159472	70277	41625	Will Donald Trump or Hillary Clinton win the 2016 US presidential election?	Who will win the US election?	1
159473	248942	248943	What is the demand for vegetarian restaurants in Atlanta, GA?	Is $70k a good Salary in Atlanta, GA?	0
159474	248944	248945	What is the difference between a director, DOP and cinematographer?	What is the difference between cinematography and DOP?	1
159475	248946	248947	What are the best Wordpress plugins for authors?	What are the best WordPress plugins?	0
159476	248948	190039	How much money will I get with 1 like in YouTube?	How much money can an average user on YouTube earn from a video?	0
159477	248949	248950	What is famed Scottish author George MacDonald's greatest book on theology?	I run a print/publishers account on Twitter. I have been posting some products that we have created. What else could I post on the Twitter?	0
159478	248951	248952	Why is my adsense RPM getting low?	Why is my Adsense RPM so low?	0
159479	248953	248954	Could you recommend good books on histories of companies in music and entertainment field?	I am a Jio customer, I am using the Airtel sim on the other slot but when I off the Jio net and on the Airtel net it is not working?	0
159480	248955	248956	What is the difference between real image and virtual image?	What are real and virtual images?	1
159481	248957	248958	How do I change a friend's snapchat display name back to their default?	Should Snapchat change its name to Snap?	0
159482	248959	248960	What exactly is the normal reaction?	What is the normal reaction force?	0
159483	248961	248962	Will power naps help me grow taller?	Are there any books or papers that explore what a universe with slightly different physics or physical constants would be like?	0
159484	248963	237025	How can I improve my life in a year?	How can i change my life in one year?	1
159485	133174	248964	Is it true that Louis Vuitton burns all their unsold bags?	What do French people think about Louis Vuitton bags?	0
159486	248965	248966	What is a subsistence economy? What are some examples?	Examples of subsistence economy?	1
159487	84787	248967	What is hollaween walk?	Hollaween ghost walk?	1
159488	248968	248969	Why is it that so many people that have a bully mentality move into management positions over more talented and nice people?	Have you ever confronted a childhood bully, and if so, what was the result?	0
159489	248970	186077	How did you become a good writer?	How can I become a good writer?	1
159490	248971	248972	Can Ichange my Suzuki gixxer SF drum brake?	Can I change my Suzuki gixxer SF drum brake?	1
159491	110164	248973	Has someone treated you poorly until they discovered you were wealthy and/or successful?	How were virtual particles discovered?	0
159492	248974	135408	What is active region in transistor?	What is saturation & active region in a transistor?	0
159493	248975	248976	What could be the alternatives to Canada Goose down jacket?	Who is your favorite first lady of China?	0
159494	248977	248978	How do Americans feel about Dallas and Fort Worth? Do they consider them good places to live? I am considering moving there from Germany.	Is Troy, Michigan a nice place to live? What cities/towns should I consider too moving to that area?	0
159495	248979	248980	How do you read a book you're not interested in?	How can I get interested in reading books?	0
159496	248981	248982	Does “Durmstrang” mean anything in Bulgarian? It's the name of a wizardry school in the Harry Potter world.	Have you considered making Bernie your VP?	0
159497	248983	248984	What are the best choices for an R IDE?	Which IDE is best for C on Windows?	0
159498	248985	248986	What is the name of the serif font Quora now uses in its mobile answers?	Why has the font of Quora changed?	1
159499	248987	248988	What do you think of the recently announced PS4 Pro?	What is your reaction to Sony announcing the new PS4 Pro?	1
159500	235971	248989	What is Hillary Clinton's plan for ISIS?	What is Hillary Clinton’s plan to deal with ISIS?	1
159501	217829	248990	How do I prevent the recovering of deleted photos in my Android phone?	How do I recover deleted photos from NQ Vault app for Android?	0
159502	60339	95794	Did India do surgical strikes inside POK ?	Is it true that India has conducted surgical strikes along LoC in the past too, but didn't publicise them?	1
159503	248991	248992	How do I get into Indian railway job?	How can I easily get Job in Indian Railways?	1
159504	25056	16573	What are the pros and cons of Ceasing Rs. 500 and Rs.1000 Currency Notes in India?	What is the main reason for discontinuing 500 and 1000 Rupees Note in India? What are the pros and cons of it?	1
159505	36690	21215	What are the best ways to prepare for the CA auditing final?	What is the best way to prepare for CA final law and audit?	1
159506	248993	248994	What other skills should an accountant have?	What skills should accountants have?	1
159507	104242	248995	How is wind energy classified, and how does it differ from gravitational energy?	How is wind energy classified, and how does it differ from chemical energy?	0
159508	248996	248997	What are the most interesting animals?	What are some of the best Japanese anime, and why?	0
159509	248998	170741	What is the difference between a free and paid Antivirus?	What is the difference between free and paid antivirus softwares?	0
159510	116557	248999	What could be the cut off for KVPY SB/SX 2016?	What is the expected cutoff for KVPY SX 2016?	1
159511	249000	249001	Board seats versus majority ownership of shares versus preferred stock, and other deal terms: which provide the greatest actual decision-making power?	Why do venture capitalist take board seats?	0
159512	249002	249003	What is the best way to study for class 10th?	What are the ways to get 10 by 10 gpa in 10th class?	0
159513	71530	6044	How should I prepare to get selected for Google summer of code.?	What should I do to get an entry in the Google Summer of Code contest?	1
159514	4661	32831	What is that one decision that changed your life forever?	What's the decision that changed your whole life?	1
159515	249004	249005	What is the national seclusion policy of Japan and how did it affect the contact with Western countries?	General insurance council members?	0
159516	249006	249007	What is the OTG support capacity in Xiomi Mi 4i? What's the maximum limit of storage it can support?	Does the HTC Desire 620 support OTG?	0
159517	39300	98721	Why do people ask dumb questions on Quora?	Why do some people asked stupid questions on Quora?	1
159518	249008	249009	How can we start our own business?	How do I start your own business?	1
159519	249010	249011	Why such shameless countries like Pak & North Korea exists in this world?	If the world condemned what Hitler did and swore to protect the citizens of the world from such future atrocities, then why are we all mute spectators to what is happening in North Korea?	0
159520	2985	23908	How can I be a native English speaker?	How do I improve my overall native English language?	1
