id	qid1	qid2	question1	question2	is_duplicate
311000	435207	435208	Is there an evolutionary advantage to afro textured hair?	Is there any reservation for freedom fighter in Afact?	0
311001	319851	435209	What is issuing authority in a passport? What should I write in it?	How do I re-issue a passport if I have lost a old Expired?	0
311002	435210	179905	What are some good online lectures on distributed systems concepts?	Is there a good online course on distributed systems?	1
311003	435211	189599	Where can we find ONIDA Service Center in Hyderabad?	Where can we find Videocon Service Center in Hyderabad?	0
311004	435212	435213	What tax rate would private equity firms pay under Trump Administration if carried interest is abolished?	Most famous and legalized porn websites in USA?	0
311005	254743	435214	What makes Spanish a beautiful language?	Does it make sense learning Spanish as a language if you live in Canada?	0
311006	115688	435215	What universities does SM Energy recruit new grads from? What majors are they looking for?	What universities does Uranium Energy recruit new grads from? What majors are they looking for?	0
311007	435216	435217	How do I read palms?	How do you read palms?	1
311008	435218	162604	How do you delete an Instagram account without logging in?	How can I log in or delete my Instagram account?	0
311009	435219	435220	Was the pilot of Sherlock’s plan Irene Adler?	Why is Sherlock so special ?	0
311010	435221	316022	I'm in extreme stress/tension right now. Exam in 6 hours from now. What should I do?	What should I do during exam stress?	0
311011	435222	275205	Which products are more profitable in online sell?	Which products are most profitable to sell online?	1
311012	435223	435224	What interesting options does my 10 year old daughter have in co-curriculars to stand out?	Can I write the statement like this for course of formal languages and automata?	0
311013	118103	81269	What are some mind blowing phones gadgets?	What are some of the best phones gadgets?	1
311014	247159	435225	Is black not a color?	Is black a color?	0
311015	435226	435227	What are some facts about science?	What are some facts about science that liberals don't like?	0
311016	435228	435229	How much does the average Subway owner net?	How much do the Lakers owner make?	0
311017	435230	435231	Is fuel lock available for Honda Hornet 160R in Bangalore?	I cannot upload videos on Facebook now, what can I do?	0
311018	154019	435232	What are the best ways of falling asleep quickly?	Is there any natural way to fall asleep whenever I want to?	0
311019	435233	435234	What is the origin of colours?	What is the actual colour of the sky?	0
311020	435235	133455	What are some common bugs or vulnerabilities in a JavaScript application that you hope are tools for detecting but you could not find?	What are some major bugs that arise when testing a web application developed in AngularJS?	0
311021	435236	435237	What is the meaning of the song Taro by Alt-J?	What genre is the song 'Garden Of England' by alt-J?	0
311022	435238	435239	How do I force Arch linux with KDE plasma 5 to use 1680x1050 screen resolution?	I have KDE Plasma on my Arch linux: is it ok to install Gnome?	0
311023	435240	91083	What would be the correct order to watch the Fate series?	Where can I watch The Last: Naruto the Movie online english dubbed?	0
311024	297200	81111	Is it possible that Singapore will re-merge with Malaysia one day?	Is it possible that Singapore will be back to Malaysia in the future?	1
311025	435241	435242	Where can I buy good quality playable bouzoukis in Athens?	What should I start learning with for a beginner, VHDL or Verilog, for a career in VLSI front end?	0
311026	258859	149109	How do I deal with failure in programming?	How do you deal with failure?	0
311027	435243	435244	What is Jane Austen's message in Pride and Prejudice?	How has Pride and Prejudice by Jane Austen influenced your life?	0
311028	95190	435245	"How do i fix the ""No internet, secured"" wifi problem in windows 10?"	How do I fix problem with Windows 10 wallpaper?	0
311029	71696	148979	Who is the all in one astrologer in india?	Famous Astrologer in India?	1
311030	385453	435246	Do men or women have a better orgasm?	Do women have better orgasms than men?	1
311031	435247	435248	What is G-7?	What would you do with 7,500hrs?	0
311032	26962	21882	How do I hack a Whatsapp of another user without having access to their phone?	How can I read my husbands secret WhatsApp messages without using his phone?	1
311033	435249	435250	How do I grow wild onions in my lawn?	Why are wild onions growing in my lawn?	0
311034	435251	435252	Isn’t dream that come true sign of God? Recently my grandfather passed away. He was not in the same country as me. I got the message through whatsapp.	How important is to do job after completion of b.tech cant a student get a rest for 2,3 months? All want to do tht.	0
311035	435253	435254	What are some reviews for the millennium Shri Ram School in Faridabad?	Which is the best HR company in Faridabad?	0
311036	435255	435256	What makes a good business voicemail greeting?	"At what time is it okay to use,""Good evening,"" as a telephone greeting?"	0
311037	72588	218542	Which is the best headphone under 3K INR?	What are the best headphones under Rs. 3000 available in India?	1
311038	9017	79403	What is the best laptop under 30k for students?	What are the best laptops available under INR 30000 (30k)?	1
311039	435257	435258	Is Instagram Stories a copyright infringement?	Does Instagram Stories infringe copyright or any other corporate laws with regards to Snapchat?	1
311040	354712	435259	If there was an Oscar for 'best line in a bollywood movie' which line would win it?	"If there were an Oscar for ""best romantic line in a movie,"" which line would win it?"	0
311041	435260	435261	"How long will it take for an ""average"" person to be forgotten?"	How long would it take Santa to deliver presents to every child in the world?	0
311042	435262	435263	How do I properly implement Gaussian Blur in GLSL?	My rigidbody is fallen through the plain when I add gravity. All I want to implement is a jump function in Unity 3D. What should I do?	0
311043	46478	435264	What does mAh mean?	How many time want to fully charge a 3050 mah?	0
311044	435265	435266	Why do people get divorced? How much money do they lose?	Is there any way to get infinite money?	0
311045	82631	34953	How can you find the purpose of human life?	How do we know the purpose of our life?	1
311046	435267	435268	What is {0} +1?	What is 1×0+1?	0
311047	64788	140475	What are the things to do before die?	What are some good things to do before you die?	1
311048	318263	144938	What is the cure for chronic eczema?	Are there any effective cures for eczema?	1
311049	435269	435270	What are the qualifications for marketing?	What is your qualification?	0
311050	111609	55972	Can you pass a urine test for meth in 4 days?	Can you pass a urine test for meth in 6 months?	1
311051	435271	269666	"Does the ""Sorry, we're having technical difficulties right now."" error mean that I'm banned from OkCupid?"	I tried to review a message thread on OkCupid, and it's totally disappeared. If I search for the person in question, he's still got a profile; we're still going on dates, so I'm not sure what to make of it. Is this a bug, or was I blocked?	0
311052	435272	435273	I got a call today from this number 9534340901 & they said that they are calling from SBI head office?	Examples on cultural artefacts? \	0
311053	435274	435275	Do psychopaths believe they are superior to most?	Do you believe psychopaths are superior to empaths?	1
311054	435276	262824	Is losing two pounds a week healthy?	Is losing 2 pounds a week safe?	1
311055	435277	435278	My girlfriend broke up with me. Can she be happy?	How does one handle the mentally draining stress of being in a financial bind?	0
311056	435279	40232	How can a westerner practice yoga without appropriating culture?	What is cultural appropriation and why is it such a big problem?	0
311057	200525	14183	Is it healthy to eat apples every day?	Is it healthy to eat a tomato every day?	0
311058	435280	112279	Why do some people struggle with weight?	Why should people struggle?	0
311059	154981	214615	What does the B2B sales process look like in Taiwan particularly in terms of lead nurturing/inside sales?	What does the B2B sales process look like in Philippines particularly in terms of lead nurturing/inside sales?	0
311060	267466	2529	Why will Brexit Happen?	Is Brexit likely to happen?	1
311061	211804	26785	Why PM Narendra Modi scrapped Rs 500, Rs 1000 notes?how does it helps INDIA?	Why Modi banned Rs 500& Rs 1000 notes?	1
311062	435281	435282	Who would win in a fight: Luke Cage or Spiderman?	Who would win in a fight, Spider-Man or Luke Cage?	1
311063	32634	262119	What are different ways to deal with social anxiety?	What are tips or helpful tools to combat social anxiety?	1
311064	117825	265739	What are the best classic novels for teens?	What are the top classic novels worth reading?	0
311065	107328	106889	What is the valid reason for India only getting a few medals in the Olympics?	Why is India performing bad in Olympics?	1
311066	435283	435284	Can the back seat of R15V2 can be adjusted to a lower height?	I want a good mileage bike with a low seat height, as I'm a little short. Can I go for the Discover 100M or any other?	0
311067	435285	435286	What does it feel like to be a detective?	What is it like to be a detective?	1
311068	435287	435288	What is your perception about Tails Operating system?	What are your views about Tails operating system?	1
311069	38932	95117	What does it mean when a girl smiles at you every time she sees you?	If a girl smiles at me and waves at me, does it mean she finds me attractive?	0
311070	435289	435290	How can the education system in India be improved? Kindly mention point wise.	How can we Improve education system in India by e-Education?	0
311071	71508	6275	What are your views about governments decision to stop flow of 1000 and 500 rupee notes.?	What do you think of the decision by the Indian government to demonetize 500 and 1000 rupee notes?	1
311072	220409	435291	Why didn't Voldemort or Bellatrix know that Narcissa Malfoy was lying when she said that Harry was dead?	What is Narcissa Malfoy's wand made out of?	0
311073	387124	435292	What are the best interview tips?	What are some good interview tips?	1
311074	435293	435294	What is the charge of a CN ion?	What is the charge of an arsenic ion? How is it calculated?	0
311075	697	435295	Why do I keep getting fleas from my dogs?	What are the best ways to keep dogs from getting fleas?	1
311076	182091	36058	Has anyone had an encounter with a ghost in real life?	Has anyone ever seen a ghost in real life?	1
311077	435296	435297	How healthy is it to do fasted cardio and fasted weight training if you’re trying to build muscle mass but lose body fat?	Can you build strong muscles if you’re a female?	0
311078	435298	435299	What are good sources of information on embedded software testing and quality assurance?	Why does humans need god concept?	0
311079	175772	6844	How is school changing in the 21st century in Palestine?	How is school changing in the 21st century in Canada?	0
311080	20692	435300	Why is it dangerous to lick a 9-volt battery?	Is it dangerous to put a 9 volt battery on your tongue?	0
311081	435301	435302	There's this spanish song that I heard in a zumba class. It starts with something like Hazigaboo. Forgive me I don't know spanish. Anybody know it?	How does one assess small business health insurance options?	0
311082	8121	42092	What is the best way to learn about stock market?	How do you join and start investing into the stock market?	1
311083	144384	435303	What is the molecular shape of BrO2-?	What is the molecular mass of UF6?	0
311084	435304	102679	"What does ""onomatopoeia"" mean? What are some examples?"	What is onomatopoeia? What are some examples?	1
311085	70710	435305	How much does a full sleeve tattoo (from wrist to shoulder) cost?	Is a half sleeve tattoo worth the cost?	0
311086	435306	435307	Can we change thr date of birth in direct second year application?	Is Sente supported on macOS Sierra?	0
311087	82543	8077	Why is watching and playing snooker different?	Why is watching snooker different to playing snooker?	1
311088	435308	435309	What are some good Indian nicknames for my boyfriend? I call him baby / Champ sometimes.. He's very special to me, I want to call him something unique. Plz suggest.	My boyfriends mom doesn't seem to like me very much? Should this be a red flag to not marry him? I am a North Indian and have a South Indian boyfriend	0
311089	435310	179644	What are the applications that can use armature control to reduce speed and in the same time can use field control to reach the speed more than rated?	What are the applications that can use armature and field control in the same time in order to increase and decrease the speed?	1
311090	357441	435311	What is some information about the government exam preparation?	What's the best way to be updated about government jobs or competitive exams about their dates and methods of preparation?	1
311091	435312	15432	How tall will I be if I am 5'2 and I am 13?	How well can you predict a child's (adult) height from information about their parents?	0
311092	435313	435314	What does retrograde Jupiter mean?	What does it mean to have Jupiter, Saturn, Mercury, Sun, Moon in Libra in 6th house?	0
311093	435315	435316	"What does ""the singularity in a black hole is a future moment in time"" mean for someone inside the event horizon?"	How can I transfer contacts from Android to Huawei P9?	0
311094	310267	270381	How do I get a mechanical engineering job?	How can I get a job in mechanical engineering?	1
311095	140827	61564	I forgot my Gmail username and have no access to my recovery phone number. How can I re-access my Gmail account?	How would I retrieve my Yahoo account without access to my alternate email or phone number?	0
311096	277874	435317	What are the pink and white things in ramen?	What is the best ramen in Rome?	0
311097	435318	435319	Which is the best off page activities in 2017?	Which are best off page SEO activities for our website?	0
311098	354162	289140	How can I improve my answer quality on Quora?	How can I improve my answers?	1
311099	435320	435321	If someone is online in what's app but you don't get blue ticks, are they reading someone else's messages?	When you put someone in mute on whats app do their messages shows with 1 tick or 2 ticks?	0
311100	435322	435323	A white person and a black person are both dying. If all else is identical and you are absolutely forced to choose between them, who would you save?	Can a white person have black privilege?	0
311101	435324	435325	Why does snow appear white in colour while water is transparent / colourless?	What is the colour of green leaf which is placed in air from water?	0
311102	227917	435326	What is the best ambiance you have seen in techfest?	From where do I get IIT Techfest passes for 2014-15?	0
311103	44514	435327	"What is the difference between ""Regards,"" ""Best regards,"" ""Sincerely,"" ""Yours Faithfully,"" and all of the other formulations? Which one is the best to use in North America in an email conversation?"	Why do North America use different bands for LTE?	0
311104	435328	102152	Why are white people racist?	What makes people support racism? What makes people oppose racism?	0
311105	435329	435330	What is the right time to replace the brakes of my car?	What is the right time to sale my old car?	0
311106	435331	435332	What are all the bad things about Bruce Springsteen?	What does Bruce Springsteen yell out before some of his live performances?	0
311107	142934	435333	What is lymphatic system?	What are the components of the lymphatic system?	0
311108	435334	140230	What are the must watch movies (not documentaries) in the world that most of the people don't know?	What movies do you love that you think most people are unaware of?	1
311109	435335	435336	What is the difference between mathematics and science?	Does listening to music while studying help?	0
311110	435337	435338	What whale has the largest skull?	Which animal has the longest skull ever?	0
311111	233902	21485	Will Saina Nehwal win gold medel in Rio Olympics 2016?	Is India going to win any medals in Rio Olympics 2016?	1
311112	435339	100011	Does the Bible explicitly forbid homosexuality?	What does the Bible say about homosexuality?	0
311113	153030	158036	Which college should I take considering the factors: KMC Manipal or KMC Mangalore?	Can someone make a brief comparison of KMC Manipal and Mangalore?	1
311114	38299	181617	Why do dogs pee on vehicle tyres?	Why do dogs pee on tyres?	1
311115	435340	435341	Why do we have to depend on people for some thing or other?	Why are people dependent on other people?	0
311116	18108	16340	What is the Sahara, and how do the average temperatures there compare to the ones in the Dasht-e Loot?	What is the Sahara, and how do the average temperatures there compare to the ones in the Great Sandy Desert?	1
311117	435342	435343	How do I buy a car online?	How do I sell a used car online?	0
311118	56736	435344	How is wheat gelatin made?	What is wheat gelatin?	0
311119	96894	42375	Where can I get Pokemon Go Level hack?	What are some of the Pokemon go hacks?	1
311120	238635	9660	Which are the best headphones I can buy under ₹2000?	What are the best headphones under Rs. 2000 in India?	1
311121	435345	435346	What are the songs with the most meaningful lyrics you have ever heard?	What songs have the most meaningful lyrics?	0
311122	435347	435348	How can I learn cakephp?	What is the best way to learn cakephp?	1
311123	66355	155622	Who cleans your teeth at the dentist? Why?	Toothbrushing: How often do you brush your teeth?	0
311124	435349	435350	Why is sashimi healthy?	Which sashimi is the healthiest?	0
311125	143703	198260	How do I choose best laptop for programming?	What is the best laptop for a programmer?	1
311126	404359	435351	How are the provisions of the First Amendment of the United States Constitution different from the ones in the Second Amendment?	How are the provisions of the First Amendment of the United States Constitution different from the ones in the Third Amendment?	0
311127	61154	6991	How was Jayalalitha buried and not cremated being a Brahmin by birth?	Why was Jayalalitha buried and not cremated?	1
311128	435352	119732	What would have happened if the Spanish Armada had succeeded and England was invaded?	What would have happened if Germany had won WWII?	0
311129	37557	435353	What is the least painful way to die?	Is dying painfull?	0
311130	212155	181617	Why dogs tend to pee on the tyres of the parked vehicles?	Why do dogs pee on tyres?	1
311131	46674	159525	How do nude beaches in Punta Cana compare to other nude beaches in Jamaica?	How do nude beaches in Punta Cana compare to other nude beaches in Haiti?	0
311132	435354	435355	How do I use prepaid card with uber?	How one can save HRA for INR 15000 without landlords PAN copy?	0
311133	435356	435357	I'm 20. I like a 25 years old girl. How do I ask her out?	I'm 17 years old. I like this 20 year old girl. How Do I ask her out?	1
311134	435358	435359	What's the difference between Queen Nefertiti and Queen Nefertari?	What is Queen's English grammar?	0
311135	435360	435361	What is devlopment studies?	What is development studies?	0
311136	435362	435363	How do I become an augmented reality engineer?	How do you become an augmented reality designer?	0
311137	435364	78007	What's the best way to earn money for my pictures?	What is the fastest way to earn money?	0
311138	435365	435366	He said it's awkward for him to act the way he acts around his friends around me because I'm his girlfriend. But why would that be awkward?	Why are Democrats okay with forgiving Bill for having a sexual act with his intern but not okay with Trump for something he said 10 years ago?	0
311139	401104	435367	What's the best way to write a business plan?	What are some books that teach you how to write business/marketing plans or in a business way?	0
311140	435368	435369	What is the reciprocal of a smiley face?	What does it mean when a guy sends you a smiley face emoji?	0
311141	250301	435370	What information do police officers look up when they pull you over?	What do I say to a police officer when I'm pulled over?	0
311142	435371	435372	What are some good books available in the market to learn Microsoft Visual Basic 6.0?	From which book should I start to learn visual basic6.0?	0
311143	435373	435374	Why can't we see any city lights when the ISS is on the dark side of the Earth?	How come I am unable to see city lights from the ISS live feed?	1
311144	389998	435375	Which are the best private mba colleges in India?	What are the better MBA colleges in INDIA?	0
311145	435376	435377	Why was Ellen DeGeneres awarded a Medal of Freedom?	Why did Ellen DeGeneres get the medal of freedom?	1
311146	166329	435378	Why can't congressmen and senators who vow to be obstructionists and block every bill sent to the hill, be removed for not doing their jobs.?	In Islam, Jesus will return in the future to defeat the evil Dajjal. So where is he and what is he doing right now?	0
311147	435379	435380	What was it like working with Johnny Depp?	What is it like to work with Johnny Depp?	1
311148	435381	435382	What causes Netflix to not play on a Mac? How do you fix this?	How can I block Netflix from my Mac?	0
311149	236682	435383	Iltutmish's son Nasiruddin Mahmud was said to succeed him but he died.Who was his wife? Anything you know about his personal life rather than warlife?	Because of glaucoma, my grandpa recently has had his right eye blind and his left eye also seeing not well, which really frustrates him a lot. Doctors said it was no use to have a surgery on eyes at his age. And, he now behaves like counting the days to die. I'm upset about that. What can I do for him?	0
311150	435384	435385	At which moment of your life you felt the most the love?	What is the moment in your life where you felt the most betrayed?	0
311151	435386	435387	What is the best way to get fit at home?	What is the best way to stay fit when working in an office 60+ hours a week?	0
311152	435388	108695	Should I become a graphic designer?	Should I be a graphic designer?	1
311153	292372	435389	Is there a way to convert an audio file (mp3 or wav) to a MIDI file?	How do you convert an MP3 file to a MIDI file?	1
311154	408372	435390	What were the reasons for the Kalinga war?	Were Germans the only reason to start World War II?	0
311155	6551	38315	Why do people ask questions on Quora that are easily to find answers too on Google?	Why do people ask questions on Quora that are just as, if not more than easier to, look up with a search engine?	1
311156	75199	435391	Why does a girl get jealous?	Why does she get jealous when I talk to other girls?	0
311157	435392	435393	NASA has released near 10,000 pictures of the Moon; how can we use them effectively?	Can we build a Starship Enterprise with our current technology in the next 10 years?	0
311158	10846	30537	How can I find the right girl for me?	How do you find the right girl?	0
311159	435394	276211	Why are people on Quora so snarky?	Why are people on Quora largely pretentious?	0
311160	330884	185995	What universities does Trillium Therapeutics recruit new grads from? What majors are they looking for?	What universities does Spark Therapeutics recruit new grads from? What majors are they looking for?	0
311161	435395	435396	Which is better: IIM Ranchi or MDI Gurgaon?	What are reviews of the PGDHRM program at IIM Ranchi?	0
311162	435397	435398	Which phones do billionaire CEOs use?	What smartphones do billionaires in technology use?	0
311163	249031	96474	Which is the most upvoted comment on Quora?	What comment of yours has the most upvotes?	0
311164	435399	435400	What is the branch and bound algorithm technique?	What are the differences between LIFO and FIFO branch and bound techniques?	0
311165	435401	435402	Is there a way to do this?	Is there a way to find the alternative flight numbers on code share flights?	0
311166	171047	259249	Ashlee Vance: What are Elon Musk's political beliefs?	Ashlee Vance: What political ideology does Elon Musk subscribe to?	1
311167	402098	435403	What are some differences between city life in Chicago and NYC?	Where is the best place in the United States to live in your early 20s: NYC, San Francisco, or Chicago?	0
311168	23549	52212	Can the existence of time machine is possible?	Is a working time machine possible in the future?	1
311169	435404	429369	I have lost my Jio sim card so how can I get it back again?	From where can I get Jio sim card in Surat?	0
311170	435405	435406	What is it like starting a company after being an employee all your life?	How do I figure out what genre of music fits my voice?	0
311171	6613	46731	Height: How would a 14 year old increase his height?	Do running increase your height?	1
311172	276153	166553	When I get paid by Paytm by someone how do I transfer it to my bank account?	How do I transfer Paytm balance to bank account?	1
311173	435407	435408	The active cell can only be changed by entering a new cell reference in the name box, true or false?	Has any scientist created a living cell in the laboratory using chemicals not produced by living cells or remains of living cells?	0
311174	366151	435409	What is the salary of systems engineer for freshers in TCS India?	How much is a TCS salary for freshers in india?	0
311175	135708	435410	How can a skinny guy gain weight and develop a fit body?	How can a skinny guy weighing 130 pounds gain 20-30 pounds of healthy weight in short time without supplements?	1
311176	420221	82860	How can I learn java for android development?	Should I learn Java for Android development?	1
311177	435411	435412	What goes well with Hollandaise sauce besides Eggs Benedict or any of its relations?	What type of sauce goes well with Sweet Potato Fries?	0
