id	qid1	qid2	question1	question2	is_duplicate
162179	252532	252533	What is the use of horseshoe crab blood?	Which companies buy horse shoe crab blood?	1
162180	252534	252535	What is leukoderma and what are the symptoms of it?	What are the symptoms of inflammation? How is it diagnosed?	0
162181	185150	252536	For physics, which is the best book to crack NEET?	Which is the best book of physics for cracking aipmt?	0
162182	252537	252538	How much does it actually cost to study in the US, particularly for Indian students?	How much does it cost in INR (Indian rupees) for a two year master's degree in computer science in the US?	0
162183	252539	252540	I'm developing software for someone and they refuse to pay until I add tons of features not in our signed agreement. What action should I take?	Can you demonstrate that gratitude is a basic, universal moral obligation?	0
162184	13756	6748	How can I improve English speaking skill?	How can I improve my communication skill and English proficiency?	1
162185	229743	252541	Which of America's founding fathers were more religious and which were less religious?	Why do many Americans believe that the Founding Fathers were Christians when the majority, were in fact, Deists>?	1
162186	252542	252543	Do Indian men treat women badly?	Do men from india treat women badly?	1
162187	252544	252545	What do NSITians think of IT-BHU (Now IIT-BHU)?	I am 27 years old and I want to be cricket . can I make to be a cricket?	0
162188	191186	148897	What is the advantage of Internet?	What are the benefits provided by Internet?	1
162189	252546	193968	What is the best chocolate cake recipe with icing?	What is the best recipe for flourless chocolate cake?	0
162190	252547	117188	What's the best way I can remove bubble gum off my daughter's face?	What can I do to fade acne scars on my face?	0
162191	252548	252549	What is the use of Hall effect sensors in smartphones?	What is the hall effect thickness sensor?	0
162192	33029	129101	Why do non-deserving people get everything and those who do struggle very hard for years?	Why is that some people get what they want very easily while others have to struggle for the same?	1
162193	252550	252551	How can I know about Alfresco Aikau?	Are over 15 million Australians descendants from the U.K and Ireland?	0
162194	21674	252552	What are the good startup ideas?	Is it a good idea to build my startup in Go?	0
162195	252553	120461	What are some laws that should be made to control the high levels of animal trafficking in Mexico?	What are some laws that should be made to control the high levels of animal trafficking in China?	0
162196	44173	252554	Where can I find free Premiere Pro title templates?	Why did Adobe Premiere Pro remove a lot of their transitions? And where can I get free transitions?	0
162197	47257	112136	What Quora mean?	What is the Quora means?	1
162198	252555	252556	What does a nonprofit treasurer need to know?	What are the roles a college treasurer might have?	0
162199	9007	29359	How could I be fluent in English?	How can I improve my communication skills in english?	1
162200	252557	252558	Is there a way to overcome heat intolerance?	What is paradoxical about Levinthal paradox?	0
162201	252559	252560	Why did Vanossgaming and Miniladd stop playing together?	I ordered CoD: AW DVD to play over the weekend online, but it's updating with an ETA of 15 hours. Is it normal? Can I stop it?	0
162202	34524	1842	Is vacuum energy infinite?	Is the potential energy of vacuum energy, virtual particles and/or dark energy infinite? NO MERGE	1
162203	252561	252562	Why are some Indian girls rude to guys who try to approach them?	As an Indian guy why do I find it easy to approach white girls, but difficult to get entertained by them?	0
162204	252563	213133	Which book is prepared for CS Executive company law?	Which book is the best reference for a CS executive in both modules?	0
162205	252564	252565	Why did Michael Jackson undergo so much plastic surgery?	What might Michael Jackson have looked like at the year of his death had he never elected to have plastic surgery?	0
162206	252566	252567	Where can I find free assets for Unreal Engine 4?	Which game engine should I learn: Unity 5.0 or Unreal Engine 4?	0
162207	211564	66286	How do I make studying fun?	How can I make studies more interesting?	0
162208	252568	252569	What is a good treatment for cramping muscles?	What are good muscle relaxers for cramps?	0
162209	252570	252571	What are the pros and cons of socialism?	What is socialism? What are the pros and cons?	1
162210	252572	252573	Is the ATM business still viable?	How profitable is the ATM business? Is it still a viable business?	1
162211	252574	252575	Is an MBA in India highly overrated? Why or why not?	Jobs in US after MBA in India?	0
162212	252576	252577	How do I make $5 dollars a day online?	How do I earn 5 dollars a day online?	1
162213	252578	252579	Why is Pep Guardiola Going To Manchester City?	How did Manchester City improve under Pep Guardiola?	0
162214	252580	21840	Soundtracks: Which are some of the greatest choir songs in movies?	What are the best movies of all time?	0
162215	252581	252582	How can I download Tumblr videos on my phone?	How can one download videos from YouTube to an Android phone?	0
162216	252583	252584	Should I start smoking?	What are some good reasons to start or continue smoking, and what are some of the benefits of smoking?	0
162217	39755	23070	Can we expect time travel to become a reality?	Is time travel to 2010 possible?	1
162218	252585	252586	How does iOS 8.1.1 perform on iPad 2?	How does iOS 6 perform on iPad 2?	0
162219	47481	252587	What is the most embarrassing photo you have ever taken of others?	What are some of the most embarrassing photos ever taken?	0
162220	252588	92337	What is best way to to become a good cyber security analyst?	What is the best way to learn Cyber Security?	0
162221	42041	15408	Which is your favorite bollywood movie in 2016?	What is the best Bollywood movie of 2016?	1
162222	252589	252590	What are the best ways to cook winkles?	How do I cook winkles in a microwave?	0
162223	252591	252592	What are the questions usually asked in an amity interview?	What questions are usually asked in an amity interview?	1
162224	64671	13099	How should I learn how to believe in myself and stop with the negative self talk?	How do I stop negative self-talk and judging people?	1
162225	252593	252594	Do I need a medical test for the visa interview to the US?	Do I need a midical test for the visa interview to the US?	1
162226	10671	27380	What are the safety precautions on handling shotguns proposed by the NRA in New Hampshire?	What are the safety precautions on handling shotguns proposed by the NRA in Idaho?	1
162227	9483	25734	Why do bad things seem to happen to good people?	Why would bad things ever happen to good people?	1
162228	153294	252595	How do I initiate a conversation with a girl?	What is the best way to start a conversation with a girl?	1
162229	252596	252597	How do I cure skinny fat?	How do I become skinny if I'm skinny fat?	1
162230	252598	252599	"Where does the word ""Hurriya"" come from?"	Where does the word no come from?	0
162231	252600	252601	Should I use iCloud or Dropbox on my Mac?	How will iCloud be better than Dropbox? Music?	0
162232	252602	252603	What are the top tips for getting into Watergate in Berlin?	What is the best place to get frozen yogurt in Berlin?	0
162233	237964	23596	What would be the impact of GST in india?	What is the use of GST bill?	1
162234	6867	252604	Can I make 10,000 a week betting on horses?	Can you make 50,000 a month betting on horses?	0
162235	149195	174639	How do you know if it's lust or love?	How do I really know if I love or lust after a girl?	1
162236	252605	252606	What can be some cool & innovative ideas that can be used in smart TVs using the IoT (Internet of things)?	How can I connect my laptop display to my smart TV wirelessly?	0
162237	34010	252607	Where can I find best hotels at Bhopal?	Where can I find best hotels in Bhopal for a holiday stay?	1
162238	76055	48191	What do you think about Donald trump?	What do you think about Donald Trump in September?	1
162239	252608	252609	What are Mike Tyson's fastest knockouts?	How good was Mike Tyson as a boxer?	0
162240	252610	148056	How do you remove wax from a tablecloth?	How can I get wax stains out of a tablecloth?	1
162241	204956	92340	What is the Minimum pay or salary for a chartered accountant?	What is salary for chartered accountant in India?	1
162242	252611	252612	How do metaphase and anaphase differ?	What are the best ways to roast frozen pork?	0
162243	252613	252614	How do I write a professional report of the development of my iOS app?	Can iOS app development be done on ubuntu?	0
162244	73772	36028	How do crop circles form?	What is a crop circle?	1
162245	252615	252616	How easy is trampoline in the Olympics?	Received warning letter from Capgemini after absconding in a month, what legal actions can they take?	0
162246	220087	252617	How is deforestation harming Latin America?	In my new house bathroom tiles shows patches what will be solutions?	0
162247	252618	252619	How do I transform acoustic guitar into an electric guitar?	Why do most arts and humanities students fear science and technology?	0
162248	252620	252621	Does Parachute's coconut oil really have 100% pure coconut oil?	How safe are Indian coconut packaged oils? Are they pure or made from mineral oil?	0
162249	7338	34450	What is the quickest way to get meth out your system?	What is the best way to flush methamphetamines out of your system?	1
162250	252622	252623	What are some mind-blowing facts about the planet Mars?	What are some facts about mars?	1
162251	118649	252624	How do i know who visited my Facebook profile?	Is there any option on Facebook to know who has / how many people have visited my profile?	0
162252	252625	156879	How can I learn ENGLISH faster?	How can I learn to speak faster?	0
162253	252626	252627	Why didn't Draco confirm Harry, Ron and Hermione's identities when they were brought to Malfoy Manor?	Why draco didn't told bellatrix about Harry's true identity at malfoy manor?	1
162254	252628	252629	What is the significance of Kodaira's classification of elliptic surfaces?	What is the significance of Jacobi elliptic functions?	0
162255	15349	87924	What's the best programming language to learn in 2016?	What are the best programming languages for beginners and why?	1
162256	252630	252631	Why do most cartoon books use uppercase letters?	Why are comic books written only in capital letters?	1
162257	252632	252633	Why does everyone blame Jawaharlal Nehru for the situation in Kashmir?	Why do people blame Nehru for Kashmir issue?	1
162258	149876	252634	I have an overall low percentage of 55 in engineering. Can I get admission into top tech colleges for a MS in the US if I am confident I can crack the GRE with a good score?	Will a SCJP certification help me to get admission into top US colleges for a Masters in CS? My GRE score is 328/340 and under graduate percentage is 74.	0
162259	252635	252636	What are today's parenting issues?	Am I eligible to apply for MNC if my graduation is from non UGC but post graduation is from UGC approved college?	0
162260	252637	78559	How can I accomplish more every single day?	How do I get motivated every single day?	0
162261	252638	252639	Is there a proof of male virginity?	Do males have virginity?	1
162262	252640	252641	I am a JEE aspirant (very weak at ray optics). How should I proceed?	I am a JEE 2016 aspirant. I am very much tensed by my performance in the test (66 centre rank which used to be under 20). What should I do now?	0
162263	252642	252643	"What is a really good analysis on the poem ""Fifteen"" by William Stafford?"	"What is a really good analysis of the poem ""Fifteen"" by William Stafford?"	1
162264	252644	252645	How do you make celery taste better?	How do I make oatmeal taste better?	0
162265	252646	252647	What will happen if you wash your hair with soap, like Lux?	Is it okay to wash your hair with soap instead of shampoo?	0
162266	252648	252649	If a father with an O blood type and a mother with a B+ blood type, what will be the child’s blood type?	Can a mother with blood type O and a father with blood type B have a son with blood type AB?	0
162267	252650	252651	What rights did women have under pre-Islamic Arab tribal law?	How does the media portray India in your country?	0
162268	137914	104093	Which are the best IAS coaching centers in india?	Union Public Service Commission (India): What are some good IAS coaching centers in Mumbai?	0
162269	31806	93521	How do I get a slim face?	My face is fat. How do I slim down my moon face?	1
162270	4639	101810	Why can I not add my friend back on Snapchat?	Why won't snapchat add someone?	0
162271	186562	61000	What is indicative of someone with borderline personality disorder?	What are the symptoms of borderline personality disorder?	1
162272	10819	36668	You've got 24 hours to live, how will you spend your last day on Earth?	What if you got to know that this world will end tomorrow, and you just have 24 hours to live, What are the last things you would like to do?	1
162273	252652	252653	What is the difference between Turk, Turkish and Turkic?	What's the difference between Turkic and Turkish?	0
162274	1025	165044	What is the best place to have sex from?	What time of the day is best for sex?	0
162275	252654	51663	Who is marking my question on Quora as needing improvement and what are their reasons?	"What should I do if Quora marks my question as ""Needs Improvement""?"	0
162276	252655	252656	How do you know that you're fucked up?	When you came to know that you are fucked up?	1
162277	252657	252658	Is it illegal If a 17 year old boy gets a 15 year old girl pregnant in Tennessee?	How a 15 years old girl get into modeling in Morocco?	0
162278	121257	252659	"Which is worse for the engine, putting diesel in a ""petrol car"" or petrol in a ""diesel car""?"	I drive about 2500Km a month in Delhi. Should I buy a diesel or petrol engine car for the purpose?	0
162279	252660	252661	Why the boiling point is not a colligative property?	How is the boiling point affected by colligative properties?	0
162280	252662	252663	What are some common misconceptions about the Scandinavian countries?	How does writing an article in law review help you to become an actual practicing lawyer?	0
162281	252664	252665	What are the best TV series worth watching in the English language?	Which are the best english TV series I should watch now?	1
162282	252666	252667	Does the Implanon (birth control) has a side effect of gaining weight?	Why are all diets about losing weight? I need to gain weight fast and effectively?	0
162283	48397	252668	How do I take decision?	Is always the rational decision the best decision?	0
162284	252669	252670	Is CarRentals.com reliable?	Is tradingeconomics.com reliable?	0
162285	252671	252672	How can I become a call boy in  Bangalore?	How do I be a call boy in Bangalore?	1
162286	14926	114804	What is the best way to lose weight and not gain it back?	What is the best way to reduce weight?	1
162287	252673	252674	Why did Drew Seeley sing for Zac Efron in High School Musical?	What is the Snapchat of Zac Efron?	0
162288	252675	47316	What are some of the worst questions asked on Quora?	What are the wittiest and funniest questions on Quora?	1
162289	252676	35812	Can I use a VPN to access iOS apps in United Kingdom?	I am looking to do a 3 year Law degree (LLB) in United Kingdom. How can I become a Lawyer in the United States (specifically New York)?	0
162290	252677	252678	What causes the glow of luminescent sea life?	What is the significance of bioluminescence?	0
162291	252679	252680	Why did Socrates hate democracy?	How do I enhance my english speaking skill?	0
162292	252681	252682	What do I need to know when starting a fabless company?	How many people do you need to start a good company?	0
162293	252683	252684	How difficult is renting an apartment for a month in Berlin?	What's the best way to find/rent an apartment in Berlin?	0
162294	205642	252685	Do you think Trump wrote his immigration policy speech or was it written by someone else like the Center for Immigration Studies?	Is it a bad idea to go for graduate school or to immigrate to another country if I don't want to work for someone else too long?	0
162295	85757	85526	Why is India bothered about CPEC?	Why is India frustrated and upset by Pakistan CPEC?	1
162296	140268	252686	In a non-leap year, which is greater: the mean number of days per month or the median number of days per month?	What is the average number of days on which you do not receive any email in a 365-day year, given that average number of emails received per day is 5?	0
162297	32863	90083	What is a good website for free ebooks?	What are the sites to download free eBooks?	1
162298	252687	159090	How and when did you lose your virginity?	Why did you lose your virginity?	0
162299	252688	252689	How do you get rid of bugs under the bed?	How do you get rid of bugs that live in your beds?	1
162300	252690	252691	How long do attack dogs live?	How long do dogs live?	0
162301	49775	149810	Which is better: Ps4 or Xbox one?	Which is better PS4 or Xbox one?	1
162302	252692	252693	What are some tips for when you are building your own laptop from scratch?	What is the best way to build your own laptop from scratch?	1
162303	252694	252695	What is a good inpatient drug and alcohol rehab center in Collier County FL?	What is a good inpatient drug and alcohol rehab center in Gulf County FL?	0
162304	252696	252697	How can we contact you?	How can I contact you?	1
162305	252698	252699	Is memory interleaving useful in a system with pipeline processing?	What will appear after registration?	0
162306	252700	252701	What are some sad indie songs?	What are some good, sad indie songs?	1
162307	252702	252703	What did some famous mathematicians do when they were young (under 20)?	What is the routine of most famous scientists and mathematicians?	0
162308	252704	252705	What are some interesting open source projects in Cryptography?	How beneficial is joining open source project?	0
162309	8222	98471	How should I forgive myself?	How do you forgive?	0
162310	22743	252706	What should I do if Amazon delivers a package to my door and then the package disappears (presumably because a passer-by might have taken it)?	How is it cheaper to pay staff a low wage and make them work overtime than hire more qualified staff at a higher wage to work more reasonable hours?	0
162311	22376	252707	In India what is the difference between a cognizable offence and non cognizable offence?	How does a civil offence differ from a criminal offense?	0
162312	252708	252709	How much do you earn by affiliate marketing?	How much you can earn by being affiliate of Kachhua?	0
162313	252710	243814	When was the Punnett Square developed?	How do you do a Punnett square?	0
162314	252711	252712	Is the movie My Name is Khan based on a true story?	What is your review of My Name Is Khan (2010 movie)?	0
162315	252713	2026	Who do you think will win the 2016 US presidential elections and whom do you want to win and why?	Who will win the 2016 U.S. presidential election and why?	0
162316	246620	252714	What is the difference between the left wing and the right wing? What is the difference on a basic level & on a hardcore politician level?	Is Al-Qaeda more right wing or left wing?	0
162317	252715	252716	What are the tradeoffs of client-side rendering vs. server-side rendering?	What are some good ways to render JSON as HTML on the browser-side using JavaScript?	0
162318	252717	252718	What are some of the rock bands that are close to Pink Floyd's style?	Can anyone suggest me bands like Pink floyd?	1
162319	28488	23782	180*0::2.5.1::4.9*1.9 ^! |! Avg Antivirus Tech Support Customer care Service Number?	Instant support @! 1800:||:2,5.1:||:49.1,9 for Avg Antivirus Tech Support phone number?	1
162320	13016	2083	What happens if I report an account on Instagram will that person find out it was me?	How do I know why I was blocked from Instagram?	0
162321	252719	252720	Why does Canada still accept Queen Elizabeth as its head of state?	Who is Canada's head of state?	0
162322	252721	36480	Why isn't anyone answering my questions?	Why wont anyone answer my questions?	1
162323	252722	252723	Did the US win the war in Afghanistan?	Can the US win the war in Afghanistan?	0
162324	154458	252724	Does Emma Watson have a boyfriend?	What does Emma Watson do?	0
162325	56613	29608	What will be the effect of possible war between India and Pakistan on Indian Stock market?	What will be the disaster effect, if nuclear war breaks out between India and Pakistan?	1
162326	181571	233442	What is the importance of education to the United States and how are their views of education different from Hungary's?	What is the importance of education to the United States and how are their views of education different from Germany's?	0
162327	150151	230544	What are the most charming small towns in Turkey?	What are the most charming small towns in Germany?	0
162328	173509	95923	How do I identify a sociopath?	How does one recognize a sociopath?	1
162329	252725	252726	Where can I find reviews for the Philips Norelco g370 charger?	My Philips QT4005 (trimmer) charger has stopped working. It's hardly been a week since I bought it. What should I do?	0
162330	252727	252728	Is the day following your birthday the most gloomy day of your life?	How can I make my today's day the most memorable day of my life (It's my birthday today)?	0
162331	198910	22286	Is there any proof that Extra Terrestrial person live?	What is the most convincing proof for extra terrestrials?	1
162332	252729	252730	What is the syllabus of the GATE for mechanical engineering?	What is the syllabus of the GATE?	0
162333	252731	252732	How do carbon dioxide be converted into oxygen?	How can I convert carbon dioxide into oxygen?	1
162334	252733	252734	Don't know what happen to my friend (girl) stopped messaging to me or talk to me..no reason what to do?	Which combat sport currently generates more money: MMA (UFC) or Boxing?	0
162335	24614	252735	What to do with the so-called jew?	Do American men who wear yarmulkes in professional settings do so more for religious reasons, or more because they want to culturally affiliate with other Jews?	0
162336	118396	252736	What is the antonym of “funny”?	What is the antonym of abbreviation?	0
162337	252737	252738	What is so great about Harry Potter - the series?	What did you hate the most about Dumbledore in the Harry Potter series?	0
162338	54602	137070	Can I increase my IQ?	How can I expand my IQ?	1
162339	252739	252740	What are some tips for ignition cylinder replacement?	How do you replace a ignition lock cylinder?	0
162340	252741	252742	Dinosaurs lived around 100 million years ago. Humans appeared around 2 million years ago. What happened in between?	If dinosaurs as well as most life was extinct about 65 million years ago, how do we have life now?	0
162341	252743	189129	How do I get American channels like CBS, FOX, AMC in India with the DishTV service provider?	On Roku, can I get network channels (ABC, ABC Family, NBC, CBS, FOX, CW) and view full episodes of current shows? Is it free or only through subscription services like HuluPlus?	0
162342	252744	252745	Who is the present Governor of RBI?	How is governor of RBI appointed?	0
162343	252746	252747	Are there any good reasons to make all criminal defenders public rather than paid for? Or would the system all fall apart?	Should wealthy people be forced to use the same defense attorneys that poor people use?	0
162344	31548	12825	If I delete my WhatsApp account permanently, will my friends still be able to see the previously sent messages (from me) on their phones?	If I block a person on WhatsApp and if the person happens to be in WhatsApp groups of which I am also a part of, will I still be able to see his/her messages in the group?	0
162345	252748	252749	Was Prophet Muhammad a black African?	Who killed prophet Muhammad?	0
162346	252750	252751	Why is the cure to tintu virus not been created yet? Why Are the people across world not working to invent cure virus? Are human too lazy to do it?	Why have humans not invented a cure for cancer when we are able to manipulate atoms?	0
162347	252752	252753	How do I become a nerd?	What should I do to be a nerd?	1
162348	252754	184231	In how much time can I learn Python?	Why should I learn Python if I already know Java?	0
162349	252755	252756	What was the funniest photo ever taken?	What is the funniest photo you have ever taken?	1
162350	87072	104860	What are tracer rounds? Are they legal for the public to possess in the state of Colorado?	What are tracer rounds? Are they legal for the public to possess in the state of Idaho?	1
162351	252757	252758	Why the ones we love doesn't stay?	What are the chemical formulas for Magnesium Sulfate, Nickel Chloride, and Copper (II) Sulfate with Water?	0
162352	106927	252759	Why would somebody text me first, but then deliberately ignore my message for hours when I reply?	Why does a guy try to bring me down when I haven't inflicted any harm on him? In fact he only messages me so that he can ignore me when I reply him.	0
162353	252760	252761	What kinds of things really make you laugh? Why?	What kinds of things really make you laugh?	1
162354	252762	163749	What can you substitute for apple cider vinegar that has similar health benefits?	What is the best substitute for apple cider vinegar?	1
162355	252763	252764	What are the differences between SAP and ERP softwares?	Is there a difference between ERP software and a web koisk?	0
162356	252765	7341	What is it like to live in San Francisco in 2015?	What is it like to live in San Francisco?	0
162357	35940	184724	How can I earn money as a student?	How can I earn as a student?	1
162358	252766	252767	What is the best tool to optimize images for the web?	What is the best image format for web?	0
