id	qid1	qid2	question1	question2	is_duplicate
171176	264544	264545	What are some common ideas that can solve the regular problems faced by Indian villagers?	What are some ideas that can solve the regular problems faced by Indian villagers?	1
171177	264546	152205	Is a solution a homogeneous mixture?	What is a homogeneous mixture?	0
171178	146563	264547	Why do some people's eyes change color when they grow up?	Why do some people's eye colors change with their age?	1
171179	264548	264549	Why do people think Asians are so good at math?	Why do people always assume that Asians are smart and good at math?	1
171180	121722	264550	How long does it usually take for Twitter verification team to respond after the form has been filled?	How long has Miley Cyrus been on Twitter?	0
171181	60650	264551	What is the policy on bringing guests to a Planet Fitness?	Does Planet Fitness have a sauna?	0
171182	264552	264553	What is the difference between couple and moment?	What is the difference between bending moment, torque, couple, and moment? What units are used to measure each?	0
171183	7525	70072	What is the best certification course to learn digital marketing?	Where can I find an online course for digital marketing?	1
171184	32413	141310	How can I join Indian Air Force after be in mechanical engineering?	How do I join IAF after mbbs?	1
171185	264554	264555	What makes a person unlikable?	What makes people unlikeable?	1
171186	43864	264556	Is there any trick to download Torrents with 0 seeds?	μTorrent: Why isn't my download speed zero when a torrent has finished and is seeding?	0
171187	13749	60274	How will scraping of 500 and 1000 rupees notes help in curbing corruption and black money?	Would banning notes of denominations 500 and 1000 help to curb the black money in system?	1
171188	264557	264558	Can a parents' divorce contribute to their child's sociopathy?	Is it right for a parent to hate their child based on the child's sex preference?	0
171189	264559	264560	If all humans descend from a single original population of ancestors in Africa, then how did humans with different skin colors come about?	What are humans evolving into, or out of?	0
171190	264561	264562	Is Uber a transport company?	Is Uber a technology or transport company?	0
171191	37906	143159	How can you delete your Yahoo account?	How do you delete your Yahoo account permanently?	1
171192	264563	264564	What is the difference between grid computing and a computer cluster?	What is the difference between grid computing and distributed computing?	0
171193	182593	264565	What should I know before buying a house?	What should I know before buying a house in Europe?	0
171194	264566	264567	Whose DTH services are better, Dish TV, Videocon or Tata Sky?	Is Videocon DTH good?	0
171195	183081	113810	Is it safe and healthy for dogs to eat cooked rib bones?	Why shouldn't dogs eat pork rib bones?	1
171196	128116	40100	How do I get my startup funded?	How can I get funding for my startups?	1
171197	264568	264569	What are the most critical metrics To measure the success of a content based mobile app?	What instrumental does Dr. Dre use in his commercial with Kendrick Lamar for Beats By Dre?	0
171198	264570	9882	If Saudi Arabia were sued for 9/11 in US courts would it win?	What would be the repercussions if the US sued Saudi Arabia for funding 9/11 and other terrorist activities?	0
171199	264571	264572	Is there a backlit keyboard in HP pavilion 15au101nx?	Can I add an SSD to HP Pavilion 15-au134tx?	0
171200	133146	264573	Which are the best colleges for electronics and instrumentation engineers if you want to study abroad?	Which is the best book to study electronics basics required for electronics engineering?	0
171201	264574	264575	What are some limitations on the United Nations Security Council?	What are criticisms of the United Nations Security Council?	0
171202	46818	17381	How do I write an article for a magazine?	How do I write a good article for a magazine?	1
171203	264576	264577	What are corrosion control methods?	What is the chance of picking a spade or an ace not of spade from a pack of 52 cards?	0
171204	36399	264578	How does one become the presidents personal bodyguard? What additional powers do the bodyguards exercise?	Once a presidential candidate is given Secret Service protection, what if the candidate wants his old bodyguard to guard him?	0
171205	264579	264580	Did AdMob ads stop showing when the Android package name was changed?	How can I set up AdMob to show house ads 100% of the time?	0
171206	188453	264581	What do dreams about being killed mean?	What could a dream about being shot in the chest mean?	0
171207	264582	25011	Who is the most unpopular President of India and why?	Who is the President of India?	0
171208	214184	6782	What is your all time favorite book?	What is your favorite book of all time and why?	1
171209	132114	54339	What is the process to determine the density of aluminum and how does nickel compare?	What is the process to determine the density of aluminum and how does gold compare?	0
171210	264583	264584	Why are people so possessive in relationships?	Why are some people so possessive in relationships?	1
171211	89287	264585	What should we follow on Quora?	What should I do so that others follow me on Quora?	0
171212	152628	264586	What do you think about iOS 10?	What is your review of iOS 10?	1
171213	264587	264588	What size diamond engagement ring is too large and considered tacky/gaudy?	Do the chinese wear engagement rings or large diamonds?	0
171214	264589	264590	What is the training period for a fresher in associate system engineering at the IBM GBS? What are the locations that I can get?	What are the possible posting opportunities for Associate System Engineer Domain web developer portal at IBM GBS?	0
171215	264591	264592	Did Germany and Japan collaborate during the WW2 or were these 2 separate wars?	If the Spanish army under Franco were to join the Wehrmacht fully in Germany's Eastern front during World War 2, would it have made any change to the outcome of WW2?	0
171216	109383	264593	Can a court judge in New York force my husband to give me Islamic divorce after he grants the civil divorce?	Can a court judge in New York force my husband to give me Islamic ivorce after he grant the civil divorce?	1
171217	264594	264595	Any Australian radio station to wish happy birthday to my girlfriend?	How do I wish a girl happy birthday just by knowing the month?	0
171218	100902	264596	Is it unhealthy to swallow one's own phlegm during a cold or a flu? Are there any ill effects or benefits from swallowing or not swallowing phlegm?	Is it dangerous to swallow mouthwash?	0
171219	264597	15432	I'm 6'4 at 13 and my dad is 6'1 and my mom is 5'8-5'10, doctors said I should be around 6'7, how tall will I be?	How well can you predict a child's (adult) height from information about their parents?	0
171220	264598	38699	How do I get a job at NASA after doing a B.E EIE from India?	How do I get a job in NASA from India?	0
171221	33250	104968	What are the Hollywood movies that are a must watch?	What are the must watch movies from Hollywood?	1
171222	264599	264600	Mercury in the 7house Taurus ascenfant?	How do you show that a function has at least one solution given a certain interval?	0
171223	650	264601	How do I know if someone blocked my texts?	Is there anyway of knowing if my green texts are blocked?	0
171224	14167	8240	What is the best way to learn white hat hacking?	What are the best way to learn hacking?	1
171225	264602	264603	2 wolves and a lamb vote on what's for dinner argument (tyrannic majority) is often made for electoral college. But is it truly democratic?	What is CADViewer JS? Like how to integrate it in j2ee web application? And how to run its software and server?	0
171226	77054	83828	What is the most important decision you have taken in your life so far?	What was the most important decision you ever made in your life? And how did it change your life?	1
171227	264604	184067	How do I start a conversation with a girl whom you have never talked but only met on internet?	Facebook: How can I start and keep the conversation going with a guy I have never been talking to before?	1
171228	264605	264606	Which is the worst argument in the world?	What is the worst argument in the world?	1
171229	17746	93515	How do i get started on machine learning?	what steps should I follow to learn machine learning?	1
171230	264607	264608	Why do most people wake up when the moving car or bus stops?	How do I wake up early in the morning and stop procrastinating?	0
171231	264609	264610	What are some ways to make Hamburger Helper cheeseburger macaroni?	How do you make a Hamburger Helper cheeseburger with macaroni?	1
171232	264611	264612	Would you be interested in health services that help you improve your lifestyles (diet, activity, habits) to prevent disease?	What are your ultimate dream sports match ups?	0
171233	264613	264614	Between Laravel, Django and Rails, which framework allows for easy database portability and reuse of logic and functionality?	Which framework (Rails 5.0.0 or Django 1.9) I must learn to work in Toronto as a web developer?	0
171234	7247	264615	Is there any commerce-field related internship in ONGC?	I am interested in neural engineering, neuroscience and artificial intelligence. Is there any relation between these three fields?	0
171235	264616	222898	Which is the oldest ocean on Earth?	What's the biggest ocean on Earth?	0
171236	35652	489	If energy is created (as it's not conserved in our expanding universe) can infinite of it be created? If yes, is potential energy/potentiality infinite?	If dark energy is created with expansion can infinite of it be created?	1
171237	264617	264618	What are the best places to visit around Delhi?	What are the best places to visit in New Delhi, India?	1
171238	264619	264620	How do Pakistan take Bangladesh now as they are growing faster?	Why is Bangladesh developing faster than Pakistan?	0
171239	38511	96761	India: What are some things that make Indians happy?	What are some things that makes Indian's happy?	1
171240	264621	264622	What are some views on Francois Gautier?	How do people develop nihilistic views?	0
171241	264623	264624	Why do I usually feel dizzy and an urge to throw up after a leg training?	Why do I feel dizzy after standing for long time? What can I do to improve my stamina?	0
171242	207630	152681	How do I start my own country?	How would you start a new country?	1
171243	264625	264626	Which is the best commuter motorcycle in Mumbai?	What is the best motorcycle for daily commute in Bangalore?	0
171244	98621	47115	How do I add an image to a question on Quora?	How do I post an image in Quora?	1
171245	8507	137255	What are the differences between the Dell Inspiron 3000, 5000, and 7000 series laptops?	My Dell Inspiron 3000 series laptop has Nvidia GeForce 820m GC, 1TB HDD, 8GBDDR3 memory, Intel Core i5. Works very slow, any solution to fix it?	0
171246	264627	264628	What are benefits of learning Android?	What are the benefits of learning android?	1
171247	216808	264629	Indian Music: What are the best feel-good Telugu songs?	Which is best Indian song ever?	0
171248	264630	264631	How do I buy ticket for Apple Music Festival 2016 in London?	My Gmail has stopped syncing suddenly. What to do?	0
171249	92158	264632	What questions can I ask my girlfriend to find out if she loves me?	What five questions should I ask my girlfriend to find out if she really loves me?	1
171250	264633	264634	What are the best streaming servers?	What is the best streaming software and streaming server?	0
171251	264635	259925	What are the best places to visit in and around Mumbai?	What are the best places to visit in Mumbai?	0
171252	102780	87914	How do I contact someone on Quora?	Can I send message on Quora?	1
171253	264636	264637	What is the difference between round the clock and around the clock?	What's the point of these US debt clocks I see around NYC?	0
171254	264638	264639	I'd like to know, what's the Management Quota in medical colleges in India? Does it still exist after introduction of NEET?	If neet-ug is re introduced in India will private medical colleges stop taking donations and does that mean there will be no management seats?	0
171255	37772	249427	How would the bilateral relationship between India and the USA be under Hillary Clinton's presidency?	What will be Hillary Clinton's strategy for India if she becomes US President?	1
171256	264640	264641	What is the explanation for the ending of the movie The Prestige?	What is Prestige movie twist?	0
171257	264642	264643	How can I deal with a condescending boss?	What is the best way to deal with a boss who communicates in an overly condescending manner?	1
171258	264644	264645	How can I make good preparations for the future?	How do I make a good future?	1
171259	264646	213872	How can I start making money using internet?	How do I make money without using internet and without any investment?	0
171260	205132	37933	Which state in Nepal speaks pure Hindi?	Which state in Japan speaks pure Hindi?	0
171261	264647	233379	Is 1000 USD difficult to earn in other countries?	How much is $100K salary in USA equivalent to in Indian salary?	0
171262	264648	264649	I'm appearing for the JEE 2016. Is it possible? How do I prepare for getting into IIT Bombay if I start studying from today?	Is it possible to crack JEE advanced 2017 by self study with an AIR under 1000 if I start preparation from scratch from jan 2016?	0
171263	264650	192226	How can I became slim?	How Do I become slim?	1
171264	264651	264652	Is education really important in making money?	Is education really important to make money?	1
171265	264653	264654	Is “Community is conflict being recognized and worked through creatively” a correct sentence?	"Is this sentence correct: ""I think it would be better if you LEFT now""?"	0
171266	231096	25344	What is a suitable inpatient drug and alcohol rehab center near Long County GA?	What is a suitable inpatient drug and alcohol rehab center near Worth County GA?	0
171267	264655	223880	Why can't theists prove that their God or gods exist?	Belief and Beliefs: Can the existence of a god be proven or disproven?	0
171268	264656	264657	Is any kind of medical proof or certificate required at Infosys mysore at the time of training?	For joining procedures in Infosys mysore, Do I need to carry all the medical reports or medical certificate alone is enough?	0
171269	6058	264658	What do you mean by open market operation?	What are open market operations?	1
171270	129243	6471	How do the tourist attractions on the Scandinavian Highlands compare to attractions in Luxembourg?	How do the tourist attractions on the Scandinavian Highlands compare to attractions in Slovakia?	0
171271	64543	264659	Which is the best free blog platform?	Which is the best blogging platform?	1
171272	76972	153965	When and what was the last time you did something for the first time?	When is the last time you've done something for the first time?	1
171273	112826	140545	How did you get into Cambridge University?	How do I get into the Uniersity of Cambridge ?	1
171274	264660	264661	What is libertarian free will?	What is libertarianism?	0
171275	163698	21287	What are the books that expand your mind?	What are some books that will expand our mind?	1
171276	264662	264663	"Are there any alternatives to the phrase ""stay tuned""?"	"What are some other ways to say ""stay tuned""?"	0
171277	264664	264665	Do snakes really take revenge?	Is it real that snakes take revenge if it partner is killed?	1
171278	264666	264667	How can I focus on study while doing job?	How do I focus on studying while doing a job?	1
171279	264668	264669	How do i treat false curvature of legs?	How can I treat false curvature of my legs?	1
171280	264670	264671	Why do white women initiate divorce so much?	Why do women initiate the majority of divorces?	1
171281	7427	264672	What exactly are in-phase and out-of-phase in terms of waves?	What is phase in a wave? What does one mean when he says a wave is out of phase?	0
171282	264673	264674	Why is my video lagging behind the audio in an MX Player video?	How does VLC for Android compare with other Android video players such as MX Player?	0
171283	264675	264676	What are the places to visit in Chennai?	What are some places that I can visit in Chennai with my girlfriend?	0
171284	264677	264678	My boyfriend is very soft spoken.He can't hurt anybody.but sometimes I want him to react if someone says something to him .In our group of friends mostly he is targeted, but he doesn't react.He always says I don't care of what people say but I want him to be aggressive at times. how can I tell him?	My friends caught my crush always looking at me but he also has this girl best friend that he'd occasionally hug but says that he doesn't like her. He says he has someone he likes but he won't tell me. Do you think that there's a possibility for him to like me?	0
171285	22297	264679	Who wrote Vedas?	Who wrote the Ramayana and Mahabharatha?	0
171286	170988	264680	I am an introvert, what could i do to improve my social life?	What activities can adults pursue in order to improve social life?	1
171287	76833	264681	What are the ten songs that you listen to the most?	What are the best songs for/by kids in Hindi movies?	0
171288	264682	264683	Would you disagree or agree to disagree on a topic?	How do you agree to disagree?	0
171289	264684	264685	What are the best bus services between Delhi and Manali?	Where can I get the best bus and coach charter service in Brisbane?	0
171290	264686	264687	Does the United States still have active underground missile silos armed with live ICBMs?	Why wouldn't you like to live in the United States of America?	0
171291	1179	12591	What do you feel is the purpose of life?	What's the sole purpose of life?	1
171292	264688	264689	Should there be a law to force people to correctly use a person's preferred pronoun?	Who is covered by Canada's anti-discrimination law regarding transgender people and the use of their preferred names, pronouns etc.?	0
171293	264690	264691	How do you explain the equation to calculate the period of a pendulum?	How do you calculate the period of a pendulum?	0
171294	264692	264693	Why does the billava ( poojary ) community from Mangalore busy picking up fights with people from their own community?	Eva Moskowitz: You are not from the communities served by your schools, why should people in those communities believe you can help their kids?	0
171295	264694	264695	What are the basics of a 747 cockpit layout?	How strong are the cockpit doors?	0
171296	264696	264697	Can I ask question in Quora with a link?	Has anyone tried walking in between platforms 9 and 10 at kings cross station? If so, what happened?	0
171297	264698	264699	What is the most creative way of cheating you have done/witnessed?	What is the most unique way of exam cheating you've done?	1
171298	264700	264701	Why did the UK stay out of the Vietnam war?	Why did the UK not send troops to fight in the Vietnam War? They usually join with the US in international military efforts.	1
171299	264702	264703	Which are good project topics on Java?	What will be a good project topic in Java?	1
171300	264704	264705	How do backlinks work?	How do I get backlinks to app?	0
171301	137464	264706	How do you want to be remembered after you die?	How do you want to be remembered when you die?	1
171302	264707	264708	Do employees at BJS Restaurants have a good work-life balance? Does this differ across positions and departments?	Do employees at The Habit Restaurants have a good work-life balance? Does this differ across positions and departments?	0
171303	42045	264709	Why cant someone stop thinking about you?	Why cant I stop thinking about you?	0
171304	3101	163674	What are the main uses of a computer network?	What is computer network?	1
171305	264710	40015	Why did God create so many galaxies, so many stars, and all those unnecessary things when the only habitable planet in the universe is going to be Earth? Why not just have our galaxy and play with it rather than creating millions of other galaxies?	Why does God create people who he knows will end up in hell?	0
171306	264711	264712	Why is Islam considered a race?	What is the best and cheapest website to buy clothes in India?	0
171307	264713	264714	What's the best way to make money as a programmer?	How do I make money as programmer?	1
171308	74355	10660	What are some psychological tricks to stop caring about what people think?	When will I stop thinking about what other people think?	1
171309	146850	263526	What should I do to become an ethical hacker?	How can I become a hacker?	1
171310	264715	264716	What is a project's organization identifier in Xcode?	Do I need an Apple Device in order to archive Xcode project?	0
171311	264717	264718	Which is the best graphic card under ₹6000?	What are the best graphics card for the money?	0
171312	264719	264720	What are different fields in computer science and which is better?	What are different fields for computer science?	1
171313	264721	264722	What Disneyland ride has the longest ride time?	Why do amusement park rides make you sick?	0
171314	264723	264724	What is a suitable solar panel installation provider in Bullhead City, Arizona AZ?	Which is a good solar panel installation provider in Circle City, Arizona AZ?	0
171315	264725	264726	Is 0^0 undefined?	How is 0+0+0+0+0+0+0…= undefined?	0
171316	264727	264728	Do all atheists go to hell according to the Bible?	According to the Bible, will all atheists go to hell?	1
171317	264729	264730	Does free (not encrryted) Wi-Fi have security vulnerabilities even with SSL protocol? If so, how hackers can break SSL?	I am getting only 15-20 marks out of 50 while attending the gate test series. What should I do?	0
171318	264731	264732	What's it feel like to be in Tomorrowland?	What is it like to attend Tomorrowland?	1
171319	264733	264734	Can you get the flu even after vaccination?	When should one get vaccinated for flu?	0
171320	264735	199847	Why my gmail is not responding in Google chrome?	Why is Google Chrome always not responding?	0
171321	264736	264737	StudentsChemistry Tutor For Class 12 Student Required Urgently In Kolkata Airport-West BengalView Contact Details?	As a mentally ill guy, I feel like my life doesn't matter because I feel men have no value in society. How do I change my suicidal views in life?	0
171322	13696	19532	What are career options in construction domain after graduation in electrical engineering?	What are best career options available for electrical and electronics engineer today?	1
171323	264738	264739	What should I do, after passing class 10 to become a Bollywood singer?	What should I do after 10th to become a pilot?	0
171324	98110	24555	Can I see who viewed my videos on Instagram?	How do l see who viewed my videos on Instagram?	1
171325	264740	264741	In order to get contacted by someone who want you to promote them on Instagram what is more important: followers or likes?	What are the best resources for someone who wants to learn many things: books, internet, videos (if there are more than one, please sort in order of importance)?	0
171326	264742	264743	How much it costs for laser treatment of eye in Vijayawada?	Which is the best laser treatment for eyes?	0
171327	264744	264745	What if you can't find someone you’re looking for in your dream?	What does it mean if you dream of someone kissing you, whom you truly wish to be your soul mate but in reality he is not concerned about your feelings?	0
171328	264746	264747	Is there any relaxation given on height (1-2cm) given during SSB Medical if the candidate is found deserving?	On what medical grounds could a candidate be rejected in a SSB interview?	0
171329	264748	264749	Should India be split into smaller, independent sovereign states?	How can India be split into smaller countires?	1
171330	264750	264751	Should a student who has failed in one or two subjects in 12th be allowed admission in college?	I failed in 3 subjects in CBSE 12th, what should I do?	0
171331	264752	264753	Can Harvard students get MIT Kerberos accounts?	What is pirateering?	0
171332	18482	15671	How did Donald trump won US presidential election 2016?	How and Why did Donald Trump win the election?	1
171333	264754	264755	How do I forgive my mother for hurting me repeatedly, when she doesn't think it was wrong?	How do I forgive my mother for hurting me repeatedly and doesn't think it was wrong?	1
171334	73088	264756	How much money I can withdraw from an SBI ATM with an SBI card?	Can I withdraw money from my SBI home branch with ATM card since I dont have my passbook?	0
171335	134484	157418	What's the best music or sound to fall asleep to?	What is the best music to help you fall asleep?	1
171336	8101	1693	How do I lose weight without doing exercise?	How do I lose weight without doing any sport?	1
171337	44418	264757	Which are the low investment high profit business?	What are some of the businesses which are not practised in India but are highly profitable in other countries?	0
171338	264758	264759	Is there a free/open source alternative to Avalara for pulling U.S. tax rates into software?	What is the cost to use Avalara for all states with sales tax?	0
171339	264760	264761	How can I remember words faster?	How can I remember my words better?	0
171340	138534	264762	Why are many of the major deserts located on the western part of the continents and also in the mid lattitude areas only?	How many legal shooting areas are there in the SoCal desert?	0
171341	51654	5258	How do I know when my spouse is having an affair with someone else?	I suspect my spouse is cheating, how do I know for sure?	1
171342	69958	76358	Why is the media against Trump?	Why is US mainstream media biased against Trump?	1
171343	91509	1488	Do psychopaths think babies look pretty, or cute?	Do psychopaths find babies cute?	1
