id	qid1	qid2	question1	question2	is_duplicate
200173	55734	75531	How cold can the Gobi Desert get, and how do its average temperatures compare to the ones in the Syrian Desert?	How cold can the Gobi Desert get, and how do its average temperatures compare to the ones in the Karakum Desert?	1
200174	301862	301863	What is it like to intern at Wong Fu Productions?	How do I write romantic/tear-inducing scripts like that of Wong Fu Productions?	0
200175	221225	301864	What does your current room look like?	How does your room look like?	1
200176	301865	301866	Will wooden pencils ever become obsolete?	Will pencils ever become obsolete?	0
200177	251074	180611	If elected president, should Hillary Clinton put Obama on the bench as a Supreme Court Justice like William Howard Taft got put on the bench?	If Hillary Clinton wins, would she nominate Barack Obama for SCOTUS? Would he even be interested in being a Supreme Court Justice?	1
200178	73570	48722	What was the significance of the battle of Somme, and how did this battle compare and contrast to the Battle of Matapan?	What is the significance of the Battle of the Somme?	1
200179	301867	231975	What drugs do you do and why?	Why do people do drugs?	0
200180	301868	30722	What is the meaning of the term S.M.A.R.T. in business or in personal life?	What is the meaning of life?	0
200181	301869	301870	Is there any good alternative softwares to Tally?	What are some good alternatives to Tally?	1
200182	301871	301872	In the age of curated social media news feeds, & large media conglomerates, how does one find and read the suppressed journalism?	How come new and exciting technologies that we see in the news/social media are never implemented?	0
200183	1203	15344	What are the funniest jokes / stories you ever heard?	What are some of funniest jokes that you have ever heard?	1
200184	301873	301874	Would graduate school in Statistics or in Biostatistics better prepare one for work in the “-Omics” fields (genomics, epigenomics, etc)?	I am preparing for graduate school in statistics. What are the recommended resources to help me be well-prepared before the semester?	0
200185	301875	301876	How exactly a magnetic brake work in an automobile? Can it replace handbrake?	What is the principle and efficiency of an air brake used in automobiles?	0
200186	301877	44803	What are some cheaper alternatives to replace blazers/suits?	Is there a cheaper alternative to Trunk Club?	0
200187	29903	301878	What countries are not in debt?	Which country has no debt?	1
200188	301879	178073	How do you deal with self hate?	How do I deal with being hated?	0
200189	301880	301881	What are some good cycling routes in and around Bangalore?	What are some of the best places/routes to cycle around Bangalore?	1
200190	301882	301883	Why are some people’s tongues cracked?	Why is my tongue cracked?	0
200191	288513	301884	If I were to make a bomb in science class would I be sent to jail?	If a clerk can be sent to jail for not following same sex marriage laws, shouldn't undocumented immigrants be put in jail for not following immigration laws?	0
200192	119858	301885	What arguments are there for or against the existence of free will?	Which side carries the burden of proof in the argument for the existence of free will?	0
200193	301886	301887	What are free alternatives to Adobe's LightRoom?	What are some free alternatives to Adobe Lightroom?	1
200194	301888	8945	Was India a country before it was ruled by the British and the East India Company?	What are the good things done by the British to India and Indians during the British Raj?	0
200195	209658	301889	How much does it cost to replace all four tires of BMW 530d, in India?	How much does it cost to replace all four tires of BMW 320d, in India?	0
200196	301890	301891	Are white lies good?	Are white lies good or bad?	1
200197	301892	301893	What are the benefits of schizophrenia, if any?	Can anyone get schizophrenia?	0
200198	177499	152363	What is the origin of homosexuality?	What are some scientific or psychological theories of homosexuality?	1
200199	110779	301894	What are the best travel hacks for being on long flights?	What is the best way to pass our time in long haul flight?	0
200200	301895	301896	What are the best sites for learn English for beginners..?	Which are the best websites to study English online?	1
200201	301897	301898	What is empwr.com?	What does FreshBooks.com do?	0
200202	62602	255821	What was the first programming language that you learned in life?	What is the first programming language you learn?	1
200203	301899	301900	Would Donald Trump be soon assassinated?	What is the possibility of an assassination of Donald Trump? Would an assassination be possible?	0
200204	301901	301902	Who do you think will win in the 2013 pakistan election?	Who do you think will win the 2013 Australian Election?	0
200205	161595	38558	What is the best laptop in 50000 in India?	Which is the best laptop to buy at price range 40-45000 rs?	1
200206	301903	301904	Should I be able to attend Yale?	What are the downsides of Yale?	0
200207	301905	85819	What do you do when you are in a bad mood at work?	What do you do when you are in a bad mood?	0
200208	301906	301907	Why do large firms acquire startups?	Why do large companies acquire startups and just let them die? Is there value in acquisitions to eliminate competition?	0
200209	301908	301909	How likely are you to get arrested if you walk up and shoot someone?	What do love about life in the big city?	0
200210	301910	301911	Can a software programmer’s/coder’s job can ever be automated?	Will computer programming ever be automated?	1
200211	264435	208047	What are the uses of terminal emulator Android app?	How can I use a terminal emulator for an Android?	1
200212	301912	301913	Which is a better option in career growth : SalesForce or ServiceNow, considering all the aspects which includes scope, job opportunities in India?	Is there any scope after doing MBA in India? Is doing MBA and getting a job better than bank manager as a career option?	0
200213	37752	301914	What are some cool WhatsApp group names?	Which is the best WhatsApp group name related to friendship?	0
200214	301915	301916	What does TGIF stand for?	What does TGIF mean?	1
200215	301917	301918	Would chemistry help with cooking?	Why does cooking help to preserve food?	0
200216	196675	85355	Is there a limit to a human brain's storage capacity?	What is the theoretical storage capacity of the human brain?	1
200217	92656	301919	Why India is a democratic national?	Why is India a democratic country?	1
200218	301920	301921	Should the Indian legal system have a perjury clause?	Why is the Indian legal system so much screwed up?	0
200219	301922	301923	"What is the origin of the term ""there, there""?"	What is the origin of the term roshambo?	0
200220	301924	301925	What does Hillary Clinton plan to do about our effect on the environment? What green energy does she plan to support?	What does Hillary Clinton plan on doing to make solar energy more available and affordable for working Americans?	1
200221	301926	301927	What is your position regarding raising the H1B visa cap in order to allow more highly skilled workers to improve the US economy?	How do I become more intelligent like Vichitra Zawar?	0
200222	301928	301929	Why do many people hate broccoli?	Why do people hate broccoli?	1
200223	301930	301931	Aging Brain: How do the brain structures of gorillas change as they age? How are these structural changes different from human brains?	Aging Brain: How do the brain structures of zebras change as they age? How are these structural changes different from human brains?	0
200224	301932	301933	Why doesn't natural selection occur as often with humans?	Why does natural selection occur more in animals than humans?	1
200225	301934	301935	In Ruby, what is the difference between strftime() and strptime()?	What is the difference between a = {} and a = [] in Ruby?	0
200226	7681	20514	What are the best places to visit on a 3 day trip in and around kerala?	What are the best 10 places to visit in Kerala including any falls?	1
200227	67997	109548	What are the easiest ways to make good money online?	What is the easiest and most profitable way to make money online?	1
200228	301936	301937	"How can I write ""how"" on Quora?"	Do Quora users write/publish books?	0
200229	301938	211415	What does CT scan do?	Why are CT scans so expensive?	0
200230	301939	301940	Why do children hate vegetables?	I am 18 and hate all fruits and vegetables. I eat strictly meat, grains and Dairy. What will my health be if I continue to eat like this? (currently I am very fit)	0
200231	270284	102565	What is a frozen shoulder?	What is frozen shoulder?	1
200232	294188	68695	What TV series changed your life?	Which TV series has changed your life? And what are those changes?	1
200233	301941	225267	Why I wouldm't be a politician?	Why don't I want to be a politician?	0
200234	301942	301943	How do humans impact the environment positively?	What positive effects do humans have on the environment?	0
200235	301944	301945	"What is meant by the phrase ""I don't feature""?"	"What is meant by the phrase ""this is my design""?"	0
200236	156384	301946	Why does Set Max repeatedly telecast Sooryavansham movie in India?	What are the telecast times of the Arrow series in India?	0
200237	126679	301947	How can I charge my iPhone without a charger?	Can you charge a mobile by a wireless mode?	0
200238	301948	44654	What are some good alternatives to indieWIRE.com?	What are good alternatives to anonfiles.com?	0
200239	301949	301950	How do I deal with the end of summer anxiety?	Why can't I forget my first love and my first rejection?	0
200240	301951	301952	Am I mentally ill?	Am I mentally ill if I have depression?	0
200241	301953	301954	Is grammar so important while writing answers on Quora? Why do people point it out?	Is grammar really important on Quora?	1
200242	301955	301956	What is among the most overrated and hyped thing in India?	What are the most overrated things among Indian parents?	0
200243	55843	68126	What are the expected consequences of Declaring 500 and 1000 rupee notes as illegal?	What could be the consequences of recalling 500 and 1000 rupee note?	1
200244	22166	301957	Would it be a form of child abuse to force a child to carry around a belt whenever in public as a reminder of what will happen if they misbehave?	What would happen if a child was never around anyone or anything since they were born?	0
200245	301958	301959	What is Apache Maven, and what is it useful for?	What is Apache Maven?	1
200246	301960	301961	In layman's terms, what is spacetime in string theory?	What is string theory in layman's terms?	0
200247	301962	236029	Which books are best for neet 2018 preparation?	What are the best books to refer for NEET?	0
200248	143738	301963	Which Quora user has the most followers?	Who has the highest number of followers on Quora?	0
200249	132013	301964	If i buy By Vilain Hair wax products which costs around 20 $ and ship it to india from denmark do i have to pay the custom duty?	How do I ship household utensils from Chennai, India to Herning, Denmark at the lowest cost?	0
200250	301965	301966	What is going to happen with gold prices in India?	What will happen to price of gold in India in the next 6-9 months?	1
200251	133276	286665	Why does Quora make it mandatory to put a question mark after the end of the question? Isn't it redundant?	Why does Quora require a question mark at end of the question?	1
200252	301967	301968	"Why is Boo Radley considered a mockingbird in the book ""To Kill a Mockingbird""?"	"What is Boo Radley really like in the book ""To Kill a Mockingbird""?"	0
200253	301969	301970	What causes uneven facial hair growth patterns? How can it be corrected?	Does cinnamon and honey mask effect the growth of facial hair?	0
200254	301971	301972	Do stock prices reflect or account for inflation?	Why do stock prices rise when the dollar is inflated?	1
200255	301973	301974	Who makes all the money during US presidential elections?	Which industries benefit from the influx of cash during US presidential election cycles?	1
200256	301975	301976	Do people generally feel that Robb Stark made a mistake by not killing Jaime Lannister when he had the chance?	In the HBO series Game of Thrones, was the actor for the Jaime Lannister character changed? If so, who was the first actor, and who is the new actor?	0
200257	301977	301978	How do I get an international license to fly helicopters?	How do I get a license to fly helicopters?	0
200258	301979	301980	What are some great fast foods in New York city?	What are some of the best fast food restaurants in New York?	1
200259	301981	129893	When did you have your first kiss and how did it feel?	What is the story of your first kiss?	0
200260	301982	147921	Why do I see so many straight girls on Tinder (I'm a lesbian)?	How often Indian girls use Tinder?	0
200261	301983	301984	Are there 6 blood groups?	Do animals have blood groups?	0
200262	301985	301986	How much money do I make in bootcamp?	Has Shahrukh done any kissing scenes?	0
200263	61552	38063	Is Quora's engine biased against Donald Trump?	Why is Quora biased agaist Donald Trump.?	1
200264	301987	301988	Why are so many Americans okay with illegal immigrants?	Why do some Americans support illegal immigration?	1
200265	301989	301990	I am fat. I want to lose weight but I don't have time for exercise as I need to study more. What should I do?	I need help losing weight. What should I do?	0
200266	301991	85139	Is learning music hard?	Why is Spanish hard to learn?	0
200267	127526	36727	Why are you proud of being a citizen of your country? How is it an accomplishment?	What makes you proud of your country?	1
200268	112331	145514	What can be done on the Cauvery issue?	How can Cauvery water dispute be resolved?	1
200269	301992	301993	Personal Savings: What is a chit fund?	Personal Savings: How do chit funds work?	1
200270	301994	301995	What are all those noises that planes make during takeoff? Can you explain them?	How much G-force does a passenger jet exert on the people riding in the plane during takeoff?	0
200271	28377	301996	How would you approach a girl who is stranger to you?	How do I approach a girl who is a stranger to me as I'm quite shy?	1
200272	87323	301997	What is the plot of Neon Genesis Evangelion?	What is the plot of Neon Genesis Evangelion: Death and Rebirth?	0
200273	301998	301999	How many molecules are there in a pencil?	How many pages can a wood case pencil write?	0
200274	302000	302001	Which countries could collapse within the next ten years?	Which countries do you think would collapse within 10 years?	1
200275	302002	302003	Is softlayer a good hosting company?	Besides Aliyun, what is a good hosting company in China?	0
200276	29281	74482	Daniel Ek: Why is Spotify not available in India?	When will Spotify launch it's services in INDIA?	1
200277	302004	302005	Why don't left government of Kerala merge in Pakistan?	What's the best way to reject someone (especially colleague) who is keep chasing her?	0
200278	4622	229004	What is a suitable solar panel installation provider in Yuma, Arizona AZ?	What is a suitable solar panel installation provider in Glendale, Arizona AZ?	0
200279	10565	13779	What do you think of the decision by the Indian Government to replace 1000 notes with 2000 notes?	What are the full implications of the Indian government's decision to withdraw all the old 500 and 1000 rupee notes from circulation?	1
200280	302006	302007	How can I buy Facebook stock?	How can I buy Facebook stock options?	1
200281	302008	302009	How can you avoid goofing off at work?	Why should you stop goofing off at work?	0
200282	141686	302010	Is anal sex enjoyable?	What does a girl feel when she has anal sex?	0
200283	302011	120590	What is the drawback of GST bill?	Is GST going to be a boon or bane for India?	0
200284	84305	302012	How do I setup a Belkin router password?	How do you find a Belkin router password? How do you setup a Belkin router password?	1
200285	302013	302014	Could Buddhism be accurately described as self-worship?	How many cars have you had over the years and which brands?	0
200286	302015	302016	Why did Pakistan lose the 1971 Indo-Pakistani War?	How can I learn more about the 1971 Indo-Pakistan War?	0
200287	259031	302017	What is a petri dish?	Why are Petri dishes round?	0
200288	38395	7632	What’s the most embarrassing moment of your life so far?	What are the most embarassing moment in life?	1
200289	203184	100401	What's the best way to learn web application development with Java technologies?	What is the path for learning Java web development technologies?	1
200290	302018	302019	What is the most insulting answer you've seen on Quora?	What's the most shocking answer you've seen on Quora?	0
200291	302020	302021	What is the Federalists 10 about?	Why is Federalist 10 important?	1
200292	299539	302022	Which coaching prepares the best Civil Services GS notes/material?	Which coaching prepares you the best for civil services GS notes/materials?	1
200293	302023	302024	How can I find a subletter for my apartment?	What are some tips for subletting your apartment?	0
200294	181544	302025	What are the main anthropogenic impacts on N and P cycles in Australian ecosystems?	What impact can competition have on your pricing and when in the product life cycle especially true?	0
200295	302026	298147	Can men/women enjoy sex after sterlization?	Are you very vocal when you have an orgasm?	0
200296	65980	14767	What is your 2017 New Year’s resolution?	What is your New Year resolution?	1
200297	15548	117215	How can I keep the peace of mind?	What is the way to get peace of mind?	1
200298	302027	105017	What happens if you drink a lot of carrot juice?	Will anything bad happen if I eat too many carrots?	0
200299	302028	90707	Are most of the terrorists in the world Muslims? Why, or why not?	What percentage of Muslims are terrorists?	0
200300	302029	6884	How long can I keep my instagram account deactivated for before it gets deleted?	What is the time limit to temporarily deactivate Instagram account?	0
200301	158097	99833	Are there any security features in Rs 2000 and Rs. 500 currency notes to make them counterfeit proof?	What are the security features of a new Rs. 500 and Rs. 2000 notes?	1
200302	216719	279242	What is the remainder when 732^732 is divided by 27?	What is the remainder when 30^100 is divided by 17?	0
200303	302030	302031	How do landlords qualify tenants?	How do landlords conduct background checks on tenants?	1
200304	131979	302032	What are the miracles that have happened in your life?	What are the miracles that happened and changed your life?	0
200305	302033	302034	How can we differentiate leadership change news from general business news?	Cricbuzz app shows latest news. From where and how do they get all these latest news?	0
200306	302035	19821	How can I or you find own talents?	How can I find my hidden talents?	0
200307	119494	46718	What is fourier transform of one?	What is the Fourier transform of this?	0
200308	116222	115898	How can I get rid of pimple scars from face?	What is the fastest way to get rid of pimples and blackheads on face?	0
200309	302036	302037	Why is Donald Trump interested to meet (make a deal with) Kim Jong-un? What does Kim Jong-un need that Trump, if elected President, could deliver?	Can Kim Jong-Un travel to the United States?	0
200310	302038	302039	Which is better for chadar trek: Trek the Himalayas(TTH), Thrillophilia or IH ? Should I try some local agency?	I am going on a trek in the Himalayas. I have no experience with photography whatsoever. What are some quick tips which I can keep in mind which would help me capture the natural beauty of the mountains?	0
200311	302040	302041	What is the difference between notebook computers and laptops?	What is the difference between a notebook and a laptop?	1
200312	302042	72140	Which is better to build web applications and why:  PHP, Python or Ruby?	What is the new language to replace PHP?	0
200313	302043	302044	How good are colleges like SIIB, TAPMI, Narsee Monjee Bangalore, KJ Somaiya and Goa institute of Management? Is it worth it to pursue MBA from these colleges after having 2 years of job experience? CAT/XAT/CMAT cutoff for these colleges? Avg salary package of these colleges?	What are the good colleges one taking XAT and CMAT apply for?	0
200314	302045	302046	What are some of the most underrated weapons?	What are the most underrated weapons of all time?	1
200315	136306	302047	What are the best tasting Herbalife shakes and how are they made?	What is the best Herbalife shake flavor?	1
200316	302048	302049	What is the difference between geostationary and geosynchronous orbits?	What is the difference between polar and equatorial orbits?	0
200317	302050	210863	Is it possible to send an email with a past date with a postfix email server?	Is it possible to send one email to mail server with its users?	0
200318	302051	302052	Unique ways to advertise a existing big brand like h&m in tier 2 city like Agra?	How do I run a big brand like H&M in a tier 2 city or a small city?	0
200319	302053	302054	How Indian population can be controlled?	How can we control population of India?	1
200320	302055	302056	What do Turks and Koreans think of each other?	I can't find my rank in WBJEE med 2016. What to do now?	0
200321	302057	302058	What are variable oxidation states?	What is an oxidation state?	0
200322	185	155654	What are some of the best romantic movies in English?	Which is world's best romantic movie?	1
200323	105424	302059	Is it illegal to pass private emails (and their content) on to third parties without consent?	Is it illegal to scrape real estate listings for private use?	0
200324	302060	302061	How can we be sure the CIA isn't being hacked by China to look like Russia hacked the election?	I just pulled a matted tuft off of my cat. It left a 3-4mm dia bleeding lesion, yet he didn't yowl/fight. What kind of injury am I looking at?	0
200325	120804	6786	How can I be charismatic?	How can I become more charismatic?	1
200326	65964	80146	Can you get pregnant a couple days before your period?	Can I get pregnant a couple hours before I got my period?	1
200327	302062	302063	Which is the best, Royal Enfield Classic 350 or Thunderbird 350 or Standard 350?	Which is best royal enfield classic 350 or standard 350?	0
200328	302064	188254	How would you describe RESTful programming/REST APIs to a complete novice?	How to build REST API using PHP?	0
200329	302065	302066	Was the 20th century the worst century in human history?	Was 20th century the worst century in human history?	1
200330	302067	302068	What is a good dream to tell your girlfriend to make her feel loved?	I once had a girlfriend who I think was very much in love with me. Why did it feel so good to hate her?	0
200331	302069	302070	What are the positives and negatives of restorative justice?	Is Vengence and Justice opposite?	0
200332	302071	302072	Are there any sequels of The Secret book by Rhonda Byrne?	"What are the reviews of ""The Secret"" by Rhonda Byrne?"	0
200333	147011	35208	Why did MS Dhoni retire so early from Test Cricket?	Why MS Dhoni retire from test?	1
200334	260686	79841	Is Playstation better than Xbox?	Which one is better: Sony PlayStation or Xbox?	1
200335	302073	302074	How do you restore an iPhone from iCloud backup?	Will restoring from an iCloud backup erase my device?	0
200336	216477	127482	What's the most embarrassing thing you've ever said in a foreign language by accident?	What's the most ridiculous thing you've ever unintentionally said when trying to speak a foreign language?	1
200337	247622	195235	What are wormholes? Do they really exist?	Does wormholes really exist?	1
200338	302075	302076	Is psychiatry useful?	Is psychiatry useful? If so, how so?	1
200339	302077	302078	I'm a 19 almost 20 y.o girl and I'm still a virgin. I get a lot of attention from men but I just want to do it with someone special? Is 20 too old?	I'm turning 20 soon. I'm a heterosexual male. I want to have lots of sex with mature older women. How do I make this a reality?	0
200340	302079	302080	Why do diabetic patients refuse to exercise and eat right?	Why are diabetes patients refusing to eat healthy and exercise? Can you help us understand why this is happening?	0
200341	139151	17918	If the superfluid dark matter is what ripples when Galaxy clusters collide why wouldn't it be what waves in a double slit experiment?	Does superfluid DM ripple when galaxy clusters collide and wave in a double slit experiment even though physics is too screwed up to figure it out?	0
200342	302081	302082	What is the difference between postgraduate degree and postgraduate diploma?	What's the difference between a graduate diploma and a postgraduate diploma?	0
200343	302083	302084	How do I create a local database and sync with multiple APIs?	How do I build a private API for synchronisation between multiple local databases and a cloud database?	0
200344	302085	302086	I am a self-taught coder and I have released an app I made to push my skills. How can I solicit feedback for my Android app on Quora?	I am addicted to WhatsApp, and I have no self-control while studying. Is there an app for temporarily locking apps on an iPhone?	0
200345	302087	302088	I cannot access my Facebook account without an access code from a mobile phone. What can I do?	When I close my Facebook account will I still be able to access my Spotify account?	0
200346	302089	302090	Do angel investors/VCs invest in startups only on the basis of their idea?	Is there a way to find an angel investor only with an extraordinary idea?	1
200347	173655	302091	What is the difference between a solute, solvent and solution?	Why is the mass of a solution always equal to the mass of solute + mass of solvent?	0
200348	302092	63497	Why was episodes of Fairy Tail 276 and 277 english dubbed before 240 to 265?	When will Fairy Tail episodes 240-265 be dubbed?	0
