id	qid1	qid2	question1	question2	is_duplicate
151184	89997	53143	Which are the top places to visit in Kerala?	What are some of the best places to visit in Kerala in a span of 5 days?	1
151185	237776	237777	Is there any way to improve my long term memory?	How can I improve my short and long term memory?	0
151186	237778	237779	Does Allah mean God?	Does the word “Allah” mean God?	1
151187	67403	54444	What are the best ways to speak English fluently?	How could an English learner speak fluently?	1
151188	237780	224758	Will the salary of a central govt contractual employee working under a project increase after 7th pay commission?	7cpc.india.gov.in: What is the 7th pay commission hike in salary of PSU employees?	0
151189	237781	54221	Will Indian currency be little stronger globally after bans on 500 and 1000 rupees notes?	Will rupee value rise after banning 500 and 1000 notes?	1
151190	8730	69441	How do you post a question on Quora?	How can I ask my question on Quora?	1
151191	237782	237783	What causes a white discharge with no odor or itching?	What is a yellow discharge with odor and no itching?	0
151192	83512	237784	What are the things you miss the most about your childhood?	Past Times: What did you enjoy the most about your childhood?	0
151193	237785	237786	What is the cause of schizophrenia?	What causes schizophrenia?	1
151194	237787	45898	What is it like to be lesbian, gay, bisexual, transgender, and/or queer in America?	"What is the difference between, ""lesbian"", ""gay"", ""bisexual"", ""transgender"", and ""queer""?"	0
151195	34815	237788	Will there be a nuclear war soon?	What if there was a nuclear war?	1
151196	14287	69708	Do Quora users still see questions that are marked as needing improvement?	What makes a question on Quora needing improvement?	1
151197	237789	237790	What are the most interesting products and innovations that Group Strategies is coming out with in 2016?	What are the most interesting products and innovations that Barnes Group is coming out with in 2016?	0
151198	237791	237792	I have abundant resources of milk and coconut, so I wish to do a startup, need some advice relating to our resources only, don't go traditional ideas?	"How has the definition of ""Entrepreneur"" changed since 2000?"	0
151199	237793	237794	Do women find short men less attractive?	"Do women find guys less attractive if they're short, like 5'5"" to 5'8""?"	0
151200	237795	237796	Which Bollywood movie influenced you the most and why?	Which movie do you expect the most this Diwali?	0
151201	237797	237798	"What's the Difference between ""PGDM"" and ""Executive PGDM""?"	What is the difference between PGDM and EPGP in business school?	1
151202	237799	237800	With Facebook Connect can I invite friends to a site as well ?	How do I use Facebook Connect?	0
151203	237801	237802	What is employees' Provident Fund in India?	Why are private provident funds in India not investing in ETF and other equity products?	0
151204	237803	237804	Job experience as an advocate in Mumbai?	What could be possible outcomes of scrapping 500 and 1000 notes? Please segregate them in good outcomes and bad outcomes.	0
151205	237805	237806	What is your opinion on whether or not aliens exist?	How likely is it in your opinion that aliens do exist?	1
151206	237807	80944	Why did the evolutionary process choose the vast majority of male mammals to be physically stronger than females?	Why are many male animals bigger than female animals?	0
151207	237808	237809	What are the best programming forums?	What is the best forum for python?	0
151208	1932	46715	Do long distance relationships work?	What does it take for a successful long distance relationship?	1
151209	154459	237810	Who is Emma Watson?	Who are Emma Watson's friends?	0
151210	237811	237812	Is Better Call Saul better than Breaking Bad?	What are all the references to Breaking Bad in Better Call Saul?	0
151211	14297	39332	Time Travel Is It Possible?	Is timetravel possible?	1
151212	20333	17477	How exactly is the proposed GST bill beneficial for our economy?	What are the advantages of GST for the Indian economy?	1
151213	237813	237814	Why don't I get upvotes or responses even on promoting my good answers?	Quora: Why don't I get upvotes?	1
151214	237815	237816	What is the best part of being a woman?	What is the best thing about being a woman?	1
151215	237817	237818	What are the career prospects after completing Masters in English Literature followed by Ph.D in Culture studies in India?	Did God punish slave master's who didn't treat their slaves fairly?	0
151216	176677	237819	What led to the decline of the Ottoman Empire?	What led to the rise of the Ottoman Empire?	0
151217	4867	237820	What does each line mean from the song STARBOY by Weeknd ?	"Which song of Zappa is this line from: ""Just drop by to say hi""?"	0
151218	237821	237822	What is the county of Edgware and how does the lifestyle compare to the London Borough of Barnet?	What is the district of Edgware and how does the lifestyle compare to the City of London or any of the London Boroughs?	0
151219	237823	237824	Who is the most powerful Avenger?	Who is the most powerful Marvel Avenger?	1
151220	133350	237825	What is the purpose of Ethernet cables?	How many types of Ethernet cable?	0
151221	237826	237827	Is agnosticism affiliated with atheism since neither are theistic?	How is atheism different from agnosticism?	0
151222	196257	237828	What is that song which gives you goosebumps?	Which song gives you goosebumps when you hear it every-time? Why?	1
151223	237829	237830	What is the historical return of real estate vs stock investing?	How do I get money to invest in real estate?	0
151224	237831	226196	What are the pros and cons with moving to Austin, TX?	Why is Austin, TX famous?	0
151225	22373	141304	Why the banning of 500 and 1000 rupees notes?	Why did GOI demobilise 500 and 1000 rupee notes?	1
151226	237832	237833	What are some of the best places to live weather-wise?	What are the best places to live weather-wise?	1
151227	237834	237835	How does Vice (HBO) get the access that it does?	How do journalists from VICE get their access to the sources they interview?	1
151228	237836	237837	What are human beings instinctively afraid of?'?	What are human beings instinctively afraid of?	1
151229	237838	52285	How do I watch Dragon Ball Super Episode 48 English Subtitled?	Where can I watch Dragon Ball Super online with English subtitles?	0
151230	68125	26274	Should people over 94 not be allowed to vote?	Should people over 91 not be allowed to vote?	1
151231	27009	221304	What are the rules and regulations when visiting an inmate at Valdosta prison and how does it compare to prisons in Arkansas?	What are the rules and regulations when visiting an inmate at Valdosta prison and how does it compare to other prisons in Georgia?	0
151232	80266	45195	What are the differences between Chinese and western table manners?	What is the difference of table manners between China and the UK?	1
151233	237839	237840	Now that CNN's stock has dropped significantly after Trump exposed them as a fake news machine, how will Time Warner rebound from this?	Do I need to get CNN or Fox News to watch the Clinton Trump debate?	0
151234	237841	237842	What does the amount of technology we use everyday depend on?	Why don't we use wireless technology for everyday use even though we have it?	0
151235	237843	50930	Consequences of Bhopal gas tragedy?	What was the reason behind the Bhopal gas tragedy?	0
151236	237844	237845	Could mindfulness and meditation stimulate the brain, to augment normal treatment for ADD/ADHD?	Are there any disadvantages to reciting mantras solely for the purpose of meditation and achieving peace in your mind?	0
151237	237846	44571	How can I safely earn money online?	What are the legitimate ways to earn money online?	0
151238	237847	237848	Why am I worrying about my relationship?	Why I am worried about the things I can't control?	1
151239	237849	237850	How can a first timer learn everything about MYOB AccountPlus program for free?	How can I learn as much as I can about cars?	0
151240	237851	237852	What are synthetic materials for collage making?	How do you make your own collage elements for your artwork?	0
151241	95797	59989	What is the way to overcome the stage fear?	What are the best ways to overcome stage fright?	1
151242	237853	237854	Will my 2 cats and dog be fine alone for 3 days?	We know that pressure at A will be equal to the pressure at B. What about the pressure at C?	0
151243	29454	217402	How do I increase my breast size?	How can I reduce breast size?	0
151244	138340	212660	Can I use any image from google/website in my blog, along with mentioning the credits for the image?	Can I use images from Image Google Search on my blog or website?	1
151245	8580	46861	How can I make an Opinion Blog on Quora?	How do I create a blog on Quora?	1
151246	237855	72956	How do I learn to make movies in blender 3D?	How do you make 3D animated movies in Blender 3D?	0
151247	237856	36411	What are best ideas to start small business in a small city with less investment?	What are the best businesses to start in 2015?	0
151248	82367	237857	How do I get rid of this laziness and procrastination?	How do I get rid of laziness and procrastination?	1
151249	208693	237858	What does this mean in English 窩艾尼?	What does this mean in English?	0
151250	237859	237860	What are the three things Americans can be hopeful about during these difficult times?	What program can I use to burn the mkv to DVD?	0
151251	65391	24613	What programming languages are best to learn?	Which programming language is the best nowadays?	1
151252	237861	237862	Do introverts and extroverts get along?	Can an extrovert and an introvert get along?	1
151253	237863	237864	Can guinea pigs eat potatoes?	Can a guinea pig eat bananas?	0
151254	237865	237866	For how long can I be on 'leave without pay' in a government job and on what grounds can I be transferred to my home town?	In which company distributed system is used?	0
151255	237867	237868	What is friend.ly up to?	What is Friend.ly about?	1
151256	237869	237870	What are some stereotypes of each subfield of psychology?	What are some stereotypes of each subfield of biology?	0
151257	237871	237872	Why does a girl avoid eye contact with a boy who loves her?	Why would a guy deliberately avoid eye contact with a girl when he's close to her?	0
151258	237873	237874	Can you block a user from answering your questions?	How do you block someone on Quora?	0
151259	237875	168180	What does it mean when a man says he is attracted to you?	If a guy says he can't be mean to a girl, what does that mean?	0
151260	237876	237877	"What does ""celebrity handler"" mean?"	Are celebrities really rich or do they live above their means?	0
151261	237878	237879	How does a siren produce noise? How does it work?	Why does a chopper motorcycle produce such loud noise?	0
151262	237880	237881	"What does ""email CV"" mean?"	"What is the meaning of ""CV""?"	0
151263	237882	237883	How can a marcerator be uninstalled without wrecking it?	Is it better to study at NITs or the Imperial College London for an undergraduate degree in engineering?	0
151264	237884	237885	What are some examples of propaganda in social media?	What are some examples of social media?	0
151265	163949	237886	Why have drone sales taken off in the past few years, and what technological advances have made consumer drones possible?	What are the critical technological advancements that happened in the last few years and made the drone revolution possible?	1
151266	237887	112962	Is Nikola Tesla overrated?	Why is Nikola Tesla generally considered to be the most underrated scientist and inventor of all times?	0
151267	237888	154937	"In Japanese, how do you say ""machine""?"	"In Japanese, how do you say ""There you are!""?"	0
151268	237889	158531	What is salary for fresher mechanical engineer at Samsung Electronics Noida?	How much do mechanical engineers earn?	0
151269	237890	237891	Is it possible for a Christian to think that God might not be so moral?	Frank Underwood vs Will Conway: how are their personalities different?	0
151270	237892	237893	How do I hire a truck in Bangalore?	What is the best way to hire a truck in Bangalore?	1
151271	237894	237895	How do you prevent packages from being stolen from your front door?	How do you prevent packages from being stolen?	1
151272	237896	73068	How do you delete friend requests on Facebook?	How to cancel all friend request pending on Facebook?	0
151273	135354	237897	What is the future of digital marketing in India?	What is the scope of digital marketing in India in the future?	1
151274	237898	237899	Should a woman take iron supplements while on her period?	How many sanitary napkins does an average American woman change per day when she has her period?	0
151275	237900	237901	How can I travel to bhutan?	What should I do when I travel to bhutan?	0
151276	120444	237902	What should you do after getting your first job?	What should I do after job?	0
151277	237903	237904	Will hacking and breaches become more important?	Is hacking and breaches became more important?	1
151278	48085	63676	Will Hillary Clinton cause WWIII by going to war with Syria?	Is Hillary Clinton crazy enough to start a nuclear war with Russia?	1
151279	152745	237905	If you have a six digit combination and the only numbers in it are 9 and 0 how many combos can you make?	We put n balls in p discernable boxes. If balls are discernable, and every box can receive any number of balls, how do you find combinations if every box can receive only 1 ball at most?	0
151280	237906	237907	How do computer programmers make the most money?	How do computer programmers make money freelancing?	0
151281	237908	64803	Which is the best digital marketing training institute in Pune providing good job assistance?	Which is the best training institutes for digital marketing in Pune?	1
151282	66488	12719	What are the safety precautions on handling shotguns proposed by the NRA in Florida?	What are the safety precautions on handling shotguns proposed by the NRA in Kansas?	1
151283	237909	237910	Where is the best resource to learn web development for free?	What is the best way to learn web development?	1
151284	237911	237912	For trading card games, how are rares printed and packaged so that there's actually a lower chance of pulling one?	Now that Microsoft will be selling the Xbox One without a Kinect, how will that affect its sales and chances of future games requiring the Kinect?	0
151285	237913	237914	Will there be a Deep Learning Summer School in 2017?	Will there be a Deep Learning Summer School in 2016?	0
151286	237915	237916	How should one crack NEET 2018? Please refer details	How can I get 330 in biology in neet 2018?	0
151287	237917	237918	What do you guys think of all the predictions made by Baba Vanga?	What do you think about Baba Vanga's predictions?	1
151288	29614	51655	How do I know if my spouse is cheating?	How do I know that my spouse is cheating on me?	1
151289	237919	237920	Can an IAS officer earn in crore?	How much can a couple IAS officer without courrept batch 2010 earn?	0
151290	237921	237922	Trading Nasdaq stocks on Interactive brokers platform from the UK, what are the costs?	How many students passed neet 2016 in tamilnadu?	0
151291	237923	237924	How competitive is the hiring process at Universal Technical Institute?	What are some tips on making it through the job interview process at Universal Technical Institute?	0
151292	237925	237926	What is it like to work as a fresher at TCS?	What is the work of a fresher in tcs?	1
151293	29547	37390	What's the best way to learn general programming?	Which is the best way to learn coding?	1
151294	237927	237928	Why are sleepovers good?	How do I have a good sleepover?	0
151295	237929	237930	What are the impacts of bond notes in gross domestic product?	What are the effects of a decline in gross domestic product?	0
151296	237931	237932	What are all the government jobs I can apply for at the age of 20? I'm with a B.Sc qualification. What are the lists of exams?	What can I study at the age of 25 with only a high school knowledge?	0
151297	237933	237934	How should I prepare for my NEET (Chemistry)?	How do I prepare for chemistry for NEET 2016?	0
151298	83667	164301	Does Battlefield 1 have online split-screen?	Which games on PS4 support 2 player split-screen?	0
151299	237935	237936	How do I decorate a bedroom with a 1989 theme?	How do I decorate a bedroom with a 1980s theme?	0
151300	237937	237938	What is a factorial?	"What is ""i"" factorial?"	0
151301	173602	237939	How do I send medicines to USA from India?	Can we send medicine via courier within India?	0
151302	237940	237941	Is there any alternative for plastic?	Is there an alternative to plastic jars?	0
151303	237942	213590	How can I develop my profile to apply to top 20 global B-schools?	How do I build my profile for top B-schools?	1
151304	237943	56775	What is the hardest thing to admit?	What is the hardest thing to do?	0
151305	42484	44194	Can you still be pregnant with neg test and period?	Can one be pregnant after three days of period?	1
151306	237944	237945	Why did Pierce Brosnan endorse tobacco products?	Why did Pierce Brosnan endorse Tobacco/Gutka?	1
151307	237946	237947	How do I learn to whistle?	Are you allowed to bring whistles to stadiums?	0
151308	3749	5718	Why World War III are inevitable?	Do you think we are on the verge of World War III?	1
151309	74289	51281	How cold can the Gobi Desert get, and how do its average temperatures compare to the ones in the Great Victoria Desert?	How cold can the Gobi Desert get, and how do its average temperatures compare to the ones in the Registan Desert?	1
151310	237948	237949	How are thoughts generated in the brain and which part of the brain takes care of that?	What part of the brain generates imagination?	0
151311	237950	132444	Is it possible to train myself to be more patient?	What are the best short term courses in financial markets after graduation in economics?	0
151312	237951	237952	What is the average salary of IIM Lucknow?	What is average placement or average salary?	0
151313	237953	81783	What are some really thought-provoking books?	What is the most thought-provoking book you have ever read and why?	0
151314	15007	17919	Is the chaotic nature of a strongly interacting dark matter responsible for the Casimir effect?	Does a superfluid dark matter which ripples when Galaxy clusters collide and waves in a double slit experiment relate GR and QM?	0
151315	2928	237954	How much does an Ola Mini cab earn on average per month from an investor's point of view in Bangalore?	How much does an UberX cab earn on average per month from an investor's point of view in Delhi/NCR?	0
151316	237955	37362	What if Hitler hadn't declared war on the USA?	What would have happened if Hitler hadn't declared war on the United States after Pearl Harbor?	1
151317	237956	237957	What effect did julius caesars seizure of power have on the Roman political system?	What is difference between a diode and a powerdiode in construction and applications?	0
151318	129424	22284	Is it true that Indian Army conducted surgical strikes last night at LOC?	What is the evidence of purported surgical strikes by India on Pakistan?	0
151319	237958	237959	Why does the Canadian flag not have the Union Jack in its upper hoist quadrant, even though it is a British realm?	Do some people view the Union Jack as a flag of oppression just like the Confederate battle flag?	0
151320	237960	237961	What are social networks?	What are some social networks for writing?	0
151321	237962	237963	What is considered a normal menstrual cycle?	What is considered a normal variation in a menstrual cycle?	1
151322	237964	24796	What would be the impact of GST in india?	What is the benefits of gst bill?	1
151323	175024	115975	What are best dating apps/sites in india?	What are the best dating apps in India?	1
151324	237965	237966	Is society equal or desirable?	Is total equality possible or even desirable in any society?	0
151325	237967	237968	What did you major in and what are you doing today?	Are Sushant Singh Rajput and Ankita Lokhande back together?	0
151326	53897	237969	What are some goods books for GMAT preparation?	Which book should I prefer for GMAT preparation?	1
151327	6748	55435	How can I improve my communication skill and English proficiency?	How can I improve my English in a very short time?	1
151328	237970	237971	How do you cruise for gay men?	What dating advice do gay men give to gay men?	0
151329	237972	237973	What is the best way for an experienced recruiter to get a good job?	What do you mean by gift card, from where I can purchase?	0
151330	237974	237975	Is there any difference between mapping and function﻿?	What is the difference between a function and a map(mapping) in mathematics?	1
151331	196439	170573	What programming languages should I learn for game development?	Which programming language should I learn if I am interested in game development?	1
151332	216902	30293	Who is the most important person in your life?	Who is the most important person in your life and why?	1
151333	237976	237977	How can I get rid of carnal desire as a student?	Where do I find a live downloadable re-useable directory of all indian colleges?	0
151334	237978	151680	What should I do after msc mathematics?	What can I do after msc in mathematics?	1
151335	237979	237980	What are the pros and cons of not having a sibling?	What is the best part about having a sibling?	0
151336	237981	90902	"How can I delete an unopened message in ""pending""?"	Can I read deleted messages kik?	0
151337	237982	237983	What are good free alternatives to Microsoft Word?	What are free word processing alternatives to Microsoft Word?	1
151338	13508	67546	Should people over 95 not be allowed to vote?	Should people over 87 not be allowed to vote?	1
151339	237984	237985	Why are some people wary of an Aberdeen Academy High School diploma?	Can you enroll in a university only with a high school diploma?	0
151340	29367	237986	How can I die without pain?	How do I die quickly without feeling anything at all?	0
151341	237987	237988	Are there similar training courses similar to the FDM Academy?	What are some similar companies to Worldstrides?	0
151342	237989	237990	I am seeking for a buyer who is interested to buy Bangladeshi germent products?	I'm interested in creating a new electronic product for a particular niche. It would be similar to other products out there but for a different use case. How can I find out who manufactures these other products to approach them about working on my product as well?	0
151343	237991	237992	What necklace does paul banks wear at lallapalooza in brazil?	Is it weird that I get uncomfortable around people who wear cross necklaces?	0
151344	35930	172274	What's your New Year's resolution for 2017?	What are your New Year's resolutions for 2016?	0
151345	149739	118457	How would you quickly learn a language?	What is the best method to learn language?	1
151346	140021	29716	"What is the meaning of ""flagged as needing improvement"" on Quora?"	How do I talk to the moderators who marked my questions as needing improvements in Quora?	1
151347	237993	232775	I am going to attempt CPT in June 2016 . Is the new syllabus applicable to me?	I am going to attempt CPT in June 2016. Is the new syllabus applicable to me?	1
151348	228616	93941	Is there a direct relationship with gravity and Earth's magnetic field?	What is the relationship between a magnetic field and gravity?	1
151349	237994	237995	Is Barack Obama a nice person when there isn't a camera around?	Is Barack Obama a kind person to work with?	0
151350	237996	78667	What are some of the best books on Java or in general  on object oriented design patterns?	What are some of the best books on Java design patterns?	1
151351	237997	237998	What is the key to learn anything present in NCERT for NEET?	What are some great family games?	0
151352	371	82169	What was the significance of the battle of Somme, and how did this battle compare and contrast to the Battle of Rostov?	What was the significance of the battle of Somme, and how did this battle compare and contrast to the Battle of The Yellow Sea?	1
151353	237999	238000	What is the national symbol of your country?	What is the Indian national symbol?	0
151354	238001	238002	Can I use human eye drops on my dog?	Is there a risk of eye infection from using water as a form of eye drop?	0
151355	238003	18154	What are the legal separation laws in PA and how do they compare with the ones in Montana?	What are the legal separation laws in PA and how do they compare with the ones in California?	0
151356	238004	238005	How can I start a fire of 1000+ degrees Celsius in a controlled environment and with limited resources?	Why does an 18 degree Celsius setting in an air conditioner feel a lot colder than an actual 18 degree Celsius weather temperature?	0
151357	238006	238007	What is the difference between couchbase and mongodb?	Couchbase: What are some negative experiences people have had with Couchbase?	0
151358	238008	238009	What is the ontological status of a fact?	Can someone plz give the Detailed procedure of appearing for CBSE board exams?	0
151359	238010	238011	For comfortable sleeping buy a natural organic mattress?	What are the ways to be sure if the green tea is done well with just green tea bag and hot water and no thermometer?	0
151360	238012	181089	Is capitalism good or bad?	Is capitalism inherently evil?	1
151361	238013	49746	Which is the best school management software?	What is the best school management software?	1
151362	55083	21512	How can I stop masturbation?	How do I quit masturbation?	1
151363	89986	132682	"What's the difference between ""V"" and ""W""?"	"What is the difference between the use of "" V"" and ""W""?"	1
151364	238014	238015	How can I download a compass on a Samsung Galaxy J7 Prime?	How do I root my Samsung Galaxy Core Prime?	0
