id	qid1	qid2	question1	question2	is_duplicate
171701	25977	5259	How do I know if my wife cheats?	How can I know if my spouse is cheating?	1
171702	265277	265278	What are some sarcastic emotions?	Is it ethical to be sarcastic?	0
171703	265279	265280	What is it like to have Christian missionaries as parents?	What does a Christian missionary do in India?	0
171704	265281	265282	Sir I have enrolled for a course in Coursera which is for intermediate, how do I change for course which is for beginners?	Which Quora writer would you like to wish this Rakshabandhan?	0
171705	265283	265284	Does Jio 4G support international roaming for data and calls?	Are international calls free on Jio sim?	0
171706	19175	265285	Where can I find research papers on physics?	Experimental and theoratical methods to calculate the stress?	0
171707	265286	265287	I am 14. My BMI is 15.6 and I still have a protruding belly. What should I do?	I am 14, and a student. I have a tattoo that is very noticeable on my neck. I am a straight A student body. Should I be concerned? What should I do?	0
171708	265288	265289	What does white smoke from motorcycle exhaust mean?	Why does my RPM Ford Transit emit black smoke from the exhaust?	0
171709	265290	265291	I am having headaches because of overthinking of past scenes. What can I do to overcome?	If a high end multi brand retailer wants to move overstock to an online consignment store what should be the consignment rate?	0
171710	63609	21996	What are the safety precautions on handling shotguns proposed by the NRA in Montana?	What are the safety precautions on handling shotguns proposed by the NRA in Mississippi?	1
171711	265292	265293	Is there any objective evidence that God doesn't exist?	Atheists, can you please post the evidence you have discovered that makes you believe that God doesn't exist?	1
171712	265294	265295	I am a teen and I enjoy seeing people get slaughtered on TV, am I mentally ill?	I'm a fifteen year old and I enjoy killing animals, am I mentally ill?	0
171713	22110	74200	Why are my all questions marked for improvement?	Why are all of my Quora questions marked as needing improvement, even though they meet all of the guidelines?	1
171714	9419	53676	Which laptop should I buy for 50k INR?	Which laptop is the best for a 50k budget?	1
171715	265296	32888	How are most wars started?	Why do wars happen?	1
171716	265297	2559	How do I motivate myself to lose weight?	What are the best ways to lose weight?	0
171717	156993	265298	What are some good undervalued stocks to buy right now?	What are the companies whose stocks are worth buying right now?	1
171718	265299	265300	What field of engineering is the most difficult, and why?	Is engineering the toughest field?	0
171719	265301	265302	What is a truly elastic collision?	What is elastic collision?	1
171720	234590	38557	Which is the best available laptop for 50,000Rs?	Which is the best laptop under Rs 50000?	1
171721	265303	265304	Why do I hate everything?	What do I do now that I hate everything?	0
171722	265305	265306	What can I do to become more wise?	How do you become wiser in life?	1
171723	164801	121434	What are the reasons behind nuclear energy being non-renewable?	Is nuclear energy non-renewable? If not, why?	1
171724	265307	265308	Can you wear a mask without wearing one?	What masks do you wear?	0
171725	138832	116353	Why is (1/9)^1/2 is equal to only 1/3 and not - 1/3?	Why is [(-1) ^(1/2)] ^3 not equal to [(-1) ^3] ^(1/2)?	0
171726	265309	265310	Avi and kevins parents pentatonix?	Does Microsoft Office 2007 needs a product key in order to use it?	0
171727	265311	257135	Does having a good profile picture brings you more upvotes?	Have you noticed that your profile picture affects upvotes?	1
171728	265312	265313	What is the best place to eat street food in Mumbai?	What is the Best street food to try in mumbai?	1
171729	144755	85186	What are some good songs to listen to when you hate someone?	What are some good songs to listen to?	0
171730	265314	265315	When you buy a shoe from an international website like Pro-Direct Soccer what is the customs duty to be paid in India?	What are the best trekking shoes to buy in India?	0
171731	265316	265317	What schooling have you gone through to become a wildlife rehabilitator? Im a current biology major and considering becoming one	What are political factors? What are some examples?	0
171732	265318	265319	Which have extra weight 1kg cotton or 1kg iron?	How much energy is produced if 1kg of silver is converted to energy?	0
171733	265320	265321	If God is real why would he create people that don't believe in him?	Why did God create people who He knows wouldn't believe in Him later in life?	1
171734	265169	265322	Do you hand wash your underwear everyday or put it in the laundry and wash it all together like once a week?	How many hand wash use one time?	0
171735	10234	12191	How do we make money online?	What are ways of earning money online?	1
171736	265323	265324	I am afraid that I was involved in a hit-and-run, what should I do?	What are some of the best comprehensive Yoga books?	0
171737	34364	265325	What are the biggest mistakes people make when visiting Sweden?	What are the biggest mistakes people make when visiting Norway?	0
171738	265326	265327	How could someone come out the formula that could create unlimited wealth?	Theoretically could someone come up with the formula that could create an unlimited amount of wealth?	1
171739	265328	29667	What are the most profound jokes involving startups?	Why do so many startups fail?	0
171740	265329	265330	Do magnets ever lose their magnetism?	Is copper magnetic?	0
171741	265331	265332	What is the reason for Virat Kohli's success?	What is the reason for Virat Kohli's failure in the India tour of England?	0
171742	265333	265334	Why are Americans anti-intellectual?	When did Americans become so anti-intellectual?	1
171743	265335	265336	Do you agree with Donald Trump´s philosophy, if yes why, if not why not?	Is there any universities in Germany that provides master's degrees for international students without requiring English proficiency tests?	0
171744	265337	265338	How do I spend my weekends wonderfully?	What are the best ways to spend time on weekends?	0
171745	126433	265339	How can I buy a new car without being ripped off from dealers?	How do you avoid getting ripped off when you buy a used car?	0
171746	19845	265340	How is ATP used in photosynthesis?	How do plants use carbon dioxide in photosynthesis?	0
171747	265341	265342	What are the top five apps for getting free kiss day gift?	What are the top five apps for getting free promise day gift?	0
171748	265343	58880	Is spot counselling for reserved candidates in ipu?	Is spot counselling for reserved candidates?	0
171749	265344	265345	What are some current products named after Greek mythology?	What are some of the best known products that are named after Greek gods and goddesses?	1
171750	265346	265347	Why am I not liked even though I try to be likeable?	Why am I jealous of my girlfriend even though I know I shouldn't be?	0
171751	265348	265349	What is rational thinking?	What is rationality?	0
171752	265350	194114	What are some advantages and disadvantages of drinking 2 glasses of sugarcane juice?	Is it healthy to fast for one day per week?	0
171753	265351	265352	What makes YouTube channel DisneyCollectorBR so popular?	How do you make your YouTube channel popular?	0
171754	265353	265354	What is happening in my brain when, after a few hours of concentrated work, my mind feels foggy and distracted?	What happens after a big mass is removed from brain?	0
171755	163227	12726	For you what is the meaning of life?	What is the meaning or purpose of life?	1
171756	59222	188755	What is the best earphone under 1000 rs?	What is the best earphone under 1k?	1
171757	245573	182386	How do I translate assammee language into english?	How do I translate 扣帽子 into English?	0
171758	64021	247437	What is Shortfeeds.com?	What does groupcommerce.com do?	0
171759	115467	232084	Did time machine exist?	Can a dragon possibly exist?	0
171760	265355	265356	If cats and kittens could write, what questions would they ask on Quora?	If cats had Quora, what kind of questions would they ask?	1
171761	265357	265358	How can I open my computer if I forget my password?	I forget my PC password what should I do to open it?	1
171762	5837	265359	What is the significance of a name?	What is the significance of the name James?	0
171763	48793	94118	What are the best lines in Hindi to start anchoring?	How do I start a program while anchoring?	0
171764	265360	265361	ELI5: How can I use Lagrange Interpolation? Are there other, easier to use, algorithms?	What algorithms are used in Facetune?	0
171765	265362	34356	Can a dechoker be bought using FSA money?	Is space exploration a waste of money?	0
171766	265363	265364	What is your review of Sausage Party?	What do you think about movie Sausage Party?	1
171767	30307	265365	How much does a YouTuber with 1 million subscribers earn in a year?	How do you get to 1 million YouTube subscribers or views?	0
171768	35035	5729	Which is the best QuickBooks error support number?	Which is the best QuickBooks Tech Support Number in New York, USA?	1
171769	176683	265366	How do we really know what the temperature of the Sun is?	What is the sun's temperature?	0
171770	265367	265368	What are some examples of homozygous dominant and homozygous recessive genes?	What are some examples of homozygous dominant and homozygous recessive genes	1
171771	265369	265370	How do I know if my grandfather is enlightened?	How can I know if my mother is enlightened?	1
171772	102327	233549	How can I understand new concepts quickly?	What are some techniques are there to understand new concepts faster?	1
171773	115824	265371	Where can I get some high quality weed (marijuana) in  Delhi/NCR?	Where can I find high quality weed in Delhi?	1
171774	265372	265373	I have completed my b.tech in Dec 2016 and want to start preparation for UPSC from Delhi can anyone guide me plz?	I admire ur strength . I want to be like you. I want to learn marshall arts, but will it develope my muscles I dont want muscles since I am a girl?	0
171775	265374	265375	Which is the fastest processor in the world?	Which is the Fastest computer in the world?	0
171776	265376	222087	Scores in NEET PG to get into KEM Mumbai in MS Gen surgery? (in 2018)	Does having a lot of peer-reviewed publications give PhD students added confidence?	0
171777	265377	265378	Does time stand still inside a black hole? Is time travel then possible by standing still?	How does time pass inside a black hole?	1
171778	265379	265380	What's the average profit margin a semi truck generates in one month?	What is the life of an average long haul truck? What truck has clocked the highest mileage?	0
171779	220339	265381	What is the meaning of Quora?	"What is the difference between sending ""Thanks"" and agreeing with/upvoting an answer on Quora?"	0
171780	265382	265383	What's the next best thing?	What is the next best thing in biotechnology?	0
171781	265384	34123	How will I know if she likes me the way I like her?	How do I know that she like me?	0
171782	143782	169612	In what ways is Hillary Clinton corrupt?	What hard evidence is there that supports the claims that Hillary is corrupt?	1
171783	265385	265386	Can I get a govt seat in up if my neet rank is 7304?	Despite so many flops, why is Sonakshi Sinha still in Bollywood?	0
171784	265387	265388	How many marks I need in JEE main to get NIT (sc category)?	What should be one's JEE Main score to get CSE at NIT Tirchy with SC reservation?	1
171785	265389	265390	Icrease in public debts and external debts in 1980's in india?	Is there any existing review of Berkshire Hathaway letter to shareholders for the year 1997?	0
171786	63941	265391	Why should I change the world?	Can one person really change the world?	0
171787	152160	265392	What is syllabus for the examination of PSTCL Junior engineer/ IT for technical section?	Which type of syllabus comes in NIFT examination?	0
171788	265393	265394	What do most Japanese people think about the Japanese imperialist period?	Are there any therapists in Mumbai who have dealt with Selective Mutism in kids?	0
171789	265395	265396	Which is more dangerous the far right or the far left?	What is far-right, centre-left, labor etc. and how can I remember them easily?	0
171790	265397	146928	What are the software a civil engineer must know?	What are the softwares that a civil engineer must know?	1
171791	183896	265398	What are the main imports and exports of Venezuela, and how does Venezuela's industry compare to Montserrat's?	What are the main imports and exports of Venezuela, and how does Venezuela's industry compare to Mexico's?	0
171792	265399	265400	Who are the most active private equity firms purchasing revenue producing tech startups?	Who are some of the most reclusive/private musicians or bands that are currently active?	0
171793	173701	265401	What is the definition of an archetypal hero?	Is Captain America a hero, anti-hero, or a villain?	0
171794	14545	265402	What makes someone a good kisser?	What defines a good kisser?	1
171795	265403	265404	Time taken to decypt the secret image in Newton's raphons method?	Can we call Mahatma Gandhi a Post-modernist thinker?	0
171796	111771	265405	What are good gifts for a foreign visitor to bring when they're invited to someone's home in São Tomé and Príncipe for the first time?	What are good gifts for a foreign visitor to bring when they're invited to someone's home in Lithuania for the first time?	0
171797	265406	265407	What trousers look best with a navy blue shirt?	Which coloured blazer and shirt should go well with a navy blue trouser?	0
171798	265408	265409	Why is the White House called the White House?	"Why is the White House called ""White House""?"	1
171799	265410	265411	Now that Steve is dead, what will happen to Fake Steve?	Is Steve Jobs really dead?	0
171800	265412	51257	What is Charlie Chaplin best known for?	What are some of the best Charlie Chaplin movies which I must watch? How can I get those?	0
171801	50137	54718	What has been the best moment in your entire life?	Which was your best moment in life?	1
171802	265413	265414	How easy is it to get admitted to the MSc of applied physics in TU Delft as a European student with a BSc in physics from Greece?	I have got the admit from TU-Delft for MS in Petroleum engineering. I have got no scholarship. Is it right for me to join the program?	0
171803	265415	265416	Is China a great country?	What makes China great?	1
171804	265417	265418	What are the codes for Patient Administration System for a hospital in Java?	A person who was in the hospital for a while was given medication now what kind of drug test would the person take to find out what drugs are in his system from the hospital?	0
171805	265419	265420	How should I convince my girlfriend not to break up?	What should I do to convince my girlfriend to not break up with me?	1
171806	35475	251838	How do I attach my car with Ola cabs and how much I can expect from it?	How do I attach my car with Ola?	1
171807	265421	265422	What is your review of Industry And Labour Under British Rule In India?	Where there any good Britishers when they ruled India?	0
171808	188461	265423	What is your biggest strength and weakness?	What is your biggest strength and weakness regarding relationships?	0
171809	139732	265424	Why do some people seem to be more susceptible to head lice than others?	Can you do a lice treatment with Listerine?	0
171810	110774	265425	How do you open .tif files?	How do you open .nrkt files?	0
171811	265426	265427	When did St. Joseph the foster father of Jesus die?	When did St. Joseph, foster father of Jesus, die?	1
171812	265428	97906	How do atheists explain demonic possession?	Do people still believe in demonic possession?	0
171813	265429	178228	What will happen in Star Wars rouge one?	What is the storyline of Star Wars Rogue One? What timeline does it happen in?	1
171814	265430	265431	Is there any problem if menstruation cycle completed before the exact period?	Why was child labor used? How can this be stopped?	0
171815	18276	32032	Why do people put ridiculous questions on Quora when they can just Google them? Huh, Huh, Huh :-/	Why do people ask questions here in Quora instead of just googling?	1
171816	2986	13113	How do I speak English like celebrities?	How To speak English Fluently ?	1
171817	265432	265433	Where can I find data on the number of apartment complexes in the US, and the demographics of residents in those complexes?	How do I sort complex numbers using merge sort in c?	0
171818	78774	25455	Which is the oldest religion in world?	Which religion is oldest religion in the earth?	1
171819	1920	14810	How can I gain healthy weight and mass?	How can I gain weight naturally?	1
171820	265434	265435	Did George Michael speak Greek?	How old is George Michael?	0
171821	265436	257442	Let [math]x=R[/math] and [math]p[/math] be the discrete metric on [math]X[/math] defined by [math]p(x,y) = 8[/math] if [math]x[/math] is not equal to [math]y[/math] and [math]0[/math], if [math]x=y[/math]. What is [math]\text{B}_0\text{(-1)}[/math]?	Do economics majors need math?	0
171822	265437	265438	Which are the three dimensions?	What are the three dimensions?	1
171823	265439	265440	What is the purpose of having so much homework for Kindergarden age kids?	What are the benefits of depositing into a credit union savings account, then borrowing that money?	0
171824	43479	36293	What are the best hotels to stay in Goa?	Where is the Best place to stay in Goa?	1
171825	265441	265442	What are some examples of compressible fluids?	How is lighter fluid made?	0
171826	265443	265444	What is the best method for growing my Instagram page?	What is the best method to grow my Instagram page?	1
171827	151580	265445	"Will my iPhone alarm still go off if ""Do Not Disturb"" is on?"	If my phone is in mute will my alarm still go off?	0
171828	265446	265447	What's the best way to diff two rows (in the same table) in mysql?	I've a variable number of tables that have the same structure in PHP MySQL and I want to retrieve data from it. How could I do that?	0
171829	265448	237540	What do you think about the third 2016 US presidential debate?	What did you think about the first 2016 US presidential debate?	0
171830	265449	265450	What is the meaning of Gujarati word 'Sanedo'?	What are the meanings of Gujarati words 'Motabhai' and 'Motiben'?	0
171831	70404	68233	How do you live your life?	Which is the best way of living life?	0
171832	216254	89260	Where can I learn stock marketing?	How can one learn stock market?	1
171833	26908	94619	Why is the Tribunal in Hague a fake UN-backed tribunal in the world?	How do people in the world think that the U.S. calls the ruling by the fake UN tribunal in Hague as an international law?	1
171834	265451	79883	Which DSLR is better to buy in October 2016: Canon 700D or Canon 1300D?	Which camera is better to buy canon 1300d or 700d?	1
171835	265452	265453	What is the best way to learn JSP?	How do I learn JSP?	1
171836	265454	265455	What is the difference between a square and a perfect square?	How to prove that a number isn't a perfect square?	0
171837	265456	265457	Does charging my mobile phone increase the weight of the battery temporarily?	How can we make a mobile phone battery?	0
171838	265458	265459	Which Ontario universities should I consider applying to with an 87% grade 12 average?	How do I become rich like Mark Zuckerberg?	0
171839	31821	69412	What is your biggest challenge in life right now?	What is the one biggest problem in your life right now?	1
171840	265460	265461	Do you take pictures with your eyes closed?	Who do you guys thing will win and become president?	0
171841	265462	83499	Is there any loophole in new 500 and 2000 rupees notes launched for blackmoney holders?	What are loopholes of issuing 2000 notes instead of 500 and 1000 notes?	1
171842	265463	265464	Where can I find the total or average distance covered by the EPL players?	Is the IPL and EPL fixed?	0
171843	265465	265466	Is there anyway to access a course on NoteFull for free?	Is Udacity free for all courses?	0
171844	265467	265468	What are the differences between piano and organ?	What is the difference between a piano and an organ?	1
171845	265469	265470	Do children who sexually abuse other children continue this behavior into adulthood?	Is South Africa a major location where sexual tourists commit crimes against children who have been forced into sexual slavery?	0
171846	265471	265472	Is there a My Little Pony D&D system?	Which My Little Pony are you?	0
171847	35921	3062	How imminent is World War three?	How close is a World War III?	1
171848	265473	265474	What is a transistor and how does it work in layman's terms?	How do transistors work?	0
171849	265475	2559	I want to lose 70 lbs and gain abs (no time limit). How do I do this, and where the hell do I start? Can you recommend any program whatsoever?	What are the best ways to lose weight?	0
171850	125389	198900	What do you think of Russian troops arriving in Pakistan for a joint military drill? Is this the biggest failure of the Modi government?	Will India lose Russia as an ally because of Modi?	0
171851	265476	265477	How do I lose weight only through a vegan diet?	Why am I gaining weight on a vegan diet?	0
171852	265478	265479	Is there a way you can get pictures redeveloped if they are from 1988?	Is there a way you can get pictures redeveloped if they're from 1988 and you don't have the negative picture film?	1
171853	265480	265481	How do I stop receiving message/notification from whatsapp, from a whatsapp group?	How do I prevent friends from spamming a WhatsApp group?	0
171854	265482	265483	Is a sign of a marriage getting ready to end if my husband is not really answering me, watching TV all day, too much inactivity, and more?	As a full-time mom when your child is still a baby, apart from taking care of them, you don't really get much time to do anything productive. What are some key things to do, to make each day more productive so it could help my family and I, and help me when I'm ready to pursue my career in the future?	0
171855	265484	265485	How about semipermanent eyebrows? Would you try it?	How do you clean an eyebrow piercing? Is there more than one way to do it?	0
171856	265486	265487	Should I get a tattoo as a medical student/doctor?	How do medical doctors get tenured? What exactly does one have to do to get tenured?	0
171857	265488	34016	What universities does MGE Energy recruit new grads from? What majors are they looking for?	What universities does Ring Energy recruit new grads from? What majors are they looking for?	0
171858	7156	68964	What is your opinion on brexit?	What is your opinion about brexit?	1
171859	265489	265490	Why does Bernie Sanders and other politicians keep repeating the gender wage gap myth?	Why do feminists believe in the wage gap myth?	0
171860	72484	265491	How does malt vinegar affect your health?	What are some health benefits of malt vinegar? How can you include malt vinegar in your diet?	1
171861	265492	265493	What are some things an Amazon Echo can do that Siri can't?	What is SAP's technology stack?	0
171862	265494	265495	How do I find my passion?	How do you know if you've discovered your passion?	0
171863	265496	265497	Startup Visa: Can I create a website to host a service if I am on an H1B status?	Can H1B visa holders study?	0
171864	97319	265498	When will Quora allow questions and answers in Hindi?	Does Quora also come in Hindi?	1
171865	248005	265499	I have $2,000 to spend on a trip. Where should I go for 2 weeks?	How should I plan a 2-week bike trip from NYC to Toronto?	0
171866	265500	103188	What do people think of Lockerz.com?	What do people think of jobdreaming.com?	0
171867	265501	265502	What are some myths about intercourse?	What are some myths about sneezing?	0
171868	265503	265504	How do I keep hermit crabs as pets?	How do you hand feed a hermit crab?	0
171869	58038	55263	How can we write a essay?	How do I write an essay in English?	1
171870	265505	265506	What are some popular Soccer metaphors?	What is the best metaphor or analogy website?	0
171871	265507	265508	Is there still any MNC left who recruit freshers 2016 in this year(2016)?(or)Upcoming MNC’s off campus drives in hyderabad for freshers 2016?	In layman's terms, what is a project repository?	0
171872	265509	265510	What are SEO trends for 2017?	What are the SEO trends in 2017?	1
171873	265511	235732	Who all are in the technical team at Zomato?	What does the Zomato logo mean?	0
171874	66240	265512	Does meditation help against anxiety?	Will meditating regularly really help me with my anxiety?	1
171875	265513	265514	What is it like to be a fashion merchandising professor?	What does a fashion merchandiser do?	0
171876	6679	8254	How do I get meth out of my system in 3 days?	How long will it take for meth to get out of my system if I'm 6'0, 155 lb and 17 years old?	1
171877	265515	265516	What are stone spirits?	Do spirits really enter into an unknown body?	0
171878	132906	113929	Why do/ don't you think that there is (or should be) a life after death?	If there is life after death, why do I live?	0
171879	265517	265518	How are missiles released from a fighter for firing?	How are missiles released and fired from a fighter jet?	1
171880	265519	265520	Radius of circle inside an equilateral triangle?	How do I market MYSELF the right way if you are starting your career as a product photographer in Delhi India?	0
171881	72435	199646	What are some of the best new products that are available and most people don't know about?	What are some mind-blowing technology gadgets that exist that most people don't know about?	1
171882	265521	265522	Why couldn't Brandon Routh be popular portraying Superman?	In Batman vs Superman, how does Batman even fight Superman who is portrayed to have god-like powers?	0
