id	qid1	qid2	question1	question2	is_duplicate
124180	200584	200585	What steps are the people of Pakistan taking to avoid their youth from getting brainwashed into becoming terrorists?	How do terrorists brainwash people to become one among them?	0
124181	71418	195114	What operating system is preferred by most programmers and why?	Which operating system computer programmers and hackers like the most?	1
124182	200586	113925	How should I invest as a teenager?	Where should I invest my money as a teenager?	1
124183	200587	200588	Where can I watch Detective Conan episode?	What are some of the best Detective Conan episodes involving the Black Organisation?	0
124184	55923	43097	What is your resolution for this year 2017?	What will be your new year resolution for 2017 and your plan of execution?	1
124185	200589	200590	What are the best way for study computer communications himself?	Will certification in data analytics with basic knowledge help me in placements?	0
124186	200591	200592	What is hexadecimal?	What's hexadecimal?	1
124187	10804	58861	How do I stop worrying about what others think of me?	Should I care what people think about me? Most have a positive impression of me, but should I care to keep it that way?	1
124188	200593	200594	What is the life of a commercial truck driver like?	I've been hearing tons of advertisements for commercial truck driver recruiting. Why is there so much of this going on right now?	0
124189	200595	200596	What is an executive summary of Apple?	What's executive summary?	0
124190	200597	200598	Which Winston Churchill biography is best?	What is a good biography about Winston Churchill?	1
124191	200599	200600	Has anyone got the Nougat update on Oneplus 1?	Has anyone got the Nougat update on Oneplus 3?	0
124192	117745	135918	What's it like being a pornstar?	What it is like to be a pornstar?	1
124193	200601	200602	My former employer withheld money for my taxes on my paychecks but never paid the irs. How do I get my money back that he withheld?	How can I find out how much I owe the IRS?	0
124194	9002	57002	What led to Cyrus Mistry ouster from TATA GROUP?	Why was Cyrus Mistry sacked by Ratan Tata from Tata Sons?	1
124195	200603	200604	How do you redeem a PSN code?	Is PSN down in the us?	0
124196	200605	200606	What are the key courses I need to take as an electrical/mechanical engineering major if I want to work in automative systems, power train engineering, battery design or building electronic devices/embedded systems?	Which are good institutes for short term course or training of Embedded System Design (Power Electronics domain) in Bangalore?	0
124197	33093	15767	What are your New Year resolutions for the upcoming year 2017?	What is your new year resolution?	1
124198	200607	200608	What exactly is a private sector job?	What is the private sector?	0
124199	200609	200610	How does a metal detector work?	How do metal detectors work?	1
124200	31193	40886	What is that one incident that changed your life for better?	What was one of your life changing experiences?	1
124201	200611	177653	What are the monomers of dipeptide?	What are the monomers of lipids?	0
124202	200612	200613	Is it immoral to think about girlfriends of your friends while masturbating?	I fell in love with my close friend who is friends with my girlfriend too. See more in details, but I don't feel guilty. How immoral can this be?	0
124203	12009	114596	What is the right procedure to make green tea?	How can I make green tea?	1
124204	200614	200615	Does Arya have a chance of reuniting with her wolf Nymeria?	What would the Starks have done with Arya if they won the war and got her back from the Hound?	0
124205	200616	200617	How was Donald J. Trump able to attend Wharton?	How did Donald Trump manage to get into Wharton?	1
124206	123639	20708	How could I become an actor?	How can I become actor?	1
124207	191776	200618	Why can I feel tremors and shaking in my body when I'm lying down and very still?	Why do I feel sick after I lie down?	0
124208	200619	200620	Say NASA found out halfway through STS 107 that the shuttle is too damaged to reenter Earth, how would they save the crew?	How would NASA have saved the STS 107 crew if they found out, halfway through the mission, that the shuttle was too damaged to return to earth?	1
124209	200621	200622	Can I delete a text before the recipient reads it on iPhone 6 so they can't read it?	Do you have to buy an iPhone if you own a MacBook?	0
124210	200623	200624	Why don't electric field lines form closed loops?	Why don't/can't we put solar panels in the Sahara Desert as a source of electricity?	0
124211	200625	7406	Should reservation be removed from India? (I want specific answers from SC/ST, OBC catagory, Because open catagory has always stands against reservation)	Should reservation be removed from India?	1
124212	200626	200627	When I use Skype video, why do I see the picture of myself in mirror image? Is the picture of the person on the other end also a mirror image?	I want to break up my possesive Korean girlfriend. How could I possibly do it nicely without being hunted?	0
124213	200628	200629	Will eSports ever become an Olympic sport?	Will baseball ever become an Olympic sport?	0
124214	200630	18499	How much of a profit are you supposed to give to an investor and keep?	How much of your company should you give to an investor?	1
124215	104613	200631	Which is best os for hacking?	Which os is good for hacking?	1
124216	200632	200633	Is there a way to download the yellow pages into a CSV or Excel file?	I need to create invoices (110) from a CSV file. They are for my cleaner. She does not know how, and gave me her ABN. Payments are downloaded to CSV?	0
124217	200634	200635	How can you learn calligraphy on your own?	Consolidation of Pvt Ltd with associate company in India?	0
124218	200636	200637	How do we use fpga?	What is FPGA? How does that works?	1
124219	200638	200639	What happened to Sauron’s armies?	Whatever happened to Sauron's armies after the One Ring's destruction?	0
124220	200640	200641	How much will the bank FD rate of interest decrease in India in future?	Will the bank FD rate of interest decrease in the future in India?	1
124221	200642	200643	Recreational Vehicles: What's it like to live out of a van or RV for an extended period of time?	Recreational Vehicles: What does it feel like to live year-round in an RV?	1
124222	200644	200645	Over 40 crowd, what is THE most stylish Pai of reading glasses money-no-object that you have seen?	Who is your favourite Onyanko Club member?	0
124223	200646	200647	What is the main purpose of marketing service agencies?	What is the definition of achiving happiness in life beyond building a family?	0
124224	69625	200648	What is the best mobile to buy under Rs 7k?	Which is the best mobile to buy under 14k rupees?	0
124225	66227	200649	What is the best question that I can ask on Quora?	Which is the best question asked on Quora?	0
124226	100757	26138	What are the most interesting and mindblowing facts you know?	What is the most interesting fact you know off the top of your head?	1
124227	200650	200651	President Obama has a clear record of divisiveness concerning race and political issues. Will you simply continue this trend if elected?	If Congress and the president fail to agree on raising the debt ceiling, and interest rates are forced up and the economy is forced into a recession, will that help or hurt Obama's chances of re-election?	0
124228	29929	200652	What are the parts of a cell?	What are the major parts of a cell?	0
124229	200653	200654	"How do I get work from ""Upwork""?"	How do I get work from upwork?	1
124230	200655	200656	Why didn't Lord Krishna's son Pradhyumna participate in the Mahabharata War? He was a proficient warrior and Abhimanyu's trainer as well.	Lord Shiva is powerful and he is the absolute God as per my understanding. How come he doesn't know that he is beheading his own son's head?	0
124231	200657	200658	Can content created by the Quora organizational account be collapsed by downvotes?	Can Quora's answers collapsed by downvotes?	1
124232	155816	108403	How can you stop your Beagle Australian Shepherd mix puppies from biting your shoes?	How do I stop my Pit Bull/English Bulldog mix from biting my shoes?	1
124233	200659	200660	Does an operating system have to have some assembly code for the kernel or any part of it?	Do SBI buddy needs account in SBI?	0
124234	200661	200662	Is the compass app of iphone 6 accurate in measuring flatness of a table?	How is a compass app made?	0
124235	200663	200664	Why do the Sentinels in X-Men: Days of Future Past look so similar to the Destroyer in Thor?	Why does The Destroyer in Thor look so much like the Sentinels in X-Men: Days of The Future Past?	1
124236	114739	27734	What career choice do I have after completing a B.Tech in mechanical engineering if I am interested in space research?	What is the best field for earning money after completing a B.Tech in mechanical engineering?	1
124237	153521	49313	What are the job opportunities after getting a Master's degree in mechanical engineering in Germany?	What are career option and job opportunities for mechanical engineering (graduate) student in Germany?	1
124238	200665	200666	What are fraternal twins?	What is it like to be a fraternal twin?	0
124239	200667	106938	What is the Great Depression?	What is the Great Depression all about?	1
124240	86730	200668	What is the deepest lake in Europe, and how does this lake's flora and fauna compare to that of Lake Superior?	What is the deepest lake in Europe, and how does this lake's flora and fauna compare to that of Lake Eerie?	0
124241	200669	200670	How can we improve the efficiency of learning?	How can I improve my learning efficiency?	1
124242	200671	200672	How did Vladimir Putin get so rich? Why doesn't he spend some of his money on his country?	Is Putin mad, or is he planning on using his nukes?	0
124243	200673	200674	Why is Super Mario so successful?	Why isn't there Super Mario on the iPhone?	0
124244	82359	11497	What are the weirdest questions you came across on Quora?	What is the weirdest question you have come across on Quora?	1
124245	200675	200676	Why can't I see the anonymous option next to the submit button anymore?	Why can't I see a 'go anonymous' option next to the 'submit question' button anymore?	1
124246	61170	200677	What are stereotypes of drivers of various car brands?	Wich was the first car brand?	0
124247	47103	63037	What is the one thing in your past that you will change given a chance?	What is a thing that you would like to change in yourself or your life?	1
124248	200678	200679	How do Mental Hospitals work?	What are the rules involving mental hospitals?	0
124249	17446	200680	"What is the politically correct term for ""midgets""?"	Is 'midget' a derogatory term for the vertically challenged?	0
124250	200681	19545	I sing from the diaphragm but I sound shaky while I sing. What can I do to sing better?	What should I do to sing better?	0
124251	200682	200683	Can someone translate this Japanese comment section to English?	Could you translate this from Japanese to English?	0
124252	200684	200685	"What word rhymes with ""find""?"	What words rhyme with orange?	0
124253	200686	200687	Chamath Palihapitiya: How do you manage ego and humility among Warriors players? What is the incentive program for success?	How are the Warriors coaches, players & management dealing with expectations of another championship?	0
124254	134390	111204	What is the easiest way to learn guitar if I had never touched guitar before?	How can l learn guitar? What are some good tips for playing guitar?	0
124255	200688	200689	Writing: How do you write and send a letter to Ellen DeGeneres?	How can Ellen DeGeneres send someone to the White House?	0
124256	200690	200691	What are the hardest adjustments to make when visiting Syria?	What are the hardest adjustments to make when visiting Poland?	0
124257	88876	200692	Have you ever been raped?	Have you been raped?	1
124258	200693	200694	How can you naturally increase oxytocin levels?	How can I increase my SHGB levels?	0
124259	200695	200696	Why isn't Los Angeles the capital of California?	Why is Sacremento the capital of California while Los Angeles seems to be the busy city?	1
124260	200697	200698	Is it bad to feel unwanted?	Is it bad that I feel?	0
124261	98579	76552	How India can get a permanent seat in UN security council?	When and how will India get a permanent seat in UN security council?	1
124262	200699	200700	How many Tsar Bombas would it take to end life on our planet?	What are the best paranormal fiction books that DO NOT come under young adult or paranormal romance category?	0
124263	200701	200702	As a victim of identity theft fraud, how do I get my money back if I know who did it?	How do I get back with my ex-girlfriend who has broken up just for freedom and space?	0
124264	200703	5007	Which university in Singapore is best for computer science?	What are the best universities in Germany for a Master's in computer science?	0
124265	161830	195200	What is a good, reliable, unbiased daily world news source?	Who is the most unbiased and reliable source of news in the Philippines?	0
124266	200704	200705	Is Rajnikant the Chuck Norris of India?	Why is Chuck Norris the God of Rajnikant?	0
124267	200706	200707	What are the best private elementary schools in Greenville, SC? What were your experiences with them?	Can a person with shoulder ligament tear do push ups?	0
124268	200708	200709	What are the most abundant ant species by mass?	What kinds of bugs are superior to humans?	0
124269	200710	200711	What are the legal and ethical issues related to boycotting goods from other countries?	What are the politically divisive issues in your country that would be bizarre to people from other countries with a similar level of development?	0
124270	200712	200713	What happens if a car battery short circuits?	What is another way to start a car, without jumper cables?	0
124271	200714	200715	Can I send a large number of emails in my Gmail inbox to one person without sending them individually?	Is it possible to use Gmail to send email inside a python script?	0
124272	104703	144455	What are career opportunities for housewife as a work from home?	I am a housewife what are the best work from home jobs?	1
124273	200716	200717	"What is the meaning of the British slang term ""tosser""?"	What are the slangs used in your local area?	0
124274	200718	200719	How is National Institute of Bank Management. How much intake they take and how much cat percentile required?	How much marks can fetch you 95 percentile in cat?	0
124275	12719	25163	What are the safety precautions on handling shotguns proposed by the NRA in Kansas?	What are the safety precautions on handling shotguns proposed by the NRA in Pennsylvania?	1
124276	60610	200720	How can I emigrate from South Africa?	Which country should I emigrate to from South Africa?	0
124277	24734	16490	How can I speaking fluently speaking English?	How do I learn spoken English?	1
124278	200721	200722	How many hours does a cop have to work daily? And can they take weekends off?	How many hours per week does the average Walmart employee work?	0
124279	200723	2303	How do I go from 40+% body fat to 10% body fat?	How do I lose weight and gain muscle?	0
124280	4473	200724	Why should one choose IPS over IAS?	How Ips can be better than IAS?	1
124281	200725	200726	What is the scariest situation you have ever been in?	What is the scariest situation you've been in?	1
124282	200727	200728	How were Gestapo prisoners treated by the Soviets in Soviet captivity?	How did Soviets treat German POWs after World War 2 ended?	0
124283	200729	200730	Why does Turkey fight every single secular force in Syria and spare ISIS?	Why Turkey is not fighting ISIS?	1
124284	200731	105634	What is it like to be a janitor at Facebook?	What does it feel like to be a janitor?	0
124285	52948	5057	Where is the proof of alien life?	Is there proof of extra terrestrial life?	1
124286	25984	69108	How do I improve my English language?	How can I improve my speaking?	1
124287	200732	200733	How many wonders in the world?	How many wonders are there in the world?	1
124288	129984	200734	How accurate is carbon dating?	How is carbon dating preformed? Does carbon dating gives the accurate period of any artefacts discovered?	1
124289	164086	200735	Where can I get different types of designer lanyards in Melbourne?	Where can I get various types of printed lanyards in Melbourne?	0
124290	200736	200737	Which TV Channel in India is broadcasting Barcelona vs Real Madrid Copa Del Ray semi-final?	FC Barcelona: Can the trio of Suarez, Neymar and Messi click the same way that Benzema, Ronaldo and Bale did for Real Madrid this past season?	0
124291	138939	200738	Which fitness tracker is better Xiaomi Mi band 1s or Intex Fitrist pulzz?	Why should I not go for a Xiaomi Redmi 1s?	0
124292	200739	200740	How do I edit the value of the peak amplitude in an AC voltage source from the command window using set_param?	How do I increase line AC voltage from 120 Volts to 240 Volts?	0
124293	200741	70991	How much time does it take to get work visa for uae?	How many days are required to get a Dubai work visa online?	1
124294	200742	200743	Can one become a sociopath during their life or are you born with it?	How does one become a sociopath? What makes one?	0
124295	102437	200744	How do I download test cases with design steps to excel from HP ALM?	What are the steps to buy a laptop from HP's official website?	0
124296	200745	200746	Does any college in Delhi university offer food technology?	How do I make sure if I am buying a genuine Casio watch in Mumbai? Also where to buy it in Mumbai?	0
124297	200747	200748	I have a MD and I'm not sure if I will be matched for residency. What graduate degree would be more helpful to me in the future, MPH or psychology?	I want to be a doctor. I am afraid that if I go to the University of Toronto for my undergraduate degree, my GPA will be very low (according to rumors). And then I will not be able to get accepted to University of Toronto's Medical School. What is the best thing for me to do in this situation?	0
124298	200749	200750	Why do pennies exist?	Why do pennies still exist?	0
124299	200751	52781	What are the reactions when a girl gets pregnant?	When does a girl gets pregnant?	0
124300	76756	175569	How can you learn english fast and easy?	How can I learn english quickly and well?	1
124301	1807	170573	What programming language should I learn if I want to do a 2D MMORPG game?	Which programming language should I learn if I am interested in game development?	1
124302	73062	200752	Is there a way to prevent Google Chrome from opening new tabs when clicking certain links?	How can I measure the time it takes for a new tab to load in the browser after a clicking a link? Is there a Firefox/Google developer tool for this?	0
124303	100352	200753	How can I learn ASP.NET?	How should I start learning asp.net?	1
124304	200754	200755	How does an AC generator works?	How does the AC Generator work?	1
124305	200756	200757	How many companies in the U.S. have over $100M in revenue?	How many companies in the usa have over $500M in revenue?	0
124306	200758	200759	"Mexican Immigrants in USA: What does ""paisa"" mean?"	"What does ""calling in a chit"" mean?"	0
124307	200760	200761	Is there any male stylist like Bethany Mota?	Why does Bethany Mota wear push up and padded bras?	0
124308	200762	200763	What is a public limited company?	What is a public limited company? What are some benefits?	1
124309	78093	69975	What are the best movies ever irrespective of genre?	What is best movies till date?	1
124310	200764	200765	What are the chances of ww3 after Trump being elected as the 45th POTUS?	What are the chances of ww3 starting?	1
124311	200766	200767	Is it legal to use Dreamspark Visual Studio Community 2015 for commercial projects?	Which is more challenging for India Globalization or Unemployment?	0
124312	200768	200769	I am a girl studying medicine, parents got an alliance of MD doctor, a kind gentleman from good family, hitch is he's almost bald. Should I accept?	What happens if everyone wants to do business and no one wants to work in a 9-5 job?	0
124313	200770	200771	What is the procedure of planes entering in to jet stream tail winds?	How do people from Taiwan view their new female president?	0
124314	200772	200773	What is your management style?	What management styles are there?	0
124315	200774	200775	What is the corporate culture like at Vector Group? How is the culture different than other companies?	What is the corporate culture like at Pattern Energy Group? How is the culture different than other companies?	0
124316	200776	200777	If Sikhs are so brave then why did they end up facing genocide in 1984? Why couldn't they protect themselves?	Why are the Sikhs so brave?	0
124317	200778	200779	What can I gift my elder brother on his birthday who is turning 27 years old?	What should I gift my elder brother, who is turning 23 years old, for his birthday?	0
124318	200780	200781	Is there a word for a spoken sentence that cannot be written. Eg there are three ways to spell the word to. (To, two, too)?	Mathematics: The word CHINCHERINCHEE is the only known English word that has one letter that occurs once, two letters that occur twice, three letters that occur three times. How many ways are there to rearrange the letters in this word?	0
124319	94069	200782	Do dolphins kill sharks? Why or why not?	Why are sharks scared of dolphins?	0
124320	200783	200784	What is a Messianic Rabbi or Jew?	How do you become a Messianic Rabbi?	0
124321	200785	200786	What are some of the worst translate done by Google translate?	What are some of the best (and worst) Google translate translations?	0
124322	21728	200787	What would be the one thing or things which you would never, never do?	What are things that you will never do in your life?	1
124323	200788	200789	What happens at MIT parties?	I have confirmed CSE in SRM KTR. I have 132 marks in MIT and would prefer it but counselling will happen after confirmation date for SRM. What now?	0
124324	22679	115421	How can I recover my hacked Instagram account?	How do I hack an Instagram account?	1
124325	200790	200791	Embedded Systems: What are the ways to interface rf transmitter and receiver to an 8051 microcontroller?	How do I write embedded C program for 7 segment display to count from 00 to 99 in 8051 microcontroller?	0
124326	200792	200793	Which is correct to say, “The yolk of the egg is white” or “The yolk of the egg are white? ”	"What is the correct way to say ""go"" in German?"	0
124327	4237	200794	How can I keep myself awake during boring lectures?	What are the best way to keep yourself awake during a class/lecture?	1
124328	200795	200796	"How can you use ""condensation"" in a sentence?"	"How is ""stern"" used in a sentence?"	0
124329	115805	46707	What are your top 10 favourite horror movies?	What are some best horror movies?	1
124330	200797	200798	Is that possible to recognize some properties with same class of PPE with both Cost and Fair Value Model?	If I own a property, can I use it as collateral to purchase another property of the same or similar value?	0
124331	123824	200799	How can the Rama Setu (Adam's bridge) made of stone float?	How can the Ram Sethu submerge under water it was made up of floating stone?	0
124332	200800	200801	How does divestment affect consumer welfare?	Why abuse welfare?	0
124333	67191	31137	What are the effects of demonetization in India?	How is demonetization affecting people of India?	1
124334	79863	52873	How can I loose weight naturally without exercise?	How can I loose weight naturally without doing exercise?	1
124335	79785	11761	Who will win ipl 2016?	Which team win IPL 9?	1
124336	200802	200803	What is the best Python tutorial for machine learning?	Which is the best video tutorials for learning Python for beginners?	0
124337	200804	90615	How do you stop German Shepherd/Husky puppies from biting your stuff?	How do I stop my Chihuahua from biting my shoes?	1
124338	110636	29665	English is my second language.How can I improve my writing?	What are suggestions or ideas to improve my English writing skills?	1
124339	65796	200805	How long does Gravol make you feel drowsy?	Why do some laxatives make me feel dizzy?	0
124340	200806	17072	How many states were there in India at the time of independence?	What are the names of countries that were once part of India? Also when they got separated from India?	0
124341	200807	200808	Why is Hillary Clinton losing polls again?	Will Hillary Clinton lose?	1
124342	53927	175287	How does it feel when you know you are about to die/dying?	What does it feel like to be dying?	1
124343	200809	72644	What can I do to wake up more easily in the morning?	What should I do to get up early in the morning?	1
124344	58049	200810	My girlfriend broke up with me and I still love her. What should I do?	My girlfriend broke up with me for her ex. What should I do?	0
124345	200811	200812	What is dharma according to Gita?	What is Dharma as per Bhagavat Gita?	1
124346	200813	200814	What is the word for an overused expression?	What words do you overuse?	0
124347	86287	200815	What are some interesting facts about the Harry Potter series?	Who is the best girl in the Harry Potter series?	0
124348	95362	200816	If you cut a fruit and keep it in the fridge, will it get spoiled?	How to keep cooked beetroot in fridge?	0
124349	200817	10380	Why danteshwari temple is so famous in Chhattisgarh?	Where is the famous temple in Chhattisgarh?	0
124350	189248	44571	What are some legit ways to earn money online?	What are the legitimate ways to earn money online?	1
124351	200818	200819	How should I calculate the electric motor power?	How do I calculate electric power of motor?	1
124352	14619	7411	What are the requirements to be a programmer?	How difficult is it for the average person to become a computer programmer?	0
