id	qid1	qid2	question1	question2	is_duplicate
47181	84270	84271	Is any sitecore training available near Delhi NCR/Gurgoan location?	What are some good EMC/NetApp Storage training institutes in Delhi and NCR?	0
47182	84272	22972	Who is the best artist ever?	Who is the best artist?	1
47183	84273	84274	How many Facebook users are there?	How many Facebook users are there in Brazil?	0
47184	84275	84276	Did numerical on organic chemistry is important for JEE advanced?	Can we connect usb tv tuner with mi note 3?	0
47185	84277	84278	Why, even though my nose is oily, the skin keeps peeling off? What cream should I use?	Which BB cream works best for oily or combination skin? Can it be used daily?	0
47186	84279	84280	Causes of natural disaster in 2016?	What are the causes of natural disaster in 2016?	1
47187	84281	84282	How do I contact Hike team including Kavin Bharti Mittal to share an awesome idea?	Is there a platform to share ideas for free?	0
47188	84283	84284	How popular is WeChat in Western countries? And why is it popular?	Is WeChat popular in other countries?	1
47189	62824	84285	How come parrots are the only animal besides humans that can produce speech?	What is the evidence that other animals beside human beings can have a sense of honour?	0
47190	84286	84287	Which thriller, lawsuit or detective TV series would you recommend that I see?	Which TV series should I see?	1
47191	84288	84289	What's it like having siblings?	What is it like to have more than five siblings?	0
47192	84290	84291	Is now a good time to invest in the NYC real estate market?	Is now a good time to invest in the California real estate market?	0
47193	69363	84292	Can cats get rabies?	Do all raccoons have rabies?	0
47194	84293	84294	Do cell phones really get infected by viruses?	How does a cell phone get a virus?	1
47195	84295	84296	What should I do about not getting any answers of my questions on Quora?	Why do some Quora questions never get answers, even when they get views?	0
47196	28057	84297	Why is the northeast part of India called Seven Sisters?	How many tribes in Northeast India?	0
47197	590	6272	What will be the effect of banning 500 and 1000 notes on stock markets in India?	What will be the effect in Stock market after the Indian Government's decision to demonitize 500 and 1000 rupee notes?	1
47198	84298	84299	How did the Byzantine empire fall?	Why did the Byzantine Empire fall?	1
47199	84300	56262	What is the meaning of angelita?	"What is the meaning of ""what's up""?"	0
47200	84301	84302	Does music have a negative impact on the brain?	How does music impact the brain?	1
47201	2388	57174	What's the reason India fails in Olympics?	Why can't India get more medals in Olympics?	1
47202	48826	84303	Could JFK appoint RFK as attorney general were he president today? Would ethics laws or rules against nepotism prohibit it?	Who killed JFK (President John F. Kennedy)?	0
47203	84304	84305	How do I change the password of my binatone ADSL router?	How do I setup a Belkin router password?	0
47204	84306	84307	How often should you buy a new mattress?	What should I know before buying a mattress?	0
47205	84308	84309	What is the fastest way to get a California Driver's License?	As an expat Canadian, how do I get a California driver's license?	0
47206	84310	84311	What things do women hide from men?	What are some things that women don't tell men?	1
47207	84312	49515	What is the best romantic movie of all time?	Which are the best Hollywood romantic movies?	1
47208	84313	84314	What is oxalic acid formula?	What is the equation for oxalic acid?	0
47209	84315	84316	Do people ever spam on Quora?	Why do people spam on Quora?	1
47210	84317	84318	In The Lord of the Rings, when the Dwarves of Moria awaken the Balrog, did they know it was a Balrog?	What happened to the Dwarves in Lord of the Rings?	0
47211	42302	84319	Why did God made men so ugly to the point where they are told to cover everything up, while women are encouraged to show as much skin as possible?	Why do most women think skin cream can cure mostly everything, while men tend to dislike it?	0
47212	84320	84321	How do I overcome tiredness after studying at school for 8 hours?	How do I overcome tiredness and fatigue after working for 9 hours?	0
47213	84322	84323	What are India's 5 fastest growing industries?	How soon growing Pakistan's IT industry will overtake India's IT industry?	0
47214	84324	84325	How do I become mentalist? Is it a course or can we learn by our own?	How can I become a mentalist?	1
47215	84326	84327	What lessons do you think you should learn from Game Of Thrones for using them in real life?	What's one thing in Game of Thrones that taught you about life?	1
47216	84328	84329	Why didn't Steve Wozniak originally finish his degree at UC Boulder?	Why doesn't Steve Wozniak have broadband in his house?	0
47217	84330	84331	What are the following-on tasks that leaders should accomplish in supervising detainee transport mission?	If a person is not a leader nor a follower, who he/she is?	0
47218	84332	84333	Are we creating the problems unknowingly or created by others in daily routine? Is it possible to solve the problem If we share them each other?	If we assume every problem in the world gets solved, will life lose it's meaning?	0
47219	84334	84335	How can I password protect a single folder in my external hard disk without installing any software?	How do I block/password protect content from my external hard disk from being copied or deleted?	0
47220	84336	84337	What about scrap copper wire?	In chemistry, what are examples of compounds?	0
47221	84338	84339	What song are you listening right now?	What music are you listening to now?	1
47222	84340	84341	What's the best way to make money online? Can anyone tell me, the easiest best way to start making money?	What is the easiest and fastest and safest way to make the most money?	1
47223	84342	84343	Which is the best field for mechanical engineer?	Which field is best for a mechanical engineer?	1
47224	61176	84344	Why are there several protests across U.S. after Donald Trump was elected President?	Why are citizens of USA so frustrated and protesting against Donald Trump when they themselves have elected him as a president?	1
47225	84345	84346	How is the structure of the spinal cord built in?	What is the structure of the spinal cord? What is its function?	0
47226	84347	84348	How many days does a normal passport take to arrive in comparison to a Tatkal passport?	Why is the Book Now link not showing?	0
47227	84349	84350	How is the Lewis structure of N3 determined?	What is the Lewis structure of N3?	0
47228	49477	84351	Why does everyone only talk about what's bad about the world?	Why do Americans talk about freedom as if their country was the only one in the world that was free?	0
47229	84352	84353	What are the biggest struggles with automating air traffic control?	Where does one train to be an air traffic controller in the United States?	0
47230	84354	84355	Which country is best known for its culture?	What country has the most weird culture?	0
47231	84356	84357	How do you convert hectometers into centimeters?	How do you convert feet into centimetres?	0
47232	84358	84359	"Who would win, Rory MacDonald or Michael ""Venom"" Page?"	What's the official Christian position on Hiroshima and Nagasaki?	0
47233	84360	84361	Why is the number of women in IITs really low?	Why is number of women low in racing?	0
47234	9189	79558	How do you know if you are in love with someone?	How can I know that I am in love with a girl?	1
47235	84362	84363	How is the only Tesla Model S owner in Singapore going to get repairs done?	When will the Tesla Model S be available in Singapore?	0
47236	11598	84364	What would it look like here on earth if your sun was a Pulsar?	What is the reason we feel the heat of the sun here on earth or on the ISS?	0
47237	84365	84366	What is the value of acceleration due to gravity at the centre of earth? Why? And also what about gravity?	The mass and radius of a planet are half the respective values of the Earth. What is the value of acceleration due to the gravity of the planet?	0
47238	84367	84368	Is smoking weed helping me or hurting me? I'm quite sure I have ADD and may also be suffering from depression. Think Kid Cudi mind state.	What did the Allies do about the Nazi gold issue in Switzerland after the war, were they considers collaborators to the allies?	0
47239	84369	84370	How is solar energy converted into electricty?	How is solar energy converted into electrical energy?	1
47240	84371	84372	Do you follow your heart or brain?	Is India in my heart or brain?	0
47241	24695	55745	What are some good animated movies?	What are the some best animation movies?	1
47242	84373	84374	What are some Font Awesome icons that represent thinking or thought?	What are some iconic images with more than 10 people represented?	0
47243	84375	84376	Who are competitors of Linxup?	Who are the competitors of salefee?	0
47244	84377	84378	How do I interpret dreams?	How do you interpret your dreams?	1
47245	84379	84380	What is trade facilitation aggrement?	What is the Trade Facilitation Agreement?	1
47246	84381	84382	Why did Muhammad prescribe hundred lashes for men who displayed transsexual behavior?	Why do transsexual women have a low risk for prostate hyperplasia rather than natural men? Doesn't oestrogen trigger hyperlasia of prostate?	0
47247	84383	84384	Where can I learn to dance like the guys in the EXO music videos?	I'm looking for a music video in which a guy catches a mermaid with the head of a fish of a girl and they dance together?	0
47248	84385	84386	When something is frozen its density increases but why this is not applicable in water?	Why does liquid water volume increases if its density decreases?	0
47249	84387	84388	Can VMware run Logic Pro X well?	What are some lesser-known sights to see when visiting Guangzhou, China?	0
47250	84389	84390	When did Russia became a developed country?	Russia: Why has Russia always been a backwards country compared to other European states?	0
47251	84391	84392	Can I change my eye colour using subliminal methods?	Can subminals audio change eye colour?	1
47252	84393	84394	"What is the difference between ""planned"" and ""non-planned"" expenditure in the Indian annual Budget?"	Where can I find the annual expenditures on CSR for top Indian firms?	0
47253	77743	21380	Which is the best QuickBooks Tech Support Number in Las Vegas?	What is the best QuickBooks support number in Arkansas?	1
47254	43408	185	Which one is the best romantic movie?	What are some of the best romantic movies in English?	1
47255	84395	84396	How can I connect a MySQL server on a Linux machine in VirtualBox from Windows using Java?	How do you ping from a Windows client on one PC to a LINUX server inside VM-ware running on a second PC using a static IP on the server side?	0
47256	84397	2645	What is wrong with Indian Education System?	What is wrong with Indian engineering education system?	1
47257	84398	84399	Can I get a virtual Korean phone number which can receive a verification code, from Google Voice?	How do I verify my Facebook account and send the code to my new phone number?	0
47258	84400	15824	How can I delete my Quora account in one minute?	How do I delete Quora account?	1
47259	84401	84402	Do employees at Cypress Semiconductor have a good work-life balance? Does this differ across positions and departments?	What kind of act you did that made people say you are an OCD case?	0
47260	84403	84404	What are the causes for the Coriolis effect?	What is the Coriolis effect in laymens terms?	0
47261	84405	84406	How do you enrich beer?	Where does Yuengling ship beer?	0
47262	84407	84408	Why do I feel so warm and fuzzy when in love?	What is warm love?	0
47263	84409	84410	Should I stop gaming to get better grades? If not how can I balance gaming and studying?	Should I quit gaming to get better grades? If not, how can I get better grades while gaming almost everyday?	1
47264	84411	84412	Why do grades in the US usually range from A+, A, A-, B+, B ... D, D-, and then jump to F rather than to a grade of E?	"Why do US school grades go A, B, C, D, and F. Why not ""E""?"	0
47265	84413	84414	How can I prepare for sanitary entrance examination?	How do I prepare for sanitary entrance examination?	1
47266	6466	84415	What are the salaries of IAS, IPS and IFS officers?	What is the life of an IRS officer like, compared to an IAS officer?	0
47267	40215	11837	If I want to invest in the stock market, how I start?	How much money will I need to start investing in stock market?	0
47268	84416	84417	Hi Looking for an eCommerce site based in India for Australian goods and services from Australia ?	How does one stop focusing so much on their own appearance?	0
47269	84418	84419	How do I write into a 6C RFID tag which is already placed on a vehicle windscreen?	How do I open up a web browser to display details for a project based on RFID?	0
47270	84420	84421	What is the average lifespan of a ladybug?	What is the average lifespan of a hamster?	0
47271	84422	84423	When will a working nintendo 3DS emulator release ?	Is there any news of a Nintendo 3DS emulator for PC?	1
47272	84424	84425	What should I do if the woman I love so dearly has an incurable life-threatening hereditary disease? She is in her 20s and still very healthy.	What can a high school student do to study interaction design?	0
47273	84426	84427	Is it ever okay to lie to her in a relationship?	Is it ok to lie in a relationship?	0
47274	14570	84428	What is the nicest thing that anyone has done for you?	What is the nicest thing anyone has ever done for you?	1
47275	3349	5855	Is it true that the new Rs. 2000 currency notes in India will have a nano GPS chip?	Will Rs. 2000 currency note really come with A GPS chip? Or it is just a rumor?	1
47276	8293	84429	Two equal masses hang one below the other on strings of equal length. The oscillation will have two modes. What is the ratio of their frequencies?	If all the mass in the universe was condensed into two separate and equal spheres, would they remain in perpetual orbit around their center of mass?	0
47277	84430	84431	Which is better: The Vampire Diaries or The Originals?	Is twilight better than the vampire diaries?	0
47278	84432	84433	How can I stop being indecisive and become a fast thinker?	How do I stop being a slow thinker?	0
47279	5434	27380	What are the safety precautions on handling shotguns proposed by the NRA in Rhode Island?	What are the safety precautions on handling shotguns proposed by the NRA in Idaho?	1
47280	84434	84435	I'm 37 years old. Am I too old to pursue an engineering degree?	I have a 3.5 GPA master and will have a 4.0 GPA doctorate this year, both in aerospace engineering. I am 37 years old. I am too old to apply for JPL?	0
47281	84436	84437	What character traits does a super hero have?	What are the super-hero powers of The Watchmen characters in the film?	0
47282	84438	84439	Which is better job or businesses?	Which one is better job or business?	1
47283	84440	84441	How can you invest like Mark Spitznagel (Universa investments) as a retail investor?	How do I find the day-to-day performance of a hedge fund like Universa Investments LP?	0
47284	84442	84443	What's the best swag for employees?	Which is the The Leading corporate Meeting Organizers in Delhi for corporate events?	0
47285	84444	84445	I have an iPhone 4S, should I upgrade to iPhone 7?	Should I upgrade my iPhone 4s to the 5s or 6?	0
47286	84446	84447	White House Down (2013 movie): Does the Speaker know that Martin Walker (the bad guy) planned to nuke cities all over the world at the end, once he got the nuclear launch codes?	Why did the hacker in White House Down die? I thought he was able to go by the explosives.	0
47287	84448	84449	What is the story behind Rahul Gandhi's statement 'Khoon Ki Dalali' about Prime Minister Narendra Modi?	Why is Rahul Gandhi accused Narendra Modi for 'Khoon Ki Dalali'?	1
47288	84450	84451	What does “bulk temperature” mean?	What does bulk packaging mean?	0
47289	84452	84453	What can I do with domain name ?	What should I do with my domain name THE.CLUB?	0
47290	84454	84455	What advice would you offer to a young person about to move out of their parents' house for the first time?	What advice would you give to someone who is about to move out of their parent's house?	1
47291	84456	84457	How can I reset my iPhone without password or backup account?	How do I reset my iPhone password?	0
47292	58262	84458	Why are diamonds so expensive?	Is the rarity of diamonds a myth?	0
47293	84459	84460	Can Manchester United win the BPL title this year?	Will manchester united win the league this year?	1
47294	82124	84461	Is Linus Torvalds on Quora?	Why did Linus Torvalds join GitHub?	0
47295	84462	84463	How do I stop going hard on myself?	Why am I so hard on myself and how do I stop it?	1
47296	84464	84465	My boyfriend has been cheating on me with girls that are in a game called dark legends and been talking to them on kik what do I do?	What are the chances of an American civil war now?	0
47297	84466	84467	As a college student, is there way I can be involved in your future Marvel films to get more experiences in filming sector?	What would the reaction of the US Government be to a Russian military base installation in Nicaragua?	0
47298	44355	42795	Why is the American President Barack Obama called POTUS in Twitter?	What will President Obama's legacy be?	0
47299	58308	53427	Now that India has banned 500 & 1000 notes, what will people with excess of such notes accrued as black money do? Can they still escape?	What are some interesting reactions of people who you know own black money after the ban on 500 and 1000 rupee notes?	1
47300	84468	84469	Am I forced to say the pledge of allegiance at school when I have a different religion?	Can my school legally force me to say the pledge of allegiance, and punish me if I refuse?	1
47301	38553	84470	Why does my head hurt?	Why does my head hurt in the morning?	0
47302	84471	84472	Why do I have lower back pain after I ejaculate?	What are good treatments for acute lower back pain?	0
47303	84473	84474	Why can't we stay young forever?	How do I stay young forever?	0
47304	72292	84475	Why do lawyers have a preference to settle out of court instead of going to court?	Can a Property case be settled out of court even after the judgement given by court, if both parties agree; or should the court judgement be followed?	0
47305	36484	22373	Why were the 500 and 1000 rupee notes demonetized?	Why the banning of 500 and 1000 rupees notes?	1
47306	84476	84477	How do you like Leaderless Group Discussion (in your nation or culture)?	How do you manage all your LinkedIn groups & how frequently do you participate in discussions?	0
47307	50061	57706	Where can I get quality assistance for budget conveyancing across the Sydney?	Where can I get friendly assistance in Sydney of any knowledgeable conveyancing solicitor?	1
47308	84478	84479	How does a Hydrolocking Engine work?	How does the Wankel engine work?	0
47309	84480	84481	What should we do to become determine about our goal?	What are some ways to achieve your Goals?	0
47310	84482	84483	Where do the credits go?	Where did credits go?	0
47311	84484	30487	How much is a 1934 twenty dollar bill worth today? What factors affect the value?	What is the value of a 1928 red seal 2 dollar bill?	0
47312	84485	84486	What are some tips and tricks for Windows 10?	What are some cool unknown tips and tricks about Windows 10?	1
47313	84487	84488	What kind of conversations only happen in Portugal?	What kind of conversations only happen in college?	0
47314	52298	10234	How can I earn money part time online?	How do we make money online?	1
47315	84489	84490	What is difference between pg diploma and masters?	What is the difference between masters and post graduate diploma?	1
47316	642	18052	How will Indian GDP be affected from banning 500 and 1000 rupees notes?	How can the ban of 500 and 1000 rupee notes increase the Indian economy?	1
47317	84491	84492	How can lox be kept at room temperature? How can you tell if it has gone bad?	How long can I leave eggs out at room temperature?	0
47318	84493	84494	Why does my penis shrinks after masturbation?	Is there any way to shrink my penis?	0
47319	84495	84496	Write down the various capital budgeting models. In financial modeling with spreadsheet?	Are messi and ronaldo the best players the world has ever seen?	0
47320	84497	84498	How do Arabs view Turks?	What do Arabs think about Turks?	1
47321	21324	407	Why do so many people hate Hillary Clinton?	Why do people hate Hillary Clinton?	1
47322	84499	84500	How do I unblock myself from someone's else account on WhatsApp?	How do I unblock myself from someone's else WhatsApp? _	1
47323	84501	16514	How beautiful is life?	What makes life beautiful?	0
47324	84502	84503	There are 5 countries called Guinea: Papua New Guinea, Equatorial Guinea, French Guiana, Guyana and Guinea. How did that happen?	What is it like to visit Equatorial Guinea?	0
47325	84504	84505	How did racism start? What made people think that a particular color is superior to the other?	If all races had the same color skin, do you think racism would still exist?	0
47326	84506	84507	Is there a difference between native mini displayport and just mini displayport on Macbok air?	"Is there a difference between ""native"" mini displayport and just mini displayport on Macbok air?"	1
47327	84508	84509	How do I implement Locality-Sensitive Hashing with respect to Levenshtein distance?	How can I implement a simple locality sensitive hash function in C?	0
47328	84510	84511	What do you think of solitude?	What does IP address and IP Subnet mask mean in LAN configuration of Netgear router?	0
47329	84512	84513	How do I study for F.Y.B.SC. Mumbai university maths?	What will magnify an automatic watch? Doesn't that make them fragile in the modern life filled with technologies?	0
47330	84514	84515	How can I remove scratches of resin glass?	How do you get scratches out of glasses?	0
47331	84516	84517	What is the difference between Mahayana and Theravada Buddhism?	How do mahayana and theravada differ?	1
47332	84518	84519	What is best sleeping time duration daily?	How can you manage sleep (decrease sleeping time) in daily life?	0
47333	84520	84521	Would you wear this dress?	Where should I wear this dress?	0
47334	84522	84523	What causes teeth to move after using braces?	How much can teeth move after using braces?	0
47335	65173	64534	What are some logical, fact-based reasons to vote for Trump?	What are valid rational reasons for voting for Donald Trump?	1
47336	84524	62261	Why doesn’t PM Narendra Modi attack Pakistan, even after the recent Uri attack in India?	How should India respond to Uri attacks?	0
47337	84525	84526	How can I get garments buyer?	How can I find garment buyers?	0
47338	34481	16333	What is the best programming language I should learn as a beginner?	Which programming language to start with for a beginner and what are steps necessary to learn it?	1
47339	84527	84528	Can I buy out TCS notice period?	In TCS, can I take flexi leaves during my notice period?	0
47340	84529	84530	How can I join the RSS in Delhi?	Is there a Toastmasters club in Delhi? How can one join?	0
47341	84531	84532	Why will Narendra Modi involve in corruption?	What would haappen if Hillary Clinton were indicted before the election?	0
47342	84533	84534	What race is a mix of Lebanese, White and Hispanic considered?	I am against a mixed race (black/white) marriage in my family. What are your views concerning negative results in mixed race marriages?	0
47343	84535	6771	What are the best foods for weight gain?	Can any one suggest the best foods for gaining weight?	1
47344	84536	84537	Which are the best old Hindi (Bollywood) romantic songs for a couple dance?	Which is the best romantic Hindi song?	0
47345	84538	10108	What are important things for people intending to major in forestry to know about?	What are important things for people intending to major in education to know about?	0
47346	84539	84540	What was your weirdest sexual experience?	What is your weirdest sexual experience?	1
47347	84541	84542	With a very neutral feeling I wonder if a song with similar sound structure is the future of radio friendly music?	I feel embarrassed about my old music, but right now I don't have the time to make it sound better. Can I remove the songs from the internet?	0
47348	84543	84544	How many combinations are there to a 3-digit lock?	How many combinations are there to a 4-digit lock?	0
47349	84545	84546	How would you rank Game of Thrones seasons?	How would you rank all game of thrones seasons from worst to best?	1
47350	84547	47240	"What is an ""Alien Key""?"	What are aliens?	0
47351	84548	84549	How do you find out what the best food to give 4 week old German Shepherd puppies?	What is the best food for a 5 week old puppy?	1
47352	84550	84551	What happened to Sanyukta after defeat of Prithviraj Chauhan?	What would have had happened to Indian history if Prithviraj Chauhan did not lose to Ghori in the second battle of Tarain?	0
47353	84552	84553	How can I get HDMI input into my MacBook Air?	MacBook Air: Is there a way to view live video on my MacbookAir from my DSLR, possibly with the HDMI port?	0
47354	84554	84555	What is Tiger Memon wanted for?	Who is Tiger Memon?	0
47355	84556	84557	Is Evernote accepting SE interns for summer 2017?	What is the acceptable dress code for a Google Summer intern?	0
47356	84558	39163	How do I calculate development length of bar in slab?	How do I calculate development length of bar in beam?	0
47357	643	11881	What will be the implications of banning 500 and 1000 rupees currency notes on Indian economy?	What will be the repercussions of banning Rs 500 and Rs 1000 notes on Indian economy?	1
47358	84559	84560	How do you clean your ear?	What are some good ways to clean ears?	0
