id	qid1	qid2	question1	question2	is_duplicate
182704	77349	79919	What's the most illegal thing you've ever done and gotten away with?	What is the greatest crime you have ever gotten away with?	1
182705	24227	124694	Can Trump repeal laws that allow gay marriages?	How easy would it be for Trump to overturn gay marriage?	1
182706	279568	279569	What should a criminal defence lawyer do if they know their client is guilty?	How do criminal lawyers sleep at night even when they know their client is guilty?	1
182707	279570	279571	What are the best ways to combat liberalism in revolutionary organizations?	What's the best way to combat liberalism in revolutionary organizations?	1
182708	257710	279572	How do I gain 20 kgs in 6 months?	What are some suggestions to gain 5-6 kgs weight?	0
182709	279573	279574	What is your review of National Institute of Design?	Review about national institute of design?	1
182710	121143	279575	How should I change my life entirely?	How do I change my life around?	1
182711	279576	279577	How many days do I need to learn Java?	How much time do I need to learn Java?	1
182712	279578	279579	What do you think of Donald Trump's energy policies?	What is Donald Trump's energy policy?	1
182713	7167	93475	What is the best way to increase traffic for a new blog?	How do I generate more traffic to my blog?	1
182714	30967	82406	What are the Major problems in Indian education system?	What is the major problem with Indian education system?	1
182715	277834	279580	When is iOS 10 coming out?	When is iOS 8 coming out?	0
182716	279581	279582	Culture of the United States of America: Is a poor college student considered financially stable in the U.S.?	Is threatening the President of the United States (18 U.S.C. Sec. 871) considered a crime of moral turpitude?	0
182717	279583	279584	SYABUS for MENTAL ABILITY ASSISTANT COMMANDENT COAST GAURD?	Is there a website that tells you if one business is related to another?	0
182718	106517	161084	What are the downsides for rooting your android device?	What are the advantages and disadvantages of rooting an android phone?	1
182719	15209	279585	What is in pepperoni?	What are the ingredients in pepperoni?	1
182720	279586	279587	How do you explain a bad semester on a grad school application?	I had a bad graduating semester. How significant does it impact my grad school app?	0
182721	199944	66399	What is the shape of the production possibilty curve which bows in towards the origin?	Under what circumstances would the production possibility curve be bowed in towards the origin?	1
182722	61062	279588	How do you root an Android tablet?	How can I root my Android 5.1 device?	1
182723	279589	279590	What does it mean when you're talking to a guy and then he rearranges/touches his crotch?	What does it mean when a guy rubs his neck when he is talking to you?	0
182724	279591	18022	How do I crack CA-CPT exams easily in India?	How can I prepare for CA CPT?	0
182725	279592	279593	How do I change/translate the text in image with same style?	How can I ask an image identification question in Quora, with the same text as an already existing question, but with a different picture (obviously)?	0
182726	279594	279595	What are good ways to deal with people who are always pushing you to conform and to blindly do what you're told?	What are good ways to deal with people who are always trying to tell you what to do?	0
182727	279596	279597	Are all backgrounds websites the same?	Is it advisable to have a website and app that do the same thing?	0
182728	279598	62064	What are the top blog platforms for a company blog?	How do I start a blog and what are the best blogging platforms available?	0
182729	279599	279600	My MacBook does not open. When I press the power button it just shows a folder in grey colour and a question mark in it. How can I solve it?	A question mark shows when I boot my MacBook Air. What happened?	1
182730	135050	228326	Which is the best bicycle to buy in India around the range of 10000 and for commuting purposes?	What are the best 10 bicycles in India under the range of Rs. 10,000?	1
182731	279601	279602	I am having a home loan of 18 lakhs and my in hand salary is 50 thousands. I get annual payment of 1.5 lakh. Should I plan for the home loan principal or should I buy any plot?	Can I get a personal loan if I have home loan?	0
182732	279603	279604	Which top 10 NITs are the best for M.Tech degrees in machine design?	What rank should I get in GATE for M.tech Biotechnology in top IITs or NITs?	0
182733	279605	227831	How do I keep my mind stable forever?	How can I control my mind from thinking too much?	0
182734	55026	124012	Will superman come back to life in next movie after Batman v Superman?	In Batman v Superman, why does Lex Luthor hate Superman?	0
182735	279606	279607	Are there any websites for downloading cracked Linux games like Ocean of Games for Windows?	Which is the best website to download game of thrones season 6?	0
182736	279608	279609	What is activation?	What is activity?	0
182737	279610	54657	Can a 36 year old date a 17 year old?	Can a 16 year old date a 13 year old?	0
182738	279611	279612	Why do foot worship videos turn me on but doing it doesn't?	Why do foot worship videos turn me on but doing it doesn't? :/	0
182739	279613	279614	Top colleges in Tamil Nadu to pursue MA English?	Guess movie name by adding cycle ball banana and monkey?	0
182740	279615	279616	Can any country (like China) ever sustain long term growth without innovating and just copying successful American companies? We shouldn't follow them?	Does SIM card gets blocked by using VPN I am currently using reliance jio 4g?	0
182741	279617	279618	How do I store aqua regia?	What are the functions of aquas regia?	0
182742	35599	242415	Who are the best investors and traders on Quora?	Who are the best Indian traders and investors to follow on Quora?	1
182743	38210	41052	What are the ideal growth stocks to invest in right now?	What are some good stocks to invest in right now?	1
182744	23743	57257	What are the safety precautions on handling shotguns proposed by the NRA in Georgia?	What are the safety precautions on handling shotguns ?	1
182745	197226	279619	Should I move out of my Parents house and move in with my boyfriend?	Should I move in with my boyfriend?	0
182746	279620	279621	What are the qualities needed to place in CTS for a computer engineer?	I want to study aerospace engineering in Germany.What kind of qualities do I need to have?	0
182747	279622	257400	What is the perfect time to register for CMA for Ca-IPCC student?	Are all golden retriever dogs dog aggressive these days?	0
182748	279623	95795	What is your opinion about my website www.TravelOnlineAdvisor.com? Please have a look and help me on how to improve to get more Travellers?	How do I tempt a girl for sex?	0
182749	78	147756	How do I prepare for civil service?	How do I prepare for the IAS 2017?	1
182750	279624	147802	How do I approach my IIT senior/IIT alumni for a job reference in his/her company even if I don't know him/her well?	How can I ask for a job to a person I don't even know?	0
182751	279625	279626	Who is the best online dating headshot photographer in San Francisco?	Who are the best Tinder photographers in San Francisco?	1
182752	152375	183829	When is a proper 3DS emulator going to be launched?	Is there a legal way to get a 3DS emulator for the PC?	1
182753	141781	279627	What do I do when I've too much work to do and not enough time?	How can I help someone who is stressed out with too much work?	0
182754	279628	279629	Is there any chance of being allowed to write JEE advanced for a third time from 2017 onwards?	Are Troye Sivans merchandise available in India?	0
182755	279630	279631	Can a 14 year old girl fall in love with a 23 year old guy?	Is it okay for a 35-year-old-guy to fall in love with a 16-year-old girl?	0
182756	279632	279633	How many aircraft are there in the world?	How many aircrafts are currently operating in the world?	0
182757	279634	279635	What are the best conferences to attend?	What are the best conferences to attend in 2014?	0
182758	279636	22922	Why does Japan want Asian countries forget about the Japanese atrocities committed to Asian people during WWII?	Why hasn't Japan properly atoned for its atrocities in WWII?	0
182759	244345	279637	Why do you hate Quora?	Who do you hate on Quora and why?	0
182760	279638	279639	How can I make my legs slimmer?	Can I run to make my legs slimmer? What can I do to slim my legs?	0
182761	279640	55142	Should I use who or whom in this sentence?	How can we use who or whom in a sentence?	0
182762	279641	254440	Are Cengage books good for JEE Advanced?	Are the cengage books for math and phy good enough for JEE advanced 2017?	1
182763	279642	279643	Is it possible to add attachments to batchbook contacts?	How can I add some 500 contacts to my phone using a computer?	0
182764	279644	279645	Is Rahul Gandhi foolish?	Why is that Rahul Gandhi is seen as foolish?	0
182765	279646	279647	How should I get rid of warts permanently?	What are some permanent ways of getting rid of acne?	0
182766	275196	279648	How to prepare for both IBPS PO and SSC CGL Tier 2 ?	How should I prepare for SSC CGL (Tier 1 and Tier 2) 2016?	0
182767	279649	6390	How come Myntra's promotional emails come directly in Gmail inbox's primary tab and not in promotional tab?	How can one track whether sent email was read?	0
182768	279650	279651	Is Kpop music popular in Sweden?	What's some music now popular in Martinique?	0
182769	279652	279653	What would you do if you were in a female body for one day?	Men of Quora: What would you do if you were in a female body for one day?	1
182770	279654	279655	How do I maximize my Quora experience?	How can I improve my Quora experience?	0
182771	16751	135779	What is SSC exam?	What's the syllabus for SSC?	0
182772	279656	279657	Is 'unconfident' a word? If not, what is the opposite of 'confident?'	What is the opposite of life?	0
182773	279658	279659	What does 1st, 2nd, & 3rd degree connection mean in LinkedIn profiles?	What is Linkedin's average number of connections per user?	0
182774	279660	279661	What do musicians think of the new musical notation system Hummingbird?	What's the best iPad music notation app?	0
182775	38552	73449	What is the best answer for why should we hire you?	"How would you answer the question ""Why should we hire you”?"	1
182776	279662	279663	What is the average salary of IT professional having 10 years experience in India?	What is the average salary of a senior IT professional with +13 years of experience in Dubai?	0
182777	279664	279665	How do you know whether a compound is stable or unstable?	How can we know whether a compound is hydrolyzed or not?	0
182778	8730	2210	How do you post a question on Quora?	What are the best ways to ask a question on Quora?	1
182779	279666	279667	What do financial statements include?	What are the contents of financial statement?	1
182780	38490	207712	What was the best day of your life? What happened?	What is the best day of your life and what made it so amazing it stayed in your mind forever?	1
182781	279668	279669	How can I take calculated risks?	How should I moivate myself to take the calculated risks?	0
182782	115296	279670	What are the best tourist destinations in Maine?	What is the best tourist destination in California?	0
182783	71195	279671	How do I can whole tomatoes?	"How can I do ""Tinned whole tomatoes"" without big investment?"	0
182784	279672	279673	What's the difference between a DDD, E, and F bra cup size?	What is difference between opinion and views?	0
182785	279674	28987	Why doesn't the US switch to the metric systems?	Why doesn't America convert to the metric system?	1
182786	35921	41576	How imminent is World War three?	Is a third World War imminent?	1
182787	39242	5215	If universe is expanding without a limit and dark and vacuum energy are created as it expands…?	If dark energy is being created with expansion can infinite of it be created?	1
182788	279675	279676	Are we in the midst of a revolution?	Is India in the midst of an IT Revolution?	0
182789	279677	279678	What are the adult signs of child sexual abuse?	What are signs of sexual abuse?	0
182790	279679	279680	How does protein sequencing via Edman degradation work?	It has never been shown that various amino acids can by any chance, bind together in sequence forming protein molecules. Can evolution explain this?	0
182791	26787	279681	How do I get confidence to talk to girls?	How can I get better at talking to girls?	1
182792	279682	279683	How is driving for uber?	How can I drive for Uber?	0
182793	279684	279685	Can you still jail-break an iPhone that IMEI says was stolen?	Will a USB bluetooth adapter work in a car stereo?	0
182794	160262	279686	Who will win in Punjab?	Who will win upcoming elections in Punjab?	1
182795	279687	279688	What are the most popular Asian wedding blogs?	What are the most popular wedding blogs?	0
182796	279689	279690	What is the business model of disqus.com?	What is the business model of SwappedIn.com?	0
182797	83829	77055	What is the biggest decision you've ever made in your life?	What is the most drastic decision you've ever made and did it impact your life positively or negatively?	1
182798	149717	61156	Why is India still under developed country?	Why ia India still considered as a developing country?	1
182799	279691	279692	How do you fly?	How can I fly?	1
182800	146456	279693	How do I get more views on my answers in Quora?	How can I increase my answers views in Quora?	1
182801	118179	193719	What if there is a nuclear war between russia and U.S, who would win?	Is it possible to win a nuclear war between the US and Russia?	1
182802	19399	7060	Is a world war going to happen?	How soon is world war III?	1
182803	279694	279695	I recently divorced my wife and moved. Ever since moving into the new house. My triplet (11y) daughters are peeing all around the house. What's wrong?	My wife has been out of town for 2 weeks. We just moved and I straighten up the house. What could I do to surprise her?	0
182804	279696	279697	How do I strengthen my faith in God?	How can I restore my faith in God?	0
182805	279698	279699	"Federal government ""ruled"" during the gilded age?"	What can I do to reduce the chances of my children becoming sexual deviants?	0
182806	279700	279701	What is an acceptable range for r-squared in real-world environments?	How do we calculate the Adj R square in a time series?	0
182807	84813	32133	As 500 and 1000 rupee note is demonetized, what will RBI do with the collected old notes?	What will RBI do after receiving all the old 500 and 1000 notes? Will they burn those notes?	1
182808	279702	279703	What is it called when words end in -er?	Is there any word that ends with the letter Q?	0
182809	279704	279705	Why does the line on positive pregnancy tests fade?	What are the risk of having kidney disease if I don't smoke nor drink, nor have family history with kidney disease?	0
182810	279706	279707	I will study in UT Dallas. Am I allowed to get in American from LA or other airport with F1-Visa?	Should I select UC Irvine EE or UT Dallas CS?	0
182811	279708	226402	What is a Nobel Prize and what makes it such an honor, if the criteria for receiving one is so vague?	Is the Nobel Prize given posthumously?	0
182812	279709	194650	Who is an alpha female?	Are there alpha females?	0
182813	279710	241948	What can I do to improve reading speed?	How do I improve my reading speed?	1
182814	149869	269767	What are the best earphones under 1000Rs?	Which are the best earphones available under INR 1000 online? Planning to buy by 28th February.	1
182815	279711	279712	What is the cost of living in Melbourne?	What is the relative cost of living in Melbourne?	1
182816	194832	279713	What will happen to fresh water fish kept in salt water?	What will happen to salt water fish in fresh water?	0
182817	279714	279715	4 yrs studie gap. Can I apply for Australia student visa?	Where did Sita dumb himself?	0
182818	22347	34044	What are the strongest majors in terms of job prospects and what are the weakest majors at Mills College?	What are the strongest majors in terms of job prospects and what are the weakest majors at Kenyon College?	0
182819	279716	279717	What do you love most about your city or town?	What do you love the most about your city?	1
182820	279718	68960	Do you think I have OCD?	Do you think I have OCD	0
182821	57028	279719	Can you dream about a specific thing on purpose? If so, how?	How do you know if your dream is your real dream, if it's just a way to call attention, or if it has any purpose in life?	0
182822	154545	279720	Which is the best colour in Royal Enfield classic 350 for students?	Which colour of Classic 350 is the best?	1
182823	279721	279722	Which is best course on Coursera I should take?	Which are the best courses on Coursera for CS?	0
182824	63009	58151	What are the best technological inventions and gadgets of 2016?	What are the best technology inventions and gadgets of 2016?	1
182825	279723	279724	"The Beatles (band): What is the meaning behind ""Norwegian Wood""?"	Were The Beatles a boy band?	0
182826	279725	279726	Financial Accounting: Under US GAAP, when can R&D expenditure be capitalized? Are there circumstances when it must be?	What are trimester test on financial accounting?	0
182827	279727	279728	Why do water and fat molecules absorb the microwave radiations of a microwave oven?	Can ground beef be cooked in a microwave oven?	0
182828	279729	279730	Are any of the ideas proposed on Ancient aliens credible?	How many graduates do Fashion colleges give to India every year? (Looking for an approx number)	0
182829	40301	114253	Will I be in trouble if I download movies from torrents in India?	In present days download movies from torrent is a criminal offence or not in India?	1
182830	279731	279732	Does Flipkart in Bangalore Offer MBA Finance Internships?	Who offers finance internships in India?	0
182831	279733	279734	What causes a bump to lie on my tongue?	What are lie bumps on your tongue? What causes this?	1
182832	473	21274	How do you potty train a 4 months Pitbull?	How do you potty train a 6-month old Pit Bull?	1
182833	279735	279736	Why is Donald Trump a liar?	Is Donald Trump a liar?	1
182834	279737	279738	Harvard College Courses: What is general shopping advice for Classics classes?	Harvard College Courses: What is general shopping advice for Classical Archaeology classes?	0
182835	279739	279740	How do trucking companies make money?	How do trucking companies make so much money?	1
182836	211172	32452	How improve vocabulary in English?	How can I improve my English vocabulary?	1
182837	279741	279742	What is the CHEMISTRY aspect of Ambien CR?	If you bring togather ten 1 sqm fresnel lenses to focus what temperature would you get?	0
182838	279743	279744	"Why is Lord Shiva often depicted as smoking ""chillum""/""weed""? What could be a proper significance of it?"	Is it true that Lord Shiva used to smoke a lot of marijuana?	0
182839	120290	279745	How shall I prepare for clat?	What is the best way to prepare for clat?	1
182840	35845	85548	Where do you put your penis in a vagina?	What does it feel like to have your penis inside a vagina?	0
182841	279746	279747	How fast do Amtrak trains go?	Are there smoking cars on Amtrak trains? If not, should there be?	0
182842	77872	279748	Why is Premarital sex is taboo in India?	Is premarital sex immoral in India?	1
182843	279749	279750	What is the best stock to invest in 2016 and why?	Which are some of the best stocks in india to invest in 2016?	0
182844	93178	37472	Can India be a developed country?	How long will India take to be a developed country?	1
182845	255380	201967	Where can I start my own country?	Where should I make my own country?	1
182846	279751	279752	Which is/are your favorite super commando dhruv comics?	What Raj Comics story is the best of all time?	0
182847	40867	56949	How do I lose stubborn belly fat?	How can I effectively lose belly fat?	1
182848	105503	18345	What movie is the best movie of 2016?	What are some interesting movies in 2016?	1
182849	279753	279754	What is your opinion on AAP hinting at Arvind Kejriwal as Punjab CM?	What do you think about the Aam Aadmi Party hinting Arvind Kejriwal as the CM candidate of Punjab?	1
182850	33486	279755	Where can you find baby owls for sale? Are owls legal to keep as pets?	Can you legally keep a sloth as a pet in the United States?	0
182851	279756	225424	What is the meaning of Marathi word 'Athavada'?	What is the meaning of Marathi word 'Aawad'?	0
182852	279757	279758	What is the difference between painting and sculpture?	What is the difference between a monument and a sculpture?	0
182853	206649	273968	What does it feel like to own a private jet?	What is it like to own a private jet?	1
182854	18877	52113	What are some of the best phones tools and gadgets?	What are some of the best mobile technology gadgets?	1
182855	19307	56903	Why Modi is putting a ban on 500 and 1000 notes?	Why do you think Indian government has demolished RS 500 and RS 1000 notes?	1
182856	279759	279760	In physics, is stress the same as pressure?	What is stress in physics?	1
182857	76814	279761	What are the causes of the Coriolis effect?	What is the Coriolis effect, and what causes it?	1
182858	279762	106612	Why does a girl hide her single relationship status suddenly on Facebook?	Dating and Relationships: If a girl likes me, but she blocked me on Facebook, MSN, and refused to reply to my texts, what does it mean?	0
182859	21938	116768	How safe is Papua New Guinea, and how does it's crime rate compare to Argentina's?	How safe is Papua New Guinea, and how does it's crime rate compare to Bolivia's?	0
182860	279763	279764	Which is more preferable Conversion-focused landing pages OR SEO-focused landing pages?	Why will Theresa May not trigger Article 50 to start the proceedings for the UK to leave the EU until early next year?	0
182861	279765	279766	What were your thoughts of the 2016 Vice Presidential debate?	What do you think about the vice presidential debate?	1
182862	279767	279768	Is co2 poisonous?	What does CO2 poisoning feel like?	0
182863	279769	279770	"Where does the word ""suicide"" come from?"	"Where did the origin of the word ""suicide"" come from?"	1
182864	122187	279771	Can lions fight gorillas?	How do I fight a lion?	0
182865	279772	80065	What is concept behind infinity?	What's infinity?	1
182866	30751	279773	If vegans had their way and everyone stopped eating meat, what would we do with all the cows, pigs, chickens and other animal food sources?	What are the average market prices of common animals like cows, pigs, sheep, goats, mules, camels, and chickens?	0
182867	85061	141595	Can someone travel back in time?	Can we travel back in time?	1
182868	279774	279775	What is the medical term for a bruise? How should it be treated?	What are guidelines to prepare image data set to train deep neural networks?	0
182869	14790	142978	Why is Manaphy angsty throughout in Pokemon Ranger and the Temple of the Sea?	In Pokemon Ranger and The Temple of The Sea, Why is Manaphy angsty?	1
182870	279776	279777	Why are there so many cute cats?	Why are cats considered cute?	0
182871	65823	25547	Why do we use electoral voting instead of majority vote?	Why is the Electoral college used instead of the popular vote?	1
182872	66945	92076	What is that one movie you recommend me watching right now?	Which is the one movie you will recommend me to watch and why?	1
182873	279778	279779	What are some sayings from Mickey Mouse Clubhouse?	How do I find the area of the face of Mickey Mouse or more generally, one face of a stone?	0
182874	279780	279781	How do I massage boobs?	Why are massages relaxing?	0
182875	116145	279782	What is your favorite novel genre?	What is your favourite book genre?	1
182876	235291	279783	How do I read effectively?	How do you read effectively?	1
182877	279784	176722	What are the top 5 best catches in the world for cricket?	What are some of the best catches in cricket?	1
182878	279785	279786	How can medical science respond to increasing antibiotic resistance?	What are some possible solutions to combat antibiotic resistance?	1
182879	161720	9766	Why do girls make sound while having sex?	Do most people make noise during sex?	1
182880	279787	279788	What are the benefits of using Lund's pancake mix?	How can a Chinese person learn English well by themselves? Or in the Internet?	0
182881	279789	279790	Which is the most efficient solar cell?	Why solar cells not efficient?	0
182882	30025	24613	What is the best scripting language to learn today?	Which programming language is the best nowadays?	1
182883	74651	74057	What are the best GMAT coaching in Delhi/NCR where I can get all the facilities?	Which is the best institute for preparing for GMAT in Delhi/NCR?	1
182884	279791	279792	Can you get the zika virus more than once?	When was the Zika virus discovered?	0
182885	279793	279794	Where would you want to live when you retire?	What do you want to do when you retire? Or what are you doing now, if you are retired?	0
182886	43358	210254	What are some mind-blowing safe wallets 2016 that exist that most people don't know about?	What are some mind-blowing wallets tools that exist that most people don't know about?	1
182887	279795	279796	"Were ""stop and frisk"" policies ruled unconstitutional?"	Is Judge Hudson's ruling on the unconstitutionality of the Patient Protection and Affordable Care Act likely to be overturned?	0
182888	279797	97059	How do I fill out Address Line 1 on an Online Form?	How do I fill in Address Line 1 and Address Line 2?	0
182889	279798	279799	Which type of goverment would you prefer to have in the places you live in ? Why?	[(x+1) (x+2) …(x+n)] /x = summation (ar/x+r). Find ar?	0
182890	261049	279800	How can I boot from USB in UEFI?	Why can't I boot from USB?	0
182891	205841	279801	How did you learn to love yourself ?	How do you learn to love yourself?	1
