id	qid1	qid2	question1	question2	is_duplicate
162716	253267	47563	How much money per hour do Uber drivers make in Springfield, IL? What's the most a person can reasonably make per month?	How much money per hour do Uber drivers make in Denver? What's the most a person can reasonably make per month?	0
162717	253268	253269	Which is the best reference book for mathematics?	Which is best reference book for economics?	0
162718	163302	106315	How do I manage product managers?	How do I become a product manager?	0
162719	253270	253271	Will US de-nukeliarize pakistan?	How can I foster inspiration for songwriting?	0
162720	253272	1858	How long can you sustain a long distance marriage?	How can long distance relationships be successful?	0
162721	85731	105645	Is GATE preparation possible in 3 months?	Can I crack gate CS 2017 in 3 months?	1
162722	253273	253274	What are the important things that civil engineers must know?	What are the important things that civil engineer should know?	1
162723	114069	253275	What does it feel to ride a choppy wave?	Are insects able to feel radio waves?	0
162724	253276	253277	What are the best resources for hiring game developers?	What are some of the best game developer resources?	0
162725	253278	217779	Is it easy to have sex in space?	Is it possible to have sex in space?	0
162726	86369	19444	What are the security features in new currency notes?	How secured is the new 2000 and 500 currency notes?	1
162727	253279	253280	How can you make money on eBay?	Can you make money on ebay?	1
162728	253281	253282	What could be a possible example of fourth/fifth/etc. person narration that has been used or might be used in the future?	What are some common examples of irony used in novels?	0
162729	1441	29684	How can I hire a hacker?	Where can I find/employ a real hacker?	1
162730	253283	138773	Is Hinduism a superior philosophy?	"Do people who think they are ""superior"" (not simply correct, virtuous, skilled etc.) think they have the right to be dumb?"	0
162731	80124	253284	What are some of the best ways to improve maths beyond JEE level?	What is the best way to practice Maths for 12 and JEE?	0
162732	253285	253286	How do you type the Copyright symbol from a keyboard?	Where is the copyright symbol on a PC keyboard?	1
162733	24555	18926	How do l see who viewed my videos on Instagram?	How can I see who views my Instagram?	1
162734	253287	253288	Who are the characters in Touhou? What are their backstories and how many are there?	How many characters are there in Touhou?	1
162735	57028	253289	Can you dream about a specific thing on purpose? If so, how?	If there are no purposes in nature, how can you have purposes yourself, given you’re a part of nature?	0
162736	253290	253291	How is the broadband performance of BSNL?	What is the quality of broadband service by BSNL?	1
162737	253292	253293	Is religion a virus?	If religion is ultimately proved to be a bug or virus in human mind, what would be the best way to fix it in cognitive-evolutionary perspective?	0
162738	21119	36475	Does green tea help to lose weight?	Will I lose weight if I drink every day 2 cups of green tea for about 2 weeks?	1
162739	253294	253295	MS in VLSI Design and Technology: Among Arizona State University, University of Texas at Dallas, University of Florida, Northeastern University, Syracuse University and SUNY Buffalo, which ones are worth applying considering Job prospects after MS?	I got an admit from Arizona State University for MS in Electronic and Mixed signal circuit design/VLSI. Should I consider applying to UC, Irvine?	0
162740	102682	253296	Why do we use AC supply in our homes?	Is there any way to charge our batteries using 230V AC voltage?	0
162741	253297	253298	What is the average package in Alliance University Bangalore for an MBA graduate?	I am a commerce graduate. What is the likely package I can expect if I do MBA from SIBM Bangalore?	0
162742	243578	253299	What is the easiest way to become a millionaire in india?	How can I become millionaire online?	0
162743	171534	111537	How did Katrina Kaif manage to make it so big in Bollywood despite her not so great acting abilities?	Why is Katrina Kaif still in Bollywood despite being a bad actor?	1
162744	253300	253301	Theoretically speaking if Prince Harry was made a Duke and parliament wanted his dukedom to have an annual income; could that happen?	How is the instinct to allow someone to hurt you after hurting them natural?	0
162745	86803	253302	If China is so much against India why don't Indians stop buying Chinese products?	Why don't we stop using Chinese products if eventually the revenue generated from it will be used against India?	1
162746	88252	33293	Why did the Indian government ban Rs. 500 and Rs. 1000 currency?	What are the advantages of the decision taken by the Government of India to scrap out 500 and 1000 rupees notes?	1
162747	253303	253304	What are some good ways to measure body fat percentage continuously?	How do I decrease my body fat percentage?	0
162748	253305	253306	What are the similarities and differences between the Aztec and Inca empires?	How did Inca achievements influence that of the Aztecs?	0
162749	253307	106089	Is Turkey invading Syria?	Does it seem like Turkey will invade Kurdish areas of Syria?	1
162750	253308	253309	Is it possible to be an introvert and an extrovert at the same time?	Can extroverts become introverts?	0
162751	51382	253310	How can we regrow hair naturally?	How do I grow my hair naturally?	0
162752	253311	253312	"How will you know if someone has turned on the ""post notification"" on your Instagram?"	I got a notification on Instagram that someone had also commented on something but when I clicked on it it didn't redirect me anywhere. What is this?	0
162753	71953	248053	Can a chemical engineer become an astronaut?	How can a mechanical engineer become an astronaut?	0
162754	253313	72230	How do I get a job at Goldman Sachs?	How can I get an internship at Goldman Sachs?	0
162755	253314	253315	When you get a benzoyl peroxide burn, how should you treat it?	How can I treat a benzoyl peroxide burn?	1
162756	253316	253317	What are your reviews for OnePlus 3?	What is your review of OnePlus (company)?	0
162757	253318	253319	Will I be able allowed to leave the dual degree programme at IIEST just after the btech degree?	Can I leave my BTech/MTech dual degree course after a BTech only?	0
162758	253320	253321	What's the best food and snacks to eat to lose body fat.?	Can eating healthy foods help lose fat and get abs?	0
162759	253322	253323	What are some tips to increase memory power?	What are some tips and tricks to increase concentration power?	0
162760	52956	48941	Are there many Mexican women that like East Asian men (Korean, Japanese, Chinese)?	Generally speaking, do many Mexican women like East Asian men (Korean, Japanese, Chinese)?	1
162761	253324	253325	Why do I always cry when I pray?	Why did I almost cry while praying to god?	0
162762	253326	253327	What are good ways for an expat software engineer to make job connections in Hong Kong?	How do I find customers in Hong Kong for a new software development startup?	0
162763	253328	253329	Who is Buddhist on Quora?	Are there any Buddhists on Quora?	0
162764	253330	253331	Is one direction really over?	Is One Direction over now?	1
162765	146988	27759	Can you actually spy on someone else's WhatsApp account?	How do I hack or spy on someone's WhatsApp conversation?	1
162766	253332	144650	How do I get fit and get rid of body fat?	Fitness: How do I reduce my body fat? See details.	1
162767	253333	253334	I am bcom honours student n I want to do group I which category I should select?	"Acer Acer Aspire One 756 11.6"" Netbook with Intel Pentium B987 Processor. Is it possible to upgrade the cpu?"	0
162768	74583	38063	Is Quora biased against Donald Trump?	Why is Quora biased agaist Donald Trump.?	1
162769	55804	253335	Does a hand job or penis inside the vagina give more pleasure?	What are some of the smallest ultimate things which gives you largest pleasure ?	0
162770	253336	253337	Which channel is best to make money online (Pinterest, Instagram, Facebook)?	Which channel is best to make money (Facebook, Instagram, Pinterest) and which one you prefer?	1
162771	253338	253339	I am a 17-year-old Indian boy. I wish to start investing in the stock market. What procedures related to banks and demat accounts are required?	I'm 26 years old, unmarried and I'm able to save 10k INR every month from my salary. What are the best investment options for 20-25 years?	0
162772	253340	253341	Dear friends do anyone have experience in pearl farming?	How can I do pearl farming?	0
162773	253342	104255	How short is life?	What is life too short for?	0
162774	253343	253344	What are convex mirrors? How are they used?	What is a convex mirror? What are their uses?	1
162775	253345	253346	I told my boss my grandpa was in the hospital, and he went to my brother’s work later and asked him about it. Do I lie about that again or come clean?	I told my brother about my anxiety, and now he's making fun of me. What do I do?	0
162776	253347	253348	Why do enlightened people seek donations?	I feel like I'm hitting the stage of teenage rebellion and apathy in my early 20s. What can I do to stop this?	0
162777	253349	253350	If someone blocked me on IMO then shall check there last login status?	Are you a fuckboi?	0
162778	253351	148257	What are good gifts for a foreign visitor to bring when they're invited to someone's home in Sudan for the first time?	What are good gifts for a foreign visitor to bring when they're invited to someone's home in Singapore for the first time?	0
162779	253352	253353	What are some most motivational photos?	What are the times you are most inspired, most motivated, most charged up?	0
162780	253354	29752	How does Notifications work on Netflix?	Why are Spotify and Netflix not yet available in India?	0
162781	52355	12272	How is school changing in the 21st century in Mexico?	How is school changing in the 21st century in Germany?	0
162782	225706	253355	What are the elements of life that make it complicated?	What are the elements in your life that make it complicated?	1
162783	253356	253357	Can I get admission in any engineering college if I complete my 12th in september via NIOS?	Can I get admission in any engineering college if I complete my 12th in October via NIOS?	0
162784	242537	198666	What are some disadvantages of the informal economy?	What are the advantages and disadvantages of an informal economy?	0
162785	253358	253359	Where are the biggest Ukrainian (origin or language) communities in the United States?	Where are the biggest Russian (origin or language) communities in the United States?	0
162786	253360	253361	When will the public get petabyte hard drives?	Is a 500GB hard drive good?	0
162787	253362	253363	What movies would fans of Donnie Darko also enjoy?	What are some movies similar to Donnie Darko?	1
162788	67555	25733	Why do bad things happen with good people?	Why do evil things happen to good people?	1
162789	253364	253365	I like debate but I don't want to be a lawyer, what is a good career for me?	I am 25. I don't how to start my career.  Can a book help me?	0
162790	139559	53547	How do I download playlist?	Is there any way to download YouTube playlists?	1
162791	24317	253366	Why does Europe have a voltage of 220 V, Japan has 100 V, and North America has 110 V? Is 220 V better, more dangerous, or more efficient? Why doesn't the world converge into a more unified voltage?	What's the household voltage in Europe and American? 220V?	0
162792	253367	253368	What is the easiest way to learn punctuation?	What is the easiest and fastest way to learn punctuation of English language?	1
162793	13689	253369	How do I prepare for the IAS exam at home?	How should one best prepare for IAS examination?	1
162794	253370	253371	How do I make a thousand dollars in a week legally?	What is the best way to legally make at least $1000 in a week?	0
162795	214630	31930	What are some lesser known/interesting stories in Mahabharata?	What are some lesser known and really interesting facts about the Mahabharata?	1
162796	253372	168816	What are some of the best job listing portals for media/content related jobs in India?	Which is the best job Portals in India?	1
162797	2790	253373	What is your most embarrassing moment in public?	What are the most embarrassing moments you have had in your office?	0
162798	224794	253374	Which university is the best for computer engineering in the world?	What is the best university in the world for engineering?	0
162799	253375	253376	I am a student and I am distracted by adult, dirty films. I want to be a topper, what should I do?	How one can learn React and Redux over the weekend?	0
162800	253377	253378	How Does SEO Better? Those who pay Google Adwords to get clients, or someone in organic listing?	Do I need to pay to get a Google AdWords account?	0
162801	184379	62435	What are the top 10 websites you can't do without visiting in a day? And Why?	What are the top 10 addictive websites for you?	1
162802	253379	253380	Is there anyway to avoid paying tax for Amazon purchases in California?	How do I complete a BOE 101 form?	0
162803	181617	253381	Why do dogs pee on tyres?	Why do street dogs in India pee on car tires and afterward smell it?	1
162804	253382	253383	Where can I find western clothing factory outlets in wholesale in India?	Find me western clothing factory outlets wholesalers in India?	1
162805	253384	253385	Should I stop being around friends that are rude to me whenever I don't want to hang out with them, or if I have too many friends and don't get the chance to hang out with most of them?	How can I show to my colleagues that I don't want any friendly relationships with them without being impolite?	0
162806	253386	253387	Do you like GaramChai Telugu entertainment on the YouTube channel?	Could someone provide with an introduction to Shintoism?	0
162807	253388	253389	Do you need legal credentials to start an investment group/vehicle? Which ones?	How do you start an investment group? What is the average worth of a single share?	0
162808	253390	253391	When can i get to my belongings from mississauga etobicoke storage?	How does one get from Toronto to Greenland?	0
162809	253392	59029	How does one meditate ON something?	What is the best way to meditate?	0
162810	202939	253393	Why do some women shave their eyebrows and paint them back on?	How do I hide a shaved eyebrow?	0
162811	253394	157361	Why USA supports Pakistan?	Why does US support Pakistan?	1
162812	253395	253396	Can a hybrid application store user login credentials locally on the device that it was installed on? Can he use this for authentication each time the user launches the application so that he may not have to do it himself and the hybrid app does the task for him/her untilsignout?	Quora User FAQs: How do I find the list of topics/interests on Quora that I got when I installed the application for the first time?	0
162813	253397	253398	Why do lean programs fail?	Why do so many companies which try to implement lean manufacturing fail?	1
162814	253399	253400	What is a Tesla coil?	What is coils?	0
162815	253401	253402	What is black hat in seo?	Who is a scarier VP option: Kaine or Pence?	0
162816	253403	253404	What does Coinbase do? What does it have to do with Bitcoin?	What's the best alternative for buy/sell bitcoin to Coinbase? I do not wish to provide my id.	0
162817	253405	253406	What gets you noticed enough by the company to get hired as a journalist if you didn't get a degree in journalism?	Which African American NFL player holds the most records?	0
162818	253407	253408	Can wolves have blue eyes?	Why do wolves have blue eyes?	0
162819	253409	253410	What is the meaning of pleurisy?	What is the best way to drive from Denver to flagstaff?	0
162820	253411	253412	How does strep throat differ from tonsilitis?	How does tonsillitis and strep throat differ?	1
162821	47953	197567	Which one is better to buy, Xbox or PlayStation and why?	Which is better: Xbox or Playstation? Why?	1
162822	4018	92977	How would demonetizing 500 and 1000 rupee notes and introducing new 2000 rupee notes help curb black money and corruption?	How does the latest decision of abolishing 500 and 1000 rupee notes help the Government curb corruption?	1
162823	253413	253414	Why is kneeling on rice used as a punishment?	Is kneeling on rice really a punishment?	1
162824	253415	118303	How can I get 12th pass certificate?	What can I do with my bca pass certificate?	0
162825	253416	253417	Can we use multiple constructors in a PHP Class?	Is PHP used in MNC?	0
162826	120674	115373	How does Donald Trump expect Mexico to pay for his proposed border wall?	How will Donald Trump make Mexico pay for the wall? Why does it make sense that Mexico will pay? Will Mexico do it?	1
162827	253418	253419	Is Lightning faster than sound and why?	Is lightning faster than sound? Why or why not?	1
162828	253420	253421	What % ROI do top hedge funds average?	Who are the top 100 women in hedge funds?	0
162829	13045	253422	What are the secrets only the wealthy know and the middle class is unaware of?	Where do wealthy and middle class people live in India, and how does it look?	0
162830	97603	4757	Does masturbation affect muscle growth when working out?	Does masturbation affect bodybuilding or muscle growth?	1
162831	253423	253424	What is an optically active material? What do they do?	What are optically active substances?	0
162832	253425	253426	How would you solve this thermodynamics problem?	How do we solve the given thermodynamics problem?	0
162833	253427	253428	What does masturbating mean for female?	My friend is 12 years old and wants to have sex. What should he do?	0
162834	233737	81433	Is there a best time to study?	What is the best time to study, day or night ?	0
162835	7299	253429	What will happen if two black holes collide?	What happens when two massive blackholes collide?	1
162836	253430	253431	How do you survive in this world?	How does one survive in this world?	1
162837	253432	253433	Why white screen comes in Gionee elife S5.5?	Why does my laptop screen turn purple and white sometimes?	0
162838	253434	253435	How do I overcome my fear of my boss at work?	How do I overcome my fear of talking to my boss?	1
162839	195043	37312	What do you do when you hate someone to the core?	What will you do if you hate someone?	1
162840	253436	253437	As expats and foreign observers, what has disappointed you the most about developments in China during recent years?	What can you say (based on some facts and statistics), about the quantity of production transferred from the US to China? Has it decreased within the last year? If it has, then why?	0
162841	76909	253438	What is the meaning of LIFE to you?	How does life make sense?	1
162842	198326	253439	What is a g tensor?	What is a tensor network?	0
162843	253440	253441	Do you put water in a crock pot; if so, how much do you add and where?	I mistakenly put my hand in a pot of boiling water and I didn't scald, how is this possible? My hands were already wet, is this why it didn't burn?	0
162844	151865	253442	How would you solve this trigonometry word problem?	How do I solve this mathematical word problem?	0
162845	253443	253444	What is the best way to prepare for pre medical test 2017?	How do I prepare for pre-medical test 2017?	1
162846	158816	253445	What is the best site to listen and download english songs?	What are some good sites for downloading English songs?	1
162847	165769	253446	Why is that the news channels broadcast advertisements all at the same time?	Why each news channel show advertisement at same time?	1
162848	70932	253447	Is Buddha an avatar of Vishnu?	Is Sri Buddha an avatar of Vishnu?	1
162849	4141	142912	What is your review of the 2016 MacBook Pro?	Is the 2016 MacBook Pro with Touch Bar a worthy buy?	1
162850	61869	63556	What is the best method of learning to speak a language?	What is the best self-study method for learning languages?	1
162851	253448	253449	How did you know you were a sociopath?	How do you know who may or may not be a sociopath?	0
162852	253450	253451	How good is the distance Post Graduate Diploma in Human Resource Management (PGDHRM) from Symbiosis center for Distance Learning?	Is it advisable to do the Human Resources Diploma course from Symbiosis Center for Distance Learning?	0
162853	14686	75290	Do you think there's life on other planets?	Is there no life on other planets?	1
162854	253452	253453	"What answer when someone (a girl) ask you ""Tell me something interesting about you""?"	"Is it misleading to just say ""okay"" when someone tells me something?"	0
162855	253454	253455	What is the best way to learn dynamic programming?	What is dynamic programming?	0
162856	253456	253457	Should we get bill before getting chips?	Counselling in private medical colleges in neet 2016 would be centralized online system or colleges wise offline. Pl clarify the procedure?	0
162857	253458	253459	How are candidates selected for CSIR or UGC fellowship based on performance in the CSIR-UGC Net?	What is the List of PSUs that an MBA (marketing) candidate can apply through UGC NET?	0
162858	253460	253461	Which is a suitable inpatient drug and alcohol rehab center in Newton County AR?	What is a suitable inpatient drug and alcohol rehab center in Howard County AR?	0
162859	253462	63031	Which is the easiest to learn for a beginner — skiing or snowboarding?	How hard is it to learn how to snowboard?	0
162860	253463	253464	"What is the meaning of the phrase ""hard work pays off""?"	How should you react when your Hard work doesn't pays off?	0
162861	253465	14283	What are some things new employees should know going into their first day at Atrion?	What are some things new employees should know going into their first day at Citizens?	0
162862	107550	203219	Why do colors look more red in one eye and more blue in the other?	Why would one eye see different colors than the other?	1
162863	253466	253467	How do I self study ccna & ccnp?	How are you studying for the CCNA?	0
162864	253468	253469	What dream did you have as a teenager which you had to bury because they said it wasn't realistic?	"I have been bullied, as a kid, a teenager, and as an adult. My tormentors, when I say I should be treated fairly, say ""Fairness is for losers. Only losers want to be treated fair, because they didn't win. Therefore you are a loser and do not deserve fair treatment"". What is your opinion about this statement?"	0
162865	253470	253471	Can you suggest some good stocks? I want to invest around 25,000₹ in multiple stocks for 8-10 months with decent returns? Suggest stocks with mixed risk and returns.	I will have $4,000 USD available next month. I want to invest it and would like to get a 10% monthly return. What are some suggestions?	0
162866	77412	106674	What is the function of a hard drive?	What is the function of the hard disc drive in a computer? How does it work?	1
162867	253472	253473	Which milk is best for a newborn baby, Friso, Similac or Aptamil?	Which is better for the family: one child, two children or more?	0
162868	253474	253475	Why do some Americans believe Edward Snowden is not a hero?	How does the world today see Edward Snowden, as a hero or as a coward?	0
162869	6613	5908	Height: How would a 14 year old increase his height?	Can skipping increase my height?	1
162870	140110	18936	How do I concentrate more on studies?	How do I concentrate better in my study?	1
162871	253476	253477	How can I stop craving sugar and dairy?	How can I stop craving sugar so much?	0
162872	253478	253479	What are some best practices in moving a Wordpress site from shared hosting to a virtual server or cloud server?	What is the best alternative to Digital Ocean for a VPS server?	0
162873	253480	253481	How do I get away with less sleep?	How do I sleep less?	0
162874	57541	16932	How do I get meth out of my system in 2 days?	How can I flush meth out of my blood?	1
162875	16089	171	What is the way to increase the height at the age of 21 years?	How can I increase my height after 21 also?	1
162876	178597	73917	Why do people drink coffee?	Why do so many people enjoy drinking coffee?	1
162877	11091	10796	What is the fastest way to lose weight safely?	What is the best way to lose calories fast?	1
162878	253482	4087	Why doesn't anal sex feel pleasurable to me?	My boyfriend wants to have anal sex with me; will it hurt or feel good?	0
162879	253483	253484	How do you compare and contrast active transport and passive transport?	How does active and passive transport compare and contrast?	1
162880	253485	253486	What is it like to live in Maryland?	What's it like to live in Catonsville, Maryland?	0
162881	178367	253487	How many trees do I need to plant to offset the carbon dioxide released in a flight?	How can you get the carbon dioxide on a plant?	0
162882	132026	34175	"If he says to me ""I don't care what you do, just make sure I don't catch you and wear a condom"" supposed to mean?"	What would you do if you became rich (really rich) and you're being contacted by a friend you do to talk to anymore? Let's say you always tried to talk to him before but he simply didn't make any effort to talk to you. Do I just tell him to piss off, nicer way to say this?	0
162883	89339	47244	How do you become a celebrity artist?	How does one become a celebrity?	0
162884	253488	253489	What are some nice, beautiful stories?	Does life stop after the end of a beautiful love story?	0
162885	253490	253491	Why did the lion roar very loudly?	If we take a very powerful speaker (yet concealable) to the jungle on foot, face a lion or tiger, and play a very loud roar, would it get scared and run away or know that it's a scam?	0
162886	253492	253493	What is a conceptual manifestation of an existential attitude?	What is law of vibration? And how can we use it effectively to manifest our desires?	0
162887	253494	253495	Are there any APIs for news headlines?	Is there any API for daily news photos?	0
