id	qid1	qid2	question1	question2	is_duplicate
243725	135886	62728	Why would a guy seem to avoid me?	What are the things you should never tell your girlfriend?	0
243726	5742	53686	How possible is it to get pregnant one day after my 3 day period?	If I have a 6 day period can I get pregnant just after it ends?	1
243727	356209	356210	Hi Neel what are your thoughts on power BI integration with Azure ML?	How do I build Insurance Lapsation model in Microsoft Azure ML?	0
243728	356211	356212	"Why do we ""think"" the way we think?"	Why and how do we think?	0
243729	2502	52590	What are the places to visit for a honeymoon in Kerala?	What are the must-see places in Kerala? Any lesser known place for a perfect vacation?	1
243730	356213	300715	How can you get rid of moles on your face?	How do you get rid of a mole?	1
243731	356214	356215	I have been denied a Chinese Z-visa due to prior US military experience, is working in China no longer an option?	Differences between pcs, laptops, smartphones, tablets?	0
243732	356216	356217	How do I get a clean clear face?	What is the best way to clean your face?	1
243733	224614	22998	Why is seo?	What is the importance of keyword in SEO?	1
243734	356218	356219	Which is the best place in mumbai for a candle light dinner?	Which is the best place in mumbai, near borivali, for a candle light dinner?	0
243735	356220	356221	Will mixed gases spontaneously 'unmix'?	Why are inert gases gaseous in nature?	0
243736	356222	356223	How much would it cost to build an app like laundrapp or washio? An on-demand dry cleaning & laundry app. The graphic design has been completed.	How much it will cost to design an app and what are the initial steps to launch it?	0
243737	356224	5780	What type of government does Guatemala have? How does it compare to the one in Ireland?	What type of government does Guatemala have? How does it compare to those in other countries?	0
243738	241519	356225	What is the importance behind the battle at Vimy Ridge? How did this event affect the outcome of the war?	What is the significance of Vimy Ridge?	1
243739	3938	1287	What should I do to improve my English ?	How can I improve my English speaking .?	1
243740	21367	22111	Why were my last few questions I asked marked as needing improvement?	Why are ALL my questions being marked as needing improvement?	1
243741	283022	356226	How can I increase my Intel HD(R) graphics dedicated video memory in a Windows 8.1 desktop?	Where can I purchase windows 8.1?	0
243742	10859	25911	How can I specifically improve my English?	How will I improve my spoken English?	1
243743	99421	17966	What is the best way to overcome porn and masturbation addiction?	What is the most effective way to break a porn addiction?	1
243744	356227	356228	What companies want from java developers?	Where can iron be found in nature? How is it found?	0
243745	205562	356229	How can I self publish a book in Yemen?	How can I Self Publish Book in Qatar?	0
243746	356230	356231	Why is it okay for a woman to be sexually frustrated but not a man?	If men and women are equal, why is it not acceptable for a man to hit a woman, but it is acceptable for a woman to hit a man?	0
243747	356232	356233	Should I go ahead and start working/uploading my comic book now or should I wait until my drawing skills are much better?	How can I escape from Mexico? I need to start a new life in a different country, Mexico is suffering a terrible crisis and it is affecting us all..	0
243748	274640	356234	Why do people pray?	Why do people pray a lot?	1
243749	356235	356236	What are some examples of ethical misconducts in research?	What are some examples of ethical misconducts in business?	0
243750	356237	102815	Why is generally woman will become fat after marriage?	Why do women become fat after marriage?	1
243751	356238	356239	What are some scarecrow tattoo designs?	What are some wolf tattoo designs?	0
243752	356240	356241	What is the best youthful and best skin care?	What are the best skin darkening creams?	0
243753	356242	356243	What are the benefits of mtech from IITs?	What will be the benefit of doing MTech in institutes like IIT if I am going to complete BE from average college?	0
243754	356244	356245	Who are the best Smart Home / IoT consultants in Montréal? What makes them great? What do they specialize in?	Who are the best Smart Home / IoT consultants in Mobile, AL? What makes them great? What do they specialize in?	0
243755	356246	356247	What is an example of the ideal PRD?	What's an effective workflow for writing a spec or Product Requirements Document (PRD)?	0
243756	356248	356249	Based on the latest Rand study, should the U.S. provoke a limited hot war with China now, before it loses the firm upper-hand in 2025?	If the U.S. was fighting a war against Russia today, would a draft be implemented? Would U.S. forces in Asia be deployed against Russia, leaving Asian defenses weaker? Could China than make a move on Asia?	0
243757	356250	356251	How do you become an American citizen if you are from Australia?	How do I become an american citizen?	1
243758	356252	356253	Is a finance PhD worth it?	How much math is in a PhD in Finance program?	0
243759	356254	356255	What are the most fun character combinations to use for One Night Ultimate Werewolf + Daybreak?	Why are card games fun?	0
243760	356256	356257	What are the best vegan restaurants in the world?	What are the best vegan restaurants in San Francisco?	0
243761	11778	154630	What are some ways to make money as a teenager? (UK)	What are the best ways to make money as a teenager?	0
243762	197233	356258	What is the difference between 4 dimension, 5D, 6D, and 7D movies?	Why don't people know the difference between movies and real life?	0
243763	356259	147577	How can I be disciplined?	How can I learn to become more disciplined?	0
243764	50587	64481	What should one do in order to escape boredom?	How do I beat boredom?	1
243765	19254	3061	Is World War 3 on the way with the US Elections?	How close are we to World War Three, and how bad would it be?	1
243766	356260	356261	I am a 19 year old guy. I briskly walk for around 5 km every day, run 2.5 Kms, and do a lot of skipping. What should be my daily calorie intake?	I ran a 8:45 for a 3 km when I was 16 years old but now I have to run a 5 km because I am 20 but I struggle to race 5 km what should I do?	0
243767	356262	190688	Is HIV a living or non-living organism?	Are viruses living or non-living organisms?	0
243768	356263	356264	Shouldn't Philippine take the Permanent Court of Arbitration of violation of UNCLOS verdicts to Chinese courts to enforce the verdicts?	Can Mr. Iyer be prosecuted for questioning Afzal Guru's prosecution of Afzal Guru? Is it not antinational to question the court's verdict?	0
243769	356265	103176	Who are most influential mathematicians and their contributions?	What are the most influential mathematicians?	1
243770	290889	59894	How can I lose weight through diet and healthy eating?	How do I lose weight without exercise?	1
243771	356266	356267	Do employees at Sierra have a good work-life balance? Does this differ across positions and departments?	Do employees at PMC-Sierra have a good work-life balance? Does this differ across positions and departments?	0
243772	11476	4052	What is the best path I should take to improve my English?	How can I continue to improve my English?	1
243773	356268	356269	How do the family members of celebrities who go nude on screen react to it?	"Has anyone won an ""outing"" with a celebrity before? How did it go?"	0
243774	356270	356271	What is the single best exercise to lose belly fat?	What is the best exercise to do at the gym to lose belly fat?	1
243775	356272	356273	Is there a list of rich people willing to help poor people with their bills?	How can I get a list of rich people willing to help poor people?	0
243776	356274	356275	Is sleep actually that important?	How important is sleep?	0
243777	35809	7526	Is NIIT Delhi good for a digital marketing course?	Which are the best online courses on digital marketing in India?	1
243778	29928	356276	Which media android player supports social sharing?	What do you think of AdTangerine.com which is an innovative Social Media Ad Platform to buy and sell advertising using Social Share?	0
243779	356277	356278	How do I sync Google contacts to iPhone?	How do I import Google Contacts to my iPhone?	1
243780	47392	255588	Self-Improvement: How can I motivate myself to work hard?	What can I do to motivate myself to work out?	0
243781	356279	356280	Will low displacement bikes like Yamaha MT-15 or Suzuki GSX-S150 ever be launched in India?	How frequent do Indians masturbate on an average?	0
243782	356281	38776	How do I reset my gmail password with a different phone number?	How can I recover my Gmail password without a recovery phone number or email?	0
243783	356282	356283	Which food tech start ups are hiring in Bangalore?	What are the existing food tech start ups in the UAE?	0
243784	356284	356285	What is the meaning of Rx? Which is written on the the doctor's Slip?	What is the meaning of Rx which is written on the the doctor's Slip?	1
243785	148005	356286	What should I care and not care about?	What should I care about the most?	0
243786	102945	285602	Is sex is required in relationship?	Why is sex given such importance in relationships?	0
243787	64234	77261	What are some great English songs to begin with?	What are the best English songs to listen?	1
243788	356287	356288	Do Indian women love white men?	Do Indian men cherish white women?	0
243789	356289	356290	What is a submersible pump? What purpose does it serve?	What is a submersible pump?	1
243790	356291	356292	What are the most mind-blowing facts of America?	What are some of the most mind-blowing facts of all time?	0
243791	35035	77743	Which is the best QuickBooks error support number?	Which is the best QuickBooks Tech Support Number in Las Vegas?	1
243792	356293	356294	What is the PG stipend for JIPMER doctors post 7th pay commission?	What will be the effect of a change of government on the 7th pay commission?	0
243793	68434	119527	How can you determine and calculate the heat capacity of a calorimeter?	How is the heat capacity of a calorimeter determined?	1
243794	317711	356295	How can I tap someone's phone call?	Can I tap somebody's phone call?	1
243795	15953	22008	What do you think about Modi government banning 500 & 1000 currency note from 9th November?	What do you think about Modi's new policy on the ban of Rs 500 and Rs 1000 notes?	1
243796	356296	356297	"Which food joints are ""must try"" in Pune?"	What are some must visit places for food lovers in Pune?	1
243797	73772	38179	How do crop circles form?	What is the mystery of crop circles?	1
243798	42464	110150	How do I overcome impotence?	Which is the best medication for male impotence?	1
243799	356298	356299	If one has to choose between CSE in Manipal and IT in VIT, which would be a better choice?	I'm choosing manipal CSE instead of Vit CSE. Is it a wrong decision?	0
243800	4993	142112	what are the signs a guy likes you ?	How do you tell if a guy likes you?	1
243801	292466	356300	What is the future in chemical engineering?	What is the future of chemical engineering?	1
243802	144227	356301	How do the petrol pumps get petrol to it?	How do petrol pumps earn?	0
243803	356302	356303	Is admission to Symbosis colleges more of a donation and less of a merit?	Can someone get admission in govt. college on the basis of relation to a minister and not having been in the merit list in the exam?	0
243804	356304	356305	What caused the Russian Revolution of 1905?	Why did the 1905 Russian revolution fail? What could have made it successful?	0
243805	208336	356306	What is your favourite game?	Games: Which is your favourite game?	1
243806	356307	356308	How many vineyards are there in the UK?	How many vegans are there in UK?	0
243807	356309	356310	Do most Israelis favor settlement expansion in the West Bank?	Do most Israeli favor settlement expansion in West Bank?	1
243808	145559	356311	Where can I buy muscle cars in India?	What are some classic muscle cars in India apart from the HM Contessa?	0
243809	356312	356313	What is the difference between a Chartered certified accountant and chartered accountant?	What is the difference between a certified and a chartered accountant?	1
243810	188140	356314	Which is the best quote or one-liner ever in a Hindi movie and why?	What is the best one liner for a WhatsApp status?	0
243811	26571	356315	How do I engage in chat with a girl?	How does one chat with girls?	0
243812	356316	356317	Should I answer a technical question if I feel I'm not an expert in that field?	Whenever I code on programming websites, I buy testcases if my answer is not correct. Is it a good practice or should I keep on trying the question?	0
243813	356318	117967	Would you kickstart a two fingers drawing application?	Would you kickstart this?	0
243814	356319	356320	What is the benefit of using a Fleet Management software?	What is the benefit of using a Fleet Management System?	1
243815	356321	356322	What are the different ways to iron our clothes?	What are the different ways to make clothes?	0
243816	235963	66156	Which is a good inpatient drug and alcohol rehab center in Clay County IL?	Which is a good inpatient drug and alcohol rehab center in Greene County IL?	0
243817	356323	356324	How will blockchain impact each country differently?	Are there any incidents that you have encountered any ghost s before?	0
243818	342591	356325	What are some natural obligations of chicken?	What are some natural obligations of scorpions?	0
243819	356326	356327	As a beginner, what do I need to become an EDM producer like DJ Snake and others?	Who was the first EDM producer?	0
243820	30925	356328	Is India still considered to be a third world country?	Can India be powerful being a third world country?	0
243821	70131	277945	What are the main differences between a bachelor's and a graduate degree in agriculture in terms of career prospects?	What are the main differences between a bachelor's and a graduate degree in sociology in terms of career prospects?	0
243822	356329	336069	How do I get a hot girlfriend who gives everything?	How can one get a hot girlfriend?	1
243823	356330	356331	What exactly does an FPSO structural engineer do? What kind of prospects does this line of work hold?	Robert Frost: Do structural engineers have a significant role at NASA? What exactly do they have to do?	0
243824	356332	51816	Has anyone attended the previous marketing conclaves of KIIT school of management? Are they helpful?	How can one attend the 7th national marketing conclave of KIIT school of management ?	0
243825	356333	356334	I want to study further in structural engineering. Is there any part time course as I am already working?	What course should one pursue after MBA if one wants to study further?	0
243826	356335	356336	What questions are usually asked during an interview for an iOS developer for a fresher?	What questions are usually asked during an interview for an iOS developer?	1
243827	28276	53499	What was the significance of the battle of Somme, and how did this battle compare and contrast to the Battle of Port Arthur?	What was the significance of the battle of Somme, and how did this battle compare and contrast to the Battle of Singapore?	1
243828	131896	128341	Where do I go to build a software/operating system?	How can I build an operating system?	1
243829	356337	356338	What are some good kitchen inventory apps for Android?	What are some good Android apps to protect my eyes?	0
243830	356339	356340	How can you learn black magic?	How can I use black magic?	1
243831	356341	356342	Do people see good heart or only the looks while choosing their partners?	Can one average-looking person have intense physical attraction for another average-looking person, or do people feel so only for good-looking people?	0
243832	199253	55137	Why does your heart or chest hurt when you're emotionally sad?	Why does my chest or heart hurt when I'm nervous and how do I stop it?	0
243833	256805	3543	How do investment bankers get paid, and how much?	How much do investment bankers make?	1
243834	111102	326871	Do you want to find a cure for muscular dystrophy?	What is Muscular dystrophy? And is there a cure for it.?	0
243835	356343	356344	Lignin, tannin and caffeine appears difficult to remove from water. What is the best method to treat Coffee industry wastewater?	What is the best method of treating flow back water from hydraulic fracturing to remove hydrocarbons, heavy metals and radioactive contamination?	0
243836	55189	356345	What is the date of SSC CGL tier 3 2016?	What will be the date of SSC CGL 2016 tier 1 exam?	0
243837	356346	356347	How can I align text boxes in Adobe Acrobat Pro XI?	How add bookmarks in Adobe Acrobat DC?	0
243838	356348	356349	What is federalism and how does a bill become a law?	How does a bill becomes a law in the U.S.?	0
243839	356350	127829	Is doing a digital marketing certification after an MBA in marketing helpful? If not, what are some suggestions for certification courses which can boost my career in marketing?	What are the certification we can do to become expert in Digital Marketing in India?	0
243840	139819	2168	How is the word 'impediment' used in a sentence?	How is the word 'inarticulate' used in a sentence?	0
243841	356351	356352	What advantage do gaming consoles have these days over laptops and PCs?	What are the advantages of gaming consoles over high end gaming PCs and vice versa?	1
243842	2566	17537	What are some popular method to do suicide?	What is the cheapest method to commit suicide?	1
243843	172793	159348	What are some mind blowing technology inventions that most people dont know?	What are some mind blowing inventions and technology things that most people don't know ?	1
243844	356353	356354	How does Ubiquitous computing works?	How does ubiquitous computing work?	1
243845	23717	14142	Is time travel possible after the discovery of gravitational waves?	Is time travel already possible on Earth?	1
243846	356355	356356	What will Jeff Sessions’s appointment as AG mean for states that have legalized marijuana?	What are marijuana prices like in states where it's legal?	0
243847	21568	356357	What is the difference between earthing, grounding and neutral?	What is the difference with ground and without ground?	0
243848	86772	356358	Can Hawaiian baby woodrose seeds be imported into Singapore legally?	Can I adopt a baby without undergoing legal procedures?	0
243849	356359	356360	How do I deal with drama queen roommate?	How can I deal with a drama queen?	0
243850	304033	356361	How do the Jews perceive, feel, understand, view, believe, and/or opine, about other religions?	What is gian coarses?	0
243851	356362	356363	What are good ways to proceed with the business idea?	I have a business idea and I need to evaluate it. What would be the best way to proceed?	0
243852	356364	273667	What are the best documentary channels on youtube?	What are the best documentaries on YouTube?	0
243853	356365	11685	What is conference?	What is a conference?	1
243854	154492	351312	How do I bypass a wifi password?	How do I hack WiFi passwords?	0
243855	225788	356366	When you're sick is it good or bad to drink alcohol?	Is it good to drink alcohol?	0
243856	325723	356367	What is the difference between the two institutions Isha Foundation and The Art of Living?	Can any one provide reviews about Isha Foundation Sadhguru's Bhuta Shuddhi program?	0
243857	118035	356368	What are the top universities for computer science in Canada?	What are the best universities for Master in Computer Science in Canada?	1
243858	356369	356370	What does the New Orleans Saints' use of the fleur-de-lis symbol mean?	"Why is the ""%"" symbol often used to mean ""the same thing""?"	0
243859	5044	348276	How do I stop addiction to porn?	How do I removed my addiction for masturbating?	1
243860	356371	305859	What are some good novels a 22 year old should read?	What are some good books for a 22-year-old to read?	1
243861	356372	356373	Is ammonia covalent or ionic? Why?	Howforefingers attracted to each other when we join you hands?	0
243862	183628	356374	Is it healthy to have egg and milk together?	Do raw eggs and milk make you gain weight?	0
243863	356375	356376	How do you write a complaint?	How can I write a complaint to Apple?	0
243864	356377	356378	How was the transistor invented?	Which is the first transistor that was invented?	0
243865	71528	39243	If dark and vacuum energy are created with expansion is there potential energy that transforms into these types of energy with expansion?	If vacuum energy is created as space expands, can infinite energy be created?	1
243866	356379	356380	What three Quantities are related in Ohm's Law?	Why do people claim to be fluent in Spanish when they can't even read a news paper in Spanish?	0
243867	39527	323904	How long would humans survive without the sun?	How long could humans survive on Earth if the Sun stopped shinning and emitting heat?	1
243868	356381	356382	Why does diffusion occur?	Do diffusion and osmosis require energy to occur? Why?	0
243869	356383	356384	Will India and Pakistan war happen in the future?	Will Pakistan defeat India in the future?	0
243870	356385	356386	What is an example of a successful spiritual autolysis?	What is spiritual autolysis described in Jed Mckenna's Spiritual Enlightenment trilogy?	0
243871	356387	16055	What's the best poem you can write?	What is some of the best poetry you have written?	0
243872	356388	356389	Can we reverse time?	Is it theoretically possible to reverse time?	1
243873	336873	136672	What is the business model of zapd.com?	What is the business model for wooroll.com?	0
243874	356390	165535	What type of questions can be expected in an online practical test and two rounds of interviews, for the post of Computer Science engineer at BPCL?	How can I get the public IP address of a user in Swift?	0
243875	64044	320650	What will happen when the Sun runs out of its fuel and dies?	What will happen if sun will die?	1
243876	356391	47696	Is there any way for me to see deleted messages on snapchat?	How do I retrieve deleted snapchat messages on Android?	1
243877	356392	154107	I have lost my 10th standard certificate and I also do not have a date of birth certificate. In this case how do I apply for a passport in India? Is it easier to get a birth certificate issued or a duplicate 10th certificate?	Lost education certificates and not possible to re issue how to apply for passport?	0
243878	356393	356394	Why does salt kill off snails?	How does salt kill slugs?	1
243879	114455	356395	What does it feel like to be shot?	What would happen if you got shot by a gun?	0
243880	356396	28734	What are some tips for training a Husky/German Shepherd mix?	How do you train a German Shepherd/Australian Shepherd mix?	0
243881	296116	356397	If humans evolved from apes will apes evolve to humans?	If man evolved from apes, what did apes evolve from?	0
243882	356398	356399	I've never had a bleeding nose in my life and I'm 19. Is this normal?	Is it normal if I'm 15 and have never made out/kissed/had a girlfriend/partied?	0
243883	356400	356401	How can we make Pakistan great again with the help of Donald Trump and China?	If Donald Trump was a Game of Thrones character what would his strategy be to make Westeros great again? Who would he form alliance with?	0
243884	23148	7530	How banning 500 and 1000 rupees note will curb the corruption and black money in India?	How will the ban on 500 and 1000 rupee note stop black money?	1
243885	2421	19732	What is the most funny joke you have ever heard?	Tell a joke that the funniest you have heard?	1
243886	211936	356402	What are some methods to last longer in bed?	Why do guys jerk off during sex?	0
243887	356403	156711	What are some basic characteristics of a library management system?	What are the features of a library management system?	0
243888	87927	16797	What are some unexpected things first-time visitors to Madagascar notice?	What are some unexpected things first-time visitors to India notice?	0
243889	356404	356405	Which is the biggest arena in the world?	What is the biggest arena in the world?	1
243890	356406	356407	How did becoming vegan make you more spiritual?	How does triangular shipment work?	0
243891	356408	356409	What is the longest time the US has gone without some kind of civil war?	What is the longest length of time that the United States has gone without a civil war?	1
243892	356410	131335	Can I spy my girlfrend whatsapp?	What's the best app that can spy on my wife's WhatsApp and BBM chat messages?	0
243893	356411	356412	What is this and how do I make this in photoshop?	How do I make this in photoshop?	0
243894	356413	139566	Are the stars visible at 7 pm?	Are the stars that are visible at 7 PM the same stars that are visible at 11 PM? Does their position in the sky change over those four hours?	0
243895	356414	106161	What does God think of people who don't believe in him?	False Pretences: Why don't some people want to believe in gods?	0
243896	356415	356416	I am IIT JEE 2017 aspirant. But I messed up 11th std. I have also joined coaching classes but I'm lagging behind. What should I do now?	I am a JEE 2017 aspirant. How can I perform better in my coaching tests?	0
243897	20289	294467	How do I get rid of my belly fat without doing any abdomen exercises?	How do I lose belly fat without exercising, it's causing me stress?	1
243898	356417	356418	How does one stop getting replaced?	How can I stop getting replaced?	1
243899	356419	356420	I am from India. I met a guy for arranged marriage, his looks are not that good, but it seems like he has a nice character. What should I do?	Arranged Marriages: What is the most weird quality that a guy has mentioned he is looking for in his bride-to-be?	0
