id	qid1	qid2	question1	question2	is_duplicate
311365	435632	435633	What is the funniest thing you have heard or seen?	What's the funniest thing you've heard yourself saying?	0
311366	435634	435635	If India- Pakistan war happens in nearby future, which side will Iran take? Why?	If a war erupts between India and Pakistan with whom will Iran side?	1
311367	227594	435636	What are the basic differences between Democrats and Republicans in American politics? Does either party support leftist ideologies?	What are the differences between the Republicans and Democrats when it comes to the economy, and why do you think that the one you support is better?	0
311368	5757	49699	Is it possible to gain height after 20?	How can I gain height at age 20?	1
311369	435637	141644	What's the current state of the American education system and is it being effective?	What are the problems with the U.S. public education system and what can be done to fix them?	0
311370	435638	141532	Is there another site like Quora once was?	What are other question-asking websites like Quora?	0
311371	102173	74672	"Why does this app is named as ""Quora""?"	"Why was Quora named ""Quora""?"	1
311372	435639	435640	"What does ""State of Grace"" by Taylor Swift mean?"	"What inspired Taylor Swift's song ""State of Grace""? How was it written?"	0
311373	435641	435642	Would a bulb light up temporarily if it is connected to an output of a transformer that is connected to a DC source when the switch is turned on?	Would grounding the (-) output of a non-isolated switch mode PSU trip an upstream RCCB at the input side when the (+) output sources say 1A to ground?	0
311374	435643	435644	Can I get a degree in economics while pursuing Mtech?	What job can I get with a degree in economics and statistics?	0
311375	44269	12718	How do I earn more money through internet/online?	How do I earn money from the Internet?	1
311376	435645	435646	How do you train a bully pit bull?	What are some tips for training a pit bull puppy?	0
311377	435647	435648	I ejected my USB 3.0 external drive 'unsafely' many times, yet I've never lost any data. Why is that?	Will a 16 GB USB 3.0 pen drive give me better speed than a USB 2.0 pen drive in a USB 2.0 port? Which is the fastest USB 2.0 16 GB pen drive in the market?	0
311378	435649	150421	How will Trump Presidency affect an atheist in a Muslim country who's contemplating to pursue a PhD in the US?	How is the victory of Donald Trump going to affect the international students aspiring to pursue their Masters in US?	1
311379	134702	435650	What are some symptoms of snow allergy?	What are some symptoms of sawdust allergy?	0
311380	435651	401714	How do you raise your self-esteem?	How can someone improve their self-esteem?	1
311381	95361	435652	How long can you keep homemade vegetable soup in the fridge?	Twelve hours ago we forgot to refrigerate a pot of homemade vegetable soup. If we boil it again, will it be safe to eat?	0
311382	435653	435654	What is the difference between photography and holography?	What are the difference between photography and holography?	1
311383	270081	435655	How can you avoid a girl who has a huge crush on you without hurting her?	How can I avoid a person who constantly looks over my shoulder to know everything you do,without hurting them?	0
311384	47935	435656	I am resigning from my employer. What are my options with 401K so that I can use it in India ?	When calculating what tax bracket I'll be in for the upcoming year, should I count money that I've converted from a Tranditional 401k to a Roth IRA as my income, thus inflating it and potentially bumping me up a bracket?	0
311385	6672	52675	Who will be a better president Donald Trump or Hillary Clinton?	Who is better among Hillary Clinton and Donald Trump?	1
311386	17897	863	How do I prepare for UGC NET English Literature exam?	How do I prepare for Net JRF in English literature?	1
311387	301392	435657	Who was the first emperor of India?	Who was the first emperor of a united India?	1
311388	10899	160244	What is a good way to become motivated?	What is the best way to keep yourself always motivated?	1
311389	42615	1375	What do you think of Mr. Modi's decision to discontinue Rs 500 and 1000 currencies as of midnight November 8th?	What would be effect of 500 and 1000 Rs notes ban?	1
311390	435658	364832	How does India successfully light up the entire country at night while China doesn't?	Is China a communist country?	0
311391	435659	235210	I'm an introvert. I feel like people hate me. they ignore me and I feel very lonely sometimes. I feel like I don't belong here. what should I do?	Why don't I feel lonely even though I'm almost always alone :/?	0
311392	84677	435660	What is the best PHP framework for web development? Why?	Which is the best PHP framework?	0
311393	435661	435662	Which book should I use as a primary study material for pharmacology: KDT or Katzung?	Is there any abandoned creepy places in Albuquerque or close by?	0
311394	41647	413249	How do I unfollow people on instagram at once?	How do I unfollow users that don't follow me on instagram?	0
311395	435663	435664	Why do I fall asleep almost all the time?	Why don't you fall asleep at this time?	0
311396	155606	88678	Is it true that there is life after death?	What are the theories as to what happens after death?	1
311397	55048	90883	What was the kindest thing you have ever done to someone?	What is the kindest thing you have ever done for a stranger?	1
311398	74247	60914	Is it possible to stop masturbating?	How can I stop doing masturbation?	1
311399	435665	54921	How do I make a fantasy world?	How do I create my fantasy world?	1
311400	435666	247436	If one has a $400K mortgage debt at 4.5% interest rate and inherits $100K, does it make more sense to pay down mortgage principal or to invest the money in stocks or mutual funds?	Should I pay down my mortgage or invest?	0
311401	351136	435667	What is the difference between a home loan, mortgage loan and a loan against property?	Which is the best option for a loan against property?	0
311402	435668	435669	How do I classify screw guns?	Why is Mexico screwed up?	0
311403	435670	435671	Which is the best ethical hacking course for my hacking career?	Is ethical hacking a good career?	0
311404	435672	435673	Will deafness be cured?	How can deafness be cured?	1
311405	435674	435675	Which phone has better camera quality Lenovo zuk z1 or moto g4 plus?	Which phone is good moto G4 or lenovo zuk z1?	0
311406	435676	84576	How do I improve my SAT scores?	What is the best way to improve SAT score in a month?	0
311407	435677	435678	What are the consequences of snorting crystal meth?	Benefits of master black belt?	0
311408	435679	435680	What do hazel eyes look like?	How do you make hazel eyes look green?	0
311409	177341	67077	What are some anonymous sexting websites or apps?	What are the good online tutorials and books to learn Android development?	0
311410	361454	202373	What were the major causes for the fall of the Roman Empire?	What are the reasons for the collapse of Roman Empire?	1
311411	435681	435682	What are the average cost per lead in women magazines around Europe?	What is the cost per click on Tumblr Sponsored Day?	0
311412	435683	435684	How strong is Canadian military on scale from 0 to 10?	How does a candidate fight against negativism in opponent's campaign?	0
311413	435685	18769	What is the coolest tank of all time?	A T90 and a Challenger 2 simultaneously spot each other on a grassy plain at a distance of one mile in a time of conflict. Which tank wins?	0
311414	435686	68335	Which are the best set of books for SSC CGL G.K. and English?	Which books should I prefer for ssc cgl 2016 tier 1 for self study?	1
311415	262177	435687	How do you make a collage on a computer?	How can you make a collage of pictures on a computer?	1
311416	188551	435688	What is [math]\int \frac{1}{e^x + e^{-x}} dx[/math] ?	What is the antiderivative of [math]e^{x^2}[/math]?	0
311417	435689	435690	How do I start a company líke Act fibernet, hathway internet etc?	Is IBM India a product based company or a service based one like TCS, Accenture, etc.?	0
311418	435691	39738	What does it feel like to be impotent?	How does it feel to survive a car accident?	0
311419	23853	358295	How many Baleno does Maruti produces in a day?	How many baleno does Maruti Suzuki produce in a day?	0
311420	32283	241541	What is procedural language? How is it best used?	What is the difference between a procedural language and a programming language?	1
311421	125246	44022	Is it too late to start medical school at 32?	In South Africa, is it too late to start medical school at the age of 24?	1
311422	435692	435693	China, being the worlds greatest military, where does it get its resources from?	Where did World War II get its name from and which civilization suffered the greatest impact?	0
311423	107021	3062	Given the situation in Ukraine and Southeast Asia, how close are we from World War 3?	How close is a World War III?	1
311424	435694	346626	What is the maximum distance that one can control a UAV from?	How much would it cost to build a drone(UAV)?	0
311425	435695	435696	What are some of the worst ever books written by Indian authors?	Have you ever read a book in English written by an Indonesian author?	0
311426	435697	60841	I'm 13 and according to all research I've done about people my age im supposed to be smart… How am I sure? I can't rely on IQ tests on the internet	How do I read/study with focus/concentration and avoid distractions/procrastination?	0
311427	114727	244487	Do employees at Integrated Device have a good work-life balance? Does this differ across positions and departments?	Do employees at Power Integrations have a good work-life balance? Does this differ across positions and departments?	0
311428	38362	47818	What are the best ways to lose weight fast?	What is the best way to burn fat fast?	1
311429	435698	435699	"How ""real"" are television cooking series like Chopped or Cutthroat Kitchen?"	"How ""real"" are television cooking series like Chopped or Cutthroat Kitchen and how does people win in those shows?"	1
311430	435700	435701	Is C# by E. Balagurusamy a good book for a beginner or not?	Is C++ by E. Balagurusamy a good book for a beginner or not?	0
311431	55350	21840	Which are the best movies in the world?	What are the best movies of all time?	1
311432	435702	132679	How can we eliminate food waste?	What is the best way to reduce food waste?	1
311433	435703	435704	My dog scratched me but there was no blood. Can I still catch rabies?	Why does my dog whine when he scratches?	0
311434	141673	435705	Hackers: Is it possible to hack into a school system and change your grades?	What can I do to improve my grades in school?	0
311435	435706	435707	What are the best font, size and color scheme for powerpoint presentations?	What are the most commonly used fonts in PowerPoint?	0
311436	435708	435709	Why do we relate people to songs?	So, the girl I like has a boyfriend. What good song can I listen to that relates to my situation?	0
311437	435710	435711	How is Capgemini as an associate consultant for an IIT Graduate?	How do I get into the world's top 5 consultant groups if you are not an IIT graduate or from some other renowned college?	0
311438	435712	128855	How to write appreciation letter to participants after attending a training program?	How do I write a good letter asking for an internship?	0
311439	95349	337832	Which top app development companies have built mobile apps for politics?	Which top app development companies have built mobile apps for restaurants?	0
311440	435713	435714	Why Average revenue curve called demand curve?	Why is the average revenue curve the same as the demand curve?	1
311441	435715	111613	What is the warmest temperature that snow has been recorded at?	Is there any temperature at which it is too cold to snow?	0
311442	435716	435717	Why use of Java?	In The Revenant, Why did the tribes attack Glass and his company when they didn't kidnap the chief’s daughter?	0
311443	20628	6171	What should I do to earn money online?	How can we earn money online without investment?	1
311444	435718	335932	What are unit tests?	What is software unit testing and why is it important?	0
311445	435719	435720	How much training does it take in order to be able to hold one's breath for 15 minutes?	Are there people in the U.S. Navy that hide their rank from their families in order to perform special operations missions?	0
311446	435721	290358	What are some of the types of frictions?	What are some of the types of friction?	1
311447	435722	435723	Is there a safe torrent site to download the adobe cs6 creative suite?	Where can I download Adobe Creative Suite for free?	0
311448	45575	18773	Should hamsters eat popcorn?	Can hamsters eat honey? Why or why not?	1
311449	435724	123111	What are some websites that teach hacking for free?	How can I learn hacking for free?	1
311450	261990	88601	What is the best way to fund an idea?	How can you get VCs to fund you if you just have an idea?	1
311451	36788	435725	Is there a philosophy of philosophy? What is it?	Is there a philosophy behind everything?	0
311452	435726	360487	Why did the partitioning of India cause violence?	How did the British implement Divide and Rule policy in India?	0
311453	435727	435728	In my laptop button 'C' is not working, how can I assign other button to 'C'?	How is persuasion transformed by certainty?	0
311454	435729	435730	What is the difference between i3, i5, i7?	What is the difference between i3 and i5 processor?	0
311455	1313	271371	How do I get off Quora?	How do you get out of Quora?	1
311456	435731	125715	What are the top 20 movies every film student should watch?	What are the top 10 films every film lover should see?	0
311457	435732	435733	Does ICICI sponsor employees to pursue higher education?	Does L&T sponsor employees to pursue higher education?	0
311458	435734	141933	What inspires you to be productive?	What inspires?	0
311459	435735	435736	Is there any management quota at PCCOE Pune? What are the fees?	What is the fee structure for MCA 2016 at RV college under management quota?	0
311460	149869	168819	What are the best earphones under 1000Rs?	Which earphone is best under 1000?	1
311461	435737	435738	Is crystal energy real?	Is crystal healing real?	0
311462	435739	435740	"If your parents told you straight-forwardly about the birds and the bees (""the talk"" about sex) when you were a child, what was your reaction to it?"	"What is it like to be a parent having ""The Talk"" with your kid(s)?"	0
311463	435741	435742	Is Bombay Shaving Company (on the lines of Dollar Shave Club) built just to get acquired by P&G or HUL?	Which diploma will be better in canada after +2, elctromechanical or only mechanical engineer?	0
311464	435743	75225	What do you think the answers on Quora reflect?	What do you think of the answers on Quora?	0
311465	146197	435744	Is there some Australian design awards like the red dot award?	Why are there awards shows like the Oscars and Grammys? What was the original motivation to give awards to art?	0
311466	435745	360000	Does Kate (Goldsmith) Middleton's Jewish heritage make her future offspring (heirs to the UK monarchy) Jewish?	Is Tom Hanks Jewish?	0
311467	36965	85735	Why is my period a week late?	Whu is my period 3 weeks late?	1
311468	435746	382261	How can I learn Hebrew?	What are some tips for someone just starting to learn Hebrew?	0
311469	435747	435748	What is the better choice in the current situation?	My banking working, time, 10 pm to7pm?	0
311470	435749	435750	As per claims Hindi was imposed by the government in Tamilnadu which resulted in Anti Hindi agitations; what were those specific steps of the government which amounted to this so called 'imposition'?	What were those specific steps of the government in the 1950-60 that amounted to the imposition of Hindi?	1
311471	140540	60903	Who is more powerful: prime minister or president?	What are the powers of prime minister of India?	1
311472	47993	390176	Is search engine visibility worth paying for?	Is Google search case sensitive?	0
311473	39514	59971	What is TQWL in Indian railways?	How safe is Indian railways in 2016?	0
311474	435751	435752	How do I get the list of areas in Bangalore in CSV?	What is the total area of Bangalore city?	0
311475	22378	230903	Are there any differences between East Asia's perception of beauty compared to Southeast Asia's?	Ethnic and Cultural Differences: What are the reasons people in East Asia don't eat dairy?	0
311476	435753	435754	My boyfriend and l have been having problems. He tells me he wants a break and during the break, he wants us to talk. He tells me he misses me soon after telling me he wants a break. What does this mean?	Why is it after every argument with my boyfriend he wants to break up with me?	0
311477	165925	362633	"Why isn't ""green"" tea green?"	Why should I drink green tea?	0
311478	435755	211322	What are some of the questions to ask on rural women's day?	What are some questions women like being asked?	0
311479	435756	435757	Would you beat a man up if he talked and flirted a little with your girlfriend?	Would you beat a woman up if she talks to your boyfriend and maybe flirt a little?	0
311480	435758	435759	I have just started art glass business but not able to get any business.Can someone suggest how to get free lancing jobs to earn something?	Why is China has problems with Dalai Lama?	0
311481	45052	73571	How to gain weight ?	How can gain my weight?	1
311482	435760	435761	"What is the meaning of the phrase ""you can't see the forest for the trees""?"	What does the saying mean to you? You can't see the forest for the trees?	1
311483	435762	435763	Will the army help me remove my visible tattoos?	Will the army help me remove my tattoos?	1
311484	8023	174	What were the major effects of the cambodia earthquake, and how do these effects compare to the Vallenar earthquake in 1922?	What were the major effects of the cambodia earthquake, and how do these effects compare to the Valparaiso earthquake in 1822?	1
311485	185325	106263	Can I get pregnant through oral sex?	Can I Get Pregnant From Oral Sex?	1
311486	435764	26999	Are presidents forced to live in the white house?	Could a President legally refuse to live in the White House?	1
311487	435765	435766	What do I do if I'm completely incapable of beating DeathStroke in Batman Arkham Origins?	Why can't I beat DeathStroke in Arkham Origins?	0
311488	65760	435767	How safe is the Oracle Arena?	How long would a woman live in a Roman Arena?	0
311489	435768	435769	What are the diameters of a proton,neutron and electron?	What is the diameter of an atom?	0
311490	435770	435771	Is the conspiracy theory about shape-shifting reptilian people on earth true?	Reptilian Race: Is there anyone else on earth who thinks that the shape-shifting lizards exist?	1
311491	196357	111178	How is blade commerce controlled in Vermont compared to Kentucky under the knife legislation?	How is blade commerce controlled in Vermont compared to Michigan under the knife legislation?	0
311492	37916	6748	What should I have to do to make my english and communication skills perfect?	How can I improve my communication skill and English proficiency?	1
311493	212889	435772	Have you ever been bullied at work?	As an adult, have you ever been bullied?	0
311494	435773	435774	What is the difference between a full-load current, rated current & nominal current?	What is the difference between a full load current and a rated current in electrical?	0
311495	435775	435776	Naruto : Can boruto use byakugan?	Does Naruto still need to use shadow clones to make a Rasengan even after becoming the 7th hokage in Naruto: Boruto the Movie?	0
311496	402031	174666	Is the white spider poisonous, and how does it compare and contrast to the wolf spider?	Is the white spider poisonous, and how does it compare and contrast to the wall spider?	0
311497	435777	435778	What is the easiest version of Bible to read?	I'm planning on reading the Bible out of curiosity. What version most accurately represents the original text?	0
311498	32495	435779	What is a Good 3ds Rom site?	How do I link my MyBoy! Emulator to visual boy advanced? Is it even possible?	0
311499	417747	284582	Can a person with average intelligence become a doctor?	Can a person with average marks become a great doctor?	1
311500	435780	435781	Why teachers are aggressive to some students?	Why teachers are so aggressive to some students?	1
311501	435782	435783	Is it true that if you don't use it, you'll lose it?	Is it true that if you don't use it you lose it?	1
311502	435784	435785	Do pinhole glasses improve vision?	Can pinhole hole glasses improve my eyesight?	1
311503	24228	230872	Can Donald Trump overturn gay marriage?	Will gay marriage be overturned with Donald Trump as President?	1
311504	435786	435787	What are some of your favourite anime movies?	Do you like animated movies? What is your favourite animated movie?	0
311505	435788	435789	The Melt: What is the seasoning used on the bread?	Why does ice melt under pressure? How is the process carried out?	0
311506	435790	22638	Why doesn't Instagram see all the photos in my library?	Is there a way to see deleted Instagram photos?	0
311507	347203	23084	Which is best smartphone?	Which is the best smartphone 2016?	0
311508	435791	265678	Why do the flames from a fire go upward?	Why does the flame of fire always go upward?	1
311509	24548	5729	What is the QuickBooks support phone number?	Which is the best QuickBooks Tech Support Number in New York, USA?	1
311510	255368	187488	How can one root android devices?	How do I root my android to do everything?	1
311511	435792	381704	If you feel unsafe stopping for a police officer on a deserted road while driving alone, is it legal to keep driving until you get to a safer place?	Can I learn car driving while baby in car seat? Is it legally allowed in US?	0
311512	344798	435793	What are the new technical seminar topics for computer science?	What are the new technical seminar topics for final electrical?	0
311513	47990	160	What actually is the purpose of life?	What's the purpose of life? What is life actually about?	1
311514	435794	435795	Who has the highest vertical jump ever?	Who has the highest vertical jump in the NFL?	0
311515	51489	51786	Who do you think will win the U.S. election in November?	Who do you think is going to win the 2016 presidential election?	1
311516	399856	435796	What are your inspirations to write?	What inspires you to write?	1
311517	435797	435798	What is the saddest quote you've ever heard or read?	What is the deepest thing you've ever heard or read?	0
311518	435799	435800	Which is better: C. V. Raman or Silicon in Orissa?	What are the upcoming 3G services in Orissa?	0
311519	435801	435802	What do you call people who constantly provoke others to get a reaction? Is there a medical or psychological term for this? Is this a disorder?	Is there a consensus among medical professionals that gender transition is the best remedy for body/mind gender dissonance, instead of 'fixing' the mind to match the body? Why or why not?	0
311520	435803	435804	What traffic laws in Grenada are particularly hard for foreign drivers to get used to?	What traffic laws in Nepal are particularly hard for foreign drivers to get used to?	0
311521	100068	435805	Can a good looking guy find a girlfriend if he's a boring conversationalist?	Can a guy still have a crush on a girl even though he has a girlfriend?	0
311522	14224	435806	How can I get the typeface used for the Windows 7 logo?	How do you install fonts in Windows 7?	0
311523	435807	435808	Is it possible that the sound insulation in my dishwasher is deteriorating over time?	How is dishwasher usage in India?	0
311524	435809	435810	What is the salary of an IAS?	What is the salary of an IAS officer?	0
311525	435811	435812	What percentage of human DNA is shared with other things?	What percent of our DNA do humans share with dogs?	0
311526	234535	435813	Why is it not technically feasible for a smartphone user to delink an old phone number from an application even if they don't utilize the old number?	Why is there no smartphone application that will allow the user to delink their old phone number even if they no longer utilize that number?	1
311527	435814	271196	Is institute of home economics du good for food technology?	How can we get the contact details of Amazon, Flipkart and Snapdeal sellers to contact them for listing their products on our portal?	0
311528	3750	26856	Is World War III coming?	How likely is World War III in the future?	1
311529	435815	435816	Does Mirena cause hair loss?	Does Axe pomade cause hair loss?	0
311530	18915	197875	What are the puzzles asked in interview?	What are the common puzzles asked in an interview?	1
311531	435817	435818	What are the similarities between philosophy of science and philosophy of mathematics?	What is the similarity between philosophy and mathematics?	0
311532	391851	435819	Can mathematics prove the existence of God or intelligent design?	Could God prove his existence and how?	0
311533	11730	168535	What are some symptoms of a bad idle air control sensor?	How do you know if you have a bad idle air control valve?	1
311534	435820	435821	Why do people think they are always right?	Why do the people think that He/She is always right?	1
311535	435822	435823	Why do I feel so empty after watching a movie?	I want to watch Manto Film. Where can I get it?	0
311536	435824	435825	Why do tiny black dots appear on my skin and on my face over time? What should I do about them?	Why do I have black dots on my skin?	0
311537	49809	106397	What's your favorite animal?	What is your favorite animal and why?	1
311538	435826	435827	How and how much is announcer Bruce Buffer of MMA Octagon paid?	Sleeping and awakeing in the morning is done by newton first law of motion?	0
311539	37653	12591	What purpose do you find in life?	What's the sole purpose of life?	1
