id	qid1	qid2	question1	question2	is_duplicate
151738	13748	39796	How will the scrapping of Rs 500 and Rs 1000 notes help in reducing black money and corruption?	Will the demonetization of the Rs 500/1000 notes in India actually help to curb black money? Or do the rich store their untaxed cash?	1
151739	238525	238526	How do I learn Quantum Field Theory as a beginner?	How did you learn quantum field theory?	1
151740	238527	238528	I need to resize a photo to 3.5cm X 3.5cm with 15-19 KB file size. How do I do it?	What is 3.5cm (width) by 1.5cm (ht.) in pixels at 600 dpi resolution?	0
151741	43984	238529	When is 5G coming to India?	Is the 5G network available in India?	1
151742	74659	238530	Is hair conditioner actually bad for my hair?	How do you bring hope back to your life?	0
151743	238531	238532	What is the best place to visit in Sri Lanka?	What are the best places to visit in Sri Lanka during monsoons?	0
151744	238533	238534	Does HBO log a history of your HBO Go account?	How do I know the expiration dates for movies on HBO GO?	0
151745	238535	238536	What is the criteria to get into Loyola College?	What is so special about Loyola College?	0
151746	238537	238538	Is it wrong for me to ask a handicapped person if they need assistance?	Is it better to ask a disabled person if they need help or wait until they ask for it?	1
151747	238539	45712	Where will you live?	Where do you live?	0
151748	238540	56155	How can the number of protons in the nucleus of an atom be determined?	How can I calculate the number of protons in the nucleus of an atom?	1
151749	144054	154776	What is it that really matters the most in our life?	What matters most in life?	1
151750	238541	238542	Does US universities wave off application fees? If yes, under which circumstances?	What is the right time to ask for application fee waiver at U.S universities? Is there any deadline?	0
151751	238543	238544	She friendzoned me, I have known her for 2 weeks, do you tkink I have to try the all out or just keep going and forget her?	What are undregradute chemical engineering projects based on simulation?	0
151752	238545	238546	Does Kasturba Medical College, Manglore provides JAIN food at their mess? It would be really helpful if anyone have idea about it	If exerting your muscles cause your heart rate to increase then why can't I feel my heart pumping when I feel my chest after doing push-ups?	0
151753	238547	238548	How long does it take for the Sun ray to burn a paper through a magnifier?	With a magnifying glass, I can burn paper under the sunlight but not under the light of an electric bulb. Why?	0
151754	238549	238550	How do I explain the concept of time signature to young music student?	What is Alessandra Giliani famous for?	0
151755	238551	238552	Where can we find a fridge repair center in Hyderabad?	Which is the best fridge repair center in Hyderabad?	1
151756	110203	190412	How does one become a diplomat?	How does one become a country's diplomat?	1
151757	238553	238554	I have a non-technical background. How can I learn JavaScript easily?	I am interested in start-ups but I have a non-technical background. Any advice?	0
151758	238555	71254	What can be the potential disadvantages of a cashless economy?	Can there be any drawbacks of total cashless economy?	1
151759	200688	238556	Writing: How do you write and send a letter to Ellen DeGeneres?	How do I write a letter in the topic of damaged poster?	0
151760	238557	238558	What process do you use to calculate the intrinsic value of a stock? Have you ever invested based on trends without arriving at a value first?	How do I calculate the fair value of stock?	0
151761	238559	238560	What is the quickest way to gain money online?	What's the quickest way to earn money online?	1
151762	238561	238562	What Does a therapist do if they have to poop during a therapy session?	What does it say about a professor if they don't have postdocs?	0
151763	238563	238564	What is the upward force?	What is frictional upward force?	0
151764	238565	238566	What is the best way to pawn my laptop?	How do you pawn a laptop?	1
151765	26855	216012	How do I flirt with girl?	How do you flirt when you pass nearby a girl?	1
151766	18419	70505	Who will win this presidential elections 2016?	Who will win the US election in 2016?	1
151767	102436	72418	Is there any life form outside earth?	How likely is it that life forms exist outside Earth?	1
151768	238567	79510	Is it alright for the media, the BJP and Congress to call Arvind Kejriwal a retard just because his ideology and way of doing things are different?	"When will the so called ""intolerance"" thing stop in India? Who is more intolerant? BJP, Congress or media?"	0
151769	238568	238569	Is e^x an odd or an even function?	When is a function neither odd nor even?	0
151770	238570	238571	Can I update my Android TV 4.4.2 to 5.0 lolipop?	How do I update the A850+ from Android 4.2.2 to Android 5.0?	0
151771	45181	123003	In Pokémon ranger and The Temple of The Sea, Why does Manaphy whine like a baby?	Why did Manaphy had a panic attack in Pokémon ranger and the temple of the sea?	1
151772	238572	238573	If life is unpredictable, why do we keep on living?	F 1 visa interview rwanda?	0
151773	238574	238575	How can I get valid Microsoft 70-247 Exam Dumps,70-247 PDF Dumps and 70-247 VCE Dumps? With new 70-247 Exam Questions as 70-247 Exam Preparation?	Where can I get latest 70-247 Exam PDF and VCE Dumps?	0
151774	238576	21600	What are some downsampling methods?	How do I code downsampling of signals using Octave or MATLAB?	0
151775	238577	238578	How many peer-reviewed journal articles are considered equivalent to one PhD thesis in the academia?	What would you do if your business competitor sets up a stall outside all your offices to poach your prospective & exsisting customers?	0
151776	238579	238580	Is it ok to only learn 6 foreign languages?	How do I learn a foreign language for free?	0
151777	105835	238581	How many characters are there in Xchrisone animation joke 8?	How many characters are in Xchrisone Animation joke episode 7?	0
151778	238582	238583	How can you tell if someone is lying?	What is a nice way to tell someone that an acquaintance is unequivocally full of bullshit, about things they would not suspect?	0
151779	238584	238585	What does it mean when you dream of yourself dead?	What does it mean when you dream of somebody?	0
151780	238586	110650	Can electric current (charge) flow through air?	Can electricity transfer through the air and if yes, then how?	0
151781	238587	238588	Why do motorcycles have rear wheel drive instead of front wheel drive?	Is there any Rear wheel drive by Acura?	0
151782	238589	238590	What is more important Question type or timing in a debate?	What question asked on Quora is the most debated?	0
151783	238591	238592	What are the best books to read in your twenties?	What are some good books to read in your twenties?	1
151784	38248	238593	How do I kill spiders?	Is it possible for a spider to kill a snake?	0
151785	238594	238595	Why do girls marry?	Why do girls get married?	1
151786	225411	97603	How does masturbation affect growth?	Does masturbation affect muscle growth when working out?	1
151787	238596	40914	Which system is better - collegium or NJAC?	Which system for appointment of judges is better, the old collegium system or the newly constituted NJAC?	1
151788	23108	4121	Why is salt water taffy candy imported in France?	Why is Saltwater taffy candy imported in Japan?	1
151789	238597	238598	How are the roles of the Chinese premier and Chinese president different?	Who are the best Mainland Chinese role model?	0
151790	238599	238600	Should I join an MBA in the Schulich School of Business, Canada?	Is Kohinoor business school good for an MBA?	0
151791	238601	238602	Why do we find life so monotonous at all times?	Why is life monotonous?	1
151792	238603	238604	What are the best books for learning game development?	What are some good books for game development?	1
151793	238605	238606	I'm involved but I told my first love that I love him still. He didn't say he love me, but he also didn't say he didn't. What are his feelings for me?	Tier 2 of SSC CGL got over. I think maths was tough and lengthy when compared to 2015 paper Even English was tougher. Wt would be the cut off guys?	0
151794	238607	238608	What are some security questions?	What are Security Questions?	0
151795	238609	238610	How can I be a freelancer?	How do I freelance in India?	0
151796	174274	238611	What business to start or how to make a lot of money right after graduation?	What it is like to have a start up just after graduation or after dropping out of graduation?	0
151797	238612	238613	How do you get a 9V battery?	How many milliamperes are in a 9v battery?	0
151798	238614	205082	I want to learn English and in what way or step that are?	How do I learn English step by step?	1
151799	238615	238616	How can India be corruption free?	What if India becomes corruption free?	1
151800	238617	238618	What is the most important feature of Java?	What is the best feature of Java?	1
151801	238619	238620	How can I change my Facebook settings to display the books that I like and not the books that I have read on my timeline?	How do I promote Books on Facebook?	0
151802	238621	238622	Fighting: Could 30 friends and I take on a silverback gorilla?	How good would a silverback gorilla be in the NFL?	0
151803	238623	238624	Usp of iPhone?	Are any books that can help to me to become a better person by thinking more clearly?	0
151804	238625	238626	What is your review of Notion Press?	What is your review of NotionPress?	1
151805	238627	238628	What is the meanest thing you have done to your mother?	What is the meanest thing you have done to your father?	0
151806	238629	238630	What are some prejudices North Indians have against South Indians and vice versa?	What are some stereotypes that North Indians have for South Indians and vice versa?	1
151807	238631	238632	Why do Canadians say sorry so much?	Does Canadian multiculturalism work?	0
151808	33833	46047	Is this move of banning 500 & 1000 Rupee notes right?	Is Modi's decision on demonetization of 500 and 1000 notes welcomed by public?	1
151809	238633	238634	When I contact your last supervisor and ask which area of your work needs the most improvement, what will I learn?	What do people need most at work?	0
151810	105852	238635	Which is the best headphone under Rs. 2000?	Which are the best headphones I can buy under ₹2000?	1
151811	84397	58478	What is wrong with Indian Education System?	What are the flaws in Indian Education system?	1
151812	238636	238637	What is single phase transformer?	What is single phase transformer mean?	1
151813	238638	238639	What is the difference between performance of DDR3 and GDDR5 graphics card? Which one is better: 2gb GDDR5 or 4gb DDR3?	Which one is best for gaming: an I5 4th gen and 4GB graphic card DDR3 or an I5 5th gen and 2GB DDR3?	0
151814	19121	77758	Where can I get best legal support for property transaction in Sydney?	Where can I get very friendly assistance in property for sale across the Sydney?	1
151815	238640	238641	How was the poisoning performed that concluded Game of Thrones Season 4 Episode 2 (The Lion and The Rose)?	Game of Thrones Season 4 Episode 2 (The Lion and The Rose): What did Bran see in his dream?	0
151816	238642	59270	What are the best phones to buy under 25k?	Which phone should I buy under 25k?	1
151817	178437	238643	Why did Philippine ask Private Temporary Arbitration in Hague, not the UN backed courts to solve the water territory disputes with China over SCS?	Why didn't Philippine request the UN courts instead of the Permanent Court of Arbitration on territory disputes between Philippines & China?	1
151818	238644	238645	Should there be mandatory military service for all men in Australia?	Is it right to apologize everytime you have fight even if u are not wrong just to save your friendship?	0
151819	238646	230831	If you accept a follow request on Instagram, do you automatically follow the other person back?	How can you stop someone from following you on Instagram?	0
151820	238647	238648	How much time will it take for my personal loan to get approved?	How much time did it take to repay MBA loan after ISB?	0
151821	877	4251	What are your views on ban of 500 and 1000 rupee notes in India?	What do you think about the ban on 500 and 1000 denomination notes in India?	1
151822	238649	238650	In a ground battle, which side would lose massive amounts of life, the Rebel Alliance or the Galactic Empire?	How do I start doing meditation like a pro?	0
151823	238651	238652	What can you do in 15 minutes?	"What was your ""15 minutes of fame""?"	0
151824	238653	238654	Will Donald Trump ever release his taxes?	Will Trump ever have to release his tax returns?	1
151825	238655	153459	What dress (for men) goes well with red shoes?	What shoe color goes best with a blue dress?	0
151826	238656	238657	Can one paragraph ccnstitute an essay?	Can one paragraph constitute an essay?	1
151827	58038	128808	How can we write a essay?	How do I write great essays?	1
151828	238658	238659	Do my Quora questions show up to others, even it is asked for an improvement?	Does Quora shows our questions to others if our question needs improvement?	1
151829	238660	238661	What's the most messed up thing you have done in Skyrim?	What do you think the future of Kashmir will be like?	0
151830	238662	238663	Pricing for AI?	Can I get ill from eating food cooked/prepared with dirty hands?	0
151831	238664	238665	Who is the richest man in Jaipur?	Who is the richest man in the world and in India?	0
151832	238666	238667	What do you eat for dinner?	What do you eat for dinner in the USA?	0
151833	238668	215891	What is the difference between Java and JavaScript?	What is the differnece between Java and Java script?	1
151834	238669	85594	How can you earn money from bitcoin?	How do I Earn from Bitcoin?	1
151835	15659	238670	How is the movie MS Dhoni untold story?	What is your opninon about MS Dhoni Movie?	1
151836	238671	238672	What happens during the first stage of meiosis?	What is the order of the stages of meiosis?	0
151837	199027	238673	What is the difference between a layer 3 switch and a router?	Difference between layer 2 vpn and layer 3 vpn?	0
151838	238674	8268	How can I make money online?	How can I make money online for free?	0
151839	238675	238676	Why isn't Shashi Tharoor on Quora?	Who is Shashi Tharoor?	0
151840	238677	238678	Is it okay for a guy to paint his toenails?	Is it okay for a guy to get his toenails painted?	1
151841	198388	56609	Will the humanity become extinct?	How and when will humans likely become extinct?	1
151842	238679	238680	How are heptane's isomer determined?	Why are ants attracted to human sweat?	0
151843	68470	22371	What's the best way to break up with someone?	How can I break up with my girlfriend?	1
151844	97108	238681	How do you get rid of a virus on an iPhone?	How do I get rid of a virus on my iPhone?	1
151845	21010	106959	How do I become a better thinker, innovator and a problem solver?	How can I be a problem solver?	1
151846	117126	238682	What are the advantages and disadvantages of being an airline pilot?	How long does it take to become a pilot in India after 12th?	0
151847	238683	238684	What are some of the best things in world?	What is the most interesting thing in the world?	0
151848	238685	238686	How can cranial nerves be healed?	What are cranial nerves?	0
151849	238687	238688	Where can I see my bookmarks in Quora app?	Where do I find bookmarks in Quora app?	0
151850	199823	238689	Why is Torrentz.eu not working, is it blocked like KAT?	Why has torrentz.eu shutdown?	1
151851	206145	238690	What is the highest salary a software engineer can get in India?	What is the highest salary a cad designer can get in India?	0
151852	131336	123810	How can you overcome a writer's block? (songwriting)	As a novice writer, what are some tips to get beyond writer's block?	1
151853	238691	205970	Is it possible to fall in love with someone you have never met?	Is it okay to be platonically in love with someone you've never met?	0
151854	238692	63596	How can we catch an asteroid?	Can we catch an asteroid on the surface of the earth?	1
151855	238693	238694	What are some foods that are available only in India?	What foods should I try in India?	0
151856	54444	39445	How could an English learner speak fluently?	How can I speak fluent english with confidence?	1
151857	3938	22064	What should I do to improve my English ?	What should I do to improve my spoken English?	1
151858	46324	238695	زب app: Can I install a Nomao naked camera for an Android?	What are the differences between a nom de guerre, a nom de plume, and a pseudonym?	0
151859	238696	238697	Is Portuguese difficult to study?	Should I learn Portuguese or German?	0
151860	169512	238698	Should there be law against the disruption of Parliament?	Can a law be passed against the disruption of parliament?	1
151861	238699	238700	What is the difference between the procedure of giving injection (medicine) vs drawing blood for a blood test? Are both the procedures different?	My crush shows interest in me sometimes, and doesn't care at all, at times. How can I make her love me?	0
151862	91511	238701	How can I hack someone else's WhatsApp account from a different place?	After knowing somebody is hacking my account, how can I recover my WhatsApp account?	0
151863	6935	238702	Why do I always feel alone?	Why do I feel so alone?	1
151864	238703	16763	Why do I always lose interest in people so quickly?	Why do people lose interest in me so quickly?	1
151865	238704	238705	Which are the best cricket academy in India?	Which are the best cricket training academies in India?	1
151866	31361	30125	How do I prepare for the UGC NET English Literature at home?	What is the best way to prepare for ugc net dec 2015 for english literature?	1
151867	238706	238707	Sales and Marketing Automation: Is there a service similar to leadlander that integrates with salesforce.com?	How important is dental marketing automation?	0
151868	238708	238709	What are best websites to buy Bamboo bags handcrafted from North East India?	Is it possible to get virus on my cell phone through opening a message on Facebook messenger?	0
151869	104952	238710	What is the price and feature difference between UberGo, UberX and UberBlack in India?	Why is the price difference between the bid price and ask price in stocks so large?	0
151870	12995	238711	How can I teach myself?	How can I teach myself to sing?	0
151871	34332	2681	What are the best places to visit in Kanhangad, Kerala?	What are some good places to visit in Kerala on tour?	1
151872	104629	24792	What is your New Year Resolution?	What are the resolutions you are going to take for the upcoming New year 2017?	1
151873	238712	238713	What is a power nap?	How can I take a power nap?	0
151874	80821	47811	Who is better from India's perspective, Donald Trump or Hillary Clinton and why?	Whose victory in US presidential election will benefit India, Donald Trump or Hillary Clinton and how?	1
151875	238714	238715	What do you think about the Qutee platform (Qutee.com)? Is it the new Reddit or not?	What do you hate about Tumblr and/or Reddit?	0
151876	238716	238717	Can a man love a woman but not want to spend time with her?	Is it discriminatory to force a woman to cover up her nipples but not to force a man with equally large nipples to cover up his nipples?	0
151877	238718	238719	How can I grow music channel on YouTube?	How can I grow a YouTube music channel?	1
151878	238720	238721	What is the colour change of methyl orange and phenolphthalein in acid, base, neutral solution?	Do all universal indicators show the same colour change for an acid, base or alkali?	0
151879	150545	79823	What are the funniest memes of 2016?	What are the funniest memes from 2016?	1
151880	143545	238722	Who is history's greatest badass and why?	Who was history's greatest badass?	1
151881	123207	238723	Which is a good inpatient drug and alcohol rehab center in Johnson County KY?	Which is a good inpatient drug and alcohol rehab center in Bourbon County KY?	0
151882	7244	23671	What existed before the beginning of the time?	If time didn't exist before the Big Bang, how could the Big Bang possibly have happened?	0
151883	238724	238725	What does 'ark' mean in the Ark of the Covenant?	What does the Ark of the Covenant do?	0
151884	238726	238727	Dividend investing: How much capital is needed to earn $500/month just on dividend returns? What are the best options?	What is the best way to earn on dividends with $2000?	0
151885	238728	53962	If a woman cheats and gets pregnant should her husband take care of the child?	If a woman commits adultery and gets pregnant, is the husband responsible for child support?	1
151886	238729	238730	What is ombre hair?	How do you do ombre hair?	0
151887	85504	238731	How do I manage time for studies with job?	How can I manage time for both job and study?	1
151888	238732	238733	How do I install software center in Kali Linux?	How do I install software center on Kali Linux 2.0?	1
151889	238734	238735	Which is the best website to do sex chat?	What are the best websites for sex chat?	1
151890	30395	238736	Why did Apple remove the headphone jack from the iPhone 7?	Idle problem with 2007 hummer?	0
151891	238737	238738	Which is better, GTX 960m or AMD Radeon R7-M440?	What is the difference in Radeon R7 260X and 360?	0
151892	90666	29874	How will World War III begin?	Are we heading towards World War III?	0
151893	202640	238739	How is it possible for you to get pregnant 8 days before ovulation?	Is it possible to get pregnant if my boyfriend ejaculated 6 days before ovulation?	0
151894	238740	238741	What are tips to ace an intercollegiate spelling bee competition?	Are there any upcoming Spelling Bee contests in Kolkata for class 12 students? And how do I enrol in them?	0
151895	238742	238743	Are there any earphones with a lost mode?	What are some examples of Newton's 2nd Law of Motion and how is it applied?	0
151896	238744	238745	What is the form number and the procedure for an Indian resident (not NRI) to obtain tax residency certificate (TRC)?	What are the tax rates for an Indian resident for any foreign income?	0
151897	238746	238747	I can feel a pimple forming. How can I get rid of it before it surfaces?	How do I get rid of pimples after shaving?	0
151898	238748	238749	What was Richard Nixon like as a person?	What was it like to know Richard Nixon in real life?	1
151899	238750	238751	Why can't human females lay eggs instead of menstruating?	Why do humans not lay eggs instead of going through difficult and painful pregnancy?	1
151900	229526	238752	What happens if you receive a D grade on a class?	How'd you feel if you knew you had to take the same grade over or repeat the class?	0
151901	238753	238754	How do I get people to like me if people always take me seriously?	How can I get people to take me seriously?	0
151902	238755	238756	Why there is a conception that Rafis best songs was far better than Kishore's best song and Kishore 's avg songs was far better than Rafi's avg songs?	What is U2's best song?	0
151903	238757	238758	What do you think about ISRO working on space shuttle instead of building one like Soyuz when space shuttle is clearly expensive and not safe?	Need help in getting track list for this new year trip to Goa?	0
151904	121374	238759	What causes throat bleeding?	What might cause a flap of skin in your throat?	0
151905	238760	238761	What is/are the reasons for your breakup?	What were some of the reasons for your breakup?	1
151906	238762	238763	If a group of 10-20 modern people are sent to the Jurassic period (back in time), would they be able to create a new civilization?	How would a group of humans fare in the Jurassic period without modern technology?	0
151907	238764	120762	How do I convince my friend's parents for an intercaste marriage of their daughter?	How do I convince my girlfriend's parents for an intercaste marriage?	0
151908	238765	238766	What relation to me is my great aunt's daughter's daughter?	My adult daughter disowned me. What can I do?	0
151909	238767	238768	Why is green paper required for legal documents in India?	Laws in India: Can an email be used as an agreement / legal document in court?	0
151910	238769	238770	What are some good PGs (paying guest) around manyata tech park for men with good ambience?	Which is the best place to stay in Bangalore for a techie who works in Manyata tech park? Reasons.	0
151911	131951	238771	Is there anyway I can increase internal memory for my intex phone?	Is it necesaay to unlock boot loader before rooting a Moto E? Can I somehow recover accidentally deleted important data for the same phone from an internal memory?	0
151912	238772	238773	What is a producing theater? What does a producing theater do and what are some examples?	How can I get motivated to study for school?	0
151913	238774	238775	What is StumbleUpon good for?	What is StumbleUpon?	0
151914	30544	16773	Is long distance relationship works?	How are long distance relationships maintained?	1
151915	238776	238777	How much money does Sachin Tendulkar make from IPL, International Cricket and Advertisements per year?	How much money did Mumbai Indians make by winning the IPL on 2015?	0
151916	40789	47512	What are some things new employees should know going into their first day at Resources Connection?	What are some things new employees should know going into their first day at Denbury Resources?	0
151917	238778	238779	How many days can you stay in dubai with visit visa?	How can I request a2a on Quora?	0
151918	149872	238780	Which stores in the United States are also in Mexico?	What if the United States purchased Mexico?	0
151919	238781	238782	Research: What are the topics in which currently groundbreaking research going on?	Research: What are some of the research areas/topics/problems that Prof. Ben Y. Zhao is currently working on?	0
151920	238783	238784	What is a mnemonic for 冒?	What are mnemonics?	0
