id	qid1	qid2	question1	question2	is_duplicate
200349	302093	302094	What is the average salary of IIT Bombay?	What is the IDC, IIT Bombay salary package compared to other departments of IIT?	0
200350	302095	302096	When and how to start preparation for cat if I am in 2 year b.tech?	Why am I alienating all my friends?	0
200351	302097	279641	How is Cengage Books for JEE Advanced?	Are Cengage books good for JEE Advanced?	1
200352	302098	302099	Why does Uranus not have an internal source of heat like other gaseous planets?	What mechanisms cause the internal heating of planets?	0
200353	202561	302100	Is mediahuman.com safe?	Is desigirlsphone.com safe?	0
200354	37972	201324	How many free kick goals were scored by Messi and Ronaldo in La Liga?	Who has more penalty goals: Messi or Ronaldo?	0
200355	302101	302102	What is section 145 A of incometax act is for? Need some detailed information. help me please.	What is a RBI Grade A officer?	0
200356	302103	147766	"What is the first word that comes to your mind when you hear the word ""Mumbai""?"	"What are the first words that come to your mind when you hear the word ""Entrepreneur""?"	0
200357	302104	302105	Why is Raziman T.V. (self roled Nanophotonics postdoc interested in programming in India) maintaining a strong Islamic State (ISIS) agenda on Quora?	Why can't India buy cheap oil from ISIS (Islamic State), when the EU and Turkey are buying the oil in range of 25-40 $ per barrel?	0
200358	302106	302107	Does being compassionate to another human being should be a much needed human trait? If yes, then why do we have wars and killings?	Can India have a PM who is a poor farmer and don't know anything about politics?	0
200359	302108	302109	Is it possible the 2016 U.S. Presidential election is rigged? Is it possible to rig an election?	How is it possible to rig the 2016 election?	1
200360	55633	33302	Which book to buy to learn java?	Which book is better for learning Core JAVA?	1
200361	302110	302111	What are some fears of the Greek goddess Artemis?	What are the weaknesses of Artemis, the Greek goddess?	0
200362	296108	302112	Software Performance: What causes a PC to slow down over time?	What makes a computer run slow over time?	1
200363	68360	16048	How do I earn more coins in 8 ball pool?	How do I get more coins in 8 ball pool miniclip?	1
200364	4109	78311	What is the biggest scam in india now?	Which is the biggest scam in India?	1
200365	302113	207960	How did Europeans’ prior experiences affect their actions in the New World? In which ways did they adapt to new circumstances?	Which European countries did not participate in WW2 and how did they manage to do it?	0
200366	32115	302114	Does turning the lights off actually save on your electric bill?	How much energy is saved by turning off the lights and fans when not using a room?	1
200367	302115	302116	Who are good personal injury attorneys in Queens? What were your experiences with them?	Who are good personal injury attorneys in Detroit? What were your experiences with them?	0
200368	302117	302118	What do libertarians believe is the function of government?	Do libertarians believe there are any necessary functions of the state? If so, what are they?	1
200369	302119	302120	What is a good memo/sticky notes software for PC?	How do I backup all the sticky notes on my Windows 7?	0
200370	302121	302122	What does Mood Indigo mean?	What is Mood Indigo like?	0
200371	75011	48610	Why is my Maltese/Husky puppy afraid of cats?	Why is my American Staffy/Kelpie mix afraid of cats?	1
200372	302123	96437	What was the most traumatizing moment of your life?	What was the most embarrassing moment of your life?	0
200373	66038	302124	Why is my diet not working?	Does Ketogenic diet work?	0
200374	302125	302126	Does the river boat MS Anton Checkhov use fixed pitch propellers?	Is it possible to travel coast to coast in the U.S. entirely by boat, using interconnected rivers, lakes, etc.?	0
200375	242986	70136	FBI to Re-Open Investigation Into Hillary Clinton's Email Server. Why?	Why has the FBI reopened the investigation into Hillary Clinton's emails?	1
200376	81354	133849	Who is the best rapper of all time?	Who is the greatest rapper of all time?	1
200377	206636	302127	Is there any PHP Script for User Management?	Blindloveapp.com will be ready to launch soon. Is there any advise you can give me in order for it to be successful?	0
200378	10321	10563	Where do I find a simple to understand solution on how to lose weight?	How should one change their diet to lose weight?	1
200379	302128	302129	What is the new thing which you learned from Quora?	What is the best way to learn new things from Quora?	0
200380	234458	289597	What actually is Gravity?	What is origin of gravity?	1
200381	302130	302131	How much money MS Dhoni took for making Film on him?	Is film 'The Haunting in Connecticut (2009)' based on a true story? If so, how much was embellished for the film?	0
200382	302132	22306	How can I safely buy an instagram account?	How do I hack Instagram account? Someone is using my identity and posting inappropriate post?	0
200383	81123	691	Which is the best phone to buy with the latest features and no heating issues?	What is the best phone to buy below 15k?	0
200384	302133	302134	How good is PayUMoney?	Is a payment through FreeCharge good?	0
200385	302135	302136	How many times a day should I brush my teeth?	How many times per day is too many times to brush my teeth?	1
200386	302137	302138	Why is education so overrated?	Is formal education overrated?	0
200387	8066	26613	How can I increase the traffic to a website?	What is the increase organic traffic of websites?	1
200388	302139	302140	What are the causes of bibasilar atelectasis? How is it treated?	What are some causes of rectal bleeding?	0
200389	302141	100820	How can I start my preparation for CAPF AC Exam 2017?	How should I prepare for CAPF AC exam?	1
200390	302142	106800	Why do American people hate the Indian accent but seem to really love the Spanish/Italian?	Why do some people hate Donald Trump and others like him?	0
200391	302143	302144	How long will it normally take for the Indian Income Tax Department to refund the tax deducted in excess when the returns are filed electronically?	How long does it take to get a tax refund e-file?	0
200392	118735	4927	What are the best Pokemon rom hacks?	What are some of the best Pokemon Go hacks?	1
200393	302145	302146	Are celebrities paid to be on social networks?	Is there a paid social network?	0
200394	13014	237822	What is ‘Edgware’ and how does the lifestyle compare to the London Borough of Brent?	What is the district of Edgware and how does the lifestyle compare to the City of London or any of the London Boroughs?	0
200395	11233	5215	If universe expansion create more gravitational dark and vacuum energy without limit?	If dark energy is being created with expansion can infinite of it be created?	1
200396	8154	30647	What is an easy way make money online?	How could I make money online?	1
200397	266673	302147	Can we ask questions on Quora and answer them ourselves?	How can you get the most answers on questions you ask on Quora?	0
200398	35921	1215	How imminent is World War three?	Is World War 3 more imminent than expected?	1
200399	219031	302148	Why are Malia Obama's high school grades and standardized test scores a closely guarded secret?	How serious is forging high school grades?	0
200400	42789	286623	Why are some people on Quora able to write really long descriptions for their question?	How do you write longer details for a Quora question?	1
200401	13625	302149	How can Communism be explained to a ten year old?	How do you explain black money to a ten year old?	0
200402	302150	302151	What Are the Differences Between an Accomplishment, an Achievement, and Success?	Do Chinese like to watch Thai movies?	0
200403	302152	302153	What are some tips to buy sofas online?	I don't need to answer 10 questions I want out now?	0
200404	302154	302155	Why does the Catholic Church oppose artificial contraception?	Why does the Catholic Church oppose contraception?	0
200405	151552	208714	What are the scopes of mechatronic engineering?	Is there any scope in mechatronics?	0
200406	193580	103168	What are the risks associated with using public Wi-Fi?	Is it harmful from security perspectives to use public Wi-Fi?	1
200407	302156	302157	Can anyone help me with income tax query?	How will it be like suffering from bipolar disorder while studying?	0
200408	302158	302159	Do you need to build backlinks from a high PR site or high PR page?	What are the on-page SEO and off-page SEO checklists for a website?	0
200409	88357	302160	Why is Donald Trump still 'ducking' his income tax return issue?	Why doesn't Donald Trump release his tax returns?	1
200410	90666	56634	How will World War III begin?	If there was a world war III around this time period what would most likely be the start of it?	1
200411	302161	302162	What is TDC?	What is a TDC?	1
200412	302163	302164	What is the first computer game?	What was the first computer game that you ever played?	0
200413	302165	302166	First 126 natural numbers are put side by side in order to create a large number N=1234..125126.what will be the remainder when N is divided by 625?	Can I get a good rank in IIT JEE if I start now?	0
200414	302167	302168	What are some new electronic gadgets?	What are the most promising new gadgets?	0
200415	302169	302170	What are the most popular publications in the 'QROPS'?	Why do I ask big questions and never care about the answers?	0
200416	39242	71529	If universe is expanding without a limit and dark and vacuum energy are created as it expands…?	Is vacuum energy the same as dark energy? is it infinite? if it is, how and why?	1
200417	302171	302172	What are the best resources to learn about the internal workings of Android OS?	What are the best books to learn the Android OS and app development?	0
200418	228944	302173	Is it high time that Bollywood make quality movies rather than quantity movies?	Is it true that black holes can make us travel through time like in movies?	0
200419	302174	253987	How can you convert .qcow2 file to .iso?	What are some ways to convert .pbp files to .iso?	0
200420	302175	302176	How much has the Affordable Care Act increased average premiums?	If the Affordable Care Act saved money, how come Medicare Advantage premiums are rising?	0
200421	302177	302178	Why do I laugh when I get extremely angry?	Why does she get angry if I get jealous?	0
200422	302179	302180	What can I expect in a group interview for Woolworths?	How should one prepare for a Linde Group interview?	0
200423	302181	302182	If you could be any ruler in history, which would it be?	What is Consumer Education and Research Centre, and what purpose does it serve?	0
200424	302183	302184	Are there really less jobs in India?	What are the most thank-less jobs in India?	0
200425	177347	302185	What is the difference between abstraction and encapsulation?	Example program of encapsulation in java?	0
200426	138344	302186	How can I manipulate anyone?	What I should do to manipulate others?	1
200427	302187	302188	Is there any difference between Monitor Deloitte and Deloitte Strategy & operation?	Receivable and Inventory issues?	0
200428	302189	302190	If Hillary or Trump were to die before the election, who would take his/her place?	What would happen if a presidential candidate were to die the day or week before an election?	1
200429	105448	302191	What is the difference between constitutional and statutory bodies or powers in India?	What is the difference between a pocket veto and the actual veto power of the President of India?	0
200430	302192	302193	"What are some examples of sentences using the phrase ""trivially true""?"	"What are some examples of sentences using the word ""derogatory""?"	0
200431	207407	27692	How do i get myself a girlfriend?	How do I get a girl's attention?	1
200432	142150	201998	How far off is Jupiter to becoming another Sun-like star?	What if was to bet entire Quora community they can't provide a single source that has more evidence than this one in the description below?	0
200433	72354	302194	"What is the ""Silicon Valley"" of Europe?"	Is there any silicon Valley in Europe?	1
200434	302195	302196	How are the parts of the cell cycle described?	How would you describe the parts of a cell cycle?	1
200435	5923	302197	Why do we use high voltage to transmit electrical power?	Why are high voltage power lines not insulated?	0
200436	2567	52182	Is there some painless way to suicide?	What is the least painful and best way to commit suicide?	1
200437	199878	54137	How can we convince a girl for sex?	How can I attract girls for sex?	0
200438	211682	37960	What are the advantages and disadvantages of 500 and 1000 rupees ban in India?	What are the benefits of banning 500 and 1000 rupees in India?	1
200439	302198	263420	Was my girlfriend wrong to defend her sister?	When my girlfriend's sister is mean to me and I defend myself, my GF defends her. When her sister is mean to me and I ignore her, my girlfriend gets angry with me for ignoring her sister. What should I do?	0
200440	302199	302200	Which are the best hotels near the Tirupati Temple?	Which is the best hotel near Tirupati temple?	1
200441	31926	209853	What are the best ways to get and be healthy?	How can I get healthy?	1
200442	46118	69441	How do I place my first question on Quora?	How can I ask my question on Quora?	1
200443	302201	302202	How turbo chargers charge phones faster than a normal charger?	Who has minecraft PS3 and what's ur psn	0
200444	302203	190971	Why are there many translations of the Bible?	Why are there many translations of the Bible? What are the differences between them?	1
200445	302204	302205	What are the top items burglars in America steal from houses these days?	I was accused of stealing money from a house party. I did really did not do this. How can I prove my innocence?	0
200446	302206	302207	Medical Conditions and Diseases: What role does the spleen play?	Which Chinese manufacturers produse reading glasses for Warby Parker?	0
200447	302208	302209	What are the best tactical vests in 2016?	Are Iranian leaders sane?	0
200448	213798	239117	What is reality?	What is the definition of reality?	1
200449	71364	302210	Does Hillary Clinton have any serious health issues?	Does Hillary Clinton have any known health issues that might keep her from running or succeeding in 2016?	1
200450	34681	18655	How do I ask a question on Quora? Please help it is very urgent.	How do I post a question in Quora?	1
200451	302211	302212	What is a good example of abductive reasoning?	Is doing a bad thing for a good reason good or bad?	0
200452	302213	302214	What is the point of dimensional analysis?	Why do we need dimensional analysis?	1
200453	302215	302216	Do most cats follow owners around the house?	Almost all house cats have secret lives. Dogs mostly don't. Does it make cats superior to dogs?	0
200454	302217	302218	How much time Adobe Noida takes to release an offer letter of software engineer after the initiation of BG check process?	How much time Adobe Noida takes to release an offer letter after the initiation of BG check process?	0
200455	302219	302220	What do mobile developers think of Ionic framework?	Are there any books on the Ionic framework?	0
200456	39851	1942	Where can I find a hacker?	Where can I find a good hacker?	1
200457	152633	18430	How do I get motivation to study hard?	How do I get motivated to study very hard?	1
200458	22107	75356	What happens when you mix sodium chloride and barium nitrate?	What happens when you combine sodium chloride and hydrochloric acid?	0
200459	302221	302222	What is your review of Blood Car (2007 movie)?	What is your review of There Will Be Blood (2007 movie)?	0
200460	302223	302224	How can I get internet connection in a disert? The energy come from solar pannels this power my laptop, free and fast internet is it possible, and how?	I would like to know about Ola and Uber cab? I want to start new busines.	0
200461	6912	86803	What will be the effect in the economy of China if Indians boycott all the Chinese products?	If China is so much against India why don't Indians stop buying Chinese products?	1
200462	302225	302226	What is a good joke you know?	What are the best jokes you know?	1
200463	302227	103435	What do investors look for in a startup?	What do investors look for in startups before investing?	1
200464	302228	241976	Why don't bananas have seeds? How does the banana tree reproduce?	Why don't Americans eat the skin of a banana?	0
200465	302229	302230	What should I join SBI PO or LIC aao??	What is better SBI PO or LIC AAO?	0
200466	35969	8891	What will happen if people having black money don't return it to bank, fearing being caught? This comes after latest 500 & 1000 rupee notes banning.	What will black money owners do after the banning of 500 and 1000 rupee notes?	1
200467	302231	302232	What are some movies bearing best names/titles?	What is the best name for a movie?	0
200468	302233	302234	What are the disadvantages of dating a model?	What are the disadvantages of dating you?	0
200469	302235	302236	Is this a positive pregnancy test?	Can having a miscarrige have a positive pregnancy test?	0
200470	302237	302238	How do they make Starburst taste so juicy?	What are the different grains used to make whiskey, and how so they effect the taste of the end product?	0
200471	302239	302240	How does supreme court protect the constitution?	If and when the Supreme Court possess a liberal majority, how likely is it that the right to firearms is eventually considered not a constitutional right?	0
200472	302241	30307	What does the average YouTuber with 1 million subscribers earn?	How much does a YouTuber with 1 million subscribers earn in a year?	1
200473	302242	302243	Will long-distance running (at a moderate speed) make your thighs slimmer?	How can I strength my leg while running and walking for long distances? I got a pain in blood veins while running	0
200474	302244	302245	How can I study engineering by myself?	What are the best ways to study in Engineering?	0
200475	211169	302246	What's the bravest thing you have ever done?	What is the bravest thing you ever did?	1
200476	302247	182997	How do you determine Lewis Structure for phosphorus trichloride?	How can you determine the Lewis structure for phosphorus?	0
200477	285330	302248	What is the future of Business Intelligence and Data Warehousing industry in India?	What is a good name for a group in an IT department that does business intelligence, reporting, database, data warehousing, SharePoint and software development?	0
200478	113285	302249	What is your strength and weaknesses?	What are the strengths and weaknesses of Infosys?	0
200479	302250	302251	How is improve my communication?	What is the best way of improving my communication?	1
200480	17384	302252	What are the top 10 web development trends in 2017?	What will be the biggest web design trends of 2017?	0
200481	302253	302254	Who is your favourite character from the Naruto manga/anime and why?	Who is your favorite character from Naruto?	1
200482	302255	302256	What does Jack Daniel's taste like when you mix it with carbonated water?	What does Jack Daniel's taste like when you mix it with vodka?	0
200483	302257	302258	Why do people ask questions on Quora but do nothing?	Why do people ask questions on Quora?	0
200484	44331	18296	Why do people ask questions on Quora that are easily answerable via a quick internet search?	Why do some people on QUORA ask questions that they can easily findout on Google?	1
200485	302259	302260	Am alone and happy, 1-2 hours a day. What should I do in that time? Going out is good but dont have anyone to accompany. I am at Ahmedabad, India.	I am doing engineering. I am addicted to masturbation. I do it at least 2 times a day. I am getting weak and dumb. What should I do?	0
200486	302261	302262	Who are allowed to come to India without Visa? Do the Britain Queen also need a VISA to come to India? (I have heard she do not need any VISA)	Which is the best Delhi public library in south Delhi for undergraduate physics?	0
200487	302263	28491	How many combination of 6 numbers can you make in 49 numbers and there is 1 to 49?	What comes next? 49,6,25,4,36,5,81,5?	0
200488	302264	302265	How do I play Xbox 360 emulator on?	How do I play emulators on the Xbox 360?	0
200489	61109	290279	What's wrong with the US healthcare system?	How did the U.S. Healthcare Industry get so complex? What are the solutions?	0
200490	51682	302266	How can an Indian apply for Sri Lankan travel Visa?	When should an Indian apply for Sri Lankan Visa?	0
200491	302267	302268	How do I take care of my orchid?	How do I take care of an orchid?	1
200492	38660	302269	What is cached data? Will it cause any problems, if we clear cached data?	"If cache memory is used for quick data access, then why do we see the ""clear cache' option in most of the browsers as it is sounding advantageous?"	0
200493	302270	302271	Where is the best place to register the .it domain?	Where is the best place to register an .is domain?	0
200494	302272	302273	Would a gorilla or lion wi in a fight?	Could a Gorilla beat a Tiger/Lion in a fight?	1
200495	302274	302275	Does one startup or start a startup?	Do people startup or start a startup?	1
200496	302276	302277	What are some quintessential Chennai memes?	What are some quintessential Indian memes?	0
200497	302278	302279	As a business owner / entrepreneur, how do you educate yourself and stay ahead of the curve when it comes to marketing?	As entrepreneurs, freelancers, and small business owners; how did you break out of working a 9-5 shift? What did you need to know then that you know now?	0
200498	4379	24613	What programming language I should learn first?	Which programming language is the best nowadays?	1
200499	302280	302281	Which machine learning book is best for a beginner who intends to do research in reinforcement learning later?	How is the mempool incorporated in the calculation of the nonce?	0
200500	302282	302283	How does Adam Schefter always have the inside scoop?	Why do the Giants still have Eli Manning?	0
200501	302284	302285	What is an OpenGL graphics system diagram?	Is anyone familiar with zigma wind ball?	0
200502	302286	302287	My Moto G2 has been restarting automatically and I can't see anything except the Moto logo (blue circle with a white M). I have not seen my home screen since this morning. How do I repair my phone?	I am using a Moto G2. Do I need a screen guard on my phone?	0
200503	302288	9466	Where is the Baraka River located, and how does it compare to the Zambesi?	Where is the Baraka River located, and how does it compare to the Salween River?	0
200504	302289	302290	The RuPay Debit Card is not accepted by the Paytm online recharge app in my Android mobile. Is the condition the same for the other online recharge apps?	I have an Android app with wallet facility. I want to allow my users to directly redeem money from their wallets by recharging their mobiles from my app instantly. Is it possible to do that by using some APIs of leading recharge companies like Paytm, MobiKwik, etc., or is there any other way to do that?	0
200505	302291	302292	Which country has the least natural beauty?	Is there a relationship between lucid dreaming and astral projection?	0
200506	209730	214187	How do I invest in myself?	What's a great way to invest in myself?	1
200507	142781	189036	What are the main imports and exports of Venezuela, and how does Venezuela's industry compare to Belize's?	What are the main imports and exports of Venezuela, and how does Venezuela's industry compare to Paraguay's?	0
200508	302293	302294	What are the reasons why people hate electric cars?	I wish to build a small recreational electric car (not street legal) for a reasonable price. What parts should I start out with / how should I start?	0
200509	302295	215987	How do I build passive income streams?	What are some ways to create passive income streams?	1
200510	302296	114459	How do I make video games programing?	How do you learn to make video games?	0
200511	206349	302297	Why does a man wear his watch on the right hand whereas a woman wears it on her left hand?	Why do people wear watches on their right hand?	0
200512	302298	302299	Which car is the fastest car?	What is the fastest car?	1
200513	302300	302301	What was the most poorly done horror movie you've ever seen?	What is the most unintentionally hilarious horror movie you've ever seen?	0
200514	302302	302303	Who introduced gst bill?	What are some good companies and startups for doing internship for college student doing b.com hons?	0
200515	126989	21401	How could I start my business?	How do you exactly start a business?	1
200516	76054	129826	Why can't I tag photos on Instagram?	I am unable to tag people on Instagram. Why?	0
200517	302304	302305	Why don't wolves perform in a circus?	Is there any specific reason for why wolves are not used in the circus?	1
200518	302306	268183	How do I create an android app like hike?	How can I create Android apps?	0
200519	302307	302308	Which coaching classes are the best in Mumbai for GATE coaching?	What is the best coaching centre for electronics and telecommunication GATE preparation in Mumbai?	0
200520	302309	302310	What are some ways in which eugenics is used in modern medical practice?	What are some examples of modern day eugenics practices?	1
200521	141109	122466	What should you do when you are angry?	What do you do when you are angry?	0
200522	9598	302311	How many vacancies will be there in ssc cgl 2016-2017?	How much vacancies are expected in SSC CGL 2017 & 2018?	0
200523	302312	81268	How can I get rid of cellulite in two months?	How do I get rid of cellulite on my thighs and butt?	0
200524	302313	302314	Are basketball players tall because they play basketball, or do they play basketball because they are tall?	Why do so many black kids play basketball?	0
