id	qid1	qid2	question1	question2	is_duplicate
206000	130893	73283	What is a good first programming language?	Which is the best programming language to learn for beginners?	0
206001	309299	309300	How do apps like Flipagram (which mashes your photos with music) use copyrighted music legally?	Some sites do not allow one to use copyrighted music. If I changed the tempo or mix in some background music would that resolve the copyright issue.?	0
206002	137025	84741	What are some things new employees should know going into their first day at Allied Motion?	What are some things new employees should know going into their first day at Ally Financial?	0
206003	35351	44893	Who is the stupidest character in Game of Thrones?	Who is the most misunderstood character in Game of Thrones?	0
206004	24179	215383	How do we control our emotions?	How do we become better at controlling our emotions?	1
206005	70475	167542	What are some mystery movies?	Which is the best Mystery movie and why?	1
206006	309301	309302	What are some other tennis shoes similar to Keds?	How is Zappos different than other shoe sellers?	0
206007	309303	309304	Has the world been devoid of unrest, famine and war for any reasonable length of time in the recorded history?	Is it advisable to form AOP (Association Of Person) for Cast (Ghynati)? What IS tax Implications for it?	0
206008	288621	139048	What is the worst thing that happened in 2010?	What is the worst thing that has happened to you?	0
206009	309305	309306	What is the difference between an antiseptic and a disinfectant?	Can beer be used as a disinfectant?	0
206010	4845	309307	What causes a car to lose power while driving?	Did people used to wear leather helmets while driving a car?	0
206011	309308	309309	How do you transfer money to another bank using Chase QuickPay?	How can I transfer money from a Chase account to Silicon Valley Bank for free?	0
206012	309310	309311	What is the best institution or factory in Chennai that offers internships to BSC chemistry students?	Which company in Kolkata offering internship for electronics student.?	0
206013	309312	309313	Why can we breathe nitrogen, but it would kill us if we drank it?	Why nitrogen is used in freeze drying?	0
206014	62048	309314	How should I make oral sex on a woman?	What are some tips for performing oral sex on women?	1
206015	309315	309316	Does being from a state board school reduce my chances of getting accepted at top UK universities?	My BS degree is from a foreign university not well known in the US, will that affect my chances to get into a top engin. grad school in the US?	0
206016	309317	27366	What are some things new employees should know going into their first day at Southside Bank?	What are some things new employees should know going into their first day at Capital Bank?	0
206017	309318	309319	What is best syllabus to teach spoken English?	How do I start a business teaching spoken English or Polish over Skype?	0
206018	309320	309321	Who discovered vacuoles? How did this discovery change biology?	How were vacuoles discovered? How did such discovery change biology?	0
206019	309322	309323	Why does every company need a logo with slogan?	What should a vegetarian do if some disaster happens and there is no vegetarian food available (eg. middle of sea, desert, etc)?	0
206020	309324	309325	What is it like living on a deserted island?	What is it like to live on a deserted island?	1
206021	61377	60274	So how does banning 500, 1000 rs and introducing 2000 rs will curb corruption?	Would banning notes of denominations 500 and 1000 help to curb the black money in system?	1
206022	309326	309327	Why does Netherlands use orange color?	Why are the Dutch associated with orange?	0
206023	309328	309329	What is the link between sensor sizes and their names?	What is the name of the sensor that is used to count number of products at once?	0
206024	309330	309331	What should you do when people gang up on you?	What causes people to wake up crying?	0
206025	5724	547	How can I Increase the traffic of my blog?	How do i get traffic for website?	1
206026	17160	67768	How do I increase my height after 16?	How can I increase my height after 18 years of age?	1
206027	309332	309333	Where should I go on vacation this summer?	Where should I go on vacation this summer in Europe?	0
206028	12353	47189	Why do we forget dreams so quickly?	Why do we forget our dreams so quickly?	1
206029	309334	309335	Which is best engineering college in madhya pradesh?	What are the top engineering colleges of Madhya Pradesh?	1
206030	143248	24896	What are some of the best dialogues written by Trivikram Srinivas?	What are the must watch movies to see before you die?	0
206031	309336	309337	How big should a tree be in order to build a tree house?	What is the best way to build tree houses?	0
206032	309338	309339	Why do many dancers wrap their sweaters or button shirts around their waist when practicing a dance routine?	How many calories can you lose doing or learning a new (kpop/jpop) dance routine?	0
206033	309340	309341	After how many views will I eligible for money on YouTube?	How do I convert clarinet music into a French horn music?	0
206034	309342	309343	How can I increase my online store sale?	How can I increase sales for my online store?	0
206035	309344	309345	Which is the best mobile app marketing company in ahmedabad?	Which is Best outsourcing mobile apps companies?	0
206036	228276	34861	I just want to die. How can I make it look like an accident?	How do I die and make it look like an accident?	1
206037	21879	309346	How do I find out if my girlfriend Is cheating?	How do I find out if my girlfriend is going to cheat on me?	0
206038	309347	309348	How can one join CBI?	How do I join the CBI?	1
206039	53632	43605	I'm fat. How do I lose weight?	I'm overweight. How can I begin to lose weight?	1
206040	249691	309349	What are some good online courses to learn foreign language?	What are some good online courses for learning German?	0
206041	309350	309351	My crush said that she loves me, but is avoiding any relationship talk. She has been cheated on in the past. What should I do?	My girlfriend says she don't love me strongly as I do.She also talks with the guys she previously had crush upon. I really love her. What should I do?	0
206042	309352	309353	Should Hinkley Point nuclear power project go ahead in UK?	Which is better intel pentium or the core i3 and why?	0
206043	309354	309355	Procedures of legal proceedings supreme courts?	Swadeshi campaign of patanjali?	0
206044	46879	106885	How can I message some one on Quora?	How do I personal message someone on Quora?	1
206045	309356	309357	How much happy are you with Narendra Modi government?	How good is Narendra Modi at governance?	1
206046	309358	309359	What will happen to wire transfer with correct Swift code and wrong IFSC code?	Is IFSC code also known as the bank code?	0
206047	168509	309360	How many keywords are there in the ActionScript programming language in the latest version?	How many keywords are there in LiveCode Programming Language in the latest version?	0
206048	309361	156529	What are the best ways to sleep better tonight?	What should I do to sleep better?	0
206049	309362	309363	What are the differences between religion and duties?	What is the difference between all religions?	0
206050	309364	309365	Is there such a website where I can get my nude photo rated?	Are the nude scenes in film and television real?	0
206051	100001	309366	Why is the melting point of diamond so much higher than silicon?	Why does diamond have a higher melting point than silica?	1
206052	76588	223043	How has 2016 been a year for you?	How has 2016 been as a year in your life?	1
206053	13556	40773	How do I improve my writing skills?	How do I continue to improve my writing?	1
206054	222235	309367	Why won't the iPhone App Store let me download apps?	Why does my iPhone 6s when I try to download an app from App Store always shows me this icon?	0
206055	183963	208509	What are some strengths and weaknesses of Australians?	What are your strengths and weaknesses?	0
206056	309368	309369	What is the expected salary for an 8 years of experience SQL developer in India?	What is the expected salary for a 3 year experienced SQL developer in India?	0
206057	309370	309371	What is the best thing someone's ever said to you?	What is the most important thing someone has ever said to you?	0
206058	43576	134155	How does the structure of the education system in South America compare to the edcuation system in South Africa?	How does the structure of the education system in South America compare to the edcuation system in Asia?	0
206059	309372	148273	What is golance.com?	What is govtogether.com?	0
206060	309373	309374	How does the Node.js Mocha testing library work?	Is Node.js overrated?	0
206061	309375	309376	What are some ways to foresee urban decision making?	How can I make changes in my life?	0
206062	98588	119051	Is it bad for being an introvert?	Is being an introvert wrong or bad for me?	1
206063	170443	309377	How come so many atheists only talk about Western religions? What about Buddhism or Taoism?	What is it about organized religion that seems to make so many people fear God?	0
206064	309378	309379	I am considering career shifting from air traffic control to air transport management, do you have suggestion or plan?	Am I the only one underwhelmed by Pokémon GO?	0
206065	32911	309380	How can I resolve my conflict of interests?	How can I identify a conflict of interest?	0
206066	19695	2364	How do you know if a guy likes you?	How do I know that a guy likes you?	1
206067	309381	309382	Is 21st century Japan considered an eastern culture or western culture?	"Why are non-white Eastern Cultures considered ""trendy""?"	0
206068	309383	309384	How do I get rid of obsession?	How can I get rid of an obsessive person?	0
206069	309385	309386	Ethiopian universities are safe to teach?	What is the difference between 5°C and 5C°.?	0
206070	309387	309388	Which has been the most financially rewarding patent in history?	What have been the most lucrative patents?	1
206071	309389	309390	How can I block a specific IP address from sending me emails?	How can I get a confirmation that my employee has visited the potential client/Seller?	0
206072	11434	32	How will it affect international students coming to the US for undergraduation now that Trump has become the President?	How will a Trump presidency affect the students presently in US or planning to study in US?	1
206073	133107	196652	Who was the worst president in U.S. history and why?	Who is the most overrated U.S. president?	0
206074	309391	309392	Digital marketing agency Europe?	What's better to prepare hard for cat 17 or to gain some experience of 2yrs and then go for cat as I got selected in infy and DOJ wll be in December?	0
206075	309393	262685	Can someone see if you screenshot their Instagram stories?	How do you know when someone takes a screenshot of your photo on Instagram?	1
206076	309394	309395	Why does Quora need your legal identificadtion?	Why does Quora need your legal identification?	1
206077	103889	260799	What are some ways to quit bad habits?	What are the most important, practical solutions to quit bad habits?	1
206078	231267	309396	How safe is Australia?	Is Australia safe to travel to?	1
206079	105323	58122	Why should Americans vote for Donald Trump?	Why Americans love Donald Trump?	1
206080	309397	309398	What kind of food did you like as a child?	What is it like to have been famous from when you were a very young child?	0
206081	309399	309400	What programming language is the most versatile?	What are the most versatile web programming languages?	0
206082	241730	94427	What are the pros and cons of eating beaver meat?	What are the pros and cons of eating peacock meat?	1
206083	51651	309401	Can yoga cure psoriasis?	Can yoga help to cure psoriasis?	0
206084	37165	137499	Will Indians face any difficulty if Donald Trump becomes the President of USA?	What will be the effects of Donald Trump being the US president on India?	1
206085	218815	309402	Engineering: What are the basic differences between one-way and two-way slabs? Where do we use them specifically?	Which code is more generally more economical when it comes to area of steel for main reinforcement? (One-way slabs)	0
206086	26054	124931	Why are there so many people using Quora to answer questions that can easily be found with a simple Google search?	Why are there so many questions on Quora that people could just search on Google?	0
206087	16372	19204	Who won the vice presidential debate of 2016 between Tim Kaine and Mike Pence?	Who won the Vice Presidential debate between Tim Kaine and Mike Pence?	1
206088	309403	309404	Where does the president of India reside today?	Where does the president of India live today?	1
206089	309405	309406	How can sedimentary rocks contain fossils?	Why are fossils found in sedimentary rocks?	0
206090	309407	69331	Which two metropolitan areas are the world largest?	What's the world's largest city?	0
206091	309408	309409	I want to buy a good depend underwear for my mother who suffers from urinary incontinence. What should I look out for?	"What is the book ""How Eat to Live"" by Elijah Muhammad about and how was it written?"	0
206092	89068	309410	How do the red blood cells synthesize proteins without a DNA?	How many years away do the most optimistic synthetic biologists think we are from being able to synthesize a cell?	0
206093	309411	309412	What are some ideas for full tattoo sleeves?	What are some ideas for a tattoo sleeve?	1
206094	309413	309414	What does Pakistan mean to China?	Why does Pakistan have such a favorable view of China?	1
206095	309415	309416	Why does India have separate Republic day and Independence day?	Why do we do the marches and parades on Independence Day and Republic Day?	0
206096	309417	309418	What should I write about in my college essay?	What should I write my college essays about?	0
206097	309419	309420	Do employees at Air Lease have a good work-life balance? Does this differ across positions and departments?	Do employees at Air Products & Chemicals have a good work-life balance? Does this differ across positions and departments?	0
206098	309421	309422	Is Trump purposely sabotaging his election campaign?	Is Donald Trump sabotaging his campaign? If so, how?	1
206099	309423	309424	Is it worthy to upgrade iOS 10 in 6s?	Should I wait for an updated version of iOS 10 or upgrade my iPhone 6s now?	1
206100	309425	106600	Is it likely that the democrats will win the senate in November 2016?	Will Democrats regain Senate control in 2016?	1
206101	309426	309427	How can someone start a business in Egypt?	How can someone start business in Iraq?	1
206102	140795	309428	What are some Beautiful lines to comment on beautiful pictures?	Would you like to send me any beautiful pictures of yours?	0
206103	309429	309430	When will women realise they should never fight back?	"Why do people run their mouths like they are ""hard"" but, when it comes time to fight, they back down?"	0
206104	309431	309432	What are some kind words to say to a friend with a sick parent?	What kind of talk does your friends enjoy and what does you say in your talk? (with elaboration)	0
206105	309433	309434	What are some fulfilled biblical prophecies?	Are Biblical prophecies being fulfilled?	0
206106	309435	309436	What is the maximum quantity of  food that a single person can consume in one sitting?	What is the maximum amount of food you've ever been able to consume in a single visit to an all-you-can-eat buffet?	0
206107	309437	309438	What is the best bait for fishing sun perch fish?	What is the best bait for fishing perch?	1
206108	309439	309440	If a computer security employee hacks their office computer system and the boss catches him, should he be appreciated or punished? What are some of the reasons?	Computer Security: If your facebook has been hacked. How do I find the person who hacked it?	0
206109	309441	309442	What are some of the best ways to heal damaged skin?	What is the best way to cure this non healing ulcer?	0
206110	309443	309444	What is Calcareous algae?	What are sugar scrubs? How do sugar scrubs work?	0
206111	198992	19610	What is the worst thing that has ever happened to you or someone you know?	What's the worst thing that happened to you and what did you learn from that?	0
206112	309445	309446	What is the arousal theory, and what are some examples?	What are some examples of the arousal theory?	1
206113	309447	149966	Has global warming stopped?	Can we stop global warming? What are some ways and ideas to stop it?	0
206114	309448	309449	How do I sell a car park/property with extremely high price?	How would you sell a car park at an extremely high price, if you were a property agent?	1
206115	309450	309451	What are some good places to visit on a road trip from Dallas, Texas to Colorado Springs?	What is a good itinerary for visiting Colorado, Oregon and Washington for a one week trip?	0
206116	296205	48688	Are those huge dicks shown in porn videos all real sizes?	Are the huge dicks you see in porn real?	1
206117	309452	309453	How can I make my own private school into a revolution in rural education?	WHY SHOULD WE RECRUIT YOU?	0
206118	309454	309455	Is the dress blue and white or black and gold?	Is this dress blue and black, or white and gold?	1
206119	97214	309456	How can Facebook and Twitter make money for you?	How do I make money on Facebook?	1
206120	309457	309458	When was the last time you were terrified?	When was the last time you were frightened?	1
206121	208871	309459	What are the top MBA programs in Singapore?	What is the best MBA program?	0
206122	165127	53758	Do Sicilians have Berber or North African ancestry?	Do Sicilians have North African ancestry?	1
206123	4583	309460	"How do I ask questions with pictures on ""Quora""?"	"How do I insert pictures while asking questions in ""Quora""?"	1
206124	309461	252581	How do I slow down YouTube videos?	How can I download Tumblr videos on my phone?	0
206125	23375	309462	What are the references to Pokemon Red and Blue in Pokemon XY?	What's the biggest mystery/secret of Pokémon red/blue/yellow?	0
206126	309463	309464	How many people use Quora per month?	How many people actively contribute to Quora per month?	1
206127	309465	309466	In what cultures do brides and grooms exchange gifts during a wedding ceremony?	What's a cool gift for a guy who's the groom in a gay wedding?	0
206128	212036	122464	What types of hard disk drive are there?	How many types of hard disks?	1
206129	19032	22473	Is it possible that there is life in other planets?	Is there any other life existing except on Earth?	1
206130	309467	211701	Has witch magic been scientifically tested?	Has witchcraft been scientifically tested?	1
206131	309468	309469	How can I become perfect?	How can I become perfect in everything?	1
206132	309470	309471	What was Adolf Hitler's management style?	What was Adolf Hitler like in person?	0
206133	244091	309472	How electric field is produced by magnetic field?	Why do Photons posses electric and magnetic fields?	0
206134	16002	309473	Is Manipal University a fraud?	What is worst about manipal university?	0
206135	14190	260199	What is organisms?	What is organization?	0
206136	309474	17220	Could we see a 0.5 millimeter little stone with a 13 cm wavelength radio wave?	Could we use 13cm wavelength radio waves to see a message in a paper?	0
206137	309475	156591	Can we eat Apple at night?	Is it healthy to eat an apple at night?	1
206138	38932	309476	What does it mean when a girl smiles at you every time she sees you?	The girl I like smiles at me every time she notices me staring at her. She has girlfriend, but she also stares at me frequently. Does it mean she likes me or what?	1
206139	309477	225793	How can I make reading more interesting?	How does one make reading interesting?	1
206140	177417	147490	If World War III broke out, who would win?	How would World War III play out?	1
206141	309478	13503	Why has the number of reported rapes in Sweden quadrupled in the past 20 years?	What caused Sweden rape statistics to rise significantly in the past years?	0
206142	309479	309480	Where can I learn about stock market?	Where can I learn more about the stock market?	1
206143	45946	53631	What are the creepiest dreams you ever had?	What are the strangest and most unusual dreams you have ever experienced?	1
206144	309481	309482	Who is the bravest character in the Harry Potter series and why?	Which is the bravest character in the Harry Potter book stories?	1
206145	18765	309483	How can I become creative?	How can I become artistic and creative?	1
206146	10409	51094	Is it necessary to have sex in relationship?	How important is sex in a successful relationship?	1
206147	130833	283323	What is the Arab-Israeli conflict?	What is the islamic and palestinian conflict?	1
206148	309484	309485	How was the Universe formed?	How was Universe formed?	1
206149	309486	117168	What is the best free video creation software?	What are some free video editing apps?	1
206150	103022	309487	For how long will reservation system for backward castes continue in India?	When can we expect the end of reservation in India?	1
206151	117979	209251	If you could have anything in the world what would you want?	If you could do anything in the world that you wanted, what would it be?	1
206152	309488	48023	What is the best way to solve 57^46 divided by 17 manually?	If [math]1\circ4=5[/math] and [math]2\circ5=12[/math] and [math]3\circ6=21[/math] then what is [math]8\circ11[/math]? Fun…	0
206153	309489	309490	What is your view of the new engineering field, mechatronics? What does it really include?	What is your review of Mechatronics?	0
206154	10696	55024	How can I get back in my Facebook without a vaild email or password?	Is it possible to login to Facebook without password?	1
206155	50663	116088	Can you really see who viewed your pics or profile on instagram?	Can you tell when someone views your profile on Instagram?	1
206156	309491	309492	Is there any sample written with the Cyrillic alphabet to be read easily by foreigners?	Are there any text-to-speech software that read English with a foreign accent?	0
206157	309493	309494	Can we work for the GOI after doing an MBA from the likes of IIM or MDI?	What will life be like 5 years after an MBA from an IIM?	0
206158	68856	33634	Which will be the best budget laptop under 30k?	What is the best laptop under 30k?	1
206159	283698	309495	How could president Franklin D. Roosevelt be elected for 3 terms president?	What can be done to stop president elect Trump?	0
206160	309496	44655	What are the best alternatives to Sabkegaane.com?	What's the best alternative to 33mail.com?	0
206161	309497	309498	What was human society like 40,000 years ago?	Modern humans appeared 200,000; civilization 10,000; and advanced technology 500 years ago. Why no advancement for something like 190,000 years?	0
206162	58690	76909	What is the meaning of our life?	What is the meaning of LIFE to you?	1
206163	309499	309500	How do I start the Internet Explorer WebDriver for Selenium in Python?	What is the time table to crack JEE Mains in 2 months (coaching from 9-1)?	0
206164	309501	309502	Can spectral clustering be used in web search?	Is there any working example (source code) of text classification using spectral clustering?	0
206165	309503	309504	How do I understand arrays in Java?	What is a dynamic array in Java?	0
206166	309505	309506	Who gets the profit from the Ryder Cup?	Would you take the most boring job in the world for 1m$ a year or the best one for 50k$?	0
206167	255236	234249	What are the health pros and cons of swallowing semen?	Is it safe to swallow semen?	0
206168	309507	309508	How do I untune a guitar?	How do I detune a guitar?	1
206169	309509	309510	How does global warming affect plants and animals?	How does global warming affect plant growth?	0
206170	309511	309512	How do I solve this Linux problem?	I am looking to buy an iPhone 7 from Canada; which is the best time to do so?	0
206171	309513	309514	How much milk do you put on cereal?	Why do people like cereal with milk?	0
206172	309515	309516	My gre score is 301 (q158 v143) which universty should apply 2 gt admssn in MIS.I have job expin SAP (ABAP and MM) for around 20 months.kindly suggest?	Is c a machine independent language?	0
206173	309517	309518	Is it possible James Comey is being blackmailed by some faction of the Trump campaign?	Does James Comey have his act together?	0
206174	309519	309520	Did Tom Hanks and Rita Wilson divorce?	Does Tom Hanks have a brother? If so, what is his name?	0
206175	309521	80224	What are the possible disadvantages of banning ₹500 and ₹1000 notes in India?	What are the pros and <bold>cons</bold> of demonetizing Rs.500 and Rs.1000 notes?	0
206176	41669	88319	What is the best way to be in a calorie deficit and lose weight successfully?	What is the best guide to lose unwanted pounds?	1
206177	309522	309523	Why are girls girls?	My name is Song-jieqin(宋杰琴) ，Song(宋)) is my family name, how to choose a good English name?	0
206178	309524	309525	What does the American Legislative Exchange Council do?	What is the American Legislative Exchange Council?	0
206179	309526	60190	Who do you think is the best football player? And why?	Who was the best football player in 2015?	0
206180	309527	309528	Which is the best packers and movers company?	Which is the Most reliable Packers and Movers Company?	1
206181	66595	178521	What would be the effect on India if Donald Trump really becomes the president of US?	Will relations between India and the USA get affected with Donald Trump as President?	1
206182	49809	142851	What's your favorite animal?	What are your three favorite animals?	1
206183	309529	32296	How does India stand to gain from the US President-elect Mr. Donald Trump?	What does a Donald Trump presidency mean for the US - India relationship?	1
