id	qid1	qid2	question1	question2	is_duplicate
206184	309530	309531	Ex Girlfriend Initiated contact after 2 months? I'm confused	What CI tool do you use and why? What 3 words would you use to describe the brand? How would you describe alternatives?	0
206185	173022	309532	What are your experiences traveling alone?	What was your best trip experience while traveling alone?	1
206186	144418	309533	Is Bharatiya Janata Party behind hacking of Twitter account of Rahul Gandhi?	Is BJP behind Rahul Gandhi's Twitter account hack?	1
206187	247700	309534	How long does it take to renew an Indian passport in the US?	How long doe it take to get a US passport renewed in another country?	0
206188	167313	309535	Which, if any, K-Pop artists are openly gay?	What is the best boy/girl band in K-Pop?	0
206189	309536	309537	What are the best jobs for a library and information science degree holder graduate?	When is the best time to start applying for jobs if you are still in school? (graduate degree)	0
206190	309538	309539	What is leadership coaching?	What is leadership?	0
206191	309540	309541	What does it feel like to eat and poop at the same time?	Why would a mother dog eat her puppies' poop?	0
206192	18301	31494	How should one improve one's presence of mind?	How can I improve my presence of mind and concentration?	1
206193	309542	309543	"As a 6'4"" 180lbs size 13 boots intermediate rider, what size snowboard should I get?"	Snowboarding: What stomp pad should I get?	0
206194	122095	177751	What is a good inpatient drug and alcohol rehab center near Washington County FL?	What is a good inpatient drug and alcohol rehab center near Jefferson County FL?	0
206195	309544	309545	I'm an atheist, but I like praying, it gives me peace. Is that ok?	Why test question sldkjfsd fsldkfjsldkf jslkdjfslkdjf?	0
206196	309546	309547	How do you calculate the hash rate of a GPU?	How do I calculate the scrap rate of a product?	0
206197	309548	44126	I lose my temper very easily. What should I do?	I easily lose my temper. What should I do?	1
206198	11013	139212	How do I erase all my answers and question on Quora?	How can I reset my Quora profile, deleting all my answers, questions and edits that are in my profile?	0
206199	309549	309550	What are the growth stages of a programmer?	What is a growth stage company?	0
206200	309551	309552	What is the most productive marketing strategy or channel for SaaS to 10 million revenue that reduces customer acquisition cost?	Are alternative theories of gravity wrong? Does dark energy actually exist in this universe?	0
206201	309553	309554	Why do I get messenger invites on Facebook from someone who is not in my friendlist anymore?	"How do I fix the ""invitation"" problem in Facebook messenger?"	0
206202	221226	301864	What does your bedroom look like?	How does your room look like?	1
206203	68917	236776	How do I see who's viewed my Instagram profile?	Can you see who who viewed your videos on Instagram?	1
206204	309555	309556	How does my phone measure my heart beat, stress level, and SpO2?	Can my heart beat till the end of time?	0
206205	309557	35958	is ice cream made of peanuts	"What is ""what is""?"	0
206206	309558	309559	Who are Bosley's top competitors?	Who are Axis 41's top competitors?	0
206207	309560	142414	What is the origin of cut it out?	"Where does the phrase ""cut the cheese"" originate?"	0
206208	309561	309562	What are the best sites for downloading Telugu movies?	What is the best site to download movies in India?	0
206209	309563	309564	What sociological theory best explains bullying? Why?	Who is the best sociology tutor in Bangalore?	0
206210	41694	309565	What are the four consecutive integers which sums up to -100?	If the sum of five consecutive odd integers is 345, what is the smallest of the five integers?	0
206211	309566	309567	What is your review of Sherlock (TV series)?	How could the TV show Sherlock be improved?	0
206212	150807	309568	What is the best messaging app you use that you feel takes care of your security?	What mobile apps deliver a useful personalized audio or video feed that allows you to start your day with all the relevant news updates you will care about?	0
206213	309569	309570	Why can some Quora users add more details to questions than me?	Why does Quora discriminate between users allowing different amount of question details for different users?	1
206214	309571	309572	What is push pull?	What is Push vs Pull Strategy?	0
206215	309573	309574	Does TDD evolve design or it just completes code coverage? Should SMART design principle s predecided or implemented as part of code refactoring?	How do I design code of conduct?	0
206216	33144	309575	What is it like flying from Bangkok to Manila and how are these touristic cities compared to Chennai?	What is it like flying from Bangkok to Manila and how are these touristic cities compared to Vientiane?	0
206217	309576	62261	Do you think Indian government should respond fast and strictly to latest terror attack by Pakistan's terrorists?	How should India respond to Uri attacks?	0
206218	309577	309578	How do I handle success and be consistent about it?	I have a Windows 7 disc but one of my computers doesn't have a disc reader. What can I do?	0
206219	309579	309580	What are the best porn review sites?	What are the best app review sites in your opinion?	0
206220	309581	309582	What is a gaming mouse? How does it differ from a regular mouse?	What is a gaming mouse for CS 1.6?	0
206221	309583	309584	What is the best Four Loko flavor?	Why do Four Lokos make you blackout?	0
206222	173266	121314	Which book will be best for iit?	Which is the best books for IIT?	1
206223	309585	26239	How good is dayananda sagar college of engineering?	What is your review of Dayananda Sagar College Of Engineering, Bangalore?	0
206224	309586	31410	Will Hillary Clinton win the US presidential elections in 2016 and prevent us from another war?	What are Hillary Clinton's chances of winning in the 2016 US Presidential Election?	1
206225	309587	309588	What are the job opportunities in digital marketing?	What are the career options in digital marketing?	1
206226	309589	283882	I live in Missouri. I am 39 years old and a single mom. I am a student and I live with my parents as I can't afford to live on my own at this time. If my parents are charging me rent, can I qualify for rent assistance or vouchers of some type?	I am a single mom with kids, separated from husband for cheating on me. Is it okay to indulge in a friends with benefits relationship?	0
206227	120797	2728	What are good gifts for a foreign visitor to bring when they're invited to someone's home in Mauritania for the first time?	What are good gifts for a foreign visitor to bring when they're invited to someone's home in Pakistan for the first time?	0
206228	309590	309591	What is the problem between Modi and Aravind Kejriwal?	What is the problem of Kejriwal with Modi govt?	1
206229	309592	309593	Why is everyone saying that it's impossible to change your eye color with subliminal audio, yet it's working for a lot of people including me?	What does a change in eye color mean?	0
206230	171934	309594	What is the best IDE for Centos?	What is the best IDE for Linux?	0
206231	33250	21556	What are the Hollywood movies that are a must watch?	Which is your top 10 hollywood movies list?	1
206232	309595	309596	What are some interesting professions?	What is the best profession in law?	0
206233	78326	34901	How do I become a digital marketing expert?	What should I learn to become a best digital marketer?	1
206234	309597	309598	What is the least and largest even integer n if [math]9^{100}-9^{99}-9^{98}-9^{97}[/math] is divisible by n?	What are some blogs or websites of top Android contributors/engineers?	0
206235	309599	309600	Why is Rob Schneider in almost every Adam Sandler movie?	What is your review of Adam Sandler (actor, comedian)?	0
206236	85715	309601	What is a difference between a small bank and a payments bank? And the need for it?	What is the difference between a small bank and a payment bank?	1
206237	220891	22095	What is the greatest lie ever told?	What is the greatest lie you've ever told to your parents?	0
206238	309602	23881	What is a good site to learn how to code Mobile First/Responsive design?	What is the best site to learn how to code?	0
206239	217126	164099	How did World War Two start?	Why was World War 1 fought?	0
206240	309603	2782	"Is it correct to use the closing ""reply to me"" in an email?"	"Is it correct to say ""please let me know if you need help"" or must I use ""whether""?"	0
206241	309604	309605	How is the temperament of a Labrador/Terrier mix dog?	What is the temperament of a bulldog and beagle mix?	0
206242	120026	309606	What is the difference between the current taxation and the new goods and services tax (GST) in India? What is the impact?	What benefits does GST bill give? How is it different from current tax system in India?	0
206243	126361	309607	I came to know after 23 years that I am adopted. What should I do?	I came to know after 26 years that I am adopted. What should I do?	0
206244	309608	309609	What are the drawbacks of mixing Vyvanse and Adderall?	How long does Adderall last?	0
206245	309610	309611	What is the best learning path for SDN from scratch for non technical person?	What's the best way to learn ActionScript 3.0 on Flash Develop from scratch?	0
206246	309612	309613	Why are people so concerned about whether God exists?	Why are so many people obsessed with whether God exists but don't ask about whether His Children practice any compassion or Love?	1
206247	309614	309615	Will the Night King be able to cross the wall now that he has marked Bran?	Can the Night King cross the Wall now that Bran has his mark?	1
206248	6082	309616	Why is diversity a good thing?	Is diversity a good thing?	1
206249	309617	286677	What should I do? (USMLE step 1 issue)	What are some tips for the USMLE Step 1?	0
206250	309618	204906	What is the criteria for getting upgrades when air travelling?	What are some hacks to get free (or low cost) upgrades to business or first class when traveling? Airplane seat & hotel upgrades..	0
206251	309619	309620	Is there any vet in Varanasi (Banaras), who can cure turtles?	An essay in Hindi on अपने जीवन का एक सहस पूर्ण प्रसंग का वर्णन कीजिए	0
206252	309621	309622	What would happen if India occupies Pakistan?	What would happen if Pakistan conquers India?	0
206253	309623	309624	What are some ways to make an airsoft grenade launcher?	How can I make an airsoft grenade launcher?	1
206254	309625	309626	What is the best way to improve my reasoning and quantitative abilities?	How can I improve my quantitative ability for CAT?	0
206255	165537	131724	How could I be gay?	What is it like to be gay?	0
206256	175936	53656	What causes pimples on the buttocks?	Why do we get pimples in our ears?	0
206257	11167	32924	Will the value of Indian rupee increase after the ban of 500 and 1000 rupee notes?	What is the use of banning 500 and 1000 rupee notes and introducing new 500 and 2000 rupee notes?	1
206258	22426	25271	Why do we need reservation in India?	Do we still need reservation in INDIA? Why?	1
206259	26924	110517	Which is the best laptop under 40000 INR?	Which is the best and durable classy laptop under 40000 INR?	1
206260	277284	54254	What are the most popular misconceptions about the Soviet Union?	What are some of the most ridiculous myths about the former Soviet Union?	1
206261	309627	309628	How does one come up with scaleable services and products as beginning entrepreneur?	How do entrepreneurs come up with new startup ideas?	0
206262	309629	309630	What is the difference between a stiff leg deadlift and a romanian deadlift?	What's the difference between romanian deadlifts and regular deadlifts?	0
206263	54019	309631	What are some must have Android apps?	What are some must have Android app?	1
206264	59848	309632	What does it feel like to get stabbed?	When in a knife fight is it better to slice or stab?	0
206265	70880	194390	How many stamps do you need to send a letter from the U.S. to Europe?	How many stamps do I need to put on a card that I'm sending from Massachusetts to Canada?	0
206266	309633	186126	Do employees at National Beverage have a good work-life balance? Does this differ across positions and departments?	Do employees at Access National have a good work-life balance? Does this differ across positions and departments?	0
206267	309634	309635	What is the best legal system?	Do you think the legal system was unfair for you?	0
206268	309636	309637	Why should we know the use of binary, decimal, octal and hexadecimal number systems?	What is the use of having number systems like Binary, Hexadecimal and Octal?	1
206269	309638	309639	What is the easiest way to get a job in the USA from India?	How hard is it to a find job as a chef in the USA?	0
206270	309640	13808	How do I install and run TASM on Windows?	Can we use Swift on Windows?	0
206271	38289	309641	Why are the Golden State Warriors known as dubnation?	Where can I buy a T-shirt of Golden State Warriors?	0
206272	142457	56012	How do I prepare for SSC CGL Tier 2 2016?	How do I score 350+ marks in SSC CGL 2016 (Tier 2) examination?	0
206273	4264	13880	How will the ban of Rs 500 and Rs 1000 notes affect Indian economy?	What will be the impact of banning Rs. 500, Rs. 1000 notes on Indian economy and Businesses?	1
206274	309642	309643	What is the best WYSIWYG editor for Drupal 7?	What are some good WYSIWYG editors for Drupal 7?	1
206275	309644	309645	What does it feel like to have a spouse or partner commit suicide?	How does it feel to outlive your spouse?	0
206276	309646	309647	Am I eligible for JEE Advanced 2018?	Am I eligible for JEE Advanced 2016?	0
206277	309648	68470	Headbreak: What can I do to prevent heart break nightmares of your ex girlfriend?	What's the best way to break up with someone?	0
206278	75184	51947	What is the best way to make the right decision successfully?	How do I make right decisions?	1
206279	309649	309650	What makes you more sad?	What is the thing that makes you often sad?	1
206280	309651	309652	What is the difference between serial and parallel processing?	How do I make a parallel code in CUDA work serially without CUDA on CPU?	0
206281	309653	40158	Why do nice men get sideline durning the dating game?	Why do nice guys get friend-zoned?	1
206282	40229	37340	Who will win, Trump or Clinton?	Who do you think would win the election, Trump or Clinton?	1
206283	309654	309655	How are burglars typically caught?	How can I burglar proof my home and keep it attractive?	0
206284	7975	64334	How should I start IAS preparation after graduation?	How do start preparation for IAS?	1
206285	309656	309657	Is there any way to have multiple YouTube My Mixes?	How do I mastribute daily with different techniques?	0
206286	88600	137210	How can I make an extra $2000 this month?	How do I make $1000 as extra income/month apart from the regular job?	1
206287	309658	309659	What are some real-world examples of applications of machine learning in the field?	What are some real world applications (present and future) of statistical learning theory?	0
206288	309660	151770	What is the best real estate website in Morocco?	What are the best real estate websites in Australia?	0
206289	309661	309662	What's the best thing to do in Wipro Bangalore Campus, if there's no office work?	How is the work culture at Wipro, Bangalore office?	0
206290	309663	309664	2 states movie download?	Who controls the U.S president?	0
206291	70350	309665	What is hydrophobicity?	Why is tyrosine hydrophobic?	0
206292	309666	309667	What are the biggest problems facing the US economy?	Economic History: At what point did the US become the biggest economy in the world?	0
206293	19621	17811	Why do some people ask questions on Quora that could easily be answered by using a search engine?	Why do so many people ask questions on Quora that can be easily answered by any number of legitimate sources on the Web? Have they not heard of Google or Bing?	1
206294	96905	42548	What is the GRAND purpose of life?	From your perspective, what is the purpose of life?	1
206295	309668	309669	What was the craziest experience you ever had in your life?	Which is the best experience you ever had in your life?	0
206296	309670	235956	What do you think we could do to best improve the US education system?	What measures would you take to improve the education system?	0
206297	309671	309672	"Where did the pointy ""S"" symbol come from?"	"Where does using ""zzz"" as a symbol for sleep noise come from?"	0
206298	309673	309674	What is difference between Microsoft Azure and VMWare Cloud?	What are the differences with Microsoft Servers and Cloud Platforms?	0
206299	36860	14142	Is it actually possible to travel through time?	Is time travel already possible on Earth?	1
206300	309675	309676	Where can I download byjus class videos for Class VIII?	How do I make videos like Coding Rainbow or Byju’s classes?	0
206301	309677	309678	What are some of the medical colleges like BHU, AMU that I can still apply to based on my NEET score?	How much marks should I score in NEET 2016 to get a govt. medical college in Mumbai?	0
206302	309679	309680	Where does your lap go when you stand up?	When I stand up too fast or step outside at day I have a wave of dizziness and dots flashing across my vision, why is this?	0
206303	309681	309682	"How do you say ""dragon"" in Japanese? How is it written in kanji?"	What is Torakan in Japanese Kanji?	0
206304	99234	181968	How can we get job in Canada?	How does one get a job in Canada?	1
206305	309683	309684	Why is Bahasa Indonesia so popular in Australia?	What if I speak Bahasa Melayu in Indonesia?	0
206306	143014	309685	How do I change my personality?	How do I change my personality to be good?	0
206307	59655	309686	Will data used between 2am -5am be debited from Jio data plan or is it separately taken care of?	Which scheme does Python use internally for its dictionary data type: open addressing or separate chaining?	0
206308	309687	309688	Is stock market worth investing in?	Is investing in the stock market worth it?	1
206309	309689	309690	How can I get more views in my YouTube channel?	How can I get YouTube views?	1
206310	220227	124635	Why do some people on Quora go anonymous?	Why do people go anonymous on Quora?	1
206311	309691	309692	How can we define logarithms of negative numbers with complex numbers?	How do you find the logarithm of a negative number? Why is it a complex number?	1
206312	309693	309694	How does high voltage current do not pass through filament of cathode in an x-ray tube?	Why does high voltage current not pass through cathode filament in an x-ray tube?	1
206313	81914	53562	Is it true that Hillary Clinton let four Americans die in Benghazi?	Why is Hillary Clinton blamed for Benghazi attacks? Is she responsible for the security failure and the deaths?	0
206314	309695	309696	How many times should a sales person insist on calling a client to make a sale?	What makes a good sales person?	0
206315	83614	132096	What is the best website for downloading free books?	What is the best website where we can read/download books for free?	1
206316	23595	14937	What are the benefits of gst bill?	What are the benefits of GST bill for common peoples?	1
206317	309697	309698	How do I tell someone I have herpes?	How do you tell someone that you have Herpes?	1
206318	309699	309700	Has a holocaust denier ever faked an evidence?	Have holocaust deniers ever faked evidence?	1
206319	309701	46819	How could I write an article?	"How do I write a ""how to"" article?"	0
206320	309702	309703	What are some good ideas for writing an economic research paper or Master's thesis on Bitcoin?	What can be a good topic for a writing a research paper in economics?	0
206321	309704	309705	How were medicines such as insulin, antibiotics and anaesthesia synthesised historically, before modern technology and labs?	How were infected burns or wounds treated before modern antibiotics?	0
206322	309706	309707	What excites you about Unicorn coders?	Has is become more difficult to build success like it was 10 - 50 years ago?	0
206323	151560	15867	Epics of India: How did Sri Krishna and Sri Rama die?	How did rama die?	1
206324	41625	70278	Who will win the US election?	Between Trump and Clinton who will win US presidential election?	1
206325	309708	253505	What is the best way to invest 5 million dollars?	What's the best way to invest in a million-dollar house?	0
206326	309709	309710	WordPress Plugins: The package could not be installed. PCLZIP_ERR_BAD_FORMAT (-10) : Unable to find End of Central Dir Record signature?	How can we add a section in a WordPress theme?	0
206327	60924	225193	Which laptop would you recommend under Rs. 60,000?	What are the best laptops under ₹ 60,000?	1
206328	309711	309712	Where can I find Telugu hd new movies?	Which are the lying instances in ASOIAF / GOT?	0
206329	54746	55686	Which are the best Bollywood movies of 2016?	What are the best Bollywood movies of 2016 so far?	1
206330	70571	67130	What is the proper methodology to study 1st year MBBS?	What are some study plans for the MBBS 1st year?	1
206331	251740	309713	How can we create a software?	How do I create a software?	1
206332	309714	309715	Could light be refracted into a loop, to be amplified or stored as a source of potential energy?	Could light be directed into a reflective chamber to be amplified or stored, as a potential source of energy?	0
206333	309716	309717	If you were just starting to get into collectibles, would Pokémon Go and YoKai Watch be worth of any value as time passes?	How do I start a new game on Pokémon go?	0
206334	309718	309719	How do you spend your life?	How can we spend life like scientists?	0
206335	309720	309721	Why don't girls reply on OKCupid?	How come that girls doesn't reply when you message them on Okcupid or Tinder?	0
206336	50420	68619	Which is the best website designing company in delhi ncr?	Which is the best website design and development company in Delhi NCR?	1
206337	51949	6306	Who is better between Hillary Clinton and Donald Trump as a US president?	Who is the better candidate for being the President of the United States of America: Hillary Clinton or Donald Trump?	1
206338	309722	309723	Was Pablo Escobar a hero?	What do Colombians think about Pablo Escobar?	0
206339	309724	309725	What are the most romantic conversation?	What is the most romantic conversation you've ever had?	0
206340	309726	309727	What are the emerging trends in industry?	What are the emerging trends in your industry?	1
206341	309728	309729	How can I change the metadata and filename of an MP3 file?	How do you see the metadata of an MP3 file?	0
206342	107791	309730	What is the most important part of singing?	As a startup CEO, what is the most important part of your digital marketing strategy?	0
206343	309731	309732	What are the body stats of pornstar kiara mia?	What are the body measurements of pornstar kiara mia?	1
206344	90426	309733	What is the best SUV?	Which is the best suv? No matter what's the price.	1
206345	309734	179672	Which company provides the best SEO and SMO services in India?	What company provides the best SEO services in India?	0
206346	309735	309736	What is a consecutive calendar day and how is it related with the Chinese Calendar, Dàmíng origin?	What is a consecutive calendar day and how is it related with the Chinese Calendar, Wùyín origin?	0
206347	309737	309738	What is the way to startup?	What is the best way to startup?	0
206348	309739	309740	Is hydrocodone able to affect birth control?	How effective is the pill as birth control?	0
206349	309741	309742	What is the Golgi apparatus made of? Why is it important?	I can only do one round of sex and it takes almost 5 hours for my penis to be erect again? What do I do?	0
206350	309743	108717	What does the Hindi word luccha mean?	"What is the meaning of the Hindi word ""बेहराल""?"	0
206351	92019	309744	How can covalent bonds be described?	How can polar-covalent and nonpolar-covalent bonds be distinguished?	0
206352	74678	309745	How do I get a visa to work in the USA?	How do I get USA work visa from India?	0
206353	13650	14298	Is time travel possible in next 5 years?	Is time travel possible? If yes how	1
206354	309746	19821	How do I identify my talents?	How can I find my hidden talents?	0
206355	156039	309747	What are the best career options for a civil engineer after getting a bachelor's degree for girls?	I am student of civil engineering what are career options after b.tech excluding IES?	0
206356	309748	309749	How does our brain know and we adjust ourselves to balance our body when we are informed just before the brake is going to apply?	Is it easier to retain information in our brain when we learn by song or melody?	0
206357	309750	309751	What are the best games to play on Skype?	What is the best Hitman game to play?	0
206358	309752	309753	When will the result of the 2016 US presidential elections be declared?	When will the results of the 2016 U.S. Presidential elections be declared?	1
206359	197021	309754	Is a size 8 1/2 in shoes pretty big for a woman?	Did shoe sizing change? Why do I wear 1.5-2 sizes smaller than when I was a teenager?	0
206360	309755	187376	Why am I losing weight but not belly fat?	Why am I losing body fat percentage and not weight on the scale?	0
206361	309756	309757	What is the best recommended books about physics?	What are some good books to read about Physics?	1
206362	138950	309758	What does Å symbol represents?	What do these symbols represent in books?	0
206363	112399	115987	What is the typical career path for someone who becomes a professor in nursing?	What is the typical career path for someone who becomes a professor in English?	0
206364	309759	309760	Logic Puzzles: How can one use two condoms for three turns?	How do I solve the three brothers puzzle problem?	0
