id	qid1	qid2	question1	question2	is_duplicate
27193	50535	18759	How is black money curbed with the ban of 1000 rupee notes and introducing new 500 and 2000 rupee notes?	How will replacing 1000 notes with 2000 notes going to stop corruption and black money?	1
27194	50536	50537	How do I integrate [math]e^{x+2}[/math] and [math]e^{x^2}[/math] and [math]e^ {x^{-2}}[/math]?	How do you solve the inequality [math]3x^2-7x+1≤0[/math]?	0
27195	50538	50539	Why is quantum teleportation important? Who discovered it?	What if I discovered how to to program DOS in a quantum computer?	0
27196	50540	50541	Why aren’t cats mentioned in the Bible?	Why aren't books being added to the Bible in modern day?	0
27197	50542	50543	What is the name of the largest cell?	What is the name of the biggest plant cell?	0
27198	50544	50545	What are good reasons that an American should move to Europe?	What are good reasons that an American should not move to Europe?	0
27199	50546	50547	What are good tips to run a successful Udemy course? (ie. $10,000 or more in revenue)	What type of topics are good for making successful courses on Udemy?	0
27200	50548	50549	How do you legally immigrate to America from Paraguay? How can I ease up this process?	How do you legally immigrate to America from Bolivia? How can I ease up this process?	1
27201	50550	50551	What are the best ways to solve a 5000 piece puzzle efficiently?	Can Jigsaw Puzzles become addicting?	0
27202	50552	50553	Can hamsters eat cucumber?	Can hamsters eat peanuts? Are they harmful for them in any way?	1
27203	50554	50555	How can I make my room sound proof?	How do I make a room sound proof easily?	1
27204	50556	50557	What is the protein with the least number of amino acids?	What is the number of amino acids in the protein formed by this mRNA molecule?	0
27205	50558	50559	Which is best between IIT Bombay and Bilkent university turkey for PHD in engineering?	Which is the best between IIT Bombay or Bilkent University in Turkey for a PhD in engineering?	1
27206	50560	50561	What is the scope of research in biomedical engineering?	What is the scope for a biomedical engineer?	1
27207	50562	50563	Where can I legally download Korean dramas for free?	Where can I see 50 Shades of Grey for free online in India?	0
27208	50564	50565	Will banks lend me money for AIRBNB business in The Netherlands?	How likely is to get loans from banks to start a business that will loan from Canada and lend that money in another country at far greater percentage?	0
27209	31247	50566	Have you seen an alien craft?	Have you seen an alien?	1
27210	48283	50567	Why is Verizon buying Yahoo?	Should Verizon buy Yahoo?	0
27211	50568	50569	Should I go back to a girl who dumped me Twice?	Why is my girlfriend of 5 years always doubting and accusing me of things only in her imagination, although she is the one who was caught trying to have a fling not once but twice? Should I dump her?	0
27212	50570	50571	"What's the role of an ""implementation coach"" in McKinsey like? And how is it compared to associates?"	What is the growth path for mckinsey implementation consultant?	0
27213	38805	50572	What famous rappers are bloods and crips?	Is Future a good rapper?	0
27214	50573	50574	How do I score 100% in economics ISC 12 th?	How do I score 100% in economics in 12 th ISC?	1
27215	50575	50576	How can lose 29 pounds in 2 months without affecting my health?	What are some diet regimes I can do to lose 29 pounds in 2 months?	1
27216	50577	50578	Did Mr. Monopoly ever have a monocle?	What is your review of Monopoly (board game)?	0
27217	50579	42070	Is CAT after b.tech in mechanical engineering useful?	What are the career opportunities in companies after an M.Tech in aerospace engineering with a B.Tech in mechanical engineering?	1
27218	38503	50580	What is the best beginner coding language?	Which coding language is the best for beginners to start with?	1
27219	50581	50582	Why would you marry a non-virgin?	Should we marry non virgin?	0
27220	50583	50584	What is the difference between Internet marketing and digital marketing?	Digital Marketing VS Internet Marketing – What is the latest trend?	0
27221	50585	50586	What is the best GMAT and CAT coaching centre in Bangalore?	Which is the best CAT coaching centres in kochi?	0
27222	50587	50588	What should one do in order to escape boredom?	How can I escape boredom?	1
27223	50589	50590	Can I open the Flipkart packing and check whether I have got the right product or not before paying in cash on delivery?	What is the default rate for Flipkart's cash on delivery in India?	0
27224	50591	40886	What is the life changing experience in your life?	What was one of your life changing experiences?	1
27225	50592	24247	If I have an iCloud, can I delete all the photos from my phone?	Can I upload my photos to icloud on my phone and delete them from my phone safely?	1
27226	50593	50594	How do you turn off the annoying auto-suggest spelling in iOS 8?	Is the iOS 10.2 safe to upgrade?	0
27227	50595	50596	How do I control my PC from my android device?	Can I control an android device from the PC?	0
27228	50597	50598	How do I gradually increase my accutane dose?	Can I use a fat burner while on Accutane?	0
27229	50599	50600	Who is the husband of sunny leone?	Who is Sunny Leone?	0
27230	50601	50602	What is reason to study?	What are reasons to study?	1
27231	50603	50604	What are the documents required to transfer the SBI savings account from one city to another city?	How do I transfer the CIF of my SBI account from one location to another location?	0
27232	50605	11011	What kind of temperament does a boudreaux pitbull have?	What is the temperament of a Lab/Pitbull mix?	0
27233	50606	50607	What does 'independence in fact and appearance' mean for auditors?	What sorts of things does a quality auditor do in IT sectors?	0
27234	50608	50609	What are the most unrealistic parts of T2 Trainspotting (2017 movie)?	What are the most unrealistic parts of T2: Trainspotting (2017 movie)?	1
27235	50610	50611	What should I get my boyfriend for Christmas?	What do I get my boyfriend for Christmas?	1
27236	50612	50613	Where can I found best quality multi-split system air conditioning products in Sydney?	Is the universe shrinking and stretching rather than expanding?	0
27237	50614	50615	Which are the most promising, well funded tech startups in India?	What are the most promising startups in India?	0
27238	50616	50617	What are some examples of subatomic particles? How do they differ among them?	I am working as a Marketing Manager for an online casino. I would like know how can I create promotions without affecting our affiliates?	0
27239	50618	50619	What are some major social faux pas to avoid when visiting Kenya?	What are some major social faux pas to avoid when visiting Ukraine?	0
27240	50620	50621	Will regular masturbation eventually make you sterile and have a lower sperm count?	How can excessive masturbation lead to low sperm count?	1
27241	50622	50623	How can you determine the oxidation state of calcium?	How do you calculate the oxidation state of carbon?	0
27242	50624	50625	Does contact between two objects occur when two forces come into balance?	When two objects touch each other can we consider the two forces getting in balance as the contact (touch) process?	1
27243	50626	50627	What are the pros and cons of the Windows phone 8?	What are the pros and cons of Windows Phone 8.1?	0
27244	50628	50629	How do I get free Instagram followers?	Where can I get free Instagram followers?	1
27245	50630	50631	How can I earn 100 rupees per day online in india?	Why is there a 100 sms per day limit in India?	0
27246	50632	50633	What are main reasons for using Adobe Photoshop instead of, or in addition to Lightroom, even though it distort images that can't be recovered?	I failed thrice in my BBA examination. What to do in life?	0
27247	50634	4100	Is there any way I can train myself to cultivate interest or develop passion for programming?	How can I stop worrying about what other people think?	0
27248	50635	10016	What is the best way to learn guitar without taking classes?	How do I learn playing guitar without formal training?	1
27249	2327	1830	Why do some Indian Muslims hate Narendra Modi?	Why Muslims hate Modi government?	1
27250	50636	50637	How would earth be different if there's no moon?	Would there be life on the Earth without the moon?	1
27251	50638	50639	Can I use my Xbox 360 Kinect sensor on an Xbox One?	Do Xbox One and PS4 have different graphics?	0
27252	50640	50641	Will my check engine light make me fail my driver's license test?	How do you clear a check engine light on a Toyota Corolla?	0
27253	50642	50643	Dating and Relationships: Shall I marry a girl who is 10 years younger than me?	I'm 30 year old man. Is it okay to have a relationship with a girl 12 years younger than me?	0
27254	50644	50645	Can you take both whey protein and mass gainer at the same time?	Can I take Gainer & Protein Both?	1
27255	50646	50647	What can we do about fake news?	What can be done to combat fake news?	1
27256	10275	50648	What are some examples for pleomorphic bacteria?	What are some examples of places where bacteria can be found?	0
27257	50649	50650	What are some other amazing websites/apps like Quora?	What are some other learning apps like Quora?	1
27258	50651	50652	How are yoga mats manufactured?	Where can I find yoga mat manufacturers in the UK?	0
27259	50653	50654	Why didn't Voldemort use Avada Kedavra on Dumbledore when they fought at the ministry?	Does it make sense to think that Voldemort could have killed Harry by non-magic means instead of Avada Kedavra when he was just a little boy?	0
27260	50655	50656	Why did Nicholas Flamel not share his philosopher stone?	Is there a real femdom in chandigarh who can use strapon?	0
27261	50657	50658	How do you delete a question or an answer on Quora?	How do I delete my answer in Quora?	1
27262	50659	50660	The U.S. uses mph. What about the rest of the world?	Can I import an american made car back into the USA, even if it is not 25 years old?	0
27263	36484	19307	Why were the 500 and 1000 rupee notes demonetized?	Why Modi is putting a ban on 500 and 1000 notes?	1
27264	50661	50662	What things are cheaper to buy in India compared to UK?	What things are cheaper to buy in the UK compared to India?	0
27265	50663	16180	Can you really see who viewed your pics or profile on instagram?	Can someone see if you have viewed public Instagram?	1
27266	50664	50665	How much time it takes to learn C# for a person new to programming?	How much time does it take to learn C# programming?	1
27267	50666	50667	What does it mean by successful in life?	What is success and what does it mean in your life?	0
27268	50668	50669	How should i invest 30 lakhs rupees?	I have 5 lakhs of rupees where can I invest?	0
27269	50670	50671	What signs do (shy) women give to show interest in a guy?	How do I subtly show a guy that I'm interested?	0
27270	50105	50672	Is Wikileaks planning an 'October Surprise' for Hillary Clinton?	What is the likelihood that Wikileaks has a genuinely scandalous October surprise to release about Hillary Clinton?	1
27271	50673	50674	How would it feel to be a cloud?	How does it feel to be the clouds?	0
27272	50675	50676	I'll have the exams in December of cs executive. How should i study for better marks?	Company Secretaries (CS): How do I prepare for CS executive 2 days before the exam?	0
27273	50677	50678	Why do we need constructors in Java?	Can we Synchronize constructor in Java?	0
27274	50679	50680	Which modern multicore assembly should I study?	Which is the most common screw thread used in India?	0
27275	50681	50682	What was the significance of the Non-Aggression pact?	Why is the non-aggression pact important?	1
27276	50683	50684	Fruit: Where can I buy soursop (guanabana) in the United States?	Meat: Where can I buy mutton in the United States?	0
27277	50685	50686	Is it easier to immigrate to Canada than to USA?	Which is easier greencard (USA) or permanent residency in Canada?	0
27278	50687	50688	What's the best and quickest easy way to find a job?	What's the best and quickest way to find a job?	1
27279	50689	50690	Do some people take credit they don't deserve from people who simply don't care about the credit?	What are the facts people don't like to admit?	0
27280	50691	50692	Are team collaboration software user friendly?	Is the team collaboration software user friendly?	1
27281	50693	50694	How can I count calories in a smart restaurant?	How do you count calories?	0
27282	50695	50696	How can I write a review paper?	How do I write a review paper?	1
27283	50697	31943	What are some good podcasts I should listen to?	What are some good podcasts to listen to?	1
27284	50698	50699	Which Nobel prize winner you like? And why?	Who are the latest Nobel prize winners?	0
27285	50700	28797	Is Spotify not available in India?	Daniel Ek: When is Spotify coming to India?	1
27286	50701	50702	What is the best way to build a successful t-shirt brand?	How do you make a successful T-shirt brand?	1
27287	50703	15220	Why and why not should I believe in God?	Why should I believe in God?	0
27288	50704	50705	How can you determine the chemical formula for oil?	How can you determine the chemical formula for toothpaste?	0
27289	50706	50707	What are some ways to increase the mileage of my Royal Enfield Classic 350cc, which is 2400kms old?	What is the mileage of a Royal Enfield Classic 350 before service?	0
27290	50708	50709	Who is Kylie Minogue?	Why is Kylie Minogue single?	0
27291	50710	50711	How does bundle and stranded conductor reduce corona loss?	How does stranded & bundled conductor reduce corona loss?	1
27292	50712	50713	How do I start an airport shuttle business?	How do you start an airport business?	0
27293	50714	50715	What are some of the best horror and thriller movies?	Which are some of the best comedy-thriller movies?	0
27294	50716	50717	What are some mind-blowing iphone tools that most people don't know about?	What are some mind-blowing iphone technologies that exist that most people don't know about?	0
27295	50718	50719	Does a girl get pregnant after giving a blowjob to a boy?	Can you get pregnant from oral sex?	1
27296	50720	50721	How will the result of NEET 2016 be declared for 1 and 2 phase?	What is NEET phase 1 and 2? I still can't get it	0
27297	50722	50723	How do aromatherapy diffusers work?	Does aromatherapy relieve stress?	0
27298	50724	33088	What is sudden loading?	Which is better? Top loading washing machine or front loading washing machine.	0
27299	50725	50726	Who are some pornography historians of the past and present?	Is it bad to watch porn?	0
27300	27783	50727	What are some unusual aspects about politics and government in Mexico?	What are some unusual aspects about politics and government in Bhutan?	0
27301	50728	50729	Which continent is the Middle East located in?	If Europe is continent, shouldn't the middle east be their own continent?	0
27302	50730	50731	What are some of the most high paying jobs?	What are some high paying jobs?	1
27303	50732	50733	What is the worst thing you have ever done for money?	What are the worst things you have ever done?	0
27304	50734	50735	CR is written on the credit side, but why is it DR for debit?	What does mean that an account has normal debit / credit value?	0
27305	50736	45256	How do I pass lab drug test with baking soda?	Does baking soda really help pass a drug test?	0
27306	50737	50738	Is 12 Mbps a good internet speed for streaming and gaming?	Is 6 Mbps download and 2 Mbps upload speed good for a 4G LTE connection?	0
27307	50739	50740	How do I know if my girlfriend in long distance is cheating on me?	How do I know if my girlfriend is cheating on me in a long distance relationship?	1
27308	50741	50742	Why do people make small talk?	How can I get better at small talk?	0
27309	50743	27018	How do I learn any language fast?	How can I learn any new language quickly?	1
27310	50744	50745	How do I give suggestions for self hypnosis?	What are some good books for learning how to induce yourself into trance or self hypnosis?	1
27311	50746	50747	Ways to earn money easily?	How can I get money easily?	1
27312	50748	50749	What are some rules of restaurant kitchen etiquette that most people don't know about?	What are some etiquette rules I should know about when eating in a restaurant in Russia?	0
27313	50750	50751	Are hindus generally safe in Bangladesh?	Is Hindu safe in Bangladesh?	1
27314	50752	50753	How do I download any torrent?	How can I download torrents in my institute?	0
27315	50754	50755	What is the use of static keyword in Java?	Why are static variables used in Java?	1
27316	50756	50757	What options are available to sell bakery products online in Bangalore?	Can I join a PSU after resigning from SSC JE post?	0
27317	50758	50759	How do I setup a system wide proxy in kali?	How do I setup reverse proxy using blue coat device?	0
27318	50760	50761	What kind of underwear is worn by Sikhs?	What kind of underwear is worn by Sikh women?	0
27319	50762	50763	"How much do you have to listen to an artist on Spotify to become a ""listener"" when other people view that artist?"	What are some good solo male artists to listen to?	0
27320	50764	50765	What is the best silencer for Classic 350 and why?	At bail stage benifit of statutes?	0
27321	50766	50767	What are some of the best movies of all times I should watch (animated are welcome)?	What are the 5 best movies of all time?	1
27322	50768	50769	What are some typical Indian habits?	What is THE typical indian habit?	1
27323	50770	50771	How much money do you get for losing a finger?	How much do I get for the loss of my pinky finger?	1
27324	50772	34865	What are good gifts for a foreign visitor to bring when they're invited to someone's home in Bhutan for the first time?	What are good gifts for a foreign visitor to bring when they're invited to someone's home in Philippines for the first time?	0
27325	50773	50774	What are some great books on psychology?	What are some great psychology books?	1
27326	50775	50776	Is it ok to dry your clothes without a dryer sheet? Why or why not?	Do I use a dryer or house air conditioning to dry clothes?	0
27327	50777	50778	Is/are there any PC games (offline or online) as good as Counter-Strike: Global Offensive?	I am young and a global elite on Counter Strike: Global Offensive, should I join the military?	0
27328	11810	29605	Why should I vote or not vote for Narendra Modi in 2019 elections?	Why should I vote for Narendra Modi in the upcoming election?	1
27329	50779	50780	How do I prepare for neet 2017 in 4 months?	How can I prepare for NEET 2017 in last 4 months?	1
27330	50781	50782	What's the difference between white and black sesame seeds?	What are some examples of black seeds?	0
27331	50783	50784	Which is the best Bollywood flim in this year 2016?	Which Bollywood movie you like the most in 2016?	1
27332	50785	50786	What do surgeons think of when they eat meat - especially when using utensils?	Do surgeons feels squeamish about eating meat after completing their training and starting practice?	0
27333	50787	50788	How do I get my iPhone out of recovery mode?	What do I do if my iPhone is stuck in recovery mode?	1
27334	50789	50790	How do you get rid of Love handles?	What is the best way To get rid of your love handles And fat around the midsection area?	0
27335	50791	50792	How can I write a letter to CBSE (Online)?	How can I write a letter online?	0
27336	50793	50794	Who were the winners of SINMQ-2015?	What do Nobel Prize winners get?	0
27337	50795	50796	What does Amazon do if you receive your Prime package late?	What is Amazon's Prime Air?	0
27338	50797	50798	How is the state of Infosys right now? Is it suggestible for a fresher to join in the present scenario?	What are Rutherford's conclusions?	0
27339	50799	50800	If Jesus is Son of God, Who is Adam, Ephraim & Ezra?	When did you experience God's protection?	0
27340	50801	50802	What are the average ratios for downloads, active users converting to transactions for ticketing apps like StubHub, SeatGeek, TodaysTix, etc.?	Should I buy NFL tickets from StubHub now or wait? Why?	0
27341	50803	50804	What purpose does a random population distribution serve?	Why did EA sports rate Ronaldo higher than Messi in Fifa 17?	0
27342	50805	50806	What's your 2017 new year resolution?	What's your new year 2017 resolution to improve your daily life routine?	1
27343	50807	50808	What are some good books on random processes?	What is a good book to start learning stochastic processes?	0
27344	50809	50810	How can I grow my web development business?	What is the best strategy for getting clients for web development business?	1
27345	50811	50812	How can you cancel you Amazon prime free trial?	How can you cancel your Prime free trial on Amazon?	1
27346	50813	50814	Which is the best import and export business in Tamil?	How do I do a business of export and import in New Zealand?	0
27347	50815	50816	Should Naruto die?	How many and which characters die in Naruto?	0
27348	50817	50818	Which business should I start with 50000 Rupees in India?	If you had 50000 INR (750$) , what business you would start?	1
27349	50819	50820	How do you find out who were the previous owners of a house?	How do you find all the previous owners of a house?	0
27350	50821	50822	Where can I get affordable package in Sydney for floor tiles?	Where can I get amazing collection of floor tiles in Sydney?	1
27351	50823	50824	What is better than Craigslist classifieds?	What is Craigslist?	0
27352	50825	50826	Are there any records of lions in the 600 - 1,000 pound range, if so where are the records?	Do any records exist of African lions at 600 upto 1,000 pounds?	1
27353	50827	50828	How many watts are equal to 1 unit in an electricity bill?	How many $1 bills would it take to weigh 1 ton?	0
27354	50829	50830	Why are people so numb to the fact that many people are starving?	What would happen if we do constant head permeability test for fine grained soil and vice versa?	0
27355	50831	50832	Which is better MBA or CA?	Which is better CA or MBA?	1
27356	50833	50834	Which are the best paraben-free affordable brands in India?	Which is the best TV brand in India?	0
27357	25987	9661	What are your New Year's resolutions?	What are your new year resolutions’2017?	1
27358	50835	50836	Can your phone get a virus?	How do phones get viruses?	1
27359	50837	50838	What are the best job fairs near Kitchener, ON? When and where are they held? What were your experiences at them?	What are the best job fairs near Queens? When and where are they held? What were your experiences at them?	0
27360	50839	50840	How do became expert in Creo 2?	I cleared the cookies but the history is intact in Chrome (Nexus 6p), still I was logged out of every website is there any way to retrieve it?	0
27361	50841	50842	How does the flood occurs?	"Did Jon Davis actually ""fight"" in OIF? Did he earn a Combat Action Ribbon for combat engagements? Several answers state that he “fought” in OIF."	0
27362	50843	4896	What's the most efficient way to reduce body-fat percentage?	How do I reduce body fat properly?	0
27363	50844	50845	Why do thunder and lightning occur when it rains?	How does lightning happen?	1
27364	6968	50846	What is unusual or different about the food and cuisine in São Tomé and Príncipe?	What is unusual or different about the food and cuisine in Bulgaria?	0
27365	50847	50848	Where can I get the cheapest MRI scans done in Mumbai?	Where can I get the cheapest MRI scans done in Chennai?	0
27366	50849	50850	Any heads up on PNB Housing Finance Ltd IPO?	Should I invest in PNB Housing Finance IPO ?	1
27367	7676	50851	How do I get into Harvard?	How should I get into Harvard University?	1
27368	50852	50853	What do you think about when you watch a movie?	What movie should I watch?	0
27369	50854	50855	What are the rates for luggage storage at Newark (Liberty, NY) Airport?	What are the different ways to get from Newark Liberty airport to JFK?	0
27370	47485	50856	Why do people try to ask silly questions on Quora rather than googling it?	Why should we ask questions on Quora, when we can Google it?	1
27371	50857	50858	How do Telecom companies earn money given that they've to spend a lot on buying spectrum and setting up infrastructure, pay salaries to employees etc?	I recently read that Iran needs higher oil prices to pay for all the government spending they've racked up. How does the government benefit from oil profits when surely profits go to the oil companies?	0
27372	50859	50860	What is asset bubbles and what are its disadvantage?	What are the asset classes?	0
27373	50861	50862	What do you do if your dog is vomiting yellow bile and not eating?	Why is my dog throwing up yellow bile? What should I do?	1
27374	50863	50864	"Do you like the song ""I Would Do Anything for Love but I Won't Do That"" by Meatloaf?"	"Did you like the song ""Gnash - I hate you, I love you""?"	0
27375	50865	50866	How can I learn to talk less?	How can we talk less?	1
27376	50867	50868	What is the meaning of Hindi word 'sampann'?	What is the meaning of Hindi word 'Paksh'?	0
27377	50869	50870	Who would play you in a movie of your life?	If you could choose an actor/actress to play you in a movie based on your life, who would you choose and why?	1
27378	50871	50872	How is CDAC KP placements for DAC course? Do any product companies come for placements?	Is Bangalore Knowledge Park CDAC Centre good in terms of placements and teaching for embedded course CDAC?	0
27379	50873	49769	What is a person who makes new words called?	What would you call someone that believes in God but not organized religion?	0
27380	50874	50875	How i can crack GATE 2017 if I start preparation from September?	What is best stabilizer to buy for 55 inch 4k led TV?	0
27381	50876	32660	What is the best comic ever written/drawn?	What are the best comics?	1
