id	qid1	qid2	question1	question2	is_duplicate
47711	85156	85157	What is your review of www.justmop.com?	What is your review of www.buttermyresume.com?	0
47712	85158	85159	Why did Adolf Hitler commit suicide?	Why did Hitler commit suicide?	1
47713	85160	14681	What is conservativespirit.com?	What is eatalo.com?	0
47714	85161	85162	On my resume, where do I place skills that I plan on learning in the future?	What is a good programming skill to learn for the future if I have 10 years of experience in C#?	0
47715	85163	85164	How are formal amendments to the U.S. Constitution proposed?	How can an amendment to the U.S. Constitution be ratified? What is the process?	1
47716	85165	5715	How do I lose weight ayurvedically?	How can I lose weight slowly and naturally?	1
47717	85166	85167	How do I continue doing my homework when I'm tired and just want to sleep?	I messed up my sleeping pattern and now I'm constantly tired. What do I do?	0
47718	85168	85169	I have a small black line on my molar, and it shows no signs of pain or sensitivity. What is it? What do I do?	How do I stop a toothache in a broken molar?	0
47719	85170	85171	In Westworld, do you think Doctor Ford is an Android?	In Westworld, is Robert Ford a host/Android?	1
47720	85172	85173	What are some low fluoride teas (from the camellia sinensis plant)?	Is drinking tea from a copper jug ok?	0
47721	85174	85175	What is the best programming language for data science?	What are the most important programming languages for data science?	1
47722	85176	85177	Why does generic pasta cook so poorly, compared to higher-priced pastas like de Cecco?	Has IAS officers become businessmen?	0
47723	85178	85179	What are some things in Bollywood movies that have gone unnoticed?	What are some best Bollywood love movies that went unnoticed or couldn't be famous?	0
47724	85180	85181	What are some famous stories about Tamil actress Khushboo Sundar?	How many Telugu stars are famous in Tamil?	0
47725	85182	85183	How does the moon rotate around the Earth?	Why do planets orbit stars?	0
47726	26367	85184	How can I prepare for UPSC exam at home?	How can I prepare for UPSC at home?	1
47727	85185	85186	What are some songs you must listen to?	What are some good songs to listen to?	1
47728	85187	85188	Introverts don't want to draw people's attention and would love to be a silent observer in a group. Is introversion the opposite of ADHD?	Will walking around with a nice set of arms really draw attention and make yourself feel elated and proud (and not to mention the sense of ego)?	0
47729	85189	85190	Why are cats afraid of cucumbers?	Are cats scared of cucumbers?	1
47730	85191	85192	Is there life on Mars?	Is life possible in Mars?	1
47731	85193	85194	Can I delay starting a job at Google for 8 months?	Is it possible to get a job at Google if I didn't start programming until college?	0
47732	85195	85196	How do you convince a conservative Muslim family to allow an inter-religion marriage with a Hindu?	Is the court marriage of a Hindu boy and Muslim girl acceptable in Islam or not (without changing religions)?	0
47733	85197	85198	What is the actual meaning of the second paragraph of the Declaration of Independence?	Do you think the second sentence in this paragraph is useful or extraneous?	0
47734	85199	85200	What is the best way to react when someone calls you their bestfriend?	How would you react when someone calls you an uncle?	0
47735	37884	85201	How do you post blogs on Quora?	How do I start a blog on Quora?	1
47736	85202	85203	What is the difference between zyrtec, claritin, and benadryl?	Can you take Claritin and Zyrtec at the same time? What are their interactions?	0
47737	85204	85205	How is the Zappos Insider program going, from the point of view of a Zappos recruiter or hiring manager?	From a candidate's point of view, what are the qualities of a great recruiter?	0
47738	85206	85207	Why unix is open source?	Is unix open source and what is its buzzword?	0
47739	85208	85209	How does the process in which Japanese grow watermelon differ from the process Koreans use?	How does the process in which Japanese grow watermelon differ from the process Ethiopians use?	0
47740	85210	85211	What are ductile materials?	What is a ductile material and what are some examples?	1
47741	85212	85213	How does you become travel agent?	How do I become a travel agent in Mumbai?	0
47742	85214	85215	When did you have your best sexual experience?	Is it true that most of the billionaires in the world are from technical (Coding/ Engineering) background?	0
47743	41781	85216	What are the most weird facts about India?	What are the weird facts about India?	1
47744	85217	85218	Can Henry kissinger become president of the U.N human rights council?	In the wake of forcibly displacing indigenous peoples from their settlements does Australia's human rights policies need reviewing by the UN Human Rights Council?	0
47745	4142	28817	What is your review of the MacBook Pro (2016)?	Is the Macbook pro 2016 overpriced?	1
47746	64428	15309	What do you think about the idea of Narendra Modi about 500&1000 notes?	What are your views on the decision of Narendra Modi to discontinue the use of 500 and 1000 currency notes?	1
47747	85219	85220	What do we do now that Trump has won?	What should I do now since Trump won?	1
47748	85221	85222	What is the difference between ordinary differential equations and partial differential equations?	How do you tell the difference between ordinary differential equations and partial differential equations?	1
47749	85223	85224	What is the value of c in terms of a and b if 2^a = 3^b = 6^c?	Is it sinful to be attracted to women that wear sports shoes (sneakers)?	0
47750	17036	85225	Sex Acts: Do women enjoy it when men shoot semen on their breasts and face?	Do women ogle men?	0
47751	85226	85227	How do I study faster and more efficiently?	How we can study faster?	1
47752	85228	85229	Who is the current Education Minister of India?	What is the current education landscape of India?	0
47753	23918	85230	Who will win the 2015 IPL?	Who will win IPL 2015?	1
47754	85231	85232	If you notice your partner smells (pee/poo/sweat) bad after you take their pants off, what should you do?	What do big cats smell like? Do they smell bad or are they virtually odorless like house cats? I know their pee has a strong smell.	0
47755	85233	85234	How do you count cards in poker?	Is card counting illegal?	0
47756	85235	85236	Is Epoch safe?	Is Cartagena safe?	0
47757	85237	85238	What are the best classified site in Sweden?	What are the top classifieds sites?	0
47758	85239	85240	What are interesting facts about Egypt?	What are some interesting facts about Egypt?	0
47759	85241	85242	Why is Indian students educational system better than the U.S?	Is the Indian education system better than that of other countries?	0
47760	85243	85244	What is it that happens when cells are placed in a hypertonic solution?	What happen when cell is placed in hypertonic solution?	1
47761	85245	5222	What is the best way to turn someone down who keeps asking you out?	How do I turn someone down nicely?	1
47762	85246	85247	Why do some people eat raw eggs? Are they not scared of getting salmonella?	Why do Western people eat raw eggs?	1
47763	85248	85249	What are some tips & tricks I should know before going to an Interview?	What should be precautions before going to an interview?	0
47764	52952	29266	How do I stop receiving Quora emails?	How do I unsubscribe from Quora emails?	1
47765	85250	85251	How do we get logos with hidden messages?	Design: What logos include hidden messages in their design?	0
47766	85252	85253	What does is feel like to be a billionaire and lose it all?	How does it feel being a billionaire?	0
47767	85254	85255	How do you get cash without earning it?	As a small business owner who gets paid in cash, how do you get the cash money back in the system (personal bank account) without the IRS disturbing you?	0
47768	85256	85257	Which famous Delhi University Professors are on Quora?	Which famous Lucknow University Professors are on Quora?	0
47769	85258	85259	"Why was the TV show ""The firm"" cancelled?"	Why was the TV show Life cancelled?	0
47770	85260	50866	How do I learn to talk less?	How can we talk less?	1
47771	85261	85262	What is job profile of Central Power Engineering Service (Central Electricity Authority) of electronics and communication engineer?	What were Queen Victoria's greatest accomplishments and how did they affect the British?	0
47772	85263	85264	What are some famous songs played on a pan flute?	How do you play Mary Had a Little Lamb on flute?	0
47773	85265	85266	Do you need coaching if you are already doing the self study using books sent by ICAI?	Will sites like Weebly, jeenka, snapmobl eliminate the need for most programmers? Should I start thinking about exit paths within the next few years?	0
47774	85267	85268	What causes diarrhea in dogs?	What causes diarrhea?	0
47775	85269	85270	How can parents teach swim?	Who need to teach children swim?	1
47776	85271	85272	How genetically close are the Cornish and Bretons? And how close are the Devonians to the Cornish and English?	How is Webdriver and its comparison with Selenium RC?	0
47777	16691	85273	"What does ""lien amount"" in the SBI mean?"	"What is ""Lien Amount"" in SBI PPF account?"	0
47778	85274	85275	I am buying a new computer for $800. What should I look for in specifications?	What should I buy with $800?	0
47779	85276	33685	How do I get a tiny waist?	How do you get a skinny waist?	1
47780	85277	85278	What is the purpose of dreaming?	Why do we dream and what's the purpose of it?	1
47781	85279	85280	Which has been most complicated merger/acquisition in the corporate history?	What is the most expensive company acquisition in recorded history?	0
47782	85281	84246	What is a UCC 1 Financing Statement?	What is a UCC Finance Statement?	0
47783	85282	85283	Who is the worst person in history and why?	Who is the worst person in the history of the world?	1
47784	85284	85285	How do I solve this math problem?	How do I solve maths problems easily?	0
47785	85286	85287	How do you sing the Happy Birthday song in your language?	How do you sing the Happy Birthday song in Italian?	0
47786	85288	85289	What should be the best strategy to prepare for upsc prelims 2017?	Which is the best book to prepare for economics for upsc prelims?	0
47787	31838	85290	How can carrots make you orange?	Why are carrots orange?	0
47788	85291	85292	Does India have the capabilities to carry out surgical strikes in Pakistan?	Can India do surgical strike in Pakistan?	1
47789	23696	85293	What is the best book or book series you ever read and why?	What's a good book series to read?	0
47790	85294	85295	What is SSC (UES-GS(X))?	What are the duties of an SSC UES pilot?	0
47791	35751	31460	How can I know if my wife is a cheater?	How do you know when your spouse is cheating?	1
47792	85296	85297	What are some best research areas in virtual reality in which I can persue my masters degree?	my daughter is doing 12th std PCMC . she wants to pursue her studies in pure science either chemistry or maths. Provide some suggestions for colleges for graduation in india and also options available for PG ?	0
47793	85298	85299	How should an aspiring screenplay writer get started?	How would an aspiring screenplay writer get their work noticed?	0
47794	85300	17978	What are some things new employees should know going into their first day at Delek?	What are some things new employees should know going into their first day at AT&T?	0
47795	85301	85302	I keep helping my boyfriend by telling him what I like and don't like but he thinks I am criticizing him. Can I break up with him?	I don't have a job and a car how do I gently break up with my boyfriend and tell him I'm no good for him?	0
47796	85303	85304	What are the best technology?	What are the best technologies available?	1
47797	85305	85306	What is a good song for a text prank?	What's a good song to do a song lyrics prank?	1
47798	85307	85308	What are the best calibers for long range hunting?	What does it take for a sniper to do a successful long range kill (2000 yd+)?	0
47799	85309	85310	How can I die without any pain?	What is the simplest way to die without pain?	1
47800	85311	85312	What is the first thing that comes to mind when you hear the word argument?	What is the first thing that comes to your mind when you hear the word apple?	0
47801	85313	85314	Who was the mughal king after aurenzeb?	Who was the first Mughal king?	0
47802	85315	85316	How can I ensure that my father (who is debt ridden) cannot use my name as a Guarantor without my information, or take any loan on my name?	How can I apply for an education loan for an MS in the USA without a guarantor, as my parents are against me studying abroad?	0
47803	29614	52660	How do I know if my spouse is cheating?	How do I find out my wife is cheating?	1
47804	85317	85318	How do I get rid of a cold immediately?	How can I get rid of a cold quickly and effectively?	1
47805	33861	85319	What is the best way to prepare for an internship?	How do I prepare to get an internship?	1
47806	85320	85321	What do you think about the Japanese proverb 'The nail that sticks out shall be hammered down'?	What do you think about the Japanese arcade game called Mushiking: The King of Beetles?	0
47807	85322	72306	What are some criticisms of cultural relativism?	What are some of the criticisms of cultural relativism?	1
47808	85323	85324	What is the best picture you have ever seen in your life?	What's the best picture you have ever seen?	1
47809	85325	85326	What is a good nickname for Donald Trump?	What are some political nicknames for Donald Trump?	1
47810	85327	85328	Is it worth completing Dragon Age Origins before playing Dragon Age 2?	What are Dragon Age themes?	0
47811	85329	85330	Should I become an actor?	Can you become an actor at 30?	0
47812	85331	85332	I lost all my photos after temporarily disabling my Instagram account. Will I get them back? How many days should I wait?	I temporarily disabled my Instagram account via PC and then logged back in via IPhone and all my photos are gone and I can't send DMs, can anyone help?	0
47813	85333	85334	"Which is correct, ""Monday to Friday"" or ""Monday through Friday""?"	Which is correct, through up or threw up?	0
47814	85335	85336	What are the skills required to design an augmented reality UI & UX?	Do any one know presto infosolution pvt ltd?	0
47815	85337	85338	Do steam rooms heal ex-smokers lungs?	Why can't smokers undergo the procedure of vacuuming the lungs after every few years?	0
47816	85339	85340	What is required to open a branch for any rural or urban cooperative bank?	What are the branch opening formalities for any rural cooperative bank?	0
47817	85341	85342	What does it feel like to be shocked by an electric eel?	What did they call the electric eel before electricity was invented?	0
47818	85343	85344	Wanted to start import export business, what's the best commodity to deal in?	I want to start import and export business. What is the best commodity to start with?	1
47819	13069	85345	What does it mean when your period is three days late?	My period is 5 days late, what do I do?	1
47820	64754	74384	What is the meaning of the Punjabi word “Bulleya”?	"What is the meaning of the Punjabi word ""pendu""?"	0
47821	85346	85347	When do people usually get married?	Why should two lovers get married?	1
47822	85348	85349	What is an infj guy like?	What is an infj man like?	1
47823	85350	85351	Can Heisenberg's Uncertainty Principle be applied in real life?	How do we apply the Heisenberg's uncertainty principle in daily life?	1
47824	48228	30782	How do I open a private Instagram account?	How can you look at someone's private Instagram account without following them?	0
47825	42475	1274	Suppose, Hillary Clinton is the next U.S. President, what do we call her husband as? Former Gentleman?	If the United States has a female president, will her husband be called the first gentleman? What will Bill Clinton be called if Hillary is elected?	1
47826	85352	85353	How does one drive to the basket when people are in the way?	What is the likelihood of pregnancy on birth control?	0
47827	85354	85355	What is the memory capacity of the human brain in terabytes?	What is the theoretical storage capacity of the human brain?	0
47828	85356	85357	Which are the best comedy TV Series to watch?	What are the best comedy TV shows ever?	1
47829	85358	85359	Why does Quora ban politically sensitive questions?	What do you do about a spouse that has been drinking for seven days straight?	0
47830	14326	39954	How do I take 360 degree photos/videos and upload them to Instagram?	How do you upload pictures from your PC to your Instagram?	0
47831	85360	85361	What division should Microsoft divest and why?	Should I buy a Microsoft Surface or an Ipad?	0
47832	85362	85363	Is it wrong to love a person who already has a lover?	How ethical is it to express your love to a person who already has a partner?	1
47833	85364	85365	What are the best online Java programming courses for beginners in hindi?	What are the best online Java programming courses for beginners?	0
47834	85366	85367	I want to write a book. How should I start?	I love to read books, but I also want to write. How should I start?	1
47835	85368	85369	"What are the ""unwritten rules"" of Mumbai that everyone needs to follow?"	"What are the ""unwritten rules"" of Chicago that everyone needs to follow?"	0
47836	85370	85371	Which is the best district in Kerala to live?	Which is the best place in Kerala to live?	1
47837	47486	80433	Is America still the land of the free?	Is America still the land of the free and the home of the brave?	1
47838	85372	85373	What is prelims exam in IAS exam?	Is there any negative mark for IAS exam prelims and Mains?	0
47839	85374	15098	What should I do if I want to be a rich person?	How can I become rich man?	1
47840	85375	85376	What is fringing effect in microstrip patch antenna?	Why are slotted antennas used instead of patch antennas?	0
47841	85377	85378	What is web application development?	What is web and web application?	0
47842	16310	85379	What is the least invested and best startup business?	What are the best startup?	0
47843	85380	85381	If I feel I need to do something for me, should I dissapoint relatives and/or friends to pursue my need?	My boyfriend of a year and half just told me he is bisexual. How can I deal with it? I love him no matter what.	0
47844	85382	85383	What happens if you overdose on Naproxen?	I took 3 500mg naproxen should I worry?	0
47845	85384	85385	What are God’s two (2) lessons from the ant?	What lessons can we learn from our fascination with God?	0
47846	4018	29152	How would demonetizing 500 and 1000 rupee notes and introducing new 2000 rupee notes help curb black money and corruption?	How would changing the 500 and 1000 currency notes help indian government in dealing with corruption?	1
47847	85386	85387	If my family was immigrant, am I really an ethnic American?	I think I don't really believe in God even if I'm from a Muslim family. Should I tell my family or keep it for myself?	0
47848	17412	54218	What is the hardest thing(s) about raising children in Austria?	What is the hardest thing(s) about raising children in Japan?	0
47849	85388	85389	How can one cure sleep paralysis?	Is there a cure for sleep paralysis? If so, what is the cure?	1
47850	85390	85391	How tall will I be if I am 5'5 and 14 years old?	How tall will I be? I am 12.5 years old.	0
47851	85392	85393	Tennis: On average, how many aces are there per match and set?	Where is the best place to sit at a tennis match?	0
47852	85394	85395	I am a 25years old MBBS student from Bangladesh. I want to go to abroad for further practicing. Where should I go?	How does Trump's economic bounce relate to Reagan's after his November win?	0
47853	85396	85397	What is the basic structure of the U.S. Constitution?	What would you change/add in the U.S. Constitution if you could?	0
47854	85398	85399	How do you turn off a 2003 Ford Taurus check engine light?	How do I disable the theft light on ford Taurus 2005?	0
47855	85400	85401	I always poop after one hour of lunch.Should i be worried?	Multi line number picker?	0
47856	21797	1772	Is it possible to Increase height or get taller after 20?	How can you increase your height?	0
47857	28323	85402	How well do Kendrick Lamar and Anna Kendrick know each other?	I have a huge crush on Anna Kendrick, but she doesn't even know who I am. Does an average guy like me stand a chance?	0
47858	85403	80446	What are the best chrome extensions for marketing?	What are the best Chrome extensions for translating?	0
47859	85404	64511	Can lost hairs be regained?	Can you grow lost hair back naturally?	0
47860	85405	85406	"What does ""taken for granted"" mean?"	"What does the phrase ""It was the best of times. It was the worst of times"" mean?"	0
47861	85407	85408	Is there any way to extend the lifespan of the sun?	What is the expected lifespan of the sun?	0
47862	85409	85410	What is a good base design for level 7 town hall in COC?	What is the best base design for Town Hall 5 CoC?	0
47863	85411	85412	How do we calculate the amount for construction per sq ft?	What is the average Construction price per sq feet in Delhi?	0
47864	85413	85414	Where's the best place to sell vinyl records online?	Where is the best marketplace for selling vinyl records?	1
47865	85415	85416	Why are some Americans opposed to immigrants? Weren't they or their ancestors originally from other countries before?	What do people from other countries think about the Americans they meet in person?	0
47866	12217	85417	What were some of the most important causes behind World War 1?	What were the main causes of World War 1 and what were the consequences for the countries involved?	1
47867	85418	85419	How does one use a sextant to determine a ship's position at sea?	How does a sea anchor work?	0
47868	85420	85421	Which one is the correct spelling: Grammer or Grammar?	Are spelling and grammar the same?	0
47869	85422	85423	What would happen if we had no sun light for one week?	What would happen if the sun quits for a week?	1
47870	85424	85425	Is it offensive to wear a rosary as a necklace? If so, why?	Why is wearing a Rosary on an ordinary day considered a sin by Catholics?	0
47871	85426	1203	What are some of the best jokes ever told?	What are the funniest jokes / stories you ever heard?	1
47872	85427	85428	How can I see who views my Twitter?	How do I view a list of people that I've blocked on Twitter?	0
47873	85429	85430	What are the best things to buy from Japan?	What are good things to buy while in Japan?	0
47874	85431	85432	I am 2nd year MBBS student. Which type of stethoscope should I buy?	I am a 1st year MBBS student, where can I get a bone set for the cheapest price?	0
47875	85433	85434	Why has judaism already cost the world 80% its population, prosperity, progress, productivity and pride?	"Why do we refer to the ""founding fathers"" when the country was already founded, and quite Christian and relatively free and prosperous?"	0
47876	85435	85436	How can I make a business plan for a bakery? What are the steps to follow?	What is a good example of a business plan for starting you own bakery?	1
47877	85437	85438	What gets you upset about being a leader?	My boyfriend gets upset when I tell him that I feel a certain way about our relationship. What do I do?	0
47878	85439	85440	What about the sub public administration?	What are the stages of evolution of public administration?	0
47879	85441	85442	Is anyone aware of the indo-German Chamber of Commerce, Churchgate. Do they provide better placements, and is it worth doing a MBA from IGTC?	Is doing MBA from abroad worth it? Or should I go for Indian college?	0
47880	85443	11070	How do I gain weight fast but still be healthy?	What are some of the best ways to gain weight in a healthy way?	1
47881	85444	85445	I just read that Indian developers can sell their Android apps but I'm unable to change my country to India. How can I change my country?	I just read that Indian developers can sell their Android apps but I'm unable to change my country to India. How can I change my country? If I can't, how can I put in my contact number?	1
47882	85446	85447	How many CEOs or other top executives are not ruthless narcissists, sociopaths or psychopaths?	Is Donald Trump a psychopath, sociopath, narcissist or suffering from some other disorder?	0
47883	85448	85449	Can Bran or any other Stark warg into a dragon?	Could Bran warg into one of the dragons?	1
47884	8972	74846	In how many dimensions we are living?	How many dimensions are there in universe and name them?	1
47885	85450	25801	How do I increase my endurance?	What can I do to increase my running stamina and strength?	0
47886	67393	85451	What will be the impact of the step taken to ban the 500 & 1000 rupee note on Indian economy?	Now that Modi govt has decided to stop circulation of Rs.500 & 1000 notes, how will this impact the Indian economy?	1
47887	85452	85453	What was the time period of Lord Rama?	When was the period of Rama?	1
47888	85454	85455	Why are there no volcanic eruptions on the moon?	What is a volcanic eruption?	0
47889	27688	85456	Can a guy make a living through sports betting? Is it possible?	What is a betting sports center?	0
47890	85457	85458	What is the Hypergeometrical Universe Theory Standard Model?	What are the main reasons for having to force yourself to exercise and eat healthy?	0
47891	85459	85460	When will Lenovo Vibe K5 Plus (3GB RAM) get the VoLTE?	Does 4G Jio VoLTE support in Lenovo Vibe k5?	0
47892	85461	2673	How do I find out who hacked my whatsapp?	How do I know if my WhatsApp account has been hacked?	0
47893	85462	85463	How do I maintain personal hygiene?	What is the best way to maintain personal hygiene?	1
47894	85464	85465	How can students pay for summer programs?	How do students pay for summer programs?	1
