id	qid1	qid2	question1	question2	is_duplicate
27000	50186	50187	Should men shave their legs?	Why do men not shave their legs?	0
27001	50188	50189	Can civil services coaching institutes refund the fees easily if the aspirant is asking for it just after one day of paying the fee?	What is the best Civil Services coaching institute in Dehradun?	0
27002	50190	50191	How do I lose my water weight?	How can I lose a lot of water weight fast?	1
27003	50192	50193	What does the active status mean on Facebook?	How can I create funny Facebook statuses that will get a lot of likes?	0
27004	50194	2737	What type of government does Turkey have? How does it compare to the one in Canada?	What type of government does Turkey have? How does it compare to the one in Wales?	0
27005	16596	50195	How much are YouTubers paid a month?	How much money do youtubers get paid?	0
27006	50196	50197	What is your review of Hotel Safety?	What is your review of Hotels?	0
27007	50198	50199	What is the best way to quit a job?	How did you quit your job?	0
27008	50200	50201	What's the scariest horror movie you've watched?	What is the scariest movie you ever watched?	1
27009	50202	50203	What is the best martial art to practice?	Which martial art is right for me?	1
27010	9737	50204	Which exercises can boost you enough to lose 30 pounds in 1 month?	What is the best way to lose 30 pounds in 1 month?	1
27011	50205	50206	What are the wings of bats made of?	"What are ""bat wings""?"	0
27012	50207	50208	How can I be successful in my life?	What changes can I make to have a successful life?	1
27013	50209	50210	What is the difference between love and sex?	What is Different Between Love and Sex?	1
27014	50211	50212	What are some nice 30 days challenge ideas?	What are the best 30 day challenges to bring some change?	0
27015	50213	50214	How is capitalism evil?	Why is capitalism evil?	1
27016	50215	50216	How much time AAI JE recruitment process take?	Do we have sectional cut-offs for AAI JE (IT) exam 2016?	0
27017	50217	50218	How much space is between particles? What is this space made of?	How do physicists account for the empty space between particles? What is space?	0
27018	50219	50220	Why is Dolph Lundgren's jaw twice the size of a normal persons?	How does the size of rain drops vary?	0
27019	50221	50222	What is navy?	What is a navy nuke?	0
27020	50223	3586	Is there a way to view your Spotify play history?	How do I use Spotify in India?	0
27021	50224	50225	Is data warehouse a database? Why?	What is a data warehouse?	0
27022	50226	50227	How can I find a good CBT therapist for a 18-year old friend?	How do I find a good therapist in Santa Clara, California?	1
27023	50228	50229	Can I check who viewed my Instagram pic?	How do I know who viewed my instagram profile?	1
27024	50230	50231	How can I earn mony in online?	How do I earn mony?	0
27025	39590	50232	What does a green circle with a white tick mean on skype?	Is it safe to take Ensure to gain weight?	0
27026	50233	50234	Has demonetisation failed?	Has demonetisation backfired Modi?	1
27027	50235	50236	How does a Trump Presidency affect Canada?	What impact will Trump's presidency have on Canada?	1
27028	50237	50238	What are molecular ionic compounds? What are some examples?	What are molecular ionic compounds?	1
27029	50239	50240	[Spoilers] In Harry Potter and the cursed child book, What happened to Draco's wife?	How did Fenrir Greyback get through the magical barrier at the foot of the tower in book six? He was never branded with the Dark Mark.	0
27030	50241	50242	What should I do to recover my data from a hard disk?	How do I recover my deleted data files from a hard disk?	1
27031	50243	50244	Where can I buy a skateboard?	Where can I buy a good skateboard?	1
27032	50245	50246	Travis a scottish band - have they been to India on tours?	Why has no other band been so successful?	0
27033	50247	50248	Can somebody explain me about GDP in Layman terms?	How can GST reduce tax burden on people and increase government revenue at the same time?	0
27034	50249	9752	How can we get the best grades in school?	What can I do to get better grades next quarter?	1
27035	50250	50251	Why does btech life is so strange?	How does a Product manager get back to work after a year long break?	0
27036	50252	50253	How do i recover Yahoo password? Do you know any Yahoo customer care?	How do I recover Yahoo password without resetting?	1
27037	50254	50255	USC POST graduate program in ANALYTICS?	The importance of economics?	0
27038	50256	50257	What are the shadows seen on the moon?	Why do the moon and earth have shadows?	0
27039	50258	50259	How can I increase height after the age of 25?	My age in 22 and my height is 5'5 I want more height its possible?	1
27040	50260	50261	How do you know what you want to study?	Which is the most popular book of Jorge Luis Borges?	0
27041	50262	50263	What is life like at PES University?	Are there hot chicks in pes university?	0
27042	50264	13753	Can the devil steal the soul of a holy person at the time of death?	What does a near death experience feel like?	0
27043	50265	50266	How do I prepare my vocabulary for competitive exams like the SSC and the Bank PO?	How do I prepare my English vocabulary, reading skill and grammar for the SSC and bank PO exams?	1
27044	8424	50267	What are the best new products or gadgets that most people don't know about?	What are some mind blowing gadgets that exist in 2016 that most people don't know about?	1
27045	50268	50269	If the US President at the spur of the moment decided to launch a nuclear missile as a first strike attack, could anyone stop him?	Could a US president launch an unwarranted nuclear attack? How many people could be killed?	0
27046	50270	2607	How does Demonetisation of 1000 and 500 rupees notes affect real estate industry?	How does the demonetized notes of 500 and 1000 effect the real estate?	1
27047	40217	45111	How should I study in first year of MBBS?	What should be my study strategy for first year of MBBS?	1
27048	50271	50272	What should I do to be an a astronaut?	How did you become an astronaut?	1
27049	50273	50274	How can I make a website without another website/platform?	How can I make a website platform?	0
27050	50275	50276	What is the name of the court structure filmed in Harry Potter (Ministry of Defence) and Wolfman?	Will Hilary Clinton address Immigration Reforms initiated by President Barack Obama?	0
27051	50277	28	What is your first sexual experience?	What was your first sexual experience?	1
27052	50278	50279	How to tackle NPAs?	How do Indian PSBs recover NPAs?	1
27053	50280	50281	Do you believe in god? and why?	Do you believe in God? If you do/don’t, why?	1
27054	50282	50283	Who are studentlist.com's competitors?	Does stamps.com have any competitors?	0
27055	50284	50285	Explain the single, double and triple integrations using a single 3D model prepared by wood?	How do I find people to invest in brick and mortar business?	0
27056	50286	50287	Was Domenico Scarlatti musically far ahead of his time?	What do you think about Zaha Hadid's architecture design?	0
27057	50288	50289	What happens to copper oxide when heated?	What happens when magnesium oxide is heated?	0
27058	50290	50291	How much are quants on Wall Street paid?	How does Wall Street work?	0
27059	50292	50293	Ever regretted buying something online?	What is something you regret buying?	0
27060	50294	50295	Why do people think Biggie is better than Tupac?	What rapper do you prefer; Tupac or Biggie. Why?	0
27061	50296	50297	Can the human brain evolve further?	Is the human brain evolving?	1
27062	50298	50299	How is ink made?	How is white ink made?	0
27063	50300	50301	Where can I watch all the censored scenes of Deadpool?	Where can I watch the unrated version of Deadpool?	0
27064	50302	50303	How are right and wrong defined? And why	What is right and what is wrong?	1
27065	50304	50305	What are some good Tamil newspaper?	Which is the best Tamil newspaper?	1
27066	50306	50307	Should laptops be allowed in the classroom? Why or why not?	Are mobiles allowed inside the classrooms in KCT?	0
27067	50308	50309	What is Akand Sitra's daily schedule while preparing for his UPSC exams?	What is your daily schedule for UPSC preparation?	0
27068	11478	50310	What are the best charities to donate to?	What is the best charity donation site?	0
27069	50311	50312	How did people like Margaret Hamilton handwrite their code?	How will I start B2B with Magento 2?	0
27070	50313	50314	What is the best gift one can give to her sister onhas her last birthday before her marriage?	What is the best gift to give girlfriend on her marriage?	0
27071	50315	50316	How can this word be used in a sentence?	How can the word 'edict' be used in a sentence?	0
27072	50317	50318	What is the nearest airport to Daytona Beach, and how do this cities tourist attractions compare to Orlando's?	What is the nearest airport to Daytona Beach, and how do this cities tourist attractions compare to Miami's?	0
27073	6438	4415	How can I make money online for job?	What should I do to make money online in India?	1
27074	50319	50320	What do people miss most about their childhoods?	What thing do you miss about your childhood?	1
27075	16310	50321	What is the least invested and best startup business?	What is the Best startup business to go into?	0
27076	50322	50323	Why are veins green in colour?	Why is green the colour green?	0
27077	50324	50325	Is world war 3 around the corner?	Is World War 3 on the horizon?	1
27078	50326	50327	What is it like to be a summer student at Mercy College? How is it different from the normal school year?	What is it like to be a summer student at Hunter College? How is it different from the normal school year?	0
27079	50328	50329	Which martial art is best for self-defense? Who/where are the best people to learn it from?	What martial arts is best for self-defense?	1
27080	50330	50331	How can I emigrate to America, I am a young man and a Sudanese resident in Saudi Arabia Married?	I'm a 27 years young married man and a father, how to be more sincere and not behaved like kids anymore at workplace?	0
27081	50332	50333	Where does Google keyword planner get its number of monthly searches from?	Should you tell someone you like you were a prostitute? How should they react?	0
27082	8165	50334	Why should I still vote for Hillary Clinton?	Would you vote for Hillary Clinton and why?	1
27083	50335	50336	What does the Arabic text mean ?	What does the Arabic text mean?	0
27084	50337	50338	"Rahul Gandhi, can you explain your thought which you addresses in front of audience when you said that ""This morning, I got up at night""?"	Do you have to have a cigarette when you wake up in bed in the morning and also before you go to sleep in bed at night?	0
27085	50339	50340	I completed 1 year in TCS couple of months back and my earlier project  got over by march.Since then I am on bench. how this bench period will affect me carrer in TCS?	I have joined TCS in march 2013 but am  still on bench .My HR is saying can't forward in RMG as its been  only four months and  I need to get allocated on  my own.After four month I will take maternity leave so I am worried what will happen next?	0
27086	50341	50342	How's Indian economy and Chinese economy is affected if it closes China product in Indian market?	India: Will Boycotting Chinese product impact their Economy without affecting ours?	1
27087	50343	50344	My sons (18) girlfriend (18) is causing a big problem trying to marry him, how do I stop this?	What are the tips to get by at work as an extremely shy person?	0
27088	50345	50346	What does it mean when someone upvotes me on Quora?	What does it mean when someone anonymously upvotes your answer on Quora?	0
27089	50347	50348	What makes a successful Movie/TV Producer?	What are the keys to being a successful film producer?	1
27090	50349	50350	Is China market intervention causing the rapid rise of the dollar against the Yen?	If Trump’s election causes uncertainty, why is USD increasing its value against several currencies?	0
27091	50351	50352	Will people stop driving completely when self driving cars become widely available in the next few years?	Will self-driving cars really pick up?	0
27092	50353	50354	Where can I buy Jordan 9 shoes?	Where can buy Jordan 7 shoes?	0
27093	50355	50356	What are some good mixes with watermelon vodka?	What's a good mixer for watermelon vodka?	1
27094	50357	50358	Who is the best rapper out of these three: J.Cole, Drake and Kendrick Lamar?	Who is better, J. Cole or Kendrick Lamar, and why?	0
27095	50359	50360	What is the difference between taper fit, narrow fit, slim fit, regular and straight fit?	What is powel fit in jeans?	0
27096	50361	50362	What is the best advice for a satisfying career in data science or machine learning?	Which is the best website/MOOC/Book to learn machine learning through R for data science?	0
27097	50363	50364	What are the environmental problems in using conventional methods in electronics engineering?	How are plants used to solve problems (environmental, medical, etc.)?	0
27098	50365	50366	Who are your best friends?	Who is my best friend?	1
27099	50367	50368	Which is the best trimmer in India?	Which is the best shaver trimmer (both in one) online in India?	0
27100	50369	50370	What percent of people in the US believe NASA hoaxes space travel?	What percent of people in the world believe NASA hoaxes space travel?	0
27101	50371	50372	Bleeding: How many blood do you have to lose to start feeling dizzy and to cause a hypovolemic shock?	What causes my body to feel like it’s being drained of blood?	0
27102	50373	50374	What are similarities between anatomy and physiology?	How are anatomy and physiology related?	0
27103	50375	39307	How does one learn how to hack?	How can I learn to hack seriously?	1
27104	50376	7799	How do I start with Android development?	How do I get started with Android application development?	1
27105	50377	50378	Can a Beechcraft King Air 350i be flown legally by one pilot?	Can a Gulfstream G650 be flown by one pilot?	0
27106	50379	50380	Is Smartron tbook good?	Which laptop I should buy, Dell or Lenovo or HP ?	0
27107	50381	50382	How can I lose a double chin in 2 days?	How can I lose a double chin in 3 days?	0
27108	50383	50384	Which fictional character do you love the most, and why?	Which fictional character do you love?	1
27109	50385	50386	Which is the best laptop under 30k which supports hadoop configuration?	Which is the best Asus laptop around 30k?	0
27110	50387	50388	What are the best asked questions at job interview and their best answers given?	Interviewing: What are best and wittiest interview question asked in a job interview?	0
27111	8461	12214	How do I improve my English speaking?	How can I improve my pronunciation of English words?	1
27112	50389	50390	How do I get rid of a cold fast?	What's the quickest way to get rid of a cold?	1
27113	50391	50392	Why are candles used in rituals?	Is there a way to use the whole of a candle?	0
27114	50393	50394	If you shoot someone by mistake at the age of 5 will you go to jail?	Why do we get sweat while doing work?	0
27115	50395	50396	Why won't my Google Chrome load?	Why won't Google Chrome download?	0
27116	50397	50398	How do we change the voting system?	What are some ways that the US voting system could be improved from a theoretical perspective?	0
27117	50399	50400	Which state is most popular of india ?	Who is the most popular Indian state Chief Minister?	0
27118	50401	50402	What song has you obsessed right now?	How many songs exist right now?	0
27119	50403	50404	Why some people use not instead of zero?	"Why do people use ""i"" instead of ""I""?"	0
27120	50405	12131	What is ultimate purpose of life?	What should the purpose of your life?	1
27121	50406	50407	How can I save YouTube videos in my phone gallery?	Is there any script to allow me to save all my uploaded YouTube videos?	0
27122	50408	50409	Online couriers in Bangalore?	I feel awkward on nights out. Should I stop going?	0
27123	50410	50411	Does the large number of Jews in science prove God exists? Or is it caused by artificial selection?	It has been said that nothing is ever proved in science; can this be documented by philosophy of science, the little scientists handbook or the like?	0
27124	50412	50413	How was Minecraft developed?	How was Minecraft created?	1
27125	50414	50415	Why do people eat cows?	Why do people eat?	0
27126	50416	50417	I will fail in two subject that math and science?	Which dialect of Faroese is spoken in Tórshavn and is more dominant or widespread?	0
27127	50418	38068	How can a boy notice if a girl likes him?	How do I know if a girl likes me back or not?	0
27128	50419	50420	Which is the best website design company Delhi/NCR?	Which is the best website designing company in delhi ncr?	1
27129	50421	25121	When and why do people commit suicide?	Why do you want to commit suicide?	1
27130	50422	50423	Is demonetization (demonetisation) in India a failure?	Is demonetization a success or failure of the Modi government after 50 days? Justify.	0
27131	50424	50425	Why do young women stand with their legs crossed?	Why does girl cross their legs when they lay down?	0
27132	50426	50427	Do software companies Amazon, Google, Microsoft, Adobe, Facebook consider people with research projects less able at programming if they have not being active in competitive programming/SPOJ/Codechef/topcoder?	"How many problems one should be able to solve in programming contests like ""CodeChef June Long Challenge 2013"", if he/she want to get placed at companies like Amazon and Microsoft?"	0
27133	50428	50429	Is watching porn once or twice a month a bad thing?	Is watching porn bad during your college life?	1
27134	50430	50431	What were the most creative, successful and daring intelligence operations, involving deception, after 1980?	I'm a dual US-Italian citizen, if I change my name in the US does it change in Italy?	0
27135	50432	50433	My OnePlus 3T's screen and display got damaged. How much would it cost to get it fixed?	Can you use WhatsApp on the OnePlus 3T?	0
27136	50434	50435	Why November 14, birthday of Jawaharlal is celebrated as Children's day? What exceptional thing did he do to be considered as dearest to children?	Why is Nehru's birthday celebrated as children's day?	1
27137	50436	50437	How much money Ryan Lochte is going to lose in sponsorship as a result of his behavior in Brazil?	How much and what will Ryan Lochte lose by losing his Speedo sponsorship?	1
27138	50438	16792	What is a zip code?	How do you find out what your zip code plus four is?	0
27139	40990	50439	What is the concept of entropy?	What is meant by entropy?	1
27140	50440	50441	Which field is better, veterinary or pharmacy?	Which field is better, good pharmacy or dental?	0
27141	50442	50443	How old are the characters during the first season of Friends?	Who is the most stupid character in Friends?	0
27142	23108	1893	Why is salt water taffy candy imported in France?	Why is Saltwater taffy candy imported in Australia?	1
27143	50444	50445	What software would I use to create videos like this?	What software was used to create the visualizations in this video?	0
27144	50446	50447	What gift should I give to my girlfriend on her birthday?	What are good birthday gifts for a girlfriend?	0
27145	50448	50449	What is cost of addidas brazuca (football)?	What is the cost of an Adidas Brazuca (football)?	1
27146	6772	18858	Which is the best food to gain weight?	What is the best diet to gain weight?	1
27147	50450	50451	What can I do after having ban on rs 500 and 1000 currency note?	What can I do after pulling out 500 and 1000 currency notes?	1
27148	8812	50452	Is it a good idea to buy a used car from a rental car company?	Is buying used cars from Avis or Hertz a good idea?	1
27149	50453	50454	Is unifunds.com legit?	Is informer.com legit?	0
27150	50455	50456	Viva questions for reynolds number?	Can clients pay me directly via Skrill without the need of freelancing sites?	0
27151	50457	50458	Is it possible to play GOD OF WAR games on my PS4?	How can I play DLC on PS4 disc based games?	0
27152	50459	50460	What are the uses of salt bridge in galvanic cell?	Why salt bridge are used in galvanic cell?	0
27153	50461	50462	What is the rarest Pokémon you have?	What's the rarest Pokémon you have in Pokémon GO?	1
27154	50463	50464	Will my credit score be 700 if put down 700 for a secured credit card?	Do secured credit cards set your credit score by the amount you put down?	1
27155	796	50465	How do I pass a drug test for methamphetamine?	Can you pass a urine test for meth with Suragel?	1
27156	50466	50467	Where is your source of motivation?	What are the sources of motivation?	0
27157	50468	50469	"What does ""otosan"" mean in Japanese? How is this word used?"	Does the word Chargie (or Chargies) mean anything in Japanese or in Japan?	0
27158	50470	50471	I'm doing a project in my school about Interstellar, how did Cooper travel into a black hole without dying?	Why didn't Cooper die due to the immense gravitational pull of the black hole before reaching Tessaract in Interstellar?	0
27159	50472	50473	How should I actually BE confident?	How can one not be over-confident?	0
27160	50474	50475	How many 250w solar panels do I need to charge a battery bank of 1 x 200ah?	How many solar panels are needed to charge 1 x 200ah battery?	0
27161	50476	50477	Are MNCs better than Indian Companies?	Are MNC better for Women Employees than Indian companies?	0
27162	50478	50479	What happened to the Russian after the abdication of Tsar Nicholas II?	How close are Russian Nationalists to take the power in Russia?	0
27163	50480	50481	Is nude photography considered objectification?	What constitutes prestige photography?	0
27164	50482	50483	What does the Iran World Cup team need to do to win its last group match against Bosnia and Herzegovina?	What does the Bosnia and Herzegovina World Cup team need to do to win its last group match against Iran?	0
27165	50484	50485	Where can I buy rave or edm clothes in New York, not online?	Some document contains middle name Kumar?	0
27166	50486	50487	How can I change my name on an online-booked IRCTC railway ticket?	What are the booking charges for Makemytrip and Irctc? Which is the cheapest way to book a railway ticket online?	0
27167	50488	48629	How do I stop a German Shepherd/Border Collie mix puppy from chewing my shoes?	How do I stop my Husky/Border Collie puppy from chewing my socks?	1
27168	50489	50490	Is BPD curable?	Is schizophrenia curable?	0
27169	50491	50492	If I am going for an interview for Android developer, what questions should I expect in the technical round?	What kind of questions should I expect in an interview for a web development position?	0
27170	50493	50494	What are the pros and cons of working in a corporate firm?	What are the pros and cons of a corporate job?	1
27171	50495	12552	What can I do with my law degree if don't want to practice law?	Is it a good idea to go to law school if you don't want to be a lawyer?	0
27172	50496	50497	How many degrees does the hour hand of a clock move in a second?	At what time(s) do the hands of a clock form a 45 degree angle?	0
27173	50498	50499	What is your experience with using Appia.com?	What are some experiences of using iOffer.com?	0
27174	50500	50501	Why women should stay at home?	Why are some women better at staying at home than others?	0
27175	50502	50503	What is the probability of middle berth in a coach?	Is there a jQuery or Javascript analog to the MS Timeline Slicer control?	0
27176	50504	50505	Should marijuana users be prohibited from buying guns in the United States?	Should possible medical marijuana users be prohibited from buying guns in the United States?	1
27177	50506	50507	Is University Of Montreal's MS in CS taught in french?	I have many question about Islamophobia, but the first, I wanna ask to you all, do you hate Islam? And why? Dont panic, I'm Moslem	0
27178	50508	50509	Why do I run faster on a treadmill than on the road?	Why do I run faster on a trail than on the road?	0
27179	50510	50511	Which are the top ten schools in India?	Which are the top ten commercial cities in India?	0
27180	50512	9656	How can I find a person by a picture?	How do I Find a persons real name with a picture?	1
27181	50513	50514	What will happen if Google starts charging for every search?	Is it normal to Google search every question you have in mind?	0
27182	50515	50516	How can I know my girl is loving me?	How do I know if a girl loves me?	0
27183	50517	50518	What is the average salary of an Indian news anchor and editors?	What is the starting and average salary of an Indian ship caption?	0
27184	50519	50520	"What is the purpose of ""certs"" directory in Linux Kernel Source?"	"Linux Kernel: What is the purpose of ""firmware"" directory in Linux Kernel Source?"	0
27185	50521	50522	Should I take the GMAT or CAT? Which is better and why?	What's better: GMAT or CAT?	0
27186	50523	50524	What is the cruelest thing that someone has ever said to you?	What is the cruelest thing anyone has ever said to you?	1
27187	50525	50526	Why it is said that a good designer is a keen observer?	What is a good logo design?	0
27188	38687	50527	What are some things new employees should know going into their first day at Universal?	What are some things new employees should know going into their first day at CSC?	0
27189	50528	50529	Does Gardenia Cambodia really?	What are Cambodia's top ten imports and exports?	0
27190	50530	50531	What are the best activities to do with children when visiting Ning'an, Heilongjiang, China?	What are the best activities to do with children when visiting Yichun, Heilongjiang, China?	0
27191	3209	50532	Why is it so hard to wake up in the morning?	Why is it so difficult to wake up every morning?	1
27192	50533	50534	What are the best books for the SAT and the TOEFL (please do not mention too many only 2 or 3)? How do I prepare for the SAT and the TOEFL as I am preparing to give the TOEFL in September and the SAT in December this year?	What are the best books for preparing for SAT and TOEFL?	1
