id	qid1	qid2	question1	question2	is_duplicate
311178	435413	435414	How dose a super moon work?	What is a super moon?	1
311179	435415	435416	How do I delete my topics in Quora?	How do I Remove some topics from Quora?	1
311180	6993	12350	How can I get rid of acne and scars?	How do I get rid of acne naturally?	1
311181	435417	435418	I joined JEE classes in July starting the Non Attending system and now I am Feeling I cannot do it anymore??	I want to do my MS abroad, but I could not write the GRE in July and I am starting to prepare now. Is it too late for me to apply this year?	0
311182	435419	435420	What do Admission Committees of top MBA programs think of students with professional qualifications like ACCA, CMA, CFA, etc?	Do people take flights just for fun, without really caring where they go?	0
311183	202878	435421	What's a day in the life of an IIIT-H student like?	Des IIIT-H provides any online course for non IIT-H students?	0
311184	435422	435423	How much control does China have over Tibet?	How did China get control over Tibet?	0
311185	64064	43167	How can I raise my self esteem?	How does I develop self confidence?	1
311186	283710	435424	How successful is Swachh Bharat Abhiyan ?	Is Modi's Swachh Abhiyan working?	1
311187	46666	102929	How do I get rid of my belly fat?	What should I eat to get rid of belly fat?	1
311188	147193	435425	How is linear algebra applied in computer science?	What are the uses of linear algebra in theoretical computer science?	0
311189	35920	155371	What's the most expensive meal you have ever had? Was it worth it?	What is the most expensive meal you have ever eaten?	1
311190	435426	435427	How can I take advantage of compound interest?	How does one actually take advantage of compound interest?	1
311191	435428	435429	Can an answer be collapsed just because it shows evidence of intelligence design in order to satisfy antitheist egos?	Can a question be collapsed only because it shows evidence of an Intelligence Design in order to satisfy antitheist egos and please the beast?	1
311192	435430	435431	Should I take AP biology and AP environmental science at the same time?	Should I take AP bio or AP environmental science?	0
311193	435432	251662	What would happen if India becomes a tax free country?	Why can't India be a tax free country like Dubai?	0
311194	435433	435434	How difficult are physics classes at Stanford?	How difficult is it to get into Stanford for grad school?	0
311195	435435	435436	Which US presidents have been impeached? What are the reasons why this action was taken?	Which US presidents have been impeached, and what are the reasons why this action was taken?	1
311196	141296	93098	How can one ask for a raise?	Asking for a Raise?	1
311197	435437	435438	Why I see lot of BJP supporters on Quora?	Why I dont see AAP supporters on Quora?	0
311198	435439	435440	Can I File for bankruptcy with child support and student loan debt	When the Qur’an says to be kind and just with non-Muslims, why are ISIS ‘jihadists’ killing them?	0
311199	435441	435442	What is the dumbest thing any country has ever done in a war?	What is the dumbest thing your country has ever done?	0
311200	293236	435443	What should I do to get muscle in my legs?	How do I get rid of too much hair that is present in my arms and legs?	0
311201	435444	435445	What is the meaning of Vidhan Sabha in English?	Which is the largest Vidhan Sabha in india?	0
311202	244714	435446	What would happen if the earth was the size of the sun?	What would happen if Earth was as big as the Sun?	1
311203	435447	417303	How common is dying in your sleep?	What are methods to die in your sleep?	0
311204	36426	172680	Why has the Modi Government banned the 500 and 1000 rupee notes?	Why did the Indian government develop a 1000 rupee note but developed 2000 rupee note?	1
311205	435448	244837	What is the story of Terence in Angry Birds Movie?	In Angry Birds: Star Wars, how do you get Yoda?	0
311206	435449	435450	Is it possible to prepare IAS and BANK exam at the same time?	Is it possible to prepare for IAS and bank exams at same time?	1
311207	435451	435452	Who are the best employment lawyers in the SF Bay Area?	I'm 25 living at home in the Bay Area with a 'useless' degree from UC Berkeley & no real clue what to do with my life; what is your advice for me?	0
311208	144780	6258	Will Hillary Clinton seek a second term as President?	Why should one vote for Hillary Clinton in the 2016 presidential election?	0
311209	23405	137461	How do I write a good essay?	Why is it so hard to write an essay?	1
311210	25502	246548	Are Mahabharata and Ramayana stories real?	Did both Ramayana and Mahabharata truly happen?	1
311211	435453	435454	Where can I find a list of Air Canada flight cancellations online?	Where can I find a list of Air Canada flight cancellations?	1
311212	114572	347974	How is the Lewis dot structure determined?	How is the Lewis dot structure for ammonium determined?	0
311213	57407	16682	I want to become rich. What should I do?	How do I become rich?	1
311214	48774	7325	How can I reduce my belly fat in 2 months?	How can I reduce my Belly and tummy fat?	1
311215	435455	435456	What Pakistan can learn from India?	What should Pakistan learn from India?	1
311216	435457	435458	How do international cricketers deal with jet lag?	How do sports persons deal with jet lag?	1
311217	435459	435460	What are project ideas for wtl?	What are some good project ideas?	0
311218	435461	435462	Explain how a program written in high level language is change into a code?	This girl keeps talking to me and she wants more than casual coneration what do I do?	0
311219	12502	435463	How long does it generally take for a bruise to form after being hit in the face?	How long does it take for a bruise to form?	0
311220	435464	435465	How similar or different is it living in Australia compared to California?	Is co-living popular in Australia?	0
311221	435466	435467	Do you think that caste based reservation should be cancelled?	Can reservation for backward cast be cancelled?	1
311222	435468	435469	How do I deal with my negative, depressed mother who blames me for everything?	How do I deal with a mother who blames me for the abuse?	0
311223	435470	435471	How can I install NGINX, PHP-FPM 5.6 and Joomla on Amazon EC2 instance?	How can I make my PHP application installable just like Moodle, Joomla and Wordpress?	0
311224	31620	68803	How can I reduce tummy fat?	Which exercise is effective to reduce tummy and belly fat?	1
311225	435472	435473	What are the reasons behind Chicago's high homicide rate?	Why are homicide rates so high in Chicago?	1
311226	87244	202813	Can you get a Second hand high from smoke outside?	Can you get a second hand high from someone smoking weed outside?	1
311227	2025	127922	Who will win the 2016 presidential election?	All biases aside, at this point in time, who do you think will win the presidential election?	1
311228	435474	435475	What if anything should happen to Hampton Creek and Josh Tetrick now that we know they faked demand by e.g., buying product and calling Whole Foods?	Apart from calling clients to come and buy our products, what are other strategies we can use while calling clients?	0
311229	435476	435477	Which movie editing software has better editing workflow?	Which is the best movie editing software?	0
311230	435478	435479	Moving from Houston to Seattle. What can I expect?	What is the ecommerse selling guide for startups?	0
311231	417765	435480	Did Father Christmas used to wear green clothes? If so, why was his clothing color changed to red?	Christmas: Why does Santa wear red?	0
311232	64891	8024	What were the major effects of the cambodia earthquake, and how do these effects compare to the Chile earthquake in 2010?	What were the major effects of the cambodia earthquake, and how do these effects compare to the Mexico earthquake in 1787?	1
311233	435481	435482	What is the salary of an entry-level staff auditor in the Philippines?	How can I join a theatre group in Jaipur?	0
311234	93231	435483	How do I switch off screen overlay in Moto G4plus?	How do I turn off scree overlay?	0
311235	175269	64236	How do I get funding for my idea of an app?	Where can I get funding for my idea?	1
311236	435484	435485	How can I make money with Facebook traffic?	How do you make money on facebook?	1
311237	292424	435486	What does Google Ventures do?	How is Google Ventures doing?	0
311238	435487	435488	Which is the best civil service coaching in Delhi and up?	Which is the best coaching for civil services in Lucknow and Delhi?	0
311239	435489	320470	What food give you instant energy?	What foods give you energy?	0
311240	435490	435491	How many Twitter users are there in Pakistan in 2016?	How many Twitter users are there in Pakistan?	0
311241	435492	257184	Can I get original voice clip of Swami Vivekananda anywhere?	Did Swami Vivekananda smoke Cannabis?	0
311242	435493	435494	What is a good wood to build your house with? I hear redwood is the best wood and doesnt need chemicals like treated wood to buy and if so what is the price compared to regular woods used to build houses?	How do you build a doghouse out of wood?	0
311243	435495	435496	What is the role of ethics in corporate governance?	What is the role of corporate governance? What does the governance department do for a big publicly traded corporation?	0
311244	435497	435498	How do I get my boyfriend to play less Halo?	How do I get my boyfriend to stop playing video games so much?	0
311245	51617	34942	How can I realistically make money online?	How can I earn money easily online?	1
311246	435499	11810	Is it possible to find out whether someone voted in an election?	Why should I vote or not vote for Narendra Modi in 2019 elections?	0
311247	162174	435500	How do you know if you cat loves you?	How can you tell if your cat really loves you?	1
311248	360942	435501	When you catch a cold, why does your face swell up?	Why is my face swelling?	0
311249	37748	202400	Why isn’t Amazon providing the total ratings or reviews filter option in advance search?	Why doesn't Amazon have a filter for products only made in the USA?	0
311250	435502	13045	Why do many middle and lower middle class people in the US mortgage a house then put it up for rent (as an investment) but most wealthy people do not?	What are the secrets only the wealthy know and the middle class is unaware of?	0
311251	435503	435504	What universities does Schnitzer Steel recruit new grads from? What majors are they looking for?	What universities does Steel Dynamics recruit new grads from? What majors are they looking for?	0
311252	400982	371496	What is the silliest question you have ever read on Quora?	Which is the silliest question ever asked?	1
311253	314242	58332	How do I setup a minecraft server?	How do I make a multiplayer Minecraft server?	1
311254	79667	378397	Why do people call the Aboriginals Australians indigenous when it's been proven they are direct descendants from Africa?	Why are aboriginals in Australia referred to as indigenous when they are descendants from Africa?	1
311255	167757	286447	Is true love exist or not?	Does true love exist in the world?	1
311256	435505	4964	Do employees at Telecom Systems have a good work-life balance? Does this differ across positions and departments?	Do employees at Comfort Systems have a good work-life balance? Does this differ across positions and departments?	0
311257	435506	313903	How and when are 'icy' and 'icey' used in sentences?	"How do I use ""will"" and ""would"" in a sentence?"	0
311258	435507	435508	How are battles won?	Do mean people ever get punished?	0
311259	435509	435510	What does it feel like to be stalked and have people after you?	What does it feel like to be stalked by women?	0
311260	315504	148429	What universities does Aaron's recruit new grads from? What majors are they looking for?	What universities does Intuit recruit new grads from? What majors are they looking for?	0
311261	435511	435512	Who is the one fictional character you would love to have sex with, in real life?	Who are some asexual characters in fiction?	0
311262	435513	435514	I want to start my own business again but I can't think what to do. How can I come up with something?	I am sixteen and eager to start my own business. Although, I can't seem to come up with a feasible idea. What can I do?	1
311263	435515	435516	I am 70kgs and 26yrars old howmany kilometers running everyday?	Did Russia and France help each other colonize Australia?	0
311264	435517	435518	How can I recover deleted Telegram chats?	Is it possible to recover deleted WhatsApp chats?	0
311265	115812	435519	How do you calculate the square root on a calculator?	How do calculators calculate square roots so quickly?	0
311266	435520	435521	Is there a payroll service as delightful as Servicejoy.com for invoicing?	Is there a payroll service as delightful as Freshbooks for invoicing?	0
311267	435522	435523	What is the Lequesne Index?	I have been plucking hair from happy trail with my index and thumb fingers. Is it safe to do so?	0
311268	435524	143444	What is it like to perform mandatory military service in Taiwan?	What is it like to go through National Service in Singapore?	0
311269	435525	435526	Would you take a gap year between high school and college?	What do you think about a year or two gap between high school and college?	1
311270	15766	6481	What is your new year resolution for 2017 or goal for 2017?	What can be my new year resolution for 2017?	1
311271	76043	435527	When do we use the simple past tense?	How is the simple past tense used in sentences?	1
311272	435528	435529	Should animals be used for testing drugs and medicines?	Should animals be used for testing medicines and drugs?	1
311273	258609	106169	Will there be any technology in the future allowing people to live forever?	Can man live forever?	1
311274	14685	138819	Is it possible to sustain life in other planets?	Is there life on other planets besides earth?	1
311275	435530	435531	How did the United States become so powerful and influential in the world?	Are the UK and USA two of the most influential and powerful countries in the world?	0
311276	435532	122606	Do skunks make good pets?	Do foxes make good pets?	0
311277	435533	435534	Why is Oprah Winfrey so popular?	What was it like to be a guest on the Oprah Winfrey Show?	0
311278	435535	435536	What's it like to work at Carnival for your first job?	What's it like to work at Shoe Carnival for your first job?	0
311279	435537	435538	What is the difference between sushi and Gimbap? Other than the countries that they are from.	Where I can get Japanese pancakes in NYC?	0
311280	235699	7855	What are some ways people make money without adding value?	How did you make money fast?	1
311281	105089	435539	What is the difference between atomic mass, mass number, atomic weight, and relative atomic mass?	What is the mass in grams of 11 atoms of potassium?	0
311282	35588	84780	How can I learn coding?	How can I learn and practice coding, I want to code?	0
311283	252177	119031	It is not a good idea to learn two kinds of languages at the same time, isn't it?	Is it a good idea to learn two languages simultaneously?	1
311284	435540	435541	Don’t Eat Burgers That Are Pink In The Middle?	Do children cause bad karma?	0
311285	435542	435543	What does Nicorette spray taste like?	What does Nicorette gum taste like?	0
311286	435544	435545	Who can match the Rothschilds in the present world scenario?	What would a city where all the world's elites live be like?	0
311287	435546	327128	Is either Capgemini or Cybage a good place to start for freshers?	Is Capgemini good to start for freshers?	0
311288	435547	8689	How would we know if a fourth dimension actually exists?	How do you explain the existence of fourth dimension?	0
311289	435548	435549	What career advice would you give someone interested in becoming a Market Research Analyst?	What advice can you give someone who wants to trade Currencies?	0
311290	25724	57668	How can I make my penis thicker?	How can I increse my penis size?	1
311291	435550	97255	What makes a Shih Tzu/Terrier mix such a loyal companion?	What makes a Labrador/Great Dane mix such a loyal companion?	0
311292	246867	388610	What advice would you give to your 29 year old self? Request	What advice would you give your 30 year old self?	1
311293	242222	371898	What is the answer to this IQ test?	I have an IQ of 188 and I'm 14. Is this good or average?	0
311294	435551	435552	How can someone hack my email?	How do you know if someone is hacking my email?	1
311295	108706	133509	What is a reason for world war?	What causes war?	1
311296	85554	433003	I am holding back many regrets of past. How can I let go of them?	How do I let go of regrets from the past and becoming older?	1
311297	435553	197974	Why dont Indian Muslims join Indian army?	Why do very few Muslims seem to join the Indian Army?	1
311298	346799	435554	Did the Ancient Syrians discover the Americas?	Wouldn't a US political hopeful just prepare or amend their tax returns far in advance to present as they would wish the public to view them?	0
311299	435555	435556	What is neutrality bias (especially in journalism)?	Is the ICTY biased?	0
311300	435557	65894	If a war between India and China happens will India be able to win?	Who will win if India and China will go to war?	1
311301	403383	435558	What is the Best pattern of answering multiple choice questions?	What is the Best pattern of answering multiple choice question?	1
311302	435559	435560	What information does an immigration inspector see when he/she puts your passport through the machine reader?	What is it like to go through a secondary inspection during the immigration to the US?	0
311303	45466	23279	Why do some people think that the Earth is flat when it is very clear that it is not?	Why do some people think Earth is flat?	1
311304	435561	435562	What would happen if the earth was entirely made up of water?	What would happen if earth was made of only water?	1
311305	321320	264675	What are all the places that I can visit in Chennai and around?	What are the places to visit in Chennai?	1
311306	131117	435563	Is milking the only way to obtain scorpion venom?	Where can I sell scorpion venom?	0
311307	435564	435565	What is the difference between a talent manager and an agent?	What is the difference between a talent agent and a manager?	1
311308	435566	170411	What is the salary of Google engineer in India?	How much do Google employees  get paid in India?	0
311309	35003	42620	What is the cheapest, painless, easiest way to commit suicide?	What is a sure way to commit suicide?	1
311310	45567	235721	What are the places to see in Coorg?	Which are the must-visit places in Coorg?	1
311311	435567	435568	Is it recommendable to do LLM after LLB for better future prospects?	What is the career scope after CS with LLB? Also, Which is better,  ICWA or  CS + LLB?	0
311312	435569	435570	How can the longest stage in the cell cycle be described?	What is the function of the longest stage in the cell cycle?	0
311313	435571	435572	What is the future in veterinary medicine?	What is the future of veterinary medicine?	1
311314	435573	435574	What are the advantages and disadvantages for Chinese students of applying for postgraduate study at US universities via an agency?	How are the studies different in the US than in India? What is the workload for an average MS student in a US university?	0
311315	272695	435575	Can a straight man have mannerisms of a stereotypical gay man?	How does a gay man propose to straight man?	0
311316	435576	435577	Which Laptop can I buy under INR 25k?	What is the best everyday use laptop under INR 25k?	1
311317	435578	435579	When will Cognizant start off campus for the freshers 2016-2017 batch?	When will Cognizant start off campus for the 2016 batch?	1
311318	435580	43105	How do I contact supervisors for graduate admissions?	How do I contact professors for graduate admissions other than emails?	1
311319	339106	435581	Can a dropper apply for KVPY exam?	Have you ever traveled alone? What were your experiences?	0
311320	38362	48082	What are the best ways to lose weight fast?	How can I lose my weight fast?	1
311321	435582	435583	How is Klinefelter syndrome diagnosed?	How is Klinefelter's Syndrome diagnosed?	1
311322	435584	435585	Is Russia the most powerful country in the present?	What sort of leader did the Russian people want after the death of Lenin in 1924?	0
311323	435586	435587	What does a man wear for book launch?	What can a man wear?	0
311324	435588	339786	Can anyone help me with this physics 102 problem?	Mathematics and Physics: Can anyone help me solve this?	0
311325	435589	435590	Why do we fall for people who don't feel the same way about us?	My AMCAT scores are English-50% Quantitative 66.8% logical 98.9% programming 85.9%? Can I expect interview calls?	0
311326	54274	127829	What are good certifications for marketers?	What are the certification we can do to become expert in Digital Marketing in India?	0
311327	435591	92564	Why do most tornadoes form in Tornado Alley?	Why do tornadoes occur in Tornado Alley?	1
311328	162361	435592	What are the best Tinder hacks?	What is the best way to use tinder?	0
311329	435593	435594	What is something I can do every day for under 5 minutes that will be worth it later in life?	Is your own marriage effected by demonetisation of 500/1000 notes? What were the problems?	0
311330	303834	435595	How can I get bigger shoulders?	What should I do to get the bigger chest, biceps and shoulders?	0
311331	199613	117473	How much is known about the release date of the new Apple MacBook Pro?	Will apple release a new MacBook Pro soon?	1
311332	435596	435597	What is backbonding?	How is octane processed through isomerisation?	0
311333	333241	435598	What happens if I can't get rid of a lead of a mechanical pencil in my skin?	What is cyberbullying in a layman language and how can I get rid of it?	0
311334	39280	435599	What is wrong with our society today?	What's wrong with todays era?	0
311335	281615	435600	What is your DREAM of life?	What is the dream of your life?	1
311336	435601	435602	What exactly is exploding in a nuclear bomb?	How exactly a nuclear bomb works?	1
311337	435603	75696	Which research labs work on tendinopathies in France?	Which research labs work on tendinopathies in Boston?	0
311338	435604	212486	Can an AWS ElastiCache Redis db be used with a Nodejitsu app? If so, what are the drawbacks?	Redis vs MySQL: Should I Consider Use Redis from Day One?	0
311339	399	2607	What are the effects of demonitization of 500 and 1000 rupees notes on real estate sector?	How does the demonetized notes of 500 and 1000 effect the real estate?	1
311340	210960	33447	What’s the difference between SEO and SMO?	What's the difference between SEO and SMO?	1
311341	435605	435606	Is a firewall necessary?	What is a firewall? Is it necessary?	1
311342	435607	435608	What is Jell-O made of?	How is Jell-O made?	0
311343	366519	100355	What happens to the matter that forms a black hole?	What happens to matter when it gets sucked by a black hole?	1
311344	435609	435610	How do you deal with possessiveness?	How do I deal with possessive parents?	0
311345	435611	435612	Why are many American Jews rich?	Why are Jews so rich?	1
311346	221361	435613	What is NoSQL?	What is NoSQL good at?	0
311347	435614	85640	Why is Blondie's Pizza so famous?	Are Pizza Hut pizzas good?	0
311348	435615	435616	How can you identify a metal?	How do you identify metals?	1
311349	435617	435618	What is the most impressive/astonishing PhD thesis you ever came across?	What is the process of writing a PhD thesis?	0
311350	369091	204047	How long should international bank transfers take by SWIFT?	Why do money transfers take up to 3-5 bank working days?	0
311351	435619	360827	What are some type of payments that can go cashless in India?	Is India moving with cashless economy?	0
311352	234941	182275	What is the solution to this maths problem?	What is the solution of this math problem?	0
311353	49253	136458	Is there a way to check exactly what time USPS delivers mail at your house on a daily basis?	How can I pick up my USPS package before it is delivered?	0
311354	435620	435621	How does ring network topology works?	Do you think Indian newspaper should also start openly endorsing political parties, just like their US counterparts?	0
311355	62122	2475	What is the best gift you have recieved from someone?	Which is the best gift that you have ever received?	1
311356	31805	93520	How can I slim down my face?	Are there any creams or anything I can use to slim down my face?	1
311357	435622	64037	Can any girl squirts during sex?	Do all women squirt during sex?	1
311358	435623	20322	If energy never gets lost, why can't we create a machine that works forever?	Are perpetual motion machines possible?	0
311359	435624	435625	If you were dying, would you upload your consciousness and your memories into a 10-year-old clone of yourself?	If I create a clone of a younger version of myself and uploaded my memories to it, how do I then destroy the old version of me without committing murder, without feeling killed?	0
311360	435626	372097	Who do you think will betray Luffy in the future?	What has been your most unexpected betrayal and what did you learn from it?	0
311361	435627	435628	What is the order of stability of halide ions in aqueous medium?	What is the order of stability of alkoxide ions?	0
311362	277966	435629	House of Cards Season 2: What is the significance of Frank and Claire's special encounter with Meechum at the end of Chapter 24?	What made Garrett Walker cancel the deal with Tusk in the finale Season 2 which ultimately made Frank the President?	0
311363	435630	281920	How can I know if I'm not pregnant without using a test?	How can you know if you’re pregnant without using a test?	0
311364	339447	435631	What are some ways to reset my iPhone 5's voicemail password?	How do I reset my iPhone voicemail password?	1
