id	qid1	qid2	question1	question2	is_duplicate
124713	160047	184328	What do the below terms mean: GFE PSE BBBJ Russian Greek MSOG Daty CIM OWO BBBJTC BBFS?	Is there any advantage for having a big butt while having intercourse? Why are men always turned on by big butt women?	0
124714	76381	201327	What is the most embarrassing moment of your life?	What is the most embarrassing moment of your parent's life?	0
124715	201328	201329	What are the chances of Marine Le Pen win the next French election?	Will Marine Le Pen win the 2017 French presidential election?	1
124716	34252	201330	What is the difference between mouse and a rat?	What is the difference between a rat, a mouse and a rodent?	0
124717	201331	201332	What are exotic metals?	Do metals react to other metals?	0
124718	201333	201334	How can you determine which way a tree will fall?	In what way can you transplant aspen trees?	0
124719	201335	201336	What is one phone device you wish would go away that still exists?	What is one smartphone device you wish would go away that still exists?	1
124720	201337	109107	What are some good books on physical chemistry?	What are the best books for physical chemistry?	1
124721	201338	201339	Why does Quora avoid talking about black people?	Why do some people on Quora keep asking questions about black people?	0
124722	201340	201341	Why do end-stage dementia patients stop eating?	What is the healthy diet for luekemia patients? What are the survival chances on stage II for a person 70+? How to treat the anxiety of the patient?	0
124723	201342	201343	If you have a B.Sc. in Electrical Engineering - does that mean you have the ability to work as an electrician?	After completing electrical engineering, can working as an electrician be justified?	0
124724	201344	201345	What is the poorest country in Asia, and how does its health system compare to the poorest country in Africa?	What is the poorest country in Asia, and how does its health system compare to the poorest country in Oceania?	0
124725	201346	201347	What is a token in programming?	What are tokens in java?	0
124726	201348	201349	What are macro and micro ideologies?	What is the basic ideology of Marxists?	0
124727	201350	154634	Does time exist out of timelines?	Does time exist?	0
124728	201351	201352	Why did they kill off Derek on Greys Anatomy? Did he want off the show?	Why did half of the main characters on Grey's Anatomy leave when they knew they were making a lot of money off the series?	0
124729	81837	155895	How can I make my money make money?	How could I make money now?	1
124730	201353	201354	What are the major advantages and differences between single rear wheel and dual rear wheel pickup trucks?	How do I get more orders to Mahindra pickup truck in Mumbai?	0
124731	201355	201356	How do you approach and solve complex coding or algorithm problem?	How should I solve a complex coding problem?	0
124732	119320	201357	What should I do to study in Harvard university?	How can I apply to Harvard University?	0
124733	201358	201359	When do I reach the turning point in my life?	What is your turning point in life?	0
124734	372	42299	What was the significance of the battle of Somme, and how did this battle compare and contrast to the Battle of Riyadh?	What was the significance of the battle of Somme, and how did this battle compare and contrast to the Battle of Penang?	1
124735	119886	188101	What would happen if all immigration barriers were lowered?	What would happen if there were no restrictions on immigration worldwide?	1
124736	201360	201361	What are the problems regarding ecotourism in Honduras?	If R-square= 0.765 and standard error = 0.038 with standard deviation=0.465, How do I find the number of observation in the regression?	0
124737	201362	201363	What is the use of # in c++?	What is the use of containership in C++?	0
124738	201364	201365	If gravity is caused by warped spacetime, what dimension is it being warped? The 4th dimension?	If gravity warps space-time, does that imply at least one additional spacial dimension for space to 'warp into', leading to 5-dimensional space-time?	0
124739	201366	201367	How did Corridor Digital make their stop motion videos?	How did corridor digital create their stop motion videos?	1
124740	201368	201369	Is it okay to marry a man 12 years older?	Will you marry the one who is 20 years older than you?	0
124741	201370	201371	How much does website design cost for a small business?	How much does a new website design cost?	0
124742	201372	201373	In the Angry Birds movie, why do the birds have legs?	Which bird you like most in Angry birds?	0
124743	201374	201375	Is it worth buying a Mac mini?	What do you think about buying a Mac Mini?	0
124744	201376	201377	What are the largest classes at the University of South Dakota? Are they worth taking? What is the workload like for them?	What Wiki platforms are helpful for an academic physics research group?	0
124745	201378	201379	What is your favorite not-so-famous plant?	What is your favorite plant?	0
124746	14488	201380	How does one cook broccoli?	What are the best ways to cook broccoli?	1
124747	201381	201382	How do I unlock my Android mobile if I forget my lock pattern and don't have any security question?	How do I change the lock pattern of Xiomi Red 1S mobile phone?	0
124748	201383	201384	What are some good thesis topics in civil engineering?	What are the best thesis topics in civil?	1
124749	201385	201386	What are some non-touristy things to do in Tokyo?	What are the must go, non- touristy places in the Bay Area?	0
124750	201387	201388	As a person with bipolar disorder type 1 or 2, how does it feel to have an episode? Do you always know when you're having one?	Does everyone with bipolar disorder type 1 experience hypersexuality?	0
124751	201389	201390	Where is the cheapest place to buy digital cameras in Hong Kong (e.g. Panasonic GF1)?	Where can I buy an iPhone 5s in Hong Kong?	0
124752	201391	201392	Are barron’s 333 high frequency words enough to get a 155+ score in verbal?	Could one possibly survive watching all of One Piece in one sitting?	0
124753	59173	201393	What is the salary of an army doctor (after doing MBBS from AFMC)?	How is life after MBBS from AFMC?	0
124754	201394	201395	What are the most interesting products and innovations that American Capital Agency is coming out with in 2016?	What are the most interesting products and innovations that American Capital Mortgage is coming out with in 2016?	0
124755	201396	198494	Why is a crush called a crush?	"Why is a ""crush"" called a ""crush""?"	1
124756	66099	201397	Which is the best way to invest money?	In what ways can I invest money?	1
124757	201398	201399	What is the most important social media tool?	What are the best social media tools for journalists?	0
124758	201400	201401	How is life in TCS for fresher?	How is life at TCS for a fresher?	1
124759	201402	98251	I know nothing about programming. What is the best way and the best language to start learning how to program?	What is best way to start learning programming?	1
124760	201403	183621	What were the terms to the Treaty of Versailles?	What were the provisions of the Treaty of Versailles?	1
124761	201404	201405	How credible is Danney Williams' claim that he is Bill Clinton's son?	Is there any truth to the claim that Bill Clinton has an illegitimate black son?	1
124762	201406	60832	In the 2002 world cup, how did Korea and Japan decide who gets to host the finals?	How has the present Philippines independent foreign policy set a good model for Japan and South Korea to follow in the world?	0
124763	173473	201407	How can you format text (make text bold, italic etc) on Facebook posts?	What is the ideal text length for a Facebook post?	0
124764	201408	201409	What is it like living in Bahrain?	How is Bahrain?	1
124765	130412	27018	How can one learn a new language quickly?	How can I learn any new language quickly?	1
124766	201410	201411	Why do I have zero friends?	Why do I have no friends?	1
124767	10114	201412	How is starch digested?	What is starch?	0
124768	201413	201414	What is your story of losing a lot of money in stock market?	How big was your incurred loss in Indian stock market?	1
124769	39226	201415	What is it like to work for Amazon?	What is it like to work in an Amazon warehouse?	0
124770	201416	201417	What would happen if a category 5 hurricane hit New York City?	What would happen if a super hurricane directly hit New York City?	1
124771	201418	201419	Why was prostitution made illegal?	What would be life after those yellow and red Indian notes?	0
124772	201420	201421	Why do people with injuries feel air pressure changes?	Why do we create and listen to music? Will you listen to it for 24h 365 days a year, even when asleep?	0
124773	30681	13144	How can I make money online quickly and easily?	What is make money online?	1
124774	201422	201423	How would you describe Christianity in three words?	How would you describe God in three words?	0
124775	19127	143224	What are the best comment on friends picture?	What is the best comment for your crush’s picture?	0
124776	6307	52675	In what aspects is Hillary Clinton better than Trump?	Who is better among Hillary Clinton and Donald Trump?	1
124777	109885	31087	What rights do you have if you have been accused of a crime in the United States? How are these rights different in Singapore?	What rights do you have if you have been accused of a crime in the United States? How are these rights different in Denmark?	0
124778	110075	14318	Where can I get wonderful floor tiles company in Sydney?	Where can I found large collections of ceramic and porcelain wall and floor tiles in Sydney?	1
124779	201424	24387	Is Donald Trump circumcised?	What would be some pros and cons of Donald Trump becoming president?	0
124780	201425	201426	Is pornography an art?	Can pornography be art?	1
124781	182371	201427	How do you convert ml to kg?	How do you convert mL to lbs?	0
124782	201428	201429	What are the best Cards Against Humanity expansion packs?	What is the best Battlefield 4 expansion pack?	0
124783	201430	201431	What are the best study tips for top students?	What are some great study tips, for those who feel they do not study properly?	0
124784	201432	201433	Should I enroll at a Java or C#/.NET bootcamp at 43 yo to land a new job?	Which are the best European vacation spots?	0
124785	201434	157717	What is the best thing you have done for yourself?	What's the best thing you've ever done?	0
124786	201435	201436	What is the biggest problem in the American education system?	What is the biggest problem with the American education system in your opinion?	1
124787	201437	201438	Where can I found best quality commercial fencing products in Sydney?	Where can I found best quality horse rail fencing products in Sydney?	0
124788	201439	201440	What is Jackie Chan like in your mind?	How is Jackie Chan in person?	0
124789	201441	201442	Have you noticed an increase in hate crimes and harassment of minorities in your community since the election came to a close?	How do I understand this physics concept?	0
124790	201443	201444	Does Gary Teal think Hillary Clinton is a neocon?	What does Gary Teal think of Hillary Clinton?	0
124791	201445	201446	Can I eat raw oats directly (without cooking) with milk? Will it disturb my digestion cycle?	Are there any benefits between cooked and raw oatmeal?	0
124792	201447	201448	Why do Indian girls make their male friends their brothers?	How can a shy person make girl friends?	0
124793	201449	201450	What is a demand curve?	What is a market demand curve?	0
124794	121469	8135	What is the most embarrassing thing you have done in front of your crush?	What was the most embarrassing moment in front of your girlfriend?	1
124795	201451	201452	Are there hidden posts on Instagram?	Can you hide posts on Instagram?	0
124796	201453	201454	What is the difference between Color vs. Monochrome LED Displays?	Whats is difference between edge-lit LED TVs and direct-lit LED TVs.?	0
124797	29028	2879	What is the best laptop under the category of Rs.20k?	What is the best laptop I could buy under 20k?	1
124798	201455	201456	What is the total cost of doing an MBBS from Manipal?	What is the total expenditure for studying MBBS in Manipal University?	1
124799	201457	201458	What are the most interesting academic articles on the psychology of political ideology?	What is it like to make over 100% returns trading, and what helped you get there?	0
124800	201459	201460	Do billionaires watch television or be on Facebook like the rest of us? And can you name things billionaires don't do but we do it on a daily basis?	Hello Vishweshwaran, how many version of Mahabharat are available and which on is authentic?	0
124801	201461	201462	I feel guilty that I am not a responsible and proactive person at the age of 24. How can I correct myself?	How much money should I save as a freelancer so that as a guy I can take the full responsibility of marrying someone at the age of 30?	0
124802	201463	179321	What is the reaction between silver nitrate and magnesium?	What is the reaction between silver nitrate and water?	0
124803	13389	201464	How do you make ≠ (not equal) sign on keyboard?	How can I make a peace sign on my computer's keyboard?	0
124804	201465	201466	How can I tell a guy that he is irreplaceable in my life?	Should a guy tell another guy he likes him?	0
124805	125218	113143	What age is too old to get a medical MD?	Is 33 too old to start medical school?	1
124806	201467	201468	How can a mechanical engineer get job in IT?	How does a mechanical engineer get a job in the IT field?	1
124807	201469	201470	Does the penis shrink after castration?	How does castration affect the male body?	0
124808	30439	201471	Do you think the Black Lives Matter movement is doing well without a political leader?	Why are you not a Black Lives Matter movement supporter?	0
124809	201472	201473	What is the best sports bar in San Francisco?	What are the best cocktail bars in San Francisco?	0
124810	69578	201474	Which shrinks more and faster, steel or tungsten when liquid nitrogen is applied?	Which nipples are more good brass or steel?	0
124811	201475	201476	Is a MSc in quantitative finance still a good career option?	Is there a term for deliberately worsening the damage done by another to oneself to increase blame?	0
124812	201477	201478	MaKey Makey units are available now.  If you have one, or know someone who has one, what do you think of it?	How would one know when to use a capacitor in a circuit?	0
124813	201479	163399	Is an individual's intelligence in any way a hereditary quality?	Is intelligence hereditary or environmental?	1
124814	153851	201480	How do I reduce my lower abdomen fat?	How do I reduce stomach fat fast?	0
124815	201481	18531	How can I have a flat belly? What do you have to eat and not to eat to lose belly fat?	What are the best ways to reduce and eliminate belly, abdominal, and thigh fat?	0
124816	34022	42640	Why should we answer on Quora?	What motivates you to answer Quora questions?	1
124817	71624	23253	What airlines have flights between Leeds and Ibiza, what safety measures do you need to take into account when traveling to these destinations?	Are there any non-stop flights between Leeds and Ibiza, and what are Leeds main tourist attractions?	1
124818	201482	155167	"What would your ""one wish"" be? (Rules--See Details)"	Hypothetical Scenarios: What would you ask for if you had one wish granted?	0
124819	154298	201483	What does it mean to be a good friend?	What does it take to be a good friend?	1
124820	11013	28922	How do I erase all my answers and question on Quora?	How do you delete a question from Quora?	1
124821	201484	201485	Does listening to motivational audiotapes for a month repetitively has any impact on ones behaviour and life?	6 (3x+2)-5 (6x-1) =3 (x-8)-5 (7x-6) +9x?	0
124822	201486	201487	How does cholesterol affect the structure and fluidity of lipid bilayers?	What important cell structure do lipids form?	0
124823	17115	201488	What was the main cause of World War One?	What situations led to World War 1?	1
124824	201489	201490	Pwc cyber security interview questions?	Is there a known means by which I might alter my computer's date while retaining use of my internet browser? If so, what is it; how do I do it?	0
124825	201491	201492	What are the tips for freelance web designer jobs in UK?	Which are the tips for get freelance web designer jobs in UK?	1
124826	201493	201494	What are the best blogs about quantitative trading?	What are best sources to know about blogging?	0
124827	201495	201496	How can I decrease my metabolism?	How do I reduce my metabolism?	1
124828	201497	201498	How do you know if someones read your text message on Android?	How do I read text messages on someone's phone from mine?	0
124829	201499	150277	What are the effects of lucid dreaming?	What are the dangers of lucid dreaming?	1
124830	201500	201501	How does evolution impact biodiversity?	How did the theory of evolution impact and/or change taxonomy? What did it help us learn?	0
124831	201502	53853	I don't know my email I signed up when I use Google plus how can I delete I have the url number?	How can I retrieve my WeChat account if I've forgotten my password, don't have QQ/email linked, and lost my phone?	0
124832	201503	201504	What is the advantage of fuel injection over a carburetor in a car engine?	What's difference between fuel injection and carburetor motor cycle. Which one is better for long ride?	0
124833	201505	201506	What are some good ways to annoy Filipinos?	What are some good ways of annoying Chinese people?	0
124834	54875	201507	How do I ask this girl to hang out?	Does the guy always have to ask the girl to hang out? Why or why not?	0
124835	201508	201509	How's studying psychology in University in london?	Donald Trump thinks strong women like his daughter should just quit if they are sexually harassed on the job. Is that what strong women should do?	0
124836	201510	201511	How does an interjector asks a question?	How do you ask a question?	0
124837	201255	54836	What do you think of the new MacBook Pro that was released late 2016? Is it worth buying?	Is MacBook Pro 2016 worth it?	1
124838	201512	201513	Who was the best sensei amongst Kakashi, Tsunade, Asuma, Kurenai, and Guy?	Who is Neko-sensei?	0
124839	201514	166738	What is holiness?	What's the holiness of God?	0
124840	60944	151811	How can I get into a top university?	What things do we need to get into the top 10 universities of the world?	1
124841	201515	201516	What are the best ways to avoid frustration?	What should we do to avoid frustration?	1
124842	120982	201517	Who is more likely to be the President of India in 2017?	Who will be the President of India in 2017?	1
124843	201518	201519	Who is the current health minister of India?	Does India deserve a politician like Arvind Kejriwal?	0
124844	201520	201521	Is love is waste of time?	Is love a waste of time?	1
124845	153026	201522	How do I measure the speed of an aeroplane?	What is the average speed of an aeroplane?	0
124846	201523	201524	Is Windows 10 better than, Windows 7 and Windows 8/8.1?	Which is the best version Windows: Windows XP, 7, 8, 8.1 or 10?	0
124847	198893	13417	What will happen if somehow the earth stopped rotating and revolving at the same time?	What would happen to us humans if the earth suddenly stopped spinning?	1
124848	201525	201526	What are the best ways to meet boys?	What's the best way to meet boys?	1
124849	82330	30722	What is the purpose of your life?	What is the meaning of life?	0
124850	22568	201527	Who is the most corrupt indian politician?	Who is the most corrupt politician in India?	1
124851	201528	201529	Food: Can you eat canned salmon right out of the can?	Is it safe to eat canned salmon?	0
124852	201530	187748	Do Pakistani acknowledge their Hindu ancestry? Do they think that their great-grandfathers were Hindu?	Why are you a Hindu?	0
124853	201531	114946	Do Muslims think non-Muslims are going to hell?	Islam: According to islam, are all non-Muslims going to hell?	1
124854	201532	201533	What is ad customizer?	What is Custom ads?	0
124855	201534	201535	What is it like to be rejected?	What does it feel like to be rejected?	1
124856	201536	201537	What are some holidays and festivals in Kazakhstan? Do they celebrate Christmas?	What are some holidays in Kazakhstan?	1
124857	201538	201539	What is the best website to sell nude photos?	What's the best paying website to sell nude photos?	1
124858	201540	110985	Is CA course worth doing these days?	What are the best courses to pursue along with CA?	0
124859	201541	201542	Where was game 6 of the 2011 World Series held and what were the teams that played?	Where was game 6 of the 2010 World Series held and what were the teams that played?	0
124860	201543	201544	"Do I need the ""Annexure I"" affidavit if I'm applying for re-issue of my passport after a major change of name?"	I have planned a visit in England. I'm from Greece and all I needed was ID until now. Will I need to apply for a visa or a passport after the Brexit?	0
124861	201545	201546	How can you overdraft a Wells Fargo debit card?	How do you get a Wells Fargo debit card?	0
124862	135454	191130	How do I create a website with pancake.io?	How do I create and design websites?	0
124863	56674	201547	Does it hurt to die of a sleeping pill overdose?	What is it like to die from a tylenol overdose?	0
124864	8238	17868	What is the best film of 2016?	What are the best movies of 2016?	1
124865	201548	201549	If someone were to have their hand amputated and immediately cauterized, how long would they have to survive without medical attention?	If someone fell on the floor, hit their head, bled and fell unconscious and immediate actions were taken, how long would it take for them to recover?	0
124866	163516	183976	What are some of the best photos taken from a cell phone?	What are the best photos taken by phone?	1
124867	201550	201551	Where can I found quality residential and commercial horse fencing items in Sydney?	Where can I find a range of horse fencing products and services in Sydney?	0
124868	201552	201553	What happens to mail that is missing an apartment number?	What happens when a regular mail item is placed in a FedEx drop off box?	0
124869	201554	201555	If I had an unknown abscess (which later healed), pain (which then subsided) and a dead nerve, how would the dentist know to look for a dead nerve?	"If a person is cryogenically frozen now and is ""revived"" 200 year later in 2216, how they would adapt to the new life?"	0
124870	201556	201557	Which is better, Omegle or Chatroulette? Why?	What is your review of Omegle?	0
124871	201558	201559	How do you keep a track of your meetings?	What is the best way of keeping track of meeting minutes?	0
124872	21738	117396	What hotel in Allahabad would be safe for unmarried couples, without the harassment of police, hotel staff, and moral police?	What hotel in Agra would be safe for unmarried couples, without the harassment of police, hotel staff, and moral police?	0
124873	201560	201561	What happens if we cancel passport appointment?	What is the procedure to cancel passport application after appointment?	0
124874	201562	201563	What are candles made of?	How are candles made?	1
124875	201564	201565	What are good open source projects to contribute and improve my math and programming/algorithmic skills?	What are some algorithmically-involved open-source projects on GitHub?	0
124876	199601	187447	What are the possible job opportunities after MA economics?	What are the jobs for me after completing master's in economics?	1
124877	201566	201567	What should one take to deal with the stomach pain of lactose intolerance?	Is there any treatment for lactose intolerance?	0
124878	201568	201569	Why is the deadlift called “deadlift”?	Why are deadlifts called that?	1
124879	18356	201570	Why are birthday consider so special?	Why are birthdays so special?	1
124880	201571	201572	How are the opportunities for software testing in Australia?	What is software testing constraints?	0
124881	201573	201574	Is there a framework for auditing social media?	Is there a template or a framework for social media audit?	1
124882	201575	201576	What do debt collectors do?	How can I stop debt-collecting agencies from threatening me?	0
124883	17291	201577	Which are the safest cities in India?	Which is the safest city in the U.S?	0
124884	201578	201579	What is the best way to make a woman happy?	What makes a woman happy?	0
124885	201580	63401	Why can't transformers transform DC current?	Why is transformer rated in kVA and not in kW?	0
124886	201581	201582	My Petition for I_129 (H1B) case was approved on August 6 2013, I just wanted to know till when this petition is valid?	I have an approved H1B Petition filed from company A. I have not yet traveled (I am in India) and its not yet stamped. Is it possible to use the approved petition for visa stamping for another employer? If yes- what is required and how can it be done? Can I get a contact who can help with this?	0
124887	201583	196867	How do I stop an addiction?	What is the best way to overcome an addiction?	0
124888	19251	43524	How do I delete an Instagram account if I don't know the email or password?	How do I delete my Instagram account when I have forgotten my password and the password to my email?	1
124889	201584	201585	What is nanotechnology?	What is the future of nanotechnology?	0
124890	201586	201587	How can you get Kik on an iPad?	How do I get Kik on iPad?	1
124891	45489	178	Which is the best laptop for gaming under 60k INR?	Which is the best gaming laptop under Rs 60000?	1
124892	9632	86061	Compare the powers of President and Prime Minister of India?	In practice, is the president or the prime minister the supreme power in Indian democracy?	1
124893	201588	201589	If Black people want segregation, then WHY should they expect white people to care about their problems?	If Jesus was supposedly white, then why would there be black, brown and yellow people?	0
