id	qid1	qid2	question1	question2	is_duplicate
124000	27180	200335	Being new to higher-ed, Univ, how would you choose to learn about CRISPR/Cas9? Where would you go for a fast, good, hands-on and immersive program?	If you had to supply a legacy for an event, how would you go about it?	0
124001	18420	51786	Who will win the 2016 presidential elections?	Who do you think is going to win the 2016 presidential election?	1
124002	200336	200337	Why does cast iron cast in soil?	Why can't cast iron be casted?	0
124003	200338	200339	"What is a ""healthy diet""?"	What can I eat and stay healthy?	0
124004	200340	200341	How can one cope with the loss of a loved one?	How did you cope with the loss of a loved one?	1
124005	200342	200343	Assuming I have an ISO of windows 7, and I am making a new computer, how can I make a bootable drive to get windows 7 on that computer?	I want to install a Windows 7 operating system from a bootable pendrive to a new laptop,how should I make a bootable pendrive?	1
124006	200344	200345	When I start pretending I'm ain't hurt, it In turn Hurts alot? Why?	How would the world react if a peaceful country like Iceland or New Zealand were invaded/attacked?	0
124007	200346	200347	How can I find the active .onion links for the darknet or darkweb?	What would be your advice and road map to someone who wants to make money only through stock market based on technical analysis?	0
124008	200348	200349	Can LLC issue additional membership interests and member of the same LLC to sell his share in the same day?	What is an article of organization for an llc? What does it mean if $275.00 min. for up to 275,000 shares; ($100 for each additional 100,000 shares)?	0
124009	200350	190185	Will Khan return in the upcoming Star Trek movies?	Do you think Jaylah will be in the next Star Trek movie?	0
124010	70562	200351	What is one of the best feelings in the world?	What are the best feelings to be experienced in life?	1
124011	45535	6804	How can I stop the urge to masturbate?	How should I stop masturbating?	1
124012	175677	15289	What are the best sites for downloading movies?	Which best sites to download movies?	1
124013	200352	187416	How can I exchange 500 and 1,000 Indian rupee notes in the USA?	How can I exchange Rupee notes for dollars in USA?	1
124014	854	1039	What can I eat every day to be more healthy?	Is it healthy to eat one chicken every day?	1
124015	200353	200354	What are your ideologies?	What was L's ideology?	0
124016	200355	200356	What is Quora etiquette?	What are Quora's unspoken values and points of etiquette?	0
124017	200357	200358	What is the best Microsoft certification to get in 2016?	Which is the best place where one can get free certification for IFRS?	0
124018	61234	200359	What are the mysteries of the Bermuda Triangle?	"What is the ""Mysterious Bermuda Triangle""?"	1
124019	200360	200361	What are the basic winning strategies in Texas Hold'em?	What are some basic strategies for Texas Holdem?	1
124020	57680	14212	What is the best investment options?	What's the best investment?	1
124021	200362	200363	Which are the best news website in India?	What are the top best news websites which provide latest news in India?	0
124022	200364	200365	Can you drink water after a wisdom tooth extraction with an IV sedation?	Is it patent infringement if my presentation of the result is different? (See description)?	0
124023	200366	200367	How do I deal with being a toxic person?	How do I deal with a toxic person?	1
124024	101481	92189	How should I concentrate on studies?	How do I concentrate when studying?	1
124025	200368	200369	Why are bromine and mercury liquids at room temperature?	Why is mercury a liquid at room temperature?	0
124026	200370	22226	Who would win in a fight between a fox and a cat?	Will a fox kill a domestic cat?	0
124027	74057	92860	Which is the best institute for preparing for GMAT in Delhi/NCR?	What are the best GMAT coaching institutes in Delhi NCR?	1
124028	200371	200372	Meteorology: How far in advance can the weather be realistically predicted?	What is the weather like in October in Rome?	0
124029	200373	200374	How many suppliers, including secondary and third party suppliers, do car manufacturers use to build one vehicle?	Who are the leading Manufacturer & Supplier of Flange Guards?	0
124030	16235	59779	What are the advantages of demonetisation?	How demonetisation affected tourist?	0
124031	200375	200376	How reliable are BMW 2011 3-series (hardtop) convertibles? Does the mechanism of the top falter often, and is it very expensive to fix?	Is buying a $16k or less BMW 3 series a bad idea?	0
124032	178269	200377	How did Life (2017 movie) get greenlit? What's the backstory of how the movie got made?	How did The Mummy (2017 movie) get greenlit? What's the backstory of how the movie got made?	0
124033	200378	200379	Will I get arrested if I watched porn under 18?	Can you get arrested for watching porn if you're under 18?	1
124034	200380	200381	Is Noma really the best restaurant in the world?	Why is Noma the best restaurant in the world?	1
124035	101414	21549	1000 and 500 notes have been banned in Indian. What will be the short and long term impact of this?	What will be the effects of demonetisation of 500 and 1000 notes on the Indian economy?	1
124036	200382	200383	Where can we get the best female Escorts in Surat?	Where can we get the best female Escorts in Bangalore?	0
124037	200384	200385	What Is the right direction to place Pooja Mandir? Where can I order a good one?	What are the most exquisite places in the world where one can get a good MBA degree from?	0
124038	200386	165498	What makes you proud to be an engineer?	What makes you proud?	0
124039	200387	200388	Is Amity Uuniversity a good option for an MSc actuarial?	What would happen if the gravitational field of the earth would be variable in one point?	0
124040	200389	200390	How can I get over/let go of something or someone?	Love Story: How can you let go of something you never had?	0
124041	33088	200391	Which is better? Top loading washing machine or front loading washing machine.	Which fully automatic washing machine is better, front load or top load and why?	1
124042	200392	200393	Why is the plural of moose not meese?	"If the plural for goose is geese, then why isn't the plural for moose ""meese""?"	1
124043	200394	200395	"How much ad revenue could a small clickbait ""news"" site generate?"	How much revenue is WhatsApp generating?	0
124044	200396	2069	What hotel in Wayanad Hill-station would be safe for unmarried couples, without the harassment of police, hotel staff, and moral police?	What hotel in Dehradun Hill-station would be safe for unmarried couples, without the harassment of police, hotel staff, and moral police?	0
124045	189354	200397	My ex-boyfriend still calls me after his marriage and says that he still loves me. Is this normal? Does it make any sense?	Ex-Boyfriends and Ex-Girlfriends: It's been 6 months and he still won't talk to me, still not ready to be friends. What's up with this, does he hate me or love me? Will he ever talk to me again?	0
124046	200398	200399	What are sources on the Internet where I can find HR related info on IT companies?	How can I tell my crush that she can abuse me any day of the week and it's fine?	0
124047	200400	200401	"Would you rather ""good"" things happen or ""interesting"" things happen?"	Would you rather have good things happen or interesting things happen?	1
124048	200402	200403	"What is the meaning of the song ""White Rabbit"" by Jefferson Airplane?"	"What's the meaning behind the song ""Nights In White Satin"" by The Moody Blues?"	0
124049	183702	73423	Is there any way to achieve immortality?	Do you think mankind will ever achieve immortality?	1
124050	185509	200404	How do l hack wifi password?	How do I hack a wifi?	1
124051	200405	200406	What is the social contract theory?	What is the social contract theory about?	1
124052	200407	200408	What is Bayesian game theory?	What are some interesting game theory projects?	0
124053	200409	200410	Did Arya not finish The Hound off because she wanted him to suffer before he died or because she cared?	Why didn't Arya Stark kill Sandor Clegane?	0
124054	84743	114094	How do I personal message on Quora?	How can I send a private message through Quora?	1
124055	200411	200412	Functional programming is useful programming paradigm for solving algorithm problems?	"How do I translate ""modern man's hustle"" into Latin?"	0
124056	200413	200414	How do I learn how to drive a boat?	How did you learn how to drive?	0
124057	200415	200416	How good is the Nestle project in Tech Mahindra?	How do I Use mobile wallets?	0
124058	200417	200418	Will GST affect the price level in India?	Will GST effect the price level in India?	1
124059	143294	52887	What is the best way to block a number when calling someone?	How do you call someone if they have blocked your number?	0
124060	200419	200420	Which is a better version, Xamidea or Xamidea simplified?	Which is better Xamidea or Arihant for class 10?	0
124061	200421	200422	Exist is to coexist?	What is the importance of social research when developing a scientific report?	0
124062	200423	200424	How do I start a career as motivator?	How can I start my career?	0
124063	200425	175382	What are good examples of incongruity in movies, books, or other pop culture?	What are some movies that have a bad boy who falls for a good girl?	0
124064	200426	200427	I am an IT services company employee for 5 years. Is it too late for me to switch to a product based company ?	What is the best way to switch from a service to product based IT company?	0
124065	200428	23111	What is the best free dating website?	What is the best free online dating site?	1
124066	200429	200430	What are the astrological remedies to get married?	What is the basis of astrological remedies? Have they been mentioned in the ancient Vedic texts?	0
124067	200431	200432	Is it okay to use sharelatex to type an IEEE paper?	Is it necessary to write code on IEEE papers?	0
124068	112868	187336	Whats the better phone, iPhone 7 or Samsung S7?	Which is better: iPhone 7 or Samsung Galaxy S7?	1
124069	200433	200434	Bhubaneswar: Why is Khandagiri square an accident prone area?	What is Marisa Tomei's middle name?	0
124070	200435	200436	Can I control subconscious mind?	How can we control our subconscious?	1
124071	200437	54207	Why do some Indian states have a bicameral legislature whereas the rest have unicameral legislature?	What makes India a very different country from rest of the world?	0
124072	200438	16900	How many hours of sleep should a college student need?	How many hours should we sleep?	0
124073	200439	200440	What can we do to increase our concentration?	What are best tips for concentration?	1
124074	3595	134237	How do i lose weight?	What is the ideal way of loosing weight?	1
124075	120172	200441	Why did Kobe Bryant change his number from 8 to 24?	"When Shaq left the Lakers in 2004, he said that Kobe Bryant ""doesn't make his teammates better."" Does this opinion still ring true to present day?"	0
124076	104134	200442	The best site to download free ebooks?	What is a good site for free ebooks?	0
124077	103219	200443	The day before yesterday, I was 25 years old, and next year I will turn 28. How is it possible?	Mathematics: The day before yesterday John was 11 years old. Next year he will be 14 years old. Explain how this can happen?	0
124078	200444	81659	What is the integration of e^√x?	What is the integration of e^(x^2)?	0
124079	200445	200446	How do I answer what my parents think of me if asked in an interview?	How do I answer if at an interview the prof asks me why I want to do an MTech in VLSI?	0
124080	200447	200448	My age is 25 and I am taking eltroxin 100mcg 21/2 dosage/day and now my TSH level is 0.01. What should I do?	What should I do as I get demotivated knowing aspirants at age 21-25 clear UPSC and I am 29 GEN and trying my first attempt now?	0
124081	200449	200450	"What does it really mean to be ""blessed""?"	What does it really mean to forgive?	0
124082	200451	200452	Why doesn't India upgrade its WWII army rather than buy costly ships and jets?	Why didn't India use the IAF in the Indo-China War?	0
124083	200453	200454	What is the scope for MHA after MBBS?	What is the scope of MBBS?	0
124084	200455	170166	What is the service like with Comcast?	Why is Comcast service so bad?	0
124085	20633	200456	Why does the same person always appear on top of the likers on Instagram pictures?	What does top mean on instagram?	0
124086	200457	200458	What is the most difficult single measure of music you have played, and what is difficult to you about it?	What is the difficult/ most difficult thing for you to do?	0
124087	18420	43413	Who will win the 2016 presidential elections?	Who will win the 2016 United States Presidential election: Trump or Clinton?	1
124088	200459	200460	If I hacked someone's Facebook account, but did not misuse it in anyway, will it still be considered a crime? What could be the penalties?	Can someone's Facebook account be easily hacked by a normal person?	0
124089	200461	200462	I tell my crush that I just broke with my girlfriend then I accidentally told her I like her, What should I do now?	My boyfriend broke up with me and 2 days later got engaged,how can he do this to me?	0
124090	200463	200464	Why is Ponyo Whining in the anime?	Why is Ponyo whining?	1
124091	35285	200465	How long does it take to get tier 2 visa after biometrics?	Me and my wife are on a Tier 2 visa in the UK. What is the fastest way to get a citizenship for our child?	0
124092	191225	88601	How can I get the funding for my startup without revealing my idea?	How can you get VCs to fund you if you just have an idea?	1
124093	146555	75262	How should I prepare for my NTSE exam?	How should I prepare for ntse?	1
124094	200466	200467	Is Warsaw better than Cracow when it comes to nightlife?	We are a group of six male students. Should we go to Warsaw or Cracow to have a good time?	0
124095	152202	35448	What would happen if Pakistan goes to war against India?	What will happen if there is a war between India and Pakistan?	1
124096	792	104911	What is a good song to lyric prank your best friend?	What are some good songs to lyric prank your boyfriend?	0
124097	99302	13027	How did the Big Bang occur?	What caused the Big Bang?	1
124098	200468	200469	What are the differences between excitatory and inhibitory neurons in the brain?	Are there more excitatory neurons or inhibitory neurons in the brain? Why?	0
124099	200470	200471	What are the best countries to immigrate for Indian?	What foreign countries are good for Indians to immigrate to?	1
124100	200472	200473	What should I do when my mom tries to defame mein front of my relatives?	 My mom won't listen to me when I tell her over and over that I am not transgender. What should I do?	0
124101	200474	42953	How do I add USB 3.0 port in a laptop without expresscard slot?	Can I use a USB 3.0 device in a USB 2.0 port?	0
124102	174007	200475	What are the health benefits of eating corn?	What are the health benefits of eating beans?	0
124103	200476	200477	What is the difference between Linux Mint mate and cinnamon?	"Is there a good comparison between ""Cinnamon"", ""Xfce"", ""KDE"", and ""MATE""? Which one should I choose?"	0
124104	200478	200479	Is it a good time to buy pounds now?	Is this a good time to buy the pound?	1
124105	200480	200481	How does a small issue of drinking water negatively affect?	How does a substance's polarity affect its solubility in water?	0
124106	200482	200483	Why are muslims protesting against honking, but not against loudspeakers blaring their prayers on mosques?	Muslims in India raised their voices against Israel for killing Palestinians, who have conducted acts of terror against Israel, but why didn't Indian Muslims protest when thousands of peaceful Hindus and Sikhs were massacred in Kashmir?	0
124107	200484	200485	Can I bring sex workers at my office in BNP Paribas London discreetly?	Can I stay at my friend's place in London without a transit visa while flying from India to US via London?	0
124108	200486	200487	How can I deal with my toxic mother?	How do I deal with my toxic mother?	1
124109	100396	200488	"What does the phrase ""my regards to your family"" mean?"	"What does ""turned out"" mean this phrase?"	0
124110	131973	29178	Is downloading from torrent illegal in India?	Are you still using torrent in India? Can I be arrested for using it?	1
124111	9739	200489	How do I get rid of scalp acne?	Is there any treatment for acne?	1
124112	15615	200490	What is it like to be a straight man who had had sex with another man?	As a gay man, have you ever had sex with a straight man?	0
124113	200491	200492	How do I find if a journal is Scopus indexed or not?	What is meant by Scopus indexing and how do I know if a conference or journal is Scopus indexed?	1
124114	200493	200494	How did people benefit from the Agricultural Revolution?	If teleportation was somehow possible, how would simultaneity be affected?	0
124115	200495	200496	Will I become a billionaire as a black man in America?	Can I become a billionaire as a black man in America?	1
124116	16924	135589	Why is my puppy afraid of cats?	Why is my Black Lab/Pitbull mix puppy afraid of cats?	1
124117	32703	200497	What are some great side dishes for chicken and rice?	What are some great side dishes for cottage pie?	0
124118	51866	200498	Is it true that the Vatican has the highest crime rate per capita of any country on earth?	Why is Vatican City a country?  Has any stronger country tried to occupy it?	0
124119	200499	200500	What is better pre EMI or interest before possession of house?	Can we listen to a guided voice or light music during Meditation? How to control thoughts and focus only on breathe?	0
124120	200501	200502	How do I learn Python for scripting?	How do I learn Python?	0
124121	200503	200504	What are some good Frank Sinatra stories?	What are the best Frank Sinatra songs?	0
124122	200505	200506	How do artificial hearts fail?	How does an artificial heart work?	0
124123	200507	200508	What is difference between Trade, commerce and Business?	What is the difference between business, trade and commerce?	1
124124	200509	200510	What is the best lg tv service center in Hyderabad?	How can we find an LG TV service center in Hyderabad?	1
124125	200511	200512	Is there a chemical formula for clay? If so, which one is it?	What is the chemical formula for clay?	1
124126	57562	108634	How was the KVPY SA 2016? What is the expected cutoff?	How was KVPY SA 2016 ? How does it compare to previous year papers? What is your expected cutoff for it?	1
124127	194441	200513	I had a short period, not bright but more of a ruby red, a week later I have dark brown bleeding and mild cramps. Could this be implantation?	Is my girlfriend pregnant? We had unprotected sex but I didn't ejaculate inside of her and then a week later she got her normal period.	0
124128	189222	175800	Have you ever been in a traffic accident?	Have you even been into a Car accident? What was the reason for the accident?	1
124129	200514	200515	Does the band Tool have any love songs?	What is your review of Tool (band)?	0
124130	132175	140808	What are some good Malayalam books to read?	Can you suggest 5 recent malayalam books to buy?	1
124131	200516	200517	What does 925 stamped on gold mean?	"What does the phrase ""all that glitter is gold"" mean?"	0
124132	200518	200519	What is the best way to build a fortune over 10 years from scratch?	Self respect comes only when someone ask your caste but not when asked while filling job application form ?	0
124133	200520	200521	Which board is easier to score the ICSE or the CBSE?	Which board is better, CBSE or ICSE?	0
124134	19134	123240	How do I block someone in Quora?	How do you block people on Quora?	1
124135	200522	200523	What is an open call audition?	What are open auditions?	0
124136	200524	165584	What is sanity testing and regression testing?	What is the purpose of software testing?	0
124137	200525	200526	Is it healthy to eat apples every day?	Is it unhealthy to eat bananas every day?	0
124138	200527	200528	What are your expectations with 2017?	What are your expectations for 2017?	1
124139	60406	200529	Can someone tell if you've been logging into their Instagram account?	Can you track someone that has logged into your instagram?	0
124140	200530	200531	Who is the worst minister in modi cabinet?	Who are the best 5 ministers in Modi cabinet?	1
124141	200532	200533	I am a rational thinker, how can I think more with my emotions or my gut instead of my mind?	I don't want to live anymore. I don't have any motivation to live. My personal relationships have been always unfulfilling. My dogs are the only one who love me truly. How should I stop negative thoughts to come in my head?	0
124142	200534	73269	Are most US police officers fat?	Why are police officers so fat?	0
124143	200535	60543	What are the everlasting dialogues used in mainstream Hollywood movies?	What are some of the most epic dialogues in Hollywood movies?	0
124144	200536	200537	What is the study process to become the CEO of Lamborghini?	How do I become the CEO of Infosys?	0
124145	93198	23982	Do we know if there is life on other planets?	Is there life on other planets?	1
124146	200538	13886	What is the population of Goud Saraswat and Chitpavan Brahmins?	Which communities and caste groups (apart from Pandits in Kashmir) are considered to be Saraswat Brahmins?	0
124147	200539	200540	What is the tax rate you pay on game show winnings in the US?	Do game show contestants pay tax on their winnings?	0
124148	200541	200542	How many robotics startups are there in Pune? What's some information about them?	How many algorithms is a humanoid robot using and what is responsibility of each of them?	0
124149	34164	200543	What should I do if my best friend is avoiding of me and doesn't talk to me anymore..?	What if my best friend doesn't want to talk to me anymore and thinks am annoying?	0
124150	77872	92490	Why is Premarital sex is taboo in India?	Why sex is a taboo in India?	0
124151	128487	200544	How do I become focused on school?	How can I focus better in school?	1
124152	200545	200546	In what ways (projects, initiatives, new features) is Facebook actively trying to improve public safety?	I got AIR 29 in the BTech exam at Cluster Innovation Centre. Is there any chance that I get selected? What are the previous years' closing ranks?	0
124153	4121	23231	Why is Saltwater taffy candy imported in Japan?	Why is saltwater Taffy candy imported in Canada?	1
124154	37695	94616	How do I start up a new cafe?	How do I start a cafe?	1
124155	200547	200548	I want to settle in a job related to CATIA V5. How good are the prospects in this field?	I'm an ECE student. I want a core job. What is an important field to get a good job?	0
124156	200549	200550	Where can I download hindu paper?	Where can I download OU BLISC previous years question papers?	0
124157	200551	63545	What is the definition of tone of the movie?	What is the best movie you have ever seen?	0
124158	200552	200553	What motivates you to pursue your passion? And what is your passion?	Who inspired you to pursue your passion?	1
124159	200554	200555	How do you define a true leader?	How would you describe a good leader?	0
124160	200556	200557	Why are Sichuanese girls so pretty?	Are Australian girls pretty?	0
124161	200558	200559	How do I bowl fast with a tennis ball?	How high did the bowling ball go, in Flubber?	0
124162	200560	200561	What cheese is good to substitute for manchego cheese?	What's a good blue cheese pizza?	0
124163	18366	489	Is at least the potential energy of vacuum energy and dark energy infinite?	If dark energy is created with expansion can infinite of it be created?	1
124164	75894	6721	How will our economy will be affected by demonetizing Rs 500 and Rs 1000 notes?	What are the economic implications of banning 500 and 1000 rupee notes?	1
124165	200562	200563	Yoshua Bengio: What is the motivation of using an RNN to do classification when it is not a problem that involves sequences explicitly?	How can one come up with new deep learning architectures?	0
124166	200564	200565	Which are the best motivational books in Malayalam?	What are some of the must-read books in Malayalam?	0
124167	200566	200567	How long will it take until Republicans remove Trump from office?	How long would it take Trump to take down the clean energy tax breaks?	0
124168	200568	117390	Where does Quora draw the line on freedom of speech?	How does Quora feel in regards to freedom of speech?	1
124169	10859	21807	How can I specifically improve my English?	How can l improve my English？?	1
124170	200569	200570	How do I dye bleached blonde hair red?	How do you dye dark hair red?	0
124171	200571	200572	If I delete rice, milk, and sugar from my diet, can I lose weight?	How do I make a diet to lose weight?	0
124172	200573	200574	What are the best foods for natural weight loss?	What foods are great for weight loss?	1
124173	200575	168222	How do I bake cake in microwave?	Is it possible to bake a cake in a microwave oven?	1
124174	35040	67069	What is the reason behind firing of Cyrus Mistry from TATA group?	Why did Tata Sons removed/sacked Cyrus Mistry as the chairman?	1
124175	200576	200577	Do teachers know when their students admire them?	Do teachers know when their students don't like them?	0
124176	200578	200579	Is Christian Grey black?	Is there any man like Christian Grey (from the novel Fifty Shades of Grey)?	0
124177	200580	200581	If I like Hong Sang Soo, what other Korean directors/films will I like?	I want to start watching Korean drama and movies. Where should I start?	0
124178	113592	67592	What is the dark side of your country?	What is your dark side?	0
124179	200582	200583	What are the consequences, both mentally and physically, of not having sex?	What are the implications of not having sex?	1
