id	qid1	qid2	question1	question2	is_duplicate
200000	301631	187418	Can Pakistan hit Indian air craft carrier in Arabian sea in case of a war between two nations? PS: PAF once breached US carrier defences in exercise.	Can Pakistan destroy an Indian aircraft carrier during a war?	0
200001	301632	301633	I really like this guy. He has a girlfriend, but we talk all the time and it seems like he flirts with me. How do I get him to like me?	Should I continue talking with this guy and wait to see if he chooses me over his current girlfriend who cheated on him? What should I do? Please help!	0
200002	33303	29594	Which is best book for Java?	Which is the best book for java programming?	1
200003	301634	158271	Is it possible to install Windows 10 for free even after July 29th 2016 and use it even without activation?	Is it illegal to use windows 10 without activation?	0
200004	301635	14707	Who are service providers of IndianMoney.com?	What are the services provided by PcKure.com?	0
200005	169796	301636	Do nice guys finish last?	Is it really true that nice guys always finish last?	1
200006	301637	188353	How can the world run out of water?	Why is the world running out of water?	0
200007	301638	275748	Why hair becomes white?	Why does the hair become white?	1
200008	7338	141154	What is the quickest way to get meth out your system?	How do I get meth out of my system faster?	1
200009	103810	15236	How do I overcome depression?	How do I overcome clinical depression?	1
200010	301639	301640	What is faminism?	What should you do in a famine?	0
200011	301641	301642	How do I download Game of Thrones?	Which is the best site to download game of throne?	1
200012	134723	280955	What are good landing page conversion rates?	What is the best way to improve conversion rates on landing pages?	0
200013	301643	301644	Is anybody there who could work on ANSYS for an assignment?	Is anybody there who could work on ANSYS software for an assignment?	0
200014	232573	2082	Instagram (product): How do I quickly unfollow people on Instagram?	How do I see people I unfollow on Instagram?	0
200015	273102	217960	What type of boys do girls prefer as their boyfriends and why?	What type of boys do girls prefer as their boyfriends?	1
200016	301645	301646	Why don't we hear about Zoho very much?	Is Zoho a reliable server?	0
200017	122817	268805	What is the difference between prokaryotic and eukaryotic cells?	What are prokaryotes and eukaryotes?	0
200018	38497	301647	Do girls like fat men?	Do some men like bigger women?	0
200019	301648	301649	What is the difference between Alprazolam and Etizolam?	What is the root of addiction? Why do some people become addicts while others don't?	0
200020	301650	301651	What is the black in the middle of a banana?	How do you make banana juice?	0
200021	301652	301653	What are some tips on making it through the job interview process at E.W. Scripps?	What are some tips on making it through the job interview process at Scripps Networks?	0
200022	56332	4040	What are your views on demonetization of 500 and 1000 rupee notes by the Modi Government?	Why Narendra Modi banned 500 and 1000 notes in India?	1
200023	301654	301655	Where did the energy from the big bang/singularity come from?	Where did the energy come from to ignite the Big Bang?	1
200024	77478	301656	How do I get my money back from an we chat scammer?	Will I be getting my money back from a scam?	0
200025	177845	301657	Where do I get second hand books online in India?	Where can I get second hand books for a cheaper price in Jamnagar?	0
200026	301658	301659	How do you understand the following sentences?	How do I understand the following sentence?	0
200027	126089	163739	How many atheletes from India have won medals in the Olympics to-date?	How many medals India won in Olympics?	1
200028	301660	301661	Who invested in Uniccos.com?	Who invested in Homing.com?	0
200029	301662	301663	Did Frasier prove to be more successful than Cheers?	"What are the narrative connections between ""Cheers"" and ""Frasier""?"	0
200030	301664	301665	Do Quorans keep answers/ incidents in their mind and then search a suitable question for their life incidents/answers?	What is the psychological meaning of someone who is not afraid of dying?	0
200031	301666	301667	Why are the lightsabers different colors?	Why do lightsabers have different colors?	1
200032	301668	301669	"What is meant by ""pending shipment""?"	What does pending mean in a bank?	0
200033	301670	301671	"What does ""debited to your card account"" mean?"	Can I receive money into my bank account through my debit card?	0
200034	301672	108734	Is there really a cure for premature ejaculation?	How do you cure premature ejaculation?	0
200035	136427	301673	Are you allowed to bring bikes to campus when you live off-campus when you are studying at IIT Bombay?	Are you allowed to have bikes when you live off-campus when you are studying at IIT Bombay?	0
200036	301674	301675	How many calories do you burn per kilometre walked?	How many calories do we burn walking 1 km?	1
200037	301676	301677	How much heat is required to kill bacteria in food?	Do onions kills good bacteria in our guts?	0
200038	3274	301678	Is ranch dressing good for you?	What is ranch dressing made of?	0
200039	301679	301680	Can I deposit money at a HDFC branch which is not my home branch?	Can I deposit money at an axis branch which is not my home branch?	0
200040	301681	301682	How fast does a computer read?	How fast is quantum computer?	0
200041	301683	301684	How can I learn how different engines work?	Startups: How can I work for/contribute meaningfully to a start-up without being an engineer/learning to code?	0
200042	212495	301685	How do I find VTU old semester results?	I am in bit bangalore of 1st semester. What is the procedure for changing of college under vtu?	0
200043	301686	301687	What do Emiratis think of Scottish People and Scottish Independence?	What do Russians think of Scottish People and Scottish Independence?	0
200044	301688	301689	Is a pass in the 2nd year foundation course in Annamalai University equivalent to a +2 course?	Which courses are best to choose after 2nd year PUC in the field of biology?	0
200045	301690	224286	What are the best companies to work for?	Which is the best company to work with?	1
200046	301691	301692	Where is the best place to get great but cheap tattoos?	Where are the best places to get tattooed cheaply?	1
200047	301693	301694	As an Indian Hindu, what do you wish Muslims knew?	As an Indian Hindu, what do you wish Indian Muslims knew?	1
200048	301695	301696	How can I prepare for GATE in Metallurgical and Materials Engineering?	How do I start preparing for GATE Metallurgical and Materials Engineering?	1
200049	301697	301698	Why do I feel bad if nobody recognizes/appreciates the things that I do?	I lose all hopes from life, career and relation. I feel depressed and there is nobody who appreciate me. What should I do?	0
200050	301699	30718	What are some good jobs for civil engineer?	What could be the best job for a civil engineer?	1
200051	301700	301701	"Why does ""of"" mean multiply in math?"	"What does ""LHS"" mean in math?"	0
200052	33292	56903	Why did Indian government scrap Rs 1000 and 500 note and instead is introducing Rs 2000 note?	Why do you think Indian government has demolished RS 500 and RS 1000 notes?	1
200053	23039	295627	What is the meaning of PQWL, RLWL, GNWL, RLGN, RSWL, CKWL, in a railway waiting list?	What is the meaning of GNWL65/WL27, and what are the chances of getting these seats confirmed?	0
200054	301702	301703	Why does my dog cry when he eats and his penis comes right out then he has to empty his bowels?	My dog becomes aggressive right after he completes his evening meal and is about to go for his poop. He comes to bite anybody around. Why is that so?	0
200055	301704	18074	How can I get MIT lectures?	How can I get admitted to MIT?	0
200056	301705	301706	How is HBTI Kanpur for a B.Tech in CSE? How are the placements? Coding culture and crowd over there? Is it comparable to NIT's?	How is the coding culture at NIT Jamshedpur?	0
200057	301707	301708	What are the hardest words in English for native Chinese speakers to pronounce?	"Do English native speakers put a ""w"" after ""do"" when pronouncing ""doing"" and other words like ""tuition"", ""fluctuate"", etc.?"	0
200058	301709	301710	How are Kerala and Keralites different from other states in India? What are some achievements unique to Kerala?	How is kerala different from other states of India?	1
200059	301711	301712	Why did Benedict Cumberbatch overact in sherlock S3 E3 (his last vow)?	Does Benedict Cumberbatch dress himself? Why?	0
200060	41649	76871	Is Donald Trump racist?	Why do some people call Donald Trump racist?	1
200061	208159	301713	Do sunburns turn into tans?	How does sunburn work?	0
200062	301714	301715	How important acceptance from the society is?	How important is society?	0
200063	301716	301717	What are some great resources for entrepreneurs who are looking for angel investors and don't know where to begin?	What does an angel investor/VC do if the idea is good but they don't think the person presenting the idea is capable?	0
200064	301718	301719	What are some other anime tearjerkers about love?	I have seen fmab (full metal alchemist brotherhood) and I absolutely loved it. Are there any other animes that are as good or even better than this?	0
200065	301720	212768	Development Practice: Have you ever worked on a successful environment project in urban Africa? What made it successful?	Development Practice: Have you ever worked on a successful water project in urban Africa? What made it successful?	0
200066	301721	219362	Does love always hurt?	Does true love always hurt or die?	1
200067	301722	301723	Do I stay with my husband if he hit me?	The money spent on war in 8 days could feed the world for 17 years. How does this dictate the conflicts in the world? What can be done about this?	0
200068	31715	2559	How can I reduce my weight and tummy?	What are the best ways to lose weight?	0
200069	13182	133200	How can I gain weight as a teenager?	How do I gain weight as an 18 year old?	1
200070	301724	301725	In the recent terrorist attacks many Indians solders have died . What can the Indian govt do to minimize the attacks by terrorist from POK?	Why aren't any SuperUser apps recognizing the SU binary on my ZTE Sonata 3?	0
200071	301726	301727	What is the best virtual assistant company?	Which is the best virtual assistant companies?	1
200072	34184	165601	How do I add a picture to my question on Quora?	How do I insert a picture in Quora?	1
200073	24801	301728	Can we do credit card payment through paytm wallet?	How do I return the refunded money from my paytm wallet back to my credit card?	0
200074	301729	301730	Do you know if Berklee College of Music gives a full tuition scholarship to international students as well?	Does Berklee College of Music offer a 100% scholarship also to international students?	1
200075	43595	71528	Is vacuum energy infinite? If it is, how and why? Is it dark energy?	If dark and vacuum energy are created with expansion is there potential energy that transforms into these types of energy with expansion?	1
200076	149413	301731	How do I invest in stock?	How do I invest in stocks as an experience?	0
200077	301732	301733	How many courses/units should I take in the summer session?	Is taking a for-credit summer course at a university a good way to show interest?	0
200078	301734	301735	What are the most suitable specializations for PhD in Computer Science for someone with weak background in programming?	What are the best Ph.D specializations in Computer Science for someone with weak background in programming?	1
200079	301736	301737	Why are most of the Pakistani girls beautiful?	Who do you think is the most underrated beautiful girl in the world?	0
200080	301738	301739	How can we deposit new notes in SBI bank?	Can I use another non SBI ATM card to deposit in a state bank cdm?	0
200081	255695	301740	I want to start selling eBooks on my own website targeting Indian customers.there going to be no partners or employees. I have few queries?	Should I use a WordPress based classified website or a custom web developer coded website? If I start with WordPress, can I shift to my own developed website later if WordPress turns out to not be easy to customize?	0
200082	76405	301741	What should one do in one's free time?	With one month remaining for my joining, how should I make the best of this free time?	0
200083	301742	301743	"What is the correct way to say ""young lady"" in Japanese?"	"What is the correct way to say ""meanie"" in Japanese?"	0
200084	301744	301745	Why are different products obtained after the electrolysis of a potassium iodide?	Why do I find the US national anthem so erotic?	0
200085	157297	301746	What is an improper noun, and what are some examples?	What are some of the best examples of improper English in marketing campaigns?	0
200086	301747	238414	What would happen if DeepMind's AlphaGo had to play a match of GO (same rules), but on a different size of square board (say 20x20 instead of 19x19)?	What would happen if, say, a contingent of Russian marines boarded a Nimitz class Carrier? What about if they captured it?	0
200087	15139	2929	What is the solution for Quora marking your every question as needing improvement?	What happens to a question on Quora if it is marked as needing further improvement?	1
200088	301748	301749	What is the best way to make man happy?	How can a woman make a man happy?	0
200089	301750	301751	When I mention my friends in comment using @ on instagram, it doesn't show suggestion for some friends' but does shows for some. How to solve it?	How can I moderate comments on an Instagram ad I ran using my Facebook business manager? Please note I don't have an Instagram account.	0
200090	301752	301753	How do I prepare for the UPSC 2015 exam? Is it possible to crack it in 8 months?	Can I prepare for upsc exam in 12-14 months?	0
200091	301754	301755	Why is spicy food good for your metabolism?	Is it true that spicy food is good for your metabolism?	1
200092	301756	301757	Does the compression of information reduce entropy?	Is entropy finite?	0
200093	301758	301759	What happens in Naruto chapter 1?	"What happens in the latest chapter of ""Naruto""?"	0
200094	301760	173003	Why do companies merge with or acquire other companies?	Why do companies buy companies?	1
200095	301761	301762	Why won't Indians protect this muslim woman from being publicly abused by her man?	Why aren't women offended by the Bible's claim that woman came from man's rib when clearly all men and women come from the womb of a woman?	0
200096	301763	301764	What does :-X mean in texting?	"What does ""^^"" mean in texting?"	0
200097	301765	301766	What are the best reasons to attend the University of Maryland University College?	What are the best reasons to attend the University of Maryland?	0
200098	187633	301767	What's the difference between a cow, a bull, a buffalo and an ox?	Can a cow be hybridised with buffalo?	0
200099	301768	301769	If you had 100 trillion dollars, what would you do?	If you had 100 billion dollars, what would you do?	1
200100	301770	301771	Am I crazy, or could I really have a problem with controlling myself sometimes? I try so hard but always fail, could it be a real fixable problem?	I really feel like not doing anything. I am finding it very hard to believe in myself. I have no interest in anything. How can I recover from this problem?	0
200101	301772	301773	When will Dribbble release a write API?	Why hasn't Dribbble released a write API?	1
200102	301774	301775	Do the rest of Indians hate the people from Bihar?	Why are some people from the rest of India mean to people from Bihar?	1
200103	301776	301777	What are the best aspects of living in Kingston, ON as a young adult?	What are the best aspects of living in Kingston, Jamaica as a young adult?	0
200104	301778	301779	How do I make $1000 in 2 days?	How can I make $1000 in 2 months?	0
200105	174412	301780	How do I score a rank in the CA Final exam?	How do I get rank in CA final?	1
200106	301781	301782	How much money per hour do Uber drivers make in Austin, TX? What's the most a person can reasonably make per month?	How much do Uber drivers make in Austin?	0
200107	301783	301784	Is it bad to add cold water on a hot pan?	How do you add more anions (negative ions) to water?	0
200108	301785	301786	Which Urban Dictionary term has the highest thumbs up to thumbs down ratio?	How much time does it take Urban Dictionary to review submissions? Why does it take that long?	0
200109	301787	301788	What does systems architecture mean?	What is Systems Architecture?	0
200110	63971	28762	How do I hack my husband phone?	How can I hack my husbands cellphone?	1
200111	51585	301789	Who was the most ignorant American you have ever met?	Who is the most accomplished person you have ever met?	0
200112	301790	301791	What are some of the best Liquid funds in India to park your surplus money for 10-15 days?	Which are the best liquid funds available in India?	1
200113	301792	301793	Why do British postage stamps of late nineteenth century have letters in the corners?	What is a postage stamp made of?	0
200114	254218	288101	Is 128 a good iq for a nine year old?	"I'm 20 years old and I have no idea what my ""IQ"" is. How did everybody find out their ""IQs""?"	0
200115	257732	301794	Why do plumbers earn so much money?	How much money do you earn from one Subscriber?	0
200116	166145	301795	In the U.S., does the president's bedroom change when there is a new president, or is it always the same room?	Can one ask the U.S. President a special favor?	0
200117	207147	301796	Which is the most horrifying thing/disease you have seen in your medical career?	What is the most horrifying fictional infectious disease?	0
200118	301797	5141	What are words that rhyme with matter?	"What are words that rhyme with ""not""?"	0
200119	301798	301799	Chartent accountant practices as government job?	I’ve read that there are only about 200 rhinoviruses, and that we catch about 4 per year; should we not then be immune to colds after our mid-fifties?	0
200120	215804	198022	What can I do to improve my chances of getting into an Ivy League school?	What are some extracurricular activities I could do to improve my chances at getting into Ivy League schools?	1
200121	301800	165057	Why does one believe in Science more than religion?	Which one should I believe? Science or my religion?	0
200122	55174	301801	How do I lose 15kgs in 21 days?	How can I lose 5 kg in 15 days?	0
200123	70794	301802	What are some things new employees should know going into their first day at Verizon?	What are some things new employees should know going into their first day at Hortonworks?	0
200124	114934	301803	How do gear pump work?	How does hydraulic pump works?	0
200125	229811	272139	What is to be made of the allegations that Donald Trump raped a 13 year old girl?	Is it true that Donald Trump raped a 13 year old and threatened to hurt her family if she talked?	1
200126	301804	301805	Is light speed actually not the speed limit in the universe?	Is the speed limit of the universe really the speed of light?	0
200127	169681	301806	How can people be so judgemental?	Why are people so judgemental?	1
200128	26892	301807	"What does ""まな"" mean in Japanese?"	What does 'omorashi' mean in Japanese?	0
200129	40173	18759	Will the decision to demonetize 500 and 1000 rupee notes help to curb black money?	How will replacing 1000 notes with 2000 notes going to stop corruption and black money?	1
200130	301808	123219	What is the best picture you have seen ever?	Which is the best picture you have ever seen?	1
200131	301809	301810	Why are facts and opinions so similar?	"Is ""I like x"" a fact or an opinion?"	0
200132	301811	301812	What should i buy? Sears and zemansky university physics or feynman lecture series(FLS)?	I can't stand office politics,cliques, groups of old entitled crones who want to run you down.i nearly died of stress.Can I survive at work in future?	0
200133	24767	46143	What universities does Groupon recruit new grads from? What majors are they looking for?	What universities does Intel recruit new grads from? What majors are they looking for?	0
200134	301813	301814	What Facebook groups are you in?	What are groups on Facebook?	0
200135	301815	301816	What is the fastest way to get rid of vitiligo?	How can I get rid of vitiligo?	1
200136	301817	301818	Does eating less give you more energy?	Which type of food gives more energy and less fat?	0
200137	40637	13027	What is the Bing Bang? What caused this to happen?	What caused the Big Bang?	1
200138	301819	301820	What are the different types of titles for nobility and how care they classified?	How are various nobility titles ranked?	0
200139	301821	301822	What are the best websites for hindi dubbed holywood movies?	What are some top Hollywood war movies dubbed in Hindi?	0
200140	113291	301823	What is the average amount of equity to give first round (seed) investors?	Does it make sense to give 33% equity for half the valuation you expected in seed round ?	0
200141	301824	115304	Who will win up 2017 election?	Who will 2017 up elections?	1
200142	240469	34554	What was your initial reaction on getting to know about the ban on the current ₹500 and ₹1,000 notes?	What do you think about Modi Government decision to ban ₹500,₹1000 notes?	1
200143	301825	5893	Is there a way to get free coins in Pokémon GO?	Is there any way to get more PokeCoins in Pokémon GO?	0
200144	301826	301827	Amcat is useful or not to mtech students?	How much time do I need to get commercial driver license in Delhi after acquiring normal driving license?	0
200145	301828	301829	What does $ mean in R?	What does ! mean in R?	0
200146	301830	301831	Why do married men have affairs?	Why do some married men have affairs?	1
200147	49410	301832	How can I remove my Gmail account from a device?	How can I log into a Gmail account from a new device, without getting a notification?	0
200148	58101	117640	I am turning 20 in a week. What are the things I need to do when I turn 20, and what advice do you have for me?	I am going to turn mid 20 soon, what advice can you give for me?	1
200149	154148	269739	What is the heaven and hell painting in Batman v Superman and is it real?	What was the painting on the wall in Lex Luthor's house in Batman v Superman: Dawn of Justice?	0
200150	301833	301834	Yesterday in Kabul Afghanistan a woman burned the holy book Quran and in reaction angry local people killed her and burned her: From the Islamic point of view what will be the punishment for those people who burned the lady?	What should Indians learn from people of Afghanistan?	0
200151	301835	301836	Where is likely to centre given by CBSE for improvement exams?	What is the proper abbreviation for an assistant professor?	0
200152	301837	301838	What are the placement prospects for M.des in film and video communications?	What are the placement chances of film and video communication design at NID Ahmedabad?	0
200153	301839	18848	Did Adolf Hitler do anything good?	What were Hitler's positive contributions to Germany?	0
200154	301840	62627	How can I use mind mapping to teach writing?	How do I use mind mapping?	0
200155	301841	301842	Can you use a Samsung j7 as a universal remote?	How do I start Jio in Samsung J7?	0
200156	301843	30108	Which are the best universities for masters in mechanical engineering in canada?	How was the situation in 1978 when demonetization took place in India for the second time?	0
200157	48846	65246	What are the best online courses available for digital business and marketing management?	Which is the best free digital marketing course?	1
200158	173100	15623	Where can I find best hotel at Ranikhet?	How do I find the best hotels in Ranikhet?	0
200159	301844	301845	I feel like my antidepressants are making me feel worse. Has this happened to anyone?	I'm in a kind of turmoil. Due to past experiences with cheating girlfriends and lying best friends and a disturbing family background, I am unable to feel close to anyone or even trust anyone and that makes me feel damn lonely. What should I do?	0
200160	301846	301847	What is the witching hour in occult belief, and why is it at 3 AM? How does it compare to the Devil's hour?	Why is 3 am called the witching hour?	1
200161	301848	301849	What are some scuba diving careers?	What is it like to scuba dive?	0
200162	261631	301850	What are the characteristics of a Pitbull/Lab mix?	What are the characteristics of a chihuahua/lab mix?	0
200163	301851	301852	IS MBA worth it?	Is an executive MBA from XLRI worth?	0
200164	301853	301854	Has a male patient ever had an erection with a female doctor during an exam?	Should a woman ever cross the patient/doctor boundary and make friends (just friends) with their female GP?	0
200165	301855	57583	Where can I find a Swiss family office database?	Where do I find a canadian family office database?	0
200166	215262	20638	What are some ways to become famous?	How can I become famous easily?	1
200167	17251	56634	If World war 3 happened, what countries would likely start the war and why?	If there was a world war III around this time period what would most likely be the start of it?	1
200168	301856	114862	Which are some of the best performing penny stocks in India?	Is it worth investing in penny stocks trading in BSE or NSE?	1
200169	301857	238686	What is the cranial nerve for taste?	What are cranial nerves?	0
200170	301858	265226	Why is nuclear power (or nuclear explosions) not used to propel rockets?	Would it be possible to use a nuclear explosion to power a spacecraft?	0
200171	12908	301859	Can a mission critical application based on Oracle run on unreliable storage?	Will Oracle ever run at a loss?	0
200172	301860	301861	Why does Canada export 90% of Canola seeds to the UAE? Why can't it crush the seed to produce oil by itself?	Why does the US both import and export oil?	0
