id	qid1	qid2	question1	question2	is_duplicate
206715	83243	57853	If he texted right after our 1st date to say he had fun and I said me too, why is he playing games now and hasn't contacted me 3 days since our date?	If a guy texted me the second the date ended saying he had fun, why is he on day 2 of radio silence and hasn't contacted me again?	1
206716	310224	310225	"To what extent was Xu Huang affected by the ""7 deadly sins""?"	"Xu You: To what extent was Xu You affected by the ""7 deadly sins""?"	0
206717	310226	310227	What happens when you overdose on amoxicillin?	What happens if you overdose on atenolol?	0
206718	310228	310229	If God exists, I have an urge to give him a punch in the face. Do you feel the same feeling?	My boyfriend is clear about the caste issues we are going to face so he doesn't think about our marriage. Should I wait or move on?	0
206719	310230	310231	What natural resources are found in North Africa and What are they used for?	What natural resources can be found in North Africa?	1
206720	102110	49494	Has anyone found a way to make money using Quora?	Can we earn money through Quora?	1
206721	310232	310233	Can I get a ten-eleven LKH package in mechanical engineering from BIT Sindri? If yes, who can be the recruiters and what max can I expect from BIT Sindri if I work really hard and smart?	What is the average package and placement for mechanical at BIT Sindri?	0
206722	310234	310235	What would be the result of the GST bill approval?	What will be result of GST bill approval?	1
206723	244449	691	Which is best ratio 4.3 or 16.9 for photo clicking from mobile	What is the best phone to buy below 15k?	0
206724	30607	33675	How long does meth stay in a persons blood?	How long does meth stay in your system? If last use was Friday, would it be out by Monday?	1
206725	253332	83861	How do I get fit and get rid of body fat?	How do I get rid of body fat?	1
206726	290684	235705	What is your review of Romajidesu.com?	What is your review of Patrika.com?	0
206727	102296	38298	How do I stop resenting and hating someone?	How can I stop hating someone?	1
206728	703	310236	How do I send message from one Android phone to another Android phone through bluetooth?	How do I backup my text messages from my Android phone?	0
206729	152425	310237	What are computer input devices? What are some examples?	What are some examples of input and output computer devices?	0
206730	310238	128251	How do you find out if a shy guy likes you when you are a shy girl?	How do you know if a shy guy likes you?	1
206731	310239	50644	Can both we take mass gainer and whey protein?	Can you take both whey protein and mass gainer at the same time?	1
206732	310240	105783	How can I overcome my feelings of guilt?	How can I overcome guilt about silly issues?	0
206733	310241	310242	Is it possible to do all of your A levels in one year?	Is it possible to complete A-level in just one year?	1
206734	310243	310244	What are some things that can be used to represent your family?	What does your family think of you using Quora?	0
206735	236809	310245	What is the best chinese movie?	What are some good Chinese movies on Netflix?	0
206736	94311	3548	How will Hillary Clinton's pneumonia diagnosis affect her presidential campaign?	How seriously will Hillary Clinton's early departure from a 9/11 ceremony affect her campaign?	1
206737	310246	310247	What is your review of Electoral Reforms in India?	In 40-60 words, what are two reforms needed in the electoral system of India?	1
206738	260691	310248	What are the best books for the self preparation of EE GATE?	What are the best books for gate preparation(EE)?	1
206739	5246	44306	What are the major differences between Chinese and Western culture?	#What are the major differences between Chinese and western cultures?	1
206740	34694	7002	Why is Spotify nott available in India?	Daniel Ek: When is Spotify coming to india?	1
206741	310249	310250	How can mice climb up walls?	Can rats climb up walls?	0
206742	79254	20772	What was the greatest day in you life?	Which will be the best day of your life?	1
206743	79204	23373	How can I earn money from my Facebook page?	How can I earn money through a Facebook page?	1
206744	310251	310252	How can I receive whatsapp messages from another phone number on my account?	What is a way by which you can get to read another person's WhatsApp messages through your own cell phone if you have another person's number?	1
206745	310253	310254	Is salt water a homogeneous mixture?	Is cloud a mixture of water droplets?	0
206746	78805	11779	What are some uses for Aloe Vera?	Uses of aloe vera?	1
206747	310255	310256	How do I participate in olympic from India?	Why are all the Olympic swimming events in a single week?	0
206748	310257	13133	How do I deactivate a Yahoo! account?	How do you disable a Yahoo account?	1
206749	40789	30524	What are some things new employees should know going into their first day at Resources Connection?	What are some things new employees should know going into their first day at Resource America?	0
206750	274476	310258	What type of benefits do you have if you join the army in US compared to the benefits of joining the army in Mexico?	What type of benefits do you have if you join the army in US compared to the benefits of joining the army in Ecuador?	0
206751	34654	21355	How does sex feel like for the first time?	How does sex for the first time feel like?	1
206752	310259	310260	What are the best gadgets that you should buy?	What are the best gadget to buy under 50€?	0
206753	310261	310262	How easy is to decompile a Qt executable?	What is the Qt(framework)?	0
206754	310263	310264	What is the average cost of living in Israel in 2014?	What is the average cost of living in Israel?	0
206755	16655	274332	What are economic activities? What are some examples?	What are some examples of economic activities?	1
206756	310265	310266	How will technology change our lives?	How has technology changed our lives?	0
206757	310267	270382	How do I get a mechanical engineering job?	How can I get jobs as a mechanical engineer?	1
206758	30526	225935	Should India declare a war on Pakistan and Why?	Should India take some aggressive step against Pakistan now?	1
206759	310268	310269	What should I do when I visit Thailand?	I am a 26 year old Indian bachelor guy and I am going to Thailand for the first time. What are some suggestions?	0
206760	310270	310271	How do I make money on a video that has gone viral?	Rachel Bloom: What's it like to make and release a viral YouTube video?	0
206761	310272	310273	What can someone with 350 million net worth expect to make off of his/her money alone annually?	Does it make sense to buy a $10 million private jet if you have a net worth of $30 million and make $2 million a year?	0
206762	310274	310275	What are some of the results of The Congress of Vienna?	What were the results of the Congress of Vienna?	1
206763	46212	138524	What has the Modi government achieved since coming to power?	Can Narendra Modi make India a superpower?	0
206764	310276	310277	What are some good colleges/universities offering MBA in Business Analytics/Data Analytics in India?	Is there a college that offers a degree in Business Analytics (or Big Data) and Finance?	0
206765	17980	8829	What is the best joke you've ever hear?	What is the best joke you've ever heard? Please keep it clean.	1
206766	27935	310278	How many hours before the departure of a train is its chart prepared?	What if my status is in waiting list 3 and chart is prepared for train?	0
206767	310279	310280	Why Flipkart is deleting the negative reviews?	Are the reviews of Amazon and Flipkart fake?	0
206768	310281	310282	Which PC games have the most stunning graphics?	What are some best PC Pokémon games which have good graphics?	0
206769	310283	310284	Why there is a sound when we crack our knuckles?	What makes the sound when we crack our knuckles?	1
206770	310285	310286	Why is bypass road spelt wrongly as byepass in India?	What are the most dangerous roads in India?	0
206771	310287	310288	What are some of the best Tamil movies of recent times?	What are some of the best time travel movies in recent times?	0
206772	270963	85497	How can I make a ps-script that checks if a scheduled task was running in the last 24 hours and if not gives me an error echo?	How do I check if a page is active and no 404 error is shown in selenium?	0
206773	310289	310290	What crime is Hillary Clinton guilty of?	What possible crime (s) can Hillary Clinton be accused of?	0
206774	310291	310292	"What does this question mean ""Please provide a short summary of your approach to business development and the methods that you use""?"	How can you prepare a short summary of The Iliad?	0
206775	310293	134744	What is the difference between turnover and net profit?	What's the difference between turnover and sales?	0
206776	118028	310294	What is an embedded systems?	What is an embedded system?	1
206777	310295	310296	Is there anyone who's taken the DASA SAT and can guide me?	What would be the physical and political effects of both Spain and Guam mysteriously vanishing overnight?	0
206778	117819	310297	If you have 1$ and you see a hobo on the street and a woman that will sleep with you for 1$, would yoh give it to the hobo or to the woman?	If you had a choice of receiving a billion dollars, or saving 3 poor Africans (and no one will ever know your deed), what would you choose?	0
206779	3867	310298	How can I unlock iphones?	How do I unlock a carrier locked iPhone?	1
206780	310299	310300	How many t-shirts could a newcomer to CafePress or Zazzle expect to sell?	What are some tips for selling on Zazzle?	0
206781	39744	290771	What books or magazines should I read to improve my English?	Books: What should I read if I want to practice and improve my English?	1
206782	310301	310302	Looking dropshipper for Matcha tea?	Why have European microstates managed to be independent (without being annexed) in a long European history which saw lots of changing territories?	0
206783	100176	82825	How do I move on from breakup?	How do I deal with a breakup?	1
206784	310303	310304	What is language variaton?	What defines a language?	0
206785	310305	310306	Are men okay with dating taller women?	Do shorter guys date taller women?	1
206786	310307	310308	Is a 4 wheeler license valid for 2 wheeler geared motorcycle in India?	How do I get a temporary 2 wheeler license?	0
206787	138259	310309	Is a plant considered a living thing?	Why are trees considered as living things?	1
206788	310310	310311	My mother is 49 years old and recently divorced. She wants to enter the job force again. What occupations could be good for her?	I want a family with my 5 year old sons mom but she doesn't see a family in us. What should I do to prove her wrong and get her to like me again?	0
206789	310312	310313	What are the differences between project, program and portfolio management?	What is the difference between Project Management and Program Management?	0
206790	56548	137804	What are some animals that live in deserts?	What are some animals that live in the desert?	1
206791	88621	89700	What is my old Gmail account?	How do I find all my Gmail accounts?	1
206792	310314	310315	I FORGOT MY UAN LOGING PASSWORD AND ALSO FORGOT REGISTER MOBILE?	I forgot my password for the UAN portal. What should I do?	0
206793	310316	310317	For the people who turned 18 this year, or the ones who got to vote for the first time, How were you feeling? Were you confused for who to vote for?	I have an aggregate of below 60% in 12th and Btech. How can I get an IT job?	0
206794	65859	310318	What happens if my dog eats a tomato?	What happens if a dog eats bird seeds?	0
206795	310319	310320	What is the syllabus of sociology in IAS?	What is the sociology syllabus for IAS?	1
206796	310321	310322	Difference between a disconnector and a circuit breaker?	What is the main difference between a disconnector and a circuit breaker for: a) The intended function? B) Fault current breaking?	1
206797	43392	79053	What is the main difference between a IIT engineering graduate and a non-IIT engineering graduate?	What are the major differences between an IIT and a non IIT Civil Engineer graduate?	1
206798	163190	42512	How can I upload pictures to Google images?	How can I upload my photo on Google images?	1
206799	310323	310324	What all career options I have after ECE?	Career advice - I have done my BE ECE, what are the various career options for me now?	1
206800	310325	310326	What are the 4 pillars of OOPs?	Is it ok to not learn OOP?	0
206801	13508	26274	Should people over 95 not be allowed to vote?	Should people over 91 not be allowed to vote?	1
206802	310327	310328	Is the dark side of the moon always dark?	How cold is the dark side of the moon?	0
206803	310329	310330	What is the conservation of money?	What is conservation?	0
206804	310331	310332	How do Scientologists feel about the South Park episode on the Church of Scientology?	What are some good South Park episodes with Randy Marsh as a major character?	0
206805	59605	310333	Why did Aishwarya Rai marry Abhishek Bachchan?	Who is more beautiful than Aishwarya Rai?	0
206806	57978	310334	"What are the questions that can be asked when the interviewer asks ""Any questions?"""	What questions are asked in AFCAT interview?	0
206807	310335	310336	What priorities should be given when developing protocols that promote situational awareness?	What is a communication protocol?	0
206808	20584	6580	Now that the GST bill has been passed by the Indian government, how will it impact the lives of the common people?	How do GST bill will benefit local people?	1
206809	310337	310338	What is the future of knowledge?	What would be the future of knowledge sharing?	0
206810	152696	106883	How does the demonetisation of 500 and 1000 INR notes impact the Dollar to INR rate?	How will the demonetization of 500 and 1000 rupee notes affect the value of INR against USD?	1
206811	310339	310340	What are some signs that you may be autistic?	What are the signs that someone is autistic?	1
206812	310341	248313	Are there only two genders?	Why are there two sexes?	0
206813	310342	310343	What exactly is the difference between BufferedReader and Scanner in Java?	Why is BufferedReader preferred over Scanner?	0
206814	310344	310345	What are Subway's healthiest sandwiches?	What is the healthy customization of a Subway sandwich?	0
206815	73768	60179	What's a way to last longer during sex? (For guys)?	How do I last longer during sexual activity?	1
206816	310346	310347	What are the health risks of dogs consuming pistachios?	What are the health risks of dogs consuming grapes?	0
206817	257852	151701	Is one a prime number?	Why is 1 not a prime number?	0
206818	310348	69902	What are some songs with lyrics that reference people of a specific age?	What are some of the best lyrics in Hindi film songs?	0
206819	310349	310350	What is the list of colleges from which SpaceX hires?	What can I do in college to better my chances of being hired at SpaceX?	0
206820	310351	310352	What are the safest and easiest hobbies to have so excel in UPSC interview?	Does YouTube live stream unveiling of a product comes under good marketing for a startup?	0
206821	310353	310354	Is denaturation of proteins desirable?	What are some ways to denature proteins?	0
206822	310355	134472	What are best book for understanding bussiness?	What are the best books to read for recruiters?	0
206823	310356	310357	Why is Facebook so fascistic?	How fascistic is Facebook?	0
206824	164062	310358	Why I don't want to see my friends anymore?	How do I tell my best friend I don't want to hang out anymore?	0
206825	286162	310359	What does 2+2x2+2 equal?	If x+2<0 then |x+2| is equal to?	0
206826	183375	46615	What is the best motivational book?	Which are the best motivational books?	1
206827	310360	310361	What is the interview process like at SpaceX?	How is interview process at Plivo?	0
206828	51489	70505	Who do you think will win the U.S. election in November?	Who will win the US election in 2016?	1
206829	147577	303028	How can I learn to become more disciplined?	How do you become more disciplined?	1
206830	310362	282240	Is it advisable to eat a hot soup on the day your wisdom teeth were extracted?	What is to eat after wisdom teeth extractions?	0
206831	310363	310364	Why don't mountaineers pack a parachute on their backs, so they can base-jump out of trouble?	Parts used in transmission system of car?	0
206832	310365	310366	How has life changed after executive MBA from IIMs?	How has a MBA from IIM changed your life?	1
206833	310367	310368	What are some planning and goal setting fun activities for students?	What will be the package for a software engineer at Cerner India with five year of experience?	0
206834	310369	310370	How can one distinguish an original pioneer car stereo from a fake one?	How can I connect my ipad 2 to my car stereo?	0
206835	15264	99190	Why and how is 0! =1?	Why does 0! Equal 1?	1
206836	310371	310372	How the customers are unique when they came from different channels?	If I join a company not as sap fico consultant but as end user then can I become consultant in that particular company? If yes then how?	0
206837	125978	310373	How do I make a horror movie?	How do I make a creepy horror movie?	1
206838	310374	310375	Does Bernie Sanders tax plan have a flaw?	Would Bernie Sanders lobby to have the estate tax laws changed?	0
206839	33899	60896	How do I recover my Gmail account when it does not open after password reset?	How do I recover my Gmail account when the recovery phone is no longer in service and forget my old password?	1
206840	310376	310377	What is a good DSLR camera for it price?	What is the best DSLR camera for travel?	0
206841	74904	292239	What are some very good and real touching romantic novels?	Which are some good romantic novels?	1
206842	310378	205319	How do you protect a tech startup idea?	How do I protect an idea?	0
206843	56815	310379	"What is the meaning of ""af""?"	What is the meaning of af?	1
206844	310380	195832	What are the probable chapters for English literature ICSE board exam?	What is the board pattern for English language in the 10 ICSE board?	0
206845	216648	24757	What is best way for preparing civil services exam?	How can I crack the civil exam?	1
206846	310381	310382	Under what conditions will saccharin dissolve in water? Why?	What is the process to dissolve salt in water?	0
206847	310383	40956	How can one make money by starting a blog in Hindi?	How can one make money starting a blog?	0
206848	310384	310385	Why SA cricket team wears pink dress in some ODI matches?	What is the highest score made by a chasing team in the last over to win an ODI cricket match?	0
206849	310386	310387	Is it worth spending so much money on Iphone?	Is iPhone really worth spending such loads of money?	1
206850	310388	83369	My 9 year old cousin is watching inappropriate videos on YouTube. How do I get her to stop?	My Android is not playing any videos, what should I do?	0
206851	310389	28679	How do I get poems published?	I want to be a poet what should I do to get my poems published?	1
206852	310390	310391	I have so many backlogs up until now in engineering. I am in the last year of IT engineering. I feel depressed. What do I do?	I have so many backlogs up until now in engineering. I am in the last year of mechanical engineering. I feel depressed. What do I do?	0
206853	310392	310393	Is Minecraft still a growing thing or has it peaked?	Is the popularity of Minecraft still growing?	0
206854	310394	310395	Is there such thing as 'the Devil'?	Is there a such thing as a devil?	1
206855	310396	310397	What is the value of a Reofect painting?	Is a high resolution CGI render of equal value to a big print photography or an oil painting?	0
206856	269383	135778	Which are the best countries to visit in February?	What's the best country to visit in summer?	0
206857	72528	310398	Who is the most over-rated Bollywood actor/actress?	Why are the Bollywood actors so over rated?	0
206858	43565	310399	How do you see a saved Wi-Fi password on Android without root privileges?	How can I see the saved Wi-Fi passwords on my modem?	0
206859	310400	118334	What are the best books on neuroscience?	What are the best books in neuroscience?	1
206860	47562	94983	How much money per hour do Uber drivers make in Windsor, ON? What's the most a person can reasonably make per month?	How much money per hour do Uber drivers make in Philadelphia? What's the most a person can reasonably make per month?	0
206861	310401	310402	What are the legal problems with digital signature?	What are digital signatures? How do they help with security issues?	0
206862	310403	310404	Would a jaguar be able to kill a lion or a cheetah?	Can a jaguar kill a cheetah or a leopard in a one to one fight?	0
206863	310405	114139	How can I learn how to draw tigers?	What is the best way to learn how to draw?	0
206864	310406	310407	What do I feed my 5-month-old Rottweiler?	What do I feed my 6 month old Rottweiler?	0
206865	310408	310409	How one can apply for IIMs after cat results?	When do IIMs call for the next round after the declaration of CAT results?	0
206866	156974	64236	"How do I get my ""groundbreaking"" app idea noticed and also get funding to develop it?"	Where can I get funding for my idea?	1
206867	310410	310411	Where can I take Korean classes in the Bay Area?	Is the Bay Area closing?	0
206868	310412	310413	How do I bring out the hero instinct in a man?	What would you do if you found out that one of your heroes was not a very nice human being?	0
206869	244676	170221	What criteria do professional photographers use to choose their wedding photographers?	What is your criteria in hiring a wedding photographer?	1
206870	1179	42548	What do you feel is the purpose of life?	From your perspective, what is the purpose of life?	1
206871	310414	310415	Why is education important for Indian people?	Why is education important to Indians?	1
206872	310416	310417	I hv signed a 5 yr bond for pvt cmpny nw I hv completd 1 yr for bond break I hv to pay 1.5lac if I got govt job will bond break or I hv to pay 1.5lac?	Can we write the formula. Ofwater as OH_2 instead of H_20?	0
206873	218772	310418	What is Ajay Chandrakar's seeks in direction of becoming the greatest Eco-Tourism Hub in Chhattisgarh?	What is Ajay Chandrakar's aims towards becoming the biggest Eco-Tourism Hub in Chhattisgarh?	1
206874	13971	102867	Which is the best movie of 2016?	Which movies are the best in 2016?	1
206875	223600	310419	Who do Republicans dislike more, Bernie Sanders or Hilary Clinton?	Are #NeverTrump republicans more likely to vote for Bernie Sanders or Hillary Clinton?	0
206876	310420	310421	Why does Luis Suarez bite players? Does he have some kind of psychological disorder?	Why isn't Luis Suarez banned from the FIFA World Cup already if he is continuously biting people on the field?	0
206877	310422	310423	What does your social media schedule look like?	If Ahok is eventually disqualified from candidacy then who would you vote for, Agus-Silvy or Anies-Sandi? Why?	0
206878	211726	144085	What is the most embarrassing thing you have done to get a job?	What is the most embarrassing thing you have ever done?	0
206879	42833	310424	How can I learn latex in the easiest way?	How do I self learn LaTeX document preparation system software?	1
206880	196806	161228	"How do you know when you've found ""the one""?"	"How do you know if you have found ""the one""?"	1
206881	15687	310425	How do you fix a packet loss?	What are some good ways of fixing packet loss?	0
206882	310426	310427	How many views I have to have on YouTube to earn money?	How many views, likes, and comments should a YouTube video have to earn a good amount of money?	1
206883	310428	310429	How do I install sharepoint 2013 on windows 7?	Being a housewife can I crack UPSC?	0
206884	310430	241485	Why is Taylor Swift famous?	Why is Taylor Swift so popular?	1
206885	310431	310432	How can I protect my Python code but still make it available to run?	How do I run a Python code?	0
206886	106061	297720	When is next Quora meetup in Mumbai?	When is the next Quora meetup in Mumbai?	0
206887	310433	220206	Which other animals have their periods?	Other than humans, what animals menstruate?	1
206888	310434	46481	Is redmi note 3 water resistant?	Will Redmi Note 3 get Marshmallow Update?	0
206889	310435	310436	What does it mean to be a mathematical realist?	What is the meaning of mathematics?	0
206890	310437	310438	What is the difference between South Korean girls and Japanese girls?	What is the different between Japanese and South Korean girls?	1
206891	310439	310440	Which Indian advertisement is the most irksome?	What are the worst Indian advertisements?	0
206892	254781	310441	With proper training and exercises, how long does it usually take one to develop the mixed voice?	How long does it take to develop the mixed voice?	1
206893	310442	310443	How can I get investement for a pitching app idea? I have developed a prototype of the app also.	What is a one log cycle?	0
206894	44269	39651	How do I earn more money through internet/online?	How can I earn money online from home only?	1
206895	310444	30009	What is the difference between arts, science and commerce?	What is the difference between art and science?	0
206896	310445	9180	Why doesn’t Quora work right? Every time I answer a question and want to share it on Facebook, it doesn't show my answer.	How can I anonymously add content on Quora?	0
206897	310446	310447	Can I get admission to IITs without GATE?	Is there any chance of getting admission in the IITs with a GATE 2015 rank of 7411 mechanical?	0
206898	310448	151447	How do I forgive someone who betray me?	How do you forgive someone who cheated on you?	0
206899	310449	127264	What should I do after completing B.E in Biotechnology in India?	What should I do after completing my BTech Biotechnology?	0
206900	228098	310450	What hairstyles did Vikings have?	What ended the Viking age?	0
