id	qid1	qid2	question1	question2	is_duplicate
47000	83972	83973	Can a person lose weight without going to the gym?	Can I lose weight and grow muscle without going to the gym or without using weights?	1
47001	83974	83975	According to Kashmir issue what exactly Pakistan want from India?	What are the maximum number of possible genotypes in the F1 generation when TTRR and ttrr are crossed?	0
47002	24734	20542	How can I speaking fluently speaking English?	How can I improve fluency in English?	1
47003	83976	83977	If somebody gave you two million dollars, but required you to spend one million dollars on something you considered evil, would you take it?	Let's say, someone gives you a million dollars, but the catch is, you have to spend it all on something that is considered evil. Would you accept it? If yes, what would you do with the money?	1
47004	83978	83979	What functions does the Golgi apparatus have in animal cells?	What functions does the Golgi apparatus have?	0
47005	9474	25262	What are part time jobs that can work from home?	What all part time work can be done from home?	1
47006	83980	83981	What is the best way to disconnect my Spotify account from Facebook?	How can I switch my Spotify account from my Facebook to my email?	0
47007	83982	83983	Do nations need different laws for VVIPS?	Does our nation need different laws for VVIPs?	0
47008	83984	83985	What are the top five biggest challenges faced by startups?	What are the biggest challenges startups usually face?	1
47009	83986	83987	What is funniest video you have ever watched?	Which is the funniest video according to you?	1
47010	83988	83989	Is it possible for a normal person to escape the rat race?	I am not enjoying my IT job. I want to pursue a career in singing or writing. I dont want to be in a rat race. What should I do?	0
47011	83990	83991	Can you name some of the most famous Bangladeshi hindus?	Are there prominent Bangladeshi Hindus?	1
47012	83992	83993	Where can I download the game The Sims 4 for PC for free?	How do you download Sims 4 mods?	0
47013	83994	83995	Why is LTE?	What is actually LTE?	0
47014	83996	83997	What is a typical day like for a software engineer at Google?	What is a typical day like for a software engineer at LinkedIn?	0
47015	83998	83999	What is your review of The Women (2008 movie)?	What is your review of W. (2008 movie)?	0
47016	84000	84001	My brother in law is cheating on my sister. Should I tell her?	Can I marry my brother in laws brother in law sisters daughter?	0
47017	84002	84003	What are the job prospects after doing MS in Industrial engineering in US?	Is there really a dengue/chikangunya crisis in Delhi right now? Are the LG and PM truly answerable instead of the State Govt?	0
47018	84004	47461	What hotel in Ahmedabad would be safe for unmarried couples, without the harassment of police, hotel staff, and moral police?	What hotel in Kolkata would be safe for unmarried couples, without the harassment of police, hotel staff, and moral police?	0
47019	84005	84006	Is it healthy to take edible lime [ Ca(OH)2]?	How do I run 100m in 10.8 sec my current time is 11.3?	0
47020	84007	84008	What does IQ exactly means?	What does actually IQ mean?	1
47021	84009	84010	What forms of culture shock do people coming to France experience?	What kind of culture shock you might have as an Asian when you come to live in the USA?	0
47022	84011	84012	Who are the most inspiring footballers/football stories?	Who is the most unlucky footballer ever? Why?	0
47023	84013	84014	What are the names of all the people in this BuzzFeed video?	Why do some people dislike Buzzfeed?	0
47024	84015	84016	What should I think before dying?	What should I do before I die?	0
47025	44842	64971	What are some examples of science experiments where scientists lost control of the situation?	People think I'm gay but I’m not. What should I do?	0
47026	25859	84017	What are good gifts for a foreign visitor to bring when they're invited to someone's home in Australia for the first time?	What are good gifts for a foreign visitor to bring when they're invited to someone's home in Kenya for the first time?	0
47027	84018	68833	Is it possible that Trump entered the Presidential campaign to ensure that Hillary Clinton wins?	Is Hillary Clinton secretly paying Donald Trump to throw the election?	1
47028	84019	84020	Why molecules with lower energy are more stable?	Which molecule is relatively more stable: [math]N_2[/math]  or  [math]O_2[/math]?	0
47029	36160	84021	How would mermaids have sex?	What is the cutest mermaid you've ever seen?	0
47030	84022	84023	How do you distinguish a hard life from an easy life?	Is life really that hard?	0
47031	84024	84025	How much time does it take for a loan to be disbursed?	I have applied online for an SBI scholar loan. I have uploaded the documents' images. What is the further process? How much time does it take to complete the entire procedure?	0
47032	84026	84027	What are examples of products that are Fast Moving Consumer Goods?	Is salt a consumer product?	0
47033	84028	84029	What is a good routine before going to sleep?	How do I get into a gaming industry as a developer?what degrees. Should i take?	0
47034	84030	84031	What does Trump's win mean for India?	How will Trump's victory affect India?	1
47035	84032	84033	If you took the modern U.S. military with the supply capabilities against the German forces of WWII, how long would it take to win WWII?	"How much after the Japanese surrender at the end of WWII did U.S. forces occupy Japan, and is it OK to say ""U.S. forces"" did?"	0
47036	84034	84035	What is difference between resistance, reactance and impedance?	What is the difference between reactance and resistance?	1
47037	84036	47713	Why would anyone start smoking?	Why do women start smoking?	1
47038	84037	84038	What is the best product launch course?	What are the best product launches in the world?	0
47039	84039	4188	How do i stop being an extrovert?	How should I stop being an introvert?	1
47040	84040	84041	Is diet green tea good for you? If so, why?	Is green tea good for health?	0
47041	84042	84043	Why did you fail?	If you try to fail and succeeded, what have you done?	0
47042	84044	84045	Why don't girls like nice guys?	Why don't some women or girls like or find nice guys attractive?	1
47043	84046	84047	Who is Tim Berners-Lee?	Does Tim Berners-Lee have Parkinson's?	0
47044	84048	84049	Is a 34C bra equivalent to a 36B bra or a 34D bra equivalent to a 36C bra for Victoria's Secret?	What is Victoria's Secret pink nation?	0
47045	84050	84051	Which company is better-Cognizant or Edgeverve for business analyst?	Which among these is a better company to work for as an electrical electronics engineer, Infosys, Accenture, Cognizant, or Wipro?	0
47046	84052	84053	How are lizards beneficial for the environment?	How did the the Texas horned lizard adapt to its environment? How has it adapted to protect itself?	0
47047	84054	84055	Where is the Nile river?	How deep is the Nile River?	0
47048	84056	84057	What are the different stages of a cell cycle and which one comes first?	What are the stages of a cell's cycle in natural order?	1
47049	84058	84059	Why do the replicants need to be killed in the movie Blade Runner? Why not just let them live 4 years?	What are some little known facts about the movie Blade Runner?	0
47050	84060	84061	How do I know if my girlfriend need sex?	How do I know a woman need sex?	1
47051	876	48346	What are your views on Modi governments decision to demonetize 500 and 1000 rupee notes? How will this affect economy?	What are your views on PM Modi's decision on discontinuing 500 & 1000 rs notes?	1
47052	21353	84004	What hotel in Fatehpur would be safe for unmarried couples, without the harassment of police, hotel staff, and moral police?	What hotel in Ahmedabad would be safe for unmarried couples, without the harassment of police, hotel staff, and moral police?	0
47053	84062	10508	What is Richard Muller's view on Islam?	What do you think of Islam?	0
47054	84063	84064	What is cashless economy and how does it help an underdeveloped, predominantly poor country like India?	Is it possible to have a cashless economy in a country like India?	1
47055	84065	84066	How do I improve this writing?	How can I improve my writing routine?	0
47056	84067	84068	Is there anywhere in the world offering pain management for peripheral neuropathy as opioids haved been banned in US?	?	0
47057	84069	70899	I got an IQ of 191. What does it mean?	What is considered a good IQ?	0
47058	84070	84071	What are some tips on making it through the job interview process at Compass Minerals?	What are some tips on making it through the job interview process at Minerals Technologies?	0
47059	84072	8692	How can I recover a direct message on Instagram I deleted?	How do I recover deleted direct messages on Instagram?	1
47060	84073	84074	What is the best way for a beginner to learn HTML/CSS?	What would be the best way to learn HTML and CSS?	1
47061	84075	84076	Should Quorans be allowed to answer their own questions?	Why can you answer your own questions?	1
47062	84077	84078	What is that one amazing fact about yourself?	What is the most amazing fact about you?	1
47063	84079	84080	Is religion a form of politics?	Is religion another form of politics?	1
47064	4479	84081	which laptop will be best under Rs 30,000?	I want a new laptop with maximum configuration under 30000?	1
47065	6421	40432	What is the Sahara, and how do the average temperatures there compare to the ones in the Antarctica?	What is the Sahara, and how do the average temperatures there compare to the ones in the Registan Desert?	1
47066	75211	50270	Will real estate and prices of essential goods come down in India after the ban of 500 and 1000 notes?	How does Demonetisation of 1000 and 500 rupees notes affect real estate industry?	1
47067	11055	84082	What must I do to have good handwriting?	What can I do improve my handwriting?	1
47068	84083	84084	How do you write a speech about my first Holy Communion?	How do I write a speech about my first Holy Communion?	1
47069	84085	84086	Why India is not boycotting Chinese products?	Why India can't ban cheap, substandard, harmful Chinese goods?	1
47070	84087	84088	What are some good places to find erotic services online now that they're banned from Craigslist?	Craig Newmark: You do customer service for Craigslist. How do you leverage yourself to really help the company?	0
47071	17051	30517	How do I reduce my anger?	What is the best way to control your anger?	1
47072	84089	84090	For which cases is Linode cheaper than Amazon AWS?	For which cases is Amazon AWS cheaper than Linode?	0
47073	84091	84092	How can we build motion capture suits using multiple MEMS sensors?	We all have some kinds of fears? Like mine, I have the biggest fear of not getting admission in MBBS, how can we get rid of it?	0
47074	84093	67113	Which is a suitable solar panel installation provider near Nevada City, California CA?	Which is a suitable solar panel installation provider near Sunnyvale, California CA?	0
47075	84094	84095	When support should be removed after the casting of slab, beam, column, staircase and lift?	How are the placements at CMR?	0
47076	84096	84097	What are some cute outfits to wear when going to a Summer Fair?	What is the best outfit to wear to an MGMT concert?	0
47077	84098	84099	How can you use a Canon MP240 to scan documents?	How can you scan a document using a Canon MP240?	1
47078	84100	84101	What is the best way to learn generics and collections in Java?	Which is the best way to learn Java on NET?	0
47079	84102	84103	Is sleeping in the evening bad for health?	Is skipping a night of sleep bad for your health?	0
47080	84104	84105	Which is the best country to live in?	What is the best country to live in and why?	1
47081	84106	84107	What are the technical specifications of an iPhone 6?	What is technical specification?	0
47082	84108	84109	What are the best stocks to buy at the moment?	What are some of best stocks to buy?	1
47083	84110	51202	How is it like to have a huge penis?	What is it like to have a big penis?	1
47084	84111	84112	Why do we celebrate Halloween in India?	Why don't we celebrate Halloween in Nigeria?	0
47085	84113	84114	How does the motorcycle engine seize and what are its causes?	What is the best way to break in a motorcycle engine? And Why?	0
47086	18525	52700	What are the career options after electrical engineering excluding joining the MNCs?	What are career options after B.tech in Electrical engineering?	1
47087	72854	84115	How do I debunk the flat earth theories?	Is this proof that the Earth is flat?	0
47088	84116	84117	Can you eat only once a day?	Is it safe for one's health to eat only once a day?	0
47089	84118	84119	What are some examples of a catalyst in a chemical reaction?	What are the catalysts used in chemical reactions of alkenes?	0
47090	84120	84121	How difficult is it to make a living playing poker?	Does intention count in live poker?	0
47091	17016	84122	How can I stop my hair fall?	How can a teenager reduce hair fall?	1
47092	84123	84124	If you only had 24 hours to live, how would you spend it with your boy- or girlfriend?	If you had only 4 hours a day to live, how would you spend it?	0
47093	41348	84125	Which is a good solar panel installation provider near Nuevo, California CA?	Which is a suitable solar panel installation provider near Alameda, California CA?	0
47094	1438	32260	How does Quora quickly mark questions as needing improvement?	Why do questions I answer almost immediately get marked as needing improvement? Is it something I said?	1
47095	84126	84127	Is this feeling normal?	Why do I feel insecure if someone I like around me? Is it weird feeling?	0
47096	84128	25959	Will there be a financial crisis if Donald Trump wins?	What might happen now that President-elect Donald Trump has won the election? What will be the impact?	0
47097	84129	84130	"What should I do to resolve the Oracle installation error ""SID already exists""?"	Which Oracle version should I install to my computer for learning PL/SQL? Is enough the Express Edition?	0
47098	8462	16490	How do I improve my pronunciation in English?	How do I learn spoken English?	1
47099	84131	84132	On the soundtrack of the Jersey Boys film, why did John Lloyd Young not sing the complete original lyrics to Sherry?	What are the lyrics to Sloop John B as sung by the Beach Boys?	0
47100	84133	84134	Which is the top ten must read books you recommend?	What is the top ten must read books that you recommend?	1
47101	15857	77576	How many wars have India fought with its neighbours since independence and what was the outcomes?	How many wars have India and Pakistan fought? And how many of them have been won by each side?	0
47102	84135	71418	Which operating system is most preferable for developers and programmers? And why?	What operating system is preferred by most programmers and why?	1
47103	84136	84137	What is the closest Croatian equivalent (if there is one) of any the following words: startup, entrepreneurship, entrepreneur, business, scaleup and new business?	What is the closest Danish equivalent (if there is one) of any the following words: startup, entrepreneurship, entrepreneur, business, scaleup, new business?	0
47104	84138	84139	Who is the education minister in Karnataka?	Who is the home minister of Karnataka?	0
47105	84140	84141	What is the best nonfiction book about the building of the US Transcontinental railroad?	What books would you recommend to better understand the building of the Transcontinental Railroad?	0
47106	84142	84143	What are benefits of being a teacher?	What are some benefits of being a teacher that outweigh the bad?	1
47107	84144	84145	Where is the best place to eat paella in Madrid?	Where can I eat good and cheap paella in Valencia?	0
47108	84146	84147	Who does GST bill impact our life?	Who does GST bill impact our life.?	1
47109	21061	17210	DId something exist before the Big Bang?	How was our universe before the Big Bang? Was it a tiny point? If it was a tiny point, where did this point exist from?	1
47110	7002	17399	Daniel Ek: When is Spotify coming to india?	Daniel Ek: Why isn't Spotify coming to India instead of the huge internet consumption India has?	1
47111	84148	28664	What is the right time to have sex for pregnancy?	What is the correct time to have sex to get a child?	1
47112	84149	84150	How do I choose an acoustic guitar?	What is the best way to chose a beginner acoustic guitar?	0
47113	29624	84151	Why does the Iran nuclear deal give Iran $150 billion?	Did Barack Obama pay ransom to release four Americans in Iran?	0
47114	84152	84153	Which bank is bitcoin friendly (allows transactions to and from bitcoin exchanges) and allows non-resident accounts?	Can an aviation maintenance duty officer (USN) wear flight suits?	0
47115	84154	84155	How are the placements after doing an Engineering Management MS in the US?	After completion of MS course in Engineering management, how do I find job in USA ?	1
47116	84156	84157	How can I get MOOC/E-learning through online Web and Video courses related to MBBS developed by Indian professorial/professors?	How can I get MOOC/E-learning through online Web and Video courses related to Merchandising Management developed by Indian professorial/professors?	0
47117	84158	84159	Which is the best book to learn programming in C for beginners?	Which is best book to learn R-programming for beginners?	0
47118	84160	84161	Why are Alibaba products so cheap? Are they genuine?	How are Alibaba's (Amazon of China) products?	0
47119	84162	84163	What are the GoPro camera's special advantages?	What is a GoPro camera?	1
47120	84164	84165	What are the risks of giving oral sex to a woman?	What are the risks of oral sex (man doing to a woman)?	1
47121	84166	84167	Why is there no longer a mobile app to manage Netflix DVDs?	Will Netflix bring back DVD search and Queue to the Apple Mobile App?	0
47122	84168	84169	Do people with 3+ Years experience (say in IT) get leftover jobs at an XLRI ? Are the plush profiles in investment, finance & strategy also offered to them?	How much importance does the XLRI (Xavier Labour Relations Institute) give to work experience for their BM (Business Management) program?	0
47123	84170	84171	What is the absolute bare minimum amount of sleep you need in order to stay healthy?	What is the least amount of sleep I need to survive?	1
47124	58696	30782	Is it possible to view someone's private Instagram account?	How can you look at someone's private Instagram account without following them?	0
47125	84172	84173	Why do you chant the Hare Krishna Mahamantra and why specifically 16 rounds?	Why do you chant the Hare Krishna Mahamantra and specifically 16 rounds?	1
47126	84174	84175	How does culture influence fan behavior?	How does influence vary across cultures?	0
47127	84176	84177	What is The Law of Success?	What are your laws of success?	1
47128	84178	84179	What does the Bible say about masturbation?	What does the Bible say about masturbation? Is it a sin?	1
47129	84180	28513	Which is the best SAP online training centre at Hyderabad?	Which is the best sap workflow online training institute in Hyderabad?	1
47130	84181	84182	Which is the best bike in India for everyday use?	What is the best way to get a used bike in Chennai?	0
47131	84183	84184	Is it possible to fall out of love?	How could you ever fall out of love with someone you once loved truly? How and why is it possible?	0
47132	84185	84186	What's life like in Bhutan?	What is it like to live in Bhutan?	1
47133	84187	3737	What is hyperclubz.com?	What is Kaufmich.com?	0
47134	84188	84189	What sport should a nine-year old boy do?	What is average height of 18 year old boy?	0
47135	84190	84191	Why do people donate to charity?	How can you make people donate to charity?	0
47136	84192	84193	What are some good low carb soups?	What are some good low carb recipes?	0
47137	84194	84195	What are super adiabatic and sub adiabatic lapse rates?	Is a reversible adiabatic process a change in entropy?	0
47138	13616	84196	What are the differences between a democracy and a republic?	How does a republic compare to a democracy?	0
47139	84197	84198	What is a polite way to request an update on a project?	What is a polite way of asking your coworker for updates?	0
47140	84199	84200	What is the cost of Baba Ramdev's Patanjali Franchise?	How can I get franchise of Patanjali products in Kolkata?	0
47141	84201	84202	How do designers protect their design in fashion?	How do I design fashion?	0
47142	84203	84204	Is there any factual basis in evidence of psychic abilities?	Is there any scientific proof of people having psychic abilities?	1
47143	84205	4900	Do you believe in God? If not, then why?	Why are some people atheists?	0
47144	84206	84207	What did Japanese soldiers do in WW2 if they captured a Japanese-American soldier?	What did the Japanese soldiers think of Americans?	0
47145	84208	84209	Why is India not attacking on Pakistan?	Why will India attack Pakistan?	0
47146	84210	84211	How do you prove Euler's identity?	How do I understand Euler's Identity?	0
47147	84212	84213	How should one prepare for merchant navy interview?	How do I prepare for merchant Navy?	0
47148	84214	25072	What is a suitable inpatient drug and alcohol rehab center near Gilmer County GA?	Which is a suitable inpatient drug and alcohol rehab center near Upson County GA?	0
47149	84215	84216	What do the different eye colors mean in anime?	Do people really have eyes with different colors like one eye is blue and other is green?	0
47150	84217	84218	What is the most interesting question you have ever been asked?	What is the best question you have ever been asked?	0
47151	40995	18525	What are the career options available if I pursue M.Designing after a B.Tech in Electrical engineering?	What are the career options after electrical engineering excluding joining the MNCs?	1
47152	84219	84220	How do I get incoming and outgoing call details of a particular prepaid number here in India?	Is India becoming an intolerant nation?	0
47153	84221	84222	What is the best English to Japanese translation app?	What is the best English to Korean translation app?	0
47154	18273	3487	Where can I found different flavours for cupcakes at Gold Coast?	Where can I get an unique taste for cupcakes in Gold Coast?	1
47155	84223	84224	"What's an alternative way of saying you're ""looking forward"" to talking to/seeing someone in business emails?"	What is the best way of saying to an email if you want to see them the email you sent?	0
47156	80989	84225	What are some facts about Donald Trump?	What are some mind-blowing facts about Donald Trump?	1
47157	84226	84227	If the Big Bang created everything, how did the Big Bang happen if there was nothing before it happened?	"How did the Big Bang ""create"" time?"	1
47158	84228	84229	Will the requests module ever replace urllib2 in the Python standard library?	How do we use libraries and modules in python?	0
47159	84230	84231	Does coconut oil substitute well for butter in baking?	Can vegetable oil be substituted for coconut oil?	0
47160	84232	84233	Should Google buy Twitter?	Why is Google not buying Twitter?	0
47161	80448	84234	What are some good TED Talks?	What are some good TED talks on bioinformatics?	0
47162	84235	84236	The Internet: Is ISDN dying? If so why?	I wake up to the apocalypse. I'm the last man on Earth. What information should I search for before the Internet dies?	0
47163	84237	84238	Why are people concerned so much with the national debt?	Why do so many people confuse national deficit with national debt?	0
47164	84239	84240	Why is RCOM stock price going down after JIO announcement?	Why has the stock price of control print gone down?	0
47165	84241	84242	What can cause muscles to be sore for weeks, to the point that they're painful when used?	How do you prevent your wrists from getting sore if you type a lot?	0
47166	84243	84244	What happens in syria?	Whats really happening in Syria?	1
47167	84245	84246	Can a UCC1 Financing Statement be considered a lien?	What is a UCC Finance Statement?	0
47168	84247	84248	What is the tale of Robin Hood?	What is the importance of the Tales of Robin Hood?	0
47169	84249	84250	Can lime juice lighten facial hair? How?	What grows faster, grass or facial hair?	0
47170	84251	84252	Does the medical profession know the cure to cancer?	Is there any cure for cancer?	1
47171	84253	84254	Visiting and Travel: What is the most boring country to live in according to you? Why do you think so?	Is it possible to visit all countries in the world?	0
47172	84255	84256	How do crowdsourcing apps (e.g. Uber, Airbnb) affect your digital habit?	For what other services or products can a uber or airbnb like app or integrator be used?	0
47173	81604	84257	What is it like for an American living in Shanghai?	What's it like for an American living in Mexico?	0
47174	36822	84258	How do you stop being lazy?	Can a lazy person stop being lazy?	1
47175	84259	178	Which is the best gaming laptop under $500?	Which is the best gaming laptop under Rs 60000?	0
47176	84260	84261	"What does this Oscar Wilde quote actually mean, ""We are all in the gutter, but some of us are looking at the stars""?"	What are some less known facts about Oscar Wilde?	0
47177	84262	84263	Hillary Clinton stated the nuclear response is 4 minutes at the debate. Has the US ever officially stated the nuclear response time to the public?	Should Hillary Clinton be criticised for telling the world the US' nuclear response time?	1
47178	84264	84265	Should Sherlyn Chopra be given the Bharat Ratna award?	Why had Bhagat Singh not been awarded with the Bharat Ratna?	0
47179	84266	84267	What are the rates and amenities like at the President Hotel Palo Alto?	What are the going rates for babysitters in the Palo Alto, Menlo Park, Redwood City and environs areas?	0
47180	84268	84269	What are the pros and cons of FDI for India?	What are the pros and cons if India and Pakistan merge?	0
