id	qid1	qid2	question1	question2	is_duplicate
27382	50877	50878	Does ureaplasma, a fungus, live in symbiosis with a kind of bacteria or fungus which produces its necessary food source, urea?	Could a lactating woman sustain herself indefinitely producing and drinking the milk? With no other source of food or water?	0
27383	50879	50880	In American history, has any Republican ever owned a slave?	How many slaves did most planters own in the south?	0
27384	50881	50882	How do I describe a intense kissing scene in writing?	How do I describe a kissing scene in my writing?	1
27385	50883	50884	What do Indians think about black people?	What do Indians think of black people?	1
27386	50885	50886	Since the human brain is basically a biochemical machine, is it possible that scientists could create a robot that is self aware, conscious?	Is it possible to create machines/robots that are conscious?	1
27387	50887	50888	What is the best thing we learn in business school?	What is the most important thing to learn in a business school?	1
27388	50889	50890	What is the one movie you watched that changed your life the most?	What are some of the most romantic and Life changing movies ever?	0
27389	50891	18022	How do I study and excel in CA CPT?	How can I prepare for CA CPT?	1
27390	50892	50893	Should I form an LLC, C or S corp for my investment business?	What's an appropriate Delaware C-Corp business address for an internet company that's run out of my house?	0
27391	50894	50895	Why isn't the Banach Tarski paradox obvious?	Are there any applications of the Banach-Tarski paradox?	0
27392	50896	50897	Why do tortoises move slowly?	Can a large turtle and/or tortoise kill human?	0
27393	50898	50899	Why is it so difficult to write Malayalam (or Tamil for that matter) in Roman script? Are there any standardized ways to write them?	Is it difficult for people who originally write in Farsi to write in any other script like Roman or Devnagri?	0
27394	50900	50901	Should I go for Intellipaat Microstrategy Course?	Should I go for Intellipaat for Microstrategy course?	1
27395	50902	16049	How do I collect 8 ball pool cash?	How can I earn 8 ball pool cash?	1
27396	50903	50904	What is the meaning of rescission?	What is the meaning of +/-?	0
27397	20129	50905	What will happen to America now that Trump is president?	What will really happen if Trump becomes President?	1
27398	50906	50907	What are the best weight loss supplements for men and womens?	What is the best weight loss supplements for womens?	0
27399	50908	50909	What are some distributed SGD implementations?	Why does a mini-batch SGD have a slower convergence rate than a standard one sample SGD?	0
27400	50910	50911	Which is the weirdest question you have ever come across on Quora?	What are the weirdest questions you have seen on Quora?	1
27401	50912	50913	I'm not musically inclined. How can I easily learn to play the guitar?	How can I learn to play guitar?	1
27402	50914	50915	What is it like to be in a relationship with someone who already has children?	Should I tell a girl that I love her even if she is already in a relationship with someone else?	0
27403	50916	50917	Do the battery saver applications actually work? If they do, which is the best battery saver application for Android?	Which is best app for data & battery saver for smartphone?	0
27404	50918	50919	What is the difference between host and server in terms of computer networking?	What is the best way to destroy a server farm?	0
27405	50920	50921	Can I take both long and short positions for same stock (say, SBI) in future trading?	What do you mean by long and short positions?	0
27406	50922	50923	How does stock market work?	Can anyone say me how does stock market works and who decide the price?	1
27407	50924	50925	Why are some people so interested in the lives of celebrities?	Why are people so interested in personal lives of celebrities?	1
27408	50926	50927	Does anybody know who this person on this book cover resembles?	Explain 'Naman Gupta' (CH15155)?	0
27409	50928	50929	How can I hypnotize someone to fall in love with me?	How can I fall in love with someone?	0
27410	50930	50931	What was the reason behind the Bhopal gas tragedy?	Has the Bhopal gas tragedy been solved?	0
27411	50932	50933	How do I start a roadside food stall in Mumbai?	What should I do for better business of my food stall?	0
27412	50934	50935	What are the class timings of coaching institutes in kota?	What is the cost of a hostel/PG in Kota?	0
27413	50936	50937	Why does clock show 10:10 in comercials?	Why every wall clock time is set 10:00 while purchasing?	0
27414	50938	50939	How does Simon Pierro (magician) perform magic tricks with an iPad?	Mentalism is it magic or trick?	0
27415	50940	50941	What should be the strategy to crack ipcc if I have 8 months?	How crack IPCC exam?	1
27416	50942	50943	What is the relative density of oil?	Is natural gas heavier than air?	0
27417	50944	50945	Im 20 now and I have wasted 3 years of my life doing nothing	Now that I'm 20 years old, how do I get over the time I've wasted in the past?	0
27418	50946	50947	Why do bloggers get paid?	How do bloggers get paid for their ideas?	0
27419	1829	50948	Does all Muslims hate Narendra Modi?	Why do most of Indian Muslims hate/against PM Modi?	1
27420	50949	50950	Why does the Different electrostatic charge attract?	How does a positive/negative charge repel/attract another positive/negative charge? How does electrostatic force act the mechanism?	0
27421	50951	32133	What will the RBI do with the old 500 and 1000 rupees notes that they will receive?	What will RBI do after receiving all the old 500 and 1000 notes? Will they burn those notes?	1
27422	50952	30380	How much are you willing to pay for a website?	How much does it cost to build a website?	0
27423	50953	50954	Does India deserve a permanent UN seat with veto powers?	Does India have a right to claim a permanent seat in the UNSC?	1
27424	50955	50956	How do private military companies advertise?	What does a private military company do?	0
27425	50957	50958	What are the best products for acne scars and redness?	What are the best products for acne scars?	0
27426	50959	50960	Are there modern-day descendants of the Mayans?	What were the uses of the Mayan masks?	0
27427	50961	50962	Nazism: Why is the symbol of Swastika adopted by Hitler slightly inverted?	Prior to Hitler and Mussolini, did politicians wear armbands with their party symbol on it?	0
27428	50963	50964	What tv show is like vikings?	Is there another TV series just like Vikings?	1
27429	50965	50966	Who is top EPC Company in Cement Plant?	Did ultimate Western acceptance of the military coup in Egypt encourage the attempted military coup in Turkey?	0
27430	50967	50968	How is group theory used in Neuroscience?	Are there (existing) applications of group theory in neuroscience?	1
27431	50969	50970	What are the meters a girls became a porn star?	What is the distinction between atom, molecule, compound?	0
27432	50971	50972	How does Morgoth's greatest servant compare to that of Sauron's?	What are the UGA SAT score requirements?	0
27433	50973	50974	How do I remove dark circles permanently?	How do I remove dark circles naturally?	0
27434	50975	50976	What is the smallest country in Africa by area?	Which country in Africa has a large Chinese population?	0
27435	50977	50978	How do I add a Contact Us page to a Facebook Page?	How do I add Facebook Page Tabs?	0
27436	50979	50980	What are some new business opportunities in India?	What are the new business opportunities in India?	1
27437	32503	2400	What is a plan for a 2 days/1 night trip to Goa?	How do I plan a 4 day trip to Goa?	1
27438	50981	50982	I have got 6 CGPA in Class X SA1. Can I get overall 9 CGPA in Class X?	I am really finding it difficult to understand market segmentation. Could anyone please describe?	0
27439	46039	407	Why do many distrust Hillary Clinton?	Why do people hate Hillary Clinton?	1
27440	50983	50984	What is the significance of the South China Sea?	Why is India getting involved in the South China Sea?	0
27441	50985	50986	How should I study to get good marks?	How can I get good grades without studying?	0
27442	42509	50987	Which is the best coaching institute for SSC CGL preparation in New Delhi?	Which is the best institute for SSC CGL preparation in Delhi?	1
27443	8730	46118	How do you post a question on Quora?	How do I place my first question on Quora?	1
27444	50988	50989	When does the covalent bond breaks?	What are covalent bonds?	0
27445	15427	50990	Fellatio: What is it like to give a blowjob?	What does it feel like to give a blowjob?	1
27446	50991	50992	What type government does North Korea have and how is it different from China's government?	What type of government does North Korea have and how is it different from China's government?	1
27447	50993	50994	What if I want to be forgiven for my sins in Hinduism?	Even after knowing that Krishna would kill Shishupal and only his 100 sins would be forgiven, why did he keep abusing him and not care for his life?	0
27448	50995	50996	How do WebSockets work?	How does Websockets operate?	1
27449	50997	50998	If I upload a pirated movie to Google Drive, only for me (not to share), could I get in trouble?	How do I upload PDF to Google drive by iPhone?	0
27450	50999	51000	How much would the founder/CEO make of a new commercial real estate firm that brokered eight off-market sales totaling $10 million?	Would the founder/CEO of a new/small realestate firm that did 25 broker deals this year totaling $55 million be making over 300k? What is his salary?	0
27451	51001	51002	How I learn Node.js?	Where can I learn Node.js?	0
27452	51003	51004	Where can I get very supportive learning environment to learn horse riding in Melbourne?	Where can I get a safe and supportive learning environment for horse riding in Melbourne?	1
27453	51005	51006	Is there an easy way to count the number of tweets posted with a specific hashtag?	Is there a way to count all the tweets in a certain hashtag in a given period of time?	0
27454	51007	51008	What's a great all-around lens for the Canon EOS Rebel T5i Digital SLR that's perfect for shooting children at home and outdoors?	What camera is better for the summer, the Canon EOS Rebel T5i or the GoPro Hero?	0
27455	51009	51010	Is there any list of Hackathons in Bay Area for 2016?	Which hackathons will be taking place in the Bay Area During Fall 2016?	1
27456	51011	51012	How good will be MBA from top B School after working in the Indian Armed forces?	After an MBA in marketing from a top Indian B school, is there a chance that I will be forced to have a sales job, instead of a marketing role?	0
27457	51013	51014	Can a man do sex in the night and do Pooja the next morning? What does Scriptures say about it?	How do I recover photos that weren't backed up on my iPhone 7?	0
27458	51015	51016	Does Quest Diagnostics detect human urine in a drug test?	Is there a drug test that can detect any drug that is in your system?	0
27459	51017	51018	How do I prepare for quantitative aptitude in NMAT?	How can I prepare for Quantitative Aptitude?	0
27460	51019	51020	What is Salesforce's market share in the SMB space (for their sales cloud application)?	What is the current market share of enterprise applications in the USA?	0
27461	51021	51022	Someone told me that nobody can predict the future. So, why do we believe in astrologists and spend so much on them?	Is astrology and believing in astrologists really helpful?	0
27462	51023	51024	What does Marc Andreessen do on the weekends?	What is Marc Andreessen like in person?	0
27463	51025	51026	Why does Reddit make only $10 million in revenue?	What makes a 100 million revenue?	0
27464	51027	51028	Where should I go to buy royalties and income producing assets? I'm looking for non-stock investments.	Where to invest? Tomorrow I will be going to invest stocks for the first time. Can any one suggest which one to buy? I will be investing 1k-2k INR?	0
27465	51029	51030	"Is a sequel planned for ""The Maze Runner"" film?"	Is there a Sequel for the maze runner?	1
27466	51031	51032	What are the differences between cheating and lying?	What's difference between lying and betraying?	0
27467	51033	12035	Can a PhD holder from other than IIT get into IIT as a professor?	What is the salary of an IIT professor?	0
27468	51034	51035	Can you lie with out lying?	Can you lie to yourself?	0
27469	51036	51037	What does it means that I dream about someone who I hate the most?	What does it mean to dream about someone smoking?	0
27470	51038	41225	How do I hack in Clash Royale?	How can we hack Clash of Royale without rooting?	1
27471	51039	51040	The decision of court of marbury v Madison case?	What was the decision of the court for the Marbury v. Madison case?	1
27472	51041	51042	Does inazuma eleven have episodes dubbed in English after its 66th episode?	Where could I get dubbed episodes of Inazuma Eleven after episode 66?	1
27473	27561	46521	What's the best earphones in India under 2000?	What are the Best earphones under 2000₹?	1
27474	51043	51044	Why do women like to wear tight jeans? Wouldn't they prefer to wear something more comfortable?	Why should a man not wear tights?	0
27475	51045	51046	What are intercultural relations? What are some examples?	In the hypothetical occurrence that HAARP exists, could hackers shut it down to end the drought? And allow the weather to balance it self out?	0
27476	51047	51048	How do phone sex hotlines work?	How do sex chromosomes work?	0
27477	51049	51050	What vegetarian diet should I follow to reduce 25kg in an year?	Uses of c++?	0
27478	51051	51052	How does RAC algorithm of indian railways work?	What are the amounts deducted if I cancel an Indian Railways ticket having status RAC and W/L respectively?	0
27479	51053	51054	I want to create a new brand of instant coffee. Where do I start?	How is instant coffee granulated?	0
27480	51055	51056	Do apps like Clean Master really work?	Do apps that clean junk like 360 Security or Clean Master actually work ?	1
27481	51057	5272	Does skipping increase height?	How do I increase the height?	1
27482	51058	51059	How do I improve my reading understanding in english?	How can I improve my English reading comprehension?	1
27483	51060	51061	What websites do you visit daily?	What are the websites you visit daily and/or most often and why?	1
27484	51062	51063	Are there any non-Iranian women on Quora who married Iranian men? How is your experience with your in-laws and other Iranians? What are some culture related challenges you face?	What should I know about Iranian/Persian women?	0
27485	43595	1841	Is vacuum energy infinite? If it is, how and why? Is it dark energy?	Can an infinite amount of dark or vacuum or gravitational energy be created with expansion?	1
27486	51064	51065	Why are the two American coasts more liberal than the centre of America?	Is New Zealand more racist than America?	0
27487	919	17399	Daniel Ek: Are there any future plans of releasing Spotify in India?	Daniel Ek: Why isn't Spotify coming to India instead of the huge internet consumption India has?	1
27488	51066	51067	Why there is no scope for an electrical engineer in isro?	What is the scope for electrical engineers in NASA/ISRO?	0
27489	51068	51069	"What do you think of the Clinton email discovered by WikiLeaks in which she forwards a translation that uses the phrase ""sand ni**ers""?"	Why do some people want Hillary Clinton in prison?	0
27490	51070	51071	Who is the most popular fictional character in Bangladesh?	Who is the most popular fictional character of all time?	0
27491	51072	51073	What are the career options after a bachelor's degree in pharmacy?	What are the career options after graduating with a Bachelor's in physics?	0
27492	51074	39185	Is Narendra Modi overrated?	Based on his performance so far, is Narendra Modi overrated?	1
27493	51075	51076	Should I buy the iPhone 7 if I currently have a 64 GB iPhone 6S? My iPhone 6s is working good but I just like new things	Should I buy iPhone 7 if I just recently bought iPhone 6s?	1
27494	51077	51078	What is a Horse Trainer?	What should a horse trainer wear?	0
27495	51079	47086	What are the best ways to advertise a YouTube channel?	What are the best ways to promote a YouTube channel?	1
27496	51080	51081	What happens if you rear end a police car or vice versa?	What would happen if a police car accidentally hit another car?	0
27497	51082	51083	Does infinity exist in nature?	Do infinities exist in nature?	1
27498	51084	51085	What is a chromosome?	What is chromosome?	1
27499	51086	51087	How is spam currently dealt with on Quora?	What is spam on Quora?	1
27500	51088	51089	What are the best ways to speed up my computer?	How do I speed up my computer?	1
27501	51090	51091	Can a sphere be represented in form of 2D?	What is the perimeter of a sphere?	0
27502	51092	51093	What is the best way to avoid becoming victim of favoritism?	What are good ways to learn to become the best leader?	0
27503	51094	23511	How important is sex in a successful relationship?	Is sex really that important in maintaining long term happy relationship?	1
27504	51095	51096	What is runtime error?	Why do I get runtime errors?	0
27505	51097	50929	How do someone fall in love?	How can I fall in love with someone?	1
27506	51098	51099	What are the weirdest sports?	What is the weirdest sport?	1
27507	51100	51101	Does the key of a song have any effect on its mood? Will a song written in D minor scale sound the same if it is played in E minor instead?	I am playing a song in the key of A, but instead of Fsharp, Csharp, Gsharp, the G sounds better natural. Can someone tell me what's going on?	0
27508	51102	51103	How many lobes does a liver have?	How many lobes does a liver have? What is the function of each one of them?	1
27509	51104	51105	How do I learn Unity tool?	What are some ways to learn unity scripting?	1
27510	51106	51107	If Britain decides to exit the EU, how would it affect the Indian Economy?	How will Brexit's exit from European Union affect the Indian economy?	1
27511	1749	25318	How can changing 500 and 1000 rupee notes end the black money in India?	The Indian government is banning the Rs. 500 & Rs. 1000 notes but it is coming up with the Rs. 2000 note. Will it not cause a generation of black money in the future?	1
27512	51108	961	Is it safe to lose 75 pound in 2 months?	Is it healthy to lose 13 pounds in a month?	0
27513	51109	51110	Is it possible to fly a commercial jet into space?	Why can’t an airplane just fly into space?	1
27514	51111	51112	What are some bad harem anime like Amnesia, Brothers Conflict, & Diabolik Lovers?	What do Anime fans think of Reverse Harem like Diabolik Lovers?	0
27515	51113	49664	Does House Baratheon have any future?	Is house Baratheon extinct?	1
27516	51114	25138	If Donald Trump wins the Presidency, what would you do?	What would you do if Donald Trump became POTUS?	1
27517	51115	51116	Who is ‏@Being_Humor on Twitter?	Who is ceoSteveJobs on Twitter?	0
27518	51117	51118	Does the 6 year course Pharm.D. (doctorate in pharmacy) have scope in the near future or is it a risk to enter this course? What can be the job opportunities available in this field?	How do I get job opportunities as a pharmacy doctor?	0
27519	51119	5241	What is the best way to learn and be fluent in a language?	How do I quickly and efficiently learn a new language?	0
27520	51120	51121	What is easy way to earn money without any investments?	What is best way to earn money without working hard?	0
27521	51122	12809	Can I get pregnant on my period?	Can I get pregnant if I have sex while I have my period?	1
27522	51123	51124	What is the best way to overcome a drug addiction?	How did you overcome your drug addiction?	1
27523	51125	51126	Are there any HFT firms trading in India?	What are some HFT firms in India?	1
27524	6551	44331	Why do people ask questions on Quora that are easily to find answers too on Google?	Why do people ask questions on Quora that are easily answerable via a quick internet search?	1
27525	51127	51128	What are the top escort services of India?	Which is the best escort service in India?	1
27526	51129	51130	What is a Dilophosaurus? When did they live?	How can I lead a healthy life?	0
27527	51131	51132	What is the best way to cut bell pepper (spears and diced) efficiently?	Where are dog parks in San mateo CA?	0
27528	20201	4416	What are ways to make money online at home?	What are some easy ways to make done extra money online?	1
27529	51133	51134	Mathematics books for Architectural modeling?	Do you feel anything (anything at all) when you hurt someone in any way, physically, emotionally, etc?	0
27530	23281	51135	How is Donald Trump going to make America great again?	What will Trump do to make America great again?	1
27531	51136	51137	Was Margaret Thatcher the most powerful democratically elected female world leader in history?	What made Margaret Thatcher the most powerful woman in the world during the 1980s?	1
27532	51138	51139	Where can I get the knowledge to build my own website?	How do I use my knowledge of HTML and CSS to create my own website?	0
27533	51140	51141	Where is it raining right now?	Has it rained where you live right now?	0
27534	51142	51143	How were the PhD placements at IIT Madras?	How is placement in MTech of EE at IIT Madras?	0
27535	39229	51144	How shall I stop watching porn?	Why should or should not I stop watching porn?	0
27536	33899	501	How do I recover my Gmail account when it does not open after password reset?	How can you recover your Gmail password?	1
27537	51145	51146	Why do you speak louder when wearing earphones?	Why do actions speak louder than words?	0
27538	51147	51148	What material harmonica should you buy?	Where can I buy harmonicas online?	0
27539	51149	51150	What are thoughts of a man falling from height to commit suicide?	Why are Jewish families so tight knit and helping each other out? Is family important in Jewish culture?	0
27540	51151	51152	Mathematics Student: How does one study Roots and Equations in Mathematics in very easy manner?	Mathematics Student: How does one study Mathematics in very easy manner?	1
27541	51153	51154	Can Enceladus (Saturn's moon) be seen from Earth using an amateur telescope?	How could I help my box turtle while she's laying eggs?	0
27542	51155	51156	When did someone save your life?	What saved your life?	0
27543	51157	51158	Why are some overseas Chinese students so reluctant to discuss their country's political system?	With over 300,000 Chinese students studying overseas in America and Europe every year, what kind of influences do they have on these schools and the local students?	0
27544	51159	51160	What are some of the important questions and answers for The Invisible Man novel in 12th CBSE?	"What kind of questions will be asked from ""The Invisible Man"" in English (Class 12)?"	0
27545	51161	51162	What's the inverse function?	What is inverse function? What are some examples?	1
27546	51163	51164	"I just saw ""Bourbon"" (brand KOVAL), label says ""distilled in Chicago"". But isn't it law that whiskey labeled ""Bourbon"" has to be made in Kentucky?"	Why doesn't Uber partner with Tesla?	0
27547	51165	51166	What is the best movie based on a video game?	Which is the best movie based on a game?	1
27548	51167	51168	What's it like to be gay in India?	How does it feel like to be a single closeted gay man in India?	1
27549	51169	51170	How can I easily pass the C2180-278 exam?	How can I easily pass the C2070-448 exam?	0
27550	51171	51172	What is difference between the fermenter and bioreactor?	What is the difference between a bioreactor and a fermenter?	1
27551	51173	51174	Is shoplifting a felony?	Is shoplifting a felony or misdemeanor?	1
27552	51175	51176	What song plays over the end credits to the movie Ring 0: Birthday?	How well known was Norman Reedus when he was cast in the movie Gossip?	0
27553	51177	20184	What are some toxic words that should not be used in a job interview?	What should you never reveal in a job interview?	1
27554	51178	51179	What animal has the longest jump?	What animal can run the longest?	0
27555	42515	51180	Which cream is best for removing dark spots in the face?	What is the best cream to remove white spots on face?	0
27556	51181	51182	What top 10 crooner songs should I start with if I want to get into that kind of music?	What are the top 10 songs of Justin Bieber?	0
27557	51183	51184	In English, why does the word “hundred” remain in its singular form regardless of the number preceding it (one hundred, two hundred, ten hundred)?	What is the origin and meaning of Everyone Dies™?	0
27558	51185	51186	How do I get job in banks?	How do you get a job in banking?	1
27559	51187	51188	What are the benefits of a gym membership at Anytime Fitness?	How much should a gym membership cost?	0
27560	41781	42662	What are the most weird facts about India?	What are some weird facts about India?	1
27561	51189	51190	"What is the origin behind the term ""raining cats and dogs""?"	"What is the origin of the phrase ""raining cats and dogs""?"	1
27562	51191	51192	Which video format does a DVD player play?	What DVD players have USB ports?	0
27563	51193	51194	How popular is Foursquare among students at the University of Washington?	How popular is reddit among students at the University of Washington?	0
27564	51195	51196	What is Delta V?	What does delta mean?	0
27565	51197	51198	How is professional life of engineers at Berlin?	Can I earn living though pranic healing in USA if I'm from India going to USA to settle?	0
27566	51199	51200	Why is depleting helium a problem?	What do world religions say about intellectual property?	0
27567	51201	51202	What is it like to have a huge penis?	What is it like to have a big penis?	1
27568	51203	51204	Halloween walk in York?	What is Halloween walk?	0
27569	51205	51206	What are the levels of Deep Web and what kind of security measures does one need to get there and why?	How secure do you need to be in the Deep Web?	0
