id	qid1	qid2	question1	question2	is_duplicate
27749	51522	51523	About how many vacuum valves/tubes were there in the Colossus?	How was possible for Colossus to work without a software?	0
27750	51524	51525	What is a good bulk email software to promote in the UK?	What's your best bulk email software of choice?	0
27751	51526	51527	Why is time measured in seconds, minutes and hours?	Can time be measured by any another unit than hours, minutes or seconds?	1
27752	51528	32509	Considering I am an international student, should my plan to study in the US be scrapped in a Trump Presidency?	I am an Indian student going to the US in Fall 2016. How bad will it be for international students if Trump gets elected as President?	1
27753	51529	51530	How can I deal with my transphobic parents?	Trans adults: How did you deal with transphobic parents?	0
27754	36645	51531	What are the differences between AM and FM radio frequencies?	What is the difference between AM and FM radio waves?	1
27755	51532	51533	What is the limit of (x^2-x) /(x-x) as x approaches 1?	What is the limit of 1 as 2 approaches 3?	0
27756	51534	51535	Could steel beams be melted by jet fuel?	Does burning jet fuel melt steel beams?	1
27757	51536	51537	Can a pure fusion weapon be made by a large amount of ground-based explosives?	Can a pure fusion weapon be made using a detonator composed of high explosives?	0
27758	51538	51539	What’s the least expensive way to fly business class?	What's the best way to fly business class cheaply?	1
27759	51540	51541	How do I cover up the holes in my face that are caused due to pimples/acne?	Can acne be caused by lotion on the face?	0
27760	51542	51543	What would the world be like if Nazi Germany had never lost the war?	What would the world be like now in 2016 if Hitler's Germany won the war?	1
27761	51544	51545	What books do I read to improve my writing skills?	I want to be a writer. What can I do to improve my writing skills?	0
27762	51546	51547	Is Hillary Clinton's political career over?	Is Hillary Clinton's political career effectively over?	1
27763	51548	51549	What are some of the best coaching centres for Google SketchUp in Bangalore?	Is CatalyseR a best coaching centre?	0
27764	51550	51551	How can a short man inspire respect in others, like taller men do?	What can short men do to ensure that when they are competing with a taller man for a job, they are just if not more competitive than him?	1
27765	51552	51553	What is best, average, worst case time complexities of merge and quick sorts?	What is best algorithm run time complexity?	0
27766	51554	51555	Were the Victorian nobility better educated than current Harvard graduates, in terms of being extremely suited for certain tasks that require a high cognitive load?	Why is Suits so obsessed with Harvard?	0
27767	51556	51557	IBPS will not conduct an exam after 2018, is it true?	What is significance of IBPS PO exams when every bank is conducting their own PO exam?	0
27768	39658	51558	Which phone should I buy under INR 15K?	What is the best phone I can get for below 15k?	1
27769	51559	51560	What is Cultural Marxism?	What exactly is cultural Marxism?	1
27770	51561	51562	Koffee With Karan: How much money did Star World India make from 1.9 million views on Salman Khan's YouTube episode?	How much money do YouTube Partners make?	0
27771	51563	51564	What does an Oxford University degree look like?	How hard is it to be accepted into Cambridge astrophysics?	0
27772	51565	51566	How can I share my content?	What kind of licenses and permits I need to obtain to open a brewery which will serve only beer and food?	0
27773	51567	51568	My Nexus 6 phone has been heating a lot lately anyone have any suggestions to make it cooler?	I have been using my Nexus 5 for the past 6 months. For the last 15 days (maybe after updating to Lollipop 5.1) it has been taking around 2 and half hours to charge from 0-100%. Earlier it was 1 and half hours. Is that a Lollipop 5.1 problem or a battery issue?	0
27774	51569	51570	Are cryptic pregnancies real?	What is the earliest day after a missed period that a person can take a home pregnancy test and expect it to be accurate?	0
27775	33347	51571	What are the best sources for news?	What is the best news source?	1
27776	51572	51573	Which is the best social network?	Social Media: What's the best social networking site in your opinion?	1
27777	51574	46008	Which language has the most words?	Which is the most used word in Hindi language?	0
27778	2855	8014	Should I ever care what people think of me?	As an individual, do I really need to care what people think about me?	1
27779	51575	51576	I have a 2 year restraining order & a complaint filed against me also. If they do not find any evidence and don't prosecute me, can I get it removed?	Can you file a restraining order if you are under 18 years old?	0
27780	51577	51578	Which is faster, better, and cheaper UPS, FedEx, or USPS?	What is the difference between Purolator, FedEx, USPS and DHL?	0
27781	51579	51580	How do I cancel/terminate a job flow *step* on Elastic MapReduce?	How can I write a Mapreduce program base on Hadoop?	0
27782	51581	51582	Similar working app as whtsdog?	What is the hardest things about raising three or more children in Silicon Valley?	0
27783	51583	24387	Why is the President of the United States of America sometimes referred to as the leader of the free world?	What would be some pros and cons of Donald Trump becoming president?	0
27784	51584	51585	Who was the most ignorant person you have ever met in America?”	Who was the most ignorant American you have ever met?	1
27785	50405	51586	What is ultimate purpose of life?	What is the purpose of life? Why are we here?	1
27786	51587	51588	When was the tradition of Breast Cancer Awareness Month started?	How was Breast Cancer Awareness Month started?	1
27787	51589	51590	What are the pros and cons of an open relationship?	What are the pros and cons of an open marriage or open relationship?	1
27788	51591	51592	European Union: How successful is the EU?	European Union: How can we get towards a more democratic EU?	0
27789	51593	5734	How can boost my metabolism and burn calories while sitting at a school desk?	How can I boost my metabolism?	0
27790	51594	51595	How do I uncollapse an answer, edit?	How do you uncollapse an answer?	1
27791	51596	5643	Why did Yahoo answers fail and Quora succeed?	How has Quora succeeded where websites such as Yahoo and Reddit have failed?	1
27792	51597	51598	Which country gives quick and easy PR if you go their to study in Nursing and in how many years between Australia, Canada or New Zealand?	Which country gives quick and easy PR if you go their to study diploma in IT and in how many years between Australia, Canada or New Zealand?	0
27793	51599	51600	What would happen if you switched a chickens egg for a crows egg (or any other specie of bird that flies) without the hen noticing?	What is the least harmful food for your health if you are a vegan and didn't find other options. Eggs, cheese or fish?	0
27794	12718	7801	How do I earn money from the Internet?	What are the easiest ways to earn money online?	1
27795	51601	51602	What is your favorite flavor?	What's your favorite Coffee flavor?	0
27796	51603	51604	What are the best alternative career options for a teacher?	What are career options for a high school teacher?	1
27797	51605	51606	What is your rank and marks in neet 2016?	How was your NEET result?	1
27798	51607	51608	What would you name your autobiography? Why?	What would you name your autobiography?	1
27799	51609	51610	Which are the best laptops of asus in range 30k-40k?	What is the best laptop in the range of 33k?	0
27800	51611	51612	What investment is required to open a mini supermarket in India?	How much money is required to open a medical store in India?	0
27801	51613	51614	What are the biggest human resources challenges in China?	How do you contact Walmart's human resources?	0
27802	51615	51616	Is it okay for a 19-year-old to go out with a 16-year-old?	How should a 16 year old guy ask a 17 year old girl out?	0
27803	51617	24296	How can I realistically make money online?	How do I earn money online?	1
27804	51618	51619	What is the most nostalgic anime in your opinion?	What anime makes you nostalgic in your opinion?	1
27805	51620	51621	Does Hillary Clinton have Parkinson's Disease?	Does Hillary have Parkinson disease?	1
27806	51622	51623	Who makes up the executive management team at Facebook?	How did Facebook acquire an amazing management team from where it started?	0
27807	51624	51625	Which should I pursue first CCENT or CCNA? I have to do CCNA but should I pursue two exam route or one exam just for CCNA?	How do I prepare for a CCNA certification exam?	0
27808	51626	51627	What would happen if I drop a fighting fish into a koi pond?	"Why doesn't the U.S. take its strategic, land-based missiles off ""hair trigger” alert?"	0
27809	51628	51629	Sunlight radiation are made with electric and magnetic field or photon? Show with diagrame?	What does a fire protection engineer do?	0
27810	51630	51631	"Why in astronomy is distance measured in light ""years""?"	How do they measure that some star is at 100 light years away?	0
27811	51632	51633	What is it like to live in Alaska?	What's life like in Alaska?	1
27812	51634	51635	Why do mineral acids denature proteins?	How do alcohols denature proteins?	0
27813	51636	51637	What is base reality?	What is the file format for 360 VR pictures?	0
27814	51638	51639	Why do most of the characters in Netflix Daredevil carry Android phones?	What is the most common hidden spy app for android phones?	0
27815	51640	36823	How should I stop myself from useless thinking, and understand things better?	What's an efficient way to overcome procrastination?	0
27816	51641	51642	Is continuous glucose monitoring test worth it?	Continues glucose monitoring test, is it worth doing?	1
27817	51643	51644	What diseases are caused by lymphs?	What diseases are caused by bacilli bacteria?	0
27818	51645	51646	Where do I get the best health insurance under the Affordable Care Act?	How can I sign up for health insurance coverage under the Affordable Care Act?	0
27819	51647	45494	What are some really interesting facts about Pokémon GO?	What are some mind blowing facts about the game Pokémon GO?	1
27820	51648	51649	What is it like losing your virginity?	What is it like to lose your virginity before puberty?	0
27821	51650	51651	Can yoga cure my psoriasis?	Can yoga cure psoriasis?	1
27822	51652	51653	"How do I reply formally to an email saying ""Please confirm the receipt of this mail""?"	"How can I write ""please confirm me after receiving my mail"" in Japanese?"	0
27823	51654	51655	How do I know when my spouse is having an affair with someone else?	How do I know that my spouse is cheating on me?	1
27824	17462	51656	Why don't we seek conviction in life?	Why do we keep running for money our whole life, while the real satisfaction is in helping others and enjoying life?	0
27825	51657	51658	How does a massage therapist know when they are good at what they do?	What is being a massage therapist like?	0
27826	51659	51660	Which is the best tricky question for IT quiz?	How can I get better at quiz questions?	0
27827	45391	51661	Why do some people believe that the world is flat?	Why do some smart and wise people think Earth is flat?	1
27828	51662	51663	Do some Quora moderators mark questions as needing improvement if it goes against their personal beliefs?	"What should I do if Quora marks my question as ""Needs Improvement""?"	0
27829	51664	51665	How do lectures affect the relative ratio of brain waves (alpha/beta/gamma/theta/delta)?	How does meditating affect the relative ratio of brain waves (alpha/beta/gamma/theta/delta)?	0
27830	51666	51667	What are the basics of Digital Marketing?	What is digital marketing?	1
27831	51668	51669	What are the moral and legal reasons behind Indian govt. not banning use of alcohol and tobacco?	What is a Maybelline lipstick made of?	0
27832	51670	51671	What does carbonation do?	What is carbon space?	0
27833	51672	51673	What is the full form of the GPL in IIT KGP?	What is wrong with IIT KGP?	0
27834	51674	51675	What it is like to touch the boobs of a woman for the first time?	"Is it bad for a woman to ""adjust"" her boobs in public?"	0
27835	51676	51677	What are some arguments to counter American exceptionalism?	Is American exceptionalism an enemy of truth?	0
27836	6079	46127	Now that Donald Trump is President, will international students stop coming to US universities?	How would it affect Indian students studying/working in the US if Trump becomes the President?	1
27837	51678	51679	Is 112 a prime or a composite number?	Is 51 considered a composite number?	0
27838	8483	51680	When will Apple release the next generation of MacBook Pros ?	What upgrades are expected with the next MacBook Pro with retina display and is there a firm release date?	1
27839	36709	51681	Which is the best tourist place in Kerala?	What are the best places to visit in Kerala? What is the best way of transportation there?	1
27840	51682	51683	How can an Indian apply for Sri Lankan travel Visa?	How can an Indian apply for a Sri Lankan travel visa?	1
27841	51684	51685	Can bumble track your location even if you are not active? For example, if you are not currently using the application will it update where you are?	Why am I not getting any likes on Bumble?	0
27842	365	51686	What if I hired two private eyes and ordered them to follow each other?	What would happen if you hired two private detectives to spy on each other?	1
27843	51687	51688	Stephen Hsu (physicist): What does Stephen Hsu think of MOOCs?	Stephen Hsu (physicist): What does Stephen Hsu think of reddit?	0
27844	51689	51690	How do I explain to my mother the difference between an iPhone and an Android phone?	What are the similarities and differences between iPhones and Android phones?	0
27845	51691	51692	Why would your mortgage company call you several times and ask you to fill out another modification when they know they will not change the payment?	"So when they ask in an interview, ""Why do you want to work for this company,"" would it be inappropriate to burst out laughing?"	0
27846	32540	51693	"What is the difference between infatuation and ""real love""?"	How would you differentiate between infatuation and love?	1
27847	51694	51695	How can I lose my weight quickly without doing exercise?	Can you lose weight without exercising?	1
27848	6367	3575	How do you delete a question on Quora?	How do I delete my question from Quora?	1
27849	51696	51697	Why are Americans so impatient?	Why do Americans seem so impatient?	1
27850	51698	51699	32:9::62:15::78:29::96:? What is the next number	Do you use protractor for e2e testing in real-life projects?	0
27851	51700	51701	What would Bran do if Jon became king?	What would Petyr Baelish do if Jon became king?	0
27852	8353	43097	What's your new year resolution for 2017?	What will be your new year resolution for 2017 and your plan of execution?	1
27853	51702	51703	How much money will Bill Ackman lose on the Herbalife short?	How much money can Bill Ackman earn in his short position on Herbalife, considering the best case scenario? If he isn't successful, how much can he lose?	1
27854	51704	51705	Why do most women shave their pubic hair?	Why don't Asian women shave their pubic hair?	0
27855	40638	51706	What force caused the Big Bang?	What are some theories as to what could've precipitated the Big Bang?	1
27856	51707	51708	Who are the best question writers on Quora?	Who asks the best questions on Quora?	1
27857	51709	51710	What's something you have to do to feel alive?	What makes you really feel alive?	0
27858	51711	51712	Why do girls give mixed signals and not talk directly?	Why do girls give mixed signals?	1
27859	17812	18296	Why do so many people on Quora ask stupid questions they could find answers to if they spent less than 5 minutes on a search engines?	Why do some people on QUORA ask questions that they can easily findout on Google?	1
27860	51713	51714	Is there such thing as false positive pregnancy test?	How common are falsely positive home pregnancy tests?	1
27861	51715	51716	What is the best business school in California?	What are the top business schools in California?	1
27862	51717	51718	What is the Taj Mahal?	Is the Taj Mahal worth visiting?	0
27863	51719	51720	Who has the highest chances of winning the Punjab 2017 elections?	Who is winning the 2017 Punjab election?	1
27864	51721	5167	How do you get rid of acne scars on your chest?	How can I get rid of acne and its effect?	1
27865	51722	51723	Why has flipkart acquired Jabong although it already has Myntra?	Why did Flipkart acquired Jabong though they have Myntra?	1
27866	51724	51725	If the universe is in a singularity, how would you explain the fact that the universe has scale?	How would a philosopher explain the origin of the universe?	0
27867	51726	51727	Is $10,000 per month a good income or only fair?	TV actors here earn 25,000 - 45,000 per day, while an engineer gets 15000 - 2000 per month. Is that unfair?	0
27868	10523	19980	Who is winning the presidential election, Trump or Clinton?	Who will be USA next president, Trump or Clinton?	1
27869	51728	51729	Why do outer stars in galaxies rotate so quickly?	How come the stars at the outer edge of the galaxy are rotating at the same speed as the stars towards the center?	0
27870	51730	51731	What is the best way to get rid of social phobia?	How can I get rid of social phobia?	0
27871	1120	20514	What can be the medium budget to visit best places in Kerala for three members (2-3 days)?	What are the best 10 places to visit in Kerala including any falls?	1
27872	51732	51733	How much would you pay for someone to drive you and your car back home after a night of drinking?	How does sociological imagination help challenge stereotypes?	0
27873	51734	51735	What are some ethical issues that Atheists might have with Christian and Islamic ethics?	What are some of the reasons that some smart people might be underutilized at work and not advance very quickly, despite being ambitious with a good work ethic?	0
27874	51736	51737	Who would win in a fight between Superman and the Hulk?	Who would win in a fight between banner Hulk and Thing?	0
27875	51738	51739	"Why are the ""chosen"" so dumb?"	Why was the M16 chosen?	0
27876	51740	51741	What are the best selling products?	What is a good product to buy and sell?	0
27877	51742	51743	What is the best way to buy medical and term life insurance, online or via an agent?	If God is omniscient, having always known everything he would ever do and not do, can he have free will?	0
27878	51744	51745	What are the best online shopping hacks?	What are some useful online shopping hacks?	0
27879	51746	39319	What should you do if you break up?	What is it like to break up?	0
27880	51747	51748	What preparation should I do to score good marks in 1st year English hons. CALCUTTA UNIVERSITY?	What are the tips to increase marks in Calcutta university?	0
27881	51749	51750	What is the difference between adsorption and absorption?	Difference between acidic and basic oxides?	0
27882	51751	51752	What are the best sex positions to help women orgasm?	What is the best way to make a woman orgasm?	0
27883	51753	51754	Does dark matter ripple when galaxy clusters collide and wave in a double slit experiment?	Does superfluid dark matter ripple when galaxy clusters collide and wave in double slit experiments?	1
27884	51755	51756	From where I can buy bitcoin?	Where do I buy bitcoin?	1
27885	51757	51758	What are adjectives used to describe winter?	Why do people use some adjectives to describe a noun when the meaning of that adjective is already reflecting in the noun?	0
27886	51759	51760	Can anyone guide me is ACCA beneficial in today's world and what are the opportunities available in ACCA?	I speak two languages. I want learn Japanese too. How can I learn it?	0
27887	51761	51762	What are some strange experiences people have had at a haunted location in Japan?	What are some strange experiences people have had at a haunted location in London?	0
27888	51763	51764	Are you going to vote for AAP- Aam Aadmi Party in the upcoming election?	Why should I vote for AAP (Aam Aadmi Party) in the 2014 elections, when I know that they can't win the majority?	0
27889	51765	51766	How do I prepare for GMAT Exam within 4 months?	How can I prepare for the GMAT exam in 1.5 months?	0
27890	51767	51768	How long should I wait to text?	How long should I wait to text her back?	1
27891	51769	51770	How can i get rid of lower back pain?	How do I get rid of lower back pain?	0
27892	51771	51772	What are examples of biodiversity?	What are some of the key aspects of biodiversity?	0
27893	51773	51774	How is the nursery web spider poisonous?	Is the nursery web spider bite dangerous?	1
27894	51775	51776	What are some suggestions and tips to (STAY) happily married?	Can two INTJs stay happily married?	1
27895	1214	26856	Can World War 3 ever take place?	How likely is World War III in the future?	1
27896	51777	51778	Gun control prevents crime?	Does Chicago have high gun crime because it has strict gun control or gun control because it has high crime?	1
27897	51779	51780	What is asexual reproduction? What are the pros and cons?	Why did things evolve to require two to reproduce?	0
27898	51781	51782	English Grammar: Why is bra singular but panties plural?	Why is 'bra' a singular and 'panties' a plural?	1
27899	7802	51783	How do I keep myself from getting distracted?	How should I stop myself from getting distracted while studying?	1
27900	51784	51785	How is the word 'scold' used in a sentence?	How is the word 'temerity' used in a sentence?	0
27901	5912	51786	Who do you think would win the 2016 USA Election?	Who do you think is going to win the 2016 presidential election?	1
27902	51787	51788	Which are the best of the best earphones for the ultimate bass, within Rs. 1000?	Which is the best bass in headphone under 1000?	0
27903	34754	51789	Do Mormons believe that Satan is the true God?	Do Mormons believe that God was human first?	0
27904	3544	14931	What will be the result of banning 500 and 1000 rupees note in India?	How do you see the PM Modi’s move of banning old 500 and 1000 rupee currency notes?	1
27905	51790	51791	Why use condensed milk in mirror glaze?	If water evaporates at 100°C then why after you shower is there condensation on the Mirror? The water couldn't have been over 70°C because you would have gotten burnt. So why is there condensation on the mirror?	0
27906	51792	51793	How credible is Wikipedia Watch?	How credible is Wikipedia?	0
27907	51794	51795	I am 13 years old, I live in Romania and I'm constantly verbally and emotionally abused by my father. How can I deal with his abuse?	How should I deal with a verbally and emotionally abusive person?	0
27908	51796	3785	Why do all of my questions get marked as needing improvement?	I can't seem to ask anything anymore. Why does Quora keep marking all my questions as needing improvement?	1
27909	51797	51798	How can I make myself smart?	How can I make myself confident and smart?	0
27910	51799	51800	How can I extract all tweets posted from a certain geographical area during a certain period of time?	How can I download tweets that contain a certain keyword, and tweeted between certain time period?	0
27911	51801	51802	Are there any plans on Quora to implement a status system, be it a contribution-based point system or icons that appear next to my name on my profile?	How does Quora's real name validation algorithm work?	0
27912	51803	51804	(2016) Will fixed deposit rates go up again in India? If so, how soon/long?	Generally the rate of interest for fixed deposit should increase with the increase in tenor. But SBI (State Bank of India) rate of interest for fixed deposit increases upto 3 years and then again decreases. Why is it so?	0
27913	51805	4875	Can men ejaculate during intercourse without having an orgasm?	How does one ejaculate without achieving orgasm?	1
27914	51806	51807	How do I maintain motivation to lose weight?	How do you keep motivated to lose weight?	1
27915	38255	38363	How can I lose weight fast and never gain it again?	I have to reduce my weight by 15 kgs. What is the healthy rate at which I should aim to reduce per month? 21yr old-female-66kg-5.2ft?	0
27916	51808	51809	What is urban culture music?	Why so many pianists and cellists in Croatia? Is it a culture to learn music there?	0
27917	51810	51811	What are roller coasters like?	Why do people like roller coasters?	0
27918	51806	51812	How do I maintain motivation to lose weight?	What motivates you to lose weight?	1
27919	51813	45966	How many Indians listen English songs and watch English TV series just to show off?	Suggest a name for movie app in iOS?	0
27920	51814	51815	How do an IR transmitter and receiver work?	How does an IR sensor work?	0
27921	51816	51817	How can one attend the 7th national marketing conclave of KIIT school of management ?	How can chronically ill children be educated AND allowed to miss school without being treated as truant when the school requires a minimum number of days of attendance?	0
27922	51818	51819	What business model does olx use?	What's the business model of OLX?	1
27923	51820	51821	It is possible to put fuel injector in petrol engine?	Can we use two fuel injectors in a diesel engine?	0
27924	51822	51823	Is the minimum package for a CSE undergraduate from PES University 6.5 LPA?	Is paying 2.8 lakh per annum at PES University really worth it? At least for the CSE branch?	0
27925	23752	21153	How do I reset my Gmail password when I don't have access to my recovery information?	How can I reset my Gmail password if I don't remember my recovery Email and current password?	1
27926	51824	51825	How is the working environment and career growth at Compro Technologies? What are the pros and cons of working here?	What are the pros and cons of working at D. E. Shaw?	0
