id	qid1	qid2	question1	question2	is_duplicate
162359	4905	212788	What are some good non-fiction books that I should read?	Which are the best non fiction books you have read?	1
162360	252768	252769	How can I choose between 2 cities to live in?	Why is Target so successful?	0
162361	252770	227205	Are you single? Why?	Are you single? Why or why not?	1
162362	252771	252772	Why am I unable to ping another computer in the same local network?	Is computer networking and network computing the same thing? If not, what's the difference?	0
162363	49659	251500	Where can I get a list of U.S. family offices?	Where can I get a list of family offices in China?	0
162364	252773	252774	Do rhinoceros have any predators?	What are rhinoceros predators?	1
162365	252775	252776	Does Civilization 6 have a large toll on the system you are running it on?	A computer program needs certain amount of RAM to run. How is that decided? Does it largely depend on size?	0
162366	252777	252778	What is your to-read list?	What's a reading list?	0
162367	252779	252780	Why is 21 Pilots unique?	What effects do Maruchan soups have in your organism?	0
162368	252781	252782	How do you become a Starbucks gold member?	Why is Starbucks so popular?	0
162369	252783	252784	I feel like if there is something in my eye but there is nothing, why?	What should I do if I feel like I have something in my eye?	0
162370	72957	68209	What would be the best book to begin with for Java?	What is the best book for beginners to learn java?	1
162371	422	252785	If Hillary Clinton can no longer serve as the Democratic nominee how would her successor be chosen?	If Hillary Clinton is assassinated before the election, how will the Democratic nominee to replace her be chosen?	1
162372	252786	252787	How could we theoretically enhance speed?	What makes Islam attractive to prisoners and convicts?	0
162373	252788	252789	What is a good weight gain supplement for a tall, skinny guy with high metabolism and IBS?	I am feeling desperate about my studies what should I do?	0
162374	111546	132729	What would the world look like if the Nazis won the war?	What would the world be like if the Nazis had won?	1
162375	252790	252791	What are the easiest software companies to join?	How do I get out of this IT company and join some real software company?	0
162376	102820	182287	Will starving yourself make you lose weight?	Would starving yourself make you lose weight faster?	1
162377	72439	102886	How should I start learning Python for Data Science?	How do I start learning Python modules?	1
162378	235596	21056	Can you get pregnant 4 days before ovulation?	Can I get pregnant the day before ovulation? Why or why not?	0
162379	252792	252793	Does Yayoi kusama has a mental disorder?	What are some rare and strange mental disorders?	0
162380	252794	252795	How do intermediaries and public's affect the business in transport services of any kind?	What kind of software do you need for your business?	0
162381	128216	144375	How do I get winter internship at iit for electrical student?	How do I get internship at any of the IITs or IISc?	1
162382	252796	252797	How can a newbie learn the Protractor testing tool for AngularJS?	Why is it better to learn ReactJS rather than AngularJS for a newbie?	0
162383	252798	252799	How does Facebook arrange the order of the people who like your photo or status?	How is it that Facebook can request photos of people's license or ID in order to either ban them or have their name changed?	0
162384	252800	252801	What are some things to do while visiting Lebanon that a tourist might not know about?	What are some things to know before visiting Lebanon?	0
162385	105498	252802	: I have small pimple inside right testicle on uper side and feel pain on touch this particle can i cure without any medical trearment urologist?	I am worried, as I just noticed swelling on my upper back & I feel like a part of my upper spine is bulging out. Is this because of sitting wrong/my sleeping posture? Can it be made right?	0
162386	252803	252804	Should healthcare be free for everyone? Why or why not?	Healthcare should be free?	1
162387	220760	5241	What should I do to learn new language?	How do I quickly and efficiently learn a new language?	0
162388	252805	252806	Which countries are a part of Europe?	How many countries are there in Europe?	0
162389	252807	252808	Canada: In Canada, is Canadian PR as good as Canadian Citizenship for practical purposes?	Can a parent or relative living on sponsored Canadian PR, work in Canada?	0
162390	252809	4087	How do you fist a girl?	My boyfriend wants to have anal sex with me; will it hurt or feel good?	0
162391	252810	55479	What series would you recommend on Netflix?	What movie should I watch on Netflix?	1
162392	252811	252812	What are the all time best songs about loving yourself?	What are the best songs about loving yourself?	1
162393	252813	252814	What are some lesser-known sights to see when visiting Chillán, Chile?	What are some lesser-known sights to see when visiting Iquique, Chile?	0
162394	252815	252816	How accurate are horoscopes, astrology, numerology, etc?	If numerology/astrology worked, would it mean that we are living in a simulation?	0
162395	85165	14927	How do I lose weight ayurvedically?	How do I lose weight without quitting?	1
162396	165823	252817	What are the characteristics of Hogwart's houses in Harry Potter? What is their role and what do they represent?	Were there any notable British actors who did not get a role in Harry Potter?	0
162397	252818	252819	How have the uses of sucrose changed over time?	Is it advisable to apply to different colleges with different majors?	0
162398	252820	129371	Why did Prophet Muhammad (P.B.U.H) from Mecca became a prophet?	Who is Prophet Muhammad?	0
162399	191934	252821	Why does Quora sometimes mark questions needing improvement even before I have the time to write the question details?	Why does Quora mark some questions as needing improvement faster than a human can read them?	1
162400	252822	252823	It has been said the BBC had broken some agreements about the India's Daughter documentary. What are those? What action is being taken for this?	"Will the documentary ""India's Daughter"" actually offend Indian audiences?"	0
162401	252824	252825	In a startup, how long does $1 million funding usually last?	How long does it take (unless it varies) for a startup to get the money from a funding round?	0
162402	132103	252826	What is the most demanded OpenStack certification?	What is the most popular IT certification by number of holders?	0
162403	42062	8030	How can I get rid of keratosis pilaris at home?	How do I get rid of keratosis pilaris?	1
162404	252827	252828	How similar is Russia Bratva in real life compared to Russian Bratva in Arrow TV show?	Why would an ex or current Russia FSB member handle security for a small sect of the Bratva?	0
162405	252829	252830	How can I reduce my weight by 10kg and become trim and fit in one month?	How do I reduce my weight by 10kg in one month?	1
162406	39526	252831	How do I learn neural networks?	What is the best way to learn neural networks?	1
162407	7016	10322	How can I lose weight safely?	How can I lose 4kg weight?	1
162408	252832	252833	What is the web site for Westinghouse?	Will I get medical college with 2403rank in kcet?	0
162409	252834	252835	Me and my boyfriend are breaking up cause we don't have future, should I move on or wait for him to come back resolving his problems What should I do?	Which is the best current affairs magazine to follow for the bank PO exams?	0
162410	61456	1812	Why has the Tata Sons Board voted to remove Cyrus Mistry as chairman?	Why TATA sons replaced Cyrus Mistry to Ratan TATA?	1
162411	187680	252836	Should I have one or two YouTube channels? I want to have a channel for like skits, challenges, vlogs, pranks, fishing and hunting?	Should I continue my lame YouTube singing channel or start a new one, a channel about lifestyle and fashion?	0
162412	252837	252838	What are the best aspects of living in Reading, UK as a young adult?	What are the best aspects of living in Glasgow, UK as a young adult?	0
162413	252839	252840	What is selective pressure?	What is selection pressure?	1
162414	252841	252842	What are the chances that ISRO will recruit engineers in 2017?	What are the chances of ISI agents working in ISRO?	0
162415	252843	252844	Has anyone been contacted for the Microsoft explore program 2016?	What programming skills would behoove a student applying for the Microsoft Explore Program or Google Engineering Practicum?	0
162416	252845	252846	What is freebasics?	What is freebasics by Facebook?	0
162417	252847	252848	How should I study for engineering first year?	How do I study for first year engineering?	0
162418	252849	252850	What is conceptual analysis?	What is a conceptual model?	0
162419	72725	252851	How do you fall asleep fast when you are not tired?	Why does it take me at least 1 hour every night to fall asleep, even when very tired?	0
162420	17231	10695	Forgot my Facebook password and email password. How can I log into Facebook?	How do I log in my Facebook account if you forgot your password?	1
162421	252852	252853	When is Amniocentesis performed?	What is amniocentesis in biology and how is it used?	0
162422	252854	252855	Modi taunted 1.3 billion people at Japan on demonetization with laughter, day later he is weeping like a kid? Why Modi is so inconsistent?	Is Xiaomi going to release the Mi notebook air in India?	0
162423	109131	252856	Is vaping without nicotine bad for you?	How bad is it to get nicotine in your mouth?	0
162424	35060	1834	What are the best romcom movies?	What are the best romantic comedy movies?	1
162425	182618	252857	How can I increase my concentration?	How I increase my focus in study?	1
162426	14958	162765	Where can you find out what needs to be improved if your question was marked for needing revision?	What should I do when someone marks my question as needing improvement?	1
162427	252858	252859	How can you uninstall iMesh from your computer?	How can you uninstall iMesh from your PC?	1
162428	157947	252860	Which is the good broadband providers in Bangalore?	Which is the best broadband provider in bangalore?	1
162429	252861	252862	Is pork roll and eggs an unhealthy breakfast?	Is it okay if we eat two eggs daily in our breakfast?	0
162430	75237	15970	How do I apply for pan card (lost)?	How do I apply for PAN Card?	1
162431	110344	122157	How should I study for CA CPT to get a rank?	How do I get a rank in CA CPT and is two months of preparation enough to get it?	1
162432	252863	51031	How cheating is different from lying?	What are the differences between cheating and lying?	1
162433	69715	252864	Will the iPhone 6 be the most technologically advanced phone on the planet so far?	What is the most disappointing aspect or feature of the new iPhone 6?	0
162434	252865	252866	What are the main differences between French culture vs American culture?	How is American culture different from that of the French?	1
162435	252867	252868	Inspiron 13 7000 series or XPS 13 or Macbook Pro 13 or Macbook Air 13: I am a developer works on Ubuntu OS. Which one should I buy?	Which color could go well with the following color?	0
162436	252869	252870	Give me some names of famous GSB people and their contribution to industry in India?	What does it mean to have a personal relationship with Krishna, Jesus, Allah or Yahweh?	0
162437	252871	252872	Who should have won the 2012 Nobel Prize in Physics?	Who should have won the 2013 Nobel Prize in Physics?	0
162438	252873	252874	What are some of the best ways to save money at an airport?	What is the easiest way to save money?	0
162439	252875	252876	What was the marketing budget for Subway Surfer?	What is the marketing budget of subway surfer?	0
162440	133195	77023	How do you make money?	What is the best way to to make money?	0
162441	252877	252878	If you are too ugly to date, is it better to have sex with prostitutes or stay alone?	I'm a 14 years old boy and I had sex with a 12 years old girl, with her consent. Is there anything wrong?	0
162442	252879	51821	What are the advantages and disadvantages of swirl motion inside IC engine?	Can we use two fuel injectors in a diesel engine?	0
162443	2929	37759	What happens to a question on Quora if it is marked as needing further improvement?	What should I do if my question is being marked instantly as needing improvement but I don't know why?	1
162444	252880	252881	Is the 2016 MacBook Pro worth it for programmers?	Is it worth it to buy a MacBook Pro 2015 instead of the new MacBook 2016 model?	0
162445	252882	252883	Advice for getting a store/sales associate job at free people or urban outfiters?	How can I get a job with Free People?	0
162446	252884	252885	Can I connect my PS3 to my laptop and use it as a screen?	Can I connect my iPad to my PS3 to use it as a mic?	0
162447	252886	252887	What is Hillary Clinton's reaction to the Vergara decision today -- a California judge ruling against teacher tenure?	Which high-profile Democrats are publicly criticizing today's decision by a California court ruling against teacher tenure?	0
162448	252888	252889	What are some best conversations you have overheard?	What is the most interesting conversation you have ever overheard?	0
162449	252890	252891	What country would you never return to?	Which country will you never visit?	1
162450	252892	252893	Game of Thrones: How did the faith of the seven, the most powerless of the gods, become so prevalent in the South?	Why is Game of Thrones the most pirated show today?	0
162451	210078	252894	What is the Environmental impacts of using coal?	What is the environmental impact of burning coal?	1
162452	209109	252895	What is the fastest brownie recipe?	What are the best brownies?	0
162453	252896	252897	How long it will take to learn html?	How long does it take to learn HTML?	1
162454	252898	252899	What are some types of hairstyles that suit a male with a square face wearing glasses?	What are some types of hairstyles that suit a male with an oval face wearing glasses?	0
162455	252900	252901	How good a Phil Barone saxophones?	What are Phil Barone saxophones?	0
162456	6668	7331	Between Java and Python, which one is better to learn first and why?	I learned Python and now I want to learn an OOP language. Should I learn Java or C++?	0
162457	252902	252903	Why is Spider-Man criticised?	What is Spider-Man's weakness?	0
162458	184181	252904	Does a proper push-up imply that the chest must touch the floor?	How much body weight is used on a push up?	0
162459	252905	252906	What are the interesting movie mistakes in bollywood?	What are some interesting examples movie mistakes in popular Bollywood movies?	1
162460	252907	252908	"What 'is the meaning of ""account balance""?"	What does it mean if my account balance is negative?	0
162461	252909	252910	My 13 year old daughter is suffering from dehydration and she wants to bathe but feels very weak, should I help bathe her or would it be too weird?	My daughter is 2.5 years old and quite small for her age (22.5 lbs). In the last year and a half she’s put on just 3 lbs. She’s constantly moving but only eats very small amounts. I try to give her a balanced diet. Should I be giving her a high-fat diet to support her growth?	0
162462	165957	117501	What is the First Amendment?	What is The First Amendment? Why is it important?	1
162463	252911	51663	Why does this question need improvement? I feel Quora is hounding me.	"What should I do if Quora marks my question as ""Needs Improvement""?"	0
162464	47114	166753	How do I add an image to my question?	How do you upload an image on a Quora question?	1
162465	252912	252913	How do human and plant cells differ?	How do animal cells and plant cells differ?	1
162466	252914	252915	Is Antonie Griezman a good buy for Manchester United?	Does Manchester United really need Zlatan?	0
162467	107377	107409	"What is the meaning and origin of the idiom ""once in a blue moon""?"	"What is the simple meaning of ""once in a blue moon""?"	1
162468	252916	252917	What is the meaning of my dream?	What is the meaning of dreams?	0
162469	252918	252919	How does the Walk Score work on Zillow?	How much did Redfin pay for Walk Score?	0
162470	252920	252921	How can I become a successful journalist?	What do I do to become a successful journalist.?	1
162471	252922	63298	How can I get started in Commercial Real Estate?	Where do I start in real estate?	0
162472	252923	252924	What is Martin Scorsese like in person?	Where does Gangs of New York rank among Martin Scorsese's movies?	0
162473	252925	252926	How can you determine the formula for heat combustion?	What is the correct formula to calculate heat of combustion?	1
162474	252927	252928	What are the main qualifications to be acquired for a fresher to become a business analyst?	Why are some people who live alone still happy?	0
162475	252929	252930	Will yongnuo RF 603 ii RF triggers allows High speed sync triggering?	Do a RF engineer needs to climb on the tower?	0
162476	181269	137989	Should I buy an iPhone 5s in 2016?	Is it worth buying iphone 5s in 2016?	1
162477	252931	252932	What does mail semen taste like?	How do I write bid in Fiverr?	0
162478	252933	252934	How is the word 'ominous' used in a sentence?	"How is the word ""ominous"" used in a sentence?"	1
162479	40994	138620	What are the career option after graduation in electrical engineer?	What are career options after graduating in electrical engineering particularly in the circuit design area?	1
162480	252935	252936	How many pints of blood are in a human body?	Why do we vomit after seeing a human body covered with blood in an accident?	0
162481	252937	252938	Does colonialism still exist today?	Are there still colonized countries today?	1
162482	252939	55323	How does Brexit affect Indian economy?	How does Brexit affect India?	1
162483	252940	252941	Is Low TDS water harmful?	Is drinking soft water bad for your health?	0
162484	196601	252942	What's the main purpose of a website?	What is the main purpose of science?	0
162485	252943	252944	Why do the New Zealand ATMs give only NZ$ 20 banknotes most of the time?	I plan to migrate to New Zealand. What are the best part time jobs in New Zealand?	0
162486	83890	252945	Does magic really exist in the world?	Why does magic exist?	0
162487	105566	127593	How do I start a food truck business in India?	How do I start a food truck business in Hyderabad?	0
162488	252946	252947	Can US agents carry concealed weapons and operate armed in the UK?	Where can I buy Concealed Carry Weapon Permit Online?	0
162489	252948	252949	Why can't I add someone back on snapchat although I can see their name pop up in the search bar?	Can I stop head bar notification pop-ups on Quora?	0
162490	109334	252950	"In French, how do you say ""my love""?"	"In French, how do you say ""kisses""?"	0
162491	252951	233910	How do I find a good accountant?	How can I find a good accountant?	1
162492	149436	188585	How's the life at IIT?	How's life like at IIT?	1
162493	252952	136532	How can we walk?	What is the best way to walk?	0
162494	150521	252953	How much does Twitter pay a new grad software engineer?	How much does Palantir pay a new grad software engineer?	0
162495	252954	252955	How do I know that my spectacle lens bought from Lenskart is an original British optics lens?	Lenskart is selling British optics lenses. When I asked on the customer care, they said that there is no direct website. Who knows about this company?	0
162496	252956	252957	What's the most developed method to teach English to children?	Is there a difference between fatty acid and fatty acetyl Co A?	0
162497	252958	122168	What are the best Hindi songs for Karaoke?	What are the best Hindi songs?	0
162498	252959	252960	When will Flipkart release an iOS app?	Will Flipkart survive?	0
162499	36925	9349	How do I improve English writing skills as well as the ability to analyse texts as an English learner?	How can I improve my English writing skills by myself?	1
162500	5555	76078	I wanna start preparing for ias exam, how should I proceed?	How do I start preparing for IAS prelims?	1
162501	252961	252962	What Top Writer has the lowest average number of upvotes per answer?	What is the average number of A2A's that top writers get?	0
162502	252963	252964	What is one remarkable thing you've witnessed at a funeral?	What are some things funeral directors won't tell you?	0
162503	252965	252966	Does clock speed matter in gaming?	How does the clock speed of a laptop matter in gaming?	0
162504	11171	252967	What is mining engineering?	What is mining engineer?	1
162505	252968	252969	India being part of BRICS, Is the only country that didn't host a major world sport event. How to look at this?	Could someone explain what intuition is, and how it is used, from a Shamanic point of view?	0
162506	252970	252971	What are Karl Marx's theories on socialism?	What are Karl Marx theories on law?	0
162507	252972	252973	Whate is DASA in NIT?	Does my master thesis advisor need to be an expert in my field of research?	0
162508	252974	252975	Is a 24 year old guy still considered young or an adult?	I am a 24 year old B. Tech graduate (2014). I am still unemployed and living at my parents. How should I proceed with my career?	0
162509	74053	252976	Why US makes such a fuss about Crimea? Since when the inner affairs of Ukraine is of any concern of US?	Why is what is happening in Ukraine of any foreign policy concern to the US?	0
162510	80419	252977	How do you remember the book you read?	How do I remember excerpts from the book you are reading?	0
162511	50535	36847	How is black money curbed with the ban of 1000 rupee notes and introducing new 500 and 2000 rupee notes?	How will the India demonetization of 500 and 1000 rupees notes will reduce black money?	1
162512	252978	252979	I messed up my first semester of grade 9 but I have decided to take AP classes and do the best throughout high school, can I get in ivy league?	What do I say if I am going to college for exam subjects?	0
162513	252980	252981	What is the role of the Bear Flag Republic in the history of the United States of America?	History of the United States: How is the role of the Church different in Plymouth than in Jamestown?	0
162514	252982	252983	People say love happens only once. If it happens again, will it not be the same as the first?	If love can happen only once (as many people say), Don't the people with more than one spouse love equally?	0
162515	252984	252985	Which type of schools do you need to attend to work in a daycare?	What type of schools do you need to attend to work in a daycare?	1
162516	252986	252987	Is it true that it is almost impossible to get a US visa if you have an Iranian stamp in your passport?	Will my H1-B approval remain valid if I get a new passport as the visa was approved on the old one? (I am yet to get the stamping done.)	0
162517	192221	138075	I am not good at making decisions, I always rely on other things even for meager situations. How can I improve my decision making power?	How can I improve my decision making skill?	1
162518	25362	188254	What is a good Python framework for building a RESTful API?	How to build REST API using PHP?	0
162519	85558	252988	How do I download a video from any website?	Which is the best software for PC to download videos from any website?	1
162520	81541	252989	What is Diaspora?	What is meaning of diaspora?	1
162521	164897	252990	How can I be a cold hearted person?	How can I become a cold hearted person?	1
162522	27205	115373	Is Trump still going to build a wall a make Mexico pay for it?	How will Donald Trump make Mexico pay for the wall? Why does it make sense that Mexico will pay? Will Mexico do it?	1
162523	48295	252991	Can I make money on Quora?	Can we make money in Quora?	1
162524	252992	252993	What would you attempt to do if you knew you could not succeed?	What would you do if you knew you could not fail?	0
162525	252994	252995	Why do liberals call conservatives racist when all we want is a border wall to keep illegals out?	How is Donald Trump’s proposal to build a wall on the Mexico border racist?	0
162526	3338	252996	What are some of your favorite sayings?	What is your favorite saying from where you are from?	1
162527	252997	252998	Why did Google remove Palestine from Google Maps?	Should Google add Palestine to Google Maps?	0
162528	252999	253000	What is the clear and concise description of Sewage treatment plant?	How do I file money suit in India?	0
162529	253001	253002	How many percent is Geert Wilders Indonesian?	How did a country as tolerant as the Netherlands elect Geert Wilders?	0
162530	253003	253004	What are some recipes using cornstarch?	What recipes use cornstarch?	1
162531	253005	253006	What will future energy look like?	What is future of energy?	0
162532	253007	253008	What are the most interesting products and innovations that Mobile Mini is coming out with in 2016?	What are the most interesting products and innovations that T-Mobile is coming out with in 2016?	0
162533	115556	253009	How do I prepare for the NID entrance exam?	How did you prepare for your NID entrance exam?	1
162534	253010	253011	Why we take carbon12 is standared for atomic weight?	Why carbon12 is salected for atomic weight? Not other element for example lithium or other element? Justify	1
162535	108665	253012	Is PM Narendra Modi the brand ambassador of Reliance Jio?	Is it morally correct for our Prime Minister Narendra Modi to appear in advertisement of Reliance Jio?	1
162536	253013	197487	What are some lesser known facts about The Big Bang Theory (TV series)?	What are some mind-blowing facts about The Big Bang Theory (TV series)?	0
162537	55149	399	How will the decision of scrapping INR 500 and INR 1000 notes affect real estate prices?	What are the effects of demonitization of 500 and 1000 rupees notes on real estate sector?	1
162538	70897	142978	Why is Manaphy angsty in Pokemon Ranger and The Temple Of The Sea?	In Pokemon Ranger and The Temple of The Sea, Why is Manaphy angsty?	1
