id	qid1	qid2	question1	question2	is_duplicate
124353	58615	120403	Why nobody replies to my questions on Quora?	Nobody answers my questions on Quora, why?	1
124354	200820	176694	Why aren't Egyptians black like all the other Africans?	Were ancient Egyptians black, white or dusky skinned?	0
124355	200821	200822	"If de Broglie's ""subquantic medium"" a sea of massive dark photons particles of matter move through and displace, causing it to wave?"	Prove that if uncertainty in position of a moving electron is equal to its de-Broglie wavelength than its velocity is completely uncertain?	0
124356	200823	200824	Is it appropriate for a 24 year old guy to date a 16 year old girl in india?	Is it bad for a 12 year old to date a 16 year old?	0
124357	200825	200826	What are the diferrent types of wiring used to domestic dwellings?	How big was the Roman Empire’s army in the end?	0
124358	30977	87657	Who would win a fight between Wonder Woman and She Hulk?	Who will win in a fight between Hulk and Wonder Woman?	0
124359	131148	169196	Are there any cheap places to stay in Goa?	Which is a cheap and good hotel to stay in goa? Like some oyo rooms or any other?	1
124360	200827	200828	What is golang good for?	Is there any good framework for golang?	0
124361	200829	200830	Is onsitego warranty genuine?	What is a factory warranty?	0
124362	28639	21713	Why do people use Quora instead of Google to find answers to questions?	Why do so many people ask questions on Quora instead of searching the answers on Wikipedia?	1
124363	200831	200832	How is living in China like for a foreign single mother?	What exactly to be done after the 4th CAP Round of MHT-CET?	0
124364	167397	200833	What is the evolutionary significance of communisim and how has it changed modern society?	What is the evolutionary significance of government and how has it changed modern society?	0
124365	200834	200835	What does it mean to say that a time series is uncorrelated but dependent?	How do you test whether a time series is undergoing mean reversion?	0
124366	200836	200837	Is a degree from CMJ University, Meghalaya valid or not?	Is a post-graduate degree from a deemed university which is not recognised by AICTE a valid one or not?	0
124367	81459	200838	What do you do to get better at basketball?	What are some ways to get better at basketball?	1
124368	200839	200840	When do lightning bugs come out?	When do lightning bugs come out? Why?	1
124369	200841	200842	What are the pros and cons of committing suicide when you realize after ten years that there is no cure for your anxiety/depression?	What are the consequences of suicide?	0
124370	200843	200844	Why is [math]\cos (30^\circ)[/math] equal to [math]\cos (-330^\circ)[/math]?	Why cos (-150) is equal to +cos(150) and not equal to -cos(150)?	0
124371	200845	200846	What are the essential skills for a mechanical engineer to be employable?	What are some essential skills that a mechanical engineer should learn?	1
124372	200847	200848	Why does my vagina smell?	Why does my vagina smell like coffee?	0
124373	200849	200850	"What are some ""grand strategy"" video games that allow you to navigate rivers?"	What are the most complex video games?	0
124374	200851	200852	Am I a judgmental person?	How judgmental of a person are you?	0
124375	98006	200853	How do you find someones recently added friends on Facebook using a tablet?	How does Facebook determine who is displayed as friends on the left side of the profile?	0
124376	200854	174224	What do people of Russia think of China?	What do people think about China?	0
124377	200855	200856	What are some TL;DRs of each of the most important leaders of Sweden?	What are some TL;DRs of each of the most important leaders of Poland?	0
124378	200857	200858	Is there any efficient algorithm to calculate running (or over a rolling window) median in linear time complexity?	What's an algorithm to find the median of in o(n) time complexity?	1
124379	200859	200860	How can we solve log base 3 of 28 without calculator?	How can I solve log base 3 of 28 without calculator?	1
124380	200861	200862	How could Russia hack US election?	Can the US redo the 2016 Presidential election if it is proven that Russia hacked the vote?	0
124381	2656	88874	Is a third world war coming?	Is World War III on its way right now?	1
124382	179559	33078	How can an African guy get a white girl?	How can an Asian guy get a white girl?	0
124383	200863	200864	Who are the greatest pianists of our age?	Who are some of the greatest pianists?	0
124384	83393	15671	How did Trump win America's vote?	How and Why did Donald Trump win the election?	1
124385	200865	56367	What are some unsung heroes?	Who are some unsung heroes of India?	0
124386	57247	200866	Why do people give gifts on Christmas?	Why are Christmas gifts such a big deal/Why do people give gifts on Christmas?	1
124387	200867	200868	Can there ever be another Led Zeppelin?	What if Led Zeppelin decide to release another album called Led Zeppelin V?	0
124388	200869	200870	How do you say Ram (the animal) in Mandarin Chinese?	Help no. 1*877*778*8969 HOTMAIL Customer Service Phone Number USA?	0
124389	200871	200872	Is Casey Neistat rich?	What do you think about Casey Neistat?	0
124390	200873	200874	How can tea bags help for styes?	Why do tea bags help with styes?	0
124391	200875	200876	What is the format of VAT and CST number?	What are the charges for VAT/TIN and CST from Mumbai?	0
124392	200877	200878	How do I find a good custom essay writing service?	How do I choose a good essay writing service?	1
124393	200879	126754	Can anyone learn how to code?	Why do so many people fail to learn programming from Free Code Camp?	0
124394	30250	200880	How should Californians vote on 2016's Proposition 63?	How should Californians vote on 2016's Proposition 64?	0
124395	163091	98268	What are some things new employees should know going into their first day at Agile Therapeutics?	What are some things new employees should know going into their first day at Agilent Technologies?	0
124396	200881	200882	What is a chemical property of copper and how is it used?	What are the chemical properties of copper and what makes these properties useful?	1
124397	200883	200884	What are some of the common mistakes made by candidates in IIT-JEE entrance exams?	What are Common Preparation Mistakes of IIT JEE Advanced?	0
124398	175521	200885	Who discovered the plate tectonics? How were they discovered?	Who discovered plate tectonics and how?	1
124399	159405	35906	How can I study c language?	How do we start preparing c language?	1
124400	200886	200887	Why doesn't the Modi government bring back black money?	Why hasn't Modi brought back the black money he promised to bring back?	1
124401	200888	200889	What is the best diet chart for a student preparing for entrance exams?	What is the best way to prepare for the 10th board math exam?	0
124402	200890	200891	Can women with breast implants breastfeed successfully?	Do women with breast implants breastfeed?	1
124403	200892	200893	I'm getting scared about my life as I am jobless and losing hope. What should I do?	Every night I get really worried, scared and depressed for a reason I don't know about. The next day I'm as happy as ever. Am I sick?	0
124404	200894	141327	How does Venmo work?	Are Venmo payouts reversible?	0
124405	180789	36460	What is the biggest regret you have?	What is your biggest regret of your life?	1
124406	200895	64988	What are the differences between TF-idf and Delta Tf-idf?	How does TF-IDF work?	0
124407	200896	200897	Is it accurate to say that evil is subjective?	Cement plastering thickness?	0
124408	792	85306	What is a good song to lyric prank your best friend?	What's a good song to do a song lyrics prank?	1
124409	38051	16686	What is your favorite book of al time?	What is your favorite book ever, and why?	1
124410	200898	200899	How is it like to become homeless?	What does it feel like to be homeless?	1
124411	170994	200900	Which EU country has the easiest citizenship requirements?	Why is it so hard for Europeans to emigrate to the USA?	0
124412	200901	103038	What is the best basic DSLR camera and lens to buy for the beginners?	What is the best DSLR for beginners?	0
124413	129231	78632	What is life like in prison?	How is life in prison?	1
124414	62278	69478	What are the chances that the Electoral College votes against Trump and for Hillary?	What is the likelihood that on December 19th, the Electoral College can vote out Donald Trump and vote in Hillary Clinton?	1
124415	49937	200902	What are all the flavors of Native American Spirit Cigarettes, and what do the colors mean?	Where do you find berry flavored lucky strike cigarettes?	0
124416	200903	200904	Civil Engineering: What is the difference between main steel and distribution steel?	What is the difference between castle-forged steel and spell-forged steel? Which one is better?	0
124417	200905	200906	What's a good business idea?	What are good business ideas?	1
124418	200907	200908	Why is Flipkart not genuine with its pricing?	How Flipkart is deicing price of the product? Is there any software for deciding the price?	0
124419	200909	2605	What is BIGO LIVE?	What is the purpose of life?	0
124420	12442	56216	What is best way to commit suicide painlessly?	What is the best way for me to kill myself?	1
124421	200910	200911	Will the Dell Latitude 2100 be capable of running Kali Linux? Specifically with regard to aircrack-ng wireless card compatibility.	I think my wireless card dell 1705 is not packet injection compatible. How can I crack WiFi passwords with it using Kali Linux?	0
124422	200912	200913	What is the best piece of software to reconstruct a 3d model from pictures?	What software is best for generating an accurate 3D model from 2D photos?	1
124423	200914	200915	Does Adobe Lightroom backup your images in the cloud?	What is it like to take the TOEFL exam?	0
124424	200916	200917	What are some adaptations of long tailed otters?	Hello Everyone could anyone please recommend a song for teachers day @ thank you?	0
124425	200918	200919	Do infosys hire Android developers?	Does Google hire Android developers?	0
124426	200920	200921	What are the vision, mission and goals of the UN?	What is the mission of the Azim Premji Foundation? What steps have been made towards meeting those goals?	0
124427	200922	200923	Should one highlight their main points in the Statement of Purpose by making the related text 'bold'?	What is the standard writing format of a Statement of Purpose?	0
124428	200924	200925	What do you do to track Facebook messages?	What do you do to track Facebook messages from another phone?	0
124429	200926	200927	What things one should know before joining his first company (software)?	What things should I be knowing before joining a software company?	1
124430	200928	200929	Is there a future for me in dating a woman 15 years younger?	How do I date a girl 20 years younger?	0
124431	200930	200931	What are the rules for serve in badminton?	What are the rules while doing serve in badminton?	1
124432	200932	200933	What should be done to encourage students to involve themselves more in outdoor games?	What are the best software/methods to encourage inactive older adults to become more active and try new exercises/activities outdoors?	0
124433	200934	200935	If I'm getting abused by a friend and my boyfriend came and saved me and got in a fist fight with him could he go to jail also?	My long distance boyfriend wants to go on a weeklong roadtrip with friends, including girls, and he had a sleepover with them yesterday. I'm getting hurt with all of this. Am I right in breaking up with him?	0
124434	88053	200936	What's the worst thing that could happen to you?	What’s the worst thing that has happened to you?	1
124435	200937	200938	What is the smartest thing you have ever done in exams?	What is the smartest thing you have ever done with your iPhone 5s?	0
124436	200939	200940	Does the earth make a sound when it rotates and revolves?	Does earth make sounds when it rotate or revolve?	1
124437	200941	200942	The new Coke Life label is green? Just saw a TV ad. I can't remember ever seeing that before. No red at all. Did I just watch brand logo history?	I just now saw ad on TV of STAR HEALTH INSURANCE insuring diabetics too.They could not settle simple claim giving odd excuse .Can anyone help me?	0
124438	200943	200944	Would you recommend Elementary OS as a first linux distribution?	What are the pros and cons Ubuntu and Elementary OS?	0
124439	200945	200946	Do girls like nerdy boys?	Do girls like geeky and nerdy guys?	1
124440	125077	200947	Why are so many Tamilians supporting Jallikattu ?	"How far is it justified to practise the ancient Tamil tradition ""Jallikattu""?"	0
124441	200948	200949	What are the symptoms of protisits disease?	What are the symptoms of microangiopathic disease?	0
124442	200950	200951	What is the world's worst assault rifle?	What are the largest assault rifles?	0
124443	200952	150961	Which is a suitable inpatient drug and alcohol rehab center near Montgomery County AL?	Which is a suitable inpatient drug and alcohol rehab center near Randolph County AL?	0
124444	200953	200954	Advertising and promotion for fashion product?	What if I don't wear retainers? My teeth were hardly crooked before braces. I don't want to wear the retainer.	0
124445	200955	81849	How much Benadryl can I give my dog for allergies? What are the side effects?	How much Benadryl can I give my dog? What are some side effects?	1
124446	200956	200957	Who are the most influential German intellectuals of the 19th century?	Who are the most influential Russian intellectuals of the 19th century?	0
124447	200958	200959	What job possibilities does a MS graduate (automotive tech) from a German university have, being an Indian?	Why is it imperative that the presidential election winner be Hillary Clinton?	0
124448	200960	124462	How do you make hair grow faster overnight?	What should I do to grow my hair in a week?	1
124449	66152	6806	Are the notes of Rs. 2000 really embedded with a GPS chip?	Is 2000 rupee note really not going to come with chip?	1
124450	200961	200962	Where is Mongolia?	What is Mongolia?	0
124451	200963	200964	Who created the Apple TV 4 screen savers?	Is Amazon Fire TV just as good as Apple TV?	0
124452	200965	52542	Which are best exercises to reduce belly fat without using weights?	How can I reduce my belly and hips fat without doing exercise?	0
124453	200966	200967	How do I calculate an angle between two sides of a triangle given the coordinates of vertices using vectors?	How do I calculate an angle between two sides of a triangle, given the coordinates of vertices using vectors in 3D?	0
124454	200968	200969	What is a good competitive programming strategy?	What is the best practice strategy for programming competitions on a large scale?	0
124455	200970	200971	What are the trigonometric ratios?	What does trigonometric ratios mean?	1
124456	165184	200972	Who is the worst actor/actress in Bollywood according to you?	Who is considered as the worst actor/actress in Indian film industry and why?	1
124457	200973	200974	What is the craziest, completely unrelated answers people have given for your questions?	On Quora, what are things to consider before posting an answer?	0
124458	171710	200975	What exams does an architecture student from India need to give to join an M.Arch course abroad?	I would like to complete my M.Arch from abroad. What should I do going forward?	0
124459	200976	200977	Why did they put Legolas in the Hobbit movies?	Why was Legolas made a part of The Hobbit films?	1
124460	200978	200979	How do I tell my parents I am interested in marriage?	How do I convince my parents that I am not interested in marriage?	0
124461	77412	135522	What is the function of a hard drive?	What is a hard disk drive?	1
124462	200980	200981	Which US B-school should I join in Spring 2017?	Which US B school should I join in Spring 2017?	1
124463	200982	200983	What is your review of Ubuntu Touch?	What knowledge is necessary to fork Ubuntu Touch?	0
124464	134142	40405	How do I download books using ISBN numbers?	Where can I get online PDF or EPUB versions of books?	0
124465	200984	200985	What are laptop specifications for architecture students?	Which laptop is suitable for an architecture student?	0
124466	200986	200987	What are the top 10 Skullcandy headphones?	What are the best Skullcandy headphones? Why?	1
124467	200988	200989	Why Wikipedia doesn't filter it's content like Quora? A lot of unwanted information is creeps up many times.	Why Wikipedia doesn't filter it's content like Quora? A lot of unwanted information creeps up many times for a query.	1
124468	174776	200990	How would I know if my husband is a sociopath?	How do I know if the guy I like is a sociopath?	0
124469	200991	200992	Do you think you would love your family if they weren't your family?	Do you love your family?	0
124470	200993	200994	What are the best books available on Kindle Unlimited or Scribd?	Which is best: Oyster, Scribd or Kindle Unlimited?	0
124471	43544	7445	What are some good ways to lose weight?	What should I do to reduce weight?	1
124472	200995	200996	How do I create inertia on a wheel?	How do I create inertia on a rotating wheel?	1
124473	200997	200998	If I have two wires of the same material but different cross sectional area, will the resistivity be the same?	What happens when the same material is used in a thermocouple instead of two different metals?	0
124474	200999	201000	Why do Pakistani men hate western women?	Why do Pakistani men dislike Western women?	1
124475	50465	797	Can you pass a urine test for meth with Suragel?	Can hair dye help pass a hair follicle drug test for daily meth smokers?	1
124476	201001	201002	Is it not fair that govts and others showering crores of rupees on PV Sindhu should contribute towards better infrastructure for Indian Sports?	Is it reasonable to reward PV Sindhu with so much money by the governments?	0
124477	201003	11011	What is the temperament of a Great Pyrenees/Lab mix?	What is the temperament of a Lab/Pitbull mix?	0
124478	201004	201005	What was the NTSB investigation?	What was the first NTSB Investigation?	0
124479	25162	26186	What are the safety precautions on handling shotguns proposed by the NRA in Vermont?	What are the safety precautions on handling shotguns proposed by the NRA in North Dakota?	1
124480	16546	201006	Why should someone do MBA?	What are the best reasons for doing an MBA?	1
124481	185733	201007	How do changes in price affect the quantity demanded?	How does change in price affects quantity demanded?	1
124482	194045	201008	What are the best pictures that showcase kindness?	What are the best pictures that showcase the UK?	0
124483	127116	91536	Is it healthy to eat only two meals a day?	Is it okay to eat two meals a day?	1
124484	201009	201010	Can I prepare for GATE in a month?	How should I prepare for GATE in a month?	0
124485	201011	201012	Could alcoholics drink safely in the zombie apocalypse?	Companies often give out samples of their products to consumers to obtain feedback is this an effective practice for gathering accurate information?	0
124486	201013	16534	How can I call through Jio 4G voice, in my Redmi note 3?	Is Jio4Gvoice app required on Redmi Note 3 to make Jio calls?	0
124487	201014	201015	If we had another civil war and it was North versus South, which side would win?	If there was another US Civil War (North vs South and no nukes) who would win?	1
124488	201016	201017	Who discovered black holes?	When and how were black holes discovered?	0
124489	201018	124848	Are most Mainers quiet people?	Why are some very smart people so quiet?	0
124490	201019	201020	Does Google have the best search engine?	What are the best search engines besides Google?	0
124491	47461	153208	What hotel in Kolkata would be safe for unmarried couples, without the harassment of police, hotel staff, and moral police?	What hotel in Azamgarh would be safe for unmarried couples, without the harassment of police, hotel staff, and moral police?	0
124492	201021	201022	What is the difference between a trading portal and an exchange?	"What is the difference between ""trade"" and ""exchange""?"	0
124493	201023	201024	What are the benefits of learning Spanish?	What are the benefits to learn Spanish?	1
124494	81165	201025	How do you solve a Rubik's Cube?	What's the trick to a Rubik's Cube?	1
124495	201026	201027	Where and how does the thermal energy flow?	What is thermal energy flow?	1
124496	150068	201028	"What is the meaning of the word ""soundacious""?"	"What is the meaning of the word ""arigatho""?"	0
124497	179281	201029	How can calcification of the arteries be reversed?	What narrows the lumens of arteries?	0
124498	201030	201031	What are the famous YouTube channels that every mechanical engineer should follow?	What is the best youtube channel for mechanical engineering?	0
124499	201032	201033	What is the best way to start with electronics?	What should I do to get started in making electronics?	0
124500	201034	201035	How do I improve the intensity of my focus?	What should I do to improve my focus?	1
124501	201036	183177	Is it possible to create artificial singularity(black holes)?	Is it possible to create an artificial black hole?	1
124502	201037	201038	What gifts are given on 25th anniversary in india?	What can be the perfect gift for a 25th marriage anniversary?	0
124503	201039	201040	What will happen to Indian students in the US after Donald Trump's victory? Will they be harmed in some way or another?	What is the fate of Indian students in US universities after Trump's Victory?	1
124504	201041	201042	How can the structure of the villi in plants be described?	How can the structure of the villi in humans be described?	0
124505	201043	201044	Where is President Obama while Louisiana floods and Milwaukee burns?	Do you think the media are treating Obama differently in light of the Louisiana floods than they did treat GWB during Hurricane Katrina?	0
124506	41625	70505	Who will win the US election?	Who will win the US election in 2016?	1
124507	201045	201046	Where can I get the previous muapt questions papers?	Where can I get the previous question paper of IAS?	0
124508	201047	201048	What is the procedure of police verification before joining central government job?	Is there any job for CSE in Central Government as well as State Government?	0
124509	33833	48346	Is this move of banning 500 & 1000 Rupee notes right?	What are your views on PM Modi's decision on discontinuing 500 & 1000 rs notes?	1
124510	201049	201050	What all should one be prepared for while going to an IIM interview?	How should one prepare for IIM interviews?	1
124511	201051	201052	What are the ways to add noise to a signal programmatically?	Are you ever concerned even the clearest signal may be random noise? Or maybe that now is the 1-in-million absurd solution?	0
124512	201053	201054	Should I openly display on my LinkedIn profile that I'm looking for a new job even though all of my current co-workers will see it?	How should a LinkedIn profile title look when you have already left your current job and are looking for a new job?	0
124513	12214	21693	How can I improve my pronunciation of English words?	How could I improve my English?	1
124514	11012	21750	How can I delete my own question from Quora?	Why can't I delete my question on Quora?	1
124515	20442	41407	If I delete a contact on whatsapp and my main contact list, will the contact still see updates on my profile and be able to send me whatsapp messages?	If someone is not in my contact list, can they see me if I am online in whatsapp?	0
124516	2475	201055	Which is the best gift that you have ever received?	What is the best gift that you ever recieved?	1
124517	201056	201057	How can I improve my self-esteem? Sometimes I feel bad with my self and can't look at other people when I'm walking on the street.	I am a personable and sociable person in small groups and with individuals. But when I'm in large groups of people I don't really know I get very reserved and like to keep to myself. Why is this and how can I overcome it?	0
124518	201058	57048	I am student my aunt gave me 1000 rs gift (old notes) I found today while cleaning my house. Can I exchange in RBI with my id proof?	Where can I deposit old Rs. 500 & Rs. 1000 notes after 30 December 2016?	0
124519	3506	6070	Can skipping increase your height?	Which exercise type help you to increase your height?	1
124520	201059	201060	How do converging and diverging mirrors compare and contrast?	How do converging and diverging mirrors differ?	1
124521	201061	201062	Do security authentication methods in smart phones internally use the if else loop.?	Do security authentication methods in smart phones internally use the if else loop construct?	1
124522	201063	201064	Why do people like me?	Why do people call me ugly?	0
124523	51980	7252	Is it possible to get pregnant before period or after period ends?	Can you get pregnant 8 days before your period?	1
124524	201065	201066	Why does bryophyte known as primitive plant?	Is there any plant known as Garden Pea except Pisum sativum?	0
124525	55811	201067	How much money in US dollars is 1 crore rupees?	How much does one crore rupees weighs (in rs. 1000 denomination)?	0
124526	98963	48201	How do I gain weight to build muscle?	How can I reduce my fat and keep my muscle?	0
124527	201068	201069	What are the reasons ice breakers liquid ice discontinued?	Why are ice breakers used?	0
124528	201070	201071	What is the best compliment ever given to a girl?	What are the best compliments for a girl?	1
124529	201072	201073	How is the word 'somnolent' used in a sentence?	How is the word 'empty' used in a sentence?	0
124530	201074	201075	Why did the ancient Greeks and Romans stop believing in their gods?	When did the Greeks and Romans stop believing in their ancient gods?	1
