id	qid1	qid2	question1	question2	is_duplicate
162000	69047	252280	Why does Australia oppose Philippines President’s anti-drug crime wars in Philippines, but help the U.S. bomb civilians in Syria and Middle East?	It's September 2013. Should President Obama & the U.S. intervene in Syria? Why or why not?	0
162001	252281	252282	What would happen if you injected thermal paste into your veins?	What will happen if I insert small pieces of glass in my veins?	0
162002	252283	252284	What are the example images of stars and other planetary bodies that we can view from amateur household telescopes?	How can I increase my concentration and brain sharpness?	0
162003	10590	29961	Should India go for another war with Pakistan?	Will India fight a war with Pakistan?	1
162004	252285	252286	What should I do if I think I have a virus on my iPhone?	Does my iPhone have a virus?	0
162005	252287	188351	What are the best help desk experiences?	What is the best help desk system?	0
162006	252288	252289	What are some circumstances when a compliance certificate is required?	The right to openly discuss wages with co-workers?	0
162007	252290	252291	Why doesn't Earth crash to the Sun thanks to gravitational pull?	If gravitational pull of the sun is very strong,why does the Earth keep its distance?	1
162008	126311	185894	What is the purpose for human living in the world?	What's our purpose of life in this world?	1
162009	16464	91346	How do I disable end call with the power/lock button featue on an iPhone?	Should I buy the iPhone 7, Galaxy S7, or Note 7?	0
162010	252292	252293	How do I copy the Linux directory?	How do you copy a folder in Linux?	1
162011	252294	252295	What does Igor Markov think of growth and the future of the Indian economy?	What is Igor Markov like in person?	0
162012	252296	252297	Is buffersales.com a genuine site?	Is Shoebacca.com a fake site?	0
162013	252298	5161	I told a girl in a relationship that I liked her and she says she never know what's going to happen to her relationship. What does that mean?	I told a girl who has a boyfriend that I liked her, and she says she doesn’t know what's going to happen to her relationship. What does that mean?	1
162014	61820	69793	What is the best business idea with surefire profits and less investment?	What are the best new business idea in india with less investment?	1
162015	252299	252300	Which app is safe and secure for money transfer?	Is there any app for money transfer which is safe & secure?	1
162016	64794	252301	What is best credit card?	Which credit card is best in INDIA?	0
162017	117611	11001	What are the worst stupidest questions asked on Quora?	What are the most annoying types of questions on Quora?	1
162018	252302	178101	When brushing my teeth, I leave the tap running and continue brushing. Can someone explain why I do this?	Should I drink water before brushing my teeth or after?	0
162019	252303	252304	How do I get rid of back pain?	How can I get rid of chronic and acute back pain?	0
162020	252305	252306	What is the 'for you ' button in Quora mean?	Is US billboard hot 100 better than UK's OCC?	0
162021	252307	252308	Where are shell type and core type transformer used? Why?	How do shell type transformers work?	0
162022	252309	67244	Why Arvind Kejriwal is in a hurry to get the evidence of surgical strikes on terrorists camps in Pakistan?	What is your view on Arvind Kejriwal recent statement concerning Indian surgical strike on Pakistan?	0
162023	146392	252310	What is the best home appliance for Panasonic air conditioner service center in Hyderabad?	Which is the best Panasonic air conditioner repair center in Hyderabad?	1
162024	140610	151812	How many dimensions does the universe really have?	How many dimensions are reported to be existing in our Universe?	1
162025	252311	620	Can I use a Jio SIM which I purchased it from showing bar-code on Samsung Galaxy J2 on my iPhone 5s (US model A1533) for voice & data ?	Can I use Jio SIM in iPhone 5s?	0
162026	252312	252313	What are some good affiliate marketing programs?	What are the best affiliate marketing programs for 2016?	0
162027	103882	252314	What is Elon Musk like in person?	How is Elon Musk in person?	1
162028	11220	162274	What do I use to clean my crystal meth?	How do you clean meth?	1
162029	252315	186060	Which stocks should I invest in BSE for maximum long term returns?	Which company should I invest in BSE/NSE for maximum long term returns?	0
162030	152779	252316	What should I do if I am going to start a coding club in my college?	What should I do if want to start a coding club in my college?	1
162031	252317	252318	What does the word yoga mean in Sanskrit?	What is the most poetic Sanskrit word?	0
162032	252319	252320	What will it take to keep the ISS hardware in orbit, past its operational life?	Would an ion thruster providing constant force on the ISS be more economical than conventional thrusters to keep it in orbit?	0
162033	252321	252322	If All South Asian Countries Unite, Could They Wipe Out India From The World’s Map?	Are the rich first world countries in the West doing enough to compensate for the pollution they caused, which lead to the global warming that is now threatening to wipe the smaller poorer countries with low land from the map?	0
162034	146796	13124	What's the best way to make new friends after college?	How do you make friends post-college?	1
162035	252323	252324	How can density and volume be calculate?	How can you calculate volume and density?	1
162036	252325	252326	Should I buy Ride for PS4?	Should I buy the game 'No Man's Sky' for PS4 or PC?	0
162037	252327	252328	How do I stop being disorganised, unreliable and start caring about things and performing?	How do I stop caring about my weight?	0
162038	252329	252330	What are some good side dishes to have with a BLT?	How do you cook a good salmon with rice as a side dish?	0
162039	3118	95333	How will Donald Trump benefit India?	What will be the impact of election of Donald Trump as the 45th US president, on India?	1
162040	252331	160089	What does gravity look like?	What is gravity?	0
162041	153170	252332	How do I make my blog popular?	How can I make my blog popular?	1
162042	252333	252334	What does it mean when you have your menstrual cycle for two weeks?	What does it mean when you have two menstrual cycles within two weeks?	0
162043	252335	252336	How long did the pyramids of Egypt keep the white colour of the limestone?	Is it true that the pyramids of Egypt were built by Jewish slaves?	0
162044	252337	218800	How do you write short stories?	How can I write a very short story?	1
162045	39723	192580	What are some tips on making it through the job interview process at Capital Bank?	What are some tips on making it through the job interview process at Independent Bank?	0
162046	252338	252339	Internal angle of synchronous motor?	Can depression and ocd go on their own?	0
162047	252340	252341	They say too much knowledge is dangerous. When and why is this the case?	Is life too long in some cases?	0
162048	1717	93519	What can I do to improve my question on Quora?	What is the best way to improve my questions on Quora?	1
162049	157338	162286	How can you find out who is calling you from an unlisted number?	How can you find out who is calling you from a private number?	1
162050	252342	252343	Which is the most liked picture in facebook?	Is there a way to find the most liked picture on Facebook? If so, what is the most liked picture?	1
162051	252344	252345	What is the difference between sister chromatids and non sister chromatids?	What are chromatids and how do they work?	0
162052	218549	100101	Is the iPhone really more expensive? Why or why not?	Why is the iPhone 6 so expensive?	1
162053	252346	252347	Why is Islam called the religion of peace? Why does so much violence revolve around its believers?	Do Muslims in Albania eat pork or not?	0
162054	252348	252349	Why is Charlestown, County Armagh so important? What has been its main contribution to the local community?	Is dell vostro 3558 better as compared to dell inspiron 3558 core i3 5th gen?	0
162055	47372	160398	Where can I take a free online IQ and personality test?	Where can I take an IQ test on the internet for free?	1
162056	252350	252351	Is there a movie based on the Indus valley civilization?	"Are Indus Valley civilization and ""Aryan"" civilization different names of the same civilization?"	0
162057	252352	252353	How do you update the Instagram Location targeting?	How can I find Instagram users by location?	0
162058	252354	252355	Which is your favourite Bhagvad Gita sloka and why?	Which sloka of the Bhagvad Gita do you like the most? How do you apply that to your life?	1
162059	252356	251240	What source is best to learn German?	What are some of the best resources to learn German?	1
162060	252357	252358	How do you play disc golf competitively?	What are some tips for playing disc golf?	0
162061	38764	166169	I have to give a small 1-minute speech on any topic. What are suggestions for a topic to choose?	What is the best topic to choose for a speech competition?	0
162062	252359	252360	How do you find the magnitude of the a net force using a formula?	How do you find the magnitude of the net force?	1
162063	17772	252361	What are the best web products to develop?	What are some good tools for collaboration on web product development?	0
162064	252362	252363	"Is it possible to cure speech disorders? Can't properly pronounce ""r""/""er"" sounds, someone once thought I was deaf."	What is VPN and how is it different from a wifi? Can someone please give an accurate answer?	0
162065	61380	7075	What does Gary Johnson have to do to have a chance of winning in November?	Can Gary Johnson win?	1
162066	136722	252364	What if Sourav Ganguly played badminton instead of cricket?	What if Sourav Ganguly played table-tennis instead of cricket?	0
162067	252365	252366	I am BSc third year student in Physics and want to do MSc in Physics, Which Colleges n Exams should I choose for reputed MSc course?	An architect asked me to develop a front-end website for him but I wanna use PHP with it . In what part of this project PHP can help me?	0
162068	63223	252367	How do you cope with depression?	How do i cope with my depression?	0
162069	252368	252369	How is a multi-engine plane controlled, and stopped from entering an immediate spin, in the event of an engine failure?	Should I give JEE again and change my college and branch from mechanical to CSE after my first year?	0
162070	252370	252371	Is it wrong to hate a certain race?	Is it wrong to hate a specific race?	1
162071	252372	252373	What is best gift you ever gave to yourself (with your money of course)?	What's the best gift you ever gave to yourself?	1
162072	252374	252375	What are the implications of a surplus budget?	Is there anyone preparing for Civil Services nearby Visakhapatnam Railway station?	0
162073	252376	252377	What is the job outlook for video production and video editors?	What are the best video editors for GoPro?	0
162074	252378	252379	How can one join an A division football club in Delhi?	How can one join a B division football club in Delhi?	0
162075	252380	252381	Is there a way for a poker site like PokerStars to detect that you are using a VPN to play (other than by blacklisting VPN providers)?	Is using a VPN legal in America?	0
162076	252382	252383	I am a failure at 40, no strength, living in closed room in parents home, unable to express, never had any relationships, neglected in life, now what?	I am 45 and never had a girlfriend. I have Asperger's which may be the reason why. Am I the only one like this, or it is common for men with Asperger's to be unable to find a girlfriend?	0
162077	252384	252385	Should I tell my dad about my moms relationship?	I have a approved H1b petition till 2019 and was given 221g during my interview .Incase if my visa gets rejected will I come under cap exempt?	0
162078	107607	241140	What are the best places to visit near Bangalore in one day?	Which is the best place near Bangalore to visit as a one day trip?	1
162079	87530	41347	Which is a good solar panel installation provider near Mcclellan, California CA?	Which is a good solar panel installation provider near Nipomo, California CA?	0
162080	252386	252387	Why doesn't the most important person of your life care about you?	If a person doesn't know what to do in life? What should he\she do?	0
162081	252388	252389	What are the legal implications of running from the police?	What are the legal implications of running from police?	1
162082	252390	252391	What are the prerequisites for understanding Riemann Zeta function, and what's it all about?	What are examples of random things to research?	0
162083	252392	252393	Body fat: how much kilograms required to lose 1 cm of waist circumference?	How do I lose 3% body fat when at 13% body fat?	0
162084	229048	252394	What undergraduate program would best prepare me for graduate studies in neuroscience?	What are the best schools to study neuroscience in the US?	0
162085	252395	252396	Why do mice squeak? Is it only to communicate, or will mice also squeak when they are alone?	What is the reason why mice squeak?	1
162086	188800	252397	I have secured a composite score of 707.5 and the percentile below is 95.2 in MAT by AIMA. What are the good colleges under MAT to which I can apply for?	I got a composite score of 731 in MAT in September 2014. Which good institutes should I apply to?	0
162087	244490	252398	How do we know that dark matter exists?	Where is dark matter? How do we know it exists?	1
162088	252399	252400	How is carbonic acid formed from the reaction of carbon dioxide and water?	Glucose reacts with oxygen to give off carbon dioxide and water. What mass of oxygen is required for a complete reaction of 25 g of glucose?	0
162089	252401	252402	Where can I get cheap cricket bats in Hyderabad?	With which cricket bat is best to bat?	0
162090	182608	252403	How many words does an average English speaker know?	On average, how many syllables do English words have?	0
162091	252404	252405	What is the importance of chlorophyll in chloroplast?	Why is the importance of chlorophyll in plants?	0
162092	252406	252407	Why do some Indians use 'RA' or 'DA' or 'Yaa' at the end of each sentence?	What is a homophone for way? How are they each used in a sentence?	0
162093	252408	252409	What is best free wordpress theme?	What are some of the best free wordpress themes for blogs?	1
162094	252410	252411	Why do our eyes get closed when we sneeze?	What makes us close our eyes forcefully while we sneeze?	1
162095	252412	128761	Why do queen ants exist?	What happens when you kill the queen ant?	0
162096	252413	135134	What is plant tissue culture?	Why is plant tissue culture important?	0
162097	252414	252415	What are the best restaurants in Hyderabad?	What are some best restaurants in Hyderabad?	1
162098	252416	252417	How many managers per employee should a mid-sized company have?	Why do companies that take over smaller companies lay-off the mid/low level employees rather than laying off the top-level management?	0
162099	144417	252418	What are your comments on Rahul Gandhi's Twitter account hacking?	What are you views on the Twitter account hack of Rahul Gandhi?	1
162100	235346	252419	How can I forward postal mail to someone?	How can I forward postal mail online?	0
162101	252420	252421	What is the most aesthetically pleasing photo you've taken on your phone? Show pictures?	Which technology needs improvement?	0
162102	252422	252423	Which is the best book on public speaking?	What's the best public speaking book?	1
162103	252424	154132	How do I find the type of triangle with the help of 3 coordinates?	How can I find the area of a triangle with side 3,2,1 cm?	0
162104	252425	98593	What is it like for an Indian to live in Taiwan?	Is Taiwan part of or separate from China?	0
162105	252426	252427	Which is the best coaching class for an IIT JEE crash course in Mumbai?	Which coaching classes are the best in Mumbai for IIT Jee?	1
162106	252428	252429	What one advice will you change my life?	What's that one change you made in your routine that completly changed your life?	1
162107	252430	252431	What is a movable pulley and what are some examples?	What is an example of a movable pulley?	0
162108	252432	202664	What is the best place to sell your clash of clans account?	How do I play a multiple Clash of Clans account on my Android device?	0
162109	252433	252434	How can I improve my note-taking? I'm trying to write the main concepts, but still end up with nearly everything that was said in the textbook.	I have made a bad habit of going 5-7 minutes late in my mid or semester exams thinking that having just a look at the notes can have a large impact but instead I forget things in the exam. I know this is wrong but it happens every time even if I try to avoid it. How should I cope with this anxiety?	0
162110	252435	252436	What's the best book about Radiohead?	"Why do a lot of Indians love the song ""Creep"" by Radiohead?"	0
162111	121850	109149	What is that one thing you will always regret about?	What are the things you regret not doing?	0
162112	9844	252437	What are some things new employees should know going into their first day at Team?	What are some things new employees should know going into their first day at Starbucks?	0
162113	252438	252439	How many times is afcat exam is conducted in a year?	How many times is an eLitmus test conducted in a year?	0
162114	252440	252441	What are the new elements discovered in the periodic table?	What are the three new elements discovered?	0
162115	4051	11397	What can I do to practice my English?	How can I improve in English?	1
162116	252442	252443	How do you pronounce anise?	How is cumin pronounced?	0
162117	252444	252445	What song plays over the end credits to the 2002 movie The Son?	What song plays over the end credits to the 2002 movie May?	0
162118	43166	79590	How can I get self-esteem and confidence?	What should I do to boost my self-esteem and self-confidence?	1
162119	252446	252447	How much does it cost to have an injection mold made?	Where do I buy personalized molds for plastic injection molding, and do I need to find an engineer to build my pieces for the molding?	0
162120	150420	252448	Why do I feel inferior?	What can I do to not feel inferior?	0
162121	24297	32317	What is the easy way to make money online?	How do I make money from home?	1
162122	252449	252450	Why do the loco pilots and the station guards wave green flags against each other when the train is crossing a station?	Why are train stations in the UK so noisy?	0
162123	252451	252452	Why do I suck at math?	Can you suck at math and be smart?	0
162124	252453	252454	What are some conspiracy theories about video games?	What are some interesting video game conspiracy theories?	1
162125	252455	252456	What are some positive reviews about techmahindra?	Are there types of antimatter just like with matter?	0
162126	76837	112888	Where can I find genuine data entry projects?	Where do I find genuine data entry projects?	1
162127	252457	38776	How do you recover old Gmail addresses?	How can I recover my Gmail password without a recovery phone number or email?	0
162128	252458	252459	How competitive is the hiring process at Host Hotels & Resorts?	How competitive is the hiring process at Strategic Hotel & Resorts?	0
162129	252460	252461	Can Apple innovate without Steve Jobs?	Did innovation at Apple die with Steve Jobs?	0
162130	252462	252463	How does Nordstrom's dress categorization process work?	Data processing recommed book?	0
162131	252464	252465	What do you think about when you cannot sleep?	What do you think before sleep?	0
162132	252466	49612	Vietnamese who speak Japanese: Where did you study Japanese? Did you take the Japanese Language Proficiency Test?	Indonesians who speak Japanese: Where did you study Japanese? Did you take the Japanese Language Proficiency Test?	0
162133	154983	28771	Who is better, Ronaldo or Messi?	Who is better, Messi or Ronaldo?	1
162134	252467	78437	Is it hard to learn English?	How difficult is it to learn English?	0
162135	252468	252469	How heavy is earth?	How heavy is the earth?	1
162136	252470	252471	What is the ray j net worth?	Who will win FIFA best player award 2016?	0
162137	252472	252473	Do women like men with shaved heads?	How do women like men with beards vs. men who are clean-shaven?	0
162138	252474	252475	Should I buy LG v20?	Should I buy LG V20 despite shattergate?	0
162139	158096	36303	How can we check counterfeit 2000 ₹ and 500 ₹ notes?	How safe is new Rs 500 and Rs 2000 Indian currency notes?	1
162140	62668	12719	What are the safety precautions on handling shotguns proposed by the NRA in the entire U.S. including it’s territories and possessions? 2	What are the safety precautions on handling shotguns proposed by the NRA in Kansas?	1
162141	252476	252477	I want to learn python, I have no previous programming experience, how do I start?	I want to learn and eventually master Python. Where do I start?	1
162142	5726	10949	How can I find all my old Gmail accounts?	Where is my other gmail accounts?	1
162143	252478	252479	What can we surmise from the apparent lack of people reading software Eula?	Are police allowed to read text messages from another people? Why or why not?	0
162144	252480	252481	How do I came out add topics on Quora?	Name of business that can be started with no investment?	0
162145	51878	1734	What are the pros and cons of Hillary Clinton being the next President?	What are pros and cons of Hillary Clinton?	1
162146	252482	24518	What is unusual or different about the food and cuisine in Bolivia?	What is unusual or different about the food and cuisine in Australia?	0
162147	252483	252484	Which is the best book?	Which is best book?	1
162148	252485	252486	Why do people pretend to like things?	Why do some people pretend to be a friend?	0
162149	252487	252488	How do Orthodox Jewish surgeons work around the Jewish holidays with their incredibly long work weeks?	How do orthodox surgeons work around all the Jewish holidays with their incredibly long work weeks?	1
162150	252489	252490	What are the pros and cons of socialism and communism?	What are the pros and cons of communism?	0
162151	155857	191272	What are some examples of personification?	What is personification? What are examples of this?	1
162152	252491	252492	How do I get AAdvantage Gold status free?	How do I transfer my AAdvantage miles to Etihad?	0
162153	252493	252494	What’s the best thing one can do if his or her car breaks down in the middle of a deserted place?	One of the main reasons for traffic jams in Delhi NCR is trucks and buses breaking down in the middle of roads. What measures can we adopt to remove these vehicles quickly from the crowded places to ensure a smooth flow of traffic?	0
162154	252495	252496	How do I convert .qsv files to .MP4?	How do I convert .exe flash file to mp4?	0
162155	192765	252497	Will my eyesight get worse if I don't wear prescription glasses?	Do we have to do eye exercises by removing glasses or wearing glasses (my eyesight is -2.5)?	0
162156	119663	252498	What's the body that governs sports in Finland, and its (email) contact point?	What's the body that governs sports in Norway, and its (email) contact point?	0
162157	252499	252500	Why are prices of watches so high?	If the price of oil and gas has gone down why are my energy bills still so high (I live in the UK)?	0
162158	252501	252502	What is the interview process at JusPay Bangalore?	What is the interview process at Juspay?	0
162159	252503	252504	Music without wifi?	"How would it be if the White House had a ""buri nazarwale tera muh kala"" sign?"	0
162160	252505	252506	Why is there still no cure for depression?	Why is there no cure for depression?	1
162161	252507	252508	My Nexus 5 will shut off randomly and won't turn on as if it were dead, how do I fix this?	My Nexus 7 is on the setup menu and it won't connect to the WiFi. What should I do?	0
162162	252509	252510	What is religious?	What's your religious history?	0
162163	165010	252511	What are the effective strategies for planning a great product launch event?	What are some great ideas for an app launch event/party?	0
162164	102508	210292	What are the most important turning points of your life?	What is the turning point in your life?	1
162165	209654	252512	Will the World end?	How will the world truly end?	1
162166	252513	252514	What are some good bluetooth headsets?	Which is best bluetooth headset?	1
162167	252515	4119	How do I unlock iCloud free on my iPhone 4s?	How can I unlock an iPhone without knowing the Apple ID or password?	0
162168	252516	252517	Is the RNC a private company?	What form of business organization do the Republican and Democratic national parties take? LLC, Corporation?	0
162169	252518	252519	Which are the best restaurants in London?	What is the best restaurant in London?	1
162170	252520	252521	How and where to sell luxury watches like Rado, Patek Philippe, Chanel etc?	How and where to sell luxury watches like Rado, Patek Philippe, Chanel etc in India or internationally?	0
162171	220443	252522	What do people in Kazakhstan think of Borat?	What do people from Khazakstan think of Borat?	1
162172	252523	252524	How can I heal myself from glaucoma?	How can we prevent glaucoma?	0
162173	252525	252526	How can a person with a timid personality be described?	How are flaws described in a person?	0
162174	252527	252528	What is the diffusion of water through a membrane?	How do water and oxygen paths differ in alveoli cell membrane?	0
162175	18916	197876	What are the puzzles asked in an interview?	What are the standard puzzles asked in interviews?	1
162176	252529	197317	What are singly and doubly reinforced beams?	Why are doubly reinforced beams required?	0
162177	252530	252531	Is one-sided love real?	Can love be one sided?	1
162178	23108	882	Why is salt water taffy candy imported in France?	Why is Saltwater Taffy candy imported in Greece?	1
