id	qid1	qid2	question1	question2	is_duplicate
243181	227375	37467	What are some mind-blowing iPhone tools that exist that most people don't know about?	What are some mind-blowing phones accessories that exist that most people don't know about?	0
243182	208362	89640	What's the best way to acquire an inactive Instagram username?	How do I gain access to a person's instagram photos, if their account is private?	0
243183	355574	355575	Are the members of the electoral college obliged to vote for the candidate they represent?	Can the members of the Electoral College individually vote for a candidate other than the one pledged?	1
243184	355576	355577	What is the step by step procedure to apply for Australian PR?	Can my brother sponsor me for an Australian PR as he has one already?	0
243185	9702	130163	Would a black hole be the exit of this universe?	Are we inside a black hole?	0
243186	355578	21881	How can I choose my own cell phone number?	How do I read someone's WhatsApp messages without any access to their mobile phone?	0
243187	355579	355580	What is the function of RNA?	What are the functions of DNA and RNA?	0
243188	355581	58753	How can I use Quora to prepare for bank exams like SBI PO and IBPS PO?	How can I prepare for ibps po exam?	1
243189	33824	355582	Do you think that suicide is a good solution for all the problems one can have?	Is it true that the more one knows, the harder it is to think a simple solution to a problem?	0
243190	355583	355584	What are some tips on making it through the job interview process at Merit Medical Systems?	Can dogs sense someone being scared?	0
243191	355585	355586	How can I learn grammar effectively?	How do I learn grammar quickly?	1
243192	355587	355588	Can we install Ambari on a Cloudera Manager existing cluster?	How do I install Cloudera CDH on 100 Node cluster without using Cloudera manager?	0
243193	355589	355590	"Does something like ""learned failure behaviour"" exist and how can you break out of it?"	I have to apply for passport but I dont have 10th marksheet & birth certificate but my born date is before 1989?	0
243194	2374	54749	Why do so may people ask questions on Quora that can easily be found by a simple Google searh?	Why do people ask questions on Quora that could simply be googled?	1
243195	140292	355591	If I visit your country, what place must I visit?	What are three must-visit places in Gwalior (MP)?	0
243196	336271	79156	How can nail polish help for a wart removal?	Can nail polish be used for wart removal?	1
243197	98782	1693	How can I loose 5kgs weight in a week without exercise?	How do I lose weight without doing any sport?	1
243198	355592	108918	Does a Blue Heeler/Australian Shepherd mix shed a lot? If so, how can this be treated?	Does a Shih Tzu/Terrier mix shed a lot? If so, how can this be treated?	0
243199	105062	355593	Who is PETA & why are they so keen in stopping jallikattu?	Is Jallikattu ban really an international lobby?	0
243200	355594	104319	What is the major difference in the syllabus of CAT and GMAT?	What is the difference between the CAT and GMAT syllabus?	1
243201	355595	355596	Is there any way to track you Digital Signature Activity?	What are the best activities to do with children when visiting Gumi, South Korea?	0
243202	355597	355598	What is the background working procedure of printf and scanf functions in C and how will they work?	Why do many C functions have an extra F?	0
243203	355599	355600	Do you recommend me to study Computer Science in Russia?	Do you recommend someone to study Computer Science in Russia?	0
243204	179824	124161	What is the difference between a pinch-off voltage and a Vgs (off) in a JFET?	Can a voltage regulator be used for a high voltage DC-to-DC conversion? What should be the maximum difference between the input and output voltage?	0
243205	355601	355602	What is the location of Palawan, and how does this Island compare to Banaba Island?	What is the location of Palawan, and how does this Island compare to Vancouver Island?	0
243206	355603	355604	Why do propellers in airplanes rotate in opposite directions?	Why does the propellers rotate in opposite direction in planes?	1
243207	98762	48201	How do I reduce face fat?	How can I reduce my fat and keep my muscle?	0
243208	21923	217199	What are Batman's positive traits?	How scary is Batman? How brutal could he be?	0
243209	355605	355606	Why do we love to eat?	Why do I love to eat?	0
243210	355607	355608	How can I access MLS listings in Massachusetts without having to sign up for MLS Pin?	Is it true that I have to give a rental agent an exclusive for them to list my property on the rental MLS?	0
243211	78670	11882	What will be the consequences of 500 and 1000 rupee notes banning?	How will the ban on Rs. 1000 and Rs. 500 notes impact Indian economy?	1
243212	355609	355610	What are alternate exchanges to Coinbase for Bitcoin trading?	Are swaps traded on exchange?	0
243213	355611	355612	What is your favorite reality TV show and what explains its popularity as a genre?	What’s your favorite reality show?	1
243214	161847	92826	What is a good question to ask Quora?	What is the best question one has ever come across in Quora?	1
243215	254877	20329	How do you find a true love?	How do I find true love?	1
243216	355613	24334	What hotel in Tamiya Hill-station would be safe for unmarried couples, without the harassment of police, hotel staff, and moral police?	What hotel in Darjeeling Hill-station would be safe for unmarried couples, without the harassment of police, hotel staff, and moral police?	0
243217	340153	355614	How do I upgrade the Android 4.4.2 (KitKat) to Android 6 (Marshmallow) with xposed installer?	How can I upgrade the android. 4.4.4 of my galaxy A5 to 5.5.0. 2?	0
243218	355615	355616	How do I apply hair spray to short hair?	Can pomade be applied to very short hair?	0
243219	355617	355618	How do employers look at a degree from University Of The People?	Does it look favorable to potential employers if you have a degree from University of Phoenix?	0
243220	227647	155433	How do high IQ people study?	How do people with high IQ think?	0
243221	202852	355619	What are some of the best site to buy concert tickets?	What are some of the best apps to buy concert tickets?	0
243222	87006	21754	What do you think is the most important thing in life?	Are money, time, and friends the most important things in life?	1
243223	355620	74037	Why does earth rotate on it's axis?	Why is Earth rotating?	0
243224	73272	106701	Who is better Donald Trump or Hillary Clinton?	Would Mr. Donald Trump be a better president than Hillary Clinton?	1
243225	137103	1327	Is the US presidential election rigged? Does voting even matter anymore?	Is the US election rigged?	1
243226	45456	26117	Can energy be borrowed from vacuum(to be returned immediately)? If this happens how do we know vacuum energy is real if virtual particles don't exist?	Is energy in vacuum real? How do we know that this energy that can be borrowed and returned immediately is real if virtual particles didn't exist?	1
243227	82551	355621	Lies and Lying: What is the easiest way to catch a liar?	How do I catch a pathetic liar?	1
243228	21592	30544	Can long distance relationships work out?	Is long distance relationship works?	1
243229	355622	355623	What is process of setting up adhesive chemical manufacturing unit and patent rules in India?	What I wiil be doing in aiesec after getting recruited?	0
243230	355624	355625	Did Ivanka Trump write her own speech?	What is do follow and no follow link in SEO?	0
243231	120201	64009	How do I recover my Gmail account password without a recovery email (forgot) or the security question when 2 step verification code is turned on?	How can I add a recovery phone number to my Gmail account without password to my account?	1
243232	355626	355627	Can a president become a member of another president's cabinet after his term is over?	Where does the President of the United States live after his term in office is over?	0
243233	22698	6729	What is the best way to avoid procrastination?	How do you avoid procrastination?	1
243234	46323	41255	Who is the Apple of Android devices?	How can I check if my Android phone is being tracked or tapped? If so, will encrypting the device help, hurt or make no difference after the fact?	0
243235	23347	355628	What are the biggest lessons you have learned in the corporate world?	What was your biggest mistake and what was the lesson you learned?	0
243236	355629	355630	What do the British think of their new Prime Minister Theresa May?	What do the Brits think of Theresa May as the new PM?	1
243237	87978	28942	What are some ways to lose belly fat and ONLY belly fat? (besides going vegan).	How do I get rid of belly fat and thigh fat?	1
243238	355631	355632	How come that I remember so good songs Which I used to hear in my youth ?	How should I answer questions in my semester exam so that I am able to score very good marks?	0
243239	23852	49432	What is BEST gaming laptops under 60000 in 2016?	What are the best gaming laptops under INR 60000?	1
243240	289612	131027	Why does AT&T want to buy Time Warner?	Why is AT&T buying Time Warner?	1
243241	15967	47392	How can I motivate myself to keep going instead of failures?	Self-Improvement: How can I motivate myself to work hard?	0
243242	355633	355634	Why are some people so suspicious?	Why are some people more suspicious than others?	0
243243	355635	355636	Could a person born in another country, adopted by US citizens become president?	What is a thing or service u want but can't find in internet or online?	0
243244	355637	355638	What is the most famous Indian photograph?	Who are some renowned/well-known professional photographers from India?	0
243245	355639	355640	Can I do shoulder and triceps workout on same day? What other combinations like this can I do?	Can gym just 3 days/week. Is it better to do full body workouts on those 3 days or should I split it into Chest-triceps, Back-biceps, Legs-shoulders?	0
243246	355641	355642	What is the function of CO2 in our bodies?	What is the function of adrenaline in our body?	0
243247	8553	59166	Can we control our feelings and emotions?	How can I control my emotions?	1
243248	300859	355643	What should i eat after workout for reducing body fat and gaining muscle ?	How soon should I eat after a workout?	0
243249	157500	75574	How did you start smoking cigarettes?	What is the best way to stop smoking cigarettes?	0
243250	355644	355645	How do I find a religious cult to join?	What are some good cults to join?	1
243251	355646	355647	Is J2EE learning is required to become a game developer / designer?	Is it practical to learn and develop Android games using only a Raspberry Pi-based PC?	0
243252	355648	2437	Are American women ever attracted to Asian men?	Do white women find Asian men attractive?	0
243253	355649	355650	How do I choose web host for my website?	How do I choose web hosting?	1
243254	38573	72102	How can I hack whatsapp?	Is it possible to hack WhatsApp?	1
243255	355651	355652	Can Indians move to South Africa?	When and why did Indians move to Africa?	0
243256	355653	355654	What are the main shoulder dumbbell exercises?	Is Facebook Live safe?	0
243257	355655	355656	Why were rabies treatment shots formerly given in a set of 20 or more and in the stomach?	There are bats on the roof outside my house. One time I slept with the window open before I realized they were there. Should I get rabies shot?	0
243258	355657	355658	What are the ways to measure the success of unsupervised learning algorithms?	How can we measure the plaster of a column?	0
243259	172138	329806	What open source software is popular for writing and self-publishing an ebook?	What software can I use to make an eBook?	1
243260	355659	355660	What are the advantages of a cash flow forecast?	How can you make 60 months cash flow forecast for your business?	0
243261	355661	355662	Who was the greatest diplomat of the 20th century?	Who was the greatest military leader of the 20th century?	0
243262	355663	355664	Can my boyfriend and I be tourists in Singapore (or even live there) despite the fact that we are both male?	Is Singapore LGBT-friendly?	0
243263	298736	355665	Why are friends not needed?	What would you do if your friends are not there for you when you need them?	0
243264	132304	355666	Who is good among Rahul Gandhi and Arvind Kejriwal as a politician?	Who is the better politician and why: Narendra Modi, Rahul Gandhi or Arvind Kejriwal?	0
243265	15669	299865	What are the best ways to study biology?	What is the best way to study for a biology test?	1
243266	355667	355668	What is an analytical mind?	What does analytics do?	0
243267	170566	355669	Do guys like shy girls?	Do boys like shy girls?	1
243268	355670	125133	How can I increase my IQ to 100?	How can I increase my IQ to 180?	0
243269	73282	32561	Which programming language is the best to learn first?	What language should I learn first?	1
243270	226594	355671	Between a Volvo A/C multi-axle semi sleeper and an A/C Sleeper, which is better in terms of providing a comfortable journey, in Indian roads?	While travelling overnight in a semi sleeper (multi axel volvo) bus which is the best seat where I won't feel bumps?	0
243271	21553	37382	What are some of the top paying career options after doing a B.Tech in mechanical engineering?	What are career opportunities in companies after an M.Tech in production engineering with a B.Tech in mechanical engineering?	1
243272	355672	355673	If I pick a random point on number line, what is the probability that picked point correspond to a rational number?	If you picked a number at random on the number line, would it have a greater chance of being rational or irrational?	0
243273	1194	55619	What is solution to Kashmir issue?	What is the possible solution for Kashmir issue?	1
243274	355674	355675	Are stereotypes actually true?	Which stereotypes are true?	0
243275	20903	12118	Are the UFO sightings real?	Are any UFO sightings real?	1
243276	355676	355677	When is a website considered a startup?	Where is panthera found?	0
243277	162282	18492	What are good sodas to mix with vodka?	What mixes well with peach vodka?	0
243278	84420	39879	What is the average lifespan of a ladybug?	What is the average lifespan of an insect?	0
243279	6898	106246	What was there before universe was born?	2. If the Universe was born at the Big Bang, what existed before then?	1
243280	9848	2025	Who is currently winning the presidential election?	Who will win the 2016 presidential election?	1
243281	355678	355679	What should I comment on Insta on a girl picture?	What is a good comment on Facebook for a pretty girl?	0
243282	355680	8809	Who would be better from indian perspective, Trump or Hillary?	Who would be better for India, Donald Trump or Hillary Clinton?	1
243283	355681	355682	If you were to describe our modern world in one sentence, what would the sentence be?	If you could say one sentence to anyone in the world, who would you say it to, and what would you say?	0
243284	355683	355684	Which of the English clubs have never been relegated from the top flight football?	Why don't clubs from top football leagues scout from India?	0
243285	355685	355686	What are the best ways to encourage our American-born Chinese (ABC) children to learn the Chinese language?	What is it like to be an ABC (aka American Born Chinese) living in China?	0
243286	355687	355688	Is William the Man in Black on Westworld?	"In Westworld, are William and ""The Man in Black"" the same person?"	1
243287	355689	355690	Where can I pay my Capital One credit card?	How much money do I have to make to apply for a Capital One credit card?	0
243288	355691	355692	Do you think United Nations has failed the world? Why are they unable to control Syria?	What happened to Thomas Edison's two children?	0
243289	355693	355694	Can a set be both a subset and a proper subset?	Divorcing property distribution in MA, real estates?	0
243290	355695	355696	Have any of the Catholic Church's doctrines ever been changed?	Why do some Catholics lobby to change the Church's doctrines instead of joining a Christian denomination where they've already been changed?	0
243291	355697	355698	How did Oracle make so much money?	How much does oracle cost?	0
243292	355699	355700	How do I increase my GPA?	What can I do to increase my GPA?	0
243293	355701	355702	Is it wise to upgrade to Windows 10 now?	Should I migrate from Windows 7 to Windows 10?	0
243294	355703	355704	What is the easiest time of day to go to the gym?	How many times should I go to the gym in a day?	0
243295	147110	355705	How long would it take for Vikings to sail from Scandinavia to England?	How long did a typical Viking raid last?	0
243296	17754	17010	What are some of the best websites to download movies?	What are the best sites to download movies from?	1
243297	355706	355707	What is good book for inorganic chemistry for IIT JEE?	What's the best inorganic chemistry theory book for IIT JEE?	1
243298	355708	220435	Can insomnia be the cause of loss of appetite? If so, how can this be treated?	Why do I have a loss of appetite and insomnia? How can I treat this?	0
243299	355709	355710	What are the applications of bearing in an automobile?	What is a thrust bearing?	0
243300	355711	43238	How do you calculate dividends?	How do you calculate preferred dividends?	0
243301	198007	105726	Why is there a brown discharge on the first menstrual period?	Why is the very first period a brown discharge?	1
243302	355712	355713	If most of the space in an atom is empty,  then why do things collide instead of just passing through each other?	Science: If everything is made of atoms, and atoms are mainly empty space, why don't things just pass through each other?	1
243303	289353	164072	Which are best consulting firms?	Who is the best IT consulting firms?	0
243304	355714	355715	Scariest ghost evidence to date with proof?	Where did I go wrong in this problem?	0
243305	30058	41015	Which is the best QuickBooks Tech Support Number in Texas?	What are the best intuit quickbooks support plans?	1
243306	233609	229009	How many air craft carriers does India have, and are they new or refurbished?	How many air craft carriers India presently have?	1
243307	29579	355716	What are some unusual aspects about politics and government in São Tomé and Príncipe?	What are some unusual aspects about politics and government in Luxembourg?	0
243308	166215	355717	U.S. Civil War: What would have happened had Robert E. Lee won at the Battle of Gettysburg?	Could the South have won the U.S. Civil War?	0
243309	184175	355718	What is the Japanese stand on the South China Sea dispute?	How to contradict China in the South China Sea dispute?	0
243310	18205	121868	What are the differences in life between Chinese and western cultures?	What are the differences between Chinese and western cultures?	1
243311	136996	19633	Who is the best politician India has ever seen?	Who is the best politician in India? Why?	1
243312	355719	355720	How do I quickly level up in Pokémon GO?	What do I need know about Pokémon GO to level up fast?	1
243313	355721	355722	How can I learn english grammar without getting bored?	How significant is the difference in handling between regular two-wheel steering and four-wheel steering?	0
243314	355723	277391	Why do eggs becaome solid on heating?	Food Science: Why do eggs turn from liquid to solid on heating?	1
243315	355724	355725	What is steps to have the green card?	What are the steps to apply for a green card for my foreign wife?	1
243316	20105	65436	How can I earn money online easily?	How can I earn money online, seriously?	1
243317	355726	355727	I am a B.Tech holder with ECE, 2016 Passout.Which is the best course that I should choose in Logistics like SCM, operations etc?	Is there an easy way to adapt Tesseract-OCR for business cards recognition?	0
243318	117418	355728	What things in your life made you cry?	What thing in your life has made you cry and cry and cry?	1
243319	355729	355730	Is it wrong to feel inspired by Hitler?	Starting package for a machanical students who has passed IIT?	0
243320	191033	355731	What features does the PS4 have that the Xbox One doesn't and vice versa?	What are some hardware and performance advantages the Xbox One has over the PlayStation 4, and vice versa?	0
243321	160888	355732	What's best way to reply when someone wishes you happy birthday?	Today is my birthday. Why does no one wish me a happy birthday?	0
243322	111087	355733	What are the best resources for learning French?	Which software is best to learn French?	0
243323	355734	355735	For higher studies, are there any specific requirements for the US Co-signer?	Could anyone please translate these sentences from Hindi to English?	0
243324	116208	355736	Is it too late to start learn programming again?	Is it too late to start learning programming at 30?	0
243325	355737	355738	Why do I have bad breath after always flossing and brushing?	I brush my teeth twice a day, floss, clean my tongue and gargle with Listerine, however I still have bad breath. Even the air that comes out of my nose smells bad. I went to the dentist but it didn't help. What do I do?	0
243326	249733	11435	Will international college students be negatively affected if Trump becomes president?	What will happen to international students in the US if Donald Trump becomes president?	1
243327	355739	355740	What was your wildest dream that you can never forget today?	How do I search for making new software company name?	0
243328	355741	355742	Greek Mythology: Who is the tragic hero of 'Antigone'?	In Greek mythology, is there a male version of Medusa?	0
243329	53396	8854	How do I delete a monsterindia.com account?	How do I delete account?	0
243330	3263	97301	How do I prepare for the 10th class ICSE board?	How should I study for ICSE class 10 board exams?	1
243331	290345	161734	What are some major events that happened in 1992?	What are some major events that occured in 2000?	0
243332	355743	30162	Which is better, Quora or reddit?	Technically speaking, what makes Quora better than Reddit?	0
243333	57778	161754	How can I motivate myself programming?	How can I motivate myself to study programming?	1
243334	75385	318423	What are common required and elective courses in music?	What are common required and elective courses in anthropology?	0
243335	355744	355745	Which are the most famous mobile wallets of UK?	I have 2+ years of experience with a IT MNC company. How do I change it or apply to other companies?	0
243336	233054	355746	What does the :( emoticon mean?	"What does the emoticon "":*)"" mean?"	0
243337	355747	158325	Does moto g 3rd gen support wireless charging with or without some accessories?	Which one among Moto G (3rd gen), Samsung Galaxy J5, and HTC Desire 626G+ should I buy? Why?	0
243338	355748	124638	What are the best reasoning questions asked in interviews?	What is the best question asked in an interview?	0
243339	63483	355749	How do I automate e commerce website like flipkart using selenium web driver, navigate the menu and then add an item to cart?	How can I request an item on any e-Commerce site like Amazon, Ebay or Flipkart?	0
243340	355750	355751	Which is the best engineering college for aerospace in India?	What are some of the best colleges in India for aerospace engineering?	1
243341	355752	355753	Should I tell the girl I'm friends with that I love her or not, I don't want to ruin our friendship?	I am friends with a girl, she is out of my league but I have now developed feelings for her, what should I do, I don't want to ruin our friendship?	0
243342	355754	355755	What is the best Finite Element Analysis software for heat transfer?	What would be the best methodology and software for finite element analysis of composite plates? Would NASTRAN be more effective than ANSYS?	0
243343	25820	28722	How can you lose weight quickly?	How can you lose weight really quick?	1
243344	355756	355757	Is there any difference between International Studies and International relations?	What is the difference between International relations and International studies?	1
243345	355758	355759	Why do I always feel a headache?	Why do we feel headache?	0
243346	76553	21377	Why should I vote for Hillary Clinton?	Why should I vote for Hillary Clinton and not Trump?	1
243347	355760	355761	How many B2 bombers does the U.S. have?	How many b2 bomber does US have?	1
243348	355762	355763	Before Trump, had the KKK ever endorsed a presidential candidate? Was George Wallace ever endorsed?	Why is Rand Paul endorsing Donald Trump?	0
243349	128927	355764	Which company gives the best car for your money, Audi, BMW, Mercedes Benz, or Jaguar?	Which car brand has the best reliability in the United States among Jaguar, BMW, Mercedes, and Audi.?	0
243350	355765	67464	Are there beach parties during the last to weeks of September in Goa?	I am going to Goa in September, how should I plan my trip to enjoy the Goa monsoon?	0
243351	355766	355767	Can I get an internship for remote sensing in Germany via DAAD?	What possible jobs can I get if I do an M.Tech or M.Sc in remote sensing?	0
243352	355768	4044	"Can I ""decompress"" my spine by supporting my weight with my hands on the base of a chair and letting my body hang?"	How can I lose weight quickly?	0
243353	55497	46329	How should we improve communication skills?	How do I improve my communication skills.?	1
243354	355769	355770	How can you teach yourself to take from others when you're the one who does all the giving but doesn't want to take?	Why don't we discuss tax and foreign policies more in Indian elections but are instead obsessed with socialist schemes?	0
243355	211917	355771	If humans are shot to death for the next 100,000 years, would they evolve to have bulletproof skin?	How did skin evolve?	0
243356	355772	355773	If both parents have type A blood, and one of the Grandparents has type AB, can the parents child have type AB?	If both parents have type A blood, but one of the Grandparents has type A, can the parents have a child with type AB?	0
