id	qid1	qid2	question1	question2	is_duplicate
311716	32509	46127	I am an Indian student going to the US in Fall 2016. How bad will it be for international students if Trump gets elected as President?	How would it affect Indian students studying/working in the US if Trump becomes the President?	1
311717	436037	436038	What materials are used in the making of fleece?	What materials are used to make fleece?	1
311718	436039	436040	What are the best swear words in Hindi?	If I use swear words in Hindi I am crass, but if I do it in English I have got class. Why?	0
311719	168740	31229	What's the meaning of life?	What is the meaning of this life?	1
311720	220071	101621	How do I get into ISRO?	How one can get a job in ISRO?	1
311721	172349	362600	Why is any number divided by infinity zero?	Is zero divided by zero (0/0) equal to zero, undefined or 1?	0
311722	436041	90593	How can I learn to dance without practicing?	What is the best way to learn to dance?	0
311723	436042	436043	Which department store has higher prices: Neiman Marcus or Harrods?	How will Neiman Marcus's reputation suffer?	0
311724	436044	436045	How does wine best describe moral philosophy as a whole?	Can wine be a word that describes philosophy as a whole? How?	1
311725	6391	8991	What is happiness?	How can I be happy?	0
311726	436046	436047	Which human foods are dangerous for cats?	What kind of human foods can you safely feed to your cat?	0
311727	436048	173160	What would happen if the Moon was blue?	What would happen if there was no Moon?	0
311728	436049	436050	Is HD motion actually faster than the old system?	As an American, what do you think about the semi-final result of the women's 4*100 relay race in Rio 2016 Olympics?	0
311729	436051	280520	Some people believe that global warming can cause longer, colder winters? How is that possible?	Can global warming lead to longer, colder winters? How?	1
311730	436052	436053	Is NSE certification exam difficult?	Does MAT consider GK scores while calculating the percentile?	0
311731	436054	436055	What are some of the most legendary prison escapes of all time?	Where do the prisoners go when they escape?	0
311732	436056	436057	Do dispersion forces exist in atoms of metals like Na, Mg, etc.?	Snooker: I know how to clear the colours on their spots - do I just need time to do it correctly?	0
311733	436058	40318	What are the attractions of Munnar?	What are the best places to visit in Munnar?	1
311734	285792	436059	Do you have to cook canned beans?	How can I store soaked beans?	0
311735	436060	436061	What are the most (and least) healthy raw fruits and vegetables to snack on?	Which are the least healthy vegetables to eat? Why?	0
311736	436062	436063	Why does a base64 encoded string always end with?	How does coding and encoding differ?	0
311737	17122	11510	Does long distance relationship work?	How can I maintain my long distance relationship to the best of my ability?	1
311738	126915	48191	What do you think about the rapist Donald Trump?	What do you think about Donald Trump in September?	1
311739	303	436064	How can I stop being afraid of working?	How can I stop being afraid to fight?	0
311740	51121	86995	What is best way to earn money without working hard?	What can I do to earn money lot without working hard?	1
311741	240125	238460	What are some of the best sex stories?	What are the most interesting sex stories?	1
311742	3073	18482	How did Donald Trump become president?	How did Donald trump won US presidential election 2016?	1
311743	436065	436066	Are there any specific facts explained by molecule-to-man evolution that cannot be adequately explained by creation theory?	Can you explain evolution in a simple way?	0
311744	436067	436068	What are some mind blowing ideas about world that may change the life?	What are the cons of a Jio sim?	0
311745	57517	245137	Why mens cheat?	Why do men like to cheat?	1
311746	91082	7224	What are the best books for preparation for CAT?	What are the section-wise best books to prepare for CAT?	1
311747	34751	122694	What are some of the best ways to break out my comfort zone?	How can I make myself to get out of my super comfort zone?	1
311748	436069	436070	Do humans have a homeworld in Star Wars?	Where do humans come from in the Star Wars universe?	1
311749	436071	436072	Pick-up artist bootcamps in india?	Is there any pick up artist bootcamp in India?	1
311750	268959	4445	How can I successfully get multiple streams of income?	Can a person realistically create multiple streams of income?	1
311751	436073	436074	How do I get started with stock market?	How do I get started in the stock market as a teen?	0
311752	436075	436076	Is studying LLM law at Hong Kong University going to help my legal career?	Is it worth studying LLM law at University of Hong Kong if I am obtaining my LLB degree from a British university?	0
311753	138873	52582	What are some outstanding indian short films?	What are some must-watch Indian short movies/films?	1
311754	14875	70019	Why should one vote for Donald Trump?	Why shouldn't I vote for Donald Trump?	0
311755	436077	436078	What are some unique, effective ways to discipline a child?	What are some good examples of the correct way to discipline a child?	1
311756	31275	436079	How popular are Bollywood stars in Pakistan and Bangladesh?	How popular are non-Muslim Bollywood actors in Pakistan?	0
311757	157727	174738	What is the square root of 100%?	What is the square root of the square root?	0
311758	8077	166134	Why is watching snooker different to playing snooker?	Why's watching snooker always different to playing it myself?	1
311759	436080	436081	Is it practically possible to get rid of H1B visas like Trump says?	Will it be tough to get H1B visa in near future?	0
311760	11885	436082	Which are the best places to visit in Estonia? Www.krazybutterfly.com	Which are the best places to visit in Norway? Www.krazybutterfly.com	0
311761	436083	436084	Do employees at Ashford Hospitality Trust have a good work-life balance? Does this differ across positions and departments?	Do employees at Ashford have a good work-life balance? Does this differ across positions and departments?	0
311762	436085	436086	What can you make of this poem?	What can you make out from this poem?	0
311763	436087	436088	How can I make up an English name?	How can I make an English name?	1
311764	436089	387956	How do I stop wanting something?	How do I stop wanting to do everything?	0
311765	197673	378819	How much of your personality can you change?	Can your personality change?	1
311766	94474	436090	Can you eat scoby raw?	Can you eat potatoes raw?	0
311767	15423	436091	Why does China as 3rd military power in the world just have 1 aircraft carrier?	What is the military advantage of having an aircraft carrier?	0
311768	436092	436093	I want to prepare for my technical interview rounds by J.P Morgan (Mumbai branch). What questions are asked by J.P Morgan for a 5 year experienced Java developer?	What perks and benefits J.P. Morgan Bangalore gives to Application Developer with 3 years of experience?	0
311769	132427	436094	Can you get gold from a bar of iron by using flux, a torch and a furnace (Parkes process)?	Does the quality (microstructures/cooling rate) of iron or steel castings differ using a holding furnace rather than pouring directly from melting furnace?	0
311770	436095	436096	What is the most polite way to say that 'u are dumb'?	What is the most polite way of saying 'No'?	0
311771	116398	436097	How did India get independence after Pakistan?	How did Pakistan get independence before India?	1
311772	436098	436099	How many 250w solar panel I need to charge 2 batteries of 12 Volts 180 Ah in 6 hours?	How many solar panels do I need to charge a 200 Ah battery in 5 hours?	0
311773	436100	436101	How many web agencies are there in the world?	How many web agencies are there in the world in 2014?	0
311774	360015	59179	How can I change my life completely in the next 30 days?	What can I do for 30 minutes a day that can change my life?	1
311775	436102	436103	What are the best books for learning mathematics?	What is the best book for mathematics?	1
311776	436104	436105	What is the best flavour of condom?	Which flavour of condom is best?	1
311777	64157	139308	Do many Mexican women like East Asian men (Korean, Japanese, Chinese)?	Are there lot of Mexican women that are attracted to East Asian men (Korean, Japanese, Chinese)?	1
311778	315726	436106	Is Pakistan a beautiful Country?	Is Pakistan a beautiful country to visit?	1
311779	436107	436108	What is the funniest English, Irish and Scottish man joke?	Do the Scottish and Irish like each other?	0
311780	48308	245871	What is the most important question of your life?	What was the most interesting question you have ever asked?	1
311781	436109	22185	How do I get rich online?	How could I get rich?	0
311782	436110	436111	Is an Airbnb property with 0 prior reviews trustworthy?	What percentage of Airbnb reviews are fake?	0
311783	436112	6319	What is the solution for kashmir?	What is the best political solution to the Kashmir conflict?	0
311784	24918	436113	What is the difference between Data Analytics, Data Analysis, Data Mining, Data Science, Machine Learning, and Big Data?	What is the basic difference between analytics, data science, big data & Hadoop?	0
311785	350172	436114	What is the oldest known joke?	What are some of the oldest recorded jokes?	1
311786	236986	436115	What are some songs with deep meanings?	What are some songs with a deep meaning?	0
311787	336329	85093	What is the best answer for tell me about yourself in an interview?	What is the best way to describe myself in an interview?	1
311788	436116	390717	How is the JMP of Robert Bosch India in terms of salaries?	Which company has a better work-life balance than Robert Bosch India?	0
311789	148396	436117	How was Osama Bin Laden killed?	Was Osama bin Laden a coward?	0
311790	436118	436119	How do I get closed captioning on Netflix?	How did Netflix get so popular?	0
311791	43396	347387	What are payday loans?	What are the best Payday loans to acquire?	1
311792	20611	436120	What are the strongest majors in terms of job prospects and what are the weakest majors at Park University?	What are the strongest majors in terms of job prospects and what are the weakest majors at Rice University?	0
311793	436121	436122	How tangible rewards undermine intrinsic motivation?	How do rewards affect intrinsic motivation?	0
311794	21970	16787	How do smart and successful people control their emotions?	How do I control emotions..Like Heart Breaking emotions?	1
311795	189281	83298	Why is the butterfly an important Apache tribe symbol? What does it mean?	Why is the dragonfly an important Apache tribe symbol? What does it mean?	0
311796	436123	436124	I have seen babies look like either their fathers or mothers. My question is, is there any possibility that a baby can get color from his/her father and height from mother? Any living examples?	A father with a young baby was fined for parking in a spot for mothers with babies. Is that sexist? Should fathers be given the same consideration?	0
311797	436125	28792	Could I be pregnant?	What are the common first signs of pregnancy? How can I tell if I'm pregnant? What are the symptoms?	0
311798	47020	2374	Why do people write questions on Quora that could be answered with a quick web search?	Why do so may people ask questions on Quora that can easily be found by a simple Google searh?	1
311799	269040	145284	What is the biggest mistake ever made by politicians?	What is the biggest mindfuck ever?	0
311800	436126	436127	How is MGM medical college for mbbs?	How is MBBS at MGM Medical College, Navi Mumbai?	1
311801	436128	436129	Why isn't water vapour from power stations utilised?	How much rest is required in between sets and exercise?	0
311802	170722	436130	Why weren't the Christians and the Muslims granted a National Revelation like the Jews?	Why does it look like Christians worship a cross/image of Jesus; and seem like Muslims worship the Kaaba?	0
311803	101672	103976	Which are the best places to buy computer parts and accessories in Bangalore?	Which are the best places to buy computer parts and accessories in Chennai?	0
311804	436131	436132	"What is the meaning of "" first name "" and "" last name ""?"	I have a vary bad first name and last name. how can I make is short?	0
311805	436133	436134	What are some examples of lampoons?	What are some examples of lampoon?	1
311806	187148	436135	What is the difference between centripetal acceleration and centrifugal force?	What is the difference between centripetal and centrifugal?	0
311807	436136	436137	How do you survive in life?	How do I survive life?	0
311808	86042	251517	What are some arguments against utilitarianism?	What are the main drawbacks of utilitarianism?	1
311809	436138	436139	What is the development language used by SAP HANA?	2.What is the development language used by SAP HANA?	1
311810	436140	436141	Whether there is uniform education policy in india?	What are the educational policies for Dalits and OBCs in India?	0
311811	436142	436143	What it means to be 熱氣 in medical term?	In medical terms, what does 'EMG' mean?	0
311812	93339	276236	What are the best books to read to learn about human psychology?	Which Is the best book on psychology?	1
311813	436144	436145	What are some free placement consultancy that provide manpower to employers in chennai?	What are some free placement consultancy that provide manpower to employers in Pune?	0
311814	436146	436147	What are the best books to give as gifts for the holidays in 2016?	What are some great books to give as gifts this upcoming holiday season?	0
311815	436148	436149	I have been hearing someone whispering. I can't figuire out where it is coming from. Could this just be a problem with my hearing or something more?	Why do I hear whispering around me wherever I go?	0
311816	436150	436151	How do pharmaceuticals companies come up with such strange brand names?	How do the pharmacy companies come up with the brand names for their medicines?	1
311817	436152	436153	How do I score distinction and above in the final year of engineering?	How do I explain my final year project during the campus interview?	0
311818	436154	436155	How do I restore an iBook G4?	How do you reset an iBook G4?	0
311819	436156	436157	If you did not get into a top college as an undergrad how did you deal with the possibility that you might end up behind your friends who did?	What would be the best college for me? I am interested in ending up in politics, but want to start out with a well earning science. I go to Trinity School at River Ridge so getting in might be easier?	0
311820	436158	436159	Should I continue or give up?	What are arguments for and against women being free with their bodies?	0
311821	436160	436161	What is the difference between Balinese Hinduism and Hinduism as it is practiced in India?	Is Balinese Hinduism a form of Majapahit Hinduism?	0
311822	73152	11012	how do I delete questions from quora?	How can I delete my own question from Quora?	1
311823	436162	436163	What are the origins of the most common last names in America?	What are the most common Last names in America?	0
311824	436164	436165	Would you use a food service where home chefs would offer their dish of the day and then deliver it straight to your home?	Would you use a food service where home chefs would offer their dish of the day and deliver it to a pick up and drop off point or with home delivery?	1
311825	273109	436166	How should I fill my first name and last name in a form, when I have my surname as first name in India?	My complete name is Ali Zergham. It doesn't include family name. What would I write in first, middle and last name filling a form?	0
311826	436167	436168	Is it bad for me or my dog to give him too much affection?	I love my dog too much and thus give her kisses constantly. How can I learn to love her less?	0
311827	436169	40405	Where can I download engineering drawing with worked examples by M.A Parker and F. Pickup for free? I have to buy it everywhere I check	Where can I get online PDF or EPUB versions of books?	0
311828	436170	320474	Who invented pen?	Who invented the pen? How was it invented?	1
311829	436171	436172	Evolutionary Psychology: Why do humans make art?	What is art?	0
311830	214232	436173	Will we ever have true equality?	I have come across the fact that Australian dollar if torn out will have the value equal to its proportion I.e. $100 torn equally have value of $50 each. Is this true?	0
311831	436174	436175	How can I download an MP3 from YouTube onto an MP3 player?	How can download YouTube playlist as mp3?	1
311832	436176	436177	How does obesity cause hypertension?	How is obesity related to hypertension?	1
311833	436178	223961	How does one downgrade from Windows 10 (genuine) to Windows 8.1?	How do I downgrade to Windows 7/8/8.1 from Windows 10 OS version?	0
311834	171378	436179	How do you locate the power button on a Samsung television?	How do I control a Samsung TV from a different geographical location?	0
311835	436180	436181	After how many days can an employee transfer from one location to another in Infosys?	What should I do after getting terminated from Infosys?	0
311836	436182	436183	Should I be a data engineer or software engineer?	How can I increase my pay as a software engineer from mid 100K to over 200K a year, without working at a top tech company (Google, Facebook, and etc)?	0
311837	21056	306645	Can I get pregnant the day before ovulation? Why or why not?	Can you get pregnant a day after ovulation?	0
311838	436184	436185	"In the Discovery Channel programme ""Wheeler Dealers"", why does Edd China always wear a long sleeve shirt underneath his t-Shirts?"	What TV show was this on discovery channel?	0
311839	436186	170639	What if Tinder was a city?	What is Tinder?	0
311840	436187	323913	How can the atomic number of an atom be calculated?	What is the atomic number of an atom determined by?	1
311841	436188	436189	Is it bad to wear weaker contact lenses than you need?	Is it okay if I wear my colored contact lenses for 14 hours but for one day only...? I wear it once or twice a month?	0
311842	291112	57981	What is the minimum penis size a 'size queen' prefers?	What penis size do women prefer?	1
311843	436190	436191	When will Prezi use HTML5 instead of Flash?	How do I let my Firefox browser use HTML5 for YouTube videos by default instead of Flash?	0
311844	157832	436192	Which is a suitable inpatient drug and alcohol rehab center in Bay County FL?	Which is a good inpatient drug and alcohol rehab center in Seminole County FL?	0
311845	192145	150197	What color pants matches with a gray shirt?	What color shirt will match with brown pants?	0
311846	436193	436194	Sanding out grooves in hardwood floor?	Would I be denied by colleges that have offered me admission because I failed a course in the first semester of my Senior year?	0
311847	436195	436196	Which one is a better deal in terms of curriculum, internships and placements, George Mason MSCS or Cincinncati ME in CS?	Which one is better in terms of costs, chances of selection and future job prospects for MS in CS: UMass-Amherst or University of Wisconsin-Madison?	0
311848	436197	436198	What is a cost of one Indian railway coach sleeper non AC?	What is the fare of booking whole Non AC Sleeper class coach in Indian Railways?	1
311849	436199	77014	How do people who are born deaf learn the language we usually talk?	How do deaf people learn how to talk?	1
311850	436200	436201	What if Air Force One was heading towards the World Trade Center with the president on board? Would they shoot it down?	What would happen if Air Force One was hijacked, with the President and Vice President onboard?	1
311851	218744	436202	What is aplastic anaemia?	Survivors: Do you ever think about what you would do, should you relapse, or be diagnosed with another disease? What would your reaction would be? I've had two bone marrow transplants for Leukemia and Aplastic Anemia, and I'm 16 and 12 years post-transplant , and I wonder sometimes... how many times would I endure this? To what extent would I endure this? Do you have a contingency plan, should another diagnosis occur?	0
311852	436203	436204	What is the best training evaluation model ?	What is the best athletic training?	0
311853	436205	436206	What are things which I need to know about C++ to prepare for GSoC?	Why did Lord Krishna make Arjuna the instrument to kill the wrongdoers and bring peace, when he could have done that himself?	0
311854	436207	436208	Do any girls find man boobs attractive?	Do girls like man boobs?	1
311855	311624	472	Why do we have to care about what people think?	Why do we care for others' opinion and about what others think about us?	1
311856	142296	104865	How have people become millionaires before 25?	How do I become a millionaire before the age of 30 in the UK?	1
311857	163633	436209	Do air purifiers remove PM2.5?	What is PM2.5 particulate matter that is polluting New Delhi?	0
311858	20336	436210	Should I include other skills in my resume when applying to development job?	Should I include other skills in my resume when applying to a development job?	1
311859	436211	436212	Molestation in bus, metro stories?	What are some yearly stand up comedy competitions in India?	0
311860	8287	436213	What is the difference between an air cooler and an air conditioner?	Which is the best air conditioner to buy?	0
311861	436214	436215	Is it wise decision to tell about my ADHD to my parents?	Is it okay to tell my parents about my ADHD?	1
311862	436216	436217	Is it possible to achieve 0% body fat for humans?	Is it possible for me to lose body fat percentage and gain some muscle without going to the gym?	0
311863	436218	436219	T20 international is the best compared to all other formats of cricket?	What is the best format of cricket?	0
311864	436220	436221	What kind of license do I need in order to start up a small business in Kolkata, West Bengal?	Who pays for the flurry of activities involved in forming the new Trump government?	0
311865	436222	436223	How do amoebas and Euglena differ?	How are amoebas and Euglena similar?	0
311866	436224	436225	When driving a manual, what is good behaviour mechanically, fully depressing the clutch when changing gears or just enough to enable gear changes?	"What will happen if a person suddenly shifts from ""Drive"" to ""Reverse"" or ""Park"" while driving at a fast speed?"	0
311867	436226	436227	What is the difference between undergraduate, graduate and postgraduate? Are they all different between the U.S. and India?	What is the difference between graduation in mathematics in India and in the USA?	0
311868	436228	82241	What are some best Indian novels?	What are some good Indian novels?	1
311869	20431	144140	Can I get pregnant a week after my cycle?	Is it possible to get pregnant before your regular period?	1
311870	170777	436229	what is time travel?	What exactly is time travelling?	1
311871	34357	436230	What is the difference between speaking and singing?	"What is the difference between ""speak to"" and ""speak with""?"	0
311872	436231	436232	Should i tell a girl I love her even though she's elder to me?	Should I tell a girl that I love her even though she told me she has no time for love?	0
311873	4352	39651	How can we earn money online in india?	How can I earn money online from home only?	1
311874	287207	348544	How do I get my own personal email for free?	How do I get my own personal email?	1
311875	54381	109507	How do I get over a breakup?	What are the steps one goes through getting over a breakup?	1
311876	436233	41380	Should I learn algorithms before learning programming?	Is Java easy to learn?	0
311877	46123	436234	What is the difference between a hotel and a motel?	What is the difference between hotel and residence?	0
311878	436235	436236	How do I prepare for the GATE Metallurgy 2018?	How do I prepare for gate metallurgy 2018?	1
311879	15547	11264	What are the best simple ways to loose weight?	What are the best was to lose weight?	1
311880	10838	7202	If humans evolved from apes, why are there still apes?	If we evolved from apes then why are there still apes around today?	1
311881	219198	403434	What are the best undergraduate engineering schools in the U.S.?	What are the top engineering universities in the U.S.?	1
311882	436237	436238	Can jio offer free calls for every handset or is it only for 4G enabled ones?	Why do my wrist hurt when I move it?	0
311883	436239	436240	Are there any international institutions that verify carbon offsets like green-e in the US?	Do the feeling of love change?	0
311884	436241	436242	I don't support gay marriage. Does that make me a bad person?	Human Behavior: Does it make me a bad person if I don't agree with gay marriage, or am I entitled to my own opinion?	1
311885	207735	5044	How can I stop temptation to watch porn?	How do I stop addiction to porn?	1
311886	19200	5358	How can I slowly lose weight?	What's the best plan to lose weight?	1
311887	262023	18160	How is the word 'countermand' used in a sentence?	How is the word 'gape' used in a sentence?	0
311888	54682	127818	What is the best Royal Enfield bike?	Which Royal Enfield bike is best?	1
311889	436243	112526	How do you unlock a Sony Ericsson Xperia?	How do you reset a Sony Ericsson Xperia?	0
311890	153278	106875	If given a chance, what superpower would you like to possess?	What would your superpower be and why?	1
311891	436244	142267	Why do people die from cancer?	How many people die from cancer each year?	0
311892	5398	22901	How do you celebrate Diwali?	How will you celebrate diwali?	1
311893	436245	436246	All mobile numbers are ten digits. What is the reason for this?	Why do most mobile numbers start with 9? Is there any reason behind this?	0
311894	436247	436248	Which is the polymorph of Esomeprazole Magnesium used to make Nexium?	Which polymorph of Esomeprazole Magnesium is used to make Nexium??	1
