id	qid1	qid2	question1	question2	is_duplicate
182172	278901	278902	If investment bankers are so rich then why doesn't everybody become one?	How did investment bankers and traders become so strongly associated with douchebag and misogyny stereotypes?	0
182173	89640	191259	How do I gain access to a person's instagram photos, if their account is private?	How do I make my Instagram account private?	0
182174	213345	278084	How do I know if I'm in a emotionally abusive relationship?	What are resources I can use to know if I am emotionally abusive in a relationship?	1
182175	278903	278904	How do I bake a cake?	How do I bake an oreo cake?	0
182176	278905	278906	What are big brothers good for?	What's it like to be a big brother?	0
182177	278907	278908	What is the difference between a company with one founder and one co-founder and a company with two co-founders?	How do you choose who should be the CEO when you have a co-founder?	0
182178	98780	278909	What does bright yellow vomit mean?	What does it mean if you're yellow around your mouth?	0
182179	278910	278911	Who was luckiest person ever?	Who is the luckiest person in the world?	1
182180	4038	7801	What are the best ways to earn money from home?	What are the easiest ways to earn money online?	1
182181	278912	15315	How is the movie suicide squad?	What is your review of Suicide Squad?	1
182182	93738	104456	PC gaming vs console gaming: What are the advantages of each platform over the other? Which is better?	Which is cheaper and better gaming: PC or console (PS4 and Xbox One)?	1
182183	278913	29229	If today is the last day of your life, would you want to do what you were about to do today? What are the 2 things you want to do that makes you happy?	If today were the last day of your life, would you want to do what you are about to do today?	0
182184	276448	261630	How can I unblock myself on WhatsApp if my close one has blocked me?	How can one hide their profile pic from a specific person without blocking him in WhatsApp?	0
182185	225303	114219	How can I move on from my ex?	How do I move on?	0
182186	60187	16705	What does it mean when answers on Quora collapse?	Why are some answers collapsed?	1
182187	9171	47818	What is the best way to reduce weight fast?	What is the best way to burn fat fast?	1
182188	278914	278915	What individuals and events in history are a source of pride for Egypt?	What individuals and events in history are a source of pride for Malaysia?	0
182189	278916	278917	What is your aim?	What do we aim for as a society?	0
182190	278918	200678	What is OPD in hospitals? What is its importance?	How do Mental Hospitals work?	0
182191	104787	88227	Is it possible for someone to have violet blue eyes? Why or why not?	Is it possible to be born with naturally purple eyes?	1
182192	278919	274893	What is the difference between an extrovert and an introvert?	What is the difference between being an introvert and being an extrovert?	1
182193	278920	278921	What is Brownstone Equation Editor 5 and what are its applications?	Why are my equation structures missing in the MS Word equation editor?	0
182194	278922	278923	"What does the Spanish phrase ""eso si que es"" mean in English? How is it used in conversation?"	"What does the Spanish phrase ""asi es"" mean? When is this phrased used?"	0
182195	80440	93519	What should I do to improve my questions on Quora?	What is the best way to improve my questions on Quora?	1
182196	66626	272073	How can I stop masturbating daily?	How can I stop masturbations?	1
182197	278924	278925	What is it like to manage a fast food restaurant?	What is the best fast food restaurant in Toronto?	0
182198	278926	278927	N acetylglucosaminidase is helpful?	Whose DLP program is better, made easy's or gate forum's? I want to prepare for both PSU n gate?	0
182199	258354	37617	How does Donald Trump's win affects Indian students preparing for graduate studies in US?	What would be the scenario for Indian students after Donald trump becomes the President of US?	1
182200	278928	278929	What advice can you give for a first day of work?	What should I do on first day of work?	1
182201	69584	3737	What is feedpost.com?	What is Kaufmich.com?	0
182202	91300	105645	What is the best way to prepare for gate 2016 (EE) in 3 months?	Can I crack gate CS 2017 in 3 months?	1
182203	190557	278930	What are the best ways to promote a Website?	What is the best free way to promote a book?	0
182204	278931	278697	What is the corporate culture like at Atmel? How is the culture different than other companies?	What is the corporate culture like at Oracle? How is the culture different than other companies?	0
182205	163690	278932	How can I get a patent for my work and theories?	How do I get Patent Rights for my concept?	1
182206	17978	278933	What are some things new employees should know going into their first day at AT&T?	What are some things new employees should know going into their first day at Google?	0
182207	278934	278935	Is love just an attraction?	What is love and what is attraction?	0
182208	278936	278937	"What rhythm is used in the Mr. Vegas / DMX song ''Top Shotter (Here Comes the Boom)""?"	"Which hindi movie song had ""Here comes the hotstepper"" in the back ground? The video had models dancing and walking in at the beginning as well."	0
182209	25712	278938	How do I contact a verified hacker?	How can I contact a genuine hacker?	1
182210	38688	36629	What are some things new employees should know going into their first day at Seaboard?	What are some things new employees should know going into their first day at Stamps.com?	0
182211	278939	278940	What universities does Graham recruit new grads from? What majors are they looking for?	What universities does IGATE recruit new grads from? What majors are they looking for?	0
182212	32413	65009	How can I join Indian Air Force after be in mechanical engineering?	How do I join IAF short service commission after completing my engineering?	1
182213	546	25023	What is the best way to get traffic on your website?	What are the best way to increase website traffic organically?	1
182214	278941	278942	Is graphology a reliable method or a pseudoscience?	Is graphology a science? Is it possible to understand the past and character of a person using graphology?	0
182215	55476	278943	What are some ways to get rid of ants?	How do I get rid of ants from my house?	1
182216	278944	278945	How do gang wars start?	What remains unreleased in the streaming media era from the Beatles as of October 2016?	0
182217	20537	59852	How GST will affect Indian economy after it is enacted?	Why is GST amendment a gamechanger for Indian Economy?	1
182218	155709	96236	What material should I use to pass the 050-730 exam?	What material should I use to pass the 650-157 exam?	0
182219	278946	278947	What are the properties of thermodynamics?	What is the property of thermodynamics?	1
182220	278948	278949	I lived in IL, FL, and CO this year, where should I file my taxes?	Is it possible to file your taxes from previous years?	0
182221	56680	62269	Which is the best way to kill yourself?	What is the easiest, painless way to die instantly?	0
182222	8372	278950	I forgot my MI Account username and password. How to delete that account in Xiaomi Redmi Note 3?	Should I buy Xiaomi Redmi Note 3 from Amazon or MI store?	0
182223	278951	278952	What is best mapping solutions in general chemistry.?	Am I late for MBA. I am 26 year old with 3 year experience in engineering. I haven't start preparing for CAT anyone pls give me some insight on this?	0
182224	84039	4187	How do i stop being an extrovert?	How can I stop myself from being extrovert?	1
182225	278953	278954	Electrical engineer make just as much or more as software developer?	Could a mechanical engineer make just as much or more as software developer?	0
182226	127258	278955	What are the three daily practices to stay young?	How do I stay consistent in things I do daily?	0
182227	278956	278957	What are some places or attractions to visit in Pattaya and Bangkok this weekend?	When did the MBA start to become useless?	0
182228	93198	69522	Do we know if there is life on other planets?	What are some signs of life on other planets?	1
182229	278958	278959	What are the 6 business strategies?	What is business strategy?	0
182230	278960	278961	What are the products of combustion reaction?	What is the product of the reaction of cumene with KMno4? How do I predict the product?	0
182231	278962	278963	Are black people under-represented on Quora?	Why are African/Black Americans under-represented on Quora?	1
182232	237522	278964	Is there any way to know how many people downloaded your file on Dropbox?	I know of many ways to boost Instagram followers. How can I share this with people?	0
182233	278965	278966	Why don't older women like younger guys?	What do older guys hate about younger women?	0
182234	278967	278968	What is the proper way to brew Japanese green tea?	What is the best way to brew Hedley's tea?	0
182235	278969	278970	Do game shows make money? How?	How do game shows (Jeopardy, Wheel of Fortune. etc) get their prize money?	0
182236	104096	278971	"Which book is better, Sedgewick's ""Algorithms"" or ""CLRS""? Why?"	I'm a visual learner, and I find it hard to read books. How can I start learning from Introduction to Algorithms by CLRS?	0
182237	278972	278973	How can I turn my idea into a fundable business?	How do I turn my idea into a successful company?	0
182238	278974	278975	How did Rock Hudson die?	When did Rock Hudson die?	0
182239	278976	259864	What are the top blogs?	What are some interesting blogs?	1
182240	278977	278978	How are the classes divided in chitkara university. I mean on what basis the students of one class selected (computer science)?	While applying for Master's in Science programmes in Germany, what does a first class degree mean? First class on the degree certificate or first class as the aggregate of the entire 8 semesters in Engineering?	0
182241	13555	45410	How do you improve your writing skills?	How should I improve my writing skill for blogging?	1
182242	278979	171539	How do you deal with stress?	How do I overcome stress?	1
182243	278980	47627	Which countries have good job prospects for Indians, who are planning to pursue an MBA abroad?	Which countries have easy job prospects for Indians doing their MBA abroad?	1
182244	278981	278982	Can I buy 2 walkie talkie with return led signal showing they’re constantly in range?for baby monitoring thru walls so motorola&co,not “300m” philipps	I'm trying to pick up my neighbor's Wi-Fi. (They're fine with that.) How do I boost the signal so I can pick it up?	0
182245	108229	278983	Does science have any evidence that parallel universes exist?	Do parallel universe exists? Any evidence in support of your answer will be appreciated?	1
182246	278984	278985	What is the best way to learn linear algebra for physics?	How can I learn linear algebra intuitively?	0
182247	278986	80253	Is there any good torrent website to download anime (dubbed)?	What is the best site to download books?	0
182248	203948	278987	Can a baby die from crying?	How can I stop a baby from crying?	0
182249	110579	278988	How do I play in share market in India?	How does the shares market work in India?	0
182250	187615	156533	What are the chances of Donald Trump Winning the 2016 election?	Is there any chance that Donald Trump will win this election?	1
182251	278989	278990	Why do some people prefer the .45 over the 9mm?	What is the lightest, flattest 9mm pistol available today?	0
182252	278991	278992	How do you change the font color in document.writeln (JavaScript)?	How do I change font color on Javascript?	0
182253	278993	278994	When do I ask my crush out?	When should I ask my crush out?	0
182254	124693	24227	Do you think that Trump and Congress will retroactively end gay marriages?	Can Trump repeal laws that allow gay marriages?	1
182255	24571	91408	What's the feeling of having sex for the first time?	What it is like to have sex first time?	1
182256	278995	278996	Will changing logic board on iPhone 6 remove activation lock on ios7?	How can I change my Mac address in an iPhone 6?	0
182257	188180	278997	How strong is NATO?	How powerful is NATO?	1
182258	260727	278998	How do I learn about basic photography?	How can I learn basics of photography?	1
182259	278999	279000	How do I calculate 30 in odd numbers?	What is the addition of 3 odd numbers?	0
182260	13817	26186	What are the safety precautions on handling shotguns proposed by the NRA in Massachisetts?	What are the safety precautions on handling shotguns proposed by the NRA in North Dakota?	1
182261	279001	279002	Can a DU sol student apply for IELTS exams to get admission in foreign universities for post graduation ?	I want to do an MSc in applied geophysics from foreign universities. Which are the best? How can I get an admission?	0
182262	18524	14469	What are the good career option after b.tech in electrical engineering from an NIT?	What is the best career option for an electrical engineer who is interested in coding?	1
182263	279003	279004	What will happen to my whatsapp account and chat group if I uninstall it and then install it after few months?	I uninstalled WhatsApp from my iPhone. Does that mean my WhatsApp account is deleted?	0
182264	26092	26072	Why are people on this site so obsessed with IQ?	Why are people on Quora obsessed with their IQ?	1
182265	22902	173287	Can Hillary Clinton pardon herself if she is elected as President?	If Hillary Clinton wins the Presidency, can she pardon herself for previous wrong doings?	1
182266	110979	279005	What are histone proteins?	How do histones control gene expression?	0
182267	242527	61419	Who are the most intelligent people to follow on Quora?	Whom should one follow on Quora? And why?	1
182268	279006	279007	"Is there any similarity between a high level programming language (e.g. Python, Java) and a natural language (e.g. French)? I heard that ""Reading well-written Python programs is just like reading articles""."	Are you a bad programmer if you look at documentation often instead of having the libraries memorized?	0
182269	168282	279008	What is the importance of money in one's life? Can money solve most, if not all, problems in life?	Why important money in our life?	0
182270	279009	279010	How good is Qualys Inc in Pune? Are they planning to expand?	What are some tips on making it through the job interview process at Qualys?	0
182271	279011	279012	How can I download PES 2017 for PC?	From where do I download PES 2015 for the PC?	0
182272	41273	106615	Do ISPs want to block websites?	Would ISPs block website builders if there wasn't net neutrality?	1
182273	279013	30129	I will go for the GATE 2016 (EE) preparation. What is a good study plan that is within six months?	How do I prepare for the GATE in 3–6 months? What are the recommended study strategies ? [ EC, CS, EE, ME, AE, Civil, CHE, Phy, Math]	0
182274	279014	279015	What is the maximum sentence for subway art?	What is the meaning of the sentence, 'its art and not science'?	0
182275	272580	279016	What are nomads? How do they survive in the desert?	How do you survive in a desert?	0
182276	27883	279017	Is CS ETS Major Field Test useful to apply an MSCS for a non-CS undergraduate?	How is campho-phenique used in kids?	0
182277	1178	185894	What is the meaning of life? Whats our purpose on Earth?	What's our purpose of life in this world?	1
182278	41685	20514	What are the best places to visit on a 3-day trip in and around Kerala?	What are the best 10 places to visit in Kerala including any falls?	1
182279	279018	279019	When will KBC 9 begin?	When will KBC season 8 begin?	0
182280	39323	34134	What universities does Resource Capital recruit new grads from? What majors are they looking for?	What universities does Callidus Capital recruit new grads from? What majors are they looking for?	0
182281	279020	279021	Once I've installed Windows 10, if I have to factory reset my laptop, will it revert to Windows 8.1 or stay on Windows 10?	I got a BCD error when I was reverting back to Windows 8.1 from my Windows 10 tab. What are some solutions?	0
182282	279022	279023	What is the total fees of CA?	What is the total semester fees for M.Tech at IIEST, Shibpur?	0
182283	117668	77023	How can I earn more money with little money I have now?	What is the best way to to make money?	0
182284	279024	45109	What should one know about the Indian education system?	What can we do to improve the Indian education system?	0
182285	279025	279026	I scored 173 in NMAT last year. What are the chances of getting selected at NMIMS in Mumbai this year?	What is a good nmat score for Mumbai campus?	0
182286	279027	115676	What constitutes true beauty?	What is the beauty?	1
182287	22136	13250	Friction from my iPhone is hurting my hands - what can I do to scroll and to reduce friction?	Although light beam bouncing between two plates inside a clock is often used to explain time dilation, how can other practical cases be explained?	0
182288	59058	3925	Is it necessary to do coaching for GATE?	Is it necessary to go for coaching for GATE preparation?	1
182289	23790	102284	What are some ways to build your blog audience?	What are the keys to growing your blog audience?	1
182290	38489	10813	What would be the best day of your life?	What was the best day of your life, and what happened?	1
182291	279028	56168	How do you retrieve photos from iCloud?	How do I restore pictures from iCloud?	1
182292	237258	276550	Why is India not getting Olympic medals?	Why does India fail to make a mark in the Olympic games?	1
182293	279029	279030	Do English and Hindi count as two languages for getting admission into Insead?	A is three times more efficient than B. if they complete a work in 30 days, then find the times required by each to complete the work individually.?	0
182294	279031	279032	What's the coolest thing you have made with a 3D printer?	What is the most interesting thing you have 3D printed?	1
182295	279033	279034	What is your favorite Taylor Swift song?	What are your favorite Taylor Swift songs?	0
182296	279035	279036	What are the things that you tried to explain to someone but you couldn't?	Let's say you are an atheist and you convert to Christianity.  If you want to convince your girlfriend or boyfriend to do the same and give it a chance to try and see if things could work between you both, but with God, what would you do to make that person try and give it a chance?	0
182297	279037	279038	What is the best book to practice yoga?	What are the best books about yoga?	0
182298	73498	279039	Why did you convert to islam?	Why did Madhavikutty convert to Islam?	0
182299	279040	279041	Do Meghalaya girls date South Indians?	Why don't Indian girls use dating sites?	0
182300	279042	279043	Did Shakespeare date men or women?	Are Korean women open to dating foreign men?	0
182301	98925	134515	Why so many people hate Justin Bieber?	Do people still hate Justin Bieber?	0
182302	279044	279045	What are good and cheap gifts to bring to India from America that will be appreciated by Indians?	What would be a good gift to bring back from Sri Lanka?	0
182303	98975	24334	What hotel in Dharamshala Hill-station would be safe for unmarried couples, without the harassment of police, hotel staff, and moral police?	What hotel in Darjeeling Hill-station would be safe for unmarried couples, without the harassment of police, hotel staff, and moral police?	0
182304	279046	279047	How does a computer or a calculator find the cube root, square root etc. of a number?	How do computers compute the square root of something?	0
182305	279048	279049	Who is Adele?	Is Adele okay?	0
182306	279050	227504	What type of benefits do you have if you join the army in US compared to the benefits of joining the army in Uruguay?	What type of benefits do you have if you join the army in US compared to the benefits of joining the army in Brazil?	0
182307	3676	220431	How do you restore a Dell Inspiron 1525 to the factory settings?	How do you restore a Dell Inspiron B130 to the factory settings?	1
182308	279051	279052	Do you think Australia is still a migrant friendly country?	Is Australia still a migrant friendly country?	1
182309	279053	3704	How many questions are there?	How many questions have been asked on Quora?	0
182310	81592	279054	How can I determine that a positive integer has exactly one zero in its binary representation?	How can you prove or disprove that I can find every n digit sequence in the decimal representation of the number pi?	0
182311	279055	279056	Differentiate a^x up to 4 terms?	Are the top philosophers generally more intelligent than the top mathematicians/physicists?	0
182312	279057	279058	What should I do if my parents kick me out and I have no money?	Would parents really 'kick me out' of the house as they say?	0
182313	279059	279060	How should I prepare for aipmt 2017?	How do I prepare for AIPMT?	0
182314	234590	141703	Which is the best available laptop for 50,000Rs?	Which is the best laptop in range of 40000 to 50000?	1
182315	1214	41576	Can World War 3 ever take place?	Is a third World War imminent?	1
182316	279061	279062	Is 8 an irrational number?	What are irrational numbers in layman’s terms?	0
182317	279063	216031	What are the best ways for doing preparation for UGC-NET in computer science?	How do I start preparation for UGC NET for Computer Science?	1
182318	132470	44676	What are unique or lesser known facts about PM Narendra Modi?	What are some unknown things about Narendra Modi?	1
182319	184720	6672	Who is better Donald Trump or Hillary Clinton and why?	Who will be a better president Donald Trump or Hillary Clinton?	1
182320	275991	279064	What is the best place to work in Mumbai?	What are good places in Mumbai?	0
182321	55075	51796	Why do my dank questions keep being marked as need improvement?	Why do all of my questions get marked as needing improvement?	1
182322	279065	279066	What does I don't love you but I care about you mean?	I don't think I love anyone. Is it possible to care about people deeply but not love them?	0
182323	279067	279068	Which kdrama should I have to watch?	Why can I watch kdrama?	0
182324	279069	279070	Why is a coat hanger used to symbolize the pro-choice movement?	Why did the Nazis use Roman symbols?	0
182325	279071	279072	What European country has the nicest people and a low crime rate?	Which european country has the nicest people?	0
182326	25764	279073	How do I find a group on WhatsApp?	Can a WhatsApp group be called a portal?	0
182327	279074	279075	What is the difference between tags and topics?	What is the difference between topics, tags and categories?	1
182328	279076	214473	What should everyone know about the Kashmir conflict?	What is the Kashmir conflict?	1
182329	279077	279078	Is it Israel's goal to have an ethnically pure state?	Why can't Israel and Palestine agree on a two state solution?	0
182330	279079	279080	How does water change from solid to liquid and gas?	How does iodine change from solid to liquid and gas?	0
182331	279081	82109	How artificial is modern pornography than the vintage pornography?	Which type of porn do ladies enjoy watching?	0
182332	104398	275507	How can I make a billion dollars?	How do I make a billion dollars in a year?	0
182333	279082	141445	How do I ask a girl out at work?	How do I ask a girl out?	0
182334	279083	279084	I am 16 and my height is 5.4 feet. I would like to grow up to 6 feet. What should I do?	"I'm 16 and my height is 5'5"" ft. What should I do to increase my height?"	0
182335	279085	279086	Why don't adults feel the need to play with toys, or be entertained all the time, like children? What caused the human brain to mature?	Why does vaginal sexual intercourse feel different with different women? Are all vaginas the same or, if not, what causes the penis to feel different?	0
182336	39223	27405	What is a good diet plan for a commuter that wants to gain weight?	What daily diet should I follow to gain weight?	1
182337	279087	279088	How are the numbers of Social Security determined?	How are Social Security numbers assigned?	1
182338	45590	155136	How does the HP OfficeJet 4620 Airprint compare to the HP LaserJet Enterprise 700 Printer M712dn?	How does the HP OfficeJet 4620 Airprint compare to the HP LaserJet Enterprise M605dh?	0
182339	279089	51663	On what basis is a question on Quora marked as needs editing to be improved?	"What should I do if Quora marks my question as ""Needs Improvement""?"	0
182340	279090	279091	Why do men always tend to cheat on their girlfriends?	Why do men cheat?	0
182341	279092	279093	Do puppies pretend to love you in order to mooch off your food supply?	￼How do I make my puppy to eat the food I prepare?	0
182342	279094	199672	What is the difference between crow and raven?	What is the exact difference between the raven and crow?	1
182343	279095	279096	What do you answer when asked if you watch porn?	Why is the US President considered the most powerful man on Earth if he can't do much without Congress' approval?	0
182344	279097	49831	How can I get backlinks from other website to my own website?	How I create backlinks for my website?	0
182345	279098	279099	What is meant by adhesion?	What is meant by force of adhesion?	0
182346	120597	279100	Is there any difference between Pepsi and Coca-Cola?	What‘s the difference between Pepsi and Coca-Cola?	1
182347	279101	279102	Why should I prefer cricket to other games?	Has cricket lead to the destruction of other games in india?	0
182348	279103	279104	What are some initiatives the Modi government should initiate?	What are the major development initiatives Modi's government is working on?	0
182349	279105	143644	Is this sentence gramatically correct?	"Is ""I've a"" gramatically correct?"	0
182350	279106	279107	What is meaning of FPS Brick in Civil Engineering?	What are the most innovative, unique and crazy civil engineering projects ever done?	0
