id	qid1	qid2	question1	question2	is_duplicate
200708	302542	302543	Who are absolutdata's competitors?	can i upgrade my laptop with 7200RPM HDD? my laptop model is HP starwars edition 2016 with i5–6200u	0
200709	302544	70008	What is the difference between XML and XAML?	What are the differences between HTML5 and (pre-5) HTML?	0
200710	302545	302546	What are the differences between mobile marketing and mobile advertising?	What's the difference between marketing and advertising?	0
200711	302547	302548	Disclose your undisclosed income! Is this scheme by Indian government really working?	How about feedback about New York State Center?	0
200712	302549	302550	Why is coding so hard?	Why coding is so hard but really fun?	1
200713	302551	302552	Why doesn't HIV spread via mosquitoes or other biting arthropods?	Does HIV spread through saliva or urine?	0
200714	302553	302554	How do you make YouTube videos autoplay?	Which types of videos should I make for YouTube?	0
200715	302555	302556	When I create gif how can use in whatspp?	How do I fix error 0x0000605 while windows 10 installation?	0
200716	116927	3780	How do I learn stock market investing?	What are the ways to learn about stock market?	1
200717	302557	302558	Does medical insurance in the universities of Canada, the USA, and Europe cover medical conditions like hemophilia and thaelessimia for foreign graduate (PhD) students? What is the medical insurance cost to get these diseases covered?	In the US do medical malpractice insurance costs amount to very much? And in other nations?	0
200718	263155	302559	What will be the chromosome number in humans during different phases of mitosis and meiosis?	Why does mitosis contain a single set of chromosomes?	0
200719	192077	177891	How can a girl become pregnant?	How does a woman become pregnant?	1
200720	302560	302561	Is it a good idea to learn Android system calls?	What's a good idea of an Android app for a mini project?	0
200721	302562	302563	Where is the best place to do an internship for mechanical engineering students in Bangalore?	Are there places in Bangalore for a mechanical internship for 15 days?	0
200722	28461	302564	I am 20-year-old male, my height is 6 feet, and my weight is 48kg. How can I increase my weight?	I am a 19-year-old guy. My height is 177 cm, but my weight is only 57 kg. How can I increase my weight?	0
200723	302565	302566	When she becomes so horny from foreplay and oral sex, should I continue till she orgasms, or should I start intercourse?	I am interested in a girl and she knows. We chat but when I ask her to go out she avoids responding. What should I take from this?	0
200724	302567	302568	What is the smell of rain called?	Why is the smell of rains so beautiful?	1
200725	37131	302569	How can you find the molar mass of deuterium?	How do you find the molar mass of ionic compounds?	0
200726	302570	302571	Will a person with undiagnosed borderline personality disorder ever see clearly without treatment?	Do you think there will ever be an effective treatment for stretch marks?	0
200727	270976	173312	Is there any public evidence that proves aliens do exist?	Do aliens really exist? If so, what are the evidence(s) supporting such claim?	1
200728	302572	302573	If Indian gals are real feminist why don't they publicly discard their inconvenient and suffocating bras just like some of their Western counterparts?	Why don't Indian people sell their used gold jewellery instead of just storing it and not monetising it?	0
200729	302574	302575	What is ordinary RC moment resisting frame?	How moments are created in framed structure?	0
200730	302576	302577	How did dodgeball start?	Was Dodgeball's implementation in PHP a cause for its neglect and lack of integration at Google?	0
200731	302578	302579	What is a barista at Starbucks?	How do I get a job as a barista at Starbucks?	0
200732	302580	302581	What is Dell's minimum service charge for laptop repair in Delhi/NCR?	Is it ok to use Dell laptops while charging?	0
200733	302582	302583	How do I make small talk?	How can I make small talk?	1
200734	302584	302585	Which is the most popular martial art in the USA nowadays?	What is the most aggressive and dangerous martial art? Where can I learn it?	0
200735	302586	302587	How can a foreigner become a Teacher in America?	How can a foreigner become a teacher in the USA?	1
200736	148364	292983	Why is sugar bad for you?	Why is sugar bad for us?	1
200737	90157	302588	What seems to be the contrast of behaviors (good or bad) between a liberal and a conservative when discussing their political views?	It seems as if we have no cultural identity, and we have political views that contrast too much to do anything. Should the U.S. split up?	0
200738	302589	302590	Who invented (or discovered) sine waves?	Is sound a sine wave or cosine wave?	0
200739	260795	114767	How did religion affect the lives of the ancient Egyptians?	What did ancient Egyptians believe about the afterlife?	0
200740	14772	35498	Why do people ask questions on Quora instead of Googling it?	Do people post questions in Quora just so that they can skip searching in Google for a few minutes?	1
200741	14376	49652	Can you see who views your Instagram?	How do I view photos someone else has liked on Instagram?	0
200742	206394	17902	Can you hide friends from you Facebook friend list?	How do I hide my friend list on Facebook?	1
200743	302591	196739	Which is the best book on C++ for beginners?	Which is the best book to start C and C++ as a beginner?	0
200744	302592	302593	How do start a YouTube channel for education?	How do l start a YouTube channel?	0
200745	250182	302594	How can I make new friends in Mumbai?	How do I make new friends in Mumbai?	1
200746	25265	156524	How can I hack Facebook?	Is there any method to hack Facebook account?	0
200747	302595	104398	How do you make a billion dollars?	How can I make a billion dollars?	1
200748	19769	183694	What never fails to make you smile?	What never fails to make you happy?	1
200749	302596	302597	Can we bombard the whole asteroid belt into Mars and increase its mass to equal Earth and make it livable?	How did pirates named their ships?	0
200750	302598	63447	Does energy drinks contain bull semen?	Do some women really like swallowing semen? Why or why not?	0
200751	92222	190677	What is to know about money?	What should one know about spending money?	1
200752	302599	302600	What is a complementary prior?	What is an example of a uniform prior?	0
200753	302601	301254	What traffic laws in Antigua and Barbuda are particularly hard for foreign drivers to get used to?	What if jio is not registered within 48 hours?	0
200754	29655	53547	What is the best way to download an entire playlist from YouTube on Windows?	Is there any way to download YouTube playlists?	1
200755	302602	302603	How do I prepare for xat?	How do I prepare for XAT 2017?	1
200756	302604	302605	Are there men who have never watched porn?	Who watches more porn, men or women?	0
200757	292726	302606	What are the worst commutes in Houston? What are some tips for making them better?	What are the worst commutes in Atlanta? What are some tips for making them better?	0
200758	302607	302608	What books & articles covering the topic of Fintech and investment trends in Fintech would you recommend to cover the theoretical part of a thesis?	What is happening in the brain with dyslexia? Specifically about assuming words and anticipating words that aren't there.	0
200759	287248	61504	What are some practical benefits of discovery of the Higgs Boson?	What are the practical applications of the discovery of Higgs Boson? Besides the probable unified theory of physics?	1
200760	302609	302610	What do you think of Mamata Banerjee TMC's governance in West Bengal?	Despite the sorry state of Bengal, why do people of West Bengal continue to re-elect Mamata Banerjee?	0
200761	127478	90711	Is it possible to be happy all the time? If yes, then how?	What are some ways to be happy all the time?	1
200762	71468	129067	When will Trump administration begin deportation of illegal immigrants?	Will Donald Trump deport illegal immigrants?	1
200763	302611	45032	Who is president of america?	Who is the president of America?	1
200764	302612	283686	What is von Neumann Architecture? How can you relate von Neumann architecture to an actual computer?	What is von Neumann architecture?	1
200765	302613	199265	How do I ignore crushes?	What should I do if my crush keeps ignoring me?	0
200766	228772	50923	How does stock market works?	Can anyone say me how does stock market works and who decide the price?	1
200767	302614	101376	What's the difference between shares and stocks?	What is the difference between stock and share?	1
200768	302615	25039	What are the best manhua to read?	What are the best books of all time?	0
200769	184349	103490	My front-facing camera on my iPhone 5s is blurry, foggy and pixelated. How can I fix this?	How can I flip front camera photos horizontally in the iPhone 6?	0
200770	302616	296471	Is higher education in norway is free for international students?	Is it really true that public universities in Norway have free education for any citizen of any country?	1
200771	302617	302618	"Where did the term ""Drumpf"" come from and what does it mean? Why do people write Drumpf instead of Trump?"	"Why don't we call Trump by his first name ""Donald"" rather than mocking his ancestral last name of Drumpf?"	0
200772	101679	110827	How is Uruguay as a country?	Is Uruguay a third world country?	0
200773	302619	58083	Who are the best people to be followed on Quora?	Who are some of the smart people to follow on Quora?	1
200774	302620	302621	What is the Reynolds number?	How was Reynolds number developed?	0
200775	302622	302623	How can I know and list good Java based companies in Indore?	Can I get a list of product based companies around Hyderabad?	0
200776	302624	302625	"Why are there almost no 30"" gas wall ovens?"	Is some gas smell normal when you turn on a gas oven?	0
200777	302626	30076	Is there any way to use LTE (or root other than using sunshine ) on an unlocked verizon htc one m8 running on lollipop 5.0.1? .	How can I downgrade Lollipop to KitKat without any root techniques?	0
200778	302627	302628	Why are synchronous machines more widely used in energy generation rather than induction machines?	Why are induction generators not used in power plants for power generation and only synchronous generators are used?	1
200779	50923	223875	Can anyone say me how does stock market works and who decide the price?	How does the stock market work?	1
200780	302629	302630	What is the best way to print scientific papers?	What is the best way to read scientific papers?	0
200781	31247	302631	Have you seen an alien craft?	Have anybody seen UFO or something like that which proves alien may exist?	1
200782	302632	213230	"Why is British Columbia named ""Columbia?"""	Why is the Canadian province of British Columbia so named?	1
200783	302633	302634	How much does an Ola driver earn in Chandigarh?	How much ola drivers earn?	0
200784	302635	302636	Which actor has the damn cute eyes and smile?	Why are Pakistani actors so cute?	0
200785	302637	302638	What is the difference between ex and former or they are the same?	"What is the difference between ""ex"" and ""former""?"	0
200786	302639	302640	Do women ever regret letting go of someone who truly loved them?	Do men ever regret letting go of someone who truly loved them?	0
200787	302641	302642	Visiting places in banalore?	Where can I find a good and inexpensive orthodontist in Mumbai?	0
200788	302643	302644	Which are the top 5 medical colleges in Tamil Nadu?	What is the procedure to get into a private medical college in Tamil Nadu?	0
200789	232768	227	What do you think of the food of China?	What do you think China food?	1
200790	302645	302646	What is the difference between Windows, android, and iOS operating systems?	Which operating System is best in terms of performance and security? Is it Windows or iOS?	0
200791	302647	302648	What do you think of this video ?	What do you think of this video?	0
200792	302649	302650	What's the difference between adverbial phrase and adverb phrase?	Can we use noun phrases as adverbial?	0
200793	302651	302652	As a computer science student How can I find job opportunity in a compuny like Google?	Where we give power supply to AC Motors?	0
200794	302653	302654	Where is teach mashal art?	How do prometrium and clomid differ from each other?	0
200795	302655	302656	How much would it cost to have Apple replace the display on a 15″ MacBook Pro with a Retina display?	How do I install Windows XP on my new MacBook Pro retina display?	0
200796	302657	302658	How do I calculate the bank balance after x years if I deposit x amount every month in a fixed deposit account?	Which are some of the best mild anti dandruff shampoos available in Indian markets?	0
200797	302659	302660	Do you think Modi ji takes half of our news feed in social media after he became prime minister?	"Does ""the four terrible years of war"" require commas?"	0
200798	13447	302661	Is Greece part of the European Union?	What are the points of conflict between the European Union & Greece?	0
200799	302662	302663	What are the things to consider before getting back with an ex?	What are some things to consider before getting back together with an ex?	1
200800	302664	302665	"What is the meaning of ""To God be the glory""?"	It is the glory of God to conceal a thing. What is the glory of kings?	0
200801	302666	302667	Why are iron and aluminum used to make power cables?	Why a mixture of iron and aluminium in making power cables?	1
200802	82358	11496	What is the weirdest question you've seen (In your opinion) on Quora?	What are some of the weirdest questions you have seen on Quora?	1
200803	302668	302669	Why is cow's milk yellow?	How does one tell soy milk from cow milk in a latte?	0
200804	302670	270026	How do you know it’s time to let someone go?	When is the right time to let someone go?	1
200805	178487	97606	What is the funniest book you have ever read?	What are the funniest books that you have read?	1
200806	302671	302672	What is good and what is bad about USA? What do you think?	What do people both from within and from other countries think about Americans (good and bad)?	0
200807	302673	302674	Should I integrate/implement Haskell/Lisp or some other language to my social network (PHP) for artificial intelligence?	If 2 opposing extremes of a language scale were Lisp and Haskell what would the sensible median be?	0
200808	302675	302676	Why do people hate the European conquest of America, but not the Mongolian or Muslim conquest of Europe?	Why is the Muslim conquest of Mecca considered to be peaceful even though a few people were not granted amnesty and branded for execution?	0
200809	302677	302678	Should learning musical instruments in schools be made compulsory?	Should sports for children based on their interests be made mandatory in school just like the other subjects they learn?	0
200810	302679	302680	Is Kolkata the worst city to work in India, due to the tremendous organizational politics and amateurish attitude of its employees?	What is UOLO?	0
200811	302681	302682	What are the minimum requirements for a startup to be eligible to sponsor an H1B visa?	Are Singaporeans eligible to apply for both visa schemes viz H1B and H1B1?	0
200812	302683	302684	How do I ask my girlfriend whether she's a virgin or not?	How do I tell my girlfriend I'm a virgin?	0
200813	302685	302686	Have you ever wished you were a cartoon character?	What do Tunisians think about the Mayotte Island?	0
200814	33580	37169	How can I quickly get rid of belly fat as a male?	How get can I rid of belly fat?	1
200815	91792	64795	What are some mind-blowing Camping tools that most people don't know about?	What are some mind-blowing camping adventure gadgets that exist that most people don't know about?	1
200816	302687	302688	Out of Chitkara University punjab and Manipal university which one is better, my 2nd year has just started,want to change my college?	Can I change my university with backlogs after the 2nd year?	0
200817	302689	302690	Is Topicanative a scam?	Does Topicanative asi exist?	1
200818	302691	302692	What is inside the Kaaba?	Is it acceptable for a non-Muslim to enter a mosque?	0
200819	44964	45994	Why should people have sex?	Why have sex?	1
200820	302693	302694	M using Xiaomi Redmi note 3 & whenever I take pictures with the flash the pictures comes out yello what should I do plz help me?	How do I expose BJP's social media scam?	0
200821	302695	23314	How do I get more followers and upvotes on Quora?	What can I do to assertively make my Quora question interesting enough to answer?	0
200822	302696	157649	Why did everyone hate the Jews?	Why does everyone hate the Jews?	1
200823	302697	302698	What is Parkinson's disease and is there any cure for it?	How can Parkinson's disease be cured using yoga?	0
200824	54314	159903	How do you remove a Gmail account from the app on Android?	How do I remove my Gmail account from all of my Android devices?	0
200825	194770	35944	What hotel in Gwalior would be safe for unmarried couples, without the harassment of police, hotel staff, and moral police?	What hotel in Jaipur would be safe for unmarried couples, without the harassment of police, hotel staff, and moral police?	0
200826	28118	76512	How I cab use Jio sim in 3G device?	How can I use Jio sim in 3G Micromax A102?	1
200827	302699	302700	How do I find an engine for an SAE Supra?	Why don't students taking part in SAE Supra India use winged cars?	0
200828	302701	302702	What is the psychology of conspiracy theories?	What is the psychology behind conspiracy theorists?	1
200829	483	302703	There are 8 balls. 7 of them weigh the same. 1 of them has a different weight, (you don't know if it's heavier or lighter). How do you find the odd ball with 2 weighs?	You have nine balls of the same size. Eight of them weigh the same, and one of them weighs slightly more or less. How can you find the ball that is different by using a balance and only three weightings?	0
200830	2947	80032	Is it stealing if you steal from a thief?	Is it stealing if you steal from another thief?	1
200831	302704	302705	What does it cost to start a microbrewery in india?	How much does it cost to start a pub in india?	0
200832	21061	121115	DId something exist before the Big Bang?	What existed in the space before Big Bang?	1
200833	114804	2712	What is the best way to reduce weight?	What are the best way of loose the weight?	1
200834	302706	302707	How was Austin Mahone discovered? How did he became so famous?	How could I spend a day with Austin Mahone?	0
200835	56076	302708	Is there real IQ testing online?	Are online IQ tests different from the real thing in schools or other places?	0
200836	13006	691	Which is the best mobile below 15000?	What is the best phone to buy below 15k?	1
200837	3477	134638	What made Tata group chairman Cyrus Mistry to quit?	Why was Cyrus Mistry removed as the Chairman of Tata Sons?	1
200838	302709	302710	What's the equation of the line through (3,7) and parallel to x=7; perpendicular to y=-2?	How do I find equations for the two tangent lines through the origin that are tangent to the curve [math]x^{2} - 4x + y^{2} + 3 = 0[/math]?	0
200839	302711	302712	Will Facebook be at the 2015 Grace Hopper Celebration of Women in Computing?	Will Pinterest be at the 2015 Grace Hopper Celebration of Women in Computing?	0
200840	211561	101072	What's the best memory in your life?	What is the best memory in your life and with whom?	1
200841	302713	79210	"Root checker app shows ""root access is not properly installed in this device"" What should I do to fix it ?"	"What does it mean to ""root"" a device?"	0
200842	242667	36295	What are good books to read on history and philosophy?	What are the best philosophy books?	0
200843	302714	218201	What is the difference between i5 6th gen and i5 7th gen?	Which is better I3 6th gen or i5 5th gen and why?	0
200844	9418	53675	Which is the best budget laptop under 50,000 INR?	What is the best laptop around 50k?	1
200845	56903	22373	Why do you think Indian government has demolished RS 500 and RS 1000 notes?	Why the banning of 500 and 1000 rupees notes?	1
200846	302715	302716	Which actor has played a single character for the longest time?	Let x and y be independent random variable with distribution N(0.1). show that x+y and x-y are independent N(0,2) distributed random variable?	0
200847	302717	101877	What are some psychological hacks that you can do daily?	What are some Psychology hacks?	0
200848	75211	399	Will real estate and prices of essential goods come down in India after the ban of 500 and 1000 notes?	What are the effects of demonitization of 500 and 1000 rupees notes on real estate sector?	1
200849	302718	282876	Why is your job the best job ever?	What is the best job ever?	0
200850	302719	302720	What is the strangest thing that happened to you as a foreigner in China?	What was the strangest thing that happened to you as a foreigner in china?	1
200851	23468	24712	How do I prepare cost accounting on a CA final?	What is the best way to prepare for CA final ISCA?	1
200852	302721	302722	What is the typical starting salary for someone with an undergraduate degree in ministry?	What is the typical starting salary for someone with an undergraduate degree in anthropology?	0
200853	302723	251805	Top preschools in Hyderabad?	Which is the most non-corrupt job in India?	0
200854	302724	302725	What do I need to know if I've been diagnosed with prostate cancer?	What is it like to have prostate cancer?	0
200855	302726	302727	I'm building a social music streaming service. Where do I get music licensing rights?	How do I get the licenses to stream copyrighted music on my streaming service?	1
200856	302728	302729	What are the best group discussion topic?	What are some best tricky group discussion topics?	0
200857	302730	302731	The sound quality of The Man in the High Castle seems to make the dialogue muffled and hard to understand. Is Anyone else having this problem?	Why is there no mention of Italy in The Man in the High Castle TV series? And for that matter, no real mention of Britain or France?	0
200858	302732	302733	What's the Chinese word for nutritional ketosis?	Can a man already in Ketosys mode remain obsess?	0
200859	302734	42265	What advice would you give a 19-year-old going through an existential crisis?	What are some interesting life hacks?	0
200860	302735	302736	Freelancer.com: Ho do I make proposals?	What special training or skills should I have to join the army?	0
200861	302737	301714	How can I be important in the society?	How important acceptance from the society is?	0
200862	302738	302739	Why can't anyone see electricity?	Why can't you see electricity?	1
200863	302740	302741	What can I do to pass the 650-302 exam?	How can I pass the 650-155 exam?	0
200864	302742	302743	How was the cotton gin invented?	Where was the cotton gin invented?	0
200865	33981	113742	What is most embarrassing moment of your life?	What is the most embarrassed you have ever felt in your life?	1
200866	54106	302744	When will episode 278 of fairy tail come out?	What is your review of Fairy Tail (anime)?	0
200867	302745	302746	Is penile dysasthesia curable?	Is bladder infection curable?	0
200868	302747	178195	If you could change one thing in your life from the past 5 years, what would it be? Why?	If you were allowed to change anything in your past, what would it be?	0
200869	27137	72948	How can I impress a teenage girl?	What should I do to impress a girl?	1
200870	275791	302748	Do IUCN release the red data book annually?	"Do you find the last 40 chapters of ""The Dream of the Red Chamber"" in any way inferior to the rest of the book?"	0
200871	302749	128361	Why doesn't India impose a economic blockade on Pakistan and force them into giving up nuclear warheads?	Why is India insecure and scared of Pakistan's economic development projects & trying hard to sabotage them?	0
200872	302750	302751	Is lemon juice good for the hair?	Is drinking hot lemon daily juice daily bad for you?	0
200873	302752	302753	Is witchcraft actually real and possible to do and how do I find spells that work?	I found out my boyfriend had romantic / sexual talks online (and possibly actual encounters) about a year ago. He said it was just to have fun and never had a real encounter with anyone, and stopped it long ago. I forgave him, but wonder if he's doing it again. How can I get over this?	0
200874	302754	302755	Can anyone give an idea related to project work on microprocessors?	What are some of the examples/projects/ideas to try related to high performance networking?	0
200875	302756	302757	Which are the best hip hop lyrics?	Who is the best hip hop rapper in the world?	0
200876	302758	302759	What is the step to creat Android app?	What are the steps to develop an Android app?	1
200877	302760	302761	When eating at the dining table, should one hold the bowl up to eat or lean down to reach the food?	What are the foods one should stop eating?	0
200878	168051	149678	How could we humans achieve world peace?	How would you achieve world peace?	1
200879	302762	302763	The demand of natural law according to Paul tillich?	What are some games with awesome graphics currently (October 2016)?	0
200880	302764	302765	Why did Google choose Java as the programming language of Android and not Python or something else?	Why did Google choose Java as the primary application development environment for Android?	1
200881	302766	302767	What are the no. of application form applied in BSNL je 2016?	How do I prepare for 1st year MBBS?	0
200882	29978	49515	Which are the most romantic movies?	Which are the best Hollywood romantic movies?	1
200883	146547	39819	Why does my question keep getting marked as needing improvement?	Why is my question repeatedly marked as needing improvement?	1
200884	302768	302769	What will be the output of the following program ?	What will be the output of the following program?	0
